"1407.0625","Johan Kallen","Johan Kallen","The spectral problem of the ABJ Fermi gas","31 pages",,,,"hep-th","http://arxiv.org/licenses/nonexclusive-distrib/1.0/","  The partition function on the three-sphere of ABJ theory can be rewritten
into a partition function of a non-interacting Fermi gas, with an accompanying
one-particle Hamiltonian. We study the spectral problem defined by this
Hamiltonian. We determine the exact WKB quantization condition, which involves
quantities from refined topological string theory, and test it successfully
against numerical calculations of the spectrum.
","[{""version"":""v1"",""created"":""Wed, 2 Jul 2014 16:01:53 GMT""}]","2014-07-03"
"1407.0626","Jessica McDonald","Jessica McDonald","A list analog of Vizing's Theorem for simple graphs with triangles but
  no other odd cycles","This paper has been withdrawn by the author",,,,"math.CO","http://arxiv.org/licenses/nonexclusive-distrib/1.0/","  This paper has been withdrawn by the author. Peterson and Woodall previously
proved that the list-edge-colouring conjecture holds for graphs without odd
cycles of length 5 or longer.
  D. Peterson and D. R. Woodall, Edge-choosability in line-perfect multigraphs,
Discrete Mathematics 202 (1999), 191-199.
  D. Peterson and D. R. Woodall, Erratum to ""Edge-choosability in line-perfect
multigraphs"", Discrete Mathematics 260 (2003), 323-326.
","[{""version"":""v1"",""created"":""Wed, 2 Jul 2014 16:03:26 GMT""},{""version"":""v2"",""created"":""Fri, 7 Aug 2015 20:52:44 GMT""}]","2015-08-11"
"1407.0627","Peter Scherpelz","Peter Scherpelz, Adam Ran\c{c}on, Yan He, K. Levin","Unified treatment of Fermi pockets and arcs scenarios for the cuprates:
  Sum rule consistent response functions of the pseudogap","5 pages, 1 figure, with included 4-page Supplementary Material","Phys. Rev. B 90, 060506(R) (2014)","10.1103/PhysRevB.90.060506",,"cond-mat.supr-con","http://arxiv.org/licenses/nonexclusive-distrib/1.0/","  Essential to understanding the cuprate pseudogap phase is a study of the
charge (and spin) response functions, which we address here via a consistent
approach to the Fermi arcs and the Fermi pockets scenario of Yang, Rice and
Zhang (YRZ). The two schemes are demonstrated to be formally similar, and to
share a common physics platform; we use this consolidation to address the
inclusion of vertex corrections which have been omitted in YRZ applications. We
show vertex corrections can be easily implemented in a fashion analytically
consistent with sum rules and that they yield important contributions to most
observables. A study of the charge ordering susceptibility of the YRZ scenario
makes their simple physics evident: they represent the inclusion of charged
bosonic, spin singlet degrees of freedom, and are found to lead to a double
peak structure.
","[{""version"":""v1"",""created"":""Wed, 2 Jul 2014 16:11:57 GMT""}]","2014-09-01"
"1407.0628","Stefano Leucci","Davide Bil\`o Luciano Gual\`a and Stefano Leucci and Guido Proietti","Exact and approximate algorithms for movement problems on (special
  classes of) graphs","26 pages, 3 figures",,,,"cs.DS cs.CC","http://arxiv.org/licenses/nonexclusive-distrib/1.0/","  When a large collection of objects (e.g., robots, sensors, etc.) has to be
deployed in a given environment, it is often required to plan a coordinated
motion of the objects from their initial position to a final configuration
enjoying some global property. In such a scenario, the problem of minimizing
some function of the distance travelled, and therefore energy consumption, is
of vital importance. In this paper we study several motion planning problems
that arise when the objects must be moved on a graph, in order to reach certain
goals which are of interest for several network applications. Among the others,
these goals include broadcasting messages and forming connected or
interference-free networks. We study these problems with the aim of minimizing
a number of natural measures such as the average/overall distance travelled,
the maximum distance travelled, or the number of objects that need to be moved.
To this respect, we provide several approximability and inapproximability
results, most of which are tight.
","[{""version"":""v1"",""created"":""Wed, 2 Jul 2014 16:12:45 GMT""}]","2014-07-03"
"1407.0629","Volodymyr Vovchenko","V.Yu. Vovchenko, D.V. Anchishkin, M.I. Gorenstein","System-size and energy dependence of particle momentum spectra: The
  UrQMD analysis of p+p and Pb+Pb collisions","21 pages, 13 figures","Phys. Rev. C 90, 024916 (2014)","10.1103/PhysRevC.90.024916",,"nucl-th hep-ph nucl-ex","http://arxiv.org/licenses/nonexclusive-distrib/1.0/","  The UrQMD transport model is used to study a system-size and energy
dependence of the pion production in high energy collisions. New data of the
NA61/SHINE Collaboration on spectra of negatively charged pions in
proton-proton interactions at SPS energies are considered. These results are
compared with the corresponding data of the NA49 Collaboration in central Pb+Pb
collisions at the same collision energies per nucleon. Mean pion multiplicity
per participant nucleon, inverse slope parameter of the transverse momentum
spectra, and width of rapidity distribution are investigated. A role of isospin
effects is discussed. We find that the UrQMD model predicts a non-monotonous
behavior of mean transverse mass with collision energy for positively charged
pions at the mid-rapidity in inelastic proton-proton interactions. This will be
checked soon experimentally by NA61/SHINE Collaboration.
","[{""version"":""v1"",""created"":""Wed, 2 Jul 2014 16:14:01 GMT""},{""version"":""v2"",""created"":""Thu, 14 Aug 2014 17:56:12 GMT""}]","2014-09-03"
"1407.0630","Batu G\""uneysu","Francesco Bei, Batu G\""uneysu, J\""orn M\""uller","Scattering theory of the Hodge-Laplacian under a conformal perturbation","A new section with several examples has been added, including the
  calculation of absolutely continuous k-form spectra on a large class of
  warped product metrics",,,,"math.DG math-ph math.FA math.MP","http://arxiv.org/licenses/nonexclusive-distrib/1.0/","  Let $g$ and $\tilde{g}$ be Riemannian metrics on a noncompact manifold $M$,
which are conformally equivalent. We show that under a very mild \emph{first
order} control on the conformal factor, the wave operators corresponding to the
Hodge-Laplacians $\Delta_g$ and $\Delta_{\tilde{g}}$ acting on differential
forms exist and are complete. We apply this result to Riemannian manifolds with
a bounded geometry and more specifically, to warped product Riemannian
manifolds with a bounded geometry. Finally, we combine our results with some
explicit calculations by Antoci to determine the absolutely continuous spectrum
of the Hodge-Laplacian on $j$-forms for a large class of warped product
metrics.
","[{""version"":""v1"",""created"":""Wed, 2 Jul 2014 16:14:52 GMT""},{""version"":""v2"",""created"":""Wed, 1 Oct 2014 11:04:38 GMT""},{""version"":""v3"",""created"":""Thu, 20 Aug 2015 13:14:50 GMT""}]","2015-08-21"
"1407.0631","Nikos Frantzikinakis","Nikos Frantzikinakis","Multiple correlation sequences and nilsequences","11 pages, some typos corrected, to appear in Inventiones Mathematicae",,,,"math.DS math.CO","http://arxiv.org/licenses/nonexclusive-distrib/1.0/","  We study the structure of multiple correlation sequences defined by measure
preserving actions of commuting transformations. When the iterates of the
transformations are integer polynomials we prove that any such correlation
sequence is the sum of a nilsequence and an error term that is small in uniform
density; this was previously known only for measure preserving actions of a
single transformation. We then use this decomposition result to give
convergence criteria for multiple ergodic averages involving iterates that grow
linearly, and prove the rather surprising fact that for such sequences,
convergence results for actions of commuting transformations follow
automatically from the special case of actions of a single transformation. Our
proof of the decomposition result differs from previous works of V. Bergelson,
B. Host, B. Kra, and A. Leibman, as it does not rely on the theory of
characteristic factors. It consists of a simple orthogonality argument and the
main tool is an inverse theorem of B. Host and B. Kra for general bounded
sequences.
","[{""version"":""v1"",""created"":""Wed, 2 Jul 2014 16:16:59 GMT""},{""version"":""v2"",""created"":""Fri, 30 Jan 2015 13:34:57 GMT""},{""version"":""v3"",""created"":""Sat, 21 Mar 2015 11:10:21 GMT""}]","2015-03-24"
"1407.0632","Piyush Gautam","Piyush Gautam","Development of Tool for Mapping Conventional Circuit to Reversible Logic","71 Pages, Dissertation Report. arXiv admin note: text overlap with
  arXiv:1403.2686 by other authors",,,,"cs.ET","http://arxiv.org/licenses/nonexclusive-distrib/1.0/","  In the last decades, great achievements have been made in the development of
computing machines. However, due to exponential growth of transistor density
and in particular due to tremendously increasing power consumption, researchers
expect that ""Conventional Technologies"" like Complementary Metal-Oxide
Semiconductor will reach their limits in near future. To further satisfy the
needs for more computational power, speed, less size etc. alternatives are
needed. Reversible Computation is the emerging field and alternative of
conventional technologies. Reversible Computation is emerging as a promising
solution and likely to work on extremely low power technologies and offer high
speed computations. The reversibility retains the capability to retrieve the
input data from output and minimizes heat dissipation. As migration to new
technology leave a lot of work done in current technology will make the
acceptability difficult. One side familiarly with new technology and other side
transformation of old circuit designs to new technology will pose a challenge
to designers. A need for convertibility of irreversible circuit to reversible
circuit was felt that can make a quick start and keep the development on track.
In this dissertation a logic circuit design entry based on binary logic system
has been taken up that can provide the ease of circuit design in binary logic
system and output as reversible circuit. Entire environment is GUI based and
easy to learn user friendly. This tool offers editing, storage and conversion
into reversible facility.
","[{""version"":""v1"",""created"":""Wed, 2 Jul 2014 16:17:55 GMT""}]","2014-07-03"
"1407.0633","Lianao Wu","Ben-Qiong Liu, Lian-Ao Wu, Guo-Mo Zeng, Jian-Ming Song, Wei Luo, Yang
  Lei, Guang-Ai Sun, Bo Chen, and Shu-Ming Peng","Quantum correlations in bulk properties of solids obtained from neutron
  scattering","6 pages and 3 figures",,,,"quant-ph","http://arxiv.org/licenses/nonexclusive-distrib/1.0/","  We demonstrate that inelastic neutron scattering technique can be used to
indirectly detect and measure the macroscopic quantum correlations quantified
by both entanglement and discord in a quantum magnetic material, VODPO4 . 1D2O.
The amount of quantum correlations is obtained 2 by analyzing the neutron
scattering data of magnetic excitations in isolated V4+ spin dimers. Our
quantitative analysis shows that the critical temperature of this material can
reach as high as Tc = 82.5 K, where quantum entanglement drops to zero.
Significantly, quantum discord can even survive at Tc = 300 K and may be used
in room temperature quantum devices. Taking into account the spin-orbit (SO)
coupling, we also predict theoretically that entanglement can be significantly
enhanced and the critical temperature Tc increases with the strength of
spin-orbit coupling.
","[{""version"":""v1"",""created"":""Wed, 2 Jul 2014 16:19:25 GMT""}]","2014-07-03"
"1407.0634","Sergio Davis","Mar\'ia Jos\'e Pozo, Sergio Davis, Joaqu\'in Peralta","Statistical distribution of thermal vacancies close to the melting point",,,"10.1016/j.physb.2014.10.023",,"cond-mat.mtrl-sci","http://arxiv.org/licenses/nonexclusive-distrib/1.0/","  A detailed description of the statistical distribution of thermal vacancies
near the melting point is presented, using copper as an example. As the
temperature is increased, the average number of thermal vacancies generated by
atoms migrating to neighboring sites also increase, according to Arrhenius'
law. We present for the first time a model for the distribution of thermal
vacancies, which according to our results follow a Gamma distribution. All the
simulations are carried out by classical molecular dynamics and the recognition
of vacancies is achieved via a recently developed algorithm. Our results could
be useful in the further development of a theory explaining the mechanism of
homogeneous melting, which seems to be mediated (at least in part) by the
accumulation of thermal vacancies near the melting point.
","[{""version"":""v1"",""created"":""Wed, 2 Jul 2014 16:19:34 GMT""},{""version"":""v2"",""created"":""Thu, 3 Jul 2014 00:39:58 GMT""}]","2015-06-22"
"1407.0635","Hans Skarsv{\aa}g","Hans Skarsvag, Andre Kapelrud and Arne Brataas","Spin Waves in Ferromagnetic Insulators Coupled via a Normal Metal","13 pages, 5 figures",,"10.1103/PhysRevB.90.094418",,"cond-mat.mes-hall","http://arxiv.org/licenses/nonexclusive-distrib/1.0/","  Herein, we study the spin-wave dispersion and dissipation in a ferromagnetic
insulator--normal metal--ferromagnetic insulator system. Long-range dynamic
coupling because of spin pumping and spin transfer lead to collective magnetic
excitations in the two thin-film ferromagnets. In addition, the dynamic dipolar
field contributes to the interlayer coupling. By solving the
Landau-Lifshitz-Gilbert-Slonczewski equation for macrospin excitations and the
exchange-dipole volume as well as surface spin waves, we compute the effect of
the dynamic coupling on the resonance frequencies and linewidths of the various
modes. The long-wavelength modes may couple acoustically or optically. In the
absence of spin-memory loss in the normal metal, the spin-pumping-induced
Gilbert damping enhancement of the acoustic mode vanishes, whereas the optical
mode acquires a significant Gilbert damping enhancement, comparable to that of
a system attached to a perfect spin sink. The dynamic coupling is reduced for
short-wavelength spin waves, and there is no synchronization. For intermediate
wavelengths, the coupling can be increased by the dipolar field such that the
modes in the two ferromagnetic insulators can couple despite possible small
frequency asymmetries. The surface waves induced by an easy-axis surface
anisotropy exhibit much greater Gilbert damping enhancement. These modes also
may acoustically or optically couple, but they are unaffected by thickness
asymmetries.
","[{""version"":""v1"",""created"":""Wed, 2 Jul 2014 16:23:05 GMT""}]","2014-11-25"
"1407.0636","Zhi-Hong Sun","Zhi-Hong Sun","Super congruences involving Bernoulli and Euler polynomials","30 pages",,,,"math.NT","http://arxiv.org/licenses/nonexclusive-distrib/1.0/","  Let $p>3$ be a prime, and let $a$ be a rational p-adic integer. Let
$\{B_n(x)\}$ and $\{E_n(x)\}$ denote the Bernoulli polynomials and Euler
polynomials, respectively. In this paper we show that $$\sum_{k=0}^{p-1}\binom
ak\binom{-1-a}k\equiv (-1)^{\langle a\rangle_p}+
p^2t(t+1)E_{p-3}(-a)\pmod{p^3}$$ and for $a\not\equiv -\frac 12\pmod p$,
$$\sum_{k=0}^{p-1}\binom ak\binom{-1-a}k\frac 1{2k+1}\equiv \frac{1+2t}{1+2a}
+p^2\frac{t(t+1)}{1+2a}B_{p-2}(-a)\pmod{p^3},$$ where $\langle
a\rangle_p\in\{0,1,\ldots,p-1\}$ satisfying $a\equiv \langle a\rangle_p\pmod p$
and $t=(a-\langle a\rangle_p)/p$. Taking $a=-\frac 13,-\frac 14,-\frac 16$ in
the above congruences we solve some conjectures of Z.W. Sun. In this paper we
also establish congruences for $\sum_{k=0}^{p-1}k\binom ak\binom{-1-a}k,\
\sum_{k=0}^{p-1}\binom ak\binom{-1-a}k\frac 1{2k-1},\ \sum_{k=1}^{p-1}\frac
1k\binom ak\binom{-1-a}k\pmod{p^3}$ and $\sum_{k=1}^{p-1}\frac {(-1)^k}k\binom
ak,\ \sum_{k=0}^{p-1}\binom ak(-2)^k\pmod{p^2}.$
","[{""version"":""v1"",""created"":""Wed, 2 Jul 2014 16:24:45 GMT""},{""version"":""v2"",""created"":""Mon, 7 Jul 2014 19:35:37 GMT""},{""version"":""v3"",""created"":""Tue, 8 Jul 2014 15:14:14 GMT""},{""version"":""v4"",""created"":""Fri, 11 Jul 2014 15:48:24 GMT""},{""version"":""v5"",""created"":""Mon, 14 Jul 2014 19:32:01 GMT""},{""version"":""v6"",""created"":""Mon, 28 Jul 2014 18:08:48 GMT""}]","2014-07-29"
"1407.0637","Stefano Leucci","Davide Bil\`o and Luciano Gual\`a and Stefano Leucci and Guido
  Proietti","Fault-Tolerant Approximate Shortest-Path Trees","20 pages, 4 figures",,,,"cs.DS","http://arxiv.org/licenses/nonexclusive-distrib/1.0/","  The resiliency of a network is its ability to remain \emph{effectively}
functioning also when any of its nodes or links fails. However, to reduce
operational and set-up costs, a network should be small in size, and this
conflicts with the requirement of being resilient. In this paper we address
this trade-off for the prominent case of the {\em broadcasting} routing scheme,
and we build efficient (i.e., sparse and fast) \emph{fault-tolerant approximate
shortest-path trees}, for both the edge and vertex \emph{single-failure} case.
In particular, for an $n$-vertex non-negatively weighted graph, and for any
constant $\varepsilon >0$, we design two structures of size $O(\frac{n \log
n}{\varepsilon^2})$ which guarantee $(1+\varepsilon)$-stretched paths from the
selected source also in the presence of an edge/vertex failure. This favorably
compares with the currently best known solutions, which are for the
edge-failure case of size $O(n)$ and stretch factor 3, and for the
vertex-failure case of size $O(n \log n)$ and stretch factor 3. Moreover, we
also focus on the unweighted case, and we prove that an ordinary
$(\alpha,\beta)$-spanner can be slightly augmented in order to build efficient
fault-tolerant approximate \emph{breadth-first-search trees}.
","[{""version"":""v1"",""created"":""Wed, 2 Jul 2014 16:30:58 GMT""},{""version"":""v2"",""created"":""Fri, 4 Nov 2016 10:53:20 GMT""}]","2016-11-07"
"1407.0638","Francisco J. Gozzi","Francisco J. Gozzi","Low Dimensional Polar Actions","Accepted for publication in Geometria Dedicata. Minor corrections
  from original version, 37 pages, 8 figures",,,,"math.DG","http://arxiv.org/licenses/nonexclusive-distrib/1.0/","  Polar manifolds are Riemannian G-manifolds admitting a ""section"", i.e., a
complete submanifold passing through every orbit and doing so orthogonally. We
consider compact simply-connected polar manifolds and achieve an equivariantly
diffeomorphic classification in dimensions 5 or less. As an application, we
determine which of these polar actions admit an invariant metric with
non-negative curvature.
","[{""version"":""v1"",""created"":""Wed, 2 Jul 2014 16:33:02 GMT""},{""version"":""v2"",""created"":""Mon, 10 Nov 2014 23:42:46 GMT""}]","2014-11-12"
"1407.0639","Christopher Farrington","Christopher D. Farrington, Theo A. ten Brummelaar, Brian D. Mason,
  William I. Hartkopf, Denis Mourard, Ehsan Moravveji, Harold A. McAlister,
  Nils H. Turner, Laszlo Sturmann, Judit Sturmann","Separated Fringe Packet Observations with the CHARA Array II: $\omega$
  Andromeda, HD 178911, and {\xi} Cephei","28 pages, 4 tables, 6 figures, accepted to AJ May 2014",,"10.1088/0004-6256/148/3/48",,"astro-ph.SR","http://arxiv.org/licenses/nonexclusive-distrib/1.0/","  When observed with optical long-baseline interferometers (OLBI), components
of a binary star which are sufficiently separated produce their own
interferometric fringe packets; these are referred to as Separated Fringe
Packet (SFP) binaries. These SFP binaries can overlap in angular separation
with the regime of systems resolvable by speckle interferometry at single,
large-aperture telescopes and can provide additional measurements for
preliminary orbits lacking good phase coverage, help constrain elements of
already established orbits, and locate new binaries in the undersampled regime
between the bounds of spectroscopic surveys and speckle interferometry. In this
process, a visibility calibration star is not needed, and the separated fringe
packets can provide an accurate vector separation. In this paper, we apply the
SFP approach to {\omega} Andromeda, HD 178911, and {\xi} Cephei with the CLIMB
three-beam combiner at the CHARA Array. For these systems we determine
component masses and parallax of 0.963${\pm}$0.049 $M_{\odot}$ and
0.860${\pm}$0.051 $M_{\odot}$ and 39.54${\pm}$1.85 milliarcseconds (mas) for
{\omega} Andromeda, for HD 178911 of 0.802${\pm}$0.055 $M_{\odot}$ and
0.622${\pm}$0.053 $M_{\odot}$ with 28.26${\pm}$1.70 mas, and masses of
1.045${\pm}$0.031 $M_{\odot}$ and 0.408${\pm}$0.066 $M_{\odot}$ and
38.10${\pm}$2.81 mas for {\xi} Cephei.
","[{""version"":""v1"",""created"":""Wed, 2 Jul 2014 16:40:12 GMT""}]","2015-06-22"
"1407.0640","Weisi Guo","Weisi Guo, Conor Devine, Siyi Wang","Performance Analysis of Micro Unmanned Airborne Communication Relays for
  Cellular Networks","conference","IEEE International Symposium on Communication Systems, Networks
  and Digital Signal Processing, 2014","10.1109/CSNDSP.2014.6923909",,"cs.NI","http://arxiv.org/licenses/nonexclusive-distrib/1.0/","  This paper analyses the potential of utilising small unmanned-aerial-vehicles
(SUAV) as wireless relays for assisting cellular network performance. Whilst
high altitude wireless relays have been investigated over the past 2 decades,
the new class of low cost SUAVs offers new possibilities for addressing local
traffic imbalances and providing emergency coverage.We present field-test
results from an SUAV test-bed in both urban and rural environments. The results
show that trough-to-peak throughput improvements can be achieved for users in
poor coverage zones. Furthermore, the paper reinforces the experimental study
with large-scale network analysis using both stochastic geometry and multi-cell
simulation results.
","[{""version"":""v1"",""created"":""Wed, 2 Jul 2014 16:41:19 GMT""}]","2016-11-15"
"1407.0641","Miroslav Havranek","Miroslav Havr\'anek, Tomasz Hemperek, Hans Kr\""uger, Yunan Fu, Leonard
  Germic, Tetsuichi Kishishita, Theresa Obermann and Norbert Wermes","DMAPS: a fully depleted monolithic active pixel sensor - analog
  performance characterization","submitted to JINST",,"10.1088/1748-0221/10/02/P02013",,"physics.ins-det hep-ex","http://arxiv.org/licenses/nonexclusive-distrib/1.0/","  Monolithic Active Pixel Sensors (MAPS) have been developed since the late
1990s based on silicon substrates with a thin epitaxial layer (thickness of
10-15 $\mu$m) in which charge is collected on an electrode, albeit by
disordered and slow diffusion rather than by drift in a directed electric
field. As a consequence, the signal is small ($\approx$ 1000 e$^-$) and the
radiation tolerance is much below the LHC requirements by factors of 100 to
1000. In this paper we present the development of a fully Depleted Monolithic
Active Pixel Sensors (DMAPS) based on a high resistivity substrate allowing the
creation of a fully depleted detection volume. This concept overcomes the
inherent limitations of charge collection by diffusion in the standard MAPS
designs. We present results from a test chip EPCB01 designed in a commercial
150 nm CMOS technology. The technology provides a thin (50 $\mu$m) high
resistivity n-type silicon substrate as well as an additional deep p-well which
allows to integrate full CMOS circuitry inside the pixel. Different matrix
types with several variants of collection electrodes have been implemented.
Measurements of the analog performance of this first implementation of DMAPS
pixels will be presented.
","[{""version"":""v1"",""created"":""Wed, 2 Jul 2014 16:47:13 GMT""}]","2015-06-22"
"1407.0642","Pablo Sober\'on","Amanda Montejano, Luis Montejano, Edgardo Rold\'an-Pensado, Pablo
  Sober\'on","About an Erd\H{o}s-Gr\""unbaum conjecture concerning piercing of non
  bounded convex sets","11 pages, 2 figures",,,,"math.MG","http://arxiv.org/licenses/nonexclusive-distrib/1.0/","  In this paper, we study the number of compact sets needed in an infinite
family of convex sets with a local intersection structure to imply a bound on
its piercing number, answering a conjecture of Erd\H{o}s and Gr\""unbaum.
Namely, if in an infinite family of convex sets in $\mathbb{R}^d$ we know that
out of every $p$ there are $q$ which are intersecting, we determine if having
some compact sets implies a bound on the number of points needed to intersect
the whole family. We also study variations of this problem.
","[{""version"":""v1"",""created"":""Wed, 2 Jul 2014 16:47:47 GMT""},{""version"":""v2"",""created"":""Wed, 24 Dec 2014 16:45:14 GMT""}]","2014-12-25"
