"1407.0804","\""Omer \""Unsal","\""Omer \""Unsal, Filiz Ta\c{s}can and Mehmet Naci \""Ozer","Application of Binary Bell polynomial approach to a (2+1) dimensional
  nonlinear evolution equation","The paper has been withdrawn due to the crucial error in soliton
  solutions",,,,"math.AP nlin.SI","http://arxiv.org/licenses/nonexclusive-distrib/1.0/","  In this paper, we apply the binary Bell polynomial approach to a (2+1)
dimensional nonlinear evolution equation. Namely, this study is an
integrability work. Bilinear formalism, bilinear Backlund transformation, Lax
pair of referred equation are obtained in the light of this work. Moreover,
infinite conservation laws are also presented. This approach can also be
applied to other nonlinear partial differential equations.
","[{""version"":""v1"",""created"":""Thu, 3 Jul 2014 07:42:12 GMT""},{""version"":""v2"",""created"":""Tue, 23 Sep 2014 16:50:25 GMT""}]","2014-09-24"
"1407.0805","Xiaohui Ling","Xiaohui Ling, Xinxing Zhou, Xunong Yi, Hailu Luo, and Shuangchun Wen","Geometric Photonic Spin Hall Effect with Metapolarization","11 pages, 4 figures",,,,"physics.optics","http://arxiv.org/licenses/nonexclusive-distrib/1.0/","  We develop a geometric photonic spin Hall effect (PSHE) which manifests as
spin-dependent shift in momentum space. It originates from an effective
space-variant Pancharatnam-Berry (PB) phase created by artificially engineering
the polarization distribution of the incident light. Unlikely the previously
reported PSHE involving the light-matter interaction, the resulting
spin-dependent splitting in the geometric PSHE is purely geometrically depend
upon the polarization distribution of light which can be tailored by assembling
its circular polarization basis with suitably magnitude and phase. This
metapolarization idea enables us to manipulate the geometric PSHE by suitably
tailoring the polarization geometry of light. Our scheme provides great
flexibility in the design of various polarization geometry and
polarization-dependent application, and can be extrapolated to other physical
system, such as electron beam or atom beam, with the similar spin-orbit
coupling underlying.
","[{""version"":""v1"",""created"":""Thu, 3 Jul 2014 07:44:09 GMT""}]","2014-07-04"
"1407.0806","Yu Qiu","Yu Qiu","Decorated marked surfaces: spherical twists versus braid twists","Updated version","Math. Ann. 365(2016), pp 595-633","10.1007/s00208-015-1339-0",,"math.RT math.AG math.CT math.GT","http://arxiv.org/licenses/nonexclusive-distrib/1.0/","  We are interested in the 3-Calabi-Yau categories $\mathcal{D}$ arising from
quivers with potential associated to a triangulated marked surface $\mathbf{S}$
(without punctures). We prove that the spherical twist group ST of
$\mathcal{D}$ is isomorphic to a subgroup (generated by braid twists) of the
mapping class group of the decorated marked surface
$\mathbf{S}_{\bigtriangleup}$. Here $\mathbf{S}_{\bigtriangleup}$ is the
surface obtained from $\mathbf{S}$ by decorating with a set of decorated
points, where the number of points equals the number of triangles in any
triangulations of $\mathbf{S}$. For instance, when $\mathbf{S}$ is an annulus,
the result implies the corresponding spaces of stability conditions on
$\mathcal{D}$ is contractible.
","[{""version"":""v1"",""created"":""Thu, 3 Jul 2014 07:48:29 GMT""},{""version"":""v2"",""created"":""Thu, 13 Nov 2014 15:42:33 GMT""},{""version"":""v3"",""created"":""Thu, 28 May 2015 13:03:47 GMT""},{""version"":""v4"",""created"":""Sat, 24 Feb 2018 06:21:05 GMT""}]","2018-02-27"
"1407.0807","Aleksandr Rodin","A. S. Rodin, A. Carvalho, A. H. Castro Neto","Excitons in anisotropic 2D semiconducting crystals","7 pages, 7 figures","Phys. Rev. B 90, 075429 (2014)","10.1103/PhysRevB.90.075429",,"cond-mat.mes-hall","http://arxiv.org/licenses/nonexclusive-distrib/1.0/","  The excitonic behavior of anisotropic two-dimensional crystals is
investigated using numerical methods. We employ a screened potential arising
due to the system polarizability to solve the central-potential problem using
the Numerov approach. The dependence of the exciton energies on the interaction
strength and mass anisotropy is demonstrated. We use our results to obtain the
exciton binding energy in phosphorene as a function of the substrate dielectric
constant.
","[{""version"":""v1"",""created"":""Thu, 3 Jul 2014 07:51:23 GMT""}]","2014-08-28"
"1407.0808","Rudolf Gr\""ubel","Rudolf Gr\""ubel","Persisting randomness in randomly growing discrete structures: graphs
  and search trees","Official journal file","Discrete Mathematics & Theoretical Computer Science, Vol. 18 no.
  1, Analysis of Algorithms (October 1, 2015) dmtcs:1289","10.46298/dmtcs.644",,"math.PR","http://arxiv.org/licenses/nonexclusive-distrib/1.0/","  The successive discrete structures generated by a sequential algorithm from
random input constitute a Markov chain that may exhibit long term dependence on
its first few input values. Using examples from random graph theory and search
algorithms we show how such persistence of randomness can be detected and
quantified with techniques from discrete potential theory. We also show that
this approach can be used to obtain strong limit theorems in cases where
previously only distributional convergence was known.
","[{""version"":""v1"",""created"":""Thu, 3 Jul 2014 08:00:04 GMT""},{""version"":""v2"",""created"":""Mon, 4 May 2015 08:44:51 GMT""},{""version"":""v3"",""created"":""Wed, 16 Sep 2015 07:16:27 GMT""},{""version"":""v4"",""created"":""Wed, 23 Sep 2015 18:51:25 GMT""}]","2021-10-04"
"1407.0809","Nicola Gigli","Nicola Gigli","Nonsmooth differential geometry - An approach tailored for spaces with
  Ricci curvature bounded from below",,,,,"math.DG math.MG","http://arxiv.org/licenses/nonexclusive-distrib/1.0/","  We discuss in which sense general metric measure spaces possess a first order
differential structure. Building on this, we then see that on spaces with Ricci
curvature bounded from below a second order calculus can be developed,
permitting to define Hessian, covariant/exterior derivatives and Ricci
curvature.
","[{""version"":""v1"",""created"":""Thu, 3 Jul 2014 08:01:09 GMT""}]","2014-07-04"
"1407.0810","M. Reza Shaebani","M. Reza Shaebani, Zeinab Sadjadi, Igor M. Sokolov, Heiko Rieger,
  Ludger Santen","Anomalous Diffusion of Self-Propelled Particles in Directed Random
  Environments","5 pages, 5 figures","Phys. Rev. E (Rapid Communications) 90, 030701(R) (2014)","10.1103/PhysRevE.90.030701",,"cond-mat.soft cond-mat.stat-mech","http://arxiv.org/licenses/nonexclusive-distrib/1.0/","  We theoretically study the transport properties of self-propelled particles
on complex structures, such as motor proteins on filament networks. A general
master equation formalism is developed to investigate the persistent motion of
individual random walkers, which enables us to identify the contributions of
key parameters: the motor processivity, and the anisotropy and heterogeneity of
the underlying network. We prove the existence of different dynamical regimes
of anomalous motion, and that the crossover times between these regimes as well
as the asymptotic diffusion coefficient can be increased by several orders of
magnitude within biologically relevant control parameter ranges. In terms of
motion in continuous space, the interplay between stepping strategy and
persistency of the walker is established as a source of anomalous diffusion at
short and intermediate time scales.
","[{""version"":""v1"",""created"":""Thu, 3 Jul 2014 08:08:33 GMT""},{""version"":""v2"",""created"":""Thu, 18 Sep 2014 16:27:12 GMT""}]","2014-09-19"
"1407.0811","Hiroyasu Matsuura","Hiroyasu Matsuura, Masao Ogata","A Poor Man's Derivation of Quantum Compass-Heisenberg Interaction:
  Superexchange Interaction in J-J Coupling Scheme","5 pages, 5 figures, Accepted for publication in J. Phys. Soc. Jpn","J. Phys. Soc. Jpn. 83, 093701 (2014)","10.7566/JPSJ.83.093701",,"cond-mat.str-el","http://arxiv.org/licenses/nonexclusive-distrib/1.0/","  The exchange interaction between 5d electrons in t$_{2g}$ orbitals is derived
in the J-J coupling scheme which is the appropriate basis in the case of strong
spin-orbit interaction. From simple calculations, it is found that
ferromagnetic Ising interaction (quantum compass model) occurs due to a
selection rule of hybridization between $\Gamma_7$ and $\Gamma_8$ orbitals,
while antiferromagnetic Heisenberg interaction appears from hybridization
between $\Gamma_7$ orbitals. It is also found that the ferromagnetic Ising
interaction becomes small as the spin-orbit interaction increases. Thus, the
sign of exchange interaction changes from ferromagnetic Ising to
antiferromagnetic Heisenberg interaction as the spin-orbit interaction
increases.
","[{""version"":""v1"",""created"":""Thu, 3 Jul 2014 08:15:01 GMT""}]","2014-08-05"
"1407.0812","Tobias Paust","Tobias Paust, Katinka Mertens, Ines Martin, Michael Beil, Othmar Marti","Active multi-point microrheology of cytoskeletal networks","11 pages, 4 figures",,,,"physics.bio-ph physics.optics","http://arxiv.org/licenses/nonexclusive-distrib/1.0/","  Active microrheology is a valuable tool to determine viscoelastic properties
of polymer networks. Observing the beads response to the excitation of a
reference leads to dynamic and morphological information of the material. In
this work we present an expansion of the well-known active two-point
microrheology. By measuring the response of multiple particles in the
viscoelastic medium in response to the excitation of a reference particle we
are able to determine the force propagation in the polymer network.
","[{""version"":""v1"",""created"":""Thu, 3 Jul 2014 08:17:47 GMT""}]","2014-07-04"
"1407.0813","Matthias Thede","M. Thede, T. Haku, T. Masuda, C. Baines, E. Pomjakushina, G. Dhalenne,
  A. Revcolevschi, E. Morenzoni, A. Zheludev","Inhomogeneous ordering in weakly coupled Heisenberg $S=1/2$ chains with
  random bonds",,"Phys. Rev. B. 90, 144407 (2014)","10.1103/PhysRevB.90.144407",,"cond-mat.str-el","http://arxiv.org/licenses/nonexclusive-distrib/1.0/","  Long range magnetic ordering in the quasi-one-dimensional random-bond
antiferromagnet BaCu$_2$(Si$_{1-x}$Ge$_{x}$)$_2$O$_7$ is studied in $\mu$SR
experiments as a function of disorder strength. Compared to the disorder-free
parent materials, the saturation ordered moment is found to be considerably
reduced. Moreover, even in weakly disordered species, the magnetically ordered
state is shown to be highly inhomogeneous. The results are interpreted in terms
of weakly coupled random spin chains, governed by the ``infinite randomness``
fixed point.
","[{""version"":""v1"",""created"":""Thu, 3 Jul 2014 08:23:30 GMT""},{""version"":""v2"",""created"":""Wed, 3 Dec 2014 10:02:22 GMT""}]","2014-12-04"
"1407.0814","Siow Shyong Lau","Siow Shyong Lau","Impact of Mobile phone in the Air and Random Access Channel RACH with
  Time Division Multiple Access TDMA Noise in Aircraft Avionics","11 pages, 7 figures",,,,"cs.SY","http://arxiv.org/licenses/nonexclusive-distrib/1.0/","  Mobile phone 1800MHz band already allowed to be used in some airlines. Many
studies talked about lower the mobile phone output power to the lowest of 0dBm,
but seldom talk about the Random Access Channel RACH, which will emit at the
highest power of 30dBm at the instant of call making and is not controllable
until the connection between the Base Station and mobile is made.Hence the
impact of RACH and TDMA noise generated in the aircraft.
","[{""version"":""v1"",""created"":""Thu, 3 Jul 2014 08:29:53 GMT""}]","2014-07-04"
"1407.0815","Vladimir Braun M","V. M. Braun, A. N. Manashov, D. Mueller and B. Pirnay","Resolving kinematic ambiguities in QCD predictions for Deeply Virtual
  Compton Scattering","Proceedings of the XXII. International Workshop on Deep-Inelastic
  Scattering and Related Subjects (DIS2014) 28 April - 2 May 2014, Warsaw,
  Poland",,,,"hep-ph nucl-th","http://arxiv.org/licenses/nonexclusive-distrib/1.0/","  The existing QCD predictions for the Deeply Virtual Compton Scattering (DVCS)
depend on the convention used for the skewedness parameter and on the reference
frame used to define helicity amplitudes. These ambiquities are formally
power-suppressed but numerically significant. They are cancelled by finite-$t$
and target mass corrections that have been calculated recently to the $1/Q^2$
accuracy. It turns out that these corrections can be minimized, at least for
unpolarized observables, by choosing a specific reference frame where
longitudinal directions are defined by the photon momenta.
","[{""version"":""v1"",""created"":""Thu, 3 Jul 2014 08:36:37 GMT""}]","2014-07-04"
"1407.0816","Jakub P\k{e}kalski","Alina Ciach and Jakub P\k{e}kalski","Simple one-dimensional lattice model for lipids in water","This work is dedicated to Prof. Johan S. H\o ye",,,,"cond-mat.soft","http://arxiv.org/licenses/nonexclusive-distrib/1.0/","  A lattice model for binary mixture of lipids and water is introduced and
investigated. The orientational degrees of freedom of the amphiphilic molecules
are taken into account in the same way as in the model for oil-water-surfactant
mixtures introduced earlier by Johan H\o ye and co-authors. The ground state of
the model is discussed in detail, and the mean-field stability analysis of the
disordered phase is performed. The model is compared to the recently introduced
lattice model for colloidal self-assembly.
","[{""version"":""v1"",""created"":""Thu, 3 Jul 2014 08:38:29 GMT""}]","2014-07-04"
"1407.0817","Angkana R\""uland","Angkana R\""uland","On Some Quantitative Unique Continuation Properties of Fractional
  Schr\""odinger Equations: Doubling, Vanishing Order and Nodal Domain Estimates","38 pages",,"10.1090/tran/6758",,"math.AP","http://arxiv.org/licenses/nonexclusive-distrib/1.0/","  In this article we determine bounds on the maximal order of vanishing for
eigenfunctions of a generalized Dirichlet-to-Neumann map (which is associated
with fractional Schr\""odinger equations) on a compact, smooth Riemannian
manifold, $(M,g)$, without boundary. Moreover, with only slight modifications
these results generalize to equations with $C^1$ potentials. Here Carleman
estimates are a key tool. These yield a quantitative three balls inequality
which implies quantitative bulk and boundary doubling estimates and hence leads
to the control of the maximal order of vanishing. Using the boundary doubling
property, we prove upper bounds on the $\mathcal{H}^{n-1}$-measure of nodal
domains of eigenfunctions of the generalized Dirichlet-to-Neumann map on
analytic manifolds.
","[{""version"":""v1"",""created"":""Thu, 3 Jul 2014 08:41:31 GMT""},{""version"":""v2"",""created"":""Sun, 6 Jul 2014 12:35:25 GMT""}]","2016-06-29"
"1407.0818","Jonas Persson","J. R. Persson","Hyperfine structure and hyperfine anomaly in Pb","15 pages. Updated version. arXiv admin note: text overlap with
  arXiv:0904.4828",,,,"physics.atom-ph nucl-ex","http://arxiv.org/licenses/nonexclusive-distrib/1.0/","  The hyperfine structure in the 6p2-configuration in lead has been analysed
and the results is compared with calculations. The hyperfine anomaly and
improved values of the nuclear magnetic moment for four lead isotopes is
obtained, using the results from the analysis. The results open up for new
measurements of the hyperfine structure in unstable lead isotopes, in order to
extract information of the hyperfine anomaly and distribution of magnetisation
in the nucleus.
","[{""version"":""v1"",""created"":""Thu, 3 Jul 2014 08:41:44 GMT""},{""version"":""v2"",""created"":""Fri, 11 Jul 2014 09:14:17 GMT""}]","2014-07-14"
"1407.0819","Peter Kritzer","Henri Faure, Peter Kritzer","Discrepancy bounds for low-dimensional point sets",,,,,"math.NT","http://arxiv.org/licenses/nonexclusive-distrib/1.0/","  The class of $(t,m,s)$-nets and $(t,s)$-sequences, introduced in their most
general form by Niederreiter, are important examples of point sets and
sequences that are commonly used in quasi-Monte Carlo algorithms for
integration and approximation. Low-dimensional versions of $(t,m,s)$-nets and
$(t,s)$-sequences, such as Hammersley point sets and van der Corput sequences,
form important sub-classes, as they are interesting mathematical objects from a
theoretical point of view, and simultaneously serve as examples that make it
easier to understand the structural properties of $(t,m,s)$-nets and
$(t,s)$-sequences in arbitrary dimension. For these reasons, a considerable
number of papers have been written on the properties of low-dimensional nets
and sequences.
","[{""version"":""v1"",""created"":""Thu, 3 Jul 2014 08:48:09 GMT""}]","2014-07-04"
"1407.0820","Mauro Pieroni","P. Binetruy, E. Kiritsis, J. Mabillard, M. Pieroni, C. Rosset","Universality classes for models of inflation","43 pages, 12 figures",,"10.1088/1475-7516/2015/04/033",,"astro-ph.CO gr-qc hep-ph hep-th","http://arxiv.org/licenses/nonexclusive-distrib/1.0/","  We show that the cosmological evolution of a scalar field in a potential can
be obtained from a renormalisation group equation. The slow roll regime of
inflation models is understood in this context as the slow evolution close to a
fixed point, described by the methods of renormalisation group. This explains
in part the universality observed in the predictions of a certain number of
inflation models. We illustrate this behavior on a certain number of examples
and discuss it in the context of the AdS/CFT correspondence.
","[{""version"":""v1"",""created"":""Thu, 3 Jul 2014 08:52:31 GMT""},{""version"":""v2"",""created"":""Mon, 7 Jul 2014 09:04:15 GMT""}]","2015-06-22"
"1407.0821","Christoph Kriegler","Christoph Kriegler (LMBP), Lutz Weis","Paley-Littlewood decomposition for sectorial operators and interpolation
  spaces","2nd version to appear in Mathematische Nachrichten, Mathematical News
  / Mathematische Nachrichten, Wiley-VCH Verlag, 2016",,"10.1002/mana.201400223",,"math.FA math.SP","http://arxiv.org/licenses/nonexclusive-distrib/1.0/","  We prove Paley-Littlewood decompositions for the scales of fractional powers
of $0$-sectorial operators $A$ on a Banach space which correspond to
Triebel-Lizorkin spaces and the scale of Besov spaces if $A$ is the classical
Laplace operator on $L^p(\mathbb{R}^n).$We use the $H^\infty$-calculus,
spectral multiplier theorems and generalized square functions on Banach spaces
and apply our results to Laplace-type operators on manifolds and graphs,
Schr\""odinger operators and Hermite expansion.We also give variants of these
results for bisectorial operators and for generators of groups with a bounded
$H^\infty$-calculus on strips.
","[{""version"":""v1"",""created"":""Thu, 3 Jul 2014 09:01:00 GMT""},{""version"":""v2"",""created"":""Fri, 19 Feb 2016 15:46:01 GMT""}]","2016-02-22"
"1407.0822","Fabrice Rossi","Arnaud De Myttenaere (SAMM), B\'en\'edicte Le Grand (CRI), Boris
  Golden (Viadeo), Fabrice Rossi (SAMM)","Reducing Offline Evaluation Bias in Recommendation Systems","23rd annual Belgian-Dutch Conference on Machine Learning (Benelearn
  2014), Bruxelles : Belgium (2014)",,,,"cs.IR cs.LG stat.ML","http://arxiv.org/licenses/nonexclusive-distrib/1.0/","  Recommendation systems have been integrated into the majority of large online
systems. They tailor those systems to individual users by filtering and ranking
information according to user profiles. This adaptation process influences the
way users interact with the system and, as a consequence, increases the
difficulty of evaluating a recommendation algorithm with historical data (via
offline evaluation). This paper analyses this evaluation bias and proposes a
simple item weighting solution that reduces its impact. The efficiency of the
proposed solution is evaluated on real world data extracted from Viadeo
professional social network.
","[{""version"":""v1"",""created"":""Thu, 3 Jul 2014 09:05:33 GMT""}]","2014-07-04"
"1407.0823","Stefano Frixione","S. Frixione, V. Hirschi, D. Pagani, H.-S. Shao, M. Zaro","Weak corrections to Higgs hadroproduction in association with a
  top-quark pair","29 pages, 38 figures",,"10.1007/JHEP09(2014)065","CERN-PH-TH-2014-123, CP3-14-49","hep-ph","http://arxiv.org/licenses/nonexclusive-distrib/1.0/","  We present the calculation of the next-to-leading contribution of order
$\alpha_S^2\alpha^2$ to the production of a Standard Model Higgs boson in
association with a top-quark pair at hadron colliders. All effects of weak and
QCD origin are included, whereas those of QED origin are ignored. We work in
the MadGraph5_aMC@NLO framework, and discuss sample phenomenological
applications at a 8, 13, and 100 TeV $pp$ collider, including the effects of
the dominant next-to-leading QCD corrections of order $\alpha_S^3\alpha$.
","[{""version"":""v1"",""created"":""Thu, 3 Jul 2014 09:08:04 GMT""}]","2015-06-22"
"1407.0824","Hartmut F\""uhr","Hartmut F\""uhr, Reihaneh Raisi Tousi","Simplified vanishing moment criteria for wavelets over general dilation
  groups, with applications to abelian and shearlet dilation groups","30 pages; (2nd revision: streamlined exposition, typos removed,
  additional references)",,,,"math.FA","http://arxiv.org/licenses/nonexclusive-distrib/1.0/","  We consider the coorbit theory associated to general continuous wavelet
transforms arising from a square-integrable, irreducible quasi-regular
representation of a semidirect product group $G = \mathbb{R}^d \rtimes H$. The
existence of coorbit spaces for this very general setting has been recently
established, together with concrete vanishing moment criteria for analyzing
vectors and atoms that can be used in the coorbit scheme. These criteria depend
on fairly technical assumptions on the dual action of the dilation group, and
it is one of the chief purposes of this paper to considerably simplify these
assumptions.
  We then proceed to verify the assumptions for large classes of dilation
groups, in particular for all abelian dilation groups, as well as a class
called {\em generalized shearlet dilation groups}, containing and extending all
known examples of shearlet dilation groups employed in dimensions two and
higher. We explain how these groups can be systematically constructed from
certain commutative associative algebras of the same dimension, and give a full
list, up to conjugacy, of shearing groups in dimensions three and four. In the
latter case, three previously unknown groups arise.
  As a result the existence of Banach frames consisting of compactly supported
wavelets, with simultaneous convergence in a whole range of coorbit spaces, is
established for all groups involved.
","[{""version"":""v1"",""created"":""Thu, 3 Jul 2014 09:09:23 GMT""},{""version"":""v2"",""created"":""Mon, 9 Mar 2015 08:09:51 GMT""},{""version"":""v3"",""created"":""Wed, 20 May 2015 05:54:43 GMT""}]","2015-05-21"
"1407.0825","Nathalie Deruelle","Nathalie Deruelle and Josephine Rua","Disformal Transformations, Veiled General Relativity and Mimetic Gravity",,,"10.1088/1475-7516/2014/09/002",,"gr-qc hep-th","http://arxiv.org/licenses/nonexclusive-distrib/1.0/","  In this Note we show that Einstein's equations for gravity are generically
invariant under 'disformations'. We also show that the particular subclass when
this is not true yields the equations of motion of 'Mimetic Gravity'. Finally
we give the 'mimetic' generalization of the Schwarzschild solution.
","[{""version"":""v1"",""created"":""Thu, 3 Jul 2014 09:09:46 GMT""}]","2015-06-22"
"1407.0826","Robert Pattinson","R. W. Pattinson, N. P. Proukakis and N. G. Parker","Equilibration of a finite temperature binary Bose gas formed by
  population transfer","4 figures, 9 pages",,"10.1103/PhysRevA.90.033625",,"cond-mat.quant-gas physics.atom-ph","http://arxiv.org/licenses/nonexclusive-distrib/1.0/","  We consider an equilibrium single-species homogeneous Bose gas from which a
proportion of the atoms are instantaneously and coherently transferred to a
second species, thereby forming a binary Bose gas in a non-equilibrium initial
state. We study the ensuing evolution towards a new equilibrium, mapping the
dynamics and final equilibrium state out as a function of the population
transfer and the interspecies interactions by means of classical field methods.
While in certain regimes, the condensate fractions are largely unaffected by
the population transfer process, in others, particularly for immiscible
interactions, one or both condensate fractions are vastly reduced to a new
equilibrium value.
","[{""version"":""v1"",""created"":""Thu, 3 Jul 2014 09:11:53 GMT""},{""version"":""v2"",""created"":""Wed, 6 Aug 2014 08:42:01 GMT""},{""version"":""v3"",""created"":""Tue, 9 Sep 2014 09:29:40 GMT""}]","2015-06-22"
