"1407.0877","Parthapratim  Pradhan","Parthapratim Pradhan","Charged Dilation Black Holes as Particle Accelerators","Accepted for Publication in Astroparticle Physics, September-2014","http://dx.doi.org/10.1016/j.astropartphys.2014.09.005","10.1016/j.astropartphys.2014.09.005",,"gr-qc astro-ph.HE","http://arxiv.org/licenses/nonexclusive-distrib/1.0/","  We examine the possibility of arbitrarily high energy in the
Center-of-mass(CM) frame of colliding neutral particles in the vicinity of the
horizon of a charged dilation black hole(BH). We show that it is possible to
achieve the infinite energy in the background of the dilation black hole
without fine-tuning of the angular momentum parameter. It is found that the CM
energy $({\cal E}_{cm})$ of collisions of particles near the infinite red-shift
surface of the extreme dilation BHs are arbitrarily large while the non-extreme
charged dilation BHs have the finite energy. We have also compared the ${\cal
E}_{cm}$ at the horizon with the ISCO(Innermost Stable Circular Orbit) and MBCO
(Marginally Bound Circular Orbit) for extremal Reissner-Nordstr{\o}m(RN) BH and
Schwarzschild BH. We find that for extreme RN BH the inequality becomes ${\cal
E}_{cm}\mid_{r_{+}}>{\cal E}_{cm}\mid_{r_{mb}}> {\cal E}_{cm}\mid_{r_{ISCO}}$
i.e. ${\cal E}_{cm}\mid_{r_{+}=M}: {\cal
E}_{cm}\mid_{r_{mb}=\left(\frac{3+\sqrt{5}}{2}\right)M} : {\cal
E}_{cm}\mid_{r_{ISCO}=4M} =\infty : 3.23 : 2.6 $. While for Schwarzschild BH
the ratio of CM energy is ${\cal E}_{cm}\mid_{r_{+}=2M}: {\cal
E}_{cm}\mid_{r_{mb}=4M} : {\cal E}_{cm}\mid_{r_{ISCO}=6M} = \sqrt{5} : \sqrt{2}
: \frac{\sqrt{13}}{3}$. Also for Gibbons-Maeda-Garfinkle-Horowitz-Strominger
(GMGHS) BHs, the ratio is being ${\cal E}_{cm}\mid_{r_{+}=2M}: {\cal
E}_{cm}\mid_{r_{mb}=2M} : {\cal E}_{cm}\mid_{r_{ISCO}=2M} =\infty : \infty :
\infty$.
","[{""version"":""v1"",""created"":""Thu, 3 Jul 2014 12:09:01 GMT""},{""version"":""v2"",""created"":""Fri, 10 Oct 2014 17:31:20 GMT""}]","2014-10-13"
"1407.0878","Qi Wang","Jia Hu, Qi Wang, Jingyue Yang, Lu Zhang","Global existence and steady states of a two competing species
  Keller-Segel chemotaxis model","Kinetic and Related Models, 2015",,,,"math.AP","http://arxiv.org/licenses/nonexclusive-distrib/1.0/","  We study an one{dimensional quasilinear system proposed by J. Tello and M.
Winkler [19] which models the population dynamics of two competing species
attracted by the same chemical. The kinetics terms of the interacting species
are chosen to be the Lotka{Volterra type. We prove the existence of global
bounded and classical solutions for all chemoattraction rates. Under
homogeneous Neumann boundary conditions, we establish the existence of
nonconstant steady states by local bifurcation theory. The stability of the
bifurcating solutions is also obtained when the diffusivity of both species is
large. Finally, we perform extensive numerical studies to demonstrate the
formation of stable positive steady states with various interesting spatial
structures.
","[{""version"":""v1"",""created"":""Thu, 3 Jul 2014 12:14:51 GMT""},{""version"":""v2"",""created"":""Sun, 24 May 2015 17:09:37 GMT""}]","2016-11-25"
"1407.0879","Stefano Bellucci","S. Bellucci, A. A. Saharian, N. A. Saharyan","Wightman function and the Casimir effect for a Robin sphere in a
  constant curvature space","28 pages, 3 figures, LaTeX file","Eur. Phys. J. C 74 (2014) 3047","10.1140/epjc/s10052-014-3047-4",,"hep-th gr-qc quant-ph","http://arxiv.org/licenses/nonexclusive-distrib/1.0/","  We evaluate the Wightman function, the mean field squared and the vacuum
expectation value (VEV) of the energy-momentum tensor for a scalar field with
Robin boundary condition on a spherical shell in the background of a constant
negative curvature space. For the coefficient in the boundary condition there
is a critical value above which the scalar vacuum becomes unstable. In both
interior and exterior regions, the VEVs are decomposed into the boundary-free
and sphere-induced contributions. For the latter, rapidly convergent integral
representations are provided. In the region inside the sphere, the eigenvalues
are expressed in terms of the zeros of the combination of the associated
Legendre function and its derivative and the decomposition is achieved by
making use of the Abel-Plana type summation formula for the series over these
zeros. The sphere-induced contribution to the VEV of the field squared is
negative for Dirichlet boundary condition and positive for Neumann one. At
distances from the sphere larger than the curvature scale of the background
space the suppression of the vacuum fluctuations in the gravitational field
corresponding to the negative curvature space is stronger compared with the
case of the Minkowskian bulk. In particular, the decay of the VEVs with the
distance is exponential for both massive and massless fields. The corresponding
results are generalized for spaces with spherical bubbles and for cosmological
models with negative curvature spaces.
","[{""version"":""v1"",""created"":""Thu, 3 Jul 2014 12:16:47 GMT""}]","2014-09-29"
"1407.0880","Fabrice Rossi","Tsirizo Rabenoro (SAMM), J\'er\^ome Lacaille, Marie Cottrell (SAMM),
  Fabrice Rossi (SAMM)","Anomaly Detection Based on Aggregation of Indicators","23rd annual Belgian-Dutch Conference on Machine Learning (Benelearn
  2014), Bruxelles : Belgium (2014)",,,,"stat.ML cs.LG","http://arxiv.org/licenses/nonexclusive-distrib/1.0/","  Automatic anomaly detection is a major issue in various areas. Beyond mere
detection, the identification of the origin of the problem that produced the
anomaly is also essential. This paper introduces a general methodology that can
assist human operators who aim at classifying monitoring signals. The main idea
is to leverage expert knowledge by generating a very large number of
indicators. A feature selection method is used to keep only the most
discriminant indicators which are used as inputs of a Naive Bayes classifier.
The parameters of the classifier have been optimized indirectly by the
selection process. Simulated data designed to reproduce some of the anomaly
types observed in real world engines.
","[{""version"":""v1"",""created"":""Thu, 3 Jul 2014 12:16:50 GMT""},{""version"":""v2"",""created"":""Tue, 16 Sep 2014 19:43:54 GMT""}]","2014-09-17"
"1407.0881","Sebastian  Dorn","Sebastian Dorn, Erandy Ramirez, Kerstin E. Kunze, Stefan Hofmann, and
  Torsten A. En{\ss}lin","Generic inference of inflation models by local non-Gaussianity","Proceedings IAU Symposium No. 306","Proceedings of the International Astronomical Union, 2014, IAU
  Symposium, Volume 306, pp 51-53","10.1017/S1743921314010667",,"astro-ph.CO astro-ph.IM","http://arxiv.org/licenses/nonexclusive-distrib/1.0/","  The presence of multiple fields during inflation might seed a detectable
amount of non-Gaussianity in the curvature perturbations, which in turn becomes
observable in present data sets like the cosmic microwave background (CMB) or
the large scale structure (LSS). Within this proceeding we present a fully
analytic method to infer inflationary parameters from observations by
exploiting higher-order statistics of the curvature perturbations. To keep this
analyticity, and thereby to dispense with numerically expensive sampling
techniques, a saddle-point approximation is introduced whose precision has been
validated for a numerical toy example. Applied to real data, this approach
might enable to discriminate among the still viable models of inflation.
","[{""version"":""v1"",""created"":""Thu, 3 Jul 2014 12:17:31 GMT""}]","2015-08-27"
"1407.0882","Peter Van","Cs. Asszonyi, T. F\""ul\""op and P. V\'an","Distinguished rheological models in the framework of a thermodynamical
  internal variable theory","16 pages, 1 figure, revised","Continuum Mech. Thermodyn. (2015) 27:971-986","10.1007/s00161-014-0392-3",,"cond-mat.soft physics.flu-dyn","http://arxiv.org/licenses/nonexclusive-distrib/1.0/","  We present and analyze a thermodynamical theory of rheology with single
internal variable. The universality of the model is ensured as long as the
mesoscopic and/or microscopic background processes satisfy the applied
thermodynamical principles, which are the second law, the basic balances and
the existence of an additional-tensorial-state variable. The resulting model,
which we suggest to call the Kluitenberg-Verh\'as body, is the
Poynting-Thomson-Zener body with an additional inertial element, or, in other
words, is the extension of Jeffreys model to solids. We argue that this
Kluitenberg-Verh\'as body is the natural thermodynamical building block of
rheology. An important feature of the presented methodology is that nontrivial
inequality-type restrictions arise for the four parameters of the model. We
compare these conditions and other aspects to those of other known
thermodynamical approaches, like Extended Irreversible Thermodynamics or the
original theory of Kluitenberg.
","[{""version"":""v1"",""created"":""Thu, 3 Jul 2014 12:18:14 GMT""},{""version"":""v2"",""created"":""Wed, 22 Oct 2014 19:33:33 GMT""}]","2015-11-24"
"1407.0883","Jean-Christophe Geminard","Maria Alejandra Aguirre (GMP), Rosario De Schant (GMP),
  Jean-Christophe G\'eminard (Phys-ENS)","Granular flow through an aperture: influence of the packing fraction",,,"10.1103/PhysRevE.90.012203",,"cond-mat.soft cond-mat.mtrl-sci","http://arxiv.org/licenses/nonexclusive-distrib/1.0/","  For the last 50 years, the flow of a granular material through an aperture
has been intensely studied in gravity-driven vertical systems (e.g. silos and
hoppers). Nevertheless, in many industrial applications, grains are
horizontally transported at constant velocity, lying on conveyor belts or
floating on the surface of flowing liquids. Unlike fluid flows, that are
controlled by the pressure, granular flow is not sensitive to the local
pressure but rather to the local velocity of the grains at the outlet. We can
also expect the flow rate to depend on the local density of the grains. Indeed,
vertical systems are packed in dense configurations by gravity but, in
contrast, in horizontal systems the density can take a large range of values,
potentially very small, which may significantly alter the flow rate. In the
present article, we study, for different initial packing fractions, the
discharge through an orifice of monodisperse grains driven at constant velocity
by a horizontal conveyor belt. We report how, during the discharge, the packing
fraction is modified by the presence of the outlet and we analyze how changes
in the packing fraction induce variations in the flow rate. We observe that
variations of packing fraction do not affect the velocity of the grains at the
outlet and, therefore, we establish that flow-rate variations are directly
related to changes in the packing fraction.
","[{""version"":""v1"",""created"":""Thu, 3 Jul 2014 12:19:25 GMT""}]","2015-06-22"
"1407.0884","Gaetana Spedalieri","Gaetana Spedalieri and Samuel L. Braunstein","Asymmetric quantum hypothesis testing with Gaussian states","REVTeX. Published version","Phys. Rev. A 90, 052307 (2014)","10.1103/PhysRevA.90.052307",,"quant-ph physics.data-an","http://arxiv.org/licenses/nonexclusive-distrib/1.0/","  We consider the asymmetric formulation of quantum hypothesis testing, where
two quantum hypotheses have different associated costs. In this problem, the
aim is to minimize the probability of false negatives and the optimal
performance is provided by the quantum Hoeffding bound. After a brief review of
these notions, we show how this bound can be simplified for pure states. We
then provide a general recipe for its computation in the case of multimode
Gaussian states, also showing its connection with other easier-to-compute lower
bounds. In particular, we provide analytical formulas and numerical results for
important classes of one- and two-mode Gaussian states.
","[{""version"":""v1"",""created"":""Thu, 3 Jul 2014 12:21:51 GMT""},{""version"":""v2"",""created"":""Fri, 29 Aug 2014 14:19:24 GMT""},{""version"":""v3"",""created"":""Thu, 3 Sep 2015 13:09:49 GMT""}]","2015-09-04"
"1407.0885","Ondrej Kop\'a\v{c}ek","Ond\v{r}ej Kop\'a\v{c}ek, Ji\v{r}\'i Kov\'a\v{r}, Vladim\'ir Karas,
  Yasufumi Kojima","Regular and Chaotic Motion in General Relativity: The Case of a Massive
  Magnetic Dipole","11 pages, 6 figures, published in the proceedings of the conference
  ""Relativity and Gravitation: 100 Years after Einstein in Prague"" (25. - 29.
  6. 2012, Prague)","Springer Proceedings in Physics, Volume 157, pp. 373-383 (2014)","10.1007/978-3-319-06761-2_52",,"astro-ph.HE gr-qc","http://arxiv.org/licenses/nonexclusive-distrib/1.0/","  Circular motion of particles, dust grains and fluids in the vicinity of
compact objects has been investigated as a model for accretion of gaseous and
dusty environment. Here we further discuss, within the framework of general
relativity, figures of equilibrium of matter under the influence of combined
gravitational and large-scale magnetic fields, assuming that the accreted
material acquires a small electric charge due to interplay of plasma processes
and photoionization. In particular, we employ an exact solution describing the
massive magnetic dipole and we identify the regions of stable motion. We also
investigate situations when the particle dynamics exhibits the onset of chaos.
In order to characterize the measure of chaoticness we employ techniques of
Poincar\'e surfaces of section and of recurrence plots.
","[{""version"":""v1"",""created"":""Thu, 3 Jul 2014 12:26:06 GMT""}]","2014-07-04"
"1407.0886","Tobias Michael Erhardt","Tobias Michael Erhardt, Claudia Czado and Ulf Schepsmeier","Spatial composite likelihood inference using local C-vines",,,,,"stat.ME","http://arxiv.org/licenses/nonexclusive-distrib/1.0/","  We present a vine copula based composite likelihood approach to model spatial
dependencies, which allows to perform prediction at arbitrary locations. This
approach combines established methods to model (spatial) dependencies. On the
one hand the geostatistical concept utilizing spatial differences between the
variable locations to model the extend of spatial dependencies is applied. On
the other hand the flexible class of C-vine copulas is utilized to model the
spatial dependency structure locally. These local C-vine copulas are
parametrized jointly, exploiting an existing relationship between the copula
parameters and the respective spatial distances and elevation differences, and
are combined in a composite likelihood approach. The new methodology called
spatial local C-vine composite likelihood (S-LCVCL) method benefits from the
fact that it is able to capture non-Gaussian dependency structures. The
development and validation of the new methodology is illustrated using a data
set of daily mean temperatures observed at 73 observation stations spread over
Germany. For validation continuous ranked probability scores are utilized.
Comparison with two other approaches of spatial dependency modeling introduced
in yet unpublished work of Erhardt, Czado and Schepsmeier (2014) shows a
preference for the local C-vine composite likelihood approach.
","[{""version"":""v1"",""created"":""Thu, 3 Jul 2014 12:26:51 GMT""}]","2014-07-04"
"1407.0887","Adrien Richou","Jean-Fran\c{c}ois Chassagneux and Adrien Richou","Numerical stability analysis of the Euler scheme for BSDEs",,,,,"math.PR","http://arxiv.org/licenses/nonexclusive-distrib/1.0/","  In this paper, we study the qualitative behaviour of approximation schemes
for Backward Stochastic Differential Equations (BSDEs) by introducing a new
notion of numerical stability. For the Euler scheme, we provide sufficient
conditions in the one-dimensional and multidimensional case to guarantee the
numerical stability. We then perform a classical Von Neumann stability analysis
in the case of a linear driver $f$ and exhibit necessary conditions to get
stability in this case. Finally, we illustrate our results with numerical
applications.
","[{""version"":""v1"",""created"":""Thu, 3 Jul 2014 12:30:53 GMT""}]","2014-07-04"
"1407.0888","Jinmian Li","Taoli Cheng, Jinmian Li, Tianjun Li","Supersymmetry with a Heavy Lightest Supersymmetric Particle","29 pages, 6 figures, completely revised version","J. Phys. G: Nucl. Part. Phys. 42 (2015) 065004","10.1088/0954-3899/42/6/065004",,"hep-ph","http://arxiv.org/licenses/nonexclusive-distrib/1.0/","  To escape the current LHC supersymmetry (SUSY) search constraints while
preserve the naturalness condition, we propose the heavy Lightest
Supersymmetric Particle (LSP) SUSY. According to the different dependence on
the LSP mass, we systematically classify the discriminating variables into
three categories. We find the strong dependence of all current SUSY searches on
variables in the first category render the weak sensitivity for the heavy LSP
SUSY. Especially, all the current LHC SUSY search constraints can be evaded if
the LSP mass is around 600 GeV or higher. In the Minimal Supersymmetric
Standard Model (MSSM), we find that the heavy LSP SUSY does not induce more
fine-tuning than Higgs boson mass. Moreover, the muon anomalous magnetic moment
can be satisfied within 3-$\sigma$ level. We systematically study the viable
parameter space for heavy LSP SUSY, and present four benchmark points which
realize our proposal concretely. An improved collider search for those
benchmark points, which mainly relies on the variable in the second category,
is discussed in detail.
","[{""version"":""v1"",""created"":""Thu, 3 Jul 2014 12:32:01 GMT""},{""version"":""v2"",""created"":""Mon, 8 Dec 2014 03:00:46 GMT""}]","2015-05-11"
"1407.0889","Eero Ruosteenoja","Eero Ruosteenoja","Local regularity results for value functions of tug-of-war with noise
  and running payoff","20 pages. Some misprints corrected. To appear in Adv. Calc. Var",,,,"math.AP","http://arxiv.org/licenses/nonexclusive-distrib/1.0/","  We prove local Lipschitz continuity and Harnack's inequality for value
functions of the stochastic game tug-of-war with noise and running payoff. As a
consequence, we obtain game-theoretic proofs for the same regularity properties
for viscosity solutions of the inhomogeneous $p$-Laplace equation when $p>2$.
","[{""version"":""v1"",""created"":""Thu, 3 Jul 2014 12:33:14 GMT""},{""version"":""v2"",""created"":""Thu, 10 Sep 2015 07:02:23 GMT""}]","2015-09-11"
"1407.0890","Florin Radulescu","Florin Radulescu","Endomorphisms of spaces of virtual vectors fixed by a discrete group","The exposition has been improved and a normalization constant has
  been addressed. The result allows a direct computation for the characters of
  the unitary representation on spaces of invariant vectors (for example
  automorphic forms) in terms of the characters of the representation to which
  the fixed vectors are associated (e.g discrete series of PSL(2, R) for
  automorphic forms)",,,,"math.OA math.NT","http://arxiv.org/licenses/nonexclusive-distrib/1.0/","  Consider a unitary representation $\pi$ of a discrete group $G$, which, when
restricted to an almost normal subgroup $\Gamma\subseteq G$, is of type II. We
analyze the associated unitary representation $\overline{\pi}^{\rm{p}}$ of $G$
on the Hilbert space of ""virtual"" $\Gamma_0$-invariant vectors, where
$\Gamma_0$ runs over a suitable class of finite index subgroups of $\Gamma$.
The unitary representation $\overline{\pi}^{\rm{p}}$ of $G$ is uniquely
determined by the requirement that the Hecke operators, for all $\Gamma_0$, are
the ""block matrix coefficients"" of $\overline{\pi}^{\rm{p}}$.
  If $\pi|_\Gamma$ is an integer multiple of the regular representation, there
exists a subspace $L$ of the Hilbert space of the representation $\pi$, acting
as a fundamental domain for $\Gamma$. In this case, the space of
$\Gamma$-invariant vectors is identified with $L$.
  When $\pi|_\Gamma$ is not an integer multiple of the regular representation,
(e.g. if $G=PGL(2,\mathbb Z[\frac{1}{p}])$, $\Gamma$ is the modular group,
$\pi$ belongs to the discrete series of representations of $PSL(2,\mathbb R)$,
and the $\Gamma$-invariant vectors are the cusp forms) we assume that $\pi$ is
the restriction to a subspace $H_0$ of a larger unitary representation having a
subspace $L$ as above.
  The operator angle between the projection $P_L$ onto $L$ (typically the
characteristic function of the fundamental domain) and the projection $P_0$
onto the subspace $H_0$ (typically a Bergman projection onto a space of
analytic functions), is the analogue of the space of $\Gamma$- invariant
vectors.
  We prove that the character of the unitary representation
$\overline{\pi}^{\rm{p}}$ is uniquely determined by the character of the
representation $\pi$.
","[{""version"":""v1"",""created"":""Thu, 3 Jul 2014 12:36:33 GMT""},{""version"":""v2"",""created"":""Mon, 4 Aug 2014 19:56:27 GMT""},{""version"":""v3"",""created"":""Mon, 11 Aug 2014 18:40:54 GMT""},{""version"":""v4"",""created"":""Tue, 17 Mar 2015 19:54:21 GMT""}]","2015-03-18"
"1407.0891","Atlas Publications","ATLAS Collaboration","Measurement of the $t\bar{t}$ production cross-section as a function of
  jet multiplicity and jet transverse momentum in 7 TeV proton-proton
  collisions with the ATLAS detector","52 pages plus author list + cover pages (75 pages total), 17 figures,
  13 tables, submitted to JHEP, All figures including auxiliary figures are
  available at
  http://atlas.web.cern.ch/Atlas/GROUPS/PHYSICS/PAPERS/TOPQ-2012-03/","JHEP01(2015)020","10.1007/JHEP01(2015)020","CERN-PH-EP-2014-114","hep-ex","http://arxiv.org/licenses/nonexclusive-distrib/1.0/","  The $t\bar{t}$ production cross-section dependence on jet multiplicity and
jet transverse momentum is reported for proton--proton collisions at a
centre-of-mass energy of 7 TeV in the single-lepton channel. The data were
collected with the ATLAS detector at the CERN Large Hadron Collider and
comprise the full 2011 data sample corresponding to an integrated luminosity of
4.6 fb$^{-1}$. Differential cross-sections are presented as a function of the
jet multiplicity for up to eight jets using jet transverse momentum thresholds
of 25, 40, 60, and 80 GeV, and as a function of jet transverse momentum up to
the fifth jet. The results are shown after background subtraction and
corrections for all detector effects, within a kinematic range closely matched
to the experimental acceptance. Several QCD-based Monte Carlo models are
compared with the results. Sensitivity to the parton shower modelling is found
at the higher jet multiplicities, at high transverse momentum of the leading
jet and in the transverse momentum spectrum of the fifth leading jet. The
MC@NLO+HERWIG MC is found to predict too few events at higher jet
multiplicities.
","[{""version"":""v1"",""created"":""Thu, 3 Jul 2014 12:40:05 GMT""}]","2015-01-15"
"1407.0892","Sebastian Ott","Antonios Antoniadis, Chien-Chung Huang and Sebastian Ott","A Fully Polynomial-Time Approximation Scheme for Speed Scaling with
  Sleep State",,,,,"cs.DS","http://arxiv.org/licenses/nonexclusive-distrib/1.0/","  We study classical deadline-based preemptive scheduling of tasks in a
computing environment equipped with both dynamic speed scaling and sleep state
capabilities: Each task is specified by a release time, a deadline and a
processing volume, and has to be scheduled on a single, speed-scalable
processor that is supplied with a sleep state. In the sleep state, the
processor consumes no energy, but a constant wake-up cost is required to
transition back to the active state. In contrast to speed scaling alone, the
addition of a sleep state makes it sometimes beneficial to accelerate the
processing of tasks in order to transition the processor to the sleep state for
longer amounts of time and incur further energy savings. The goal is to output
a feasible schedule that minimizes the energy consumption. Since the
introduction of the problem by Irani et al. [16], its exact computational
complexity has been repeatedly posed as an open question (see e.g. [2,8,15]).
The currently best known upper and lower bounds are a 4/3-approximation
algorithm and NP-hardness due to [2] and [2,17], respectively. We close the
aforementioned gap between the upper and lower bound on the computational
complexity of speed scaling with sleep state by presenting a fully
polynomial-time approximation scheme for the problem. The scheme is based on a
transformation to a non-preemptive variant of the problem, and a discretization
that exploits a carefully defined lexicographical ordering among schedules.
","[{""version"":""v1"",""created"":""Thu, 3 Jul 2014 12:41:07 GMT""}]","2014-07-04"
