"1407.0716","Eric Morganson","E. Morganson, W. S. Burgett, K. C. Chambers, P. J. Green, N. Kaiser,
  E. A. Magnier, P. J. Marshall, J. S. Morgan, P. A. Price, H.-W. Rix, E. F. S
  Chlafly, J.L. Tonry, F. Walter","Measuring Quasar Variability with Pan-STARRS1 and SDSS",,"The Astrophysical Journal, Volume 784, Issue 2, article id. 92, 16
  pp. (2014)","10.1088/0004-637X/784/2/92",,"astro-ph.HE astro-ph.IM","http://arxiv.org/licenses/nonexclusive-distrib/1.0/","  We measure quasar variability using the Panoramic Survey Telescope and Rapid
Response System 1 Survey (Pan-STARRS1 or PS1) and the Sloan Digital Sky Survey
(SDSS) and establish a method of selecting quasars via their variability in
10,000 square degree surveys. We use 100,000 spectroscopically confirmed
quasars that have been well measured in both PS1 and SDSS and take advantage of
the decadal time scales that separate SDSS measurements and PS1 measurements. A
power law model fits the data well over the entire time range tested, 0.01 to
10 years. Variability in the current PS1-SDSS dataset can efficiently
distinguish between quasars and non-varying objects. It improves the purity of
a griz quasar color cut from 4.1% to 48% while maintaining 67% completeness.
Variability will be very effective at finding quasars in datasets with no u
band and in redshift ranges where exclusively photometric selection is not
efficient. We show that quasars' rest-frame ensemble variability, measured as a
root mean squared in delta magnitudes, is consistent with V(z, L, t) = A0
(1+z)^0.37 (L/L0)^-0.16 (t/1yr)^0.246 , where L0 = 10^46 ergs^-1 and A0 =
0.190, 0.162, 0.147 or 0.141 in the gP1 , rP1 , iP1 or zP1 filter,
respectively. We also fit across all four filters and obtain median variability
as a function of z, L and lambda as V(z, L, lambda, t) = 0.079(1 + z)^0.15
(L/L0 )^-0.2 (lambda/1000 nm)^-0.44 (t/1yr)^0.246 .
","[{""version"":""v1"",""created"":""Wed, 2 Jul 2014 20:28:17 GMT""}]","2015-06-22"
"1407.0717","Lubomir Bourdev","Lubomir Bourdev, Fei Yang, Rob Fergus","Deep Poselets for Human Detection",,,,,"cs.CV","http://arxiv.org/licenses/nonexclusive-distrib/1.0/","  We address the problem of detecting people in natural scenes using a part
approach based on poselets. We propose a bootstrapping method that allows us to
collect millions of weakly labeled examples for each poselet type. We use these
examples to train a Convolutional Neural Net to discriminate different poselet
types and separate them from the background class. We then use the trained CNN
as a way to represent poselet patches with a Pose Discriminative Feature (PDF)
vector -- a compact 256-dimensional feature vector that is effective at
discriminating pose from appearance. We train the poselet model on top of PDF
features and combine them with object-level CNNs for detection and bounding box
prediction. The resulting model leads to state-of-the-art performance for human
detection on the PASCAL datasets.
","[{""version"":""v1"",""created"":""Wed, 2 Jul 2014 20:28:22 GMT""}]","2014-07-04"
"1407.0718","Luan Ghezzi","Luan Ghezzi, Let\'icia Dutra-Ferreira, Diego Lorenzo-Oliveira, Gustavo
  F. Porto de Mello, Bas\'ilio X. Santiago, Nathan De Lee, Brian L. Lee, Luiz
  N. da Costa, Marcio A. G. Maia, Ricardo L. C. Ogando, John P. Wisniewski,
  Jonay I. Gonz\'alez Hern\'andez, Keivan G. Stassun, Scott W. Fleming, Donald
  P. Schneider, Suvrath Mahadevan, Phillip Cargile, Jian Ge, Joshua Pepper, and
  Ji Wang","Accurate Atmospheric Parameters at Moderate Resolution Using Spectral
  Indices: Preliminary Application to the MARVELS Survey","Accepted for publication in AJ. Abstract edited to comply with arXiv
  standards regarding the number of characters",,"10.1088/0004-6256/148/6/105",,"astro-ph.SR","http://arxiv.org/licenses/nonexclusive-distrib/1.0/","  Studies of Galactic chemical and dynamical evolution in the solar
neighborhood depend on the availability of precise atmospheric parameters
(Teff, [Fe/H] and log g) for solar-type stars. Many large-scale spectroscopic
surveys operate at low to moderate spectral resolution for efficiency in
observing large samples, which makes the stellar characterization difficult due
to the high degree of blending of spectral features. While most surveys use
spectral synthesis, in this work we employ an alternative method based on
spectral indices to determine the atmospheric parameters of a sample of nearby
FGK dwarfs and subgiants observed by the MARVELS survey at moderate resolving
power (R~12,000). We have developed three codes to automatically normalize the
observed spectra, measure the equivalent widths of the indices and, through the
comparison of those with values calculated with pre-determined calibrations,
derive the atmospheric parameters of the stars. The calibrations were built
using a sample of 309 stars with precise stellar parameters obtained from the
analysis of high-resolution FEROS spectra. A validation test of the method was
conducted with a sample of 30 MARVELS targets that also have reliable
atmospheric parameters from high-resolution spectroscopic analysis. Our
approach was able to recover the parameters within 80 K for Teff, 0.05 dex for
[Fe/H] and 0.15 dex for log g, values that are lower or equal to the typical
external uncertainties found between different high-resolution analyzes. An
additional test was performed with a subsample of 138 stars from the ELODIE
stellar library and the literature atmospheric parameters were recovered within
125 K for Teff, 0.10 dex for [Fe/H] and 0.29 dex for log g. These results show
that the spectral indices are a competitive tool to characterize stars with the
intermediate resolution spectra.
","[{""version"":""v1"",""created"":""Wed, 2 Jul 2014 20:41:35 GMT""}]","2015-06-22"
"1407.0719","Eric Brown","Rijan Maharjan, Shomeek Mukhopadhyay, Benjamin Allen, Tobias Storz,
  Eric Brown","Constitutive relation for the system-spanning dynamically jammed region
  in response to impact of cornstarch and water suspensions","v3: added more stress data. We removed reflected light intensity
  tracking data which was irreproducible, and retract our claim of a 2nd front.
  v4: Visualization data was moved to a separate paper(arXiv:1709.01133). v5:
  some content was moved to a separate arxiv submission: ""Testing constitutive
  relations by running and walking on cornstarch and water suspensions""","Phys. Rev. E 97, 052602 (2018)","10.1103/PhysRevE.97.052602",,"cond-mat.soft","http://arxiv.org/licenses/nonexclusive-distrib/1.0/","  We experimentally characterize the impact response of concentrated
suspensions consisting of cornstarch and water. We observe that the suspensions
support a large normal stress -- on the order of MPa -- with a delay after the
impactor hits the suspension surface. We show that neither the delay nor the
magnitude of the stress can yet be explained by either standard rheological
models of shear thickening in terms of steady-state viscosities, or impact
models based on added mass or other inertial effects. The stress increase
occurs when a dynamically jammed region of the suspension in front of the
impactor propagates to the opposite boundary of the container, which can
support large stresses when it spans between solid boundaries. We present a
constitutive relation for impact rheology to relate the force on the impactor
to its displacement. This can be described in terms of an effective modulus,
but only after the delay required for the dynamically jammed region to span
between solid boundaries. Both the modulus and the delay are reported as a
function of impact velocity, fluid height, and weight fraction. We report in a
companion paper to this one on the structure of the dynamically jammed region
when it spans between the impactor and the opposite boundary
(arXiv:1709.01133). In a direct follow-up, we show that this constitutive model
can be used to quantitatively predict, for example, the trajectory and
penetration depth of the foot of a person walking or running on cornstarch and
water.
","[{""version"":""v1"",""created"":""Wed, 2 Jul 2014 20:45:31 GMT""},{""version"":""v2"",""created"":""Mon, 7 Jul 2014 14:40:39 GMT""},{""version"":""v3"",""created"":""Wed, 14 Jun 2017 17:28:21 GMT""},{""version"":""v4"",""created"":""Mon, 4 Sep 2017 20:58:34 GMT""},{""version"":""v5"",""created"":""Wed, 25 Oct 2017 21:34:29 GMT""},{""version"":""v6"",""created"":""Thu, 15 Mar 2018 15:52:22 GMT""}]","2018-05-09"
"1407.0720","Hao Lin","Hao Lin, Fei Zhou, Chi-Ping Liu, and Vidvuds Ozolins","Non-Grotthuss Proton Diffusion Mechanism in Tungsten Oxide Dihydrate
  from First-Principles Calculations","Journal of Materials Chemistry A: Materials for Energy and
  Sustainability 07/2014",,"10.1039/C4TA02465F",,"cond-mat.mtrl-sci","http://arxiv.org/licenses/nonexclusive-distrib/1.0/","  Fast proton conduction mechanism is of key importance for achieving high
performance in fuel cell membranes, batteries, supercapacitors, and
electrochromic materials. Enhanced proton diffusion is often observed in
hydrated materials where it is thought to occur via the famous Grotthuss
mechanism through pathways formed by structural water. Using first-principles
density-functional theory calculations, we demonstrate that proton diffusion in
tungsten oxide dihydrate (WO$_{3}$.2H$_{2}$O), a known good proton conductor,
takes place within the layers of corner-sharing WO$_{6}$ octahedra without
direct involvement of structural water. The calculated proton migration barrier
in WO$_{3}$.2H$_{2}$O (0.42 eV) is in good agreement with the experimental
value inferred from the temperature dependence of conductivity (0.36 eV). The
preferred proton diffusion path in WO$_{3}$.2H$_{2}$O is essentially the same
as in $\gamma$-WO$_{3}$, and we find an activation energy of 0.35 eV for the
latter, which agrees well with the experimental values. In contrast to the
small intercalation voltages calculated for WO$_{3}$ and WO$_{3}$.2H$_{2}$O, we
find that proton absorption in the monohydrate WO$_{3}$.H$_{2}$O is
energetically highly favorable, corresponding to voltages in excess of 1 eV in
the dilute limit. However, strong proton-proton repulsion limits the
equilibrium H content at zero voltage. We find a fast one-dimensional diffusion
channel in WO$_{3}$.H$_{2}$O with an activation energy of only 0.07 eV at
dilute proton concentrations, but much higher barriers are expected at
near-equilibrium concentrations due to strong repulsive interactions with other
protons. Our results illustrate that low proton diffusion barriers and low
insertion voltages both contribute to fast proton transport in bulk
WO$_{3}$.2H$_{2}$O and $\gamma$-WO$_{3}$.
","[{""version"":""v1"",""created"":""Wed, 2 Jul 2014 20:46:13 GMT""}]","2014-07-04"
"1407.0721","Jorge  Zavala","J. A. Zavala, I. Aretxaga, D. H. Hughes","The redshift distribution of submillimetre galaxies at different
  wavelengths","Final version to appear in MNRAS","MNRAS, 443, 2384-2390 (2014)","10.1093/mnras/stu1330",,"astro-ph.GA","http://arxiv.org/licenses/nonexclusive-distrib/1.0/","  Using simulations we demonstrate that some of the published redshift
distributions of submillimetre galaxies (SMGs) at different wavelengths, which
were previously reported to be statistically different, are consistent with a
parent distribution of the same population of galaxies. The redshift
distributions which peak at z_med=2.9, 2.6, 2.2, 2.2, and 2.0 for galaxies
selected at 2 and 1.1 mm, and 870, 850, and 450 um respectively, can be derived
from a single parent redshift distribution, in contrast with previous studies.
The differences can be explained through wavelength selection, depth of the
surveys, and to a lesser degree, angular resolution. The main differences are
attributed to the temperature of the spectral energy distributions, as
shorter-wavelength maps select a hotter population of galaxies. Using the same
parent distribution and taking into account lensing bias we can also reproduce
the redshift distribution of 1.4 mm-selected ultra-bright galaxies, which peaks
at z_med=3.4. However, the redshift distribution of 450 um-selected galaxies in
the deepest surveys, which peaks at z_med=1.4, cannot be reproduced from the
same parent population with just these selection effects. In order to explain
this distribution we have to add another population of galaxies or include
different selection biases.
","[{""version"":""v1"",""created"":""Wed, 2 Jul 2014 20:46:45 GMT""},{""version"":""v2"",""created"":""Thu, 31 Jul 2014 20:16:17 GMT""}]","2014-08-04"
"1407.0722","Jian-Xin Zhu Dr.","Jian-Xin Zhu, Xiao-Dong Wen, J. T. Haraldsen, Mi He, C. Panagopoulos,
  Elbert E. M. Chia","Induced Ferromagnetism at BiFeO3/YBa2Cu3O7 Interfaces","13 pages, 4 figures","Sci. Rep. 4, 5368 (2014)","10.1038/srep05368",,"cond-mat.str-el cond-mat.mtrl-sci","http://arxiv.org/licenses/nonexclusive-distrib/1.0/","  Transition metal oxides (TMOs) exhibit many emergent phenomena ranging from
high-temperature superconductivity and giant magnetoresistance to magnetism and
ferroelectricity. In addition, when TMOs are interfaced with each other, new
functionalities can arise, which are absent in individual components. Here, we
report results from first-principles calculations on the magnetism at the
BiFeO3/YBa2Cu3O7 interfaces. By comparing the total energy for various magnetic
spin configurations inside BiFeO3, we are able to show that a metallic
ferromagnetism is induced near the interface. We further develop an interface
exchange-coupling model and place the extracted exchange coupling interaction
strengths, from the first-principles calculations, into a resultant generic
phase diagram. Our conclusion of interfacial ferromagnetism is confirmed by the
presence of a hysteresis loop in field-dependent magnetization data. The
emergence of interfacial ferromagnetism should have implications to electronic
and transport properties.
","[{""version"":""v1"",""created"":""Wed, 2 Jul 2014 20:48:19 GMT""}]","2014-07-04"
"1407.0723","Jian-Xin Zhu Dr.","S. Singh, J. T. Haraldsen, J. Xiong, E. M. Choi, P. Lu, D. Yi, X.-D.
  Wen, J. Liu, H. Wang, Z. Bi, P. Yu, M. R. Fitzsimmons, J. L.
  MacManus-Driscoll, R. Ramesh, A. V. Balatsky, Jian-Xin Zhu, Q. X. Jia","Induced magnetization in La$_{0.7}$Sr$_{0.3}$MnO$_3$/BiFeO$_3$
  superlattices","5 pages, 4 figures, with Supplemental Materials. To appear in
  Physical Review Letters",,"10.1103/PhysRevLett.113.047204",,"cond-mat.str-el","http://arxiv.org/licenses/nonexclusive-distrib/1.0/","  Using polarized neutron reflectometry (PNR), we observe an induced
magnetization of 75$\pm$ 25 kA/m at 10 K in a La$_{0.7}$Sr$_{0.3}$MnO$_3$
(LSMO)/BiFeO$_3$ superlattice extending from the interface through several
atomic layers of the BiFeO$_3$ (BFO). The induced magnetization in BFO is
explained by density functional theory, where the size of bandgap of BFO plays
an important role. Considering a classical exchange field between the LSMO and
BFO layers, we further show that magnetization is expected to extend throughout
the BFO, which provides a theoretical explanation for the results of the
neutron scattering experiment.
","[{""version"":""v1"",""created"":""Wed, 2 Jul 2014 20:49:06 GMT""}]","2015-06-22"
"1407.0724","Benjamin Pope","Benjamin Pope, Niranjan Thatte, Rick Burruss, Matthias Tecza, Fraser
  Clarke, Garret Cotter","Wavefront sensing from the image domain with the Oxford-SWIFT integral
  field spectrograph","8 Pages, 3 Figures, submitted to SPIE Astronomical Telescopes and
  Instrumentation 2014",,"10.1117/12.2055334",,"astro-ph.IM","http://arxiv.org/licenses/nonexclusive-distrib/1.0/","  The limits for adaptive-optics (AO) imaging at high contrast and high
resolution are determined by residual phase errors from non-common-path
aberrations not sensed by the wavefront sensor, especially for integral field
spectrographs, where phase diversity techniques are complicated by the image
slicer. We present the first application of kernel phase-based wavefront
sensing to ground-based AO, where an asymmetric pupil mask and a single image
are sufficient to map aberrations up to high order. We push toward internally
diffraction-limited performance with the Oxford-SWIFT integral field
spectrograph coupled with the PALM-3000 extreme AO system on the Palomar
200-inch telescope. This represents the first observation in which the
PALM-3000 + SWIFT internal point-spread-function has closely approached the
Airy pattern. While this can only be used on SWIFT with an internal stimulus
source, as at short wavelengths the uncorrected atmospheric wavefront errors
are still > 1 radian, this nevertheless demonstrates the feasibility of
detecting non-common-path errors with this method as an active optics paradigm
for near-infrared, AO-corrected instruments at Palomar. We note that this is a
particularly promising approach for correcting integral field spectrographs, as
the diversity of many narrowband images provides strong constraints on the
wavefront error estimate, and the average of reconstructions from many narrow
bands can be used to improve overall reconstruction quality.
","[{""version"":""v1"",""created"":""Wed, 2 Jul 2014 21:17:24 GMT""}]","2015-06-22"
"1407.0725","Hanan Dery","Yang Song, Oleg Chalaev, Hanan Dery","Donor-driven spin relaxation in multi-valley semiconductors","4 pages of main text, 7 pages of appendices, 2 Figures","Phys. Rev. Lett. 113, 167201 (2014)","10.1103/PhysRevLett.113.167201",,"cond-mat.mtrl-sci cond-mat.mes-hall","http://arxiv.org/licenses/nonexclusive-distrib/1.0/","  We present a theory for spin relaxation of electrons due to scattering off
the central-cell potential of impurities in silicon. Taking into account the
multivalley nature of the conduction band and the violation of translation
symmetry, the spin-flip amplitude is dominated by this short-range impurity
scattering after which the electron is transferred to a valley on a different
axis in $k$-space (the so called $f$-process). These $f$-processes dominate the
spin relaxation at all temperatures, where scattering off the impurity
central-cell dominate at low temperatures, and scattering with $\Sigma$-axis
phonons at elevated temperatures. To the best of our knowledge, the theory is
the first to explain and accurately quantify the empirically-found dependence
of spin relaxation on the impurity identity. Accordingly, the new formalism
fills a longstanding gap in the spin relaxation theory of $n$-type silicon, and
it is valuable for characterization of silicon-based spintronic devices.
","[{""version"":""v1"",""created"":""Wed, 2 Jul 2014 21:27:15 GMT""}]","2014-10-14"
"1407.0726","Yao Xie","Yang Cao and Yao Xie","Fast Algorithm for Low-rank matrix recovery in Poisson noise","Presented at IEEE GLOBALSIP2014",,,,"stat.ML cs.LG math.ST stat.TH","http://arxiv.org/licenses/nonexclusive-distrib/1.0/","  This paper describes a fast algorithm for recovering low-rank matrices from
their linear measurements contaminated with Poisson noise: the Poisson noise
Maximum Likelihood Singular Value thresholding (PMLSV) algorithm. We propose a
convex optimization formulation with a cost function consisting of the sum of a
likelihood function and a regularization function which the nuclear norm of the
matrix. Instead of solving the optimization problem directly by semi-definite
program (SDP), we derive an iterative singular value thresholding algorithm by
expanding the likelihood function. We demonstrate the good performance of the
proposed algorithm on recovery of solar flare images with Poisson noise: the
algorithm is more efficient than solving SDP using the interior-point algorithm
and it generates a good approximate solution compared to that solved from SDP.
","[{""version"":""v1"",""created"":""Wed, 2 Jul 2014 21:27:23 GMT""},{""version"":""v2"",""created"":""Fri, 19 Dec 2014 20:11:13 GMT""}]","2014-12-22"
"1407.0727","Lillian Ratliff","Ioannis C. Konstantakopoulos, Lillian J. Ratliff, Ming Jin, S. Shankar
  Sastry, and Costas Spanos","Social Game for Building Energy Efficiency: Utility Learning,
  Simulation, and Analysis",,,,,"math.OC cs.GT","http://arxiv.org/licenses/nonexclusive-distrib/1.0/","  We describe a social game that we designed for encouraging energy efficient
behavior amongst building occupants with the aim of reducing overall energy
consumption in the building. Occupants vote for their desired lighting level
and win points which are used in a lottery based on how far their vote is from
the maximum setting. We assume that the occupants are utility maximizers and
that their utility functions capture the tradeoff between winning points and
their comfort level. We model the occupants as non-cooperative agents in a
continuous game and we characterize their play using the Nash equilibrium
concept. Using occupant voting data, we parameterize their utility functions
and use a convex optimization problem to estimate the parameters. We simulate
the game defined by the estimated utility functions and show that the estimated
model for occupant behavior is a good predictor of their actual behavior. In
addition, we show that due to the social game, there is a significant reduction
in energy consumption.
","[{""version"":""v1"",""created"":""Wed, 2 Jul 2014 21:27:33 GMT""},{""version"":""v2"",""created"":""Sat, 5 Jul 2014 18:15:20 GMT""}]","2014-07-08"
"1407.0728","Hong Lu","Wei-Jian Geng and H. Lu","Isotropic Expansion of Inhomogeneous Universe","Latex, 8 pages, polishing before journal submission and references
  added","Phys. Rev. D 90, 083511 (2014)","10.1103/PhysRevD.90.083511",,"hep-th gr-qc","http://arxiv.org/licenses/nonexclusive-distrib/1.0/","  We propose a cosmological model that describes isotropic expansion of
inhomogeneous universe. The energy-momentum tensor that creates the spatial
inhomogeneity may not affect the uniform expansion scaling factor $a(t)$ in the
FLRW-like metrics. Such energy-momentum tensor may not be exotic; in fact any
linear or non-linear $\sigma$-model has this feature. We show that the
classical spatial inhomogeneity can be embedded in both inflation models and
the traditional cosmological expansion by perfect fluid. The spatial
inhomogeneity resembles the primordial quantum perturbation that was frozen in
the co-moving frame. We obtain some exact inhomogeneous solutions with
spherical or axial symmetries. We also show that some of our cosmological
models can be viewed as the dynamical black hole formation.
","[{""version"":""v1"",""created"":""Wed, 2 Jul 2014 21:36:19 GMT""},{""version"":""v2"",""created"":""Sun, 13 Jul 2014 08:24:36 GMT""}]","2014-10-15"
"1407.0729","Satoshi Egi","Satoshi Egi","Non-Linear Pattern-Matching against Unfree Data Types with Lexical
  Scoping","25 pages, 3 figures",,,,"cs.PL","http://arxiv.org/licenses/nonexclusive-distrib/1.0/","  This paper proposes a pattern-matching system that enables non-linear
pattern-matching against unfree data types. The system allows multiple
occurrences of the same variables in a pattern, multiple results of
pattern-matching and modularization of the way of pattern-matching for each
data type at the same time. It enables us to represent pattern-matching against
not only algebraic data types but also unfree data types such as sets, graphs
and any other data types whose data have no canonical form and multiple ways of
decomposition. I have realized that with a rule that pattern-matching is
executed from the left side of a pattern and a rule that a binding to a
variable in a pattern can be referred to in its right side of the pattern.
Furthermore, I have realized modularization of these patterns with lexical
scoping. In my system, a pattern is not a first class object, but a
pattern-function that obtains only patterns and returns a pattern is a first
class object. This restriction simplifies the non-linear pattern-matching
system with lexical scoping. I have already implemented the pattern-matching
system in the Egison programming language.
","[{""version"":""v1"",""created"":""Wed, 2 Jul 2014 21:42:02 GMT""},{""version"":""v2"",""created"":""Wed, 9 Jul 2014 01:29:10 GMT""},{""version"":""v3"",""created"":""Tue, 2 Sep 2014 10:20:54 GMT""},{""version"":""v4"",""created"":""Thu, 11 Sep 2014 15:07:25 GMT""},{""version"":""v5"",""created"":""Thu, 16 Oct 2014 14:01:45 GMT""},{""version"":""v6"",""created"":""Fri, 17 Oct 2014 16:36:46 GMT""}]","2014-10-20"
