"1412.6858","Jingwei Liang","Jingwei Liang, Jalal Fadili, Gabriel Peyr\'e, Russell Luke","Activity Identification and Local Linear Convergence of
  Douglas--Rachford/ADMM under Partial Smoothness","17 pages, 1 figure, published in the proceedings of the Fifth
  International Conference on Scale Space and Variational Methods in Computer
  Vision",,,,"math.OC","http://arxiv.org/licenses/nonexclusive-distrib/1.0/","  Convex optimization has become ubiquitous in most quantitative disciplines of
science, including variational image processing. Proximal splitting algorithms
are becoming popular to solve such structured convex optimization problems.
Within this class of algorithms, Douglas--Rachford (DR) and alternating
direction method of multipliers (ADMM) are designed to minimize the sum of two
proper lower semi-continuous convex functions whose proximity operators are
easy to compute. The goal of this work is to understand the local convergence
behaviour of DR (resp. ADMM) when the involved functions (resp. their
Legendre-Fenchel conjugates) are moreover partly smooth. More precisely, when
both of the two functions (resp. their conjugates) are partly smooth relative
to their respective manifolds, we show that DR (resp. ADMM) identifies these
manifolds in finite time. Moreover, when these manifolds are affine or linear,
we prove that DR/ADMM is locally linearly convergent. When $J$ and $G$ are
locally polyhedral, we show that the optimal convergence radius is given in
terms of the cosine of the Friedrichs angle between the tangent spaces of the
identified manifolds. This is illustrated by several concrete examples and
supported by numerical experiments.
","[{""version"":""v1"",""created"":""Mon, 22 Dec 2014 01:29:57 GMT""},{""version"":""v2"",""created"":""Tue, 6 Jan 2015 13:15:38 GMT""},{""version"":""v3"",""created"":""Wed, 21 Jan 2015 22:20:31 GMT""},{""version"":""v4"",""created"":""Tue, 27 Jan 2015 09:43:50 GMT""},{""version"":""v5"",""created"":""Tue, 3 Mar 2015 18:26:23 GMT""},{""version"":""v6"",""created"":""Wed, 1 Jul 2015 16:47:09 GMT""},{""version"":""v7"",""created"":""Fri, 31 Jul 2015 00:48:25 GMT""}]","2015-08-03"
"1412.6859","Song-Sun Lin","Wen-Guei Hu and Song-Sun Lin","Justifications of spatial entropies of multi-dimensional symbolic
  dynamical systems",,,,,"math.DS","http://arxiv.org/licenses/nonexclusive-distrib/1.0/","  The commonly used spatial entropy $h_{r}(\mathcal{U})$ of the
multi-dimensional shift space $\mathcal{U}$ is the limit of growth rate of
admissible local patterns on finite rectangular sublattices which expands to
whole space $\mathbb{Z}^{d}$, $d\geq 2$. This work studies spatial entropy
$h_{\Omega}(\mathcal{U})$ of shift space $\mathcal{U}$ on general expanding
system $\Omega=\{\Omega(n)\}_{n=1}^{\infty}$ where $\Omega(n)$ is increasing
finite sublattices and expands to $\mathbb{Z}^{d}$. $\Omega$ is called
genuinely $d$-dimensional if $\Omega(n)$ contains no lower-dimensional part
whose size is comparable to that of its $d$-dimensional part. We show that
$h_{r}(\mathcal{U})$ is the supremum of $h_{\Omega}(\mathcal{U})$ for all
genuinely two-dimensional $\Omega$. Furthermore, when $\Omega$ is genuinely
$d$-dimensional and satisfies certain conditions, then
$h_{\Omega}(\mathcal{U})=h_{r}(\mathcal{U})$. On the contrary, when $\Omega(n)$
contains a lower-dimensional part, then
$h_{r}(\mathcal{U})<h_{\Omega}(\mathcal{U})$ for some $\mathcal{U}$. Therefore,
$h_{r}(\mathcal{U})$ is appropriate to be the $d$-dimensional spatial entropy.
","[{""version"":""v1"",""created"":""Mon, 22 Dec 2014 01:32:14 GMT""}]","2014-12-23"
"1412.6860","Andriy Olenko","Vo Anh, Nikolai Leonenko, Andriy Olenko","On the rate of convergence to Rosenblatt-type distribution","25 pages, 2 figures, typos corrected",,"10.1016/j.jmaa.2014.12.016",,"math.PR","http://arxiv.org/licenses/nonexclusive-distrib/1.0/","  The main result of the article is the rate of convergence to the
Rosenblatt-type distributions in non-central limit theorems. Specifications of
the main theorem are discussed for several scenarios. In particular, special
attention is paid to the Cauchy, generalized Linnik's, and local-global
distinguisher random processes and fields. Direct analytical methods are used
to investigate the rate of convergence in the uniform metric.
","[{""version"":""v1"",""created"":""Mon, 22 Dec 2014 02:16:50 GMT""},{""version"":""v2"",""created"":""Wed, 15 Jun 2016 00:09:39 GMT""}]","2016-06-16"
"1412.6861","Kazuhiro Hada","K. Hada, M. Giroletti, M. Kino, G. Giovannini, F. D'Ammando, C. C.
  Cheung, M. Beilicke, H. Nagai, A. Doi, K. Akiyama, M. Honma, K. Niinuma, C.
  Casadio, M. Orienti, H. Krawczynski, J. L. Gomez, S. Sawada-Satoh, S. Koyama,
  A. Cesarini, S. Nakahara and M. A. Gurwell","A strong radio brightening at the jet base of M87 during the elevated
  very-high-energy gamma-ray state in 2012","To appear in the Proceedings of the IAU Symposium No. 313:
  ""Extragalactic jets from every angle,"" Galapagos, Ecuador, 15-19 September
  2014, F. Massaro, C. C. Cheung, E. Lopez, and A. Siemiginowska (Eds.),
  Cambridge University Press",,"10.1017/S174392131500246X",,"astro-ph.HE","http://arxiv.org/licenses/nonexclusive-distrib/1.0/","  The nearby radio galaxy M87 offers a unique opportunity for exploring the
connection between gamma-ray production and jet formation at an unprecedented
linear resolution. However, the origin and location of the gamma-rays in this
source is still elusive. Based on previous radio/TeV correlation events, the
unresolved jet base (radio core) and the peculiar knot HST-1 at >120 pc from
the nucleus are proposed as candidate site(s) of gamma-ray production. Here we
report our intensive, high-resolution radio monitoring observations of the M87
jet with the VLBI Exploration of Radio Astrometry (VERA) and the European VLBI
Network (EVN) from February 2011 to October 2012. During this period, an
elevated level of the M87 flux is reported at TeV with VERITAS. We detected a
remarkable flux increase in the radio core with VERA at 22/43 GHz coincident
with the VHE activity. Meanwhile, HST-1 remained quiescent in terms of its flux
density and structure at radio. These results strongly suggest that the TeV
gamma-ray activity in 2012 originates in the jet base within 0.03 pc
(projected) from the central supermassive black hole.
","[{""version"":""v1"",""created"":""Mon, 22 Dec 2014 02:32:51 GMT""}]","2015-06-23"
"1412.6862","Jongmyon Kim","Shohidul Islam, Cheol-Hong Kim, and Jong-Myon Kim","Computationally Efficient Implementation of a Hamming Code Decoder using
  a Graphics Processing Unit","6 pages, 8 figures, Journal of Communications and Networks",,,,"cs.DC cs.IT math.IT","http://arxiv.org/licenses/nonexclusive-distrib/1.0/","  This paper presents a computationally efficient implementation of a Hamming
code decoder on a graphics processing unit (GPU) to support real-time
software-defined radio (SDR), which is a software alternative for realizing
wireless communication. The Hamming code algorithm is challenging to
parallelize effectively on a GPU because it works on sparsely located data
items with several conditional statements, leading to non-coalesced, long
latency, global memory access, and huge thread divergence. To address these
issues, we propose an optimized implementation of the Hamming code on the GPU
to exploit the higher parallelism inherent in the algorithm. Experimental
results using a compute unified device architecture (CUDA)-enabled NVIDIA
GeForce GTX 560, including 335 cores, revealed that the proposed approach
achieved a 99x speedup versus the equivalent CPU-based implementation.
","[{""version"":""v1"",""created"":""Mon, 22 Dec 2014 03:00:38 GMT""}]","2014-12-23"
"1412.6863","In\^es Aniceto","Michael C. Abbott, In\^es Aniceto","An improved AFS phase for AdS3 string integrability","7 pages","Phys. Lett. B 743 (2015) 61-65","10.1016/j.physletb.2015.02.016",,"hep-th","http://arxiv.org/licenses/nonexclusive-distrib/1.0/","  We propose a number of modifications to the classical term in the dressing
phase for integrable strings in AdS3 x S3 x S3 x S1, and check these against
existing perturbative calculations, crossing symmetry, and the semiclassical
limit of the Bethe equations. The principal change is that the phase for
different masses should start with a term Q_1 Q_2, like the one-loop AdS3
dressing phase, rather than Q_2 Q_3 as for the original AdS5 AFS phase.
","[{""version"":""v1"",""created"":""Mon, 22 Dec 2014 03:10:14 GMT""}]","2015-03-04"
"1412.6864","Mattias Johnsson","Mattias T. Johnsson, Gavin K. Brennen, and Jason Twamley","Macroscopic superpositions and gravimetry with quantum magnetomechanics",,,,,"quant-ph","http://arxiv.org/licenses/nonexclusive-distrib/1.0/","  We utilise a magneto-mechanical levitated massive resonator in the quantum
regime to prepare highly macroscopic quantum superposition states. Using these
macroscopic superpositions we present a novel interferometry protocol to
perform absolute gravimetry with a sensitivity that exceeds state of the art
atom-interferometric and corner-cube gravimeters by a factor of 20. In
addition, our scheme allows probing the gravitational field on a length scale
eight orders of magnitude smaller than other methods.
","[{""version"":""v1"",""created"":""Mon, 22 Dec 2014 03:35:36 GMT""}]","2014-12-23"
"1412.6865","Zhonglue Wen","Z. L. Wen and J. L. Han","Dependence of the bright end of galaxy luminosity function on cluster
  dynamical state","7 pages, 5 figures, 1 table, accepted for publication in MNRAS",,"10.1093/mnras/stu2722",,"astro-ph.GA","http://arxiv.org/licenses/nonexclusive-distrib/1.0/","  Luminosity function of cluster galaxies provides a fundamental constraint on
galaxy evolution in cluster environments. By using the bright member galaxies
of a large sample of rich clusters identified from Sloan Digital Sky Survey, we
obtain the bright end of composite luminosity functions of cluster galaxies,
and study their dependence on cluster dynamical state. After a
redshift-evolution correction of absolute magnitude, the luminosity function of
member galaxies can be well fitted by a Schechter function when the brightest
cluster galaxies (BCGs) are excluded. The absolute magnitudes of BCGs follow a
Gaussian function with a characteristic width of about 0.36 mag. We find that
the luminosity function of galaxies in more relaxed clusters has a fainter
characteristic absolute magnitude (M_{\ast}), and these clusters have fewer
bright non-BCG member galaxies but a brighter BCG. Our results suggest the
co-evolution of galaxy population with cluster dynamical state and somewhat
support the hierarchical formation scenario of the BCGs.
","[{""version"":""v1"",""created"":""Mon, 22 Dec 2014 03:51:28 GMT""}]","2015-06-23"
"1412.6866","Francisco A. Brito","D. Bazeia, F.A. Brito, and F.G. Costa","Induced higher-derivative massive gravity on a 2-brane in 4D Minkowski
  space","Latex, 12 pages, no figure; refs added, version to appear in PLB","Phys. Lett. B 742 (2015) 317","10.1016/j.physletb.2015.01.051",,"hep-th gr-qc","http://arxiv.org/licenses/nonexclusive-distrib/1.0/","  In this paper we revisit the problem of localizing gravity in a 2-brane
embedded in a 4D Minkowski space to address induction of high derivative
massive gravity. We explore the structure of propagators to find well-behaved
higher-derivative massive gravity induced on the brane. Exploring a special
case in the generalized mass term of the graviton propagator we find a model of
consistent higher order gravity with an additional unitary massive spin-2
particle and two massless particles: one spin-0 particle and one spin-1
particle. The condition for the absence of tachyons is satisfied for both
`right' and `wrong' signs of the Einstein-Hilbert term on the 2-brane. We also
find the Pauli-Fierz mass term added to the new massive gravity in three
dimensions and recover the low dimensional DGP model.
","[{""version"":""v1"",""created"":""Mon, 22 Dec 2014 04:28:05 GMT""},{""version"":""v2"",""created"":""Sat, 31 Jan 2015 23:22:35 GMT""}]","2015-02-25"
"1412.6867","Takuma Akimoto","Takuma Akimoto, Masaki Nakagawa, Soya Shinkai, and Yoji Aizawa","Generalized Lyapunov exponent as a unified characterization of dynamical
  instabilities","8 pages, 4 figures",,"10.1103/PhysRevE.91.012926",,"nlin.CD math.DS","http://arxiv.org/licenses/nonexclusive-distrib/1.0/","  The Lyapunov exponent characterizes an exponential growth rate of the
difference of nearby orbits. A positive Lyapunov exponent is a manifestation of
chaos. Here, we propose the Lyapunov pair, which is based on the generalized
Lyapunov exponent, as a unified characterization of non-exponential and
exponential dynamical instabilities in one-dimensional maps. Chaos is
classified into three different types, i.e., super-exponential, exponential,
and sub-exponential dynamical instabilities. Using one-dimensional maps, we
demonstrate super-exponential and sub-exponential chaos and quantify the
dynamical instabilities by the Lyapunov pair. In sub-exponential chaos, we show
super-weak chaos, which means that the growth of the difference of nearby
orbits is slower than a stretched exponential growth. The scaling of the growth
is analytically studied by a recently developed theory of a continuous
accumulation process, which is related to infinite ergodic theory.
","[{""version"":""v1"",""created"":""Mon, 22 Dec 2014 04:38:31 GMT""}]","2015-06-23"
"1412.6868","Renato Fabbri","Renato Fabbri","Ensaio sobre o Auto-Aproveitamento: um relato de investidas naturais na
  participa\c{c}\~ao social","in Portuguese",,,,"physics.soc-ph","http://creativecommons.org/licenses/publicdomain/","  The use of digital traces of our social structures and activities is a
reality for some companies and State instances. The exploitation by the
individual and by Society is still incipient. This writing is a brief account
of an immersion to advance this civil empowerment, beginning with experiments
for collection and dissemination of information, and going through social
structures streaming, resource recommendation via complex networks and natural
language processing, linked data and ontological organizations of social and
participatory structures.
  Keywords: complex networks, natural language processing, linked data, social
participation, anthropological physics
","[{""version"":""v1"",""created"":""Mon, 22 Dec 2014 04:46:20 GMT""},{""version"":""v2"",""created"":""Mon, 18 May 2015 16:16:17 GMT""}]","2015-05-19"
"1412.6869","Eun-jong Kim","Eun-jong Kim, J. R. Johansson, Franco Nori","Circuit analog of quadratic optomechanics","18 pages, 14 figures","Phys. Rev. A 91, 033835 (2015)","10.1103/PhysRevA.91.033835",,"quant-ph","http://arxiv.org/licenses/nonexclusive-distrib/1.0/","  We propose a superconducting electrical circuit that simulates a quadratic
optomechanical system. A capacitor placed between two transmission-line (TL)
resonators acts like a semi-transparent membrane, and a superconducting quantum
interference device (SQUID) that terminates a TL resonator behaves like a
movable mirror. Combining these circuit elements, it is possible to simulate a
quadratic optomechanical coupling whose coupling strength is determined by the
coupling capacitance and the tunable bias flux through the SQUIDs. Estimates
using realistic parameters suggest that an improvement in the coupling strength
could be realized, to five orders of magnitude from what has been observed in
membrane-in-the-middle cavity optomechanical systems. This leads to the
possibility of achieving the strong-coupling regime of quadratic optomechanics.
","[{""version"":""v1"",""created"":""Mon, 22 Dec 2014 04:58:23 GMT""}]","2015-04-08"
"1412.6870","Kabgyun Jeong","Kabgyun Jeong, Jaewan Kim, and Su-Yong Lee","Gaussian private quantum channel with squeezed coherent states","7 pages, 2 figures","Scientific Reports 5, 13974 (2015)","10.1038/srep13974",,"quant-ph","http://arxiv.org/licenses/nonexclusive-distrib/1.0/","  While the objective of conventional quantum key distribution (QKD) is to
secretly generate and share the classical bits concealed in the form of
maximally mixed quantum states, that of private quantum channel (PQC) is to
secretly transmit individual quantum states concealed in the form of maximally
mixed states using shared one-time pad and it is called Gaussian private
quantum channel (GPQC) when the scheme is in the regime of continuous
variables. We propose a GPQC enhanced with squeezed coherent states (GPQCwSC),
which is a generalization of GPQC with coherent states only (GPQCo) [Phys. Rev.
A 72, 042313 (2005)]. We show that GPQCwSC beats the GPQCo for the upper bound
on accessible information. As a subsidiary example, it is shown that the
squeezed states take an advantage over the coherent states against a beam
splitting attack in a continuous variable QKD. It is also shown that a
squeezing operation can be approximated as a superposition of two different
displacement operations in the small squeezing regime.
","[{""version"":""v1"",""created"":""Mon, 22 Dec 2014 05:05:26 GMT""},{""version"":""v2"",""created"":""Mon, 14 Sep 2015 11:22:38 GMT""}]","2015-09-15"
"1412.6871","Heming Jiao","Heming Jiao and Tingting Wang","The Dirichlet problem for a class of Hessian type equations",,,,,"math.AP","http://arxiv.org/licenses/nonexclusive-distrib/1.0/","  We are concerned with the Dirichlet problem for a class of Hessian type
equations. Applying some new methods we are able to establish the $C^2$
estimates for an approximating problem under essentially optimal structure
conditions. Based on these estimates, the existence of classical solutions is
proved.
","[{""version"":""v1"",""created"":""Mon, 22 Dec 2014 05:09:04 GMT""},{""version"":""v2"",""created"":""Thu, 5 May 2016 13:19:32 GMT""}]","2016-05-06"
"1412.6872","Alexandra Friesen","A. V. Friesen, Yu. L. Kalinovsky, V. D. Toneev","Impact of the vector interaction on the phase structure of QCD matter","9 pages, 12 figures. arXiv admin note: text overlap with
  arXiv:1006.3648 by other authors",,"10.1142/S0217751X1550089X",,"hep-ph","http://arxiv.org/licenses/nonexclusive-distrib/1.0/","  The 2-flavor Polyakov-loop extended model is generalized by taking into
account the effective four-quark vector-type interaction with the coupling
strengths, which are endowed with a dependence on the Polyakov field $\Phi$.
The effective vertex generates entanglement interaction between the Polyakov
loop and the chiral condensate. We investigate the influence of an additional
quark vector interaction and the entanglement interaction on the location of
the critical end-point at the given chemical potential or quark density. It is
shown that the finite value of the vector interaction strength $G_{\rm v}$
improves the model agreement with the lattice data. The influence of the
non-zero $G_{\rm v}$ and entanglement on the thermodynamic observables and the
curvature of the crossover boundary in the $T-\mu$ plane is also examined.
","[{""version"":""v1"",""created"":""Mon, 22 Dec 2014 05:10:04 GMT""}]","2016-08-17"
"1412.6873","Takashi Tsuji","Takashi Tsuji, Tadashi Nakajima, Yoichi Takeda","Near Infrared Spectroscopy of M Dwarfs. II. H2O Molecule as an Abundance
  Indicator of Oxygen","35 pages, 18 figures, 9 tables + 2 tables for electronic version
  only, Corrected typos, accepted by PASJ",,"10.1093/pasj/psu160",,"astro-ph.SR","http://arxiv.org/licenses/nonexclusive-distrib/1.0/","  Based on the near infrared spectra (R~20000) of M dwarfs, oxygen abundances
are determined from the ro-vibrational lines of H2O. Although H2O lines in M
dwarfs are badly blended each other and the continuum levels are depressed
appreciably by the collective effect of numerous H2O lines themselves,
quantitative analysis of H2O lines has been carried out by referring to the
pseudo-continua both on the observed and theoretical spectra. For this purpose,
the pseudo-continuum on the theoretical spectrum has been evaluated by the use
of the recent high-precision H2O line-list. Then, we propose a simple and
flexible method of analyzing equivalent widths (EWs) of blended features by the
use of a mini curve-of-growth (CG), which is a small portion of the usual CG
around the observed EW. The mini CG is generated by using the theoretical EWs
evaluated from the synthetic spectrum by exactly the same way as the EWs are
measured from the observed spectrum. The observed EW is converted to the
abundance by the use of the mini CG, and the process is repeated for all the
observed EWs line-by-line or blend-by-blend. In cool M dwarfs, almost all the
oxygen atoms left after CO formation are in stable H2O molecules, which suffer
little change for the uncertainties due to imperfect modelling of the
photospheres. Then the numerous H2O lines are excellent abundance indicators of
oxygen. The oxygen abundances are determined to be logAo between -3.5 and -3.0
in 38 M dwarfs. The resulting O/C ratios plotted against logAc appear to be
systematically smaller in the carbon-rich M dwarfs, showing the different
formation histories of oxygen and carbon in the chemical evolution of the
Galactic disk. Also, O/Fe ratios in most M dwarfs are closer to the solar O/Fe
ratio based on the classical high oxygen abundance rather than on the recently
downward revised low value.
","[{""version"":""v1"",""created"":""Mon, 22 Dec 2014 05:18:20 GMT""},{""version"":""v2"",""created"":""Tue, 30 Dec 2014 11:21:57 GMT""}]","2015-06-23"
"1412.6874","Tingting Wang","Tingting Wang, WeiSong Dong, Gejun Bao","A priori estimates for the obstacle problem of Hessian type equations on
  Riemannian manifolds",,,,,"math.AP","http://arxiv.org/licenses/nonexclusive-distrib/1.0/","  We are concerned with a priori estimates for the obstacle problem of a wide
class of fully nonlinear equations on Riemannian manifolds. We use new
techniques introduced by Bo Guan and derive new results for a priori second
order estimates of its singular perturbation problem under fairly general
conditions. By approximation, the existence of a C^{1,1} viscosity solution is
proved.
","[{""version"":""v1"",""created"":""Mon, 22 Dec 2014 05:29:04 GMT""},{""version"":""v2"",""created"":""Fri, 3 Apr 2015 02:28:36 GMT""}]","2015-04-06"
"1412.6875","Mark W. Paris","E. Grohs, G. M. Fuller, C. T. Kishimoto, and M. W. Paris","Effect of neutrino rest mass on ionization equilibrium freeze-out","6 pages, 6 figures; reorganized, content unchanged","Phys. Rev. D 92, 125027 (2015)","10.1103/PhysRevD.92.125027","LA-UR-14-29625","astro-ph.CO","http://arxiv.org/licenses/nonexclusive-distrib/1.0/","  We discuss how small neutrino rest masses can increase the expansion rate
near the photon decoupling epoch in the early universe, causing an earlier,
higher temperature freeze-out for ionization equilibrium compared to the
massless neutrino case. This yields a larger free-electron fraction. A larger
ratio of the sound horizon to the photon diffusion length follows, implying a
smaller inferred Neff. This neutrino-mass/recombination effect depends strongly
on the neutrino rest masses. Though below current sensitivity, this effect
could be probed by next-generation cosmic microwave background experiments,
giving an observational handle of neutrino mass physics.
","[{""version"":""v1"",""created"":""Mon, 22 Dec 2014 05:40:33 GMT""},{""version"":""v2"",""created"":""Mon, 4 Jan 2016 22:40:05 GMT""}]","2016-01-06"
"1412.6876","Chiang-Mei Chen","Chiang-Mei Chen, Jia-Rui Sun, Fu-Yi Tang, Ping-Yen Tsai","Spinor Particle Creation in Near Extremal Reissner-Nordstrom Black Holes","references added, errors corrected",,"10.1088/0264-9381/32/19/195003",,"hep-th gr-qc","http://arxiv.org/licenses/nonexclusive-distrib/1.0/","  The pair production of spinor particles, which can be captured by the
solution of the Dirac equation with an appropriate boundary condition, in
charged black holes is investigated. We obtain the closed form of the
production rate in the near extremal limit of the Reissner-Nordstrom black
holes. The cosmic censorship conjecture is seemingly guaranteed by the pair
production process. Moreover, the absorption cross section ratio and retarded
Green's functions of the spinor fields calculated from the gravity side match
well with those of spinor operators in the dual CFT side.
","[{""version"":""v1"",""created"":""Mon, 22 Dec 2014 05:48:00 GMT""},{""version"":""v2"",""created"":""Tue, 30 Dec 2014 15:46:40 GMT""}]","2015-09-23"
"1412.6877","Hidetoshi Taya","Hidetoshi Taya","Hadron Masses in Strong Magnetic Fields","5 pages, 3 figures, 1 table. v2: discussion and figure improved,
  references added, version to be published in PRD","Phys. Rev. D 92, 014038 (2015)","10.1103/PhysRevD.92.014038","UT-KOMABA/14-8","hep-ph nucl-th","http://arxiv.org/licenses/nonexclusive-distrib/1.0/","  Hadron masses under strong magnetic fields are studied. In the presence of
strong magnetic fields exceeding the QCD energy scale $ eB \gg \Lambda^2_{\rm
QCD} $, ${\rm SU(3)}_{\rm flavor} \otimes {\rm SU(2)}_{\rm spin}$ symmetry of
hadrons is explicitly broken so that the quark components of hadrons differ
from those with zero or weak magnetic fields $ eB \lesssim \Lambda^2_{\rm QCD}
$. Also, squeezing of hadrons by strong magnetic fields affects the hadron mass
spectrum. We develop a quark model which appropriately incorporates these
features and analytically calculate various hadron masses including mesons,
baryons and those with strangeness.
","[{""version"":""v1"",""created"":""Mon, 22 Dec 2014 05:48:36 GMT""},{""version"":""v2"",""created"":""Thu, 23 Jul 2015 11:27:58 GMT""}]","2015-08-04"
