"1412.6917","Manuel Saorin","Estefan\'ia Andreu Juan and Manuel Saor\'in","Pseudo-Frobenius graded algebras with enough idempotents","24 pages. arXiv admin note: substantial text overlap with
  arXiv:1304.0586",,,,"math.RT","http://arxiv.org/licenses/nonexclusive-distrib/1.0/","  We introduce and study the notion of pseudo-Frobenius graded algebra with
enough idempotents, showing that it follows the pattern of the classical
concept of pseudo-Frobenius (PF) and Quasi-Frobenius (QF) rings, in particular
finite dimensional self-injective algebras, as studied by Nakayama, Morita,
Faith, Tachikawa, etc. We show that such an algebra is characterized by the
existence of a graded Nakayama form. Moreover, we prove that the
pseudo-Frobenius property is preserved and reflected by covering functors, a
fact that makes the concept useful in Representation Theory.
","[{""version"":""v1"",""created"":""Mon, 22 Dec 2014 10:39:07 GMT""}]","2014-12-23"
"1412.6918","Ian Bonnell","J. M. MacLachlan, I. A. Bonnell, K. Wood, and J. E. Dale","Photoionising feedback and the star formation rates in galaxies","10 pages, 11 figures, A&A, in press",,"10.1051/0004-6361/201322250",,"astro-ph.GA","http://arxiv.org/licenses/nonexclusive-distrib/1.0/","  Aims. We investigate the effects of ionising photons on accretion and stellar
mass growth in a young star forming region, using a Monte Carlo radiation
transfer code coupled to a smoothed particle hydrodynamics (SPH) simulation.
Methods. We introduce the framework with which we correct stellar cluster
masses for the effects of photoionising (PI) feedback and compare to the
results of a full ionisation hydrodynamics code. Results. We present results of
our simulations of star formation in the spiral arm of a disk galaxy, including
the effects of photoionising radiation from high mass stars. We find that PI
feedback reduces the total mass accreted onto stellar clusters by approximately
23 per cent over the course of the simulation and reduces the number of high
mass clusters, as well as the maximum mass attained by a stellar cluster. Mean
star formation rates (SFRs) drop from 0.042 solar masses per year in our
control run to 0.032 solar masses per year after the inclusion of PI feedback
with a final instantaneous SFR reduction of 62 per cent. The overall cluster
mass distribution appears to be affected little by PI feedback. Conclusions. We
compare our results to the observed extra-galactic Schmidt-Kennicutt relation
and the observed properties of local star forming regions in the Milky Way and
find that internal photoionising (PI) feedback is unlikely to reduce star
formation rates by more than a factor of approximately 2 and thus may play only
a minor role in regulating star formation.
","[{""version"":""v1"",""created"":""Mon, 22 Dec 2014 10:50:40 GMT""}]","2015-06-23"
"1412.6919","Ramzy Daou","Ramzy Daou, Raymond Fr\'esard, Sylvie H\'ebert and Antoine Maignan","Large anisotropic thermal conductivity of intrinsically two-dimensional
  metallic oxide PdCoO$_2$","3 figures","Phys. Rev. B 91, 041113(R) (2015)","10.1103/PhysRevB.91.041113",,"cond-mat.str-el cond-mat.mtrl-sci","http://arxiv.org/licenses/nonexclusive-distrib/1.0/","  The highly conductive layered metallic oxide \pdcoo{} is a near-perfect
analogue to an alkali metal in two dimensions. It is distinguished from other
two-dimensional electron systems where the Fermi surface does not reach the
Brillouin zone boundary by a high planar electron density exceeding $10^{15}$
cm$^{-2}$. The simple single-band quasi-2D electronic structure results in
strongly anisotropic transport properties and limits the effectiveness of
electron-phonon scattering. Measurements on single crystals in the temperature
range from 10-300K show that the thermal conductivity is much more weakly
anisotropic than the electrical resistivity, as a result of significant phonon
heat transport. The in-plane thermoelectric power is linear in temperature at
300\,K and displays a purity-dependent peak around 50K. Given the extreme
simplicity of the band-structure, it is possible to identify this peak with
phonon drag driven by normal electron-phonon scattering processes.
","[{""version"":""v1"",""created"":""Mon, 22 Dec 2014 10:52:07 GMT""}]","2015-01-21"
"1412.6920","Edcel John Salumbides","E. J. Salumbides, J. Bagdonaite, H. Abgrall, E. Roueff, and W. Ubachs","H$_2$ Lyman and Werner band lines and their sensitivity for a variation
  of the proton-electron mass ratio in the gravitational potential of white
  dwarfs",,,"10.1093/mnras/stv656",,"physics.atom-ph astro-ph.SR physics.space-ph","http://arxiv.org/licenses/nonexclusive-distrib/1.0/","  Recently an accurate analysis of absorption spectra of molecular hydrogen,
observed with the Cosmic Origins Spectrograph aboard the Hubble Space
Telescope, in the photosphere of white dwarf stars GD133 and GD29-38 was
published in a Letter [Phys. Rev. Lett. 113, 123002 (2014)], yielding a
constraint on a possible dependence of the proton-electron mass ratio on a
gravitational field of strength 10,000 times that at the Earth's surface. In
the present paper further details of that study are presented, in particular a
re-evaluation of the spectrum of the $B^1\Sigma_u^+ - X^1\Sigma_g^+ (v',v'')$
Lyman bands relevant for the prevailing temperatures (12,000 - 14,000 K) of the
photospheres. An emphasis is on the calculation of so-called
$K_i$-coefficients, that represent the sensitivity of each individual line to a
possible change in the proton-electron mass ratio. Such calculations were
performed by semi-empirical methods and by ab initio methods providing accurate
and consistent values. A full listing is provided for the molecular physics
data on the Lyman bands (wavelengths $\lambda_i$, line oscillator strengths
$f_i$, radiative damping rates $\Gamma_i$, and sensitivity coefficients $K_i$)
as required for the analyses of H$_2$-spectra in hot dwarf stars. A similar
listing of the molecular physics parameters for the $C^1\Pi_u - X^1\Sigma_g^+
(v',v'')$ Werner bands is provided for future use in the analysis of white
dwarf spectra.
","[{""version"":""v1"",""created"":""Mon, 22 Dec 2014 10:55:03 GMT""}]","2015-06-23"
"1412.6921","Mohamed Kayid","M. Kayid, S. Izadkhah and H. Alhalees","Combination Mean Residual Life Order with Reliability Applications","This paper has been withdrawn by the author due to a crucial sign
  error in equation 1",,,,"stat.ME","http://arxiv.org/licenses/nonexclusive-distrib/1.0/","  The purpose of this paper is to introduce, study and analyze a new stochastic
order which lies in the framework of the mean residual life and the combination
convexity orders. Several preservation properties of the new order under
reliability operations of monotone transformation, mixture, weighted
distributions and shock models are discussed. In addition, two characterization
properties of the new order based on the concept of residual life at random
time and the concept of excess lifetime in renewal processes are given.
Finally, we highlight some new applications of this order in the context of
reliability and survival analysis.
","[{""version"":""v1"",""created"":""Mon, 22 Dec 2014 10:55:20 GMT""},{""version"":""v2"",""created"":""Wed, 7 Jan 2015 11:27:15 GMT""}]","2015-01-08"
"1412.6922","Mogadalai P Gururajan","Arijit Roy and Mogadalai P Gururajan","Growth kinetics and morphological stability of precipitates in 3-D: a
  phase field study","17 pages, 8 figures (1 colour)",,,,"cond-mat.mtrl-sci","http://arxiv.org/licenses/nonexclusive-distrib/1.0/","  We have studied the growth kinetics of isolated precipitates growing from a
supersaturated matrix in 3-dimensions (3-D) using phase field models; we assume
isotropic interfacial energy consider both constant and variable diffusivity.
We report and compare our numerical growth rates with the classic analytical
solutions of Zener and Frank (ZF). The numerical results deviate from the
analytical ones. These deviations can be understood in terms of the generalised
Gibbs-Thomson effect. Specifically, due to the higher capillary contribution in
3-D (curvature is twice for a sphere compared to a circle), the precipitate
growth kinetics deviates more from ZF in 3-D as compared to 2-D. In addition,
the kinetic parameter associated with the normal velocity of the
precipitate-matrix interface also modifies the deviation of the precipitate
composition from its equilibrium value and hence its growth kinetics. In phase
field models (such as the one used by us) which use a combination of Allen-Cahn
and Cahn-Hilliard type equations, we show how to choose the kinetic parameters
(namely, mobility and relaxation parameter) so that the kinetic coefficient (in
the generalised Gibbs-Thomson equation) is made effectively zero. We also show
that the kinetic parameter the precipitate-matrix interface might play a
crucial role in making the precipitate undergo morphological instabilities as
it grows (leading to ""sea-weed""-like structures).
","[{""version"":""v1"",""created"":""Mon, 22 Dec 2014 11:03:42 GMT""}]","2014-12-23"
"1412.6923","Alexander Schrijver","Alexander Schrijver","On Lie algebra weight systems for 3-graphs",,,,,"math.QA math.CO math.RT","http://arxiv.org/licenses/nonexclusive-distrib/1.0/","  A {\em $3$-graph} is a connected cubic graph such that each vertex is is
equipped with a cyclic order of the edges incident with it. A {\em weight
system} is a function $f$ on the collection of $3$-graphs which is {\em
antisymmetric}: $f(H)=-f(G)$ if $H$ arises from $G$ by reversing the
orientation at one of its vertices, and satisfies the IHX-equation. Key
instances of weight systems are the functions $\varphi_{\frak{g}}$ obtained
from a metric Lie algebra $\frak{g}$ by taking the structure tensor $c$ of
$\frak{g}$ with respect to some orthonormal basis, decorating each vertex of
the $3$-graph by $c$, and contracting along the edges.
  We give equations on values of any complex-valued weight system that
characterize it as complex Lie algebra weight system. It also follows that if
$f=\varphi_{\frak{g}}$ for some complex metric Lie algebra $\frak{g}$, then
$f=\varphi_{\frak{g}'}$ for some unique complex reductive metric Lie algebra
$\frak{g}'$. Basic tool throughout is geometric invariant theory.
","[{""version"":""v1"",""created"":""Mon, 22 Dec 2014 11:04:56 GMT""}]","2014-12-23"
"1412.6924","Klaus Jaffe Dr","Klaus Jaffe","Visualizing the Invisible Hand of Markets: Simulating complex dynamic
  economic interactions",,,,,"cs.MA q-fin.GN","http://arxiv.org/licenses/nonexclusive-distrib/1.0/","  In complex systems, many different parts interact in non-obvious ways.
Traditional research focuses on a few or a single aspect of the problem so as
to analyze it with the tools available. To get a better insight of phenomena
that emerge from complex interactions, we need instruments that can analyze
simultaneously complex interactions between many parts. Here, a simulator
modeling different types of economies, is used to visualize complex
quantitative aspects that affect economic dynamics. The main conclusions are:
1- Relatively simple economic settings produce complex non-linear dynamics and
therefore linear regressions are often unsuitable to capture complex economic
dynamics; 2- Flexible pricing of goods by individual agents according to their
micro-environment increases the health and wealth of the society, but
asymmetries in price sensitivity between buyers and sellers increase price
inflation; 3- Prices for goods conferring risky long term benefits are not
tracked efficiently by simple market forces. 4- Division of labor creates
synergies that improve enormously the health and wealth of the society by
increasing the efficiency of economic activity. 5- Stochastic modeling improves
our understanding of real economies, and didactic games based on them might
help policy makers and non specialists in grasping the complex dynamics
underlying even simple economic settings.
","[{""version"":""v1"",""created"":""Mon, 22 Dec 2014 11:04:57 GMT""},{""version"":""v2"",""created"":""Thu, 2 Apr 2015 10:35:48 GMT""}]","2015-04-03"
"1412.6925","Xudong Chen","Xudong Chen, M.-A. Belabbas, Tamer Basar","Controllability of Formations over Time-varying Graphs",,,,,"cs.SY","http://arxiv.org/licenses/nonexclusive-distrib/1.0/","  In this paper, we investigate the controllability of a class of formation
control systems. Given a directed graph, we assign an agent to each of its
vertices and let the edges of the graph describe the information flow in the
system. We relate the strongly connected components of this graph to the
reachable set of the formation control system. Moreover, we show that the
formation control model is approximately path-controllable over a
path-connected, open dense subset as long as the graph is weakly connected and
satisfies some mild assumption on the numbers of vertices of the strongly
connected components.
","[{""version"":""v1"",""created"":""Mon, 22 Dec 2014 11:10:55 GMT""},{""version"":""v2"",""created"":""Fri, 27 Mar 2015 17:59:44 GMT""},{""version"":""v3"",""created"":""Fri, 29 May 2015 01:54:30 GMT""},{""version"":""v4"",""created"":""Mon, 1 Jun 2015 18:26:43 GMT""}]","2015-06-02"
"1412.6926","Ralph Kenna","R. Kenna and B. Berche","Fisher's scaling relation above the upper critical dimension","Published version has 6 pages, 2 figures","EPL, 105 (2014) 26005","10.1209/0295-5075/105/26005",,"cond-mat.stat-mech","http://arxiv.org/licenses/nonexclusive-distrib/1.0/","  Fisher's fluctuation-response relation is one of four famous scaling formulae
and is consistent with a vanishing correlation-function anomalous dimension
above the upper critical dimension d_c. However, it has long been known that
numerical simulations deliver a negative value for the anomalous dimension
there. Here, the apparent discrepancy is attributed to a distinction between
the system-length and correlation- or characteristic-length scales. On the
latter scale, the anomalous dimension indeed vanishes above d_c and Fisher's
relation holds in its standard form. However, on the scale of the system
length, the anomalous dimension is negative and Fisher's relation requires
modification. Similar investigations at the upper critical dimension, where
dangerous irrelevant variables become marginal, lead to an analogous pair of
Fisher relations for logarithmic-correction exponents. Implications of a
similar distinction between length scales in percolation theory above d_c and
for the Ginzburg criterion are briefly discussed.
","[{""version"":""v1"",""created"":""Mon, 22 Dec 2014 11:12:23 GMT""}]","2014-12-23"
"1412.6927","Boglione Mariaelena","M. Boglione, J.O. Gonzalez Hernandez, S. Melis, A. Prokudin","Phenomenological implementations of TMD evolution","8 pages, 5 figures, to appear in the proceedings of ""QCD Evolution
  Workshop"", Santa Fe, NM (USA), May 12-16, 2014",,"10.1142/S2010194515600307",,"hep-ph","http://arxiv.org/licenses/nonexclusive-distrib/1.0/","  Although the theoretical set-up of TMD evolution appears to be well
established, its phenomenological implementations still require special
attention, particularly as far as the interplay between perturbative and
non-perturbative contributions is concerned. These issues have been extensively
studied in Drell-Yan processes, where they seem to be reasonably under control.
Instead, applying the same prescriptions and methodologies to Semi-Inclusive
Deep Inelastic (SIDIS) processes is, at present, far from obvious. Some of the
controversies related to the applications of TMD Evolution to SIDIS processes
will be discussed with practical examples, exploring different kinematical
configurations of SIDIS experiments.
","[{""version"":""v1"",""created"":""Mon, 22 Dec 2014 11:14:09 GMT""}]","2015-06-23"
"1412.6928","Jana Hant\'akov\'a","Jana Hant\'akov\'a, Samuel Roth, Zuzana Roth","On the weakest version of distributional chaos",,,,,"math.DS","http://arxiv.org/licenses/nonexclusive-distrib/1.0/","  The aim of the paper is to correct and improve some results concerning
distributional chaos of type 3. We show that in a general compact metric space,
distributional chaos of type 3, denoted DC3, even when assuming the existence
of an uncountable scrambled set, is a very weak form of chaos. In particular,
(i) the chaos can be unstable (it can be destroyed by conjugacy), and (ii) such
an unstable system may contain no Li-Yorke pair. However, the definition can be
strengthened to get DC$2\frac{1}{2}$ which is a topological invariant and
implies Li-Yorke chaos, similarly as types DC1 and DC2; but unlike them, strict
DC$2\frac{1}{2}$ systems must have zero topological entropy.
","[{""version"":""v1"",""created"":""Mon, 22 Dec 2014 11:15:22 GMT""},{""version"":""v2"",""created"":""Tue, 14 Jul 2015 13:58:57 GMT""},{""version"":""v3"",""created"":""Tue, 1 Mar 2016 09:49:34 GMT""}]","2016-03-02"
"1412.6929","Aron Walsh","Keith T. Butler, Jarvist M. Frost and Aron Walsh","Ferroelectric Materials for Solar Energy Conversion: Photoferroics
  Revisited",,"Energy Environ. Sci. 8, 838 (2015)","10.1039/C4EE03523B",,"cond-mat.mtrl-sci","http://arxiv.org/licenses/nonexclusive-distrib/1.0/","  The application of ferroelectric materials (i.e. solids that exhibit
spontaneous electric polarisation) in solar cells has a long and controversial
history. This includes the first observations of the anomalous photovoltaic
effect (APE) and the bulk photovoltaic effect (BPE). The recent successful
application of inorganic and hybrid perovskite structured materials (e.g.
BiFeO3, CsSnI3, CH3NH3PbI3) in solar cells emphasises that polar semiconductors
can be used in conventional photovoltaic architectures. We review developments
in this field, with a particular emphasis on the materials known to display the
APE/BPE (e.g. ZnS, CdTe, SbSI), and the theoretical explanation. Critical
analysis is complemented with first-principles calculation of the underlying
electronic structure. In addition to discussing the implications of a
ferroelectric absorber layer, and the solid state theory of polarisation (Berry
phase analysis), design principles and opportunities for high-efficiency
ferroelectric photovoltaics are presented.
","[{""version"":""v1"",""created"":""Mon, 22 Dec 2014 11:17:14 GMT""}]","2015-03-06"
"1412.6930","Seyed Shahin Mousavi","S. Sh. Mousavi, S. N. Hosseini, A. Ilaghi-Hosseini","On General Closure Operators and Quasi Factorization Structures","21 pages",,,,"math.CT","http://arxiv.org/licenses/nonexclusive-distrib/1.0/","  In this article the notions of (quasi weakly hereditary) general closure
operator $\mb{C}$ on a category $\cx$ with respect to a class $\cm$ of
morphisms, and quasi factorization structures in a category $\cx$ are
introduced. It is shown that under certain conditions, if $(\ce, \cm)$ is a
quasi factorization structure in $\cx$, then $\cx$ has quasi right
$\cm$-factorization structure and quasi left $\ce$-factorization structure. It
is also shown that for a quasi weakly hereditary and quasi idempotent
QCD-closure operator with respect to a certain class $\cm$, every quasi
factorization structure $(\ce, \cm)$ yields a quasi factorization structure
relative to the given closure operator; and that for a closure operator with
respect to a certain class $\cm$, if the pair of classes of quasi dense and
quasi closed morphisms forms a quasi factorization structure, then the closure
operator is both quasi weakly hereditary and quasi idempotent. Several
illustrative examples are furnished.
","[{""version"":""v1"",""created"":""Mon, 22 Dec 2014 11:23:34 GMT""},{""version"":""v2"",""created"":""Tue, 3 Sep 2019 07:15:34 GMT""}]","2019-09-04"
"1412.6931","Magdalena Kunert-Bajraszewska","M. Kunert-Bajraszewska (TCfA), K. Katarzynski (TCfA), A. Janiuk
  (CTP-PAS)","Broadband nuclear emission in two radio-loud BAL quasars","10 pages, 6 figures. Accepted to Astronomy and Astrophysics. Online
  material (Appendix) will be available at A&A",,"10.1051/0004-6361/201424729",,"astro-ph.GA astro-ph.HE","http://arxiv.org/licenses/nonexclusive-distrib/1.0/","  The X-ray weakness of broad absorption line (BAL) quasars in comparison to
non-BAL objects is possibly caused by the absorption of X-ray emission by the
shielding material near the equatorial plane. On the other hand, the radio-loud
BALQSOs are more X-ray loud than the radio-quiet ones. This suggests that part
of the X-ray emission may arise from the radio jet. To investigate this
possibility, we modelled the nuclear spectra of two radio-loud BALQSOs. We
focus on the emission from the very centres of these two objects. The source of
emission was approximated by a single, homogeneous component that produces
synchrotron and inverse-Compton (IC) radiation. The simplicity of the model
allowed us to estimate the basic physical parameters of the emitting regions,
using a universal analytic approach. Such methods have already been used in
blazars. For the first time we propose this solution for quasars. In addition,
we modelled the radiation spectra of the accretion disk and its corona to
compare them with the jets' spectra. We find that in the case of luminous
3C270.1, the nuclear X-ray continuum is dominated by the non-thermal, IC
emission from the innermost parts of the radio jet. However, the radio core of
the lobe-dominated PG 1004+130 is probably too weak to produce significant part
of the observed X-ray emission. A large contribution from the X-ray emitting
accretion disk and corona is produced in our model. However, it then exceeds
the observed flux. Because the large intrinsic absorption was postulated
recently by the NuSTAR observations, we propose that the disk-corona component
may still account for the X-rays produced in this source. This part of the
spectrum must nevertheless be dominated by the X-ray jet. We conclude that the
jet-linked X-ray emission is present in strong and weak radio sources, but its
fraction seems to scale with the radio jet power.
","[{""version"":""v1"",""created"":""Mon, 22 Dec 2014 11:25:53 GMT""}]","2015-06-23"
"1412.6932","Alexander Schrijver","Alexander Schrijver","Connection matrices and Lie algebra weight systems for multiloop chord
  diagrams",,,,,"math.QA math.CO math.RT","http://arxiv.org/licenses/nonexclusive-distrib/1.0/","  We give necessary and sufficient conditions for a weight system on multiloop
chord diagrams to be obtainable from a metrized Lie algebra representation, in
terms of a bound on the ranks of associated connection matrices.
  Here a multiloop chord diagram is a graph with directed and undirected edges
so that at each vertex precisely one directed edge is entering and precisely
one directed edge is leaving, and each vertex is incident with precisely one
undirected edge. Weight systems on multiloop chord diagrams yield the Vassiliev
invariants for knots and links.
  The $k$-th connection matrix of a function $f$ on the collection of multiloop
chord diagrams is the matrix with rows and columns indexed by $k$-labeled chord
tangles, and with entries equal to the $f$-value on the join of the tangles.
","[{""version"":""v1"",""created"":""Mon, 22 Dec 2014 11:27:22 GMT""}]","2014-12-23"
"1412.6933","Rafi Blumenfeld","Raphael Blumenfeld","Structural evolution of granular systems: Theory","4 pages, 3 figures, of which two with subfigures, submitted to Phys.
  Rev. Lett, minor editing in version 2",,,,"cond-mat.mtrl-sci cond-mat.soft","http://arxiv.org/licenses/nonexclusive-distrib/1.0/","  A first-principles theory is developed for the general evolution of a key
structural characteristic of planar granular systems - the cell order
distribution. The dynamic equations are constructed and solved in closed form
for a number of examples: dense systems undergoing progressive compaction;
initial dilation of very dense systems; and the approach to steady state of
general systems. It is shown that the convergence to steady state is
exponential, except when contacts are only broken and no new contacts are made,
in which case the approach is algebraic in time. Where no closed form solutions
are possible, illustrative numerical solutions of the evolution are shown.
These show that the dynamics are sensitive to the cell event rates, which are
process dependent. The formalism can be extended to other structural
characteristics, paving the way to a general theory of structural organisation
of granular systems, parameterised by the contact event rates.
","[{""version"":""v1"",""created"":""Mon, 22 Dec 2014 11:29:06 GMT""},{""version"":""v2"",""created"":""Fri, 1 May 2015 11:13:19 GMT""}]","2015-05-04"
"1412.6934","Gregorio Herdoiza","Anthony Francis, Gregorio Herdo\'iza, Hanno Horch, Benjamin J\""ager,
  Harvey B. Meyer, Hartmut Wittig","Study of the Couplings of QED and QCD from the Adler Function","7 pages, 4 figures. Contribution to the 32nd International Symposium
  on Lattice Field Theory (Lattice 2014), 23-28 June 2014, Columbia University,
  New York, NY, USA",,,,"hep-lat hep-ph","http://arxiv.org/licenses/nonexclusive-distrib/1.0/","  The contribution from hadronic vacuum polarisation effects is responsible for
a large fraction of the theoretical uncertainty in the running of the QED
coupling. The current level of uncertainty has become a limitation for
electroweak precision tests. We use lattice QCD simulations with two flavours
of O$(a)$ improved Wilson fermions to determine the Adler function in a broad
range of the momentum transfer $Q^2$. The running of the QED coupling,
including valence contributions from $u$, $d$, $s$ and $c$ quarks, is compared
to phenomenological results at intermediate $Q^2$ values. In the large $Q^2$
regime, the lattice determination of the Adler function is fitted to
perturbation theory in order to examine the feasibility of a determination of
the strong coupling constant.
","[{""version"":""v1"",""created"":""Mon, 22 Dec 2014 11:35:40 GMT""}]","2014-12-23"
