"1412.6802","Bin Shu","Yang Zeng and Bin Shu","On Kac-Weisfeiler modules for general and special linear Lie
  superalgebras","15 pages",,,,"math.RT math.RA","http://creativecommons.org/licenses/publicdomain/","  Let $\ggg:=\gl_{m|n}$ be a general linear Lie superalgebra over an
algebraically closed field $\mathds{k}=\overline{\mathbb{F}}_p$ of
characteristic $p>2$. A module of $\ggg$ is said to be of Kac-Weisfeiler if its
dimension coincides with the dimensional lower bound in the super
Kac-Weisfeiler property presented by Wang-Zhao in \cite{WZ}. In this paper, we
verify the existence of the Kac-Weisfeiler modules for $\gl_{m|n}$. We also
establish the corresponding consequence for the special linear Lie
superalgebras $\mathfrak{sl}_{m|n}$ with restrictions $p>2$ and $p\nmid(m-n)$.
","[{""version"":""v1"",""created"":""Sun, 21 Dec 2014 16:00:32 GMT""}]","2014-12-23"
"1412.6803","Herv\'e Hocquard","Marthe Bonamy, Herv\'e Hocquard, Samia Kerdjoudj and Andr\'e Raspaud","Incidence coloring of graphs with high maximum average degree",,,,,"cs.DM math.CO","http://creativecommons.org/licenses/by/3.0/","  An incidence of an undirected graph G is a pair $(v,e)$ where $v$ is a vertex
of $G$ and $e$ an edge of $G$ incident with $v$. Two incidences $(v,e)$ and
$(w,f)$ are adjacent if one of the following holds: (i) $v = w$, (ii) $e = f$
or (iii) $vw = e$ or $f$. An incidence coloring of $G$ assigns a color to each
incidence of $G$ in such a way that adjacent incidences get distinct colors. In
2005, Hosseini Dolama \emph{et al.}~\citep{ds05} proved that every graph with
maximum average degree strictly less than $3$ can be incidence colored with
$\Delta+3$ colors. Recently, Bonamy \emph{et al.}~\citep{Bonamy} proved that
every graph with maximum degree at least $4$ and with maximum average degree
strictly less than $\frac{7}{3}$ admits an incidence $(\Delta+1)$-coloring. In
this paper we give bounds for the number of colors needed to color graphs
having maximum average degrees bounded by different values between $4$ and $6$.
In particular we prove that every graph with maximum degree at least $7$ and
with maximum average degree less than $4$ admits an incidence
$(\Delta+3)$-coloring. This result implies that every triangle-free planar
graph with maximum degree at least $7$ is incidence $(\Delta+3)$-colorable. We
also prove that every graph with maximum average degree less than 6 admits an
incidence $(\Delta + 7)$-coloring. More generally, we prove that $\Delta+k-1$
colors are enough when the maximum average degree is less than $k$ and the
maximum degree is sufficiently large.
","[{""version"":""v1"",""created"":""Sun, 21 Dec 2014 16:01:36 GMT""},{""version"":""v2"",""created"":""Tue, 27 Jan 2015 13:52:10 GMT""}]","2015-01-28"
"1412.6804","Thierry Gallay","Thierry Gallay and Dmitry Pelinovsky","Orbital stability in the cubic defocusing NLS equation: II. The black
  soliton","19 pages, no figure",,,,"math.AP","http://arxiv.org/licenses/nonexclusive-distrib/1.0/","  Combining the usual energy functional with a higher-order conserved quantity
originating from integrability theory, we show that the black soliton is a
local minimizer of a quantity that is conserved along the flow of the cubic
defocusing NLS equation in one space dimension. This unconstrained variational
characterization gives an elementary proof of the orbital stability of the
black soliton with respect to perturbations in $H^2(\mathbb{R})$.
","[{""version"":""v1"",""created"":""Sun, 21 Dec 2014 16:07:13 GMT""}]","2014-12-23"
"1412.6805","Bin Shu","Yang Zeng and Bin Shu","Finite $W$-superalgebras and the dimensional lower bounds for the
  representations of basic Lie superalgebras","47 pages. This version is revised from the last 3 chapters of the
  manuscript ""Finite W-superalgebras for basic classical Lie superalgebras""
  (arXiv:1404.1150 [math.RT]). arXiv admin note: text overlap with
  arXiv:0809.0663 by other authors",,,,"math.RT math.RA","http://creativecommons.org/licenses/publicdomain/","  In this paper we formulate a conjecture about the minimal dimensional
representations of the finite $W$-superalgebra $U(\mathfrak{g}_\bbc,e)$ over
the field of complex numbers and demonstrate it with examples including all the
cases of type $A$. Under the assumption of this conjecture, we show that the
lower bounds of dimensions in the modular representations of basic Lie
superalgebras are attainable. Such lower bounds, as a super-version of
Kac-Weisfeiler conjecture, were formulated by Wang-Zhao in \cite{WZ} for the
modular representations of a basic Lie superalgebra ${\ggg}_{{\bbk}}$ over an
algebraically closed field $\bbk$ of positive characteristic $p$.
","[{""version"":""v1"",""created"":""Sun, 21 Dec 2014 16:11:07 GMT""}]","2014-12-23"
"1412.6806","Alexey Dosovitskiy","Jost Tobias Springenberg, Alexey Dosovitskiy, Thomas Brox, Martin
  Riedmiller","Striving for Simplicity: The All Convolutional Net","accepted to ICLR-2015 workshop track; no changes other than style",,,,"cs.LG cs.CV cs.NE","http://arxiv.org/licenses/nonexclusive-distrib/1.0/","  Most modern convolutional neural networks (CNNs) used for object recognition
are built using the same principles: Alternating convolution and max-pooling
layers followed by a small number of fully connected layers. We re-evaluate the
state of the art for object recognition from small images with convolutional
networks, questioning the necessity of different components in the pipeline. We
find that max-pooling can simply be replaced by a convolutional layer with
increased stride without loss in accuracy on several image recognition
benchmarks. Following this finding -- and building on other recent work for
finding simple network structures -- we propose a new architecture that
consists solely of convolutional layers and yields competitive or state of the
art performance on several object recognition datasets (CIFAR-10, CIFAR-100,
ImageNet). To analyze the network we introduce a new variant of the
""deconvolution approach"" for visualizing features learned by CNNs, which can be
applied to a broader range of network structures than existing approaches.
","[{""version"":""v1"",""created"":""Sun, 21 Dec 2014 16:16:37 GMT""},{""version"":""v2"",""created"":""Mon, 2 Mar 2015 21:44:06 GMT""},{""version"":""v3"",""created"":""Mon, 13 Apr 2015 07:58:17 GMT""}]","2015-04-14"
"1412.6807","Matthew Bayliss","Matthew B. Bayliss (Harvard/CfA), Keren Sharon (Michigan), and Traci
  Johnson (Michigan)","Quantifying the Impact of Cosmological Parameter Uncertainties on Strong
  Lensing Models With an Eye Toward the Frontier Fields","6p, 4 Figures 1 Table, ApJL published",,"10.1088/2041-8205/802/1/L9",,"astro-ph.CO","http://arxiv.org/licenses/nonexclusive-distrib/1.0/","  We test the effects of varying the cosmological parameter values used in the
strong lens modeling process for the six Hubble Frontier Fields (HFF) galaxy
clusters. The standard procedure for generating high fidelity strong lens
models includes careful consideration of uncertainties in the output models
that result from varying model parameters within the bounds of available data
constraints. It is not, however, common practice to account for the effects of
cosmological parameter value uncertainties. The convention is to instead use a
single fiducial ""concordance cosmology"" and generate lens models assuming zero
uncertainty in cosmological parameter values. We find that the magnification
maps of the individual HFF clusters vary significantly when lens models are
computed using different cosmological parameter values taken from recent
literature constraints from space- and ground-based experiments. Specifically,
the magnification maps have average variances across the best fit models
computed using different cosmologies that are comparable in magnitude to - and
as much as 2.5 times larger than - the model fitting uncertainties in each best
fit model. We also find that estimates of the mass profiles of the cluster
cores themselves vary only slightly when different input cosmological
parameters are used. We conclude that cosmological parameter uncertainty is a
non-negligible source of uncertainty in lens model products for the HFF
clusters, and that it is important that current and future work which relies on
precision strong lensing models take care to account for this additional source
of uncertainty.
","[{""version"":""v1"",""created"":""Sun, 21 Dec 2014 16:25:28 GMT""},{""version"":""v2"",""created"":""Thu, 26 Mar 2015 03:24:54 GMT""}]","2015-03-27"
"1412.6808","Waheed Bajwa","Tong Wu and Waheed U. Bajwa","Learning the nonlinear geometry of high-dimensional data: Models and
  algorithms","Extended version of the journal paper accepted for publication in
  IEEE Trans. Signal Processing (20 pages, 7 figures, 4 tables)","IEEE Trans. Signal Processing, vol. 63, no. 23, pp. 6229-6244,
  Dec. 2015","10.1109/TSP.2015.2469637",,"stat.ML cs.CV cs.LG","http://arxiv.org/licenses/nonexclusive-distrib/1.0/","  Modern information processing relies on the axiom that high-dimensional data
lie near low-dimensional geometric structures. This paper revisits the problem
of data-driven learning of these geometric structures and puts forth two new
nonlinear geometric models for data describing ""related"" objects/phenomena. The
first one of these models straddles the two extremes of the subspace model and
the union-of-subspaces model, and is termed the metric-constrained
union-of-subspaces (MC-UoS) model. The second one of these models---suited for
data drawn from a mixture of nonlinear manifolds---generalizes the kernel
subspace model, and is termed the metric-constrained kernel union-of-subspaces
(MC-KUoS) model. The main contributions of this paper in this regard include
the following. First, it motivates and formalizes the problems of MC-UoS and
MC-KUoS learning. Second, it presents algorithms that efficiently learn an
MC-UoS or an MC-KUoS underlying data of interest. Third, it extends these
algorithms to the case when parts of the data are missing. Last, but not least,
it reports the outcomes of a series of numerical experiments involving both
synthetic and real data that demonstrate the superiority of the proposed
geometric models and learning algorithms over existing approaches in the
literature. These experiments also help clarify the connections between this
work and the literature on (subspace and kernel k-means) clustering.
","[{""version"":""v1"",""created"":""Sun, 21 Dec 2014 16:40:31 GMT""},{""version"":""v2"",""created"":""Mon, 10 Aug 2015 02:12:06 GMT""}]","2018-03-06"
"1412.6809","Christian de Ronde","Hector Freytes, Graciela Domenech, Christian de Ronde","Physical properties as modal operators in the topos approach to quantum
  mechanics",,"Foundations of Physics, December 2014, Volume 44, Issue 12, pp
  1357-1368","10.1007/s10701-014-9842-9",,"quant-ph","http://arxiv.org/licenses/nonexclusive-distrib/1.0/","  In the framework of the topos approach to quantum mechanics we give a
representation of physical properties in terms of modal operators on Heyting
algebras. It allows us to introduce a classical type study of the mentioned
properties.
","[{""version"":""v1"",""created"":""Sun, 21 Dec 2014 16:43:45 GMT""}]","2014-12-23"
"1412.6810","Raffaello Potestio","Karsten Kreis, Aoife C. Fogarty, Kurt Kremer and Raffaello Potestio","Advantages and challenges in coupling an ideal gas to atomistic models
  in adaptive resolution simulations",,,"10.1140/epjst/e2015-02412-1",,"cond-mat.stat-mech","http://arxiv.org/licenses/nonexclusive-distrib/1.0/","  In adaptive resolution simulations, molecular fluids are modeled employing
different levels of resolution in different subregions of the system. When
traveling from one region to the other, particles change their resolution on
the fly. One of the main advantages of such approaches is the computational
efficiency gained in the coarse-grained region. In this respect the best
coarse-grained system to employ in the low resolution region would be the ideal
gas, making intermolecular force calculations in the coarse-grained subdomain
redundant. In this case, however, a smooth coupling is challenging due to the
high energetic imbalance between typical liquids and a system of
non-interacting particles. In the present work, we investigate this approach,
using as a test case the most biologically relevant fluid, water. We
demonstrate that a successful coupling of water to the ideal gas can be
achieved with current adaptive resolution methods, and discuss the issues that
remain to be addressed.
","[{""version"":""v1"",""created"":""Sun, 21 Dec 2014 16:44:28 GMT""},{""version"":""v2"",""created"":""Wed, 25 Feb 2015 13:56:22 GMT""},{""version"":""v3"",""created"":""Tue, 3 Mar 2015 08:06:03 GMT""}]","2015-10-28"
"1412.6811","Chandre Dharma-wardana","M. W. C. Dharma-wardana (NRC-Canada)","Strongly-Coupled Coulomb Systems using finite-$T$ Density Functional
  Theory: A review of studies on Strongly-Coupled Coulomb Systems since the
  rise of DFT and SCCS-1977","A slightly modified version will appear in Contributions in Plasma
  Physics. Based on a presentation at the Strongly Coupled Coulomb Systems
  meeting, Santa Fe, NM, 2014",,,,"cond-mat.stat-mech physics.chem-ph physics.plasm-ph","http://arxiv.org/licenses/nonexclusive-distrib/1.0/","  The conferences on ""Strongly Coupled Coulomb Systems"" (SCCS) arose from the
""Strongly Coupled Plasmas"" meetings, inaugurated in 1977. The progress in SCCS
theory is reviewed in an `author-centered' frame to limit its scope. Our
efforts, i.e., with Fran\c{c}ois Perrot, sought to apply density functional
theory (DFT) to SCCS calculations. DFT was then poised to become the major
computational scheme for condensed matter physics. The ion-sphere models of
Salpeter and others evolved into useful average-atom models for finite-$T$
Coulomb systems, as in Lieberman's Inferno code. We replaced these by
correlation-sphere models that exploit the description of matter via density
functionals linked to pair-distributions. These methods provided practical
computational means for studying strongly interacting electron-ion Coulomb
systems like warm-dense matter (WDM). The staples of SCCS are wide-ranged,
viz., equation of state, plasma spectroscopy, opacity (absorption, emission),
scattering, level shifts, transport properties, e.g., electrical and heat
conductivity, laser- and shock- created plasmas, their energy relaxation and
transient properties etc. These calculations need pseudopotentials and
exchange-correlation functionals applicable to finite-$T$ Coulomb systems that
may be used in ab initio codes, molecular dynamics, etc. The search for simpler
computational schemes has proceeded via proposals for orbital-free DFT,
statistical potentials, classical maps of quantum systems using classical
schemes like HNC to include strong coupling effects (CHNC). Laughlin's
classical plasma map for the fractional quantum Hall effect (FQHE) is a seminal
example where we report new results for graphene.
","[{""version"":""v1"",""created"":""Sun, 21 Dec 2014 16:46:22 GMT""}]","2016-02-02"
"1412.6812","Debasish Chaudhuri","Swarnali Bandopadhyay, Debasish Chaudhuri, A. M. Jayannavar","Macrospin in external magnetic field: Entropy production and fluctuation
  theorems","8 pages, 4 figures; version accepted for publication in JStat","Journal of Statistical Mechanics: Theory and Experiment 2015,
  P11002 (2015)","10.1088/1742-5468/2015/11/P11002",,"cond-mat.stat-mech cond-mat.mes-hall","http://arxiv.org/licenses/nonexclusive-distrib/1.0/","  We consider stochastic rotational dynamics of a macrospin at a constant
temperature, in presence of an external magnetic field. Starting from the
appropriate Langevin equation which contains multiplicative noise, we calculate
entropy production (EP) along stochastic trajectories, and obtain fluctuation
theorems. The system remains inherently out of equilibrium due to a spin torque
supporting azimuthal current, leading to an excess EP apart from the EP due to
heat dissipation. The anomaly may be removed using a redefinition of dissipated
heat and stochastic work done. Using numerical simulations, we obtain
distribution functions for entropy production along stochastic trajectories to
find good agreement with the detailed fluctuation theorem.
","[{""version"":""v1"",""created"":""Sun, 21 Dec 2014 16:57:01 GMT""},{""version"":""v2"",""created"":""Wed, 1 Jul 2015 17:19:03 GMT""},{""version"":""v3"",""created"":""Fri, 16 Oct 2015 05:00:13 GMT""}]","2016-01-15"
"1412.6813","Christian de Ronde","Christian de Ronde","Epistemological and Ontological Paraconsistency in Quantum Mechanics:
  For and Against Bohrian Philosophy","Festschrift honoring J.-Y. Beziau's 50th Birthday",,,,"quant-ph physics.hist-ph","http://arxiv.org/licenses/nonexclusive-distrib/1.0/","  We interpret the philosophy of Niels Bohr as related to the so called
""linguistic turn"" and consider paraconsistency in the light of the Bohrian
notion of complementarity. Following [16], Jean-Yves Beziau has discussed the
seemingly contradictory perspectives found in the quantum mechanical double
slit experiment in terms of paraconsistent view-points [7, 8]. This
interpretation goes in line with the well known Bohrian Neo-Kantian
epistemological account of quantum mechanics. In the present paper, we put
forward the idea that one can also consider, within quantum mechanics and
departing from the philosophy of the danish physicist, a more radical
paraconsistency found within one of the main formal elements of the theory,
namely, quantum superpositions. We will argue that, rather than
epistemological, the contradictions found within quantum superpositions could
be interpreted as ontological contradictions.
","[{""version"":""v1"",""created"":""Sun, 21 Dec 2014 17:12:23 GMT""}]","2014-12-23"
"1412.6814","Sanjay  Moudgalya","Sanjay Moudgalya, Frank Pollmann","Fragility of Symmetry Protected Topological Order on a Hubbard Ladder","7 pages, 4 figures","Phys. Rev. B 91, 155128 (2015)","10.1103/PhysRevB.91.155128",,"cond-mat.str-el","http://creativecommons.org/licenses/by/3.0/","  Anfuso and Rosch [Phys. Rev. B 75, 144420 (2007)] showed that the
""topological"" Haldane phase in a fermionic spin-1/2 ladder can be continuously
deformed into a ""trivial"" phase without explicitly breaking symmetries when
local charge fluctuations are taken into account. Within the framework of
symmetry protected topological phases, we revisit the model and demonstrate how
the Haldane phase can be adiabatically connected to a trivial phase due to
charge fluctuations. Furthermore, we show that the Haldane phase remains stable
as long as the system is symmetric under particular reflection symmetries.
","[{""version"":""v1"",""created"":""Sun, 21 Dec 2014 17:32:33 GMT""}]","2015-04-22"
"1412.6815","Misha Denil","Misha Denil and Alban Demiraj and Nando de Freitas","Extraction of Salient Sentences from Labelled Documents","arXiv admin note: substantial text overlap with arXiv:1406.3830",,,,"cs.CL cs.IR cs.LG","http://arxiv.org/licenses/nonexclusive-distrib/1.0/","  We present a hierarchical convolutional document model with an architecture
designed to support introspection of the document structure. Using this model,
we show how to use visualisation techniques from the computer vision literature
to identify and extract topic-relevant sentences.
  We also introduce a new scalable evaluation technique for automatic sentence
extraction systems that avoids the need for time consuming human annotation of
validation data.
","[{""version"":""v1"",""created"":""Sun, 21 Dec 2014 17:38:19 GMT""},{""version"":""v2"",""created"":""Sat, 28 Feb 2015 23:57:08 GMT""}]","2015-03-03"
"1412.6816","Andrew Gorbatyuk V","A. V. Gorbatyuk, B. V. Ivanov","Simulation of Submicrosecond Regimes of High-Voltage Reversibly-Switched
  Dynistors","9 pages, in Russian, 6 figures",,"10.1134/S1063784215080071",,"cond-mat.other","http://arxiv.org/licenses/nonexclusive-distrib/1.0/","  Basing on 2D computer simulation of physical processes in high-voltage
reversibly-switched dynistors (RSD) important peculiarities of their
submicrosecond pulse performance mechanisms have been studied. It is
characteristic that on early stages of switching fronts rather great voltage
spikes and dangerous delays in current rise are observed. These undesirable
manifestations are found to be eliminated due to appropriate reduction of the
doping in p-base. Following this way for RSD with blocking voltage of 2.5-5 kV
at the value of reversibly pumped charge 5-10 uC/cm^2 one can diminished the
switching front duration up to 75-100 ns and lower. As for the current rise
rate it can be increased up to (20-30) A/cm^2/ns, i.e., more then the order
higher of the similar parameter for the standard RSD. For the switching pulse
amplitudes of few unites kA and with the total pulse duration of several
hundred nanoseconds the energy transmitted to the load can reach fractions and
units of joules per cycle at the power losses in RSD nearly 10% of these
values.
","[{""version"":""v1"",""created"":""Sun, 21 Dec 2014 17:46:54 GMT""}]","2015-09-30"
"1412.6817","Nata\v{s}a Ad\v{z}i\'c","Natasa Adzic and Rudolf Podgornik","Charge regulation in ionic solutions: thermal fluctuations and
  Kirkwood-Schumaker interaction","14 pages, 9 figures, submitted to Phys. Rev. E",,"10.1103/PhysRevE.91.022715",,"physics.chem-ph cond-mat.soft","http://arxiv.org/licenses/nonexclusive-distrib/1.0/","  We study the behavior of two macroions with dissociable charge groups,
regulated by local variables such as pH and electrostatic potential, immersed
in a mono-valent salt solution, considering cases where the net charge can
either change sign or remain of the same sign depending on these local
parameters. The charge regulation, in both cases, is described with the proper
free energy function for each of the macroions, while the coupling between the
charges is evaluated on the approximate Debye-H\""uckel level. The charge
correlation functions and the ensuing charge fluctuation forces are calculated
analytically and numerically. Strong attraction between like-charged macroions
is found close to the point of zero charge, specifically due to asymmetric,
anticorrelated charge fluctuations of the macroion charges. The general theory
is then implemented for a system of two protein-like macroions, generalizing
the form and magnitude of the Kirkwood-Schumaker interaction.
","[{""version"":""v1"",""created"":""Sun, 21 Dec 2014 18:07:40 GMT""}]","2015-06-23"
"1412.6818","Simon Riche","Carl Mautner, Simon Riche","On the exotic t-structure in positive characteristic","v1: 34 pages; v2: some references added; v3: minor corrections",,,,"math.RT","http://arxiv.org/licenses/nonexclusive-distrib/1.0/","  In this paper we study Bezrukavnikov's exotic t-structure on the derived
category of equivariant coherent sheaves on the Springer resolution of a
connected reductive algebraic group defined over a field of positive
characteristic with simply-connected derived subgroup. In particular, we show
that the heart of the exotic t-structure is a graded highest weight category,
and we study the tilting objects in this heart. Our main tool is the ""geometric
braid group action"" studied by Bezrukavnikov and the second author.
","[{""version"":""v1"",""created"":""Sun, 21 Dec 2014 18:19:27 GMT""},{""version"":""v2"",""created"":""Wed, 28 Jan 2015 13:57:08 GMT""},{""version"":""v3"",""created"":""Thu, 18 Jun 2015 08:31:03 GMT""}]","2015-06-19"
"1412.6819","Hosein Gholizade","H.Gholizade, A. Altaibayeva, R. Myrzakulov","Thermodynamics and geometry of strange quark matter",,,"10.1007/s10773-014-2417-x",,"gr-qc","http://arxiv.org/licenses/nonexclusive-distrib/1.0/","  We study thermodynamic of strange quark matter (SQM) using the analytic
expressions of free and internal energies. We investigate two regimes of the
high density and low density separately. As a vital program, in the case of a
massless gluon and massless quarks at finite temperature, we also present a
geometry of thermodynamics for the gluon and Bosons using a Legendre invariance
metric, it is so called as geometrothermodynamic (GTD) to better understanding
of the phase transition. The GTD metric and its second order scalar invariant
have been obtained, and we clarify the phase transition by study the
singularities of the scalar curvature of this Riemannian metric. This method is
ensemble dependence and to complete the phase transition. Meanwhile, we also
investigate enthalpy and entropy and internal energy representations. Our work
exposes new pictures of the nature of phase transitions in SQM.
","[{""version"":""v1"",""created"":""Sun, 21 Dec 2014 18:47:09 GMT""}]","2014-12-23"
