"1412.6971","Gary R. W. Greaves","Xi-Ming Cheng, Alexander L. Gavrilyuk, Gary R. W. Greaves, Jack H.
  Koolen","Biregular graphs with three eigenvalues","28 pages","European J. Combin. 56 (2016), pp. 57--80","10.1016/j.ejc.2016.03.004",,"math.CO","http://arxiv.org/licenses/nonexclusive-distrib/1.0/","  We consider nonregular graphs having precisely three distinct eigenvalues.
The focus is mainly on the case of graphs having two distinct valencies and our
results include constructions of new examples, structure theorems, valency
constraints, and a classification of certain special families of such graphs.
We also present a new example of a graph with three valencies and three
eigenvalues of which there are currently only finitely many known examples.
","[{""version"":""v1"",""created"":""Mon, 22 Dec 2014 13:16:58 GMT""},{""version"":""v2"",""created"":""Tue, 12 Apr 2016 08:46:41 GMT""}]","2016-05-03"
"1412.6972","Peter Rakyta","P. Rakyta, M. Vigh, A. Csord\'as and J. Cserti","Protected edge states in silicene antidots and dots in magnetic field","10 pages, 7 figure","Phys. Rev. B 91, 125412 (2015)","10.1103/PhysRevB.91.125412",,"cond-mat.mes-hall","http://arxiv.org/licenses/nonexclusive-distrib/1.0/","  Silicene systems, due to the buckled structure of the lattice, manifest
remarkable intrinsic spin-orbit interaction triggering a topological phase
transition in the low-energy regime. Thus, we found that protected edge states
are present in silicene antidots and dots, being polarized in valley-spin
pairs. We have also studied the effect of the lattice termination on the
properties of the single electron energy levels and electron density
distribution of silicene antidots and dots situated in a perpendicular magnetic
field. Our calculations confirmed that the topological edge states are
propagating over the perimeter of the antidot/dot for both ideal or realistic
edge termination containing roughness on the atomic length scale. The valley
polarization and the slope of the energy line as a function of the magnetic
field is, however, reduced when the antidot or dot has a rough edge.
","[{""version"":""v1"",""created"":""Mon, 22 Dec 2014 13:26:52 GMT""},{""version"":""v2"",""created"":""Tue, 17 Mar 2015 08:25:29 GMT""}]","2015-03-18"
"1412.6973","Guangming Lang","Guangming Lang","Decision-theoretic rough sets-based three-way approximations of
  interval-valued fuzzy sets",,,,,"cs.AI","http://creativecommons.org/licenses/by/3.0/","  In practical situations, interval-valued fuzzy sets are frequently
encountered. In this paper, firstly, we present shadowed sets for interpreting
and understanding interval fuzzy sets. We also provide an analytic solution to
computing the pair of thresholds by searching for a balance of uncertainty in
the framework of shadowed sets. Secondly, we construct errors-based three-way
approximations of interval-valued fuzzy sets. We also provide an alternative
decision-theoretic formulation for calculating the pair of thresholds by
transforming interval-valued loss functions into single-valued loss functions,
in which the required thresholds are computed by minimizing decision costs.
Thirdly, we compute errors-based three-way approximations of interval-valued
fuzzy sets by using interval-valued loss functions. Finally, we employ several
examples to illustrate that how to take an action for an object with
interval-valued membership grade by using interval-valued loss functions.
","[{""version"":""v1"",""created"":""Mon, 22 Dec 2014 13:34:04 GMT""}]","2014-12-23"
"1412.6974","Tomaz Prosen","Marcin Mierzejewski, Peter Prelovsek, and Tomaz Prosen","Local and Quasilocal Conserved Quantities in Integrable Systems","7 pages in RevTex with 5 eps figures, version as accepted in
  Phys.Rev.Lett","Phys. Rev. Lett. 114, 140601 (2015)","10.1103/PhysRevLett.114.140601",,"cond-mat.stat-mech cond-mat.str-el quant-ph","http://arxiv.org/licenses/nonexclusive-distrib/1.0/","  We outline a procedure for counting and identifying a complete set of local
and quasilocal conserved operators in integrable lattice systems. The method
yields a systematic generation of all independent, conserved quasilocal
operators related to time-average of local operators with a support on up to M
consecutive sites. As an example we study the anisotropic Heisenberg spin-1/2
chain and show that the number of independent conserved operators grows
linearly with M. Besides the known local operators there exist novel quasilocal
conserved quantities in all the parity sectors. The existence of quasilocal
conserved operators is shown also for the isotropic Heisenberg model.
Implications for the anomalous relaxation of quenched systems are discussed as
well.
","[{""version"":""v1"",""created"":""Mon, 22 Dec 2014 13:36:59 GMT""},{""version"":""v2"",""created"":""Tue, 31 Mar 2015 06:41:54 GMT""}]","2015-04-16"
"1412.6975","Stefania Melillo","A.Attanasi, A.Cavagna, L.Del Castello, I.Giardina, S.Melillo,
  L.Parisi, O.Pohl, B.Rossaro, E.Shen, E.Silvestri, M.Viale","Finite-size scaling as a way to probe near-criticality in natural swarms","Selected for Viewpoint in Physics; PRL Editor's Suggestion","Phys.Rev.Lett. 113, 238102 (2014)","10.1103/PhysRevLett.113.238102",,"cond-mat.stat-mech physics.bio-ph q-bio.PE","http://arxiv.org/licenses/nonexclusive-distrib/1.0/","  Collective behaviour in biological systems is often accompanied by strong
correlations. The question has therefore arisen of whether correlation is
amplified by the vicinity to some critical point in the parameters space.
Biological systems, though, are typically quite far from the thermodynamic
limit, so that the value of the control parameter at which correlation and
susceptibility peak depend on size. Hence, a system would need to readjust its
control parameter according to its size in order to be maximally correlated.
This readjustment, though, has never been observed experimentally. By gathering
three-dimensional data on swarms of midges in the field we find that swarms
tune their control parameter and size so as to maintain a scaling behaviour of
the correlation function. As a consequence, correlation length and
susceptibility scale with the system's size and swarms exhibit a near-maximal
degree of correlation at all sizes.
","[{""version"":""v1"",""created"":""Mon, 22 Dec 2014 13:39:01 GMT""}]","2014-12-23"
"1412.6976","Vicent Mateu","Andre H. Hoang, Vicent Mateu, Piotr Pietrulewicz","Secondary Production of Massive Quarks in Thrust","6 pages, 1 figure. Presented at the XIth International Conference on
  Quark Confinement and the Hadron Spectrum, Saint Petersburg, Russia,
  September 8-12, 2014",,,"UWTHPH 2014-36, DESY 14-249","hep-ph","http://arxiv.org/licenses/nonexclusive-distrib/1.0/","  We present a factorization framework that takes into account the production
of heavy quarks through gluon splitting in the thrust distribution for e+ e-
--> hadrons. The explicit factorization theorems and some numerical results are
displayed in the dijet region where the kinematic scales are widely separated,
which can be extended systematically to the whole spectrum. We account for the
necessary two-loop matrix elements, threshold corrections, and include
resummation up to N3LL order. We include nonperturbative power corrections
through a field theoretical shape function, and remove the O(Lambda_QCD)
renormalon in the partonic soft function by appropriate mass-dependent
subtractions. Our results hold for any value of the quark mass, from an
infinitesimally small (merging to the known massless result) to an infinitely
large one (achieving the decoupling limit). This is the first example of an
application of a variable flavor number scheme to final state jets.
","[{""version"":""v1"",""created"":""Mon, 22 Dec 2014 13:41:53 GMT""}]","2014-12-23"
"1412.6977","Miguel D. Bustamante","Marc Perlin and Miguel D. Bustamante","A Robust Quantitative Comparison Criterion of Two Signals based on the
  Sobolev Norm of Their Difference",,"J Eng Math 101, 115-124 (2016)","10.1007/s10665-016-9849-7",,"physics.flu-dyn physics.ao-ph physics.data-an","http://arxiv.org/licenses/nonexclusive-distrib/1.0/","  In this manuscript we present a method for the quantitative comparison of two
surfaces, applicable to temporal and/or spatial extent in one or two
dimensions. Often surface comparisons are simply overlaid graphs of results
from different methodologies that are qualitative at best; it is the purpose of
this work to facilitate quantitative evaluation. The surfaces can be
analytical, numerical, and/or experimental, and the result returned by the
method, termed surface similarity parameter or normalized error, has been
normalized so that its value lies between zero and one. When the parameter has
a value of zero, the surfaces are in perfect agreement, whereas a value of one
is indicative of perfect disagreement. To provide insight regarding the
magnitude of the parameter, several canonical cases are presented, followed by
results from breaking water wave experimental measurements with numerical
simulations, and by a comparison of a prescribed, periodic, square-wave surface
profile and the subsequent manufactured surface.
","[{""version"":""v1"",""created"":""Mon, 22 Dec 2014 13:42:58 GMT""},{""version"":""v2"",""created"":""Tue, 24 Mar 2015 22:15:07 GMT""}]","2022-02-08"
"1412.6978","Yasuhiro Ishitsuka","Yasuhiro Ishitsuka","Orbit parametrizations of theta characteristics on hypersurfaces over
  arbitrary fields","35 pages",,,,"math.AG math.NT","http://arxiv.org/licenses/nonexclusive-distrib/1.0/","  It is well-known that theta characteristics on smooth plane curves over a
field of characteristic different from two are in bijection with certain smooth
complete intersections of three quadrics. We generalize this bijection to
possibly singular hypersurfaces of any dimension over arbitrary fields
including those of characteristic two. It is accomplished in terms of linear
orbits of tuples of symmetric matrices instead of smooth complete intersections
of quadrics. As an application of our methods, we give a description of the
projective automorphism groups of complete intersections of quadrics
generalizing Beauville's results.
","[{""version"":""v1"",""created"":""Mon, 22 Dec 2014 13:52:35 GMT""},{""version"":""v2"",""created"":""Thu, 15 Jan 2015 16:26:10 GMT""},{""version"":""v3"",""created"":""Wed, 21 Jan 2015 12:18:55 GMT""}]","2015-01-22"
"1412.6979","Volker Betz","Volker Betz and St\'ephane Le Roux","Multi-scale metastable dynamics and the asymptotic stationary
  distribution of perturbed Markov chains","26 pages, 1 figure",,,,"math.PR","http://arxiv.org/licenses/nonexclusive-distrib/1.0/","  We consider a simple but important class of metastable discrete time Markov
chains, which we call perturbed Markov chains. Basically, we assume that the
transition matrices depend on a parameter $\varepsilon$, and converge as
$\varepsilon$. We further assume that the chain is irreducible for
$\varepsilon$ but may have several essential communicating classes when
$\varepsilon$. This leads to metastable behavior, possibly on multiple time
scales. For each of the relevant time scales, we derive two effective chains.
The first one describes the (possibly irreversible) metastable dynamics, while
the second one is reversible and describes metastable escape probabilities.
Closed probabilistic expressions are given for the asymptotic transition
probabilities of these chains, but we also show how to compute them in a fast
and numerically stable way. As a consequence, we obtain efficient algorithms
for computing the committor function and the limiting stationary distribution.
","[{""version"":""v1"",""created"":""Mon, 22 Dec 2014 13:52:41 GMT""}]","2014-12-23"
"1412.6980","Diederik P Kingma M.Sc.","Diederik P. Kingma and Jimmy Ba","Adam: A Method for Stochastic Optimization","Published as a conference paper at the 3rd International Conference
  for Learning Representations, San Diego, 2015",,,,"cs.LG","http://arxiv.org/licenses/nonexclusive-distrib/1.0/","  We introduce Adam, an algorithm for first-order gradient-based optimization
of stochastic objective functions, based on adaptive estimates of lower-order
moments. The method is straightforward to implement, is computationally
efficient, has little memory requirements, is invariant to diagonal rescaling
of the gradients, and is well suited for problems that are large in terms of
data and/or parameters. The method is also appropriate for non-stationary
objectives and problems with very noisy and/or sparse gradients. The
hyper-parameters have intuitive interpretations and typically require little
tuning. Some connections to related algorithms, on which Adam was inspired, are
discussed. We also analyze the theoretical convergence properties of the
algorithm and provide a regret bound on the convergence rate that is comparable
to the best known results under the online convex optimization framework.
Empirical results demonstrate that Adam works well in practice and compares
favorably to other stochastic optimization methods. Finally, we discuss AdaMax,
a variant of Adam based on the infinity norm.
","[{""version"":""v1"",""created"":""Mon, 22 Dec 2014 13:54:29 GMT""},{""version"":""v2"",""created"":""Sat, 17 Jan 2015 20:26:06 GMT""},{""version"":""v3"",""created"":""Fri, 27 Feb 2015 21:04:48 GMT""},{""version"":""v4"",""created"":""Tue, 3 Mar 2015 17:51:27 GMT""},{""version"":""v5"",""created"":""Thu, 23 Apr 2015 16:46:07 GMT""},{""version"":""v6"",""created"":""Tue, 23 Jun 2015 19:57:17 GMT""},{""version"":""v7"",""created"":""Mon, 20 Jul 2015 09:43:23 GMT""},{""version"":""v8"",""created"":""Thu, 23 Jul 2015 20:27:47 GMT""},{""version"":""v9"",""created"":""Mon, 30 Jan 2017 01:27:54 GMT""}]","2017-01-31"
"1412.6981","Christian Bracco","Christian Bracco","Einstein and Besso: from Z\""urich to Milano",,"Istituto Lombardo - Accademia di Scienze e Lettere - Rendiconti di
  Scienze, vol. 148 (2014) :
  http://www.ilasl.org/index.php/Scienze/article/view/178",,,"physics.hist-ph","http://arxiv.org/licenses/nonexclusive-distrib/1.0/","  The 1896-1901 Milanese period is a key one to understand Einstein's training
background. When he was a student at the ETH in Z\""urich (the Swiss Federal
Polytechnic in Z\""urich) from 1896 to 1900, he would make regular trips back to
Milan to stay with his family who was involved in the development of the
electricity industry in northern Italy. Between 1899 and 1901, he would meet
his faithful friend and collaborator, Michele Besso in Milan on a regular
basis. Given their relationship, the 1899-1901 Milanese period therefore
foreshadowed the Bern period later in 1904. In order to specify the
circumstances under which Einstein and Besso got the chance to meet, we will
show that their respective families did have interconnected social networks,
especially through the electricity sector and the polytechnic engineering
Universities of Z\""urich and Milan. The branch of the Cantoni family, on
Michele's mother's side, rather ignored by now, played a crucial role: with
Vittorio Cantoni, a renowned electrical engineer who had not been previously
identified as being Michele's uncle, and Giuseppe Jung, professor at the Milan
Politecnico. We will also show that when staying in Milan, Einstein, who lived
in a well-known Milanese palace in the heart of the city, worked in the nearby
rich library of the Istituto Lombardo, Accademia di Scienze e Lettere in Brera.
The linkage between the scientific observations which can be found in
Einstein's correspondence and this library collection sheds new light on his
scientific work, in particular on his original thesis.
","[{""version"":""v1"",""created"":""Mon, 22 Dec 2014 13:55:22 GMT""}]","2015-07-28"
"1412.6982","Thomas Rauscher","T. Rauscher (1,2,3), C. Travaglio (4), R. Gallino (5), N. Nishimura
  (3,6), R. Hirschi (3,6,7) ((1) U Hertfordshire, UK, (2) U Basel, Switzerland,
  (3) UK Network for Bridging Disciplines of Galactic Chemical Evolution
  (BRIDGCE), (4) INAF-Astrophysical Observatory Turin, Italy, (5) U Turin,
  Italy, (6) Keele University, UK, (7) U Tokyo, Japan)","Production of 92Nb, 92Mo, and 146Sm in the gamma-process in SNIa","6 pages, 4 figures, Proceedings of the 13th Symposium on Nuclei in
  the Cosmos (NIC XIII), July 2014, Debrecen, Hungary",,,,"astro-ph.HE astro-ph.SR nucl-th","http://arxiv.org/licenses/nonexclusive-distrib/1.0/","  The knowledge of the production of extinct radioactivities like 92Nb and
146Sm by photodisintegration processes in ccSN and SNIa models is essential for
interpreting abundances in meteoritic material and for Galactic Chemical
Evolution (GCE). The 92Mo/92Nb and 146Sm/144Sm ratios provide constraints for
GCE and production sites. We present results for SNIa with emphasis on nuclear
uncertainties.
","[{""version"":""v1"",""created"":""Mon, 22 Dec 2014 14:00:48 GMT""}]","2014-12-23"
"1412.6983","Shiyan Li","J. Zhang, J. K. Dong, Y. Xu, J. Pan, L. P. He, L. J. Zhang, S. Y. Li","Superconductivity at 2.5 K in new transition-metal chalcogenide Ta2PdSe5","5 pages, 4 figures, 1 table","Supercond. Sci. Technol. 28, 115015 (2015)","10.1088/0953-2048/28/11/115015",,"cond-mat.supr-con cond-mat.str-el","http://arxiv.org/licenses/nonexclusive-distrib/1.0/","  We report the synthesis and superconducting properties of a new
transition-metal chalcogenide Ta$_2$PdSe$_5$. The measurements of resistivity,
magnetization, and specific heat reveal that Ta$_2$PdSe$_5$ is a bulk
superconductor with $T_c$ $\simeq$ 2.5 K. The zero-field electronic specific
heat in the superconducting state can be fitted with a two-gap BCS model. The
upper critical field $H_{c2}$ shows a linear temperature dependence, and the
value of $H_{c2}$(0) is much higher than the estimated Pauli limiting field
$H_{c2}^{P}$ and orbital limiting field $H_{c2}^{orb}$. All these results of
specific heat and upper critical field suggest that Ta$_2$PdSe$_5$ is a
multi-band superconductor.
","[{""version"":""v1"",""created"":""Mon, 22 Dec 2014 14:03:13 GMT""},{""version"":""v2"",""created"":""Sun, 4 Jan 2015 23:12:32 GMT""},{""version"":""v3"",""created"":""Mon, 13 Apr 2015 14:25:19 GMT""}]","2015-10-28"
"1412.6984","Elliot Krop","Hung Hua, Elliot Krop, and Christopher Raridan","A counterexample to a conjecture of Ghosh","4 pages",,,,"math.CO","http://arxiv.org/licenses/nonexclusive-distrib/1.0/","  We answer two questions of Shamik Ghosh in the negative. We show that there
exists a lobster tree of diameter less than 6 which accepts no alpha-labeling
with two central vertices labeled by the critical number and the maximum vertex
label. We also show a simple example of a tree of diameter 4, with an even
degree central vertex which does not accept a maximum label in any graceful
labeling.
","[{""version"":""v1"",""created"":""Mon, 22 Dec 2014 14:06:35 GMT""}]","2014-12-23"
"1412.6985","Oliver Knill","Oliver Knill","Coloring graphs using topology","81 pages, 48 figures",,,,"math.CO cs.CG cs.DM math.GT","http://arxiv.org/licenses/nonexclusive-distrib/1.0/","  Higher dimensional graphs can be used to colour two-dimensional geometric
graphs. If G the boundary of a three dimensional graph H for example, we can
refine the interior until it is colourable with 4 colours. The later goal is
achieved if all interior edge degrees are even. Using a refinement process
which cuts the interior along surfaces we can adapt the degrees along the
boundary of that surface. More efficient is a self-cobordism of G with itself
with a host graph discretizing the product of G with an interval. It follows
from the fact that Euler curvature is zero everywhere for three dimensional
geometric graphs, that the odd degree edge set O is a cycle and so a boundary
if H is simply connected. A reduction to minimal colouring would imply the four
colour theorem. The method is expected to give a reason ""why 4 colours suffice""
and suggests that every two dimensional geometric graph of arbitrary degree and
orientation can be coloured by 5 colours: since the projective plane can not be
a boundary of a 3-dimensional graph and because for higher genus surfaces, the
interior H is not simply connected, we need in general to embed a surface into
a 4-dimensional simply connected graph in order to colour it. This explains the
appearance of the chromatic number 5 for higher degree or non-orientable
situations, a number we believe to be the upper limit. For every surface type,
we construct examples with chromatic number 3,4 or 5, where the construction of
surfaces with chromatic number 5 is based on a method of Fisk. We have
implemented and illustrated all the topological aspects described in this paper
on a computer. So far we still need human guidance or simulated annealing to do
the refinements in the higher dimensional host graph.
","[{""version"":""v1"",""created"":""Mon, 22 Dec 2014 14:06:37 GMT""}]","2014-12-23"
"1412.6986","Tarek Abdelrahman","Tianyi David Han, Tarek S. Abdelrahman","Automatic Tuning of Local Memory Use on GPGPUs","Part of ADAPT Workshop proceedings, 2015 (arXiv:1412.2347)",,,"ADAPT/2015/04","cs.DC","http://arxiv.org/licenses/nonexclusive-distrib/1.0/","  The use of local memory is important to improve the performance of OpenCL
programs. However, its use may not always benefit performance, depending on
various application characteristics, and there is no simple heuristic for
deciding when to use it. We develop a machine learning model to decide if the
optimization is beneficial or not. We train the model with millions of
synthetic benchmarks and show that it can predict if the optimization should be
applied for a single array, in both synthetic and real benchmarks, with high
accuracy.
","[{""version"":""v1"",""created"":""Mon, 22 Dec 2014 14:06:37 GMT""}]","2014-12-23"
"1412.6987","Andrei Khrennikov Yu","Andrei Khrennikov","Bell as the Copernicus of Probability","consistent histories, the use of statistical data from incompatible
  experiments, no counterfactuals","Open systems and information dynamics 23, no 2, 1650008 (2016)","10.1142/S1230161216500086",,"quant-ph math.PR","http://arxiv.org/licenses/nonexclusive-distrib/1.0/","  Our aim is to emphasize the role of mathematical models in physics,
especially models of geometry and probability. We briefly compare developments
of geometry and probability by pointing to similarities and differences: from
Euclid to Lobachevsky and from Kolmogorov to Bell. In probability Bell played
the same role as Lobachevsky in geometry. In fact, violation of Bell's
inequality implies the impossibility to apply the classical probability model
of Kolmogorov (1933) to quantum phenomena. Thus quantum probabilistic model
(based on Born's rule) is an example of non-Kolmogorovian model of probability,
similarly to the Lobachevskian model -- the first example of non-Euclidean
model of geometry. We also discuss coupling of the classical probabilistic
model with classical (Boolean) logic. The Kolmogorov model of probability is
based on the set-theoretic presentation of the Boolean logic. In this framework
violation of Bell's inequality implies the impossibility to use the Boolean
structure of events for quantum phenomena; instead of it, events have to be
represented by linear subspaces. This is the ""probability model"" interpretation
of violation of Bell's inequality. We also criticize the standard
interpretation -- an attempt to add to rigorous mathematical probability models
additional elements such as (non)locality and (un)realism. Finally, we compare
embeddings of non-Euclidean geometries into the Euclidean space with embeddings
of the non-Kolmogorovian probabilities (in particular, quantum probability)
into the Kolmogorov probability space. As an example, we consider the
CHSH-test.
","[{""version"":""v1"",""created"":""Mon, 22 Dec 2014 14:15:30 GMT""},{""version"":""v2"",""created"":""Sat, 10 Jan 2015 12:39:30 GMT""}]","2018-07-25"
"1412.6988","Hayato Takahashi","Hayato Takahashi","Universal test for Hippocratic randomness","Submitted to Information Processing Letters",,,,"cs.IT math.IT","http://arxiv.org/licenses/nonexclusive-distrib/1.0/","  Hippocratic randomness is defined in a similar way to Martin-Lof randomness,
however it does not assume computability of the probability and the existence
of universal test is not assured. We introduce the notion of approximation of
probability and show the existence of the universal test (Levin-Schnorr
theorem) for Hippocratic randomness when the logarithm of the probability is
approximated within additive constant.
","[{""version"":""v1"",""created"":""Mon, 22 Dec 2014 14:17:42 GMT""}]","2014-12-23"
