"1412.7572","Tuomo Valkonen","Michael Hinterm\""uller, Tuomo Valkonen, and Tao Wu","Limiting aspects of non-convex ${TV}^\phi$ models",,,"10.1137/141001457",,"math.FA math.OC","http://arxiv.org/licenses/nonexclusive-distrib/1.0/","  Recently, non-convex regularisation models have been introduced in order to
provide a better prior for gradient distributions in real images. They are
based on using concave energies $\phi$ in the total variation type functional
${TV}^\phi(u) := \int \phi(|\nabla u(x)|) d x$. In this paper, it is
demonstrated that for typical choices of $\phi$, functionals of this type pose
several difficulties when extended to the entire space of functions of bounded
variation, ${BV}(\Omega)$. In particular, if $\phi(t)=t^q$ for $q \in (0, 1)$
and ${TV}^\phi$ is defined directly for piecewise constant functions and
extended via weak* lower semicontinuous envelopes to ${BV}(\Omega)$, then still
${TV}^\phi(u)=\infty$ for $u$ not piecewise constant. If, on the other hand,
${TV}^\phi$ is defined analogously via continuously differentiable functions,
then ${TV}^\phi \equiv 0$, (!). We study a way to remedy the models through
additional multiscale regularisation and area strict convergence, provided that
the energy $\phi(t)=t^q$ is linearised for high values. The fact, that this
kind of energies actually better matches reality and improves reconstructions,
is demonstrated by statistics and numerical experiments.
","[{""version"":""v1"",""created"":""Tue, 23 Dec 2014 22:50:34 GMT""}]","2020-02-13"
"1412.7574","Levent Alpoge","Levent Alpoge","Square-root cancellation for the signs of Latin squares","4 pages",,,,"math.CO","http://arxiv.org/licenses/nonexclusive-distrib/1.0/","  Let $L(n)$ be the number of Latin squares of order $n$, and let
$L^{\textrm{even}}(n)$ and $L^{\textrm{odd}}(n)$ be the number of even and odd
such squares, so that $L(n) = L^{\textrm{even}}(n) + L^{\textrm{odd}}(n)$. The
Alon-Tarsi conjecture states that $L^{\textrm{even}}(n)\neq
L^{\textrm{odd}}(n)$ when $n$ is even (when $n$ is odd the two are equal for
very simple reasons). In this short note we prove that $|L^{\textrm{even}}(n) -
L^{\textrm{odd}}(n)|\leq L(n)^{\frac{1}{2} + o(1)},$ thus establishing the
conjecture that the number of even and odd Latin squares, while conjecturally
not equal in even dimensions, are equal to leading order asymptotically. Two
proofs are given: both proceed by applying a differential operator to an
exponential integral over $\mathrm{SU}(n)$. The method is inspired by a recent
result of Kumar-Landsberg.
","[{""version"":""v1"",""created"":""Tue, 23 Dec 2014 23:46:51 GMT""}]","2014-12-25"
"1412.7576","Sebastian Fortin Dr.","Mario Castagnino, Sebastian Fortin, Roberto Laura and Daniel Sudarsky","Interpretations of Quantum Theory in the Light of Modern Cosmology","25 pages",,,,"gr-qc quant-ph","http://arxiv.org/licenses/nonexclusive-distrib/1.0/","  The difficult issues related to the interpretation of quantum mechanics and,
in particular, the ""measurement problem"" are revisited using as motivation the
process of generation of structure from quantum fluctuations in inflationary
cosmology. The unessential mathematical complexity of the particular problem is
bypassed, facilitating the discussion of the conceptual issues, by considering,
within the paradigm set up by the cosmological problem, another problem where
symmetry serves as a focal point: a simplified version of Mott's problem.
","[{""version"":""v1"",""created"":""Wed, 24 Dec 2014 00:42:01 GMT""}]","2014-12-25"
"1412.7577","Heather E. Logan","Heather E. Logan (Carleton U.)","Hiding a Higgs width enhancement from off-shell gg (--> h*) --> ZZ
  measurements","5 pages, 1 figure. v2: refs added, minor improvements to text. v3:
  expanded discussion, refs added, version accepted by PRD","Phys. Rev. D 92, 075038 (2015)","10.1103/PhysRevD.92.075038",,"hep-ph hep-ex","http://arxiv.org/licenses/nonexclusive-distrib/1.0/","  Measurements of the off-shell Higgs boson production cross section in gg (-->
h*) --> ZZ have recently been used by the CMS and ATLAS collaborations to
indirectly constrain the total width of the Higgs boson. I point out that the
interpretation of these measurements as a Higgs width constraint can be
invalidated if additional neutral Higgs boson(s) are present with masses below
about 350 GeV.
","[{""version"":""v1"",""created"":""Wed, 24 Dec 2014 00:44:13 GMT""},{""version"":""v2"",""created"":""Fri, 16 Jan 2015 15:41:42 GMT""},{""version"":""v3"",""created"":""Tue, 13 Oct 2015 15:17:48 GMT""}]","2015-11-04"
"1412.7578","Kaushik Seshadreesan","Jonathan P. Dowling and Kaushik P. Seshadreesan","Quantum optical technologies for metrology, sensing and imaging","Published online in the Jounal of Lightwave Technology. To appear in
  the IEEE/OSA Special Issue on the 23rd International Conference on OPTICAL
  FIBER SENSORS (OFS23)","Journal of Lightwave Technology vol. 33, no. 12, pages 2359 -
  2370, June 2015","10.1109/JLT.2014.2386795",,"quant-ph","http://arxiv.org/licenses/nonexclusive-distrib/1.0/","  Over the past 20 years, bright sources of entangled photons have led to a
renaissance in quantum optical interferometry. Optical interferometry has been
used to test the foundations of quantum mechanics and implement some of the
novel ideas associated with quantum entanglement such as quantum teleportation,
quantum cryptography, quantum lithography, quantum computing logic gates, and
quantum metrology. In this paper, we focus on the new ways that have been
developed to exploit quantum optical entanglement in quantum metrology to beat
the shot-noise limit, which can be used, e.g., in fiber optical gyroscopes and
in sensors for biological or chemical targets. We also discuss how this
entanglement can be used to beat the Rayleigh diffraction limit in imaging
systems such as in LIDAR and optical lithography.
","[{""version"":""v1"",""created"":""Wed, 24 Dec 2014 00:58:03 GMT""},{""version"":""v2"",""created"":""Fri, 27 Feb 2015 20:59:54 GMT""}]","2015-08-25"
"1412.7579","Yuliang Yan","Dai-Mei Zhou, Yu-Liang Yan, Xing-Long Li, Xiao-Mei Li, Bao-Guo Dong,
  Xu Cai, and Ben-Hao Sa","An upgraded issue of the parton and hadron cascade model, PACIAE 2.2","15 pages, 4 figures",,"10.1016/j.cpc.2015.01.022",,"nucl-th hep-ph","http://arxiv.org/licenses/nonexclusive-distrib/1.0/","  The parton and hadron cascade model PACIAE 2.1 (cf. Comput. Phys. Commun.184
(2013) 1476) has been upgraded to the new issue of PACIAE 2.2. By this new
issue the lepton-nucleon and lepton-nucleus (inclusive) deep inelastic
scatterings can also be investigated. As an example, the PACIAE 2.2 model is
enabled to calculate the specific charged hadron multiplicity in the $e^-$+p
and $e^-$+D semi-inclusive deep-inelastic scattering at 27.6 GeV electron beam
energy. The calculated results are well comparing with the corresponding HERMES
data. Additionally, the effect of model parameters \alpha and \beta in the Lund
string fragmentation function on the multiplicity is studied.
","[{""version"":""v1"",""created"":""Wed, 24 Dec 2014 01:19:20 GMT""}]","2016-05-04"
"1412.7580","Nicolas Vasilache","Nicolas Vasilache, Jeff Johnson, Michael Mathieu, Soumith Chintala,
  Serkan Piantino, Yann LeCun","Fast Convolutional Nets With fbfft: A GPU Performance Evaluation","Camera ready for ICLR2015",,,,"cs.LG cs.DC cs.NE","http://arxiv.org/licenses/nonexclusive-distrib/1.0/","  We examine the performance profile of Convolutional Neural Network training
on the current generation of NVIDIA Graphics Processing Units. We introduce two
new Fast Fourier Transform convolution implementations: one based on NVIDIA's
cuFFT library, and another based on a Facebook authored FFT implementation,
fbfft, that provides significant speedups over cuFFT (over 1.5x) for whole
CNNs. Both of these convolution implementations are available in open source,
and are faster than NVIDIA's cuDNN implementation for many common convolutional
layers (up to 23.5x for some synthetic kernel configurations). We discuss
different performance regimes of convolutions, comparing areas where
straightforward time domain convolutions outperform Fourier frequency domain
convolutions. Details on algorithmic applications of NVIDIA GPU hardware
specifics in the implementation of fbfft are also provided.
","[{""version"":""v1"",""created"":""Wed, 24 Dec 2014 01:31:36 GMT""},{""version"":""v2"",""created"":""Tue, 30 Dec 2014 16:55:04 GMT""},{""version"":""v3"",""created"":""Fri, 10 Apr 2015 20:01:00 GMT""}]","2015-04-14"
"1412.7581","Robert J. Nemiroff","Robert J. Nemiroff","Superluminal Spot Pair Events in Astronomical Settings: Sweeping Beams","30 pages, 8 figures, accepted for publication in PASA",,"10.1017/pasa.2014.46",,"astro-ph.IM physics.optics","http://arxiv.org/licenses/nonexclusive-distrib/1.0/","  Sweeping beams of light can cast spots moving with superluminal speeds across
scattering surfaces. Such faster-than-light speeds are well-known phenomena
that do not violate special relativity. It is shown here that under certain
circumstances, superluminal spot pair creation and annihilation events can
occur that provide unique information to observers. These spot pair events are
{\it not} particle pair events -- they are the sudden creation or annihilation
of a pair of relatively illuminated spots on a scattering surface. Real spot
pair illumination events occur unambiguously on the scattering surface when
spot speeds diverge, while virtual spot pair events are observer dependent and
perceived only when real spot radial speeds cross the speed of light.
Specifically, a virtual spot pair creation event will be observed when a real
spot's speed toward the observer drops below $c$, while a virtual spot pair
annihilation event will be observed when a real spot's radial speed away from
the observer rises above $c$. Superluminal spot pair events might be found
angularly, photometrically, or polarimetrically, and might carry useful
geometry or distance information. Two example scenarios are briefly considered.
The first is a beam swept across a scattering spherical object, exemplified by
spots of light moving across Earth's Moon and pulsar companions. The second is
a beam swept across a scattering planar wall or linear filament, exemplified by
spots of light moving across variable nebulae including Hubble's Variable
Nebula. In local cases where the sweeping beam can be controlled and repeated,
a three-dimensional map of a target object can be constructed. Used
tomographically, this imaging technique is fundamentally different from lens
photography, radar, and conventional lidar.
","[{""version"":""v1"",""created"":""Wed, 24 Dec 2014 01:38:07 GMT""}]","2015-06-23"
"1412.7582","Renyu Hu","Renyu Hu","Ammonia, Water Clouds and Methane Abundances of Giant Exoplanets and
  Opportunities for Super-Earth Exoplanets","Report of a quick study of science return from direct-imaging
  exoplanet missions, commissioned by the NASA Exoplanet Exploration Program on
  behalf of the WFIRST/AFTA Science Definition Team and the Exo-S and Exo-C
  Science and Technology Definition Teams",,,,"astro-ph.EP","http://arxiv.org/licenses/nonexclusive-distrib/1.0/","  Future direct-imaging exoplanet missions such as WFIRST/AFTA, Exo-C, and
Exo-S will measure the reflectivity of exoplanets at visible wavelengths. The
exoplanets to be observed will be located further away from their parent stars
than is Earth from the Sun. These ""cold"" exoplanets have atmospheric
environments conducive for the formation of water and/or ammonia clouds, like
Jupiter in the Solar System. We study the science return from direct-imaging
exoplanet missions, focusing on the exoplanet atmospheric compositions. First,
the study shows that a low-resolution (R=70) reflection spectrum of a giant
exoplanet at 600 - 1000 nm, for a moderate signal-to-noise ratio of 20, will
allow measurements of both the pressure of the uppermost cloud deck and the
mixing ratio of methane, if the uppermost cloud deck is located at the pressure
level of 0.6 - 1.5 bars. Further increasing the signal-to-noise ratio can
improve the measurement range of the cloud deck pressure to 0.2 - 4 bars. The
strong and the weak absorption bands of methane allow the simultaneous
measurements of cloud and gas; when the uppermost cloud deck is located
shallower than the pressure level of 0.2, the weak bands are muted, and the
cloud deck pressure and the mixing ratio of methane are not distinguishable
from a single reflection spectrum. Second, future direct-imaging exoplanet
missions may detect the broadband reflectivity of a few super-Earth exoplanets.
If having H2O-dominated atmospheres, directly imaged super Earths are likely to
have water clouds located shallower than 1E-3 bars. The very high clouds on
these planets would mute most gas absorption features except for H2O, and these
planets would occupy a confined phase space in the color-color diagrams.
","[{""version"":""v1"",""created"":""Wed, 24 Dec 2014 01:38:27 GMT""}]","2014-12-25"
"1412.7583","Viet Hung Nguyen","Viet Hung Nguyen, Philippe Dollfus","Strain-induced modulation of Dirac cones and van Hove singularities in
  twisted graphene bilayer","8 pages, 7 figures, submitted","2D Materials 2, 035005 (2015)","10.1088/2053-1583/2/3/035005",,"cond-mat.mes-hall","http://arxiv.org/licenses/nonexclusive-distrib/1.0/","  By means of atomistic tight-binding calculations, we investigate the effects
of uniaxial strain on the electronic bandstructure of twisted graphene bilayer.
We find that the bandstructure is dramatically deformed and the degeneracy of
the bands is broken by strain. As a conseqence, the number of Dirac cones can
double and the van Hove singularity points are separated in energy. The
dependence of these effects on the strength of strain, its applied direction
and the twist angle is carefully clarified. As an important result, we
demonstrate that the position of van Hove singularities can be modulated by
strain, suggesting the possibility of observing this phenomenon at low energy
in a large range of twist angle (i.e., larger than $10^\circ$). Unfortunately,
these interesting/important phenomena have not been clarified in the previous
works based on the continuum approximation. While they are in good agreement
with available experiments, our results provide a detailed understanding of the
strain effects on the electronic properties and may motivate other
investigations of electronic transport in this type of graphene lattice.
","[{""version"":""v1"",""created"":""Wed, 24 Dec 2014 01:46:59 GMT""}]","2015-07-13"
"1412.7584","Zhanglong Ji","Zhanglong Ji, Zachary C. Lipton, Charles Elkan","Differential Privacy and Machine Learning: a Survey and Review",,,,,"cs.LG cs.CR cs.DB","http://arxiv.org/licenses/nonexclusive-distrib/1.0/","  The objective of machine learning is to extract useful information from data,
while privacy is preserved by concealing information. Thus it seems hard to
reconcile these competing interests. However, they frequently must be balanced
when mining sensitive data. For example, medical research represents an
important application where it is necessary both to extract useful information
and protect patient privacy. One way to resolve the conflict is to extract
general characteristics of whole populations without disclosing the private
information of individuals.
  In this paper, we consider differential privacy, one of the most popular and
powerful definitions of privacy. We explore the interplay between machine
learning and differential privacy, namely privacy-preserving machine learning
algorithms and learning-based data release mechanisms. We also describe some
theoretical results that address what can be learned differentially privately
and upper bounds of loss functions for differentially private algorithms.
  Finally, we present some open questions, including how to incorporate public
data, how to deal with missing data in private datasets, and whether, as the
number of observed samples grows arbitrarily large, differentially private
machine learning algorithms can be achieved at no cost to utility as compared
to corresponding non-differentially private algorithms.
","[{""version"":""v1"",""created"":""Wed, 24 Dec 2014 01:51:06 GMT""}]","2014-12-25"
"1412.7585","Jia Xu","Jia Xu, Patrick Shironoshita, Ubbo Visser, Nigel John, Mansur Kabuka","Converting Instance Checking to Subsumption: A Rethink for Object
  Queries over Practical Ontologies",,"International Journal of Intelligence Science, Vol. 5 No. 1,
  44-62, 2015","10.4236/ijis.2015.51005",,"cs.AI","http://arxiv.org/licenses/nonexclusive-distrib/1.0/","  Efficiently querying Description Logic (DL) ontologies is becoming a vital
task in various data-intensive DL applications. Considered as a basic service
for answering object queries over DL ontologies, instance checking can be
realized by using the most specific concept (MSC) method, which converts
instance checking into subsumption problems. This method, however, loses its
simplicity and efficiency when applied to large and complex ontologies, as it
tends to generate very large MSC's that could lead to intractable reasoning. In
this paper, we propose a revision to this MSC method for DL SHI, allowing it to
generate much simpler and smaller concepts that are specific-enough to answer a
given query. With independence between computed MSC's, scalability for query
answering can also be achieved by distributing and parallelizing the
computations. An empirical evaluation shows the efficacy of our revised MSC
method and the significant efficiency achieved when using it for answering
object queries.
","[{""version"":""v1"",""created"":""Wed, 24 Dec 2014 02:18:01 GMT""},{""version"":""v2"",""created"":""Tue, 17 Feb 2015 20:23:48 GMT""},{""version"":""v3"",""created"":""Thu, 26 Feb 2015 17:18:41 GMT""}]","2015-02-27"
"1412.7586","David Jerison","Alessio Figalli and David Jerison","Quantitative stability for sumsets in $R^n$",,,,,"math.NT math.AP","http://arxiv.org/licenses/nonexclusive-distrib/1.0/","  Given a measurable set $A\subset \R^n$ of positive measure, it is not
difficult to show that $|A+A|=|2A|$ if and only if $A$ is equal to its convex
hull minus a set of measure zero. We investigate the stability of this
statement: If $(|A+A|-|2A|)/|A|$ is small, is $A$ close to its convex hull? Our
main result is an explicit control, in arbitrary dimension, on the measure of
the difference between $A$ and its convex hull in terms of $(|A+A|-|2A|)/|A|$.
","[{""version"":""v1"",""created"":""Wed, 24 Dec 2014 02:30:16 GMT""}]","2014-12-25"
"1412.7587","Jin-Wu Jiang","Jin-Wu Jiang, Bing-Shen Wang, Harold S. Park","Interlayer Breathing and Shear Modes in Few-Layer Black Phosphorus","10 figures, 7 tables",,,,"cond-mat.mtrl-sci","http://arxiv.org/licenses/nonexclusive-distrib/1.0/","  The interlayer breathing and shear modes in few-layer black phosphorus are
investigated for their symmetry and lattice dynamical properties. The symmetry
groups for the even-layer and odd-layer few-layer black phosphorus are utilized
to determine the irreducible representation and the infrared and Raman activity
for the interlayer modes. The valence force field model is applied to calculate
the eigenvectorw and frequencies for the interlayer breathing and shear modes,
which are explained using the atomic chain model. The anisotropic puckered
configuration for black phosphorus leads to a highly anisotropic frequency for
the two interlayer shear modes. More specifically, the frequency for the shear
mode in the direction perpendicular to the pucker is less than half of the
shear mode in the direction parallel with the pucker. We also report a set of
interlayer modes having the same frequency for all few-layer black phosphorus
with layer number N=3i with integer i, because of their collective vibrational
displacements. The optical activity of the collective modes supports possible
experimental identification for these modes.
","[{""version"":""v1"",""created"":""Wed, 24 Dec 2014 02:31:48 GMT""}]","2014-12-25"
"1412.7588","Phan Hoang Chon","Phan H. Chon","Modular coinvariants and the mod p homology of QS^k","26 pages; To appear in Proceedings of the London Mathematical Society",,"10.1112/plms/pdv073",,"math.AT","http://arxiv.org/licenses/nonexclusive-distrib/1.0/","  We use modular invariant theory to establish a complete set of relations of
the mod $p$ homology of $\{QS^k\}_{k\geq0}$, for $p$ odd, as a ring object in
the category of coalgebras (also known as a coalgebraic ring or a Hopf ring).
We also describe the action of the mod $p$ Dyer-Lashof algebra as well as the
mod $p$ Steenrod algebra on the coalgebraic ring.
","[{""version"":""v1"",""created"":""Wed, 24 Dec 2014 02:37:51 GMT""},{""version"":""v2"",""created"":""Wed, 2 Dec 2015 02:16:33 GMT""}]","2017-05-17"
"1412.7589","Rub\'en Vigara","Ruben Vigara","Non-euclidean shadows of classical projective theorems","Comments to version 2: some minor changes and corrected typos
  introduced",,,,"math.MG","http://arxiv.org/licenses/nonexclusive-distrib/1.0/","  Some translations into non-euclidean geometry of classical theorems of planar
projective geometry are explored. The existence of some common triangle centers
is dedeuced from theorems of Pascal and Chasles. Desargues' Theorem allows to
construct a non-euclidean version of the Euler line and the nine-point circle
of a triangle. The whole non-euclidean trigonometry (for triangles and
generalizaed triangles) can be deduced from Menelaus' Theorem. A theorem of
Carnot about affine triangles implies the non-euclidean versions of another
theorem of Carnot about euclidean triangles. Finally, it is given the
projective theorem which is hidden behind all the laws of cosines of
non-euclidean triangles and generalized triangles.
","[{""version"":""v1"",""created"":""Wed, 24 Dec 2014 02:54:37 GMT""},{""version"":""v2"",""created"":""Thu, 22 Jan 2015 12:32:50 GMT""}]","2015-01-23"
"1412.7590","Eric Norman","Eric B. Norman, Keenan J. Thomas, Kristina E. Telhami","Seaborg's Plutonium?",,,,,"nucl-ex physics.ins-det","http://arxiv.org/licenses/nonexclusive-distrib/1.0/","  Passive x-ray and gamma-ray analysis was performed on UC Berkeley's EH&S
Sample S338. The object was found to contain Pu-239 and no other radioactive
isotopes. The mass of Pu-239 contained in this object was determined to be 2.0
+- 0.3 micrograms. These observations are consistent with the identification of
this object being the 2.77-microgram plutonium oxide sample described by Glenn
Seaborg and his collaborators as the first sample of Pu-239 that was large
enough to be weighed.
","[{""version"":""v1"",""created"":""Wed, 24 Dec 2014 03:00:01 GMT""},{""version"":""v2"",""created"":""Tue, 17 Feb 2015 20:05:20 GMT""}]","2015-02-18"
"1412.7591","Qingxue Wang","Elisha Falbel, Qingxue Wang","Duality and invariants of representations of fundamental groups of
  3-manifolds into PGL(3,C)","Revised version, 29 pages,4 figures","Journal of the London Mathematical Society, (2) 95 (2017) 1-22","10.1112/jlms.12004",,"math.GT","http://arxiv.org/licenses/nonexclusive-distrib/1.0/","  We determine the explicit transformation under duality of generic
configurations of four flags in $\PGL(3,\bC)$ in cross-ratio coordinates. As an
application we prove invariance under duality of an invariant in the Bloch
group obtained from decorated triangulations of 3-manifolds.
","[{""version"":""v1"",""created"":""Wed, 24 Dec 2014 03:07:31 GMT""},{""version"":""v2"",""created"":""Tue, 9 Aug 2016 11:26:58 GMT""}]","2018-06-18"
"1412.7592","David Jerison","Yves Colin de Verdiere, Victor Guillemin, and David Jerison","Singularities of the wave trace for the Friedlander model",,,,,"math.AP","http://arxiv.org/licenses/nonexclusive-distrib/1.0/","  In a recent preprint, we showed that for the Dirichlet Laplacian $\Delta$ on
the unit disk, the wave trace ${Tr}(e^{it\sqrt{\Delta}})$, which has
complicated singularities on $2\pi - \epsilon < t < 2\pi$, is, on the interval
$2\pi < t < 2\pi + \epsilon$, the restriction to this interval of a $C^\infty$
function on its closure. In this paper we prove the analogue of this somewhat
counter-intuitive result for the Friedlander model. The proof for the
Friedlander model is simpler and more transparent than in the case of the unit
disk.
","[{""version"":""v1"",""created"":""Wed, 24 Dec 2014 03:11:20 GMT""}]","2014-12-25"
