"1412.7422","Emanuel Huhnen-Venedey","Alexander I. Bobenko, Emanuel Huhnen-Venedey, Thilo R\""orig","Supercyclidic nets","34 pages, 20 figures","Internat. Math. Research Notices, vol. 2017 (2), 323-371",,,"math.DG","http://arxiv.org/licenses/nonexclusive-distrib/1.0/","  Supercyclides are surfaces with a characteristic conjugate parametrization
consisting of two families of conics. Patches of supercyclides can be adapted
to a Q-net (a discrete quadrilateral net with planar faces) such that
neighboring surface patches share tangent planes along common boundary curves.
We call the resulting patchworks 'supercyclidic nets' and show that every Q-net
in $\mathbb{R}P^3$ can be extended to a supercyclidic net. The construction is
governed by a multidimensionally consistent 3D system. One essential aspect of
the theory is the extension of a given Q-net in $\mathbb{R}P^N$ to a system of
circumscribed discrete torsal line systems. We present a description of the
latter in terms of projective reflections that generalizes the systems of
orthogonal reflections which govern the extension of circular nets to cyclidic
nets by means of Dupin cyclide patches.
","[{""version"":""v1"",""created"":""Tue, 23 Dec 2014 16:03:10 GMT""}]","2017-09-08"
"1412.7423","Cupatitzio Ram\'irez Romero","J.P. Mart\'inez-Garcilazo and C. Ram\'irez","Ground states for nonuniform periodic Ising chains","11 pages, 4 figures",,"10.1103/PhysRevE.91.042128",,"cond-mat.stat-mech","http://arxiv.org/licenses/nonexclusive-distrib/1.0/","  We give a generalization of Morita's works on ground states of Ising chains,
for chains with a periodic structure with different spins, and distant neighbor
interactions. The main assumption is translational invariance. The length of
the irreducible blocks is a multiple of the period of the chain. In the case of
parity invariance, it restricts the length in general only in the diatomic
case. There are degenerated states and under certain circumstances there could
be nonregular ground states. We illustrate the results and give the ground
state diagrams in several cases.
","[{""version"":""v1"",""created"":""Tue, 23 Dec 2014 16:04:59 GMT""}]","2015-05-20"
"1412.7424","Siddharth Prakash Rao","Siddharth Prakash Rao","Turning Bitcoins into the Best-coins",,,,,"cs.CR","http://arxiv.org/licenses/nonexclusive-distrib/1.0/","  In this paper we discuss Bitcoin, the leader among the existing
cryptocurrencies, to analyse its trends, success factors, current challenges
and probable solutions to make it even better. In the introduction section, we
discuss the history and working mechanism of Bitcoin. In the background
section, we develop the ideas that evolved in the process of making a stable
cryptocurrency. We also analyze the survey matrices of the present day
cryptocurrencies. This survey clearly shows that Bitcoin is the clear winner
among its kind. Section 3 is about the success factors of Bitcoin and the
proceeding sections are a discussion about current challenges which pose as
hurdles in making Bitcoin a better currency in the digital world. We finally
discuss the balance between anonymity and reduced trust in the cryptocurrency
world, before concluding the survey.
","[{""version"":""v1"",""created"":""Tue, 23 Dec 2014 16:09:13 GMT""}]","2014-12-24"
"1412.7425","Alexey Kavokin","A.V. Kavokin, A.S. Sheremet, I.A. Shelykh, P.G. Lagoudakis, and Y.G.
  Rubo","Exciton-photon correlations in bosonic condensates of exciton-polaritons","5 pages, 2 figures","Scientific Reports 5, 12020 (2015)","10.1038/srep12020",,"cond-mat.mes-hall","http://arxiv.org/licenses/nonexclusive-distrib/1.0/","  Exciton-polaritons are mixed light-matter quasiparticles. We have developed a
statistical model describing stochastic exciton-photon transitions within a
condensate of exciton polaritons. We show that the exciton-photon correlator
depends on the ""hidden variable"" which characterizes the rate of exciton-photon
transformations in the condensate. We discuss implications of this effect for
the quantum statistics of photons emitted by polariton lasers.
","[{""version"":""v1"",""created"":""Tue, 23 Dec 2014 16:11:40 GMT""}]","2018-07-10"
"1412.7426","Giuseppe Da Prato x","Giuseppe Da Prato, Arnaud Debussche","Estimate for $P_tD$ for the stochastic Burgers equation",,,,,"math.PR","http://arxiv.org/licenses/nonexclusive-distrib/1.0/","  We consider the Burgers equation on $H=L^2(0,1)$ perturbed by white noise and
the corresponding transition semigroup $P_t$. We prove a new formula for
$P_tD\varphi$ (where $\varphi:H\to\R$ is bounded and Borel) which depends on
$\varphi$ but not on its derivative. Then we deduce some new consequences for
the invariant measure $\nu$ of $P_t$ as its Fomin differentiability and an
integration by parts formula which generalises the classical one for gaussian
measures.
","[{""version"":""v1"",""created"":""Tue, 23 Dec 2014 16:12:20 GMT""}]","2014-12-24"
"1412.7427","Marian Boguna","Guillem Mosquera-Donate and Marian Boguna","Follow the Leader: Herding Behavior in Heterogeneous Populations",,,"10.1103/PhysRevE.91.052804",,"physics.soc-ph nlin.AO","http://arxiv.org/licenses/nonexclusive-distrib/1.0/","  Here we study the emergence of spontaneous leadership in large populations.
In standard models of opinion dynamics, herding behavior is only obeyed at the
local scale due to the interaction of single agents with their neighbors; while
at the global scale, such models are governed by purely diffusive processes.
Surprisingly, in this paper we show that the combination of a strong separation
of time scales within the population and a hierarchical organization of the
influences of some agents on the others induces a phase transition between a
purely diffusive phase, as in the standard case, and a herding phase where a
fraction of the agents self-organize and lead the global opinion of the whole
population.
","[{""version"":""v1"",""created"":""Tue, 23 Dec 2014 16:14:47 GMT""}]","2015-06-11"
"1412.7428","Girjesh R. Gupta Dr.","G. R. Gupta, Durgesh Tripathi, Helen E. Mason","Spectroscopic Observations of a Coronal Loop: Basic Physical Plasma
  Parameters Along the Full Loop Length","accepted for publication in ApJ","ApJ 800, 140 (2015)","10.1088/0004-637X/800/2/140",,"astro-ph.SR","http://arxiv.org/licenses/nonexclusive-distrib/1.0/","  Coronal loops are the basic structures of the solar transition region and
corona. The understanding of physical mechanism behind the loop heating, plasma
flows, and filling are still considered a major challenge in the solar physics.
The mechanism(s) should be able to supply mass to the corona from the
chromosphere and able to heat the plasma over 1 MK within the small distance of
few hundred km from the chromosphere to the corona. This problem makes coronal
loops an interesting target for detailed study. In this study, we focus on
spectroscopic observations of a coronal loop, observed in its full length, in
various spectral lines as recorded by the Extreme-ultraviolet Imaging
Spectrometer (EIS) on-board Hinode. We derive physical plasma parameters such
as electron density, temperature, pressure, column depth, and filling factors
along the loop length from one foot-point to the another. The obtained
parameters are used to infer whether the observed coronal loop is over-dense or
under-dense with respect to gravitational stratification of the solar
atmosphere. These new measurements of physical plasma parameters, from one
foot-point to another, provide important constraints on the modeling of the
mass and energy balance in the coronal loops.
","[{""version"":""v1"",""created"":""Tue, 23 Dec 2014 16:17:22 GMT""}]","2015-02-24"
"1412.7429","Lennon O Naraigh","Lennon O. Naraigh","Global modes in nonlinear non-normal evolutionary models: exact
  solutions, perturbation theory, direct numerical simulation, and chaos","34 pages, 13 figures",,"10.1016/j.physd.2015.07.004",,"physics.flu-dyn physics.optics quant-ph","http://arxiv.org/licenses/nonexclusive-distrib/1.0/","  This paper is concerned with the theory of generic non-normal nonlinear
evolutionary equations, with potential applications in Fluid Dynamics and
Optics. Two theoretical models are presented. The first is a model two-level
non-normal nonlinear system that not only highlights the phenomena of linear
transient growth, subcritical transition and global modes, but is also of
potential interest in its own right in the field of nonlinear optics. The
second is the fairly familiar inhomogeneous nonlinear complex Ginzburg--Landau
(CGL) equation. The two-level model is exactly solvable for the nonlinear
global mode and its stability, while for the spatially-extended CGL equation,
perturbative solutions for the global mode and its stability are presented,
valid for inhomogeneities with arbitrary scales of spatial variation and global
modes of small amplitude, corresponding to a scenario near criticality. For
other scenarios, a numerical iterative nonlinear eigenvalue technique is
preferred. Two global modes of different amplitudes are revealed in the
numerical approach. For both the two-level system and the nonlinear CGL
equation, the analytical calculations are supplemented with direct numerical
simulation, thus showing the fate of unstable global modes. For the two-level
model this results in unbounded growth of the full nonlinear equations. For the
spatially-extended CGL model in the subcritical regime, the global mode of
larger amplitude exhibits a `one-sided' instability leading to a chaotic
dynamics, while the global mode of smaller amplitude is always unstable (theory
confirms this). However, advection can stabilize the mode of larger amplitude.
","[{""version"":""v1"",""created"":""Tue, 23 Dec 2014 16:18:33 GMT""},{""version"":""v2"",""created"":""Tue, 6 Jan 2015 11:04:03 GMT""}]","2015-09-30"
"1412.7430","Changjiang Bu","Lizhu Sun, Baodong Zheng, Changjiang Bu and Yimin Wei","Some results on the generalized inverse of tensors and idempotent
  tensors",,,,,"math.NA math.SP","http://arxiv.org/licenses/nonexclusive-distrib/1.0/","  Let $\mathcal{A}$ be an order $t$ dimension $m\times n\times \cdots \times n$
tensor over complex field. In this paper, we study some {generalized inverses}
of $\mathcal{A}$, the {$k$-T-idempotent tensors} and the idempotent tensors
based on the general tensor product. Using the tensor generalized inverse, some
solutions of the equation $\mathcal{A}\cdot x^{t-1}=b$ are given, where $x$ and
$b$ are dimension $n$ and $m$ vectors, respectively. The {generalized inverses}
of some block tensors, the eigenvalues of {$k$-T-idempotent tensors} and
idempotent tensors are given. And the relation between the generalized inverses
of tensors and the $k$-T-idempotent tensors is also showed.
","[{""version"":""v1"",""created"":""Tue, 23 Dec 2014 16:19:06 GMT""}]","2014-12-24"
"1412.7431","Juha Lepp\""akangas","J. Lepp\""akangas, A. Puska, L. \""Ak\""aslompolo, E. Thuneberg, P. J.
  Hakonen","Fully superconducting Bloch-oscillating transistor: Amplification and
  bifurcation based on Bloch oscillations and counterflowing Cooper pairs","14 pages, 8 figures",,,,"cond-mat.mes-hall cond-mat.supr-con","http://arxiv.org/licenses/nonexclusive-distrib/1.0/","  The Bloch-oscillating transistor (BOT) is an amplifier that utilizes
semiclassical dynamics of states in energy bands under traveling quasimomentum.
In a BOT, a single quasiparticle tunneling across a base tunnel junction
switches the state of a superconducting tunnel junction to a lower Bloch band,
triggering a series of resonant Cooper-pair tunnelings through an emitter
Josephson junction (Bloch oscillations). Here, we investigate experimentally
and theoretically an alternative realization of this device, based only on
superconducting tunnel junctions. We discover new amplification schemes, where
the periodic motion of the quasimomentum is used to control charge transport
between the electrodes. Remarkable, in operation the resonant Cooper-pair
transport across the base Josephson junction occurs repeatedly to two opposite
directions.
","[{""version"":""v1"",""created"":""Tue, 23 Dec 2014 16:22:18 GMT""}]","2014-12-24"
"1412.7432","Omar Osenda","Mariano Garagiola and Omar Osenda","Spectral properties and control of an exciton trapped in a multi-layered
  quantum dot",,,,,"quant-ph cond-mat.mes-hall","http://arxiv.org/licenses/nonexclusive-distrib/1.0/","  The spectral properties of one exciton trapped in a self-assembled
multi-layered quantum dot is obtained using a high precision variational
numerical method. The exciton Hamiltonian includes the effect of the
polarization charges, induced by the presence of the exciton in the quantum
dot, at the material interfaces. The method allows to implement rather easily
the matching conditions at the interfaces of the hetero-structure. The
numerical method also provides accurate approximate eigenfunctions that enable
the study of the separability of the exciton eigenfunction in electron and hole
states. The separability, or the entanglement content, of the total wave
function allows a better understanding of the spectral properties of the
exciton and, in particular, shed some light about when the perturbation theory
calculation of the spectrum is fairly correct or not. Finally, using the
approximate spectrum and eigenfunctions, the controlled time evolution of the
exciton wave function is analyzed when an external driving field is applied to
the system. It is found that it is possible to obtain pico and sub-picoseconds
controlled oscillations between two particular states of the exciton with a
rather low leakage of probability to other exciton states, and with a simple
pulse shape.
","[{""version"":""v1"",""created"":""Tue, 23 Dec 2014 16:28:47 GMT""}]","2014-12-24"
"1412.7433","Sylvain Schwartz","M. Ammar, M. Dupont-Nivet, L. Huet, J.-P. Pocholle, P. Rosenbusch, I.
  Bouchoule, C. I. Westbrook, J. Est\`eve, J. Reichel, C. Guerlin and S.
  Schwartz","Symmetric micro-wave potentials for interferometry with thermal atoms on
  a chip",,,"10.1103/PhysRevA.91.053623",,"physics.atom-ph","http://arxiv.org/licenses/nonexclusive-distrib/1.0/","  A trapped atom interferometer involving state-selective adiabatic potentials
with two microwave frequencies on a chip is proposed. We show that this
configuration provides a way to achieve a high degree of symmetry between the
two arms of the interferometer, which is necessary for coherent splitting and
recombination of thermal (i.e. non-condensed) atoms. The resulting
interferometer holds promise to achieve high contrast and long coherence time,
while avoiding the mean-field interaction issues of interferometers based on
trapped Bose-Einstein condenstates.
","[{""version"":""v1"",""created"":""Tue, 23 Dec 2014 16:29:54 GMT""}]","2015-06-11"
"1412.7434","Oscar Naviliat-Cuncic","V.F. Ezhov, A.Z. Andreev, G. Ban, B.A. Bazarov, P. Geltenbort, A.G.
  Glushkov, V.A. Knyazkov, N.A. Kovrizhnykh, G.B. Krygin, O. Naviliat-Cuncic,
  and V.L. Ryabov","Measurement of the neutron lifetime with ultra-cold neutrons stored in a
  magneto-gravitational trap","4 pages, 3 figures",,,,"nucl-ex physics.ins-det","http://arxiv.org/licenses/nonexclusive-distrib/1.0/","  We report a new measurement of the neutron lifetime using ultra-cold neutrons
stored in a magneto-gravitational trap made of permanent magnets. Neutrons
surviving in the trap after fixed storage times have been counted and the trap
losses have continuously been monitored during storage by detecting neutrons
leaking from the trap. The value of the neutron lifetime resulting from this
measurement is $\tau_n=(878.3\pm1.9)$s. It is the most precise measurement of
the neutron lifetime obtained with magnetically stored neutrons.
","[{""version"":""v1"",""created"":""Tue, 23 Dec 2014 16:32:28 GMT""}]","2014-12-24"
"1412.7435","Daniele Pranzetti","Daniele Pranzetti and Hanno Sahlmann","Horizon entropy with loop quantum gravity methods","15 pages, 2 figures; published version","Physics Letters B 746 (2015) 209-216","10.1016/j.physletb.2015.04.070",,"gr-qc","http://arxiv.org/licenses/nonexclusive-distrib/1.0/","  We show that the spherically symmetric isolated horizon can be described in
terms of an SU(2) connection and a su(2) valued one form, obeying certain
constraints. The horizon symplectic structure is precisely the one of 3d
gravity in a first order formulation. We quantize the horizon degrees of
freedom in the framework of loop quantum gravity, with methods recently
developed for 3d gravity with non-vanishing cosmological constant. Bulk
excitations ending on the horizon act very similar to particles in 3d gravity.
The Bekenstein-Hawking law is recovered in the limit of imaginary
Barbero-Immirzi parameter. Alternative methods of quantization are also
discussed.
","[{""version"":""v1"",""created"":""Tue, 23 Dec 2014 16:34:42 GMT""},{""version"":""v2"",""created"":""Mon, 18 May 2015 11:18:56 GMT""}]","2015-05-19"
"1412.7436","James Nightingale","James Nightingale, Simon Dye","Adaptive Semi-linear Inversion of Strong Gravitational Lens Imaging","19 pages, 16 figures, 4 tables, Revised Submission to MNRAS",,"10.1093/mnras/stv1455",,"astro-ph.IM astro-ph.GA","http://arxiv.org/licenses/nonexclusive-distrib/1.0/","  We present a new pixelized method for the inversion of gravitationally lensed
extended source images which we term adaptive semi-linear inversion (SLI). At
the heart of the method is an h-means clustering algorithm which is used to
derive a source plane pixelization that adapts to the lens model magnification.
The distinguishing feature of adaptive SLI is that every pixelization is
derived from a random initialization, ensuring that data discretization is
performed in a completely different and unique way for every lens model
parameter set. We compare standard SLI on a fixed source pixel grid with the
new method and demonstrate the shortcomings of the former when modeling
singular power law ellipsoid (SPLE) lens profiles. In particular, we
demonstrate the superior reliability and efficiency of adaptive SLI which, by
design, fixes the number of degrees of freedom (NDOF) of the optimization and
thereby removes biases present with other methods that allow the NDOF to vary.
In addition, we highlight the importance of data discretization in pixel-based
inversion methods, showing that adaptive SLI averages over significant
systematics that are present when a fixed source pixel grid is used. In the
case of the SPLE lens profile, we show how the method successfully samples its
highly degenerate posterior probability distribution function with a single
non-linear search. The robustness of adaptive SLI provides a firm foundation
for the development of a strong lens modeling pipeline, which will become
necessary in the short-term future to cope with the increasing rate of
discovery of new strong lens systems.
","[{""version"":""v1"",""created"":""Tue, 23 Dec 2014 16:35:08 GMT""},{""version"":""v2"",""created"":""Tue, 16 Jun 2015 14:15:58 GMT""}]","2015-08-06"
"1412.7437","Aram Harrow","Cyril J. Stark and Aram W. Harrow","Compressibility of positive semidefinite factorizations and quantum
  models","13 pages","IEEE Trans. Inf. Th., vol 62, no 5, pp 2867 - 2880, May 2016","10.1109/TIT.2016.2538278","MIT-CTP 4619","quant-ph cs.IT math.IT","http://arxiv.org/licenses/nonexclusive-distrib/1.0/","  We investigate compressibility of the dimension of positive semidefinite
matrices while approximately preserving their pairwise inner products. This can
either be regarded as compression of positive semidefinite factorizations of
nonnegative matrices or (if the matrices are subject to additional
normalization constraints) as compression of quantum models. We derive both
lower and upper bounds on compressibility. Applications are broad and range
from the statistical analysis of experimental data to bounding the one-way
quantum communication complexity of Boolean functions.
","[{""version"":""v1"",""created"":""Tue, 23 Dec 2014 16:37:30 GMT""}]","2016-05-06"
"1412.7438","Jaume Terradas","J. Terradas, R. Soler, M. Luna, R. Oliver, J. L. Ballester","Morphology and dynamics of solar prominences from 3D MHD simulations","Accepted for publication in ApJ",,"10.1088/0004-637X/799/1/94",,"astro-ph.SR","http://arxiv.org/licenses/nonexclusive-distrib/1.0/","  In this paper we present a numerical study of the time evolution of solar
prominences embedded in sheared magnetic arcades. The prominence is represented
by a density enhancement in a background stratified atmosphere and is connected
to the photosphere through the magnetic field. By solving the ideal
magnetohydrodynamic (MHD) equations in three dimensions we study the dynamics
for a range of parameters representative of real prominences. Depending on the
parameters considered, we find prominences that are suspended above the
photosphere, i.e., detached prominences, but also configurations resembling
curtain or hedgerow prominences whose material continuously connects to the
photosphere. The plasma$-\beta$ is an important parameter that determines the
shape of the structure. In many cases magnetic Rayleigh-Taylor (MRT)
instabilities and oscillatory phenomena develop. Fingers and plumes are
generated, affecting the whole prominence body and producing vertical
structures in an essentially horizontal magnetic field. However, magnetic shear
is able to reduce or even to suppress this instability.
","[{""version"":""v1"",""created"":""Tue, 23 Dec 2014 16:39:47 GMT""}]","2015-06-23"
"1412.7439","Saurabh Maiti","Saurabh Maiti, Manfred Sigrist, Andrey Chubukov","Spontaneous currents in a superconductor with s+is symmetry","4 figs, 4+5 pages",,"10.1103/PhysRevB.91.161102",,"cond-mat.supr-con","http://arxiv.org/licenses/nonexclusive-distrib/1.0/","  We analyze $s + is$ state proposed as a candidate superconducting state for
strongly hole-doped Ba$_{1-x}$K$_x$Fe$_2$As$_2$. Such a state breaks
time-reversal symmetry (TRS) but does not break any other discrete symmetry. We
address the issue whether TRS breaking alone can generate spontaneous currents
near impurity sites, which could be detected in, e.g., muSR experiments. We
argue that there are no spontaneous currents if only TRS is broken. However,
supercurrents do emerge if the system is put under external strain and C4
lattice rotation symmetry is externally broken.
","[{""version"":""v1"",""created"":""Tue, 23 Dec 2014 16:43:34 GMT""}]","2015-06-23"
"1412.7440","Jose Manuel Velhinho","J. M. Velhinho","An introduction to strict quantization","Typos corrected. References updated","EJTP 12 (2015) 61-90",,,"math-ph math.MP","http://arxiv.org/licenses/nonexclusive-distrib/1.0/","  We present a short review of the approach to quantization known as strict
(deformation) quantization, which can be seen as a generalization of the
Weyl-Moyal quantization. We include examples and comments on the process of
quantization.
","[{""version"":""v1"",""created"":""Tue, 23 Dec 2014 16:45:00 GMT""},{""version"":""v2"",""created"":""Sun, 27 Sep 2015 09:26:10 GMT""}]","2015-09-29"
"1412.7441","Matthew Williams","Matthew O. Williams and Irina I. Rypina and Clarence W. Rowley","Identifying Finite-Time Coherent Sets from Limited Quantities of
  Lagrangian Data","14 pages, 7 figures",,,,"physics.flu-dyn","http://arxiv.org/licenses/nonexclusive-distrib/1.0/","  A data-driven procedure for identifying the dominant transport barriers in a
time-varying flow from limited quantities of Lagrangian data is presented. Our
approach partitions state space into pairs of coherent sets, which are sets of
initial conditions chosen to minimize the number of trajectories that ""leak""
from one set to the other under the influence of a stochastic flow field during
a pre-specified interval in time. In practice, this partition is computed by
posing an optimization problem, which once solved, yields a pair of functions
whose signs determine set membership. From prior experience with synthetic,
""data rich"" test problems and conceptually related methods based on
approximations of the Perron-Frobenius operator, we observe that the functions
of interest typically appear to be smooth. As a result, given a fixed amount of
data our approach, which can use sets of globally supported basis functions,
has the potential to more accurately approximate the desired functions than
other functions tailored to use compactly supported indicator functions. This
difference enables our approach to produce effective approximations of pairs of
coherent sets in problems with relatively limited quantities of Lagrangian
data, which is usually the case with real geophysical data. We apply this
method to three examples of increasing complexity: the first is the double
gyre, the second is the Bickley Jet, and the third is data from numerically
simulated drifters in the Sulu Sea.
","[{""version"":""v1"",""created"":""Tue, 23 Dec 2014 16:45:23 GMT""},{""version"":""v2"",""created"":""Mon, 27 Jul 2015 14:33:46 GMT""}]","2015-07-28"
