"1412.7502","Daniel Kuan Li Oi","Kaila C. S. Hall and Daniel K. L. Oi","Bell inequality violation in the presence of vacancies and incomplete
  measurements","8 pages, 9 figures",,,,"quant-ph","http://arxiv.org/licenses/nonexclusive-distrib/1.0/","  The characterization of a quantum system can be complicated by non-ideal
measurement processes. In many systems, the underlying physical measurement is
only sensitive to a single fixed state, complementary outcomes are inferred by
non-detection leaving them vulnerable to out-of-Hilbert space errors such as
particle loss. It is still possible to directly verify the violation of a Bell
inequality, hence witness entanglement of a bipartite state, in the presence of
large vacancy rates using such an incomplete measurement by optimizing the
measurement settings. The scheme is robust against imperfect a priori state
knowledge and also moderate amounts of error in state determination.
","[{""version"":""v1"",""created"":""Tue, 23 Dec 2014 20:16:48 GMT""}]","2014-12-24"
"1412.7503","Guy Rousseau","Nicole Bardy-Panse, St\'ephane Gaussent (ICJ), Guy Rousseau","Iwahori-Hecke algebras for Kac-Moody groups over local fields","Version 2: Section on the extended affine case added, containing the
  relationship with the DAHAs, to appear in Pacific Journal of Mathematics","Pacific J. Math. 285 (2016) 1-61","10.2140/pjm.2016.285.1",,"math.RT","http://arxiv.org/licenses/nonexclusive-distrib/1.0/","  We define the Iwahori-Hecke algebra for an almost split Kac-Moody group over
a local non-archimedean field. We use the hovel associated to this situation,
which is the analogue of the Bruhat-Tits building for a reductive group. The
fixer K of some chamber in the standard apartment plays the role of the Iwahori
subgroup. We can define the Iwahori-Hecke algebra as the algebra of some
K-bi-invariant functions on the group with support consisting of a finite union
of double classes. As two chambers in the hovel are not always in a same
apartment, this support has to be in some large subsemigroup of the Kac-Moody
group. In the split case, we prove that the structure constants of the
multiplication in this algebra are polynomials in the cardinality of the
residue field, with integer coefficients depending on the geometry of the
standard apartment. We give a presentation of this algebra, similar to the
Bernstein-Lusztig presentation in the reductive case, and embed it in a greater
algebra, algebraically defined by the Bernstein-Lusztig presentation. In the
affine case, this algebra contains the Cherednik's double affine Hecke algebra.
Actually, our results apply to abstract ""locally finite"" hovels, so that we can
define the Iwahori-Hecke algebra with unequal parameters.
","[{""version"":""v1"",""created"":""Tue, 23 Dec 2014 20:18:15 GMT""},{""version"":""v2"",""created"":""Thu, 2 Jul 2015 06:57:43 GMT""},{""version"":""v3"",""created"":""Wed, 17 Aug 2016 06:27:55 GMT""}]","2016-10-05"
"1412.7504","Henry O. Jacobs","Henry O. Jacobs, Stefan Sommer","Higher-order Spatial Accuracy in Diffeomorphic Image Registration","33 pages, pages 22-33 consist of an appendix where we list coordinate
  formulas",,,,"cs.CV math.DG math.OC","http://arxiv.org/licenses/nonexclusive-distrib/1.0/","  We discretize a cost functional for image registration problems by deriving
Taylor expansions for the matching term. Minima of the discretized cost
functionals can be computed with no spatial discretization error, and the
optimal solutions are equivalent to minimal energy curves in the space of
$k$-jets. We show that the solutions convergence to optimal solutions of the
original cost functional as the number of particles increases with a
convergence rate of $O(h^{d+k})$ where $h$ is a resolution parameter. The
effect of this approach over traditional particle methods is illustrated on
synthetic examples and real images.
","[{""version"":""v1"",""created"":""Tue, 23 Dec 2014 20:19:19 GMT""},{""version"":""v2"",""created"":""Thu, 4 Jun 2015 02:47:46 GMT""}]","2015-06-05"
"1412.7505","Alfonso  Ballon Bayona","Alfonso Ballon-Bayona, Gastao Krein, Carlisson Miller","Decay constants of the pion and its excitations in holographic QCD","10 pages, 5 figures","Phys. Rev. D 91, 065024 (2015)","10.1103/PhysRevD.91.065024",,"hep-ph hep-lat hep-th","http://arxiv.org/licenses/nonexclusive-distrib/1.0/","  We investigate the leptonic decay constants of the pion and its excitations
with a 5-d holographic model for quantum chromodynamics. We prove numerically
that the leptonic decay constants of the excited states of the pion vanish in
the chiral limit when chiral symmetry is dynamically broken. This nontrivial
result is in agreement with a solid prediction of quantum chromodynamics and is
based on a generalized Gell-Mann-Oakes-Renner relationship involving the decay
constants and masses of the excited states of the pion. We also obtain an
extended partially conserved axial-vector current relation that includes the
fields of the excited states of the pion, a relation that was proposed long ago
in the context of current algebra.
","[{""version"":""v1"",""created"":""Tue, 23 Dec 2014 20:27:26 GMT""}]","2015-04-01"
"1412.7507","Maria Hellgren","Maria Hellgren, Fabio Caruso, Daniel R. Rohr, Xinguo Ren, Angel Rubio,
  Matthias Scheffler, Patrick Rinke","Static correlation and electron localization in molecular dimers from
  the self-consistent RPA and GW approximation","13 pages, 7 figures","Phys. Rev. B 91, 165110 (2015)","10.1103/PhysRevB.91.165110",,"cond-mat.str-el physics.chem-ph","http://arxiv.org/licenses/nonexclusive-distrib/1.0/","  We investigate static correlation and delocalization errors in the
self-consistent GW and random-phase approximation (RPA) by studying molecular
dissociation of the H_2 and LiH molecules. Although both approximations contain
topologically identical diagrams, the non-locality and frequency dependence of
the GW self-energy crucially influence the different energy contributions to
the total energy as compared to the use of a static local potential in the RPA.
The latter leads to significantly larger correlation energies which allow for a
better description of static correlation at intermediate bond distances. The
substantial error found in GW is further analyzed by comparing spin-restricted
and spin-unrestricted calculations. At large but finite nuclear separation
their difference gives an estimate of the so-called fractional spin error
normally determined only in the dissociation limit. Furthermore, a calculation
of the dipole moment of the LiH molecule at dissociation reveals a large
delocalization error in GW making the fractional charge error comparable to the
RPA. The analyses are supplemented by explicit formulae for the GW Green's
function and total energy of a simplified two-level model providing additional
insights into the dissociation limit.
","[{""version"":""v1"",""created"":""Tue, 23 Dec 2014 20:33:57 GMT""},{""version"":""v2"",""created"":""Thu, 9 Apr 2015 09:36:23 GMT""}]","2015-04-10"
"1412.7508","Florian Preis Dr.","Maria Irakleidou, Iva Lovrekovic, Florian Preis","Canonical charges and asymptotic symmetry algebra of conformal gravity","18 pages","Phys. Rev. D 91, 104037 (2015)","10.1103/PhysRevD.91.104037",,"hep-th gr-qc","http://arxiv.org/licenses/nonexclusive-distrib/1.0/","  We study canonical conformal gravity in four dimensions and construct the
gauge generators and the associated charges. Using slightly generalized
boundary conditions compared to those in \cite{Grumiller:2013mxa} we find that
the charges associated with space-time diffeomorphisms are finite and conserved
in time. They are also shown to agree with the Noether charges found in
\cite{Grumiller:2013mxa}. However, there exists no charge associated with Weyl
transformations. Consequently the asymptotic symmetry algebra is isomorphic to
the Lie algebra of the boundary condition preserving diffeomorphisms. For
illustrative purposes we apply the results to the Mannheim--Kazanas--Riegert
solution of conformal gravity.
","[{""version"":""v1"",""created"":""Tue, 23 Dec 2014 20:34:00 GMT""}]","2015-06-03"
"1412.7509","Michael Lashkevich","Michael Lashkevich and Yaroslav Pugai","Form factors of descendant operators: Reduction to perturbed $M(2,2s+1)$
  models","25 pages; v2: eq. (6.2) corrected; v3: references added; v4: numerous
  misprints (including some reference equations) corrected; v5: annoying
  misprints in eqs. (1.3), (6.3) corrected",,"10.1007/JHEP04(2015)126",,"hep-th math-ph math.MP nlin.SI","http://arxiv.org/licenses/nonexclusive-distrib/1.0/","  In the framework of the algebraic approach to form factors in two-dimensional
integrable models of quantum field theory we consider the reduction of the
sine-Gordon model to the $\Phi_{13}$-perturbation of minimal conformal models
of the $M(2,2s+1)$ series. We find in an algebraic form the condition of
compatibility of local operators with the reduction. We propose a construction
that make it possible to obtain reduction compatible local operators in terms
of screening currents. As an application we obtain exact multiparticle form
factors for the compatible with the reduction conserved currents $T_{\pm2k}$,
$\Theta_{\pm(2k-2)}$, which correspond to the spin $\pm(2k-1)$ integrals of
motion, for any positive integer~$k$. Furthermore, we obtain all form factors
of the operators $T_{2k}T_{-2l}$, which generalize the famous $T\bar T$
operator. The construction is analytic in the $s$ parameter and, therefore,
makes sense in the sine-Gordon theory.
","[{""version"":""v1"",""created"":""Tue, 23 Dec 2014 20:34:52 GMT""},{""version"":""v2"",""created"":""Tue, 6 Jan 2015 19:12:46 GMT""},{""version"":""v3"",""created"":""Fri, 13 Feb 2015 11:11:37 GMT""},{""version"":""v4"",""created"":""Wed, 29 Apr 2015 09:20:19 GMT""},{""version"":""v5"",""created"":""Thu, 18 Feb 2016 10:01:12 GMT""}]","2016-02-19"
"1412.7510","Roland M. Crocker","Roland M. Crocker, Geoffrey V. Bicknell, Andrew M. Taylor, and Ettore
  Carretti","A Unified Model of the Fermi Bubbles, Microwave Haze, and Polarized
  Radio Lobes: Reverse Shocks in the Galactic Center's Giant Outflows","Accepted for publication in the Astrophysical Journal. 14 figures.
  Qualitative results unchanged from vers. 1 but calculations made more robust
  and text clarified","ApJ, 808, 107 (2015)","10.1088/0004-637X/808/2/107",,"astro-ph.HE astro-ph.GA","http://arxiv.org/licenses/nonexclusive-distrib/1.0/","  The Galactic Center's giant outflows are manifest in three different,
non-thermal phenomena: i) the hard-spectrum, \gamma-ray `Fermi Bubbles'
emanating from the nucleus and extending to |b| ~ 50 degrees; ii) the
hard-spectrum, total-intensity microwave (~ 20-40 GHz) `Haze' extending to |b|
~ 35 degrees in the lower reaches of the Fermi Bubbles; and iii) the steep
spectrum, polarized, `S-PASS' radio (~ 2-20 GHz) Lobes that envelop the Bubbles
and extend to |b| ~ 60 degrees. We find that the nuclear outflows inflate a
genuine bubble in each Galactic hemisphere that has the classical structure,
working outwards, of reverse shock, contact discontinuity, and forward shock.
Expanding into the finite pressure of the halo and given appreciable cooling
and gravitational losses, the contact discontinuity of each bubble is now
expanding only very slowly. We find observational signatures in both
hemispheres of giant, reverse shocks at heights of ~ 1 kpc above the nucleus;
their presence ultimately explains all three of the non-thermal phenomena
mentioned above. Synchrotron emission from shock-reaccelerated cosmic-ray
electrons explains the spectrum, morphology, and vertical extent of the
microwave Haze and the polarized radio Lobes. Collisions between
shock-reaccelerated hadrons and denser gas in cooling condensations that form
inside the contact discontinuity account for most of the Bubbles' \gamma-ray
emissivity.
","[{""version"":""v1"",""created"":""Tue, 23 Dec 2014 20:40:43 GMT""},{""version"":""v2"",""created"":""Thu, 18 Jun 2015 03:30:38 GMT""}]","2015-07-30"
"1412.7511","Samuel Belliard","Samuel Belliard and Rodrigo A. Pimenta","Modified algebraic Bethe ansatz for XXZ chain on the segment - II -
  general cases","V2 published version","Nuclear Phys. B894 (2015) 527-552","10.1016/j.nuclphysb.2015.03.016",,"math-ph cond-mat.stat-mech hep-th math.MP nlin.SI","http://arxiv.org/licenses/nonexclusive-distrib/1.0/","  The spectral problem of the Heisenberg XXZ spin-$\frac{1}{2}$ chain on the
segment is investigated within a modified algebraic Bethe ansatz framework. We
consider in this work the most general boundaries allowed by integrability. The
eigenvalues and the eigenvectors are obtained. They are characterised by a set
of Bethe roots with cardinality equal to $N$, the length of the chain, and
which satisfies a set of Bethe equations with an additional term.
","[{""version"":""v1"",""created"":""Tue, 23 Dec 2014 20:40:45 GMT""},{""version"":""v2"",""created"":""Thu, 2 Apr 2015 13:43:52 GMT""}]","2015-04-03"
"1412.7512","Giuseppe Durisi","Giuseppe Durisi, Tobias Koch, Johan \""Ostman, Yury Polyanskiy, Wei
  Yang","Short-Packet Communications over Multiple-Antenna Rayleigh-Fading
  Channels","11 pages, 4 figures; to appear in IEEE Transactions on
  Communications; the numerical routines used for the simulation results are
  part of SPECTRE (short-packet communication toolbox) and can be downloaded at
  https://github.com/yp-mit/spectre",,"10.1109/TCOMM.2015.2511087",,"cs.IT math.IT","http://arxiv.org/licenses/nonexclusive-distrib/1.0/","  Motivated by the current interest in ultra-reliable, low-latency,
machine-type communication systems, we investigate the tradeoff between
reliability, throughput, and latency in the transmission of information over
multiple-antenna Rayleigh block-fading channels. Specifically, we obtain
finite-blocklength, finite-SNR upper and lower bounds on the maximum coding
rate achievable over such channels for a given constraint on the packet error
probability. Numerical evidence suggests that our bounds delimit tightly the
maximum coding rate already for short blocklengths (packets of about 100
symbols). Furthermore, our bounds reveal the existence of a tradeoff between
the rate gain obtainable by spreading each codeword over all available
time-frequency-spatial degrees of freedom, and the rate loss caused by the need
of estimating the fading coefficients over these degrees of freedom. In
particular, our bounds allow us to determine the optimal number of transmit
antennas and the optimal number of time-frequency diversity branches that
maximize the rate. Finally, we show that infinite-blocklength performance
metrics such as the ergodic capacity and the outage capacity yield inaccurate
throughput estimates.
","[{""version"":""v1"",""created"":""Tue, 23 Dec 2014 20:41:36 GMT""},{""version"":""v2"",""created"":""Tue, 25 Aug 2015 15:57:31 GMT""},{""version"":""v3"",""created"":""Wed, 16 Dec 2015 21:12:58 GMT""}]","2016-11-17"
"1412.7513","Henry O. Jacobs","Stefan Sommer, Henry O. Jacobs","Symmetry in Image Registration and Deformation Modeling","23 pages, survey article",,,,"cs.CV math.DG","http://arxiv.org/licenses/nonexclusive-distrib/1.0/","  We survey the role of symmetry in diffeomorphic registration of landmarks,
curves, surfaces, images and higher-order data. The infinite dimensional
problem of finding correspondences between objects can for a range of concrete
data types be reduced resulting in compact representations of shape and spatial
structure. This reduction is possible because the available data is incomplete
in encoding the full deformation model. Using reduction by symmetry, we
describe the reduced models in a common theoretical framework that draws on
links between the registration problem and geometric mechanics. Symmetry also
arises in reduction to the Lie algebra using particle relabeling symmetry
allowing the equations of motion to be written purely in terms of Eulerian
velocity field. Reduction by symmetry has recently been applied for
jet-matching and higher-order discrete approximations of the image matching
problem. We outline these constructions and further cases where reduction by
symmetry promises new approaches to registration of complex data types.
","[{""version"":""v1"",""created"":""Tue, 23 Dec 2014 20:44:02 GMT""},{""version"":""v2"",""created"":""Wed, 24 Dec 2014 10:25:24 GMT""}]","2014-12-25"
"1412.7514","Robert Muth","Robert Muth","Graded skew Specht modules and cuspidal modules for
  Khovanov-Lauda-Rouquier algebras of affine type A","Minor corrections, shortened proofs in {\S}4, and some additional
  remarks incorporating suggestions of referee",,,,"math.RT math.QA","http://arxiv.org/licenses/nonexclusive-distrib/1.0/","  Kleshchev, Mathas and Ram (2012) gave a presentation for graded Specht
modules over Khovanov-Lauda-Rouquier algebras of finite and affine type A. We
show that this construction can be applied more generally to skew shapes to
give a presentation of graded skew Specht modules, which arise as subquotients
of restrictions of Specht modules. As an application, we show that cuspidal
modules associated to a balanced convex preorder in affine type A are skew
Specht modules for certain hook shapes.
","[{""version"":""v1"",""created"":""Tue, 23 Dec 2014 20:44:40 GMT""},{""version"":""v2"",""created"":""Sat, 21 Nov 2015 21:48:16 GMT""}]","2015-11-24"
"1412.7515","Tim Gershon","Heavy Flavor Averaging Group, Y. Amhis, Sw. Banerjee, E. Ben-Haim, S.
  Blyth, A. Bozek, C. Bozzi, A. Carbone, R. Chistov, M. Chrz\k{a}szcz, G.
  Cibinetto, J. Dingfelder, M. Gelb, M. Gersabeck, T. Gershon, L. Gibbons, B.
  Golob, R. Harr, K. Hayasaka, H. Hayashii, T. Kuhr, O. Leroy, A. Lusiani, K.
  Miyabayashi, P. Naik, S. Nishida, A. Oyanguren Campos, M. Patel, D. Pedrini,
  M. Petri\v{c}, M. Rama, M. Roney, M. Rotondo, O. Schneider, C. Schwanda, A.
  J. Schwartz, B. Shwartz, J. G. Smith, R. Tesarek, K. Trabelsi, P. Urquijo, R.
  Van Kooten, A. Zupanc","Averages of $b$-hadron, $c$-hadron, and $\tau$-lepton properties as of
  summer 2014","436 pages, many figures and tables. Online updates available at
  http://www.slac.stanford.edu/xorg/hfag/",,,,"hep-ex hep-ph","http://arxiv.org/licenses/nonexclusive-distrib/1.0/","  This article reports world averages of measurements of $b$-hadron,
$c$-hadron, and $\tau$-lepton properties obtained by the Heavy Flavor Averaging
Group (HFAG) using results available through summer 2014. For the averaging,
common input parameters used in the various analyses are adjusted (rescaled) to
common values, and known correlations are taken into account. The averages
include branching fractions, lifetimes, neutral meson mixing parameters, $CP$
violation parameters, parameters of semileptonic decays and CKM matrix
elements.
","[{""version"":""v1"",""created"":""Tue, 23 Dec 2014 20:45:19 GMT""}]","2014-12-24"
"1412.7516","Florent Malrieu","Florent Malrieu (LMPT)","Some simple but challenging Markov processes",,,,,"math.PR","http://arxiv.org/licenses/nonexclusive-distrib/1.0/","  In this note, we present few examples of Piecewise Deterministic Markov
Processes and their long time behavior. They share two important features: they
are related to concrete models (in biology, networks, chemistry,. . .) and they
are mathematically rich. Their math-ematical study relies on coupling method,
spectral decomposition, PDE technics, functional inequalities. We also relate
these simple examples to recent and open problems.
","[{""version"":""v1"",""created"":""Tue, 23 Dec 2014 20:46:27 GMT""}]","2014-12-24"
"1412.7517","Pierre Degond","Pierre Degond, Michael Herty, Jian-Guo Liu","Meanfield games and model predictive control",,,,,"math.OC","http://arxiv.org/licenses/nonexclusive-distrib/1.0/","  Mean-Field Games are games with a continuum of players that incorporate the
time-dimension through a control-theoretic approach. Recently, simpler
approaches relying on the Best Reply Strategy have been proposed. They assume
that the agents navigate their strategies towards their goal by taking the
direction of steepest descent of their cost function (i.e. the opposite of the
utility function). In this paper, we explore the link between Mean-Field Games
and the Best Reply Strategy approach. This is done by introducing a Model
Predictive Control framework, which consists of setting the Mean-Field Game
over a short time interval which recedes as time moves on. We show that the
Model Predictive Control offers a compromise between a possibly unrealistic
Mean-Field Game approach and the sub-optimal Best Reply Strategy.
","[{""version"":""v1"",""created"":""Tue, 23 Dec 2014 20:47:16 GMT""}]","2014-12-24"
"1412.7518","Viet Hung Nguyen","Viet Hung Nguyen, Huy-Viet Nguyen, Jerome Saint Martin, Philippe
  Dollfus","Strain-induced conduction gap in vertical devices made of twisted
  graphene layers","7 pages, 5 figures, submitted","Nanotechnology 26, 115201 (2015)","10.1088/0957-4484/26/11/115201",,"cond-mat.mes-hall","http://arxiv.org/licenses/nonexclusive-distrib/1.0/","  We investigate the effects of uniaxial strain on the transport properties of
vertical devices made of two twisted graphene layers, which partially overlap
each other. We find that because of the different orientations of the two
graphene lattices, their Dirac points can be displaced and separated in the
$k-$space by the effects of strain. Hence, a finite conduction gap as large as
a few hundred meV can be obtained in the device with a small strain of only a
few percent. The dependence of this conduction gap on the strain strength,
strain direction, transport direction and twist angle are clarified and
presented. On this basis, the strong modulation of conductance and significant
improvement of Seebeck coefficient are shown. The suggested devices therefore
may be very promising for improving applications of graphene, e.g., as
transistors or strain and thermal sensors.
","[{""version"":""v1"",""created"":""Tue, 23 Dec 2014 20:50:18 GMT""}]","2015-02-26"
"1412.7519","Helene Montanie","H\'el\`ene Montani\'e (LIENSs), Pascaline Ory (LIENSs), Francis
  Orvain, Daniel Delmas, Christine Dupuy (LIENSs)","Microbial interactions in marine water amended by eroded benthic
  biofilm: A case study from an intertidal mudflat",,"Journal of Sea Research, Elsevier, 2014, 92, pp.74 - 85","10.1016/j.seares.2013.11.011",,"q-bio.QM q-bio.PE","http://arxiv.org/licenses/nonexclusive-distrib/1.0/","  In shallow macrotidal ecosystems with large intertidal mudflats, the
sediment-water coupling plays a crucial role in structuring the pelagic
microbial food web functioning, since inorganic and organic matter and
microbial components (viruses and microbes) of the microphytobenthic biofilm
can be suspended toward the water column. Two experimental bioassays were
conducted in March and July 2008 to investigate the importance of biofilm input
for the pelagic Microbial and Viral Loops. Pelagic inocula (<0.6$\mu$ and
<10$\mu$ filtrates) were diluted either with \textless{}30kDa-ultrafiltered
seawater or with this ultrafiltrate enriched with the respective
size-fractionated benthic biofilm or with \textless{}30kDa-benthic compounds
(BC). The kinetics of heterotrophic nanoflagellates (HNF), bacteria and viruses
were assessed together with bacterial and viral genomic fingerprints, bacterial
enzymatic activities and viral life strategies. The experimental design allowed
us to evaluate the effect of BC modulated by those of benthic size-fractionated
microorganisms (virus+bacteria, +HNF). BC presented (1) in March, a positive
effect on viruses and bacteria weakened by pelagic HNF. Benthic microorganisms
consolidated this negative effect and sustained the viral production together
with a relatively diverse and uneven bacterial assemblage structure; (2) in
July, no direct impact on viruses but a positive effect on bacteria modulated
by HNF, which indirectly enhanced viral multiplication. Both effects were
intensified by benthic microorganisms and bacterial assemblage structure became
more even. HNF indirectly profited from BC more in March than in July. The
Microbial Loop would be stimulated by biofilm during periods of high resources
(March) and the Viral Loop during periods of depleted resources (July).
","[{""version"":""v1"",""created"":""Tue, 23 Dec 2014 20:50:46 GMT""}]","2014-12-24"
