"1412.7631","Andrew.Kirk","A. Kirk, W. Suttrop, Yueqiang Liu, I.T. Chapman, P. Cahyna, T.Eich,
  C.Fuchs, C.Ham, J.R. Harrison, M W. Jakubowski, S. Pamela, M. Peterka, D.
  Ryan, S. Saarelma, R. Scannell, A.J. Thornton, M. Valovic, B. Sieglin, L.
  Barrera Orte, M. Willensdorfer, B. Kurzan, R. Fischer (for the MAST, ASDEX
  Upgrade and EUROfusion MST1 Collaborations)","Effect of resonant magnetic perturbations on low collisionality
  discharges in MAST and a comparison with ASDEX Upgrade","31 pages, 28 figures. This is an author-created, un-copyedited
  version of an article submitted for publication in Nuclear Fusion. IoP
  Publishing Ltd is not responsible for any errors or omissions in this version
  of the manuscript or any version derived from it","Nuclear Fusion, Vol.55, No.4, April 2015, pp.043011","10.1088/0029-5515/55/4/043011",,"physics.plasm-ph","http://arxiv.org/licenses/nonexclusive-distrib/1.0/","  Sustained ELM mitigation has been achieved on MAST and AUG using RMPs with a
range of toroidal mode numbers over a wide region of low to medium
collisionality discharges. The ELM energy loss and peak heat loads at the
divertor targets have been reduced. The ELM mitigation phase is typically
associated with a drop in plasma density and overall stored energy. In one
particular scenario on MAST, by carefully adjusting the fuelling it has been
possible to counteract the drop in density and to produce plasmas with
mitigated ELMs, reduced peak divertor heat flux and with minimal degradation in
pedestal height and confined energy. While the applied resonant magnetic
perturbation field can be a good indicator for the onset of ELM mitigation on
MAST and AUG there are some cases where this is not the case and which clearly
emphasise the need to take into account the plasma response to the applied
perturbations. The plasma response calculations show that the increase in ELM
frequency is correlated with the size of the edge peeling-tearing like response
of the plasma and the distortions of the plasma boundary in the X-point region.
","[{""version"":""v1"",""created"":""Wed, 24 Dec 2014 09:31:56 GMT""}]","2019-08-15"
"1412.7632","Anirban Saha Dr.","Sunandan Gangopadhyay, Anirban Saha, Swarup Saha","Interaction of a circularly polarised gravitational wave with a charged
  particle in a static magnetic background","8 pages, Latex","Gen.Rel.Grav. 47 (2015) 6, 65","10.1007/s10714-015-1906-4",,"gr-qc","http://arxiv.org/licenses/nonexclusive-distrib/1.0/","  Interaction of a charged particle in a static magnetic background, i.e., a
Landau system with circularly polarised gravitational wave (GW) is studied
quantum mechanically in the long wavelength and low velocity limit. We quantize
the classical Hamiltonian following \cite{speli}. The rotating polarization
vectors of the circularly polarized GW are employed to form a unique
directional triad which served as the coordinate axes. The Schrodinger
equations for the system are cast in the form of a set of coupled linear
differential equations. This system is solved by iterative technique. We
compute the time-evolution of the position and momentum expectation values of
the particle. The results show that the resonance behaviour obtained
earlier\cite{emgw_classical} by classical treatements of the system has a
quantum analogue not only for the linearly polarized GW \cite{emgw_1_lin}, but
for circularly polarized GW as well.
","[{""version"":""v1"",""created"":""Wed, 24 Dec 2014 09:51:49 GMT""}]","2015-06-03"
"1412.7633","Delgado Lopez-Cozar emilio","Alberto Martin-Martin, Enrique Ordunna-Malea, Juan Manuel Ayllon,
  Emilio Delgado Lopez-Cozar","Proceedings Scholar Metrics: H Index of proceedings on Computer Science,
  Electrical & Electronic Engineering, and Communications according to Google
  Scholar Metrics (2009-2013)","29 pages",,,"EC3 Reports 12","cs.DL","http://creativecommons.org/licenses/by-nc-sa/3.0/","  The objective of this report is to present a list of proceedings
(conferences, workshops, symposia, meetings) in the areas of Computer Science,
Electrical & Electronic Engineering, and Communications covered by Google
Scholar Metrics and ranked according to their h-index. Google Scholar Metrics
only displays publications that have published at least 100 papers and have
received at least one citation in the last five years (2009-2013). The searches
were conducted between the 15th and 22nd of December, 2014. A total of 1208
proceedings have been identified
","[{""version"":""v1"",""created"":""Wed, 24 Dec 2014 09:54:10 GMT""},{""version"":""v2"",""created"":""Wed, 7 Jan 2015 11:45:36 GMT""}]","2015-01-09"
"1412.7634","Kevin Langlois","Marta Agustin Vicente, Kevin Langlois","On intersection cohomology with torus actions of complexity one","Revista Matematica Complutense 31 (2018), no. 1, 163-186",,,,"math.AG","http://arxiv.org/licenses/nonexclusive-distrib/1.0/","  The purpose of this article is to investigate the intersection cohomology for
algebraic varieties with torus action. Given an algebraic torus $\mathbb{T}$,
one of our result determines the intersection cohomology Betti numbers of any
normal projective $\mathbb{T}$-variety admitting an algebraic curve as global
quotient. The calculation is expressed in terms of a combinatorial description
involving a divisorial fan which is the analogous of the defining fan of a
toric variety. Our main tool to obtain this computation is a description of the
decomposition theorem in this context.
","[{""version"":""v1"",""created"":""Wed, 24 Dec 2014 10:01:16 GMT""},{""version"":""v2"",""created"":""Sat, 7 Feb 2015 15:28:36 GMT""},{""version"":""v3"",""created"":""Mon, 30 Mar 2015 18:25:49 GMT""},{""version"":""v4"",""created"":""Mon, 9 Jan 2017 09:11:08 GMT""},{""version"":""v5"",""created"":""Thu, 18 May 2017 09:54:02 GMT""},{""version"":""v6"",""created"":""Wed, 6 May 2020 12:18:48 GMT""}]","2020-05-07"
"1412.7635","Fran\c{c}ois Legrand","Fran\c{c}ois Legrand","Hilbert specialization results with local conditions",,,,,"math.NT","http://arxiv.org/licenses/nonexclusive-distrib/1.0/","  Given a field $k$ of characteristic zero and an indeterminate $T$, the main
topic of the paper is the construction of specializations of any given finite
extension of $k(T)$ of degree $n$ that are degree $n$ field extensions of $k$
with specified local behavior at any given finite set of primes of $k$. First,
we give a full non-Galois analog of a result with a ramified type conclusion
from a preceding paper and next we prove a unifying statement which combines
our results and previous work devoted to the unramified part of the problem in
the case $k$ is a number field.
","[{""version"":""v1"",""created"":""Wed, 24 Dec 2014 10:08:32 GMT""},{""version"":""v2"",""created"":""Mon, 12 Jan 2015 15:42:20 GMT""},{""version"":""v3"",""created"":""Mon, 2 Feb 2015 09:23:28 GMT""},{""version"":""v4"",""created"":""Mon, 1 Feb 2016 10:34:21 GMT""},{""version"":""v5"",""created"":""Mon, 15 Feb 2016 16:30:05 GMT""}]","2016-02-16"
"1412.7636","Dmitry Shepelsky","Spyridon Kamvissis, Dmitry Shepelsky and Lech Zielinski","Robin boundary condition and shock problem for the focusing nonlinear
  Schr\""odinger equation","25 pages",,,,"nlin.SI math-ph math.MP","http://arxiv.org/licenses/nonexclusive-distrib/1.0/","  We consider the initial boundary value (IBV) problem for the focusing
nonlinear Schr\""odinger equation in the quarter plane $x>0,t>0$ in the case of
periodic initial data (at $t=0$) and a Robin boundary condition at $x=0$. Our
approach is based on the simultaneous spectral analysis of the Lax pair
equations combined with symmetry considerations for the corresponding
Riemann-Hilbert problems. A connection between the original IBV problem and an
associated initial value (IV) problem is established.
","[{""version"":""v1"",""created"":""Wed, 24 Dec 2014 10:13:58 GMT""}]","2014-12-25"
"1412.7637","Daniel Brod","Daniel J. Brod","The Computational Power of Non-interacting Particles","PhD Thesis, defended at Universidade Federal Fluminense on March
  2014. Final version, 208 pages. New results in Chapter 5 correspond to
  arXiv:1106.1863, arXiv:1207.2126, and arXiv:1308.1463. New results in Chapter
  6 correspond to arXiv:1212.2783, arXiv:1305.3188, arXiv:1311.1622 and
  arXiv:1412.6788",,,,"quant-ph","http://arxiv.org/licenses/nonexclusive-distrib/1.0/","  Shortened abstract: In this thesis, I study two restricted models of quantum
computing related to free identical particles.
  Free fermions correspond to a set of two-qubit gates known as matchgates.
Matchgates are classically simulable when acting on nearest neighbors on a
path, but universal for quantum computing when acting on distant qubits or when
SWAP gates are available. I generalize these results in two ways. First, I show
that SWAP is only one in a large family of gates that uplift matchgates to
quantum universality. In fact, I show that the set of all matchgates plus any
nonmatchgate parity-preserving two-qubit gate is universal, and interpret this
fact in terms of local invariants of two-qubit gates. Second, I investigate the
power of matchgates in arbitrary connectivity graphs, showing they are
universal on any connected graph other than a path or a cycle, and classically
simulable on a cycle. I also prove the same dichotomy for the XY interaction.
  Free bosons give rise to a model known as BosonSampling. BosonSampling
consists of (i) preparing a Fock state of n photons, (ii) interfering these
photons in an m-mode linear interferometer, and (iii) measuring the output in
the Fock basis. Sampling approximately from the resulting distribution should
be classically hard, under reasonable complexity assumptions. Here I show that
exact BosonSampling remains hard even if the linear-optical circuit has
constant depth. I also report several experiments where three-photon
interference was observed in integrated interferometers of various sizes,
providing some of the first implementations of BosonSampling in this regime.
The experiments also focus on the bosonic bunching behavior and on validation
of BosonSampling devices. This thesis contains descriptions of the numerical
analyses done on the experimental data, omitted from the corresponding
publications.
","[{""version"":""v1"",""created"":""Wed, 24 Dec 2014 10:23:26 GMT""}]","2014-12-25"
"1412.7638","Mladen Kolar","Jialei Wang and Mladen Kolar","Inference for Sparse Conditional Precision Matrices",,,,,"stat.ML","http://arxiv.org/licenses/nonexclusive-distrib/1.0/","  Given $n$ i.i.d. observations of a random vector $(X,Z)$, where $X$ is a
high-dimensional vector and $Z$ is a low-dimensional index variable, we study
the problem of estimating the conditional inverse covariance matrix $\Omega(z)
= (E[(X-E[X \mid Z])(X-E[X \mid Z])^T \mid Z=z])^{-1}$ under the assumption
that the set of non-zero elements is small and does not depend on the index
variable. We develop a novel procedure that combines the ideas of the local
constant smoothing and the group Lasso for estimating the conditional inverse
covariance matrix. A proximal iterative smoothing algorithm is used to solve
the corresponding convex optimization problems. We prove that our procedure
recovers the conditional independence assumptions of the distribution $X \mid
Z$ with high probability. This result is established by developing a uniform
deviation bound for the high-dimensional conditional covariance matrix from its
population counterpart, which may be of independent interest. Furthermore, we
develop point-wise confidence intervals for individual elements of the
conditional inverse covariance matrix. We perform extensive simulation studies,
in which we demonstrate that our proposed procedure outperforms sensible
competitors. We illustrate our proposal on a S&P 500 stock price data set.
","[{""version"":""v1"",""created"":""Wed, 24 Dec 2014 10:32:02 GMT""}]","2014-12-25"
"1412.7639","Viviana Gammaldi","Viviana Gammaldi","Highlights on gamma rays, neutrinos and antiprotons from TeV Dark Matter","5 pages, 3 figures, To appear on the proceeding of RICAP-14 ""The Roma
  International Conference on Astroparticle Physics""",,,,"astro-ph.HE astro-ph.CO hep-ph","http://arxiv.org/licenses/nonexclusive-distrib/1.0/","  It has been shown that the gamma-ray flux observed by HESS from the J1745-290
Galactic Center source is well fitted as the secondary gamma-rays photons
generated from Dark Matter annihilating into Standard Model particles in
combination with a simple power law background. The neutrino flux expected from
such Dark Matter source has been also analyzed. The main results of such
analyses for 50 TeV Dark Matter annihilating into W+W- gauge boson and
preliminary results for antiprotons are presented.
","[{""version"":""v1"",""created"":""Wed, 24 Dec 2014 10:41:57 GMT""}]","2014-12-25"
"1412.7640","Michel Weber","Christophe Cuny, Michel Weber","Ergodic theorems with arithmetical weights","25 pages","Israel J. Math. 217 (2017), no. 1, 139--180",,,"math.DS","http://arxiv.org/licenses/nonexclusive-distrib/1.0/","  We prove that the divisor function $d(n)$ counting the number of divisors of
the integer $n$, is a good weighting function for the pointwise ergodic
theorem. For any measurable dynamical system $(X, {\mathcal A},\nu,\tau)$ and
any $f\in L^p(\nu)$, $p>1$, the limit $$ \lim_{n\to \infty}{1\over
\sum_{k=1}^{n} d(k)} \sum_{k=1}^{n} d(k)f(\tau^k x)$$ exists $\nu$-almost
everywhere. We also obtain similar results for other arithmetical functions,
like $\theta(n)$ function counting the number of squarefree divisors of $n$ and
the generalized Euler totient function $J_s(n)$, $s>0$. We use Bourgain's
method, namely the circle method based on the shift model.
","[{""version"":""v1"",""created"":""Wed, 24 Dec 2014 10:46:16 GMT""}]","2017-07-20"
"1412.7641","Raphael Reischuk","Florian Schr\""oder and Raphael M. Reischuk and Johannes Gehrke","Balancing Isolation and Sharing of Data for Third-Party Extensible App
  Ecosystems",,,,,"cs.CR","http://arxiv.org/licenses/nonexclusive-distrib/1.0/","  In the landscape of application ecosystems, today's cloud users wish to
personalize not only their browsers with various extensions or their
smartphones with various applications, but also the various extensions and
applications themselves. The resulting personalization significantly raises the
attractiveness for typical Web 2.0 users, but gives rise to various security
risks and privacy concerns, such as unforeseen access to certain critical
components, undesired information flow of personal information to untrusted
applications, or emerging attack surfaces that were not possible before a
personalization has taken place.
  In this paper, we propose a novel extensibility mechanism which is used for
implementing personalization of existing cloud applications towards (possibly
untrusted) components in a secure and privacy-friendly manner. Our model
provides a clean component abstraction, thereby in particular ruling out
undesired component accesses and ensuring that no undesired information flow
takes place between application components -- either trusted from the base
application or untrusted from various extensions. We then instantiate our model
in the SAFE web application framework (WWW 2012), resulting in a novel
methodology that is inspired by traditional access control and specifically
designed for the newly emerging needs of extensibility in application
ecosystems. We illustrate the convenient usage of our techniques by showing how
to securely extend an existing social network application.
","[{""version"":""v1"",""created"":""Wed, 24 Dec 2014 10:50:42 GMT""},{""version"":""v2"",""created"":""Fri, 10 Apr 2015 15:56:34 GMT""}]","2015-04-13"
"1412.7642","Valentin Zauner","V. Zauner, D. Draxler, L. Vanderstraeten, J. Haegeman, F. Verstraete","Symmetry Breaking and the Geometry of Reduced Density Matrices","5 pages, 3 figures, Appendix with 2 pages, 3 figures","New J. Phys. 18, 113033 (2016)","10.1088/1367-2630/18/11/113033",,"quant-ph cond-mat.stat-mech cond-mat.str-el","http://arxiv.org/licenses/nonexclusive-distrib/1.0/","  The concept of symmetry breaking and the emergence of corresponding local
order parameters constitute the pillars of modern day many body physics. The
theory of quantum entanglement is currently leading to a paradigm shift in
understanding quantum correlations in many body systems and in this work we
show how symmetry breaking can be understood from this wavefunction centered
point of view. We demonstrate that the existence of symmetry breaking is a
consequence of the geometric structure of the convex set of reduced density
matrices of all possible many body wavefunctions. The surfaces of those convex
bodies exhibit non-analytic behavior in the form of ruled surfaces, which turn
out to be the defining signatures for the emergence of symmetry breaking and of
an associated order parameter.
  We illustrate this by plotting the convex sets arising in the context of
three paradigmatic examples of many body systems exhibiting symmetry breaking:
the quantum Ising model in transverse magnetic field, exhibiting a second order
quantum phase transition; the classical Ising model at finite temperature in
two dimensions, which orders below a critical temperature $T_c$; and a system
of free bosons at finite temperature in three dimensions, exhibiting the
phenomenon of Bose-Einstein condensation together with an associated order
parameter $\langle\psi\rangle$. Remarkably, these convex sets look all very
much alike. We believe that this wavefunction based way of looking at phase
transitions demystifies the emergence of order parameters and provides a unique
novel tool for studying exotic quantum phenomena.
","[{""version"":""v1"",""created"":""Wed, 24 Dec 2014 10:58:59 GMT""},{""version"":""v2"",""created"":""Thu, 8 Jan 2015 21:50:16 GMT""},{""version"":""v3"",""created"":""Tue, 3 Mar 2015 10:33:30 GMT""},{""version"":""v4"",""created"":""Tue, 8 Mar 2016 03:54:56 GMT""}]","2016-11-18"
"1412.7643","Andrea Geralico","Donato Bini, Andrea Geralico","Effect of an arbitrary spin orientation on the quadrupolar structure of
  an extended body in a Schwarzschild spacetime","15 pages, 3 figures; revised version matching the published one","Phys. Rev. D 91, 104036 (2015)","10.1103/PhysRevD.91.104036",,"gr-qc","http://arxiv.org/licenses/nonexclusive-distrib/1.0/","  The influence of an arbitrary spin orientation on the quadrupolar structure
of an extended body moving in a Schwarzschild spacetime is investigated. The
body dynamics is described by the Mathisson-Papapetrou-Dixon model, without any
restriction on the motion or simplifying assumption on the associated spin
vector and quadrupole tensor, generalizing previous works. The equations of
motion are solved analytically in the limit of small values of the
characteristic length scales associated with the spin and quadrupole variables
with respect to the characteristic length of the background curvature. The
solution provides all corrections to the circular geodesic on the equatorial
plane taken as the reference trajectory due to both dipolar and quadrupolar
structure of the body as well as the conditions which the nonvanishing
components of the quadrupole tensor must fulfill in order that the problem be
self-consistent.
","[{""version"":""v1"",""created"":""Wed, 24 Dec 2014 11:06:47 GMT""},{""version"":""v2"",""created"":""Wed, 16 Sep 2015 10:59:22 GMT""}]","2015-09-17"
"1412.7644","Chitra Shukla","Anindita Banerjee and Chitra Shukla","Comment on ""Teleportation of Three-Qubit State via Six-qubit Cluster
  State""","3 pages, 1 figure",,,,"quant-ph","http://arxiv.org/licenses/nonexclusive-distrib/1.0/","  Recently Yu and Sun [Int. J. Theor. Phys. DOI 10.1007/s10773-014-2360-x] have
presented probabilistic teleportation of 3-qubit cat state via 6-qubit cluster
state. The success probability depends on absolute value of only two of the
coefficients of cluster state i.e. |c|^2 + |d|^2. We have demonstrated the
feasibility to teleport 3-qubit cat state via 2-qubit non maximally entangled
Bell state instead of a complex state like 6-qubit non maximally entangled
cluster state. In this comment we have prescribed an optimal protocol for
teleportation of n-qubit state of the form (\alpha|x> + \beta|\bar{x}>)_n via
non maximally entangled Bell state a|00> + b|11> henceforth allowing
teleportation of n-qubit state via 2-qubit Bell state. The success probability
of the prescribed protocol is |b|^2.
","[{""version"":""v1"",""created"":""Wed, 24 Dec 2014 11:34:51 GMT""}]","2014-12-25"
"1412.7645","Hampei Sasahara","Hampei Sasahara, Masaaki Nagahara, Kazunori Hayashi, and Yutaka
  yamamoto","Communication Performance Analysis of Sampled-Data H-infinity Optimal
  Coupling Wave Canceler","submitted to the SICE International Symposium on Control Systems
  2015, Dec. 2014; 2 pages, 4 figures",,,,"cs.IT cs.SY math.IT","http://arxiv.org/licenses/nonexclusive-distrib/1.0/","  In this manuscript, we propose a design method of digital filters which
cancel coupling waves generated in single-frequency full-duplex wireless relay
stations by using the sampled-data H-infinity control theory. Simulation
results show effectiveness of the proposed method to communication performance
from a base station to a terminal.
","[{""version"":""v1"",""created"":""Wed, 24 Dec 2014 11:36:06 GMT""}]","2014-12-25"
"1412.7646","Xiao Li","Xiao Li, Dong Yin, Sameer Pawar, Ramtin Pedarsani, Kannan Ramchandran","Sub-linear Time Support Recovery for Compressed Sensing using
  Sparse-Graph Codes",,,,,"cs.IT math.IT","http://arxiv.org/licenses/nonexclusive-distrib/1.0/","  We study the support recovery problem for compressed sensing, where the goal
is to reconstruct the a high-dimensional $K$-sparse signal
$\mathbf{x}\in\mathbb{R}^N$, from low-dimensional linear measurements with and
without noise. Our key contribution is a new compressed sensing framework
through a new family of carefully designed sparse measurement matrices
associated with minimal measurement costs and a low-complexity recovery
algorithm. The measurement matrix in our framework is designed based on the
well-crafted sparsification through capacity-approaching sparse-graph codes,
where the sparse coefficients can be recovered efficiently in a few iterations
by performing simple error decoding over the observations. We formally connect
this general recovery problem with sparse-graph decoding in packet
communication systems, and analyze our framework in terms of the measurement
cost, time complexity and recovery performance. In the noiseless setting, our
framework can recover any arbitrary $K$-sparse signal in $O(K)$ time using $2K$
measurements asymptotically with high probability. In the noisy setting, when
the sparse coefficients take values in a finite and quantized alphabet, our
framework can achieve the same goal in time $O(K\log(N/K))$ using
$O(K\log(N/K))$ measurements obtained from measurement matrix with elements
$\{-1,0,1\}$. When the sparsity $K$ is sub-linear in the signal dimension
$K=O(N^\delta)$ for some $0<\delta<1$, our results are order-optimal in terms
of measurement costs and run-time, both of which are sub-linear in the signal
dimension $N$. The sub-linear measurement cost and run-time can also be
achieved with continuous-valued sparse coefficients, with a slight increment in
the logarithmic factors. This offers the desired scalability of our framework
that can potentially enable real-time or near-real-time processing for massive
datasets featuring sparsity.
","[{""version"":""v1"",""created"":""Wed, 24 Dec 2014 11:55:14 GMT""},{""version"":""v2"",""created"":""Mon, 26 Feb 2018 04:36:19 GMT""}]","2018-02-27"
"1412.7647","Nassim Nicholas Taleb","Donald Geman, H\'elyette Geman, and Nassim Nicholas Taleb","Tail Risk Constraints and Maximum Entropy",,"Entropy 17 (6), 3724-3737, 2015",,,"q-fin.RM","http://arxiv.org/licenses/nonexclusive-distrib/1.0/","  In the world of modern financial theory, portfolio construction has
traditionally operated under at least one of two central assumptions: the
constraints are derived from a utility function and/or the multivariate
probability distribution of the underlying asset returns is fully known. In
practice, both the performance criteria and the informational structure are
markedly different: risk-taking agents are mandated to build portfolios by
primarily constraining the tails of the portfolio return to satisfy VaR, stress
testing, or expected shortfall (CVaR) conditions, and are largely ignorant
about the remaining properties of the probability distributions. As an
alternative, we derive the shape of portfolio distributions which have maximum
entropy subject to real-world left-tail constraints and other expectations. Two
consequences are (i) the left-tail constraints are sufficiently powerful to
overide other considerations in the conventional theory, rendering individual
portfolio components of limited relevance; and (ii) the ""barbell"" payoff
(maximal certainty/low risk on one side, maximum uncertainty on the other)
emerges naturally from this construction.
","[{""version"":""v1"",""created"":""Wed, 24 Dec 2014 12:10:11 GMT""}]","2016-09-05"
