"1404.1212","Atlas Publications","ATLAS Collaboration","Measurement of the low-mass Drell-Yan differential cross section at
  $\sqrt{s}$ = 7 TeV using the ATLAS detector","32 pages plus author list (53 pages total), 7 figures, 13 tables,
  submitted to JHEP, All figures including auxiliary figures are available at
  http://atlas.web.cern.ch/Atlas/GROUPS/PHYSICS/PAPERS/STDM-2011-41/","JHEP 06 (2014) 112","10.1007/JHEP06(2014)112","CERN-PH-EP-2014-020","hep-ex","http://arxiv.org/licenses/nonexclusive-distrib/1.0/","  The differential cross section for the process $Z/\gamma^*\rightarrow ll$
($l=e,\mu$) as a function of dilepton invariant mass is measured in pp
collisions at $\sqrt{s}=$ 7 TeV at the LHC using the ATLAS detector. The
measurement is performed in the $e$ and $\mu$ channels for invariant masses
between 26 GeV and 66 GeV using an integrated luminosity of 1.6 fb$^{-1}$
collected in 2011 and these measurements are combined. The analysis is extended
to invariant masses as low as 12 GeV in the muon channel using 35 pb$^{-1}$ of
data collected in 2010. The cross sections are determined within fiducial
acceptance regions and corrections to extrapolate the measurements to the full
kinematic range are provided. Next-to-next-to-leading-order QCD predictions
provide a significantly better description of the results than
next-to-leading-order QCD calculations, unless the latter are matched to a
parton shower calculation.
","[{""version"":""v1"",""created"":""Fri, 4 Apr 2014 10:42:36 GMT""},{""version"":""v2"",""created"":""Mon, 7 Apr 2014 10:08:11 GMT""},{""version"":""v3"",""created"":""Fri, 30 May 2014 09:54:42 GMT""}]","2014-06-30"
"1404.1213","Dheeraj  Singh","Dheeraj Kumar Singh, Tetsuya Takimoto","Orbital ordering transition in the single-layer manganites near half
  doping: a weak-coupling approach",,"Eur. Phys. J. B (2015) 88","10.1140/epjb/e2015-60044-3",,"cond-mat.str-el","http://arxiv.org/licenses/nonexclusive-distrib/1.0/","  The roles of crystal-field splitting and Jahn-Teller distortions on the
orbital ordering transition are investigated in the single-layer manganites
near half doping. Crystal-field splitting of energy levels favoring the
$d_{3z^2-r^2}$ occupancy provides not only the correct Fermi surface topology
for La$_{0.5}$Sr$_{1.5}$MnO$_4$ having a circular electron pocket around the
$\Gamma$ point, but also enhances the flatness of the hole pocket around the M
point thereby improving the nesting. In the presence of the circular electron
pocket, Jahn-Teller distortions are found to be crucial for the transition to
the transverse orbital ordering with ordering wavevector ($0.5\pi, 0.5\pi$). In
the hole-doping regime $0.5 \leq x \leq 0.7$, the orbital ordering wavevector
shows a linear dependence on the hole concentration in accordance with the
experiments.
","[{""version"":""v1"",""created"":""Fri, 4 Apr 2014 10:44:29 GMT""},{""version"":""v2"",""created"":""Tue, 2 Dec 2014 04:22:43 GMT""}]","2017-06-29"
"1404.1214","Ulrich Bauer","Ulrich Bauer, Axel Munk, Hannes Sieling, Max Wardetzky","Persistence Barcodes versus Kolmogorov Signatures: Detecting Modes of
  One-Dimensional Signals",,,"10.1007/s10208-015-9281-9",,"math.ST cs.CG stat.TH","http://arxiv.org/licenses/nonexclusive-distrib/1.0/","  We investigate the problem of estimating the number of modes (i.e., local
maxima) - a well known question in statistical inference - and we show how to
do so without presmoothing the data. To this end, we modify the ideas of
persistence barcodes by first relating persistence values in dimension one to
distances (with respect to the supremum norm) to the sets of functions with a
given number of modes, and subsequently working with norms different from the
supremum norm. As a particular case we investigate the Kolmogorov norm. We
argue that this modification has certain statistical advantages. We offer
confidence bands for the attendant Kolmogorov signatures, thereby allowing for
the selection of relevant signatures with a statistically controllable error.
As a result of independent interest, we show that taut strings minimize the
number of critical points for a very general class of functions. We illustrate
our results by several numerical examples.
","[{""version"":""v1"",""created"":""Fri, 4 Apr 2014 11:03:15 GMT""},{""version"":""v2"",""created"":""Tue, 27 Jan 2015 11:25:14 GMT""}]","2016-05-03"
"1404.1215","Sergey Goncharov","Sergey Goncharov and Dirk Pattinson","Coalgebraic Weak Bisimulation from Recursive Equations over Monads","final version",,,,"cs.LO","http://arxiv.org/licenses/nonexclusive-distrib/1.0/","  Strong bisimulation for labelled transition systems is one of the most
fundamental equivalences in process algebra, and has been generalised to
numerous classes of systems that exhibit richer transition behaviour. Nearly
all of the ensuing notions are instances of the more general notion of
coalgebraic bisimulation. Weak bisimulation, however, has so far been much less
amenable to a coalgebraic treatment. Here we attempt to close this gap by
giving a coalgebraic treatment of (parametrized) weak equivalences, including
weak bisimulation. Our analysis requires that the functor defining the
transition type of the system is based on a suitable order-enriched monad,
which allows us to capture weak equivalences by least fixpoints of recursive
equations. Our notion is in agreement with existing notions of weak
bisimulations for labelled transition systems, probabilistic and weighted
systems, and simple Segala systems.
","[{""version"":""v1"",""created"":""Fri, 4 Apr 2014 11:14:55 GMT""},{""version"":""v2"",""created"":""Fri, 2 May 2014 13:09:38 GMT""}]","2014-05-05"
"1404.1216","Giuseppe Allodi","Giuseppe Allodi and Roberto De Renzi","A numerical method to calculate the muon relaxation function in the
  presence of diffusion","7 pages, 3 figures. Submitted to Journal of Physics: Condensed Matter",,"10.1088/0031-8949/89/11/115201",,"cond-mat.other","http://arxiv.org/licenses/nonexclusive-distrib/1.0/","  We present an accurate and efficient method to calculate the effect of random
fluctuations of the local field at the muon, for instance in the case muon
diffusion, within the framework of the strong collision approximation. The
method is based on a reformulation of the Markovian process over a discretized
time base, leading to a summation equation for the muon polarization function
which is solved by discrete Fourier transform. The latter is formally
analogous, though not identical, to the integral equation of the original
continuous-time model, solved by Laplace transform. With real-case parameter
values, the solution of the discrete-time strong collision model is found to
approximate the continuous-time solution with excellent accuracy even with a
coarse-grained time sampling. Its calculation by the fast Fourier transform
algorithm is very efficient and suitable for real time fitting of experimental
data even on a slow computer.
","[{""version"":""v1"",""created"":""Fri, 4 Apr 2014 11:20:51 GMT""}]","2015-06-19"
"1404.1217","Horiguchi Tatsuya","Hiraku Abe and Tatsuya Horiguchi","The torus equivariant cohomology rings of Springer varieties","14 pages",,,,"math.AT","http://arxiv.org/licenses/nonexclusive-distrib/1.0/","  The Springer variety of type $A$ associated to a nilpotent operator on
$\mathbb{C}^n$ in Jordan canonical form admits a natural action of the
$\ell$-dimensional torus $T^{\ell}$ where $\ell$ is the number of the Jordan
blocks. We give a presentation of the $T^{\ell}$-equivariant cohomology ring of
the Springer variety through an explicit construction of an action of the
$n$-th symmetric group on the $T^{\ell}$-equivariant cohomology group. The
$T^{\ell}$-equivariant analogue of so called Tanisaki's ideal will appear in
the presentation.
","[{""version"":""v1"",""created"":""Fri, 4 Apr 2014 11:22:43 GMT""}]","2014-04-07"
"1404.1218","Saurabh Trivedi","Nhan Nguyen, Saurabh Trivedi and David Trotman","A geometric proof of the existence of definable Whitney stratifications","9 pages, 1 figure",,,,"math.DG","http://arxiv.org/licenses/nonexclusive-distrib/1.0/","  We give a geometric proof of existence of Whitney stratifications of
definable sets in o-minimal structures.
","[{""version"":""v1"",""created"":""Fri, 4 Apr 2014 11:36:07 GMT""}]","2014-04-07"
"1404.1219","Andrzej Niedzwiecki","Andrzej Niedzwiecki, Fu-Guo Xie, Agnieszka Stepnik","X-ray emission from hot accretion flows","To be published in ""Multiwavelength AGN surveys and studies"",
  Proceedings of IAU Symposium No. 304, 2013, eds. A. Mickaelian, F. Aharonian,
  D. Sanders",,,,"astro-ph.HE","http://arxiv.org/licenses/nonexclusive-distrib/1.0/","  Radiatively inefficient, hot accretion flows are widely considered as a
relevant accretion mode in low-luminosity AGNs. We study spectral formation in
such flows using a refined model with a fully general relativistic description
of both the radiative (leptonic and hadronic) and hydrodynamic processes, as
well as with an exact treatment of global Comptonization. We find that the
X-ray spectral index--Eddington ratio anticorrelation as well as the cut-off
energy measured in the best-studied objects favor accretion flows with rather
strong magnetic field and with a weak direct heating of electrons. Furthermore,
they require a much stronger source of seed photons than considered in previous
studies. The nonthermal synchrotron radiation of relativistic electrons seems
to be the most likely process capable of providing a sufficient flux of seed
photons. Hadronic processes, which should occur due to basic properties of hot
flows, provide an attractive explanation for the origin of such electrons.
","[{""version"":""v1"",""created"":""Fri, 4 Apr 2014 11:39:35 GMT""}]","2014-04-07"
"1404.1220","Subhajit Saha","Subhajit Saha, Atreyee Biswas and Subenoy Chakraborty","Irreversible Thermodynamics of the Universe: Constraints from Planck
  Data","15 pages, 8 figures","Advances in High Energy Physics 2014, 652962 (2014)","10.1155/2014/652962",,"gr-qc","http://arxiv.org/licenses/nonexclusive-distrib/1.0/","  The present work deals with irreversible Universal thermodynamics. The
homogenous and isotropic flat model of the universe is chosen as open
thermodynamical system and non-equilibrium thermodynamics comes into picture
due to the mechanism of particle creation. For simplicity, entropy flow is
considered only due to heat conduction. Further, due to Maxwell-Cattaneo
modified Fourier law for non-equilibrium phenomenon, the temperature satisfies
damped wave equation instead of heat conduction equation. Validity of
generalized second law of thermodynamics (GSLT) has been investigated for
Universe bounded by apparent or event horizon with cosmic substrutum as perfect
fluid with constant or variable equation of state or interacting dark species.
Finally, we have used three Planck data sets to constrain the thermal
conductivity \lambda and the coupling parameter b^2. These constraints must be
satisfied in order for GSLT to hold for Universe bounded by apparent or event
horizons.
","[{""version"":""v1"",""created"":""Fri, 4 Apr 2014 11:41:30 GMT""}]","2016-05-17"
"1404.1221","Piotr Homola Dr.","Piotr Homola and Markus Risse","A method to calibrate the absolute energy scale of air showers with
  ultra-high energy photons","accepted for publication in Phys. Rev. Lett",,"10.1103/PhysRevLett.112.151104",,"astro-ph.IM astro-ph.HE hep-ph","http://arxiv.org/licenses/nonexclusive-distrib/1.0/","  Calibrating the absolute energy scale of air showers initiated by ultra-high
energy cosmic rays is an important experimental issue. Currently, the
corresponding systematic uncertainty amounts to 14-21% using the fluorescence
technique. Here we describe a new, independent method which can be applied if
ultra-high energy photons are observed. While such photon-initiated showers
have not yet been identified, the capabilities of present and future cosmic-ray
detectors may allow their discovery. The method makes use of the geomagnetic
conversion of UHE photons (preshower effect), which significantly affects the
subsequent longitudinal shower development. The conversion probability depends
on photon energy and can be calculated accurately by QED. The comparison of the
observed fraction of converted photon events to the expected one allows the
determination of the absolute energy scale of the observed photon air showers
and, thus, an energy calibration of the air shower experiment. We provide
details of the method and estimate the accuracy that can be reached as a
function of the number of observed photon showers. Already a very small number
of UHE photons may help to test and fix the absolute energy scale.
","[{""version"":""v1"",""created"":""Fri, 4 Apr 2014 11:41:56 GMT""}]","2015-06-19"
"1404.1222","J\'ulius Czap","J\'ulius Czap, Peter \v{S}ugerek","Three classes of 1-planar graphs",,"Filomat 31 (2017) 363-370, New title: Drawing Graph Joins in the
  Plane with Restrictions on Crossings","10.2298/FIL1702363C",,"math.CO","http://arxiv.org/licenses/nonexclusive-distrib/1.0/","  A graph is called 1-planar if it can be drawn in the plane so that each of
its edges is crossed by at most one other edge. In this paper we decompose the
set of all 1-planar graphs into three classes $\mathcal C_0, \mathcal C_1$ and
$\mathcal C_2$ with respect to the types of crossings and present the
decomposition of 1-planar join products.
  Zhang \cite{z} proved that every $n$-vertex 1-planar graph of class $\mathcal
C_1$ has at most $\frac{18}{5}n-\frac{36}{5}$ edges and a $\mathcal
C_1$-drawing with at most $\frac 35 n-\frac 65$ crossings. We improve these
results. We show that every $\mathcal C_1$-drawing of a 1-planar graph has at
most $\frac 35 n-\frac 65$ crossings. Consequently, every $n$-vertex 1-planar
graph of class $\mathcal C_1$ has at most $\frac{18}{5}n-\frac{36}{5}$ edges.
Moreover, we prove that this bound is sharp.
","[{""version"":""v1"",""created"":""Fri, 4 Apr 2014 11:52:31 GMT""}]","2017-03-16"
"1404.1223","Rene Gerritsma","Jannis Joger and Antonio Negretti and Rene Gerritsma","Quantum dynamics of an atomic double-well system interacting with a
  trapped ion","14 pages, 13 figures",,"10.1103/PhysRevA.89.063621",,"quant-ph","http://arxiv.org/licenses/nonexclusive-distrib/1.0/","  We theoretically analyze the dynamics of an atomic double-well system with a
single ion trapped in its center. We find that the atomic tunnelling rate
between the wells depends both on the spin of the ion via the short-range
spin-dependent atom-ion scattering length and on its motional state with
tunnelling rates reaching hundreds of Hz. A protocol is presented that could
transport an atom from one well to the other depending on the motional (Fock)
state of the ion within a few ms. This phonon-atom coupling is of interest for
creating atom-ion entangled states and may form a building block in
constructing a hybrid atom-ion quantum simulator. We also analyze the effect of
imperfect ground state cooling of the ion and the role of micromotion when the
ion is trapped in a Paul trap. Due to the strong non-linearities in the
atom-ion interaction, the micromotion can cause couplings to high energy
atom-ion scattering states, preventing accurate state preparation and
complicating the double-well dynamics. We conclude that the effects of
micromotion can be reduced by choosing ion/atom combinations with a large mass
ratio and by choosing large inter-well distances. The proposed double-well
system may be realised in an experiment by combining either optical traps or
magnetic microtraps for atoms with ion trapping technology.
","[{""version"":""v1"",""created"":""Fri, 4 Apr 2014 11:54:19 GMT""}]","2015-06-19"
"1404.1224","Isabelle Liousse","Nancy Guelman, Isabelle Liousse","Burnside problem for groups of homeomorphisms of compact surfaces",,,,,"math.DS math.GR","http://arxiv.org/licenses/nonexclusive-distrib/1.0/","  A group $\Gamma$ is said to be periodic if for any $g$ in $\Gamma$ there is a
positive integer $n$ with $g^n=id$.
  We first prove that a finitely generated periodic group acting on the
2-sphere $\SS^2$ by $C^1$-diffeomorphisms with a finite orbit, is finite and
conjugate to a subgroup of $\mathrm{O}(3,\R)$ and we use it for proving that a
finitely generated periodic group of spherical diffeomorphisms with even
bounded orders is finite. Finally, we show that a finitely generated periodic
group of homeomorphisms of any orientable compact surface other than the
2-sphere or the 2-torus (which is the purpose of a previous paper of the
authors) is finite.
","[{""version"":""v1"",""created"":""Fri, 4 Apr 2014 11:54:57 GMT""},{""version"":""v2"",""created"":""Tue, 11 Nov 2014 19:07:58 GMT""}]","2014-11-12"
"1404.1225","Bertram Felgenhauer","Bertram Felgenhauer and Aart Middeldorp and Harald Zankl and Vincent
  van Oostrom","Layer Systems for Proving Confluence",,,"10.1145/2710017",,"cs.LO","http://arxiv.org/licenses/nonexclusive-distrib/1.0/","  We introduce layer systems for proving generalizations of the modularity of
confluence for first-order rewrite systems. Layer systems specify how terms can
be divided into layers. We establish structural conditions on those systems
that imply confluence. Our abstract framework covers known results like
modularity, many-sorted persistence, layer-preservation and currying. We
present a counterexample to an extension of persistence to order-sorted
rewriting and derive new sufficient conditions for the extension to hold. All
our proofs are constructive.
","[{""version"":""v1"",""created"":""Fri, 4 Apr 2014 11:55:01 GMT""},{""version"":""v2"",""created"":""Mon, 9 Feb 2015 10:21:46 GMT""}]","2015-02-10"
"1404.1226","Ray-Kuang Lee","Wen-Xing Yang, Ai-Xi Chen, Ting-Ting Zha, Yanfeng Bai, and Ray-Kuang
  Lee","Interference-induced enhancement of field entanglement in a
  microwave-driven V-type single-atom laser","7 pages, 4 figures",,"10.2478/s11534-014-0510-7",,"quant-ph","http://arxiv.org/licenses/nonexclusive-distrib/1.0/","  We investigate the generation and the evolution of two-mode
continuous-variable (CV) entanglement from system of a microwave-driven V-type
atom in a quantum beat laser. By taking into account the effects of
spontaneously generated quantum interference between two atomic decay channels,
we show that the CV entanglement with large mean number of photons can be
generated in our scheme, and the property of the filed entanglement can be
adjusted by properly modulating the frequency detuning of the fields. More
interesting, it is found that the entanglement can be significantly enhanced by
the spontaneously generated interference.
","[{""version"":""v1"",""created"":""Fri, 4 Apr 2014 11:57:29 GMT""}]","2015-06-19"
"1404.1227","Jochen Burghardt","Jochen Burghardt","Formale Entwicklung einer Steuerung f\""ur eine Fertigungszelle mit
  SYSYFOS","in german; 66 pages; 29 figures","Technical Report, GMD Arbeitspapier Vol.996, Jun 1996",,,"cs.LO cs.SE","http://arxiv.org/licenses/nonexclusive-distrib/1.0/","  Using the synthesis approach of Manna and Waldinger, a formally specified and
verified control circuitery for a production cell was developped. Building an
appropriate formal language level, we could achieve a requirements
specification to the informal description. We demonstrated that the paradigm of
deductive synthesis can be applied to the development of complete verified
systems, including hardware and mechanics. We defined two domain-specific
logical operators that schematise frequent patterns in specification and proof
and hence allow a more concise and expressive presentation. In Burghardt
(1995), an english short version of this paper, without appendices, can be
found.
","[{""version"":""v1"",""created"":""Fri, 4 Apr 2014 12:00:56 GMT""}]","2014-04-07"
"1404.1228","Vitali Denisov","V. Yu. Denisov","Nucleus-nucleus potential with shell-correction contribution and deep
  sub-barrier fusion of heavy nuclei","7 pages, 4 figures, Phys. Rev. C to be published",,"10.1103/PhysRevC.89.044604",,"nucl-th","http://arxiv.org/licenses/nonexclusive-distrib/1.0/","  It is suggested that the full nucleus-nucleus potential consists of the
macroscopic and shell-correction parts. The deep sub-barrier fusion hindrance
takes place in a nucleus-nucleus system with a strong negative shell-correction
contribution to the full heavy-ion potential, while a strong positive
shell-correction contribution to the full potential leads to weak enhancement
of the deep sub-barrier fusion cross section.
","[{""version"":""v1"",""created"":""Fri, 4 Apr 2014 12:08:16 GMT""}]","2015-06-19"
"1404.1229","Guang-Ri Jin Dr.","X. M. Feng, G. R. Jin, and W. Yang","Quantum interferometry with binary-outcome measurements in the presence
  of phase diffusion","7 pages, 5 figures; typing error are fixed; the published version","Phys. Rev. A 90, 013807 (2014)","10.1103/PhysRevA.90.013807",,"quant-ph physics.optics","http://arxiv.org/licenses/nonexclusive-distrib/1.0/","  Optimal measurement scheme with an efficient data processing is important in
quantum-enhanced interferometry. Here we prove that for a general binary
outcome measurement, the simplest data processing based on inverting the
average signal can saturate the Cram\'{e}r-Rao bound. This idea is illustrated
by binary outcome homodyne detection, even-odd photon counting (i.e., parity
detection), and zero-nonzero photon counting that have achieved super-resolved
interferometric fringe and shot-noise limited sensitivity in coherent-light
Mach-Zehnder interferometer. The roles of phase diffusion are investigated in
these binary outcome measurements. We find that the diffusion degrades the
fringe resolution and the achievable phase sensitivity. Our analytical results
confirm that the zero-nonzero counting can produce a slightly better
sensitivity than that of the parity detection, as demonstrated in a recent
experiment.
","[{""version"":""v1"",""created"":""Fri, 4 Apr 2014 12:22:25 GMT""},{""version"":""v2"",""created"":""Thu, 17 Apr 2014 07:17:13 GMT""},{""version"":""v3"",""created"":""Fri, 20 Jun 2014 14:55:39 GMT""},{""version"":""v4"",""created"":""Wed, 2 Jul 2014 08:58:23 GMT""},{""version"":""v5"",""created"":""Wed, 9 Jul 2014 08:07:32 GMT""}]","2014-07-11"
"1404.1230","Cheng Cheng","Cheng Cheng and Qing-Guo Huang","Constraint on inflation model from BICEP2 and WMAP 9-year data","4 pages, 1 figure; inflation model with power-law potential added and
  refs added","Int. J. Mod. Phys. D 24, 1541001 (2015)","10.1142/S0218271815410011",,"astro-ph.CO gr-qc hep-ph hep-th","http://arxiv.org/licenses/nonexclusive-distrib/1.0/","  Even though Planck data released in 2013 (P13) is not compatible with
Background Imaging of Cosmic Extragalactic Polarization (B2) and some local
cosmological observations, including Supernova Legacy Survey (SNLS) samples and
$H_0$ prior from Hubble Space Telescope (HST) etc, Wilkinson Microwaves
Anisotropy Probe 9-year data (W9) is consistent with all of them in the base
six-parameter $\Lambda$CDM+tensor cosmology quite well. In this letter, we
adopt the combinations of B2+W9 and B2+W9+SNLS+BAO+HST to constrain the
cosmological parameters in the base six-parameter $\Lambda$CDM+tensor model
with $n_t=-r/8$, where r and $n_t$ are the tensor-to-scalar ratio and the tilt
of relic gravitational wave spectrum, and BAO denotes Baryon Acoustic
Oscillation. We find that the Harrison-Zel'dovich (HZ) scale invariant scalar
power spectrum is consistent with both data combinations, chaotic inflation is
marginally disfavored by the data at around $2\sigma$ level, but the power-law
inflation model and the inflation model with inverse power-law potential can
fit the data nicely.
","[{""version"":""v1"",""created"":""Fri, 4 Apr 2014 12:24:43 GMT""},{""version"":""v2"",""created"":""Tue, 8 Apr 2014 13:35:29 GMT""}]","2015-04-03"
"1404.1231","Andrea Giuliani","D.M. Chernyak, F.A. Danevich, A. Giuliani, M. Mancuso, C. Nones, E.
  Olivieri, M. Tenconi, V.I. Tretyak","Rejection of randomly coinciding events in ZnMoO$_4$ scintillating
  bolometers",,,"10.1140/epjc/s10052-014-2913-4",,"physics.ins-det nucl-ex","http://arxiv.org/licenses/nonexclusive-distrib/1.0/","  Random coincidence of events (particularly from two neutrino double beta
decay) could be one of the main sources of background in the search for
neutrinoless double beta decay with cryogenic bolometers due to their poor time
resolution. Pulse-shape discrimination by using front edge analysis, mean-time
and $\chi^2$ methods was applied to discriminate randomly coinciding events in
ZnMoO$_4$ cryogenic scintillating bolometers. These events can be effectively
rejected at the level of 99% by the analysis of the heat signals with rise-time
of about 14 ms and signal-to-noise ratio of 900, and at the level of 92% by the
analysis of the light signals with rise-time of about 3 ms and signal-to-noise
ratio of 30, under the requirement to detect 95% of single events. These
rejection efficiencies are compatible with extremely low background levels in
the region of interest of neutrinoless double beta decay of $^{100}$Mo for
enriched ZnMoO$_4$ detectors, of the order of $10^{-4}$ counts/(y keV kg).
Pulse-shape parameters have been chosen on the basis of the performance of a
real massive ZnMoO$_4$ scintillating bolometer. Importance of the
signal-to-noise ratio, correct finding of the signal start and choice of an
appropriate sampling frequency are discussed.
","[{""version"":""v1"",""created"":""Fri, 4 Apr 2014 12:25:10 GMT""}]","2015-06-19"
