"1404.1137","Lin Zhang","Lin Zhang, Qiang Lin, Lionel C. Kimerling, and Jurgen Michel","Self-Frequency Shift of Cavity Soliton in Kerr Frequency Comb",,,,,"physics.optics nlin.PS","http://arxiv.org/licenses/nonexclusive-distrib/1.0/","  We show that the ultrashort cavity soliton in octave-spanning Kerr frequency
comb generation exhibits striking self-adaptiveness and robustness to external
perturbations, resulting in a novel frequency shifting/cancellation mechanism
and gigantic dispersive wave generation in response to the strong frequency
dependence of Kerr nonlinearity, Raman scattering, chromatic dispersion, and
cavity Q. These observations open up a great avenue towards versatile
manipulation of nonlinear soliton dynamics, flexible spectrum engineering of
mode-locked Kerr frequency combs, and highly efficient frequency translation of
optical waves.
","[{""version"":""v1"",""created"":""Fri, 4 Apr 2014 02:51:02 GMT""}]","2014-04-07"
"1404.1138","Hyunsoo Yang","Kulothungasagaran Narayanapillai and Hyunsoo Yang","Control of domain wall motion at vertically etched nanotrench in
  ferromagnetic nanowires",,"Appl. Phys. Lett. 103, 252401 (2013)","10.1063/1.4850415",,"cond-mat.mtrl-sci","http://arxiv.org/licenses/nonexclusive-distrib/1.0/","  We study field-induced domain wall motion in permalloy nanowires with
vertically etched nanotrench pinning site. Micromagnetic simulations and
electrical measurements are employed to characterize the pinning potential at
the nanotrench. It is found that the potential profile for a transverse wall
significantly differs from that of a vortex wall, and there is a correlation
between the pinning strength and the potential profile. Reliable domain wall
pinning and depinning is experimentally observed from a nanotrench in permalloy
nanowires. This demonstrates the suitability of the proposed nanotrench pinning
sites for domain wall device applications.
","[{""version"":""v1"",""created"":""Fri, 4 Apr 2014 02:53:45 GMT""}]","2014-04-07"
"1404.1139","Yufan Li","Yufan Li, Gang Su, Dazhi Hou, Li Ye, Yuan Tian, Jianli Xu, and
  Xiaofeng Jin","Evidence of the side jump mechanism in the anomalous Hall effect in
  paramagnets",,,"10.1209/0295-5075/110/27002",,"cond-mat.mtrl-sci","http://arxiv.org/licenses/nonexclusive-distrib/1.0/","  Persistent confusion has existed between the intrinsic (Berry curvature) and
the side jump mechanisms of anomalous Hall effect (AHE) in ferromagnets. We
provide unambiguous identification of the side jump mechanism, in addition to
the skew scattering contribution in epitaxial paramagnetic Ni$_{34}$Cu$_{66}$
thin films, in which the intrinsic contribution is by definition excluded.
Furthermore, the temperature dependence of the AHE further reveals that the
side jump mechanism is dominated by the elastic scattering.
","[{""version"":""v1"",""created"":""Fri, 4 Apr 2014 02:56:21 GMT""}]","2015-05-20"
"1404.1140","Christopher Amato","Christopher Amato, Frans A. Oliehoek","Scalable Planning and Learning for Multiagent POMDPs: Extended Version",,,,,"cs.AI cs.LG","http://arxiv.org/licenses/nonexclusive-distrib/1.0/","  Online, sample-based planning algorithms for POMDPs have shown great promise
in scaling to problems with large state spaces, but they become intractable for
large action and observation spaces. This is particularly problematic in
multiagent POMDPs where the action and observation space grows exponentially
with the number of agents. To combat this intractability, we propose a novel
scalable approach based on sample-based planning and factored value functions
that exploits structure present in many multiagent settings. This approach
applies not only in the planning case, but also in the Bayesian reinforcement
learning setting. Experimental results show that we are able to provide high
quality solutions to large multiagent planning and learning problems.
","[{""version"":""v1"",""created"":""Fri, 4 Apr 2014 03:02:44 GMT""},{""version"":""v2"",""created"":""Sat, 20 Dec 2014 03:28:34 GMT""}]","2014-12-23"
"1404.1141","Dong Zhang","Dong Zhang, Maosheng Miao, Fuhua Yang, Haiqing Lin and Kai Chang","Half metallic and insulating phases in BN/Graphene lateral
  heterostructures",,"2D Mater. 2 041001 (2015)",,,"cond-mat.mes-hall","http://arxiv.org/licenses/nonexclusive-distrib/1.0/","  We investigate theoretically the electronic structure of graphene and boron
nitride (BN) lateral heterostructures, which were fabricated in recent
experiments. The first-principles density functional calculation demonstrates
that a huge intrinsic transverse electric field can be induced in the graphene
nanoribbon region, and depends sensitively on the edge configuration of the
lateral heterostructure. The polarized electric field originates from the
charge mismatch at the BN-graphene interfaces. This huge electric field can
open a significant bang gap in graphene nanoribbon, and lead to fully
spinpolarized edge states and induce half-metallic phase in the lateral
BN/Graphene/BN heterostructure with proper edge configurations.
","[{""version"":""v1"",""created"":""Fri, 4 Apr 2014 03:14:28 GMT""}]","2016-07-04"
"1404.1142","Yifan Zhou","Yifan Zhou, Zhifeng Zhao, Qianlan Ying, Rongpeng Li, Xuan Zhou, and
  Honggang Zhang","Two-tier Spatial Modeling of Base Stations in Cellular Networks",,,,,"cs.NI","http://arxiv.org/licenses/nonexclusive-distrib/1.0/","  Poisson Point Process (PPP) has been widely adopted as an efficient model for
the spatial distribution of base stations (BSs) in cellular networks. However,
real BSs deployment are rarely completely random, due to environmental impact
on actual site planning. Particularly, for multi-tier heterogeneous cellular
networks, operators have to place different BSs according to local coverage and
capacity requirement, and the diversity of BSs' functions may result in
different spatial patterns on each networking tier. In this paper, we consider
a two-tier scenario that consists of macrocell and microcell BSs in cellular
networks. By analyzing these two tiers separately and applying both classical
statistics and network performance as evaluation metrics, we obtain accurate
spatial model of BSs deployment for each tier. Basically, we verify the
inaccuracy of using PPP in BS locations modeling for either macrocells or
microcells. Specifically, we find that the first tier with macrocell BSs is
dispersed and can be precisely modelled by Strauss point process, while Matern
cluster process captures the second tier's aggregation nature very well. These
statistical models coincide with the inherent properties of macrocell and
microcell BSs respectively, thus providing a new perspective in understanding
the relationship between spatial structure and operational functions of BSs.
","[{""version"":""v1"",""created"":""Fri, 4 Apr 2014 03:19:33 GMT""},{""version"":""v2"",""created"":""Fri, 1 Aug 2014 10:38:05 GMT""}]","2014-08-04"
"1404.1143","Qianlan Ying","Qianlan Ying, Zhifeng Zhao, Yifan Zhou, Rongpeng Li, Xuan Zhou and
  Honggang Zhang","Characterizing Spatial Patterns of Base Stations in Cellular Networks",,,,,"cs.NI","http://creativecommons.org/licenses/by-nc-sa/3.0/","  The topology of base stations (BSs) in cellular networks, serving as a basis
of networking performance analysis, is considered to be obviously distinctive
with the traditional hexagonal grid or square lattice model, thus stimulating a
fundamental rethinking. Recently, stochastic geometry based models, especially
the Poisson point process (PPP), attracts an ever-increasing popularity in
modeling BS deployment of cellular networks due to its merits of tractability
and capability for capturing nonuniformity. In this study, a detailed
comparison between common stochastic models and real BS locations is performed.
Results indicate that the PPP fails to precisely characterize either urban or
rural BS deployment. Furthermore, the topology of real data in both regions are
examined and distinguished by statistical methods according to the point
interaction trends they exhibit. By comparing the corresponding real data with
aggregative point process models as well as repulsive point process models, we
verify that the capacity-centric deployment in urban areas can be modeled by
typical aggregative processes such as the Matern cluster process, while the
coverage-centric deployment in rural areas can be modeled by representative
","[{""version"":""v1"",""created"":""Fri, 4 Apr 2014 03:20:37 GMT""},{""version"":""v2"",""created"":""Sun, 8 Jun 2014 08:21:12 GMT""},{""version"":""v3"",""created"":""Thu, 19 Jun 2014 11:51:06 GMT""}]","2014-06-20"
"1404.1144","Kiran Sree Pokkuluri Prof","Pokkuluri Kiran Sree, Inampudi Ramesh Babu, SSSN Usha Devi N","AIS-MACA- Z: MACA based Clonal Classifier for Splicing Site, Protein
  Coding and Promoter Region Identification in Eukaryotes","6,1-6 Pages, Journal of Artificial Intelligence Research & Advances
  Volume 1, Issue 1,2014. arXiv admin note: text overlap with arXiv:1403.5933,
  arXiv:1404.0453",,,,"cs.CE cs.LG","http://arxiv.org/licenses/nonexclusive-distrib/1.0/","  Bioinformatics incorporates information regarding biological data storage,
accessing mechanisms and presentation of characteristics within this data. Most
of the problems in bioinformatics and be addressed efficiently by computer
techniques. This paper aims at building a classifier based on Multiple
Attractor Cellular Automata (MACA) which uses fuzzy logic with version Z to
predict splicing site, protein coding and promoter region identification in
eukaryotes. It is strengthened with an artificial immune system technique
(AIS), Clonal algorithm for choosing rules of best fitness. The proposed
classifier can handle DNA sequences of lengths 54,108,162,252,354. This
classifier gives the exact boundaries of both protein and promoter regions with
an average accuracy of 90.6%. This classifier can predict the splicing site
with 97% accuracy. This classifier was tested with 1, 97,000 data components
which were taken from Fickett & Toung , EPDnew, and other sequences from a
renowned medical university.
","[{""version"":""v1"",""created"":""Fri, 4 Apr 2014 03:31:29 GMT""}]","2014-04-07"
"1404.1145","Jirina Stone","N.J.Stone, J.R.Stone, P.M.Walker and C.R.Bingham","Quasi-particle and collective magnetism: Rotation, pairing and blocking
  in high-K isomers","5 pages, 2 figures, published in Physics Letters B726, 675 (2013)","Physics Letters B 726, 675 (2013)","10.1016/j.physletb.2013.09.016",,"nucl-ex nucl-th","http://arxiv.org/licenses/nonexclusive-distrib/1.0/","  For the first time, a wide range of collective magnetic g-factors g$_{\rm
R}$, obtained from a novel analysis of experimental data for
multi-quasiparticle configurations in high-K isomers, is shown to exhibit a
striking systematic variation with the relative number of proton and neutron
quasiparticles, N$_{\rm p}$ - N$_{\rm n}$. Using the principle of additivity,
the quasi-particle contribution to magnetism in high-K isomers of Lu - Re, Z =
71 - 75, has been estimated. Based on these estimates, band-structure branching
ratio data are used to explore the behaviour of the collective contribution as
the number and proton/neutron nature (N$_{\rm p}$, N$_{\rm n}$), of the
quasi-particle excitations, change. Basic ideas of pairing, its quenching by
quasi-particle excitation and the consequent changes to moment of inertia and
collective magnetism are discussed. Existing model calculations do not
reproduce the observed g$_{\rm R}$ variation adequately. The paired superfluid
system of nucleons in these nuclei, and their excitations, present properties
of general physics interest. The new-found systematic behaviour of g$_{\rm R}$
in multi-quasi-particle excitations of this unique system, showing variation
from close to zero for multi-neutron states to above 0.5 for multi-proton
states, opens a fresh window on these effects and raises the important question
of just which nucleons contribute to the `collective' properties of these
nuclei.
","[{""version"":""v1"",""created"":""Fri, 4 Apr 2014 03:33:51 GMT""}]","2015-06-19"
"1404.1146","Hyunsoo Yang","Praveen Deorani, Jaesung Son, Karan Banerjee, Nikesh Koirala, Matthew
  Brahlek, Seongshik Oh, Hyunsoo Yang","Observation of inverse spin Hall effect in bismuth selenide",,"Phys. Rev. B, 90, 094403 (2014)","10.1103/PhysRevB.90.094403",,"cond-mat.mtrl-sci cond-mat.mes-hall","http://arxiv.org/licenses/nonexclusive-distrib/1.0/","  Bismuth Selenide (Bi2Se3) is a topological insulator exhibiting helical spin
polarization and strong spin-orbit coupling. The spin-orbit coupling links the
charge current to spin current via the spin Hall effect (SHE). We demonstrate a
Bi2Se3 spin detector by injecting the pure spin current from a magnetic
permalloy layer to a Bi2Se3 thin film and detect the inverse SHE in Bi2Se3. The
spin Hall angle of Bi2Se3 is found to be 0.0093 and the spin diffusion length
in Bi2Se3 to be 6.2 nm at room temperature. Our results suggest that
topological insulators with strong spin-orbit coupling can be used in
functional spintronic devices.
","[{""version"":""v1"",""created"":""Fri, 4 Apr 2014 03:42:42 GMT""},{""version"":""v2"",""created"":""Thu, 2 Oct 2014 02:43:28 GMT""}]","2015-06-19"
"1404.1147","Karthik Gurumoorthy","Karthik S. Gurumoorthy and Anand Rangarajan","Error bounds for gradient density estimation computed from a finite
  sample set using the method of stationary phase",,,,,"stat.CO","http://arxiv.org/licenses/nonexclusive-distrib/1.0/","  For a twice continuously differentiable function $S$, we define the density
function of its gradient (derivative in one dimension) $s = S^{\prime}$ as a
random variable transformation of a uniformly distributed random variable using
$s$ as the transformation function. Given $N$ values of $S$ sampled at equally
spaced locations, we demonstrate using the method of stationary phase that the
approximation error between the integral of the scaled, discrete power spectrum
of the wave function
$\phi^{D}_{\tau}=\frac{1}{\sqrt{L}}\exp\left(\frac{iS}{\tau}\right)$ and the
integral of the true density function of $s$ over an arbitrarily small interval
is bounded above by $O(1/N)$ as $N \rightarrow \infty$ ($\tau \rightarrow 0$).
In addition to its easy implementation and fast computability in $O(N \log N)$
that only requires computing the discrete Fourier transform, our framework for
obtaining the derivative density does not involve any parameter selection like
the number of histogram bins, width of the histogram bins, width of the kernel
parameter, number of mixture components etc. as required by other widely
applied methods like histograms and Parzen windows.
","[{""version"":""v1"",""created"":""Fri, 4 Apr 2014 03:43:28 GMT""},{""version"":""v2"",""created"":""Thu, 4 Feb 2016 08:36:03 GMT""},{""version"":""v3"",""created"":""Thu, 29 Dec 2016 05:42:10 GMT""}]","2016-12-30"
"1404.1148","Mohammad Noshad","Mohammad Noshad and Maite Brandt-Pearce","Hadamard Coded Modulation: An Alternative to OFDM for Optical Wireless
  Communications",,,,,"cs.IT math.IT","http://arxiv.org/licenses/nonexclusive-distrib/1.0/","  Orthogonal frequency division multiplexing (OFDM) is a modulation technique
susceptible to source, channel and amplifier nonlinearities because of its high
peak-to-average ratio (PAPR). The distortion gets worse by increasing the
average power of the OFDM signals since larger portion of the signals are
affected by nonlinearity. In this paper we introduce Hadamard coded modulation
(HCM) that uses the fast Walsh-Hadamard transform (FWHT) to modulate data as an
alternative technique to OFDM in direct-detection wireless optical systems.
This technique is shown to have a better performance for high average optical
power scenarios because of its small PAPR, and can be used instead of OFDM in
two scenarios: 1) in optical systems that require high average optical powers
such as visible light communications (VLC), and 2) in optical wireless systems
unconstrained by average power, for which HCM achieves lower bit error rate
(BER) compared to OFDM. The power efficiency of HCM can be improved by removing
a part of the signal's DC bias without losing any information. In this way, the
amplitude of the transmitted signal is decreased and the signals become less
susceptible to nonlinearity. Interleaving can be applied on HCM to make the
resulting signals resistent against inter-symbol interference (ISI) effects in
dispersive channels by uniformly distributing the interference over all
symbols.
","[{""version"":""v1"",""created"":""Fri, 4 Apr 2014 03:45:53 GMT""}]","2014-04-07"
"1404.1149","Bin Shu","Bin Shu","Generic property and conjugacy classes of homogeneous Borel subalgebras
  of restricted Lie algebras","24 pages. The title is changed. In the revised version, we limit to
  classify the conjugacy classes of homogeneous Borel subalgebras",,,,"math.RT","http://arxiv.org/licenses/nonexclusive-distrib/1.0/","  Let $(\mathfrak{g},[p])$ be a finite-dimensional restricted Lie algebra over
an algebraically closed field $\mathbb{K}$ of characteristic $p>0$, and $G$ be
the adjoint group of $\mathfrak{g}$. We say that $\mathfrak{g}$ satisfying the
{\sl generic property} if $\mathfrak{g}$ admits generic tori introduced in
\cite{BFS}. A Borel subalgebra (or Borel for short) of $\mathfrak{g}$ is by
definition a maximal solvable subalgebra containing a maximal torus of
$\mathfrak{g}$, which is further called generic if additionally containing a
generic torus. In this paper, we first settle a conjecture proposed by Premet
in \cite{Pr2} on regular Cartan subalgebras of restricted Lie algebras. We
prove that the statement in the conjecture for a given $\mathfrak{g}$ is valid
if and only if it is the case when $\mathfrak{g}$ satisfies the generic
property. We then classify the conjugay classes of homogeneous Borel
subalgebras of the restricted simple Lie algebras $\mathfrak{g}=W(n)$ under
$G$-conjugation when $p>3$, and present the representatives of these classes.
Here $W(n)$ is the so-called Jacobson-Witt algebra, by definition the
derivation algebra of the truncated polynomial ring
$\mathbb{K}[T_1,\cdots,T_n]\slash (T_1^p,\cdots,T_n^p)$. We also describe the
closed connected solvable subgroups of $G$ associated with those representative
Borel subalgebras.
","[{""version"":""v1"",""created"":""Fri, 4 Apr 2014 03:59:58 GMT""},{""version"":""v2"",""created"":""Mon, 16 Oct 2017 16:23:49 GMT""}]","2017-10-17"
"1404.1150","Bin Shu","Yang Zeng and Bin Shu","Finite W-superalgebras for basic classical Lie superalgebras","82 pages. The main result in the older version is improved. For this,
  we add Sections 9.3 and 9.4. This is still a primary version. arXiv admin
  note: text overlap with arXiv:0809.0663 by other authors",,,,"math.RT","http://arxiv.org/licenses/nonexclusive-distrib/1.0/","  We consider the finite W-superalgebras for a basic classical Lie superalgebra
g associated with an even nilpotent element in g both over the field of complex
numbers field and and over a filed of positive characteristic. We present the
PBW theorem for these finite W-superalgebrfas. Then we formulate a conjecture
about the minimal dimensional representations of of complex finite
W-superalgebras, and demonstrate it with some examples. Under the assumption
that the conjecture holds, we finally show that the lower bound of dimensions
predicted in the super version of Kac-Weisfeiler conjecture formulated and
proved by Wang-Zhao in [40] for the modular representations of the basic
classical Lie superalgebra with any p-characters can be reached.
","[{""version"":""v1"",""created"":""Fri, 4 Apr 2014 04:15:16 GMT""},{""version"":""v2"",""created"":""Sun, 11 May 2014 15:13:52 GMT""}]","2014-05-13"
"1404.1151","Sadanand Kulkarni A","Sadanand A. Kulkarni, Prashant L. Borde, Ramesh R. Manza, Pravin L.
  Yannawar","Recognition of Handwritten MODI Numerals using Hu and Zernike features","This paper has been withdrawn by the author due to the paper was
  rejected by journal with a reson ""paper was not suitable for the journal""",,,,"cs.CV","http://arxiv.org/licenses/nonexclusive-distrib/1.0/","  Handwritten automatic character recognition has attracted many researchers
all over the world to contribute automatic character recognition domain. Shape
identification and feature extraction is very important part of any character
recognition system and success of method is highly dependent on selection of
features. However feature extraction is the most important step in defining the
shape of the character as precisely and as uniquely as possible. This is indeed
the most important step and complex task as well and achieved success by using
invariance property, irrespective of position and orientation. Zernike moments
describes shape, identify rotation invariant due to its Orthogonality property.
MODI is an ancient script of India had cursive and complex representation of
characters. The work described in this paper presents efficiency of Zernike
moments over Hus moment for automatic recognition of handwritten MODI numerals.
","[{""version"":""v1"",""created"":""Fri, 4 Apr 2014 04:31:52 GMT""},{""version"":""v2"",""created"":""Thu, 3 Jul 2014 06:21:13 GMT""},{""version"":""v3"",""created"":""Mon, 27 Oct 2014 13:17:22 GMT""}]","2014-10-28"
"1404.1152","Josh Moles","Josh Moles, Peter Banda, Christof Teuscher","Delay Line as a Chemical Reaction Network","9 pages, 11 figures, 6 tables","Parallel Process. Lett. 25, 1540002 (2015)","10.1142/S0129626415400022",,"q-bio.MN","http://arxiv.org/licenses/nonexclusive-distrib/1.0/","  Chemistry as an unconventional computing medium presently lacks a systematic
approach to gather, store, and sort data over time. To build more complicated
systems in chemistries, the ability to look at data in the past would be a
valuable tool to perform complex calculations. In this paper we present the
first implementation of a chemical delay line providing information storage in
a chemistry that can reliably capture information over an extended period of
time. The delay line is capable of parallel operations in a single instruction,
multiple data (SIMD) fashion.
  Using Michaelis-Menten kinetics, we describe the chemical delay line
implementation featuring an enzyme acting as a means to reduce copy errors. We
also discuss how information is randomly accessible from any element on the
delay line. Our work shows how the chemical delay line retains and provides a
value from a previous cycle. The system's modularity allows for integration
with existing chemical systems. We exemplify the delay line capabilities by
integration with a threshold asymmetric signal perceptron to demonstrate how it
learns all 14 linearly separable binary functions over a size two sliding
window. The delay line has applications in biomedical diagnosis and treatment,
such as smart drug delivery.
","[{""version"":""v1"",""created"":""Fri, 4 Apr 2014 04:43:14 GMT""},{""version"":""v2"",""created"":""Tue, 31 Mar 2015 22:37:41 GMT""}]","2015-04-02"
"1404.1153","Azer Akhmedov","Azer Akhmedov and Warren Shreve","Balance in Random Trees","3 Figures",,,,"math.CO","http://arxiv.org/licenses/nonexclusive-distrib/1.0/","  We prove that a random labeled (unlabeled) tree is balanced. We also prove
that random labeled and unlabeled trees are strongly $k$-balanced for any
$k\geq 3$.
","[{""version"":""v1"",""created"":""Fri, 4 Apr 2014 04:55:33 GMT""}]","2014-04-07"
"1404.1154","Dinakar Ramakrishnan","Kapil Paranjape and Dinakar Ramakrishnan","Modular Forms and Calabi-Yau Varieties","23 pages; this is a slight modification of the first version, mainly
  fixing some typos, adding references and making a few remarks",,,,"math.NT math.AG","http://arxiv.org/licenses/nonexclusive-distrib/1.0/","  Given a holomorphic newform $f$ of weight $k$ and with rational coefficients,
a question of Mazur and van Straten asks if there is an associated Calabi-Yau
variety $X$ over ${\mathbb Q}$ of dimension $k-1$ such that the $\ell$-adic
Galois representation of $f$ occurs in the cohomology of $X$ in degree $k-1$.
We provide some explicit examples giving a positive answer, and show moreover
that such $X$ come equipped with an involution $\tau$ acting by $-1$ on $H^0(X,
\Omega^{k-1})$. We also raise a general question regarding the regular
algebraic, (essentially) selfdual cusp forms $\pi$ on GL$(n)$ with ${\mathbb
Q}$-coefficients, asking for associated Calabi-Yau varieties $X=X_\pi$ (with an
involution $\tau$ on each such $X$ such that the quotient variety $X/\tau$ is
rational) carrying the (conjectural) motive of $\pi$. We then investigate the
compatibility of this with Rankin-Selberg products of modular forms.
","[{""version"":""v1"",""created"":""Fri, 4 Apr 2014 05:22:36 GMT""},{""version"":""v2"",""created"":""Mon, 12 May 2014 18:14:08 GMT""}]","2014-05-13"
"1404.1155","Kosho Minomo","K. Minomo, T. Matsumoto, K. Egashira, K. Ogata, and M. Yahiro","Eikonal reaction theory for two-neutron removal reactions","4 pages, 3 figures",,"10.1103/PhysRevC.90.027601",,"nucl-th","http://arxiv.org/licenses/nonexclusive-distrib/1.0/","  The eikonal reaction theory (ERT) proposed lately is a method of calculating
one-neutron removal reactions at intermediate incident energies in which
Coulomb breakup is treated accurately with the continuum discretized
coupled-channels method. ERT is extended to two-neutron removal reactions. ERT
reproduces measured one- and two-neutron removal cross sections for 6He
scattering on 12C and 208Pb targets at 240 MeV/nucleon and also on a 28Si
target at 52 MeV/nucleon. For the heavier target in which Coulomb breakup is
important, ERT yields much better agreement with the measured cross sections
than the Glauber model.
","[{""version"":""v1"",""created"":""Fri, 4 Apr 2014 05:31:48 GMT""}]","2015-06-19"
