"1404.0988","Marta Mazzocco","Leonid Chekhov and Marta Mazzocco","On a Poisson space of bilinear forms with a Poisson Lie action","Substantially enhanced new version",,,,"math.QA math-ph math.MP nlin.SI","http://arxiv.org/licenses/nonexclusive-distrib/1.0/","  We consider the space of bilinear forms on a complex N-dimensional vector
space endowed with the quadratic Poisson bracket studied in our previous paper
arXiv:1012.5251. We classify all possible quadratic brackets on the set of
pairs of matrices A and B with the property that the natural action of B on the
defining matrix A of a bilinear form is a Poisson action of a Poisson-Lie
group, thus endowing this space of bilinear forms with the structure of Poisson
homogeneous space. Beside the product Poisson structure we find two more (dual
to each other) structures for which (in contrast to the product Poisson
structure) we can implement the reduction to the space of bilinear forms with
block upper triangular defining matrices by Dirac procedure. We consider the
generalisation of the above construction to triples and show that the space of
bilinear forms then acquires the structure of Poisson symmetric space. We study
also the generalisation to chains of transformations and to the quantum and
quantum affine algebras and the relation between the construction of Poisson
symmetric spaces and that of the Poisson groupoid.
","[{""version"":""v1"",""created"":""Thu, 3 Apr 2014 16:05:00 GMT""},{""version"":""v2"",""created"":""Mon, 9 Jun 2014 09:40:40 GMT""},{""version"":""v3"",""created"":""Fri, 20 Mar 2015 16:16:09 GMT""}]","2015-03-23"
"1404.0989","Martin Larsson","Damir Filipovic and Martin Larsson","Polynomial Diffusions and Applications in Finance","This article is forthcoming in Finance and Stochastics",,,,"math.PR","http://arxiv.org/licenses/nonexclusive-distrib/1.0/","  This paper provides the mathematical foundation for polynomial diffusions.
They play an important role in a growing range of applications in finance,
including financial market models for interest rates, credit risk, stochastic
volatility, commodities and electricity. Uniqueness of polynomial diffusions is
established via moment determinacy in combination with pathwise uniqueness.
Existence boils down to a stochastic invariance problem that we solve for
semialgebraic state spaces. Examples include the unit ball, the product of the
unit cube and nonnegative orthant, and the unit simplex.
","[{""version"":""v1"",""created"":""Thu, 3 Apr 2014 16:08:08 GMT""},{""version"":""v2"",""created"":""Tue, 15 Jul 2014 23:10:46 GMT""},{""version"":""v3"",""created"":""Mon, 11 Aug 2014 14:51:45 GMT""},{""version"":""v4"",""created"":""Tue, 26 May 2015 18:10:23 GMT""},{""version"":""v5"",""created"":""Tue, 22 Dec 2015 13:34:10 GMT""},{""version"":""v6"",""created"":""Sun, 13 Mar 2016 17:03:23 GMT""}]","2016-03-15"
"1404.0990","Giulio Chiribella","G. Chiribella and Y. Yang","Optimal asymptotic cloning machines","27 + 9 pages, corrected one observation about cloning of maximally
  entangled states","New J. Phys. 16 063005 (2014)","10.1088/1367-2630/16/6/063005",,"quant-ph math-ph math.MP","http://arxiv.org/licenses/nonexclusive-distrib/1.0/","  We pose the question whether the asymptotic equivalence between quantum
cloning and quantum state estimation, valid at the single-clone level, still
holds when all clones are examined globally. We conjecture that the answer is
affirmative and present a large amount of evidence supporting our conjecture,
developing techniques to derive optimal asymptotic cloners and proving their
equivalence with estimation in virtually all scenarios considered in the
literature. Our analysis covers the case of arbitrary finite sets of states,
arbitrary families of coherent states, arbitrary phase- and
multiphase-covariant sets of states, and two-qubit maximally entangled states.
In all these examples we observe that the optimal asymptotic fidelity enjoys a
universality property, as its scaling does not depend on the specific details
of the set of input states, but only on the number of parameters needed to
specify them.
","[{""version"":""v1"",""created"":""Thu, 3 Apr 2014 16:08:26 GMT""},{""version"":""v2"",""created"":""Tue, 8 Apr 2014 07:08:45 GMT""},{""version"":""v3"",""created"":""Fri, 16 May 2014 08:33:43 GMT""},{""version"":""v4"",""created"":""Tue, 11 Nov 2014 03:56:00 GMT""}]","2014-11-12"
"1404.0991","Shi-Zeng Lin","Shi-Zeng Lin, Kipton Barros, Eundeok Mun, Jae-Wook Kim, Matthias
  Frontzek, S. Barilo, S. V. Shiryaev, Vivien S. Zapf, and Cristian D. Batista","Magnetic field induced phases in anisotropic triangular
  antiferromagnets: application to $\mathrm{CuCrO_2}$","6.5 pages, 9 figures","Phys. Rev. B 89, 220405(R) (2014)","10.1103/PhysRevB.89.220405",,"cond-mat.mtrl-sci cond-mat.stat-mech","http://arxiv.org/licenses/nonexclusive-distrib/1.0/","  We introduce a minimal spin model for describing the magnetic properties of
$\mathrm{CuCrO_2}$. Our Monte Carlo simulations of this model reveal a rich
magnetic field induced phase diagram, which explains the measured field
dependence of the electric polarization. The sequence of phase transitions
between different mutiferroic states arises from a subtle interplay between
spatial and spin anisotropy, magnetic frustration and thermal fluctuations. Our
calculations are compared to new measurements up to 92 T.
","[{""version"":""v1"",""created"":""Thu, 3 Apr 2014 16:09:01 GMT""},{""version"":""v2"",""created"":""Wed, 18 Jun 2014 15:41:07 GMT""}]","2014-06-19"
"1404.0992","Olivier Bouillot","Olivier Bouillot","The Algebra of Multitangent Functions",,,,,"math.NT","http://arxiv.org/licenses/nonexclusive-distrib/1.0/","  Multizeta values are numbers appearing in many different contexts.
Unfortunately, their arithmetics remains mostly out of reach. In this article,
we define a functional analogue of the algebra of multizetas values, namely the
algebra of multitangent functions, which are 1- periodic functions defined by a
process formally similar to multizeta values. We introduce here the fundamental
notions of reduction into monotangent functions, projection onto multitangent
functions and that of trifactorization, giving a way of writing a multitangent
function in terms of Hurwitz multizeta functions. This explains why the
multitangent algebra is a functional analogue of the algebra of multizeta
values. We then discuss the most important algebraic and analytic properties of
these functions and their consequences on multizeta values, as well as their
regularization in the divergent case. Each property of multitangents has a
pendant on the side of multizeta values. This allows us to propose new
conjectures, which have been checked up to the weight 18.
","[{""version"":""v1"",""created"":""Thu, 3 Apr 2014 16:10:10 GMT""}]","2014-04-04"
"1404.0993","Benjamin Buck","Benjamin Buck, Eric Anderssen, Jason Bessuille, Mario Cepeda, Thomas
  Johnson, James Kelsey, Gerrit van Nieuwenhuizen, Gerard Visser","Design and Fabrication of a Highly Integrated Silicon Detector for the
  STAR Experiment at Brookhaven National Laboratory","14 Pages, 17 Figures. Submitted to New England iMAPS 2014 Symposium
  and Expo",,,,"physics.ins-det","http://arxiv.org/licenses/nonexclusive-distrib/1.0/","  We present the design of a detector used as a particle tracking device in the
STAR experiment at the RHIC collider of Brookhaven National Laboratories. The
""stave,"" 24 of which make up the completed detector, is a highly mechanically
integrated design comprised of 6 custom silicon sensors mounted on a Kapton
substrate. 4608 wire bonds connect these sensors to 36 analog front-end chips
which are mounted on the same substrate. Power and signal connectivity from the
hybrid to the front-end chips is provided by wire bonds. The entire circuit is
mounted on a carbon fiber base co-cured to the Kapton substrate. We present the
unique design challenges for this detector and some novel techniques for
overcoming them.
","[{""version"":""v1"",""created"":""Thu, 3 Apr 2014 16:11:32 GMT""}]","2014-04-04"
"1404.0994","Christoph Adami","Christoph Adami, Jory Schossau, and Arend Hintze","Evolutionary game theory using agent-based methods","29 pages, 13 figures. Version to appear in Physics of Life Reviews",,,,"q-bio.PE nlin.AO physics.bio-ph","http://arxiv.org/licenses/nonexclusive-distrib/1.0/","  Evolutionary game theory is a successful mathematical framework geared
towards understanding the selective pressures that affect the evolution of the
strategies of agents engaged in interactions with potential conflicts. While a
mathematical treatment of the costs and benefits of decisions can predict the
optimal strategy in simple settings, more realistic settings such as finite
populations, non-vanishing mutations rates, stochastic decisions, communication
between agents, and spatial interactions, require agent-based methods where
each agent is modeled as an individual, carries its own genes that determine
its decisions, and where the evolutionary outcome can only be ascertained by
evolving the population of agents forward in time. While highlighting standard
mathematical results, we compare those to agent-based methods that can go
beyond the limitations of equations and simulate the complexity of
heterogeneous populations and an ever-changing set of interactors. We conclude
that agent-based methods can predict evolutionary outcomes where purely
mathematical treatments cannot tread (for example in the weak selection--strong
mutation limit), but that mathematics is crucial to validate the computational
simulations.
","[{""version"":""v1"",""created"":""Thu, 3 Apr 2014 16:14:18 GMT""},{""version"":""v2"",""created"":""Tue, 17 Nov 2015 18:58:01 GMT""},{""version"":""v3"",""created"":""Wed, 31 Aug 2016 19:25:26 GMT""}]","2016-09-01"
"1404.0995","Armin Schikorra","Miroslav Ba\v{c}\'ak, Bobo Hua, J\""urgen Jost, Martin Kell, Armin
  Schikorra","A notion of nonpositive curvature for general metric spaces",,,"10.1016/j.difgeo.2014.11.002",,"math.MG","http://arxiv.org/licenses/nonexclusive-distrib/1.0/","  We introduce a new definition of nonpositive curvature in metric spaces and
study its relationship to the existing notions of nonpositive curvature in
comparison geometry. The main feature of our definition is that it applies to
all metric spaces and does not rely on geodesics. Moreover, a scaled and a
relaxed version of our definition are appropriate in discrete metric spaces,
and are believed to be of interest in geometric data analysis.
","[{""version"":""v1"",""created"":""Thu, 3 Apr 2014 16:14:49 GMT""}]","2016-04-08"
"1404.0996","Nilanjana Kumar","Nilanjana Kumar and Stephen P. Martin","LHC search for di-Higgs decays of stoponium and other scalars in events
  with two photons and two bottom jets","15 pages v3:Modified cuts on photon pT's and fake photon backgrounds
  added","Phys. Rev. D 90, 055007 (2014)","10.1103/PhysRevD.90.055007",,"hep-ph","http://arxiv.org/licenses/nonexclusive-distrib/1.0/","  We study the prospects for LHC discovery of a narrow resonance that decays to
two Higgs bosons, using the final state of two photons and two bottom jets. Our
work is motivated in part by a scenario in which two-body flavor-preserving
decays of the top squark are kinematically forbidden. Stoponium, a hadronic
bound state of the top squark and its anti-particle, will then form, and may
have a large branching fraction into the two Higgs boson final state. We
estimate the cross-section needed for a 5-sigma discovery at the 14 TeV LHC for
such a narrow di-Higgs resonance, using the invariant mass distributions of the
final state bottom jets and photons, as a function of the integrated
luminosity. The results are also applicable to any other di-Higgs resonance
produced by gluon fusion.
","[{""version"":""v1"",""created"":""Thu, 3 Apr 2014 16:15:38 GMT""},{""version"":""v2"",""created"":""Mon, 14 Apr 2014 18:12:11 GMT""},{""version"":""v3"",""created"":""Mon, 18 Aug 2014 18:19:29 GMT""}]","2014-09-17"
"1404.0997","Olivier Bouillot","Olivier Bouillot","The Algebra of Hurwitz Multizeta Functions",,,,,"math.CO","http://arxiv.org/licenses/nonexclusive-distrib/1.0/","  Multizeta values are real numbers which span a complicated algebra: there
exist two different interacting products. A functional analog of these numbers
is defined so as to obtain a better understanding of them, the Hurwitz
multizeta functions, which span an algebra for which a precise description is
wanted. In this note, we prove that the algebra of Hurwitz multizeta functions
is a polynomial algebra.
","[{""version"":""v1"",""created"":""Thu, 3 Apr 2014 16:23:56 GMT""}]","2014-04-04"
"1404.0998","Carly Richardson","C. L. Richardson, S. D. Edkins, G. R. Berdiyorov, C. J. Chua, J. P.
  Griffiths, G. A. C. Jones, M. R. Buitelaar, V. Narayan, F. Sfigakis, C. G.
  Smith, L. Covaci, M. R. Connolly","Vortex detection and quantum transport in mesoscopic graphene Josephson
  junction arrays","5 pages, 6 figures","Phys. Rev. B, 91, 245418 (2015)","10.1103/PhysRevB.91.245418",,"cond-mat.mes-hall cond-mat.supr-con","http://arxiv.org/licenses/nonexclusive-distrib/1.0/","  We investigate mesoscopic Josephson junction arrays created by patterning
superconducting disks on monolayer graphene, concentrating on the high-$T/T_c$
regime of these devices and the phenomena which contribute to the
superconducting glass state in diffusive arrays. We observe features in the
magnetoconductance at rational fractions of flux quanta per array unit cell,
which we attribute to the formation of flux-quantized vortices. The applied
fields at which the features occur are well described by Ginzburg-Landau
simulations that take into account the number of unit cells in the array. We
find that the mean conductance and universal conductance fluctuations are both
enhanced below the critical temperature and field of the superconductor, with
greater enhancement away from the graphene Dirac point.
","[{""version"":""v1"",""created"":""Thu, 3 Apr 2014 16:25:29 GMT""},{""version"":""v2"",""created"":""Sun, 21 Jun 2015 19:03:22 GMT""}]","2015-06-23"
"1404.0999","Lasse Leskel\""a","Lasse Leskel\""a and Matti Vihola","Conditional convex orders and measurable martingale couplings","21 pages","Bernoulli 23 (2017) 2784-2807","10.3150/16-BEJ827",,"math.PR","http://arxiv.org/licenses/nonexclusive-distrib/1.0/","  Strassen's classical martingale coupling theorem states that two real-valued
random variables are ordered in the convex (resp.\ increasing convex)
stochastic order if and only if they admit a martingale (resp.\ submartingale)
coupling. By analyzing topological properties of spaces of probability measures
equipped with a Wasserstein metric and applying a measurable selection theorem,
we prove a conditional version of this result for real-valued random variables
conditioned on a random element taking values in a general measurable space. We
also provide an analogue of the conditional martingale coupling theorem in the
language of probability kernels and illustrate how this result can be applied
in the analysis of pseudo-marginal Markov chain Monte Carlo algorithms. We also
illustrate how our results imply the existence of a measurable minimiser in the
context of martingale optimal transport.
","[{""version"":""v1"",""created"":""Thu, 3 Apr 2014 16:25:44 GMT""},{""version"":""v2"",""created"":""Tue, 17 Jun 2014 14:02:49 GMT""},{""version"":""v3"",""created"":""Fri, 30 Oct 2015 12:57:49 GMT""}]","2017-05-11"
"1404.1000","Diego S\'aez","Neus Puchades and Diego S\'aez","Relativistic Positioning Systems: Numerical Simulations","10 pages, 4 figures, published in ACTA FUTURA/ACT/ESA","ACTA FUTURA (2013)","10.2420/AF07.2013.103",,"gr-qc","http://arxiv.org/licenses/nonexclusive-distrib/1.0/","  The motion of satellite constellations similar to GPS and Galileo is
numerically simulated and, then, the region where bifurcation (double
positioning) occurs is appropriately represented. In the cases of double
positioning, the true location may be found using additional information
(angles or times). The zone where the Jacobian, J, of the transformation from
inertial to emission coordinates vanishes is also represented and interpreted.
It is shown that the uncertainties in the satellite world lines produce
positioning errors, which depend on the value of |J|. The smaller this quantity
the greater the expected positioning errors. Among all the available 4-tuples
of satellites, the most appropriate one -for a given location- should minimize
positioning errors (large enough |J| values) avoiding bifurcation. Our study is
particularly important to locate objects which are far away from Earth, e.g.,
satellites.
","[{""version"":""v1"",""created"":""Thu, 3 Apr 2014 16:32:29 GMT""}]","2014-04-04"
"1404.1001","Eliecer Hernandez-Gajate","C. Albertus, E. Hern\'andez, C. Hidalgo-Duque and J.Nieves","$\bar B_s\to K$ semileptonic decay from an Omn\`es improved constituent
  quark model","9 latex pages, 5 figures, 1 table",,"10.1016/j.physletb.2014.09.037",,"hep-ph hep-ex nucl-th","http://arxiv.org/licenses/nonexclusive-distrib/1.0/","  We study the $f^+$ form factor for the semileptonic $\bar B_s\to
K^+\ell^-\bar\nu_\ell$ decay in a constituent quark model. The valence quark
estimate is supplemented with the contribution from the $\bar B^*$ pole that
dominates the high $q^2$ region. We use a multiply-subtracted Omn\`es
dispersion relation to extend the quark model predictions from its region of
applicability near $q^2_{\rm max}=(M_{B_s}-M_K)^2\sim 23.75$ GeV$^2$ to all
$q^2$ values accessible in the physical decay. To better constrain the
dependence of $f^+$ on $q^2$, we fit the subtraction constants to a combined
input from previous light cone sum rule [Phys. Rev. D 78 (2008) 054015] and the
present quark model results. From this analysis, we obtain $\Gamma(\bar B_s\to
K^+\ell^-\bar\nu_\ell)=(5.45^{+0.83}_{-0.80})|V_{ub}|^2\times 10^{-9}\,{\rm
MeV}$, which is about 20\% higher than the prediction based only on QCD light
cone sum rule estimates. Differences are much larger for the $f^+$ form factor
in the region above $q^2=15$ GeV$^2$.
","[{""version"":""v1"",""created"":""Thu, 3 Apr 2014 16:34:51 GMT""}]","2015-12-30"
"1404.1002","Richard Scalzo","R. A. Scalzo, M. Childress, B. Tucker, F. Yuan, B. Schmidt, P. J.
  Brown, C. Contreras, N. Morrell, E. Hsiao, C. Burns, M. M. Phillips, A.
  Campillay, C. Gonzalez, K. Krisciunas, M. Stritzinger, M. L. Graham, J.
  Parrent, S. Valenti, C. Lidman, B. Schaefer, N. Scott, M. Fraser, A. Gal-Yam,
  C. Inserra, K. Maguire, S. J. Smartt, J. Sollerman, M. Sullivan, F. Taddia,
  O. Yaron, D. R. Young, S. Taubenberger, C. Baltay, N. Ellman, U. Feindt, E.
  Hadjiyska, R. McKinnon, P. E. Nugent, D. Rabinowitz, and E. S. Walker","Early ultraviolet emission in the Type Ia supernova LSQ12gdj: No
  evidence for ongoing shock interaction","18 pages, 10 figures, accepted to MNRAS; v2 accepted version. Spectra
  available on WISEReP (http://www.weizmann.ac.il/astrophysics/wiserep/).
  Natural-system photometry and bolometric light curve available as online
  tables in MNRAS version",,"10.1093/mnras/stu1723",,"astro-ph.HE astro-ph.SR","http://arxiv.org/licenses/nonexclusive-distrib/1.0/","  We present photospheric-phase observations of LSQ12gdj, a slowly-declining,
UV-bright Type Ia supernova. Classified well before maximum light, LSQ12gdj has
extinction-corrected absolute magnitude $M_B = -19.8$, and pre-maximum
spectroscopic evolution similar to SN 1991T and the super-Chandrasekhar-mass SN
2007if. We use ultraviolet photometry from Swift, ground-based optical
photometry, and corrections from a near-infrared photometric template to
construct the bolometric (1600-23800 \AA) light curve out to 45 days past
$B$-band maximum light. We estimate that LSQ12gdj produced $0.96 \pm 0.07$
$M_\odot$ of $^{56}$Ni, with an ejected mass near or slightly above the
Chandrasekhar mass. As much as 27% of the flux at the earliest observed phases,
and 17% at maximum light, is emitted bluewards of 3300 \AA. The absence of
excess luminosity at late times, the cutoff of the spectral energy distribution
bluewards of 3000 \AA, and the absence of narrow line emission and strong Na I
D absorption all argue against a significant contribution from ongoing shock
interaction. However, up to 10% of LSQ12gdj's luminosity near maximum light
could be produced by the release of trapped radiation, including kinetic energy
thermalized during a brief interaction with a compact, hydrogen-poor envelope
(radius $< 10^{13}$ cm) shortly after explosion; such an envelope arises
generically in double-degenerate merger scenarios.
","[{""version"":""v1"",""created"":""Thu, 3 Apr 2014 16:43:17 GMT""},{""version"":""v2"",""created"":""Thu, 21 Aug 2014 13:20:42 GMT""}]","2015-06-19"
"1404.1003","P. S. Bhupal Dev","P. S. Bhupal Dev, Peter Millington, Apostolos Pilaftsis, Daniele
  Teresi","Flavour Covariant Transport Equations: an Application to Resonant
  Leptogenesis","109 pages, 14 figures, 5 tables; typos corrected; final published
  version","Nucl. Phys. B 886 (2014) 569-664","10.1016/j.nuclphysb.2014.06.020","MAN/HEP/2014/01, IPPP/14/20, DCPT/14/40","hep-ph astro-ph.CO hep-th","http://arxiv.org/licenses/nonexclusive-distrib/1.0/","  We present a fully flavour-covariant formalism for transport phenomena, by
deriving Markovian master equations that describe the time-evolution of
particle number densities in a statistical ensemble with arbitrary flavour
content. As an application of this general formalism, we study flavour effects
in a scenario of resonant leptogenesis (RL) and obtain the flavour-covariant
evolution equations for heavy-neutrino and lepton number densities. This
provides a complete and unified description of RL, capturing three distinct
physical phenomena: (i) the resonant mixing between the heavy-neutrino states,
(ii) coherent oscillations between different heavy-neutrino flavours, and (iii)
quantum decoherence effects in the charged-lepton sector. To illustrate the
importance of this formalism, we numerically solve the flavour-covariant rate
equations for a minimal RL model and show that the total lepton asymmetry can
be enhanced by up to one order of magnitude, as compared to that obtained from
flavour-diagonal or partially flavour off-diagonal rate equations. Thus, the
viable RL model parameter space is enlarged, thereby enhancing further the
prospects of probing a common origin of neutrino masses and the baryon
asymmetry in the Universe at the LHC, as well as in low-energy experiments
searching for lepton flavour and number violation. The key new ingredients in
our flavour-covariant formalism are rank-4 rate tensors, which are required for
the consistency of our flavour-mixing treatment, as shown by an explicit
calculation of the relevant transition amplitudes by generalizing the optical
theorem. We also provide a geometric and physical interpretation of the
heavy-neutrino degeneracy limits in the minimal RL scenario. Finally, we
comment on the consistency of various suggested forms for the heavy-neutrino
self-energy regulator in the lepton-number conserving limit.
","[{""version"":""v1"",""created"":""Thu, 3 Apr 2014 16:53:11 GMT""},{""version"":""v2"",""created"":""Fri, 25 Apr 2014 18:03:25 GMT""},{""version"":""v3"",""created"":""Mon, 23 Jun 2014 16:51:36 GMT""},{""version"":""v4"",""created"":""Fri, 25 Jul 2014 14:59:52 GMT""}]","2015-04-28"
"1404.1004","Andrei Teleman","Fran\c{c}ois Lalonde, Andrei Teleman","The $g$-areas and the commutator length","13 pages, 2 figures. To appear in International Journal of
  Mathematics, Vol. 24, No. 7 (2013). Revised version: misprint corrected",,"10.1142/S0129167X13500572",,"math.SG","http://arxiv.org/licenses/nonexclusive-distrib/1.0/","  The commutator length of a Hamiltonian diffeomorphism $f\in \mathrm{Ham}(M,
\omega)$ of a closed symplectic manifold $(M,\omega)$ is by definition the
minimal $k$ such that $f$ can be written as a product of $k$ commutators in
$\mathrm{Ham}(M, \omega)$. We introduce a new invariant for Hamiltonian
diffeomorphisms, called the $k_+$-area, which measures the ""distance"", in a
certain sense, to the subspace $\mathcal{C}_k$ of all products of $k$
commutators. Therefore this invariant can be seen as the obstruction to writing
a given Hamiltonian diffeomorphism as a product of $k$ commutators. We also
consider an infinitesimal version of the commutator problem: what is the
obstruction to writing a Hamiltonian vector field as a linear combination of
$k$ Lie brackets of Hamiltonian vector fields? A natural problem related to
this question is to describe explicitly, for every fixed $k$, the set of linear
combinations of $k$ such Lie brackets. The problem can be obviously
reformulated in terms of Hamiltonians and Poisson brackets. For a given Morse
function $f$ on a symplectic Riemann surface $M$ (verifying a weak genericity
condition) we describe the linear space of commutators of the form $\{f,g\}$,
with $g\in\mathcal{C}^\infty(M,\mathbb{R})$.
","[{""version"":""v1"",""created"":""Thu, 3 Apr 2014 16:55:18 GMT""},{""version"":""v2"",""created"":""Sun, 6 Apr 2014 11:11:17 GMT""}]","2014-04-08"
