"1403.3381","Christophe Grojean","Roberto Contino, Margherita Ghezzi, Christophe Grojean, Margarete
  Muhlleitner and Michael Spira","eHDECAY: an Implementation of the Higgs Effective Lagrangian into HDECAY","28 pages. Manual of the eHEDCAY code that can be downloaded at the
  http://www-itp.particle.uni-karlsruhe.de/~maggie/eHDECAY/ Submitted to
  Comput. Phys. Commun. Companion paper: arXiv:1303.3876, JHEP 1307 (2013) 035",,"10.1016/j.cpc.2014.06.028","CERN-PH-TH/2013-316, KA-TP-03-2014, PSI-PR-13-20","hep-ph","http://arxiv.org/licenses/nonexclusive-distrib/1.0/","  We present eHDECAY, a modified version of the program HDECAY which includes
the full list of leading bosonic operators of the Higgs effective Lagrangian
with a linear or non-linear realization of the electroweak symmetry and
implements two benchmark composite Higgs models.
","[{""version"":""v1"",""created"":""Thu, 13 Mar 2014 19:46:05 GMT""}]","2015-06-19"
"1403.3382","Tomasz Lukowski","Nils Kanning, Tomasz Lukowski, Matthias Staudacher","A Shortcut to General Tree-level Scattering Amplitudes in N=4 SYM via
  Integrability","18 pages, 7 figures; v2: minor changes, references added",,,,"hep-th","http://arxiv.org/licenses/nonexclusive-distrib/1.0/","  We combine recent applications of the two-dimensional quantum inverse
scattering method to the scattering amplitude problem in four-dimensional N=4
Super Yang-Mills theory. Integrability allows us to obtain a general, explicit
method for the derivation of the Yangian invariants relevant for tree-level
scattering amplitudes in the N=4 model.
","[{""version"":""v1"",""created"":""Thu, 13 Mar 2014 19:46:49 GMT""},{""version"":""v2"",""created"":""Tue, 8 Apr 2014 16:56:43 GMT""}]","2014-04-09"
"1403.3383","Abolhassan Vaezi","Abolhassan Vaezi, Maissam Barkeshli","Fibonacci Anyons From Abelian Bilayer Quantum Hall States","5+9 pages. Accepted for publication in Phys. Rev. Lett","Phys. Rev. Lett. 113, 236804 (2014)","10.1103/PhysRevLett.113.236804",,"cond-mat.str-el cond-mat.mes-hall","http://arxiv.org/licenses/nonexclusive-distrib/1.0/","  The possibility of realizing non-Abelian statistics and utilizing it for
topological quantum computation (TQC) has generated widespread interest.
However, the non-Abelian statistics that can be realized in most accessible
proposals is not powerful enough for universal TQC. In this paper, we consider
a simple bilayer fractional quantum Hall (FQH) system with the $1/3$ Laughlin
state in each layer. We show that interlayer tunneling can drive a transition
to an exotic non-Abelian state that contains the famous `Fibonacci'anyon, whose
non-Abelian statistics is powerful enough for universal TQC. Our analysis rests
on startling agreements from a variety of distinct methods, including thin
torus limits, effective field theories, and coupled wire constructions. We
provide evidence that the transition can be continuous, at which point the
charge gap remains open while the neutral gap closes. This raises the question
of whether these exotic phases may have already been realized at $\nu = 2/3$ in
bilayers, as past experiments may not have definitively ruled them out.
","[{""version"":""v1"",""created"":""Thu, 13 Mar 2014 19:47:37 GMT""},{""version"":""v2"",""created"":""Thu, 6 Nov 2014 02:00:09 GMT""}]","2014-12-04"
"1403.3384","Giovanni Antonio Chirilli","Giovanni A. Chirilli, Yuri V. Kovchegov","$\gamma^* \gamma^*$ Cross Section at NLO and Properties of the BFKL
  Evolution at Higher Orders","29 pages and 5 figures, v2: minor typos corrected, plots redrawn",,"10.1007/JHEP05(2014)099",,"hep-ph","http://arxiv.org/licenses/nonexclusive-distrib/1.0/","  We obtain a simple analytic expression for the high energy $\gamma^*
\gamma^*$ scattering cross section at the next-to-leading order in the
logarithms-of-energy power counting. To this end we employ the eigenfunctions
of the NLO BFKL equation constructed in our previous paper. We also construct
the eigenfunctions of the NNLO BFKL kernel and obtain a general form of the
solution for the NNLO BFKL equation, which confirms the ansatz proposed in our
previous paper.
","[{""version"":""v1"",""created"":""Thu, 13 Mar 2014 19:48:22 GMT""},{""version"":""v2"",""created"":""Wed, 20 Aug 2014 14:19:29 GMT""}]","2015-06-19"
"1403.3385","Erik Panzer","Erik Panzer","Algorithms for the symbolic integration of hyperlogarithms with
  applications to Feynman integrals","The described Maple program is supplied in the ancillary files to
  this submission and can also be obtained from
  http://www.math.hu-berlin.de/~panzer/","Computer Physics Communications, 188 (2015), pp. 148-166","10.1016/j.cpc.2014.10.019",,"hep-th hep-ph math-ph math.MP","http://arxiv.org/licenses/nonexclusive-distrib/1.0/","  We provide algorithms for symbolic integration of hyperlogarithms multiplied
by rational functions, which also include multiple polylogarithms when their
arguments are rational functions. These algorithms are implemented in Maple and
we discuss various applications. In particular, many Feynman integrals can be
computed by this method.
","[{""version"":""v1"",""created"":""Thu, 13 Mar 2014 19:48:29 GMT""}]","2015-01-06"
"1403.3386","Fabrizio Caola","Fabrizio Caola, Andrzej Czarnecki, Yi Liang, Kirill Melnikov, Robert
  Szafron","Muon decay spin asymmetry","5 pages, 2 figures","Phys. Rev. D 90, 053004 (2014)","10.1103/PhysRevD.90.053004","Alberta Thy 4-14","hep-ph","http://arxiv.org/licenses/nonexclusive-distrib/1.0/","  We compute the spin asymmetry of the muon decay through O(alpha^2) in
perturbative QED. These two-loop corrections are about a factor five (twenty)
smaller than the current statistical (systematic) uncertainty of the most
precise measurement, performed by the TWIST collaboration. We point out that at
O(alpha^2) the asymmetry requires a careful definition due to multi-lepton
final states and suggest to use familiar QCD techniques to define it in an
infra-red safe way. We find that the TWIST measurement of the asymmetry is in
excellent agreement with the Standard Model.
","[{""version"":""v1"",""created"":""Thu, 13 Mar 2014 19:50:01 GMT""}]","2014-09-10"
"1403.3387","Berardo Ruffini","Berardo Ruffini (SNS)","Stability theorems for GNS inequalities: a reduction principle to the
  radial case",,,,,"math.AP","http://arxiv.org/licenses/nonexclusive-distrib/1.0/","  A symmetrization techique, introduced by Cianchi, Fusco, Maggi and Pratelli
concerning the Sobolev inequality, is adapted to the
Gagliardo-Nirenberg-Sobolev inequality (GNS) to obtain a reduction step of the
problem of showing its quantitative version. More precisely we prove a
stability result for the GNS inequality under the hypothesis that it holds, in
turn, in the smaller class of radial symmetric decreasing functions.
","[{""version"":""v1"",""created"":""Thu, 13 Mar 2014 19:52:17 GMT""}]","2014-03-14"
"1403.3388","Berardo Ruffini","Camillo De Lellis, Matteo Focardi, Berardo Ruffini (SNS)","A note on the hausdorff dimension of the singular set for minimizers of
  the mumford-shah energy",,,,,"math.AP","http://arxiv.org/licenses/nonexclusive-distrib/1.0/","  We give a more elementary proof of a result by Ambrosio, Fusco and Hutchinson
to estimate the Hausdorff dimension of the singular set of minimizers of the
Mumford-Shah energy (see [2, Theorem 5.6]). On the one hand, we follow the
strategy of the above mentioned paper; but on the other hand our analysis
greatly simplifies the argument since it relies on the compactness result
proved by the first two Authors in [4, Theorem 13] for sequences of local
minimizers with vanishing gradient energy, and the regularity theory of minimal
Caccioppoli partitions, rather than on the corresponding results for Almgren's
area minimizing sets.
","[{""version"":""v1"",""created"":""Thu, 13 Mar 2014 19:59:25 GMT""},{""version"":""v2"",""created"":""Tue, 18 Mar 2014 12:09:22 GMT""}]","2014-03-19"
"1403.3393","Edward Schlafly","E. F. Schlafly, G. Green, D. P. Finkbeiner, H.-W. Rix, E. F. Bell, W.
  S. Burgett, K. C. Chambers, P. W. Draper, K. W. Hodapp, N. Kaiser, E. A.
  Magnier, N. F. Martin, N. Metcalfe, P. A. Price, J. L. Tonry","A Large Catalog of Accurate Distances to Molecular Clouds from PS1
  Photometry","16 pages, 4 figures",,"10.1088/0004-637X/786/1/29",,"astro-ph.GA","http://arxiv.org/licenses/nonexclusive-distrib/1.0/","  Distance measurements to molecular clouds are important, but are often made
separately for each cloud of interest, employing very different different data
and techniques. We present a large, homogeneous catalog of distances to
molecular clouds, most of which are of unprecedented accuracy. We determine
distances using optical photometry of stars along lines of sight toward these
clouds, obtained from PanSTARRS-1. We simultaneously infer the reddenings and
distances to these stars, tracking the full probability distribution function
using a technique presented in Green et al. (2014). We fit these star-by-star
measurements using a simple dust screen model to find the distance to each
cloud. We thus estimate the distances to almost all of the clouds in the
Magnani et al. (1985) catalog, as well as many other well-studied clouds,
including Orion, Perseus, Taurus, Cepheus, Polaris, California, and Monoceros
R2, avoiding only the inner Galaxy. Typical statistical uncertainties in the
distances are 5%, though the systematic uncertainty stemming from the quality
of our stellar models is about 10%. The resulting catalog is the largest
catalog of accurate, directly-measured distances to molecular clouds. Our
distance estimates are generally consistent with available distance estimates
from the literature, though in some cases the literature estimates are off by a
factor of more than two.
","[{""version"":""v1"",""created"":""Thu, 13 Mar 2014 20:00:00 GMT""}]","2015-06-19"
"1403.3394","Andreas Papaefstathiou","Massimiliano Grazzini, Andreas Papaefstathiou, Jennifer M. Smillie and
  Bryan R. Webber","Resummation of the transverse-energy distribution in Higgs boson
  production at the Large Hadron Collider","26 pages, 13 figures. Version to appear in JHEP",,"10.1007/JHEP09(2014)056",,"hep-ph","http://arxiv.org/licenses/nonexclusive-distrib/1.0/","  We compute the resummed hadronic transverse-energy ($E_T$) distribution due
to initial-state QCD radiation in the production of a Standard Model Higgs
boson of mass 126 GeV by gluon fusion at the Large Hadron Collider, with
matching to next-to-leading order calculations at large $E_T$. Effects of
hadronization, underlying event and limited detector acceptance are estimated
using aMC@NLO with the Herwig++ and Pythia 8 event generators.
","[{""version"":""v1"",""created"":""Thu, 13 Mar 2014 20:00:01 GMT""},{""version"":""v2"",""created"":""Mon, 25 Aug 2014 10:58:10 GMT""}]","2015-06-19"
"1403.3395","Prateek Sharma","Nilanjan Banerjee, Prateek Sharma","Turbulence and cooling in galaxy cluster cores","13 pages, 7 figures; replaced by the MNRAS-accepted version",,"10.1093/mnras/stu1179",,"astro-ph.GA astro-ph.CO","http://arxiv.org/licenses/nonexclusive-distrib/1.0/","  We study the interplay between turbulent heating, mixing, and radiative
cooling in an idealized model of cool cluster cores. Active galactic nuclei
(AGN) jets are expected to drive turbulence and heat cluster cores. Cooling of
the intracluster medium (ICM) and stirring by AGN jets are tightly coupled in a
feedback loop. We impose the feedback loop by balancing radiative cooling with
turbulent heating. In addition to heating the plasma, turbulence also mixes it,
suppressing the formation of cold gas at small scales. In this regard, the
effect of turbulence is analogous to thermal conduction. For uniform plasma in
thermal balance (turbulent heating balancing radiative cooling), cold gas
condenses only if the cooling time is shorter than the mixing time. This
condition requires the turbulent kinetic energy to be $\gtrsim$ the plasma
internal energy; such high velocities in cool cores are ruled out by
observations. The results with realistic magnetic fields and thermal conduction
are qualitatively similar to the hydrodynamic simulations. Simulations where
the runaway cooling of the cool core is prevented due to {\em mixing} with the
hot ICM show cold gas even with subsonic turbulence, consistent with
observations. Thus, turbulent mixing is the likely mechanism via which AGN jets
heat cluster cores. The thermal instability growth rates observed in
simulations with turbulence are consistent with the local thermal instability
interpretation of cold gas in cluster cores.
","[{""version"":""v1"",""created"":""Thu, 13 Mar 2014 20:00:05 GMT""},{""version"":""v2"",""created"":""Wed, 2 Jul 2014 12:51:05 GMT""},{""version"":""v3"",""created"":""Sat, 8 Nov 2014 16:29:00 GMT""}]","2015-06-19"
"1403.3396","Elise Furlan","E. Furlan, S. T. Megeath, M. Osorio, A. M. Stutz, W. J. Fischer, B.
  Ali, T. Stanke, P. Manoj, J. D. Adams, J. J. Tobin","On the nature of the deeply embedded protostar OMC-2 FIR 4","Accpeted by ApJ, 17 pages, 11 figures",,"10.1088/0004-637X/786/1/26",,"astro-ph.SR","http://arxiv.org/licenses/nonexclusive-distrib/1.0/","  We use mid-infrared to submillimeter data from the Spitzer, Herschel, and
APEX telescopes to study the bright sub-mm source OMC-2 FIR 4. We find a point
source at 8, 24, and 70 $\mu$m, and a compact, but extended source at 160, 350,
and 870 $\mu$m. The peak of the emission from 8 to 70 $\mu$m, attributed to the
protostar associated with FIR 4, is displaced relative to the peak of the
extended emission; the latter represents the large molecular core the protostar
is embedded within. We determine that the protostar has a bolometric luminosity
of 37 Lsun, although including more extended emission surrounding the point
source raises this value to 86 Lsun. Radiative transfer models of the
protostellar system fit the observed SED well and yield a total luminosity of
most likely less than 100 Lsun. Our models suggest that the bolometric
luminosity of the protostar could be just 12-14 Lsun, while the luminosity of
the colder (~ 20 K) extended core could be around 100 Lsun, with a mass of
about 27 Msun. Our derived luminosities for the protostar OMC-2 FIR 4 are in
direct contradiction with previous claims of a total luminosity of 1000 Lsun
(Crimier et al 2009). Furthermore, we find evidence from far-infrared molecular
spectra (Kama et al. 2013, Manoj et al. 2013) and 3.6 cm emission (Reipurth et
al 1999) that FIR 4 drives an outflow. The final stellar mass the protostar
will ultimately achieve is uncertain due to its association with the large
reservoir of mass found in the cold core.
","[{""version"":""v1"",""created"":""Thu, 13 Mar 2014 20:00:06 GMT""}]","2015-06-19"
"1403.3397","Sylvain Fichet","Sylvain Fichet, Bj\""orn Herrmann, Yannick Stoll","A new flavour imprint of SU(5)-like Grand Unification and its LHC
  signatures","6 pages, minor typos fixed, reference added, matches PLB version",,"10.1016/j.physletb.2015.01.013","LAPTH-016/14","hep-ph","http://arxiv.org/licenses/nonexclusive-distrib/1.0/","  We point out that the hypothesis of a SU(5)-like supersymmetric Grand Unified
Theory (GUT) implies a generic relation within the flavour structure of up-type
squarks. Contrary to other well-known SU(5) relations between the down-quark
and charged lepton sectors, this relation remains exact in the presence of any
corrections and extra operators. Moreover it remains valid to a good precision
at the electroweak scale, and opens thus new possibilities for testing
SU(5)-like GUTs. We derive the low-energy effective theory of observable light
up-type squarks, that also constitutes a useful tool for squark phenomenology.
We use this effective theory to determine how to test SU(5) relations at the
LHC. Focussing on scenarios with light stops, compatible with Natural SUSY, it
appears that simple tests involving ratios of event rates are sufficient to
test the hypothesis of a SU(5)-like GUT theory. The techniques of charm-tagging
and top-polarimetry are a crucial ingredient of these tests.
","[{""version"":""v1"",""created"":""Thu, 13 Mar 2014 20:00:33 GMT""},{""version"":""v2"",""created"":""Thu, 12 Jun 2014 13:10:30 GMT""},{""version"":""v3"",""created"":""Tue, 11 Nov 2014 23:38:09 GMT""},{""version"":""v4"",""created"":""Mon, 26 Jan 2015 20:54:58 GMT""}]","2015-06-19"
"1403.3398","Marco Stefano Bianchi","Marco S. Bianchi and Matias Leoni","On the ABJM four-point amplitude at three loops and BDS exponentiation","31 pages, 4 figures",,"10.1007/JHEP11(2014)077",,"hep-th","http://arxiv.org/licenses/nonexclusive-distrib/1.0/","  We study the three-loop four-point amplitude in ABJM theory. We determine the
dual conformal invariant integrals with highest number of propagators and fix
their coefficients by two-particle cuts. Evaluating such a combination of
integrals in dimensional regularization we provide evidence for exponentiation
of the amplitude, including the finite terms. In addition we show that the
three-loop amplitude can be expressed in terms of classical polylogarithms of
uniform degree of transcendentality.
","[{""version"":""v1"",""created"":""Thu, 13 Mar 2014 20:00:33 GMT""}]","2015-06-19"
"1403.3399","Doojin Kim","Chien-Yi Chen, Hooman Davoudiasl and Doojin Kim","Warped Graviton ""Z + Missing Energy"" Signal at Hadron Colliders","8 pages, 5 figues and 1 table","Phys. Rev. D 89, 096007 (2014)","10.1103/PhysRevD.89.096007",,"hep-ph hep-ex","http://arxiv.org/licenses/nonexclusive-distrib/1.0/","  We examine the reach at hadron colliders for the lightest warped Kaluza-Klein
(KK) graviton G_1 in the Z(->l+l-) Z(->nu nu) channel, l=e,mu, within
Randall-Sundrum models of hierarchy and flavor where the Standard Model gauge
fields and fermions propagate in the 5D bulk. The reconstructed Z and the
accompanying large missing energy allow for an efficient suppression of
backgrounds. For reasonable parameters, a ~2(2.6) TeV G_1 can be discovered at
5 sigma with 300 /fb (3 /ab) of 14 TeV LHC data via our ""Z + missing energy""
signal. Using this signal, the discovery reach for G_1 at a future 100 TeV pp
collider is estimated to be as high as ~10 TeV. We discuss mass determination
of the singly produced G_1, using the energy distribution of its visible (Z ->
l+l-) decay product, by adapting a recently proposed method. Based on our
analysis, a mass measurement at the ~5% level with ~3 /ab of the 14 TeV LHC
data can be feasible.
","[{""version"":""v1"",""created"":""Thu, 13 Mar 2014 20:00:37 GMT""}]","2014-05-21"
"1403.3400","Gilad Svirski","Gilad Svirski and Ehud Nakar","SN 2008D: A Wolf-Rayet explosion through a thick wind","5 pages, 1 figure, submitted to apjL","ApJ, 788, L14, 2014","10.1088/2041-8205/788/1/L14",,"astro-ph.HE","http://arxiv.org/licenses/nonexclusive-distrib/1.0/","  Supernova (SN) 2008D/XRT 080109 is considered to be the only direct detection
of a shock breakout from a regular SN to date. While a breakout interpretation
was favored by several papers, inconsistencies remain between the observations
and current SN shock breakout theory. Most notably, the duration of the
luminous X-ray pulse is considerably longer than expected for a spherical
breakout through the surface of a type Ibc SN progenitor, and the X-ray
radiation features, mainly its flat spectrum and its luminosity evolution, are
enigmatic. We apply a recently developed theoretical model for the observed
radiation from a Wolf-Rayet SN exploding through a thick wind and show that it
naturally explains all the observed features of SN 2008D X-ray emission,
including the energetics, the spectrum and the detailed luminosity evolution.
We find that the inferred progenitor and SN parameters are typical for an
exploding Wolf-Rayet. A comparison of the wind density found at the breakout
radius to the density at much larger radii, as inferred by late radio
observations, suggests an enhanced mass loss rate taking effect about ten days
or less prior to the SN explosion. This finding joins accumulating evidence for
a possible late phase in the stellar evolution of massive stars, involving
vigorous mass loss a short time before the SN explosion.
","[{""version"":""v1"",""created"":""Thu, 13 Mar 2014 20:00:37 GMT""}]","2014-07-15"
"1403.3401","Andi Hektor","Andi Hektor, Luca Marzola","Coy Dark Matter and the anomalous magnetic moment","added references, some minor corrections","Phys. Rev. D 90, 053007 (2014)","10.1103/PhysRevD.90.053007",,"hep-ph astro-ph.CO astro-ph.HE","http://arxiv.org/licenses/nonexclusive-distrib/1.0/","  Coy Dark Matter removes the tension between the traditional WIMP paradigm of
Dark Matter and the latest exclusion bounds from direct detection experiments.
In this paper we present a leptophilic Coy Dark Matter model that, on top of
explaining the spatially extended 1-5 GeV $\gamma$-ray excess detected at the
Galactic Center, reconciles the measured anomalous magnetic moment of muon with
the corresponding Standard Model prediction. The annihilation channel of DM is
$\chi\chi \to \tau\bar\tau$ with the DM mass $m_\chi =
9.43\,(^{+.063}_{-0.52}\,{\rm stat.})\,(\pm 1.2 \,{\rm sys.})$ GeV given by
best-fit of the $\gamma$-ray excess. Fitting the measured anomalous magnetic
moment of the muon requires instead a pseudoscalar mediator with a minimal mass
$m_a = 12^{+7}_{-3}$ GeV.
","[{""version"":""v1"",""created"":""Thu, 13 Mar 2014 20:00:37 GMT""},{""version"":""v2"",""created"":""Wed, 21 May 2014 11:40:29 GMT""}]","2014-09-17"
"1403.3402","Aseem Paranjape","Aseem Paranjape (ETHZ)","Cosmology with Galaxy Clusters: Systematic Effects in the Halo Mass
  Function","23 pages, 11 figures. v2: minor clarifications and some new results;
  conclusions unchanged; to appear in PRD","Phys. Rev. D 90, 023520 (2014)","10.1103/PhysRevD.90.023520",,"astro-ph.CO","http://arxiv.org/licenses/nonexclusive-distrib/1.0/","  We investigate potential systematic effects in constraining the amplitude of
primordial fluctuations \sigma_8 arising from the choice of halo mass function
in the likelihood analysis of current and upcoming galaxy cluster surveys. We
study the widely used N-body simulation fit of Tinker et al. (T08) and, as an
alternative, the recently proposed analytical model of Excursion Set Peaks
(ESP). We first assess the relative bias between these prescriptions when
constraining \sigma_8 by sampling the ESP mass function to generate mock
catalogs and using the T08 fit to analyse them, for various choices of survey
selection threshold, mass definition and statistical priors. To assess the
level of absolute bias in each prescription, we then repeat the analysis on
dark matter halo catalogs in N-body simulations designed to mimic the mass
distribution in the current data release of Planck SZ clusters. This N-body
analysis shows that using the T08 fit without accounting for the scatter
introduced when converting between mass definitions (alternatively, the scatter
induced by errors on the parameters of the fit) can systematically
over-estimate the value of \sigma_8 by as much as 2\sigma\ for current data,
while analyses that account for this scatter should be close to unbiased in
\sigma_8. With an increased number of objects as expected in upcoming data
releases, regardless of accounting for scatter, the T08 fit could over-estimate
the value of \sigma_8 by ~1.5\sigma. The ESP mass function leads to
systematically more biased but comparable results. A strength of the ESP model
is its natural prediction of a weak non-universality in the mass function which
closely tracks the one measured in simulations and described by the T08 fit. We
suggest that it might now be prudent to build new unbiased ESP-based fitting
functions for use with the larger datasets of the near future.
","[{""version"":""v1"",""created"":""Thu, 13 Mar 2014 20:00:37 GMT""},{""version"":""v2"",""created"":""Mon, 30 Jun 2014 07:48:05 GMT""}]","2014-07-23"
"1403.3403","Gemma Anderson","Gemma J. Anderson, Donough Regan and David Seery","Optimal bispectrum constraints on single-field models of inflation","25 pages, plus references and appendix",,"10.1088/1475-7516/2014/07/017",,"astro-ph.CO","http://arxiv.org/licenses/nonexclusive-distrib/1.0/","  We use WMAP 9-year bispectrum data to constrain the free parameters of an
'effective field theory' describing fluctuations in single-field inflation. The
Lagrangian of the theory contains a finite number of operators associated with
unknown mass scales. Each operator produces a fixed bispectrum shape, which we
decompose into partial waves in order to construct a likelihood function. Based
on this likelihood we are able to constrain four linearly independent
combinations of the mass scales. As an example of our framework we specialize
our results to the case of 'Dirac-Born-Infeld' and 'ghost' inflation and obtain
the posterior probability for each model, which in Bayesian schemes is a useful
tool for model comparison. Our results suggest that DBI-like models with two or
more free parameters are disfavoured by the data by comparison with single
parameter models in the same class.
","[{""version"":""v1"",""created"":""Thu, 13 Mar 2014 20:00:38 GMT""}]","2015-06-19"
