"1403.3455","Lewis Tseng","Lewis Tseng and Nitin Vaidya","Asynchronous Convex Consensus in the Presence of Crash Faults","A version of this work is published in PODC 2014",,,,"cs.DC","http://arxiv.org/licenses/nonexclusive-distrib/1.0/","  This paper defines a new consensus problem, convex consensus. Similar to
vector consensus [13, 20, 19], the input at each process is a d-dimensional
vector of reals (or, equivalently, a point in the d-dimensional Euclidean
space). However, for convex consensus, the output at each process is a convex
polytope contained within the convex hull of the inputs at the fault-free
processes. We explore the convex consensus problem under crash faults with
incorrect inputs, and present an asynchronous approximate convex consensus
algorithm with optimal fault tolerance that reaches consensus on an optimal
output polytope. Convex consensus can be used to solve other related problems.
For instance, a solution for convex consensus trivially yields a solution for
vector consensus. More importantly, convex consensus can potentially be used to
solve other more interesting problems, such as convex function optimization [5,
4].
","[{""version"":""v1"",""created"":""Thu, 13 Mar 2014 23:01:39 GMT""},{""version"":""v2"",""created"":""Mon, 31 Aug 2015 17:27:44 GMT""}]","2015-09-01"
"1403.3456","Maria  Palazzi","M. J. Palazzi and M. G. Cosenza","Amplitude death in coupled robust-chaos oscillators","4 pages, 4 figures",,"10.1140/epjst/e2014-02296-5",,"nlin.CD","http://arxiv.org/licenses/nonexclusive-distrib/1.0/","  We investigate the synchronization behavior of a system of globally coupled,
continuous-time oscillators possessing robust chaos. The local dynamics
corresponds to the Shimizu-Morioka model where the occurrence of robust chaos
in a region of its parameter space has been recently discovered. We show that
the global coupling can drive the oscillators to synchronization into a fixed
point created by the coupling, resulting in amplitude death in the system. The
existence of robust chaos allows to introduce heterogeneity in the local
parameters, while guaranteeing the functioning of all the oscillators in a
chaotic mode. In this case, the system reaches a state of oscillation death,
with coexisting clusters of oscillators in different steady states. The
phenomena of amplitude death or oscillation death in coupled robust-chaos flows
could be employed as mechanisms for stabilization and control in systems that
require reliable operation under chaos.
","[{""version"":""v1"",""created"":""Thu, 13 Mar 2014 23:04:05 GMT""},{""version"":""v2"",""created"":""Thu, 3 Apr 2014 20:57:24 GMT""},{""version"":""v3"",""created"":""Tue, 8 Apr 2014 13:58:26 GMT""}]","2015-06-19"
"1403.3457","Yuekai Sun","Yuekai Sun and Jonathan E. Taylor","Valid post-correction inference for censored regression problems","20 pages, 6 figues",,,,"stat.ME","http://arxiv.org/licenses/nonexclusive-distrib/1.0/","  Two-step estimators often called upon to fit censored regression models in
many areas of science and engineering. Since censoring incurs a bias in the
naive least-squares fit, a two-step estimator first estimates the bias and then
fits a corrected linear model. We develop a framework for performing valid
/post-correction inference/ with two-step estimators. By exploiting recent
results on post-selection inference, we obtain valid confidence intervals and
significance tests for the fitted coefficients.
","[{""version"":""v1"",""created"":""Thu, 13 Mar 2014 23:07:38 GMT""}]","2014-03-17"
"1403.3458","Haitao Wang","Danny Z. Chen, Rajasekhar Inkulu, and Haitao Wang","Two-Point $L_1$ Shortest Path Queries in the Plane","38 pages, 13 figures. A preliminary version appeared in SoCG 2014",,,,"cs.CG cs.DS","http://arxiv.org/licenses/nonexclusive-distrib/1.0/","  Let $\mathcal{P}$ be a set of $h$ pairwise-disjoint polygonal obstacles with
a total of $n$ vertices in the plane. We consider the problem of building a
data structure that can quickly compute an $L_1$ shortest obstacle-avoiding
path between any two query points $s$ and $t$. Previously, a data structure of
size $O(n^2\log n)$ was constructed in $O(n^2\log^2 n)$ time that answers each
two-point query in $O(\log^2 n+k)$ time, i.e., the shortest path length is
reported in $O(\log^2 n)$ time and an actual path is reported in additional
$O(k)$ time, where $k$ is the number of edges of the output path. In this
paper, we build a new data structure of size $O(n+h^2\cdot \log h \cdot
4^{\sqrt{\log h}})$ in $O(n+h^2\cdot \log^{2} h \cdot 4^{\sqrt{\log h}})$ time
that answers each query in $O(\log n+k)$ time. Note that $n+h^2\cdot \log^{2} h
\cdot 4^{\sqrt{\log h}}=O(n+h^{2+\epsilon})$ for any constant $\epsilon>0$.
Further, we extend our techniques to the weighted rectilinear version in which
the ""obstacles"" of $\mathcal{P}$ are rectilinear regions with ""weights"" and
allow $L_1$ paths to travel through them with weighted costs. Our algorithm
answers each query in $O(\log n+k)$ time with a data structure of size
$O(n^2\cdot \log n\cdot 4^{\sqrt{\log n}})$ that is built in $O(n^2\cdot
\log^{2} n\cdot 4^{\sqrt{\log n}})$ time (note that $n^2\cdot \log^{2} n\cdot
4^{\sqrt{\log n}}= O(n^{2+\epsilon})$ for any constant $\epsilon>0$).
","[{""version"":""v1"",""created"":""Thu, 13 Mar 2014 23:15:44 GMT""}]","2014-03-17"
"1403.3459","Jun Deng","Tahir Choulli and Jun Deng","Structure conditions under progressively added information","29 pages",,,,"q-fin.RM","http://arxiv.org/licenses/nonexclusive-distrib/1.0/","  It has been understood that the ""local"" existence of the Markowitz' optimal
portfolio or the solution to the local-risk minimization problem is guaranteed
by some specific mathematical structures on the underlying assets price
processes known in the literature as ""{\it Structure Conditions}"". In this
paper, we consider a semi-martingale market model, and an arbitrary random time
that is not adapted to the information flow of the market model. This random
time may model the default time of a firm, the death time of an insured, or any
the occurrence time of an event that might impact the market model somehow. By
adding additional uncertainty to the market model, via this random time, the
{\it structures conditions} may fail and hence the Markowitz's optimal
portfolio and other quadratic-optimal portfolios might fail to exist. Our aim
is to investigate the impact of this random time on the structures conditions
from different perspectives. Our analysis allows us to conclude that under some
mild assumptions on the market model and the random time, these structures
conditions will remain valid on the one hand. Furthermore, we provide two
examples illustrating the importance of these assumptions. On the other hand,
we describe the random time models for which these structure conditions are
preserved for any market model. These results are elaborated separately for the
two contexts of stopping with the random time and incorporating totally a
specific class of random times respectively.
","[{""version"":""v1"",""created"":""Thu, 13 Mar 2014 23:19:58 GMT""},{""version"":""v2"",""created"":""Thu, 27 Dec 2018 00:00:30 GMT""}]","2018-12-31"
"1403.3460","Chi Wang","Chi Wang, Xueqing Liu, Yanglei Song, Jiawei Han","Scalable and Robust Construction of Topical Hierarchies",,,,,"cs.LG cs.CL cs.DB cs.IR","http://arxiv.org/licenses/nonexclusive-distrib/1.0/","  Automated generation of high-quality topical hierarchies for a text
collection is a dream problem in knowledge engineering with many valuable
applications. In this paper a scalable and robust algorithm is proposed for
constructing a hierarchy of topics from a text collection. We divide and
conquer the problem using a top-down recursive framework, based on a tensor
orthogonal decomposition technique. We solve a critical challenge to perform
scalable inference for our newly designed hierarchical topic model. Experiments
with various real-world datasets illustrate its ability to generate robust,
high-quality hierarchies efficiently. Our method reduces the time of
construction by several orders of magnitude, and its robust feature renders it
possible for users to interactively revise the hierarchy.
","[{""version"":""v1"",""created"":""Thu, 13 Mar 2014 23:22:21 GMT""}]","2014-03-17"
"1403.3461","Hien Ngo Quoc","Hien Quoc Ngo and Erik G. Larsson and Thomas L. Marzetta","Aspects of Favorable Propagation in Massive MIMO",,,,,"cs.IT math.IT","http://arxiv.org/licenses/nonexclusive-distrib/1.0/","  Favorable propagation, defined as mutual orthogonality among the
vector-valued channels to the terminals, is one of the key properties of the
radio channel that is exploited in Massive MIMO. However, there has been little
work that studies this topic in detail. In this paper, we first show that
favorable propagation offers the most desirable scenario in terms of maximizing
the sum-capacity. One useful proxy for whether propagation is favorable or not
is the channel condition number. However, this proxy is not good for the case
where the norms of the channel vectors may not be equal. For this case, to
evaluate how favorable the propagation offered by the channel is, we propose a
``distance from favorable propagation'' measure, which is the gap between the
sum-capacity and the maximum capacity obtained under favorable propagation.
Secondly, we examine how favorable the channels can be for two extreme
scenarios: i.i.d. Rayleigh fading and uniform random line-of-sight (UR-LoS).
Both environments offer (nearly) favorable propagation. Furthermore, to analyze
the UR-LoS model, we propose an urns-and-balls model. This model is simple and
explains the singular value spread characteristic of the UR-LoS model well.
","[{""version"":""v1"",""created"":""Thu, 13 Mar 2014 23:26:47 GMT""}]","2014-03-17"
"1403.3462","Joel Friedman","Joel Friedman and David-Emmanuel Kohler","The Relativized Second Eigenvalue Conjecture of Alon",,,,,"cs.DM math.CO","http://arxiv.org/licenses/nonexclusive-distrib/1.0/","  We prove a relativization of the Alon Second Eigenvalue Conjecture for all
$d$-regular base graphs, $B$, with $d\ge 3$: for any $\epsilon>0$, we show that
a random covering map of degree $n$ to $B$ has a new eigenvalue greater than
$2\sqrt{d-1}+\epsilon$ in absolute value with probability $O(1/n)$.
Furthermore, if $B$ is a Ramanujan graph, we show that this probability is
proportional to $n^{-{\eta_{\rm \,fund}}(B)}$, where ${\eta_{\rm \,fund}}(B)$
is an integer depending on $B$, which can be computed by a finite algorithm for
any fixed $B$. For any $d$-regular graph, $B$, ${\eta_{\rm \,fund}}(B)$ is
greater than $\sqrt{d-1}$.
  Our proof introduces a number of ideas that simplify and strengthen the
methods of Friedman's proof of the original conjecture of Alon. The most
significant new idea is that of a ``certified trace,'' which is not only
greatly simplifies our trace methods, but is the reason we can obtain the
$n^{-{\eta_{\rm \,fund}}(B)}$ estimate above. This estimate represents an
improvement over Friedman's results of the original Alon conjecture for random
$d$-regular graphs, for certain values of $d$.
","[{""version"":""v1"",""created"":""Thu, 13 Mar 2014 23:43:27 GMT""}]","2014-03-17"
"1403.3463","Travis Brannan","Travis Brannan, Zhongzhong Qin, Andrew MacRae, A. I. Lvovsky","Generation and tomography of arbitrary qubit states in a transient
  collective atomic excitation","4 pages, 3 figures","Opt. Lett. 39, 5447 (2014)","10.1364/OL.39.005447",,"quant-ph","http://arxiv.org/licenses/nonexclusive-distrib/1.0/","  We demonstrate the generation of heralded Fock-basis qubits $(a|0\rangle +
b|1\rangle)$ from transient collective spin excitations in a hot atomic vapor.
The collective spin excitation is heralded by Raman-scattered photons in a
four-wave mixing process seeded by a weak coherent optical excitation. The
amplitude and phase of the seed field allow arbitrary control over the qubit
coefficients. The state of the ensemble is read out optically and then
characterized using balanced homodyne tomography. This work represents a step
towards quantum engineering of collective atomic spin states.
","[{""version"":""v1"",""created"":""Fri, 14 Mar 2014 00:17:55 GMT""}]","2014-10-27"
"1403.3464","Ross J. Kang","Ross J. Kang, J\'anos Pach, Viresh Patel, Guus Regts","A precise threshold for quasi-Ramsey numbers","17 pages, 1 figure","SIAM Journal on Discrete Mathematics 29(3): 1670-1682, 2015","10.1137/14097313X",,"math.CO","http://arxiv.org/licenses/nonexclusive-distrib/1.0/","  We consider a variation of Ramsey numbers introduced by Erd\H{o}s and Pach
(1983), where instead of seeking complete or independent sets we only seek a
$t$-homogeneous set, a vertex subset that induces a subgraph of minimum degree
at least $t$ or the complement of such a graph.
  For any $\nu > 0$ and positive integer $k$, we show that any graph $G$ or its
complement contains as an induced subgraph some graph $H$ on $\ell \ge k$
vertices with minimum degree at least $\frac12(\ell-1) + \nu$ provided that $G$
has at least $k^{\Omega(\nu^2)}$ vertices. We also show this to be best
possible in a sense. This may be viewed as correction to a result claimed in
Erd\H{o}s and Pach (1983).
  For the above result, we permit $H$ to have order at least $k$. In the harder
problem where we insist that $H$ have exactly $k$ vertices, we do not obtain
sharp results, although we show a way to translate results of one form of the
problem to the other.
","[{""version"":""v1"",""created"":""Fri, 14 Mar 2014 00:21:32 GMT""},{""version"":""v2"",""created"":""Tue, 14 Jul 2015 12:58:27 GMT""}]","2017-07-19"
"1403.3465","Hugh Brendan McMahan","H. Brendan McMahan","A Survey of Algorithms and Analysis for Adaptive Online Learning",,,,,"cs.LG","http://arxiv.org/licenses/nonexclusive-distrib/1.0/","  We present tools for the analysis of Follow-The-Regularized-Leader (FTRL),
Dual Averaging, and Mirror Descent algorithms when the regularizer
(equivalently, prox-function or learning rate schedule) is chosen adaptively
based on the data. Adaptivity can be used to prove regret bounds that hold on
every round, and also allows for data-dependent regret bounds as in
AdaGrad-style algorithms (e.g., Online Gradient Descent with adaptive
per-coordinate learning rates). We present results from a large number of prior
works in a unified manner, using a modular and tight analysis that isolates the
key arguments in easily re-usable lemmas. This approach strengthens pre-viously
known FTRL analysis techniques to produce bounds as tight as those achieved by
potential functions or primal-dual analysis. Further, we prove a general and
exact equivalence between an arbitrary adaptive Mirror Descent algorithm and a
correspond- ing FTRL update, which allows us to analyze any Mirror Descent
algorithm in the same framework. The key to bridging the gap between Dual
Averaging and Mirror Descent algorithms lies in an analysis of the
FTRL-Proximal algorithm family. Our regret bounds are proved in the most
general form, holding for arbitrary norms and non-smooth regularizers with
time-varying weight.
","[{""version"":""v1"",""created"":""Fri, 14 Mar 2014 00:25:03 GMT""},{""version"":""v2"",""created"":""Mon, 13 Oct 2014 18:31:01 GMT""},{""version"":""v3"",""created"":""Mon, 9 Nov 2015 17:32:51 GMT""}]","2015-11-10"
"1403.3466","Chong Li","Chong Li and Nicola Elia","Stochastic Sensor Scheduling via Distributed Convex Optimization","Proof errors and typos are fixed. One section is removed from last
  version",,,,"math.OC","http://arxiv.org/licenses/nonexclusive-distrib/1.0/","  In this paper, we propose a stochastic scheduling strategy for estimating the
states of N discrete-time linear time invariant (DTLTI) dynamic systems, where
only one system can be observed by the sensor at each time instant due to
practical resource constraints. The idea of our stochastic strategy is that a
system is randomly selected for observation at each time instant according to a
pre-assigned probability distribution. We aim to find the optimal pre-assigned
probability in order to minimize the maximal estimate error covariance among
dynamic systems. We first show that under mild conditions, the stochastic
scheduling problem gives an upper bound on the performance of the optimal
sensor selection problem, notoriously difficult to solve. We next relax the
stochastic scheduling problem into a tractable suboptimal quasi-convex form. We
then show that the new problem can be decomposed into coupled small convex
optimization problems, and it can be solved in a distributed fashion. Finally,
for scheduling implementation, we propose centralized and distributed
deterministic scheduling strategies based on the optimal stochastic solution
and provide simulation examples.
","[{""version"":""v1"",""created"":""Fri, 14 Mar 2014 00:28:43 GMT""},{""version"":""v2"",""created"":""Mon, 22 Jun 2015 02:50:40 GMT""}]","2015-06-23"
"1403.3467","Friedrich W. Hehl","Peter Baekler (Duesseldorf), Alberto Favaro (Oldenburg), Yakov Itin
  (Jerusalem), Friedrich W. Hehl (Cologne and Columbia, Missouri)","The Kummer tensor density in electrodynamics and in gravity","54 pages, 6 figures, written in LaTex; improved version in accordance
  with the referee report","Annals of Physics (NY) 349 (2014) 297--324","10.1016/j.aop.2014.06.007",,"gr-qc hep-th","http://arxiv.org/licenses/nonexclusive-distrib/1.0/","  Guided by results in the premetric electrodynamics of local and linear media,
we introduce on 4-dimensional spacetime the new abstract notion of a Kummer
tensor density of rank four, ${\cal K}^{ijkl}$. This tensor density is, by
definition, a cubic algebraic functional of a tensor density of rank four
${\cal T}^{ijkl}$, which is antisymmetric in its first two and its last two
indices: ${\cal T}^{ijkl} = - {\cal T}^{jikl} = - {\cal T}^{ijlk}$. Thus,
${\cal K}\sim {\cal T}^3$, see Eq.(46). (i) If $\cal T$ is identified with the
electromagnetic response tensor of local and linear media, the Kummer tensor
density encompasses the generalized {\it Fresnel wave surfaces} for propagating
light. In the reversible case, the wave surfaces turn out to be {\it Kummer
surfaces} as defined in algebraic geometry (Bateman 1910). (ii) If $\cal T$ is
identified with the {\it curvature} tensor $R^{ijkl}$ of a Riemann-Cartan
spacetime, then ${\cal K}\sim R^3$ and, in the special case of general
relativity, ${\cal K}$ reduces to the Kummer tensor of Zund (1969). This $\cal
K$ is related to the {\it principal null directions} of the curvature. We
discuss the properties of the general Kummer tensor density. In particular, we
decompose $\cal K$ irreducibly under the 4-dimensional linear group $GL(4,R)$
and, subsequently, under the Lorentz group $SO(1,3)$.
","[{""version"":""v1"",""created"":""Fri, 14 Mar 2014 00:33:07 GMT""},{""version"":""v2"",""created"":""Sun, 28 Sep 2014 20:50:29 GMT""}]","2015-06-19"
"1403.3468","Andrzej Czarnecki","Andrzej Czarnecki","Current distribution in an infinite plate",,"Canadian Journal of Physics 92, 1297 (2014)","10.1139/cjp-2014-0136","Alberta Thy 5-14","physics.class-ph","http://arxiv.org/licenses/nonexclusive-distrib/1.0/","  Distribution of the electric potential in a very long plate (for example a
long metal ruler) is determined. This is achieved by conformally mapping the
plate into a plane, simplifying the geometry of boundary conditions.
Singularities of the potential are discussed as well as their regularization by
the final size of electrical contacts. An analogy with renormalization is
pointed out. Results are compared with previous studies.
","[{""version"":""v1"",""created"":""Fri, 14 Mar 2014 00:33:46 GMT""}]","2019-12-17"
"1403.3469","Ish Dhand","Ish Dhand and Barry C. Sanders","Stability of the Trotter-Suzuki decomposition","18 pages, 1 figure","J. Phys. A: Math. Theor. 47, 265206 (2014)","10.1088/1751-8113/47/26/265206",,"math-ph math.MP","http://arxiv.org/licenses/nonexclusive-distrib/1.0/","  The Trotter-Suzuki decomposition is an important tool for the simulation and
control of physical systems. We provide evidence for the stability of the
Trotter-Suzuki decomposition. We model the error in the decomposition and
determine sufficiency conditions that guarantee the stability of this
decomposition under this model. We relate these sufficiency conditions to
precision limitations of computing and control in both classical and quantum
cases. Furthermore we show that bounded-error Trotter-Suzuki decomposition can
be achieved by a suitable choice of machine precision.
","[{""version"":""v1"",""created"":""Fri, 14 Mar 2014 00:48:42 GMT""},{""version"":""v2"",""created"":""Tue, 8 Jul 2014 19:49:01 GMT""},{""version"":""v3"",""created"":""Wed, 9 Jul 2014 04:09:33 GMT""}]","2014-07-10"
"1403.3470","Francesco Veneziano","Roberto Dvornicich, Francesco Veneziano, Umberto Zannier","On the integral values of a curious recurrence",,,,,"math.NT","http://arxiv.org/licenses/nonexclusive-distrib/1.0/","  We discuss a problem initially thought for the Mathematical Olympiad but
which has several interpretations. The recurrence sequences involved in this
problem may be generalized to recurrence sequences related to a much larger set
of diophantine equations.
","[{""version"":""v1"",""created"":""Fri, 14 Mar 2014 01:04:01 GMT""}]","2014-03-17"
"1403.3471","David M.J. Calderbank","David M.J. Calderbank","Integrable Background Geometries","for Progress in Twistor Theory, SIGMA","SIGMA 10 (2014), 034, 51 pages","10.3842/SIGMA.2014.034",,"math.DG nlin.SI","http://creativecommons.org/licenses/by-nc-sa/3.0/","  This work has its origins in an attempt to describe systematically the
integrable geometries and gauge theories in dimensions one to four related to
twistor theory. In each such dimension, there is a nondegenerate integrable
geometric structure, governed by a nonlinear integrable differential equation,
and each solution of this equation determines a background geometry on which,
for any Lie group $G$, an integrable gauge theory is defined. In four
dimensions, the geometry is selfdual conformal geometry and the gauge theory is
selfdual Yang-Mills theory, while the lower-dimensional structures are
nondegenerate (i.e., non-null) reductions of this. Any solution of the gauge
theory on a $k$-dimensional geometry, such that the gauge group $H$ acts
transitively on an $\ell$-manifold, determines a $(k+\ell)$-dimensional
geometry ($k+\ell\leqslant4$) fibering over the $k$-dimensional geometry with
$H$ as a structure group. In the case of an $\ell$-dimensional group $H$ acting
on itself by the regular representation, all $(k+\ell)$-dimensional geometries
with symmetry group $H$ are locally obtained in this way. This framework
unifies and extends known results about dimensional reductions of selfdual
conformal geometry and the selfdual Yang-Mills equation, and provides a rich
supply of constructive methods. In one dimension, generalized Nahm equations
provide a uniform description of four pole isomonodromic deformation problems,
and may be related to the ${\rm SU}(\infty)$ Toda and dKP equations via a
hodograph transformation. In two dimensions, the ${\rm Diff}(S^1)$ Hitchin
equation is shown to be equivalent to the hyperCR Einstein-Weyl equation, while
the ${\rm SDiff}(\Sigma^2)$ Hitchin equation leads to a Euclidean analogue of
Plebanski's heavenly equations.
","[{""version"":""v1"",""created"":""Fri, 14 Mar 2014 01:06:42 GMT""},{""version"":""v2"",""created"":""Fri, 28 Mar 2014 07:02:33 GMT""}]","2014-03-31"
"1403.3472","Kyu-Min Lee","Kyu-Min Lee, Charles D. Brummitt, and K.-I. Goh","Threshold cascades with response heterogeneity in multiplex networks","7 pages, 6 figures","Phys. Rev. E 90, 062816 (2014)","10.1103/PhysRevE.90.062816",,"physics.soc-ph cond-mat.dis-nn cond-mat.stat-mech","http://arxiv.org/licenses/nonexclusive-distrib/1.0/","  Threshold cascade models have been used to describe spread of behavior in
social networks and cascades of default in financial networks. In some cases,
these networks may have multiple kinds of interactions, such as distinct types
of social ties or distinct types of financial liabilities; furthermore, nodes
may respond in different ways to in influence from their neighbors of multiple
types. To start to capture such settings in a stylized way, we generalize a
threshold cascade model to a multiplex network in which nodes follow one of two
response rules: some nodes activate when, in at least one layer, a large enough
fraction of neighbors are active, while the other nodes activate when, in all
layers, a large enough fraction of neighbors are active. Varying the fractions
of nodes following either rule facilitates or inhibits cascades. Near the
inhibition regime, global cascades appear discontinuously as the network
density increases; however, the cascade grows more slowly over time. This
behavior suggests a way in which various collective phenomena in the real world
could appear abruptly yet slowly.
","[{""version"":""v1"",""created"":""Fri, 14 Mar 2014 01:29:42 GMT""},{""version"":""v2"",""created"":""Thu, 18 Dec 2014 10:30:33 GMT""}]","2016-10-05"
"1403.3473","Jose Velez Marulanda","Jose A. Velez-Marulanda","On the Infinitude of Prime Ideals in Dedekind Domains",,,,,"math.NT math.RA","http://arxiv.org/licenses/nonexclusive-distrib/1.0/","  Let $R$ be an infinite Dedekind domain with at most finitely many units, and
let $K$ denote its field of fractions. We prove the following statement. If
$L/K$ is a finite Galois extension of fields and $\mathcal{O}$ is the integral
closure of $R$ in $L$, then $\mathcal{O}$ contains infinitely many prime
ideals. In particular, if $\mathcal{O}$ is further a unique factorization
domain, then $\mathcal{O}$ contains infinitely many non-associate prime
elements.
","[{""version"":""v1"",""created"":""Fri, 14 Mar 2014 01:50:13 GMT""}]","2019-03-26"
