"1403.3547","Rakesh Kumar Pandey","Rakesh Kumar Pandey, Dilip Kumar","Distributed Transformer Monitoring System Based On Zigbee Technology","3 Pages, 5 Figures, International Journal of Engineering Trends and
  Technology (IJETT)-Volume4 Issue5-May (2013)",,,,"cs.OH","http://arxiv.org/licenses/nonexclusive-distrib/1.0/","  A Distributed transformer networks remote monitoring system is developed and
constructed,for monitor and record the parameters like temperature, oil level
status, of a distribution transformer.The system consists of a micro controller
based circuit,with solid-state components for handling sensors,power
back-up,real time clock and data communication module which based on ZigBee
protocol.
","[{""version"":""v1"",""created"":""Fri, 14 Mar 2014 12:08:22 GMT""}]","2014-03-17"
"1403.3548","Richard Montgomery","Richard Montgomery","Almost all friendly matrices have many obstructions","11 pages",,,,"math.CO","http://arxiv.org/licenses/nonexclusive-distrib/1.0/","  A symmetric $m\times m$ matrix $M$ with entries taken from $\{0,1,\ast\}$
gives rise to a graph partition problem, asking whether a graph can be
partitioned into $m$ vertex sets matched to the rows (and corresponding
columns) of $M$ such that, if $M_{ij}=1$, then any two vertices between the
corresponding vertex sets are joined by an edge, and if $M_{ij}=0$ then any two
vertices between the corresponding vertex sets are not joined by an edge. The
entry $\ast$ places no restriction on the edges between the corresponding sets.
This problem generalises graph colouring and graph homomorphism problems.
  A graph with no $M$-partition but such that every proper subgraph does have
an $M$-partition is called a minimal obstruction. Feder, Hell and Xie have
defined friendly matrices and shown that non-friendly matrices have infinitely
many minimal obstructions. They showed through examples that friendly matrices
can have finitely or infinitely many minimal obstructions and gave an example
of a friendly matrix with an NP-hard partition problem. Here we show that
almost all friendly matrices have infinitely many minimal obstructions and an
NP-hard partition problem.
","[{""version"":""v1"",""created"":""Fri, 14 Mar 2014 12:12:38 GMT""},{""version"":""v2"",""created"":""Mon, 15 Dec 2014 13:31:01 GMT""}]","2014-12-16"
"1403.3549","Mikhalo Dzyuba","M.O.Dzyuba, Yu.N. Chiang, D.A. Chareev, A.N. Vasiliev","Spin-dependent conductivity of iron-based superconductors in a magnetic
  field","9 pages, 7 figures","Physica B: Condensed Matter, 464, 68-73 (2015)","10.1016/j.physb.2015.02.004",,"cond-mat.supr-con","http://arxiv.org/licenses/nonexclusive-distrib/1.0/","  We report the results of a study of magnetic field features of electron
transport in heterojunctions with NS boundary inside iron-based
superconductors, represented by a binary phase of $\alpha$ - FeSe and
oxyarsenide pnictide LaO(F)FeAs. We used the ability of self magnetic field of
the transport current to partially destroy superconductivity, no matter how low
the field may be, in the NS interface area, where, due to the proximity effect,
the superconducting order parameter, $\Delta$, disperses from 1 to 0 within the
scale of the Ginzburg-Landau coherence length. The following features of
transport were found:(i) at $T<T_{c}$, magnetoresistance in systems with
different superconductors has different sign;(ii) sign and magnitude of the
magnetoresistance depend on the magnitude of current and temperature, and (iii)
in all operating modes where the contribution from Andreev reflection is
suppressed ($(T + eV) \gtrsim \Delta$),the hysteresis of the magnetoresistance
is present. Based on the results of the experiment and analysis it has been
concluded that there is along-range magnetic order in th eground normal state
of the iron-based superconductors studied, in the presence of itinerant
magnetism of conduction electrons which determines the possibility of
anisotropic spin-dependent exchange interaction with the local magnetic moments
of the ions.
","[{""version"":""v1"",""created"":""Fri, 14 Mar 2014 12:15:46 GMT""}]","2015-03-16"
"1403.3550","Johannes Hackmann M.Sc.","Johannes Hackmann, Dmitry S. Smirnov, Mikhail M. Glazov and Frithjof
  B. Anders","Spin noise in a quantum dot ensemble: from a quantum mechanical to a
  semi-classical description","6 pages, 3 figures",,"10.1002/pssb.201451103",,"cond-mat.mes-hall","http://arxiv.org/licenses/nonexclusive-distrib/1.0/","  Spin noise spectroscopy is a promising technique for revealing the
microscopic nature of spin dephasing processes in quantum dots. We compare the
spin-noise in an ensemble of singly charged quantum dots calculated by two
complementary approaches. The Chebyshev polynomial expansion technique (CET)
accounts for the full quantum mechanical fluctuation of the nuclear spin bath
and a semi-classical approach (SCA) is based on the averaging the electron spin
dynamics over all different static Overhauser field configurations.
  We observe a remarkable agreement between both methods in the high-frequency
part of the spectra, while the low-frequency part is determined by the long
time fluctuations of the Overhauser field. We find small differences in the
spectra depending on the distribution of hyperfine couplings. The spin-noise
spectra in strong enough magnetic fields where the nuclear dynamics is quenched
calculated by two complimentary approaches are in perfect agreement.
","[{""version"":""v1"",""created"":""Fri, 14 Mar 2014 12:17:36 GMT""}]","2015-06-19"
"1403.3551","Morten St\""ockel","Rasmus Pagh, Morten St\""ockel","The Input/Output Complexity of Sparse Matrix Multiplication","Submitted to ICALP 2014",,,,"cs.DS","http://arxiv.org/licenses/nonexclusive-distrib/1.0/","  We consider the problem of multiplying sparse matrices (over a semiring)
where the number of non-zero entries is larger than main memory. In the
classical paper of Hong and Kung (STOC '81) it was shown that to compute a
product of dense $U \times U$ matrices, $\Theta \left(U^3 / (B \sqrt{M})
\right)$ I/Os are necessary and sufficient in the I/O model with internal
memory size $M$ and memory block size $B$.
  In this paper we generalize the upper and lower bounds of Hong and Kung to
the sparse case. Our bounds depend of the number $N =
\mathtt{nnz}(A)+\mathtt{nnz}(C)$ of nonzero entries in $A$ and $C$, as well as
the number $Z = \mathtt{nnz}(AC)$ of nonzero entries in $AC$.
  We show that $AC$ can be computed using $\tilde{O} \left(\tfrac{N}{B}
\min\left(\sqrt{\tfrac{Z}{M}},\tfrac{N}{M}\right) \right)$ I/Os, with high
probability. This is tight (up to polylogarithmic factors) when only semiring
operations are allowed, even for dense rectangular matrices: We show a lower
bound of $\Omega \left(\tfrac{N}{B}
\min\left(\sqrt{\tfrac{Z}{M}},\tfrac{N}{M}\right) \right)$ I/Os.
  While our lower bound uses fairly standard techniques, the upper bound makes
use of ``compressed matrix multiplication'' sketches, which is new in the
context of I/O-efficient algorithms, and a new matrix product size estimation
technique that avoids the ``no cancellation'' assumption.
","[{""version"":""v1"",""created"":""Fri, 14 Mar 2014 12:18:26 GMT""}]","2014-03-17"
"1403.3552","Ravindra Singh Solanki","Ravindra Singh Solanki, Sunil Kumar Mishra, Anatoliy Senyshyn, Songhak
  Yoon, Sunggi Baik, Namsoo Shin and Dhananjai Pandey","Confirmation of the monoclinic Cc space group for the ground state phase
  of Pb(Zr0.525Ti0.475)O3 (PZT525): A Combined Synchrotron X-Ray and Neutron
  Powder Diffraction Study","13 Pages, 5 Figures","Applied Physics Letters, Vol. 102, Page-052903, Year-2013","10.1063/1.4790569",,"cond-mat.mtrl-sci","http://arxiv.org/licenses/nonexclusive-distrib/1.0/","  The low temperature antiferrodistortive phase transition in a
pseudo-tetragonal composition of PZT with x=0.525 is investigated through a
combined synchrotron x-ray and neutron powder diffraction study. It is shown
that the superlattice peaks cannot be correctly accounted for in the Rietveld
refinement using R3c or R3c+Cm structural models, whereas the Cc space group
gives excellent fits to the superlattice peaks as well as to the perovskite
peaks. This settles at rest the existing controversies about the structure of
the ground state phase of PZT in the MPB region.
","[{""version"":""v1"",""created"":""Fri, 14 Mar 2014 12:18:51 GMT""}]","2014-03-17"
"1403.3553","Flavio Esposito","Flavio Esposito and Ibrahim Matta","A Decomposition-based Architecture for Distributed Virtual Network
  Embedding","6 pages",,,,"cs.NI","http://arxiv.org/licenses/nonexclusive-distrib/1.0/","  Network protocols have historically been developed on an ad-hoc basis, and
cloud computing is no exception. A fundamental management protocol, not yet
standardized, that cloud providers need to run to support wide-area virtual
network services is the virtual network (VN) embedding protocol. In this paper,
we use decomposition theory to provide a unifying architecture for the VN
embedding problem. We show how our architecture subsumes existing solutions,
and how it can be used by cloud providers to design a distributed VN embedding
protocol that adapts to different scenarios, by merely instantiating different
decomposition policies. We analyze key representative tradeoffs via simulation,
and with our VN embedding testbed that uses a Linux system architecture to
reserve virtual node and link capacities. In contrast with existing VN
embedding solutions, we found that partitioning a VN request not only increases
the signaling overhead, but may decrease cloud providers' revenue.
","[{""version"":""v1"",""created"":""Fri, 14 Mar 2014 12:25:47 GMT""}]","2014-03-17"
"1403.3554","Sourav Sarkar","Sukanya Mitra and Sourav Sarkar","Medium effects on the thermal conductivity of a hot pion gas",,"Physical Review D89, 054013 (2014)","10.1103/PhysRevD.89.054013",,"nucl-th hep-ph","http://arxiv.org/licenses/nonexclusive-distrib/1.0/","  We investigate the effect of the medium on the thermal conductivity of a pion
gas out of chemical equilibrium by solving the relativistic transport equation
in the Chapman-Enskog and relaxation time approximations. Using an effective
model for the pi-pi cross-section involving rho and sigma meson exchange,
medium effects are incorporated through thermal one-loop self-energies. The
temperature dependence of the thermal conductivity is observed to be
significantly affected.
","[{""version"":""v1"",""created"":""Fri, 14 Mar 2014 12:34:10 GMT""}]","2014-03-17"
"1403.3555","Dr. Andy Read","A.M. Read (1), M. Guainazzi (2), S. Sembay (1) ((1) University of
  Leicester, UK, (2) ESAC, Spain)","Cross-Calibration of the XMM-Newton EPIC pn & MOS On-Axis Effective
  Areas Using 2XMM Sources","8 Pages, 2 figures (3 panels), 1 table. Accepted for publication in
  A&A",,"10.1051/0004-6361/201423422",,"astro-ph.IM astro-ph.HE","http://arxiv.org/licenses/nonexclusive-distrib/1.0/","  We aim to examine the relative cross-calibration accuracy of the on-axis
effective areas of the XMM-Newton EPIC pn and MOS instruments. Spectra from a
sample of 46 bright, high-count, non-piled-up isolated on-axis point sources
are stacked together, and model residuals are examined to characterize the EPIC
MOS-to-pn inter-calibration. The MOS1-to-pn and MOS2-to-pn results are broadly
very similar. The cameras show the closest agreement below 1 keV, with MOS
excesses over pn of 0-2% (MOS1/pn) and 0-3% (MOS2/pn). Above 3 keV, the MOS/pn
ratio is consistent with energy-independent (or only mildly increasing)
excesses of 7-8% (MOS1/pn) and 5-8% (MOS2/pn). In addition, between 1-2 keV
there is a `silicon bump' - an enhancement at a level of 2-4% (MOS1/pn) and
3-5% (MOS2/pn). Tests suggest that the methods employed here are stable and
robust. The results presented here provide the most accurate cross-calibration
of the effective areas of the XMM-Newton EPIC pn and MOS instruments to date.
They suggest areas of further research where causes of the MOS-to-pn
differences might be found, and allow the potential for corrections to and
possible rectification of the EPIC cameras to be made in the future.
","[{""version"":""v1"",""created"":""Fri, 14 Mar 2014 12:34:30 GMT""}]","2014-05-08"
"1403.3556","Carlos Eduardo ViolBarbosa","C.E. ViolBarbosa, S. Ouardi, T. Kubota, S. Mizukami, G. H. Fecher, T.
  Miyazaki, X. Kozina, E. Ikenaga, and C. Felser","Investigation on Mn$_{3-\delta}$Ga/MgO interface for magnetic tunneling
  junctions",,,"10.1063/1.4890582",,"cond-mat.mtrl-sci","http://arxiv.org/licenses/nonexclusive-distrib/1.0/","  The Mn$_3$Ga Heusler compound and related alloys are the most promising
materials for the realization of spin-transfer-torque switching in magneto
tunneling junctions. Improved performance can be achieved by high quality
interfaces in these multilayered structured devices. In this context, the
interface between Mn$_{1.63}$Ga and MgO is of particular interest because of
its spin polarization properties in tunneling junctions. We performed a
chemical characterization of the MgO/Mn$_{1.63}$Ga junction by hard x-ray
photoelectron spectroscopy (HAXPES). The experiment indicated the formation of
Ga-O bonds at the interface and evidenced changes in the local environment of
Mn atoms in the proximity of the MgO film. In addition, we show that the
insertion of a metallic Mg-layer interfacing the MgO and Mn--Ga film strongly
suppresses the oxidation of gallium.
","[{""version"":""v1"",""created"":""Fri, 14 Mar 2014 12:36:16 GMT""},{""version"":""v2"",""created"":""Wed, 26 Mar 2014 12:32:52 GMT""},{""version"":""v3"",""created"":""Tue, 8 Apr 2014 12:10:56 GMT""},{""version"":""v4"",""created"":""Fri, 9 May 2014 14:40:36 GMT""}]","2014-08-01"
"1403.3557","Edinah Gnang K","Edinah K. Gnang","Computing Spectral Elimination Ideals",,,,,"math.AC","http://arxiv.org/licenses/nonexclusive-distrib/1.0/","  We present here an overview of the hypermatrix spectral decomposition deduced
from the Bhattacharya-Mesner hypermatrix algebra. We describe necessary and
sufficient conditions for the existence of a spectral decomposition. We further
extend to hypermatrices the notion of resolution of identity and use them to
derive hypermatrix analog of matrix spectral bounds. Finally we describe an
algorithm for computing generators of the spectral elimination ideals which
considerably improves on Groebner basis computation suggested in.
","[{""version"":""v1"",""created"":""Fri, 14 Mar 2014 12:45:31 GMT""}]","2014-03-17"
"1403.3558","Tim-Torben Paetz","Piotr T. Chru\'sciel, Tim-Torben Paetz","Characteristic initial data and smoothness of Scri. I. Framework and
  results","32 pages, some minor modifications",,"10.1007/s00023-014-0364-y",,"gr-qc","http://arxiv.org/licenses/nonexclusive-distrib/1.0/","  We analyze the Cauchy problem for the vacuum Einstein equations with data on
a complete light-cone in an asymptotically Minkowskian space-time. We provide
conditions on the free initial data which guarantee existence of global
solutions of the characteristic constraint equations. We present
necessary-and-sufficient conditions on characteristic initial data in $3+1$
dimensions to have no logarithmic terms in an asymptotic expansion at null
infinity.
","[{""version"":""v1"",""created"":""Fri, 14 Mar 2014 12:54:42 GMT""},{""version"":""v2"",""created"":""Fri, 23 May 2014 10:09:51 GMT""},{""version"":""v3"",""created"":""Tue, 23 Sep 2014 14:23:50 GMT""}]","2015-10-28"
"1403.3559","J\""urgen M\""unch","Ioana Rus, Holger Neu, J\""urgen M\""unch","A Systematic Methodology for Developing Discrete Event Simulation Models
  of Software Development Processes","7 pages","Proceedings of the 4th International Workshop on Software Process
  Simulation and Modeling (ProSim 2003), Portland, Oregon, USA, May 3-4 2003",,,"cs.SE","http://arxiv.org/licenses/nonexclusive-distrib/1.0/","  So far there have been several efforts for developing software process
simulators. However, the approaches for developing the simulators seem to have
been ad-hoc and no systematic methodology exists. Since modeling and simulation
in support of software development should become more popular (and there are
signs that it does), there is a need for migrating modeling from craft to
engineering. This article proposes such a systematic method, focused on the
development of discrete simulation-based decision models, but extensible to
other modeling approaches as well.
","[{""version"":""v1"",""created"":""Fri, 14 Mar 2014 12:56:22 GMT""}]","2014-03-17"
"1403.3560","Tim-Torben Paetz","Tim-Torben Paetz","Characteristic initial data and smoothness of Scri. II. Asymptotic
  expansions and construction of conformally smooth data sets","53 pages",,"10.1063/1.4897209",,"gr-qc","http://arxiv.org/licenses/nonexclusive-distrib/1.0/","  We derive necessary-and-sufficient conditions on characteristic initial data
for Friedrich's conformal field equations in $3+1$ dimensions to have no
logarithmic terms in an asymptotic expansion at null infinity.
","[{""version"":""v1"",""created"":""Fri, 14 Mar 2014 13:01:32 GMT""}]","2015-06-19"
"1403.3561","Andr\'es E. Piatti","Andres E. Piatti","Disentangling the physical reality of star cluster candidates projected
  towards the inner disc of the Large Magellanic Cloud","MNRAS, accepted",,"10.1093/mnras/stu534",,"astro-ph.GA astro-ph.CO","http://arxiv.org/licenses/nonexclusive-distrib/1.0/","  We have used Washington photometry for 90 star cluster candidates of small
angular size -typically ~ 11"" in radius- distributed within nine selected
regions in the inner disc of the Large Magellanic Cloud (LMC) to disentangle
whether they are genuine physical system, and to estimate the ages for the
confirmed clusters. In order to avoid a misleading interpretation of the
cluster colour-magnitude diagrams (CMDs), we applied a subtraction procedure to
statistically clean them from field star contamination. Out of the 90 candidate
clusters studied, 61 of them resulted to be genuine physical systems, whereas
the remaining ones were classified as possible non- clusters since either their
CMDs and/or the distribution of stars in the respective fields do not resemble
those of stellar aggregates. We statistically show that ~ (13 +- 6)% of the
catalogued clusters in the inner disc could be possible non-clusters,
independently of their deprojected distances. We derived the ages for the
confirmed clusters from the fit of theoretical isochrones to the cleaned
cluster CMDs. The derived ages resulted to be in the age range 7.8 < log(t) <
9.2. Finally, we built cluster frequencies for the different studied regions
and found that there exists some spatial variation of the LMC CF throughout the
inner disc. Particularly, the innermost field contains a handful of clusters
older than ~ 2 Gyr, while the wider spread between different CFs has taken
place during the most recent 50 Myr of the galaxy lifetime.
","[{""version"":""v1"",""created"":""Fri, 14 Mar 2014 13:02:01 GMT""}]","2015-06-19"
"1403.3562","Rosana Veroneze","Rosana Veroneze, Arindam Banerjee and Fernando J. Von Zuben","Enumerating all maximal biclusters in numerical datasets",,,,,"cs.DM","http://arxiv.org/licenses/nonexclusive-distrib/1.0/","  Biclustering has proved to be a powerful data analysis technique due to its
wide success in various application domains. However, the existing literature
presents efficient solutions only for enumerating maximal biclusters with
constant values, or heuristic-based approaches which can not find all
biclusters or even support the maximality of the obtained biclusters. Here, we
present a general family of biclustering algorithms for enumerating all maximal
biclusters with (i) constant values on rows, (ii) constant values on columns,
or (iii) coherent values. Versions for perfect and for perturbed biclusters are
provided. Our algorithms have four key properties (just the algorithm for
perturbed biclusters with coherent values fails to exhibit the first property):
they are (1) efficient (take polynomial time per pattern), (2) complete (find
all maximal biclusters), (3) correct (all biclusters attend the user-defined
measure of similarity), and (4) non-redundant (all the obtained biclusters are
maximal and the same bicluster is not enumerated twice). They are based on a
generalization of an efficient formal concept analysis algorithm called
In-Close2. Experimental results point to the necessity of having efficient
enumerative biclustering algorithms and provide a valuable insight into the
scalability of our family of algorithms and its sensitivity to user-defined
parameters.
","[{""version"":""v1"",""created"":""Fri, 14 Mar 2014 13:04:15 GMT""},{""version"":""v2"",""created"":""Tue, 8 Apr 2014 14:01:14 GMT""},{""version"":""v3"",""created"":""Tue, 30 Sep 2014 21:18:13 GMT""},{""version"":""v4"",""created"":""Thu, 23 Jul 2015 10:44:21 GMT""}]","2015-07-24"
"1403.3563","John Ramsdell","John D. Ramsdell","Proving Security Goals With Shape Analysis Sentences","MITRE Technical Report. arXiv admin note: substantial text overlap
  with arXiv:1204.0480",,,"MTR130488","cs.CR","http://arxiv.org/licenses/nonexclusive-distrib/1.0/","  The paper that introduced shape analysis sentences presented a method for
extracting a sentence in first-order logic that completely characterizes a run
of CPSA. Logical deduction can then be used to determine if a security goal is
satisfied.
  This paper presents a method for importing shape analysis sentences into a
proof assistant on top of a detailed theory of strand spaces. The result is a
semantically rich environment in which the validity of a security goal can be
determined using shape analysis sentences and the foundation on which they are
based.
","[{""version"":""v1"",""created"":""Fri, 14 Mar 2014 13:04:23 GMT""}]","2014-03-17"
"1403.3564","Mikael Kurula","Mikael Kurula, Hans Zwart","Feedback theory extended for proving generation of contraction
  semigroups","33 pages",,,,"math.OC math.FA","http://arxiv.org/licenses/nonexclusive-distrib/1.0/","  Recently, the following novel method for proving the existence of solutions
for certain linear time-invariant PDEs was introduced: The operator associated
to a given PDE is represented by a (larger) operator with an internal loop. If
the larger operator (without the internal loop) generates a contraction
semigroup, the internal loop is accretive, and some non-restrictive technical
assumptions are fulfilled, then the original operator generates a contraction
semigroup as well. Beginning with the undamped wave equation, this general idea
can be applied to show that the heat equation and wave equations with damping
are well-posed. In the present paper we show how this approach can benefit from
feedback techniques and recent developments in well-posed systems theory, at
the same time generalising the previously known results. Among others, we show
how well-posedness of degenerate parabolic equations can be proved.
","[{""version"":""v1"",""created"":""Fri, 14 Mar 2014 13:05:11 GMT""},{""version"":""v2"",""created"":""Fri, 6 Nov 2015 11:56:42 GMT""}]","2015-11-09"
"1403.3565","Florian Sikora","Cristina Bazgan, Morgan Chopin, Andr\'e Nichterlein, Florian Sikora","Parameterized Inapproximability of Target Set Selection and
  Generalizations",,"Computability, vol. 3, no. 2, 2014","10.3233/COM-140030",,"cs.CC","http://arxiv.org/licenses/nonexclusive-distrib/1.0/","  In this paper, we consider the Target Set Selection problem: given a graph
and a threshold value $thr(v)$ for any vertex $v$ of the graph, find a minimum
size vertex-subset to ""activate"" s.t. all the vertices of the graph are
activated at the end of the propagation process. A vertex $v$ is activated
during the propagation process if at least $thr(v)$ of its neighbors are
activated. This problem models several practical issues like faults in
distributed networks or word-to-mouth recommendations in social networks. We
show that for any functions $f$ and $\rho$ this problem cannot be approximated
within a factor of $\rho(k)$ in $f(k) \cdot n^{O(1)}$ time, unless FPT = W[P],
even for restricted thresholds (namely constant and majority thresholds). We
also study the cardinality constraint maximization and minimization versions of
the problem for which we prove similar hardness results.
","[{""version"":""v1"",""created"":""Fri, 14 Mar 2014 13:09:20 GMT""},{""version"":""v2"",""created"":""Wed, 10 Jun 2015 12:05:31 GMT""}]","2015-06-11"
"1403.3566","Pier Paolo Baruselli","Pier Paolo Baruselli, Matthias Vojta","Kondo holes in topological Kondo insulators: Spectral properties and
  surface quasiparticle interference",,"Phys Rev B 89, 205105 (2014)","10.1103/PhysRevB.89.205105",,"cond-mat.str-el","http://arxiv.org/licenses/nonexclusive-distrib/1.0/","  A fascinating type of symmetry-protected topological states of matter are
topological Kondo insulators, where insulating behavior arises from Kondo
screening of localized moments via conduction electrons, and non-trivial
topology emerges from the structure of the hybridization between the
local-moment and conduction bands. Here we study the physics of Kondo holes,
i.e., missing local moments, in three-dimensional topological Kondo insulators,
using a self-consistent real-space mean-field theory. Such Kondo holes quite
generically induce in-gap states which, for Kondo holes at or near the surface,
hybridize with the topological surface state. In particular, we study the
surface-state quasiparticle interference (QPI) induced by a dilute
concentration of surface Kondo holes and compare this to QPI from conventional
potential scatterers. We treat both strong and weak topological-insulator
phases and, for the latter, specifically discuss the contributions to QPI from
inter-Dirac-cone scattering.
","[{""version"":""v1"",""created"":""Fri, 14 Mar 2014 13:13:01 GMT""}]","2014-05-13"
