"1403.3310","Marianne Rooman","Marianne Rooman, Jaroslav Albert, Mitia Duerinckx","Stochastic noise reduction upon complexification: positively correlated
  birth-death type systems","38 pages, 5 figures, to appear in J. Theor. Biol",,,,"q-bio.BM q-bio.CB q-bio.MN","http://arxiv.org/licenses/nonexclusive-distrib/1.0/","  Cell systems consist of a huge number of various molecules that display
specific patterns of interactions, which have a determining influence on the
cell's functioning. In general, such complexity is seen to increase with the
complexity of the organism, with a concomitant increase of the accuracy and
specificity of the cellular processes. The question thus arises how the
complexification of systems - modeled here by simple interacting birth-death
type processes - can lead to a reduction of the noise - described by the
variance of the number of molecules. To gain understanding of this issue, we
investigated the difference between a single system containing molecules that
are produced and degraded, and the same system - with the same average number
of molecules - connected to a buffer. We modeled these systems using Ito
stochastic differential equations in discrete time, as they allow
straightforward analytical developments. In general, when the molecules in the
system and the buffer are positively correlated, the variance on the number of
molecules in the system is found to decrease compared to the equivalent system
without a buffer. Only buffers that are too noisy by themselves tend to
increase the noise in the main system. We tested this result on two model
cases, in which the system and the buffer contain proteins in their active and
inactive state, or protein monomers and homodimers. We found that in the second
test case, where the interconversion terms are non-linear in the number of
molecules, the noise reduction is much more pronounced; it reaches up to 20%
reduction of the Fano factor with the parameter values tested in numerical
simulations on an unperturbed birth-death model. We extended our analysis to
two arbitrary interconnected systems.
","[{""version"":""v1"",""created"":""Thu, 13 Mar 2014 16:02:48 GMT""}]","2014-03-14"
"1403.3311","Jason Petta","S. Sangtawesin, T. O. Brundage, and J. R. Petta","Fast Room-Temperature Phase Gate on a Single Nuclear Spin in Diamond","Related papers at http://pettagroup.princeton.edu","Phys. Rev. Lett. 113, 020506 (2014)","10.1103/PhysRevLett.113.020506",,"cond-mat.mes-hall quant-ph","http://arxiv.org/licenses/nonexclusive-distrib/1.0/","  Nuclear spins support long lived quantum coherence due to weak coupling to
the environment, but are difficult to rapidly control using nuclear magnetic
resonance (NMR) as a result of the small nuclear magnetic moment. We
demonstrate a fast ~ 500 ns nuclear spin phase gate on a 14N nuclear spin qubit
intrinsic to a nitrogen-vacancy (NV) center in diamond. The phase gate is
enabled by the hyperfine interaction and off-resonance driving of electron spin
transitions. Repeated applications of the phase gate bang-bang decouple the
nuclear spin from the environment, locking the spin state for up to ~ 140
microseconds.
","[{""version"":""v1"",""created"":""Thu, 13 Mar 2014 16:05:30 GMT""},{""version"":""v2"",""created"":""Mon, 14 Jul 2014 22:57:44 GMT""}]","2014-07-16"
"1403.3312","Manish Dave","Manish B Dave","Optimal number of users in Co-operative spectrum sensing in WRAN using
  Cyclo-Stationary Detector","5 pages, 6 figures, Published with International Journal of
  Engineering Trends and Technology (IJETT)","International Journal of Engineering Trends and Technology (IJETT)
  4(7):2806-2810, July 2013",,,"cs.NI cs.IT math.IT","http://arxiv.org/licenses/nonexclusive-distrib/1.0/","  Cognitive radio allows unlicensed users to access licensed frequency bands
through dynamic spectrum access so as to reduce spectrum scarcity. This
requires intelligent spectrum sensing techniques. This paper investigates the
use of cyclo-stationary detector and performance evaluation for Digital Video
Broadcast-Terrestrial (DVB-T) signals. Generally, DVB-T is specified in IEEE
802.22 standard in VHF and UHF TV broadcasting spectrum. Simulations results
show that implementing co-operative spectrum sensing help in better utilization
of resources. The paper further proposes to find number of optimal users in a
scenario to optimize the detection probability and makes use of the particle
swarm optimization (PSO) technique to find an optimum value of threshold.
","[{""version"":""v1"",""created"":""Thu, 13 Mar 2014 16:09:08 GMT""}]","2014-03-14"
"1403.3313","Abhijit Banerjee","Abhijit Banerjee, Sanjib Kumar Datta, Md. Azizul Hoque","Inverse Laplace Transform for Bi-Complex Variables","To appear in Mathematical Inverse Problems, Asia Pacific Journal of
  Mathematics","Mathematical Inverse Problems, vol 1, no 1, 2014",,,"math.CV","http://arxiv.org/licenses/nonexclusive-distrib/1.0/","  In this paper we examine the existence of bicomplexied inverse
Laplacetransform as an extension of its complexied inverse version within
theregion of convergence of bicomplex Laplace transform. In this course weuse
the idempotent representation of bicomplex-valued functions as pro-jections on
the auxiliary complex spaces of the components of bicomplexnumbers along two
orthogonal,idempotent hyperbolic directions.
","[{""version"":""v1"",""created"":""Thu, 13 Mar 2014 16:09:23 GMT""}]","2014-04-15"
"1403.3314","Sam Ballas","Samuel A. Ballas","Finite Volume Properly Convex Deformations of the Figure-eight Knot","21 pages, 7 figure. Incorporated additional referee comments, fixed
  typos. Simplified the proof of Lemma 3.3. To appear in Geometriae Dedicata","Geom. Dedicata. 178 (2015) 49073","10.1007/s10711-015-0043-2",,"math.GT","http://arxiv.org/licenses/nonexclusive-distrib/1.0/","  In this paper we show that some open set of the representations of the
fundamental group of figure-eight knot complement found in \cite{Ballas12a} are
the holonomies of a family of finite volume properly convex projective
structures on the figure-eight knot complement.
","[{""version"":""v1"",""created"":""Thu, 13 Mar 2014 16:11:01 GMT""},{""version"":""v2"",""created"":""Tue, 19 Aug 2014 01:36:50 GMT""},{""version"":""v3"",""created"":""Fri, 9 Jan 2015 16:58:25 GMT""}]","2016-03-22"
"1403.3315","Paul Hockett Dr","Paul Hockett, Matthias Wollenhaupt, Christian Lux, Thomas Baumert","Complete photoionization experiments via ultra-fast coherent control
  with polarization-multiplexing",,"Phys. Rev. Lett. 112, 223001, 2014","10.1103/PhysRevLett.112.223001",,"physics.atom-ph","http://creativecommons.org/licenses/by-nc-sa/3.0/","  Photoelectron angular distributions (PADs) obtained from ionization of
potassium atoms using moderately intense femtosecond IR fields
($\sim$10$^{12}$Wcm$^{-2}$) of various polarization states are shown to provide
a route to ""complete"" photoionization experiments. Ionization occurs by a net
3-photon absorption process, driven via the $4s\rightarrow4p$ resonance at the
1-photon level. A theoretical treatment incorporating the intra-pulse
electronic dynamics allows for a full set of ionization matrix elements to be
extracted from 2D imaging data. 3D PADs generated from the extracted matrix
elements are also compared to experimental, tomographically reconstructed, 3D
photoelectron distributions, providing a sensitive test of their validity.
Finally, application of the determined matrix elements to ionization via more
complex, polarization-shaped, pulses is demonstrated, illustrating the utility
of this methodology towards detailed understanding of complex ionization
control schemes and suggesting the utility of such ""multiplexed"" intra-pulse
processes as powerful tools for measurement.
","[{""version"":""v1"",""created"":""Thu, 13 Mar 2014 16:12:47 GMT""}]","2015-01-15"
"1403.3316","Ori Katz","Ori Katz, Pierre Heidmann, Mathias Fink, Sylvain Gigan","Non-invasive real-time imaging through scattering layers and around
  corners via speckle correlations",,"Nature Photonics 8, 784 (2014)","10.1038/nphoton.2014.189",,"physics.optics","http://arxiv.org/licenses/nonexclusive-distrib/1.0/","  Imaging with optical resolution through and inside complex samples is a
difficult challenge with important applications in many fields. The fundamental
problem is that inhomogeneous samples, such as biological tissues, randomly
scatter and diffuse light, impeding conventional image formation. Despite many
advancements, no current method enables to noninvasively image in real-time
using diffused light. Here, we show that owing to the memory-effect for speckle
correlations, a single image of the scattered light, captured with a standard
high-resolution camera, encodes all the information that is required to image
through the medium or around a corner. We experimentally demonstrate
single-shot imaging through scattering media and around corners using
incoherent light and various samples, from white paint to dynamic biological
samples. Our lensless technique is simple, does not require laser sources,
wavefront-shaping, nor time-gated detection, and is realized here using a
camera-phone. It has the potential to enable imaging in currently inaccessible
scenarios.
","[{""version"":""v1"",""created"":""Thu, 13 Mar 2014 16:17:31 GMT""}]","2014-10-17"
"1403.3317","Andrew Rasmussen","Andrew Rasmussen","Pixel area variations in sensors: a novel framework for predicting pixel
  fidelity and distortion in flat field response","17 pages, 7 figures, submitted to ""Precision Astronomy with Fully
  Depleted CCDs"" - conference proceedings to be published by JINST",,"10.1088/1748-0221/9/04/C04027",,"astro-ph.IM astro-ph.CO","http://arxiv.org/licenses/nonexclusive-distrib/1.0/","  We describe the drift field in thick depleted silicon sensors as a
superposition of a one-dimensional backdrop field and various three-dimensional
perturbative contributions that are physically motivated. We compute
trajectories for the conversions along the field lines toward the channel and
into volumes where conversions are confined by the perturbative fields. We
validate this approach by comparing predictions against measured response
distributions seen in five types of fixed pattern distortion features. We
derive a quantitative connection between ""tree ring"" flat field distortions to
astrometric and shape transfer errors with connections to measurable wavelength
dependence - as ancillary pixel data that may be used in pipeline analysis for
catalog population. Such corrections may be tested on DECam data, where
correlations between tree ring flat field distortions and astrometric errors -
together with their band dependence - are already under study. Dynamic effects,
including the brighter-fatter phenomenon for point sources and the flux
dependence of flat field fixed pattern features are approached using
perturbations similar in form to those giving rise to the fixed pattern
features. These in turn provide drift coefficient predictions that can be
validated in a straightforward manner. Once the three parameters of the model
are constrained using available data, the model is readily used to provide
predictions for arbitrary photo-distributions with internally consistent
wavelength dependence provided for free.
","[{""version"":""v1"",""created"":""Thu, 13 Mar 2014 16:21:25 GMT""}]","2015-06-19"
"1403.3318","Wolfgang Bietenholz","H\'ector Mej\'ia-D\'iaz, Wolfgang Bietenholz and Marco Panero","The Continuum Phase Diagram of the 2d Non-Commutative lambda phi**4
  Model","21 pages, LaTex, 9 figures, 1 table, extended version published in
  JHEP","JHEP 1410 (2014) 56","10.1007/JHEP10(2014)056","IFT-UAM/CSIC-14-014","hep-lat hep-ph hep-th","http://arxiv.org/licenses/nonexclusive-distrib/1.0/","  We present a non-perturbative study of the lambda phi**4 model on a
non-commutative plane. The lattice regularised form can be mapped onto a
Hermitian matrix model, which enables Monte Carlo simulations. Numerical data
reveal the phase diagram; at large lambda it contains a ""striped phase"", which
is absent in the commutative case. We explore the question whether or not this
phenomenon persists in a Double Scaling Limit (DSL), which extrapolates
simultaneously to the continuum and to infinite volume, at a fixed
non-commutativity parameter. To this end, we introduce a dimensional lattice
spacing based on the decay of the correlation function. Our results provide
evidence for the existence of a striped phase even in the DSL, which implies
the spontaneous breaking of translation symmetry. Due to the non-locality of
this model, this does not contradict the Mermin-Wagner Theorem.
","[{""version"":""v1"",""created"":""Thu, 13 Mar 2014 16:27:47 GMT""},{""version"":""v2"",""created"":""Tue, 14 Oct 2014 23:35:38 GMT""}]","2014-10-16"
"1403.3319","Henri Epstein","Henri Epstein and Ugo Moschella","de Sitter tachyons and related topics","Updated references",,"10.1007/s00220-015-2308-x",,"hep-th","http://arxiv.org/licenses/nonexclusive-distrib/1.0/","  We present a complete study of a family of tachyonic scalar fields living on
the de Sitter universe. We show that for an infinite set of discrete values of
the negative squared mass the fields exhibit a gauge symmetry and there exists
for them a fully acceptable local and covariant quantization similar to the
Feynman-Gupta-Bleuler quantization of free QED. For general negative squares
masses we also construct positive quantization where the de Sitter symmetry is
spontaneously broken. We discuss the sense in which the two quantizations may
be considered physically inequivalent even when there is a Lorentz invariant
subspace in the second one.
","[{""version"":""v1"",""created"":""Thu, 13 Mar 2014 16:28:23 GMT""},{""version"":""v2"",""created"":""Mon, 24 Mar 2014 12:22:46 GMT""}]","2015-06-19"
"1403.3320","Jiong Zhang","Jiong Zhang, Remco Duits, Gonzalo Sanguinetti and Bart M. ter Haar
  Romeny","Numerical Approaches for Linear Left-invariant Diffusions on SE(2),
  their Comparison to Exact Solutions, and their Applications in Retinal
  Imaging","A final and corrected version of the manuscript is Published in
  Numerical Mathematics: Theory, Methods and Applications (NM-TMA), vol. (9),
  p.1-50, 2016","Numerical Mathematics: Theory, Methods and Applications (NM-TMA),
  vol. (9), p.1-50, 2016","10.4208/nmtma.2015.m1411",,"math.NA cs.CV","http://arxiv.org/licenses/nonexclusive-distrib/1.0/","  Left-invariant PDE-evolutions on the roto-translation group $SE(2)$ (and
their resolvent equations) have been widely studied in the fields of cortical
modeling and image analysis. They include hypo-elliptic diffusion (for contour
enhancement) proposed by Citti & Sarti, and Petitot, and they include the
direction process (for contour completion) proposed by Mumford. This paper
presents a thorough study and comparison of the many numerical approaches,
which, remarkably, is missing in the literature. Existing numerical approaches
can be classified into 3 categories: Finite difference methods, Fourier based
methods (equivalent to $SE(2)$-Fourier methods), and stochastic methods (Monte
Carlo simulations). There are also 3 types of exact solutions to the
PDE-evolutions that were derived explicitly (in the spatial Fourier domain) in
previous works by Duits and van Almsick in 2005. Here we provide an overview of
these 3 types of exact solutions and explain how they relate to each of the 3
numerical approaches. We compute relative errors of all numerical approaches to
the exact solutions, and the Fourier based methods show us the best performance
with smallest relative errors. We also provide an improvement of Mathematica
algorithms for evaluating Mathieu-functions, crucial in implementations of the
exact solutions. Furthermore, we include an asymptotical analysis of the
singularities within the kernels and we propose a probabilistic extension of
underlying stochastic processes that overcomes the singular behavior in the
origin of time-integrated kernels. Finally, we show retinal imaging
applications of combining left-invariant PDE-evolutions with invertible
orientation scores.
","[{""version"":""v1"",""created"":""Thu, 13 Mar 2014 16:35:24 GMT""},{""version"":""v2"",""created"":""Mon, 17 Mar 2014 21:22:54 GMT""},{""version"":""v3"",""created"":""Sat, 29 Mar 2014 23:38:31 GMT""},{""version"":""v4"",""created"":""Fri, 4 Apr 2014 15:03:59 GMT""},{""version"":""v5"",""created"":""Mon, 2 Mar 2015 23:38:32 GMT""},{""version"":""v6"",""created"":""Fri, 4 Dec 2015 18:11:32 GMT""},{""version"":""v7"",""created"":""Tue, 1 Mar 2016 17:29:36 GMT""}]","2016-05-27"
"1403.3321","Yun Shen","Yun Shen and Klaus Obermayer and Wilhelm Stannat","On Average Risk-sensitive Markov Control Processes","37 pages, submitted to SIAM J. on Control and Optimization",,,,"math.OC","http://arxiv.org/licenses/nonexclusive-distrib/1.0/","  We introduce the Lyapunov approach to optimal control problems of average
risk-sensitive Markov control processes with general risk maps. Motivated by
applications in particular to behavioral economics, we consider possibly
non-convex risk maps, modeling behavior with mixed risk preference. We
introduce classical objective functions to the risk-sensitive setting and we
are in particular interested in optimizing the average risk in the
infinite-time horizon for Markov Control Processes on general, possibly
non-compact, state spaces allowing also unbounded cost. Existence and
uniqueness of an optimal control is obtained with a fixed point theorem applied
to the nonlinear map modeling the risk-sensitive expected total cost. The
necessary contraction is obtained in a suitable chosen seminorm under a new set
of conditions: 1) Lyapunov-type conditions on both risk maps and cost functions
that control the growth of iterations, and 2) Doeblin-type conditions, known
for Markov chains, generalized to nonlinear mappings. In the particular case of
the entropic risk map, the above conditions can be replaced by the existence of
a Lyapunov function, a local Doeblin-type condition for the underlying Markov
chain, and a growth condition on the cost functions.
","[{""version"":""v1"",""created"":""Thu, 13 Mar 2014 16:36:40 GMT""},{""version"":""v2"",""created"":""Wed, 19 Mar 2014 13:16:02 GMT""},{""version"":""v3"",""created"":""Fri, 29 Aug 2014 10:32:30 GMT""},{""version"":""v4"",""created"":""Wed, 22 Jul 2015 14:37:12 GMT""}]","2015-07-23"
"1403.3322","William Webber","W.R. Webber and D.S. Intriligator","Voyager 1 and 2 Observations of Cosmic Ray Intensities in the
  North-South Heliosheaths-Implications for the Latitude Extent of the
  Heliospheric Current Sheet and Radial Structure in the Heliosheath","28 pages, 7 Figures",,,,"physics.space-ph","http://arxiv.org/licenses/nonexclusive-distrib/1.0/","  The paper describes differences in the intensity as a function of radial
distance of anomalous and galactic cosmic rays in the N-S heliosheaths as
observed by the Voyager 1 and 2 spacecraft respectively. The anomalous cosmic
ray (ACR) intensities above a few MeV in the N heliosheath reach a maximum at
~2009.5, about 16 AU beyond the heliospheric current sheet (HTS), thus
indicating a possible source location for these higher energy particles. The
galactic cosmic ray electron and nuclei intensities continue to increase
rapidly throughout the entire N-heliosheath out to 121.7 AU. Two sudden
increases of these electrons at 16.6 and 22.2 AU beyond the HTS suggest that
the V1 spacecraft passed significant heliosheath structures at these times.
Later, at 121.7 AU, which is a distance of 27.6 AU beyond the initial HTS
crossing distance, V1 in the N heliosheath appears to pass beyond the ACR
trapping region as the anomalous particles disappear suddenly and completely.
At V2 in the S heliosheath, large 42-21 day periodic intensity variations were
observed for a few MeV particles just beyond the HTS crossing distance at 83.7
AU and again about a year later when V2 was ~4 AU beyond this shock. These are
the dominant features of the energetic particle populations in the inner part
of the S-heliosheath. The ACR and electrons later decreased to almost
background levels until a sudden increase at 2011.25, at a distance of about 10
AU beyond the HTS. The features observed by V2 in the S heliosheath relative to
those at V1 indicate a much more structured S heliosheath in which the latitude
of V2 relative to the HCS maximum latitude (sector zone) may play an important
role. Estimates of a S heliosheath trapping/modulation boundary for energetic
particles in the range 105-110 AU are obtained in this paper from a comparison
with those at 121.7 AU observed in the N hemisphere.
","[{""version"":""v1"",""created"":""Thu, 13 Mar 2014 16:42:08 GMT""}]","2014-03-14"
"1403.3323","Christian Krattenthaler","Mihai Ciucu and Christian Krattenthaler","A factorization theorem for lozenge tilings of a hexagon with triangular
  holes","20 pages","Trans. Amer. Math. Soc. 369 (2017), 3655-3672",,,"math.CO math-ph math.MP","http://arxiv.org/licenses/nonexclusive-distrib/1.0/","  In this paper we present a combinatorial generalization of the fact that the
number of plane partitions that fit in a $2a\times b\times b$ box is equal to
the number of such plane partitions that are symmetric, times the number of
such plane partitions for which the transpose is the same as the complement. We
use the equivalent phrasing of this identity in terms of symmetry classes of
lozenge tilings of a hexagon on the triangular lattice. Our generalization
consists of allowing the hexagon have certain symmetrically placed holes along
its horizontal symmetry axis. The special case when there are no holes can be
viewed as a new, simpler proof of the enumeration of symmetric plane
partitions.
","[{""version"":""v1"",""created"":""Thu, 13 Mar 2014 16:44:22 GMT""},{""version"":""v2"",""created"":""Fri, 26 Aug 2016 13:36:33 GMT""}]","2017-02-13"
"1403.3324","Brian M. Andersen","Maria N. Gastiasoro, Brian M. Andersen","Enhancing magnetic stripe order in iron pnictides by RKKY exchange
  interactions","5 pages, 4 figures","Phys. Rev. Lett. 113, 067002 (2014)","10.1103/PhysRevLett.113.067002","NBI CMT 2014","cond-mat.supr-con cond-mat.str-el","http://arxiv.org/licenses/nonexclusive-distrib/1.0/","  Recent experimental studies have revealed several unexpected properties of
Mn-doped BaFe2As2. These include extension of the stripe-like magnetic (pi,0)
phase to high temperatures above a critical Mn concentration only, the presence
of diffusive and weakly temperature dependent magnetic (pi,pi) checkerboard
scattering, and an apparent absent structural distortion from tetragonal to
orthorhombic. Here, we study the effects of magnetic impurities both below and
above the N\'eel transition temperature within a real-space five-band model
appropriate to the iron pnictides. We show how these experimental findings can
be explained by a cooperative behavior of the magnetic impurities and the
conduction electrons mediating the Ruderman-Kittel-Kasuya-Yosida (RKKY)
interactions between them.
","[{""version"":""v1"",""created"":""Thu, 13 Mar 2014 16:59:23 GMT""}]","2014-08-12"
"1403.3325","Alessandro Zocca MSc","Alessandro Zocca, Sem C. Borst, Johan S.H. van Leeuwaarden","Slow transitions, slow mixing and starvation in dense random-access
  networks","29 pages, 5 figures",,,,"math.PR cs.NI","http://arxiv.org/licenses/nonexclusive-distrib/1.0/","  We consider dense wireless random-access networks, modeled as systems of
particles with hard-core interaction. The particles represent the network users
that try to become active after an exponential back-off time, and stay active
for an exponential transmission time. Due to wireless interference, active
users prevent other nearby users from simultaneous activity, which we describe
as hard-core interaction on a conflict graph. We show that dense networks with
aggressive back-off schemes lead to extremely slow transitions between dominant
states, and inevitably cause long mixing times and starvation effects.
","[{""version"":""v1"",""created"":""Thu, 13 Mar 2014 16:59:28 GMT""}]","2014-03-14"
"1403.3326","Vladimir Nesterenko","V.V. Nesterenko and A.V. Nesterenko","Macroscopic approach to the Casimir friction force","8 pages, no figures, no tables, REVTeX4-1, The paper is considerably
  extended, new results are obtained, presentation is improved","JETP Lett. 99, 581 (2014)","10.1134/S0021364014100087",,"quant-ph cond-mat.mes-hall","http://arxiv.org/licenses/nonexclusive-distrib/1.0/","  The general formula is derived for the vacuum friction force between two
parallel perfectly flat planes bounding two material media separated by a
vacuum gap and moving relative to each other with a constant velocity
$\mathbf{v}$. The material media are described in the framework of macroscopic
electrodynamics whereas the nonzero temperature and dissipation are taken into
account by making use of the Kubo formulae from non-equilibrium statistical
thermodynamics. The formula obtained provides a rigorous basis for calculation
of the vacuum friction force within the quantum field theory methods in the
condensed matter physics. The revealed $v$-dependence of the vacuum friction
force proves to be the following: for zero temperature ($T=0$) it is
proportional to $(v/c)^3$ and for $T>0$ this force is linear in $(v/c)$.
","[{""version"":""v1"",""created"":""Thu, 13 Mar 2014 17:01:58 GMT""},{""version"":""v2"",""created"":""Wed, 23 Apr 2014 15:00:42 GMT""}]","2014-06-26"
