"1403.4411","Fran\c{c}ois Liot","F. Liot","Conditions for the Invar effect in Fe$_{1-x}A_{x}$ ($A={\rm Pt},{\rm
  Ni}$)","13 pages, 5 figures, JPCM format",,,,"cond-mat.mtrl-sci","http://arxiv.org/licenses/nonexclusive-distrib/1.0/","  We present a necessary condition under which a collinear ferromagnet
Fe$_{1-x}A_{x}$ ($A={\rm Pt},{\rm Ni}$) with disordered face-centered-cubic
structure exhibits the Invar effect. The condition involves the rate at which
the fraction of Fe moments that are antiferromagnetically aligned with the
magnetization fluctuates as the system is heated, $dx^{{\rm Fe}\downarrow}/dT$.
Another contributing factor is the magnetostructural coupling
$\kappa=-(1/V)(\partial V / \partial x^{{\rm Fe}\downarrow})_{T}$, where the
volume $V(T, x^{{\rm Fe}\downarrow})$ corresponds to a homogeneous
ferromagnetic state, a partially disordered local moment state, or a disordered
local moment state depending on the value of $x^{{\rm Fe}\downarrow}$.
According to the criterion, the Invar phenomenon occurs only when the thermal
expansion arising from the temperature dependence of the fraction of Fe moments
which point down $-1/3\,\kappa\,dx^{{\rm Fe}\downarrow}/dT$ compensates for the
thermal expansion associated with the anharmonicity of lattice vibrations in a
wide temperature interval. Upon further investigation, we provide evidence that
only alloys with strong magnetostructural coupling at zero Kelvin can show the
Invar effect.
","[{""version"":""v1"",""created"":""Tue, 18 Mar 2014 11:33:17 GMT""}]","2014-03-19"
"1403.4412","Richard Gonzales","Richard Gonzales","Localization in equivariant operational K-theory and the Chang-Skjelbred
  property","25 pages",,,,"math.AG math.KT","http://arxiv.org/licenses/nonexclusive-distrib/1.0/","  We establish a localization theorem of Borel-Atiyah-Segal type for the
equivariant operational K-theory of Anderson and Payne. Inspired by the work of
Chang-Skjelbred and Goresky-Kottwitz-MacPherson, we establish a general form of
GKM theory in this setting, applicable to singular schemes with torus action.
Our results are deduced from those in the smooth case via Gillet-Kimura's
technique of cohomological descent for equivariant envelopes. As an
application, we extend Uma's description of the equivariant K-theory of smooth
compactifications of reductive groups to the equivariant operational K-theory
of all, possibly singular, projective group embeddings.
","[{""version"":""v1"",""created"":""Tue, 18 Mar 2014 11:34:04 GMT""}]","2014-03-19"
"1403.4413","Stefanos Leontsinis Mr.","T. Alexopoulos, G. Iakovidis, S. Leontsinis, K. Ntekas, V.
  Polychronakos","Identification of circles from datapoints using Gaussian sums","4 pages, 5 figures",,"10.1016/j.nima.2014.01.046",,"physics.ins-det hep-ex","http://arxiv.org/licenses/nonexclusive-distrib/1.0/","  We present a pattern recognition method which use datapoints on a plane and
estimates the parameters of a circle. MC data are generated in order to test
the method's efficiency over noise hits, uncertainty in the hits positions and
number of datapoints. The scenario were the hits from a quadrant of the circle
are missing is also considered. The method proposed is proven to be robust,
accurate and very efficient.
","[{""version"":""v1"",""created"":""Tue, 18 Mar 2014 11:35:19 GMT""},{""version"":""v2"",""created"":""Wed, 19 Mar 2014 07:03:45 GMT""},{""version"":""v3"",""created"":""Sat, 22 Mar 2014 15:52:05 GMT""}]","2015-06-19"
"1403.4414","Ishai Dan-Cohen","Ishai Dan-Cohen and Stefan Wewers","The Heisenberg coboundary equation: appendix to Explicit Chabauty-Kim
  theory","Minor corrections. Formerly part of arXiv:1209.0276",,,,"math.NT","http://arxiv.org/licenses/nonexclusive-distrib/1.0/","  Let p be a regular prime number, let Gp denote the Galois group of the
maximal unramified away from p extension of Q, and let H_et denote the
Heisenberg group over Qp with Gp-action given by H_et = Qp(1)^2 \oplus Qp(2).
Although Soul\'e vanishing guarantees that the map H^1(Gp, H_et) ---> H^1(Gp,
Qp(1)^2) is bijective, the problem of constructing an explicit lifting of an
arbitrary cocycle in H^1(Gp, Qp(1)^2) proves to be a challenge. We explain how
we believe this problem should be analyzed, following an unpublished note by
Romyar Sharifi, hereby making the original appendix to Explicit Chabauty-Kim
theory available online in an arXiv-only note.
","[{""version"":""v1"",""created"":""Tue, 18 Mar 2014 11:35:47 GMT""},{""version"":""v2"",""created"":""Wed, 19 Mar 2014 13:40:29 GMT""}]","2014-03-20"
"1403.4415","Julia Perl","Julia Preusse, J\'er\^ome Kunegis, Matthias Thimm, Sergej Sizov","DecLiNe -- Models for Decay of Links in Networks",,,,,"cs.SI physics.soc-ph","http://arxiv.org/licenses/nonexclusive-distrib/1.0/","  The prediction of graph evolution is an important and challenging problem in
the analysis of networks and of the Web in particular. But while the appearance
of new links is part of virtually every model of Web growth, the disappearance
of links has received much less attention in the literature. To fill this gap,
our approach DecLiNe (an acronym for DECay of LInks in NEtworks) aims to
predict link decay in networks, based on structural analysis of corresponding
graph models. In analogy to the link prediction problem, we show that analysis
of graph structures can help to identify indicators for superfluous links under
consideration of common network models. In doing so, we introduce novel metrics
that denote the likelihood of certain links in social graphs to remain in the
network, and combine them with state-of-the-art machine learning methods for
predicting link decay. Our methods are independent of the underlying network
type, and can be applied to such diverse networks as the Web, social networks
and any other structure representable as a network, and can be easily combined
with case-specific content analysis and adopted for a variety of social network
mining, filtering and recommendation applications. In systematic evaluations
with large-scale datasets of Wikipedia we show the practical feasibility of the
proposed structure-based link decay prediction algorithms.
","[{""version"":""v1"",""created"":""Tue, 18 Mar 2014 11:44:36 GMT""},{""version"":""v2"",""created"":""Wed, 19 Mar 2014 13:03:24 GMT""}]","2014-03-20"
"1403.4416","Hania Djani","Hania Djani, Patrick Hermet, Philippe Ghosez","First principles characterization of the P2_1ab ferroelectric phase of
  Bi2WO6","23 pages, 5 figures, 13 tables",,,,"cond-mat.mtrl-sci","http://arxiv.org/licenses/nonexclusive-distrib/1.0/","  The structural, dielectric, dynamical, elastic, piezoelectric and nonlinear
optical (second-order susceptibility and Pockels tensors) properties of Bi2$WO6
in its P2_1ab ferroelectric ground state are determined using density
functional theory. The calculation of infrared and Raman spectra on single
crystal allowed us to clarify the assignment of experimental phonon modes,
considering the good agreement between the calculated and the experimental
Raman spectra obtained on polycrystal. The calculation of the elastic constants
confirms the elastic stability of the crystal and allow us to estimate the
Young and shear moduli of polycrystalline samples. The piezoelectric constants
have significant intrinsic values comparable to those of prototypical ABO3
ferroelectrics. The electro-optic response is strongly dominated by the ionic
contribution of transverse optic modes, yielding sizable Pockels coefficients
around 9 pm/V along the polar direction.
","[{""version"":""v1"",""created"":""Tue, 18 Mar 2014 11:48:49 GMT""}]","2014-03-19"
"1403.4417","Sang Wook Kim","Minsu Kim, Jinhyoung Lee, and Sang Wook Kim","Is Bell inequality violated once measurement independence is relaxed?","4 pages, 1 figure",,,,"quant-ph","http://arxiv.org/licenses/nonexclusive-distrib/1.0/","  It has been believed that statistical inequality such as Bell inequality
should be modified once measurement independence (MI), the assumption that
observers can freely choose measurement settings without changing the
probability distribution of hidden variables, is relaxed. However, we show that
there exists the possibility that Bell inequality is still valid even if MI is
relaxed. MI is only a sufficient condition to derive Bell inequality when both
determinism and setting independence, usually called as local realism, are
satisfied. We thus propose a new condition necessary and sufficient for
deriving Bell inequality, called as concealed measurement dependence.
","[{""version"":""v1"",""created"":""Tue, 18 Mar 2014 11:49:27 GMT""}]","2014-03-19"
"1403.4418","Genadi Levin","Genadi Levin, Grzegorz Swiatek","Limit drift","Final version. To appear in Ergodic Theory and Dynamical Systems",,"10.1017/etds.2016.10",,"math.DS","http://arxiv.org/licenses/nonexclusive-distrib/1.0/","  We study the problem of the existence of wild attractors for critical circle
covering maps with Fibonacci dynamics.
","[{""version"":""v1"",""created"":""Tue, 18 Mar 2014 11:51:12 GMT""},{""version"":""v2"",""created"":""Mon, 1 Sep 2014 15:33:01 GMT""},{""version"":""v3"",""created"":""Fri, 15 Jan 2016 20:30:09 GMT""}]","2016-07-13"
"1403.4419","Ezio Venturino","D. Melchionda, E. Pastacaldi, C. Perri, E. Venturino","Interacting population models with pack behavior",,,,,"math.DS q-bio.PE","http://arxiv.org/licenses/nonexclusive-distrib/1.0/","  Models of coordinated behavior of populations living in the same environment
are introduced for the cases when they either compete with each other, or they
both gain by mutual interactions, or finally when one hunts the other one. The
equilibria of the systems are analysed, showing that in some cases the
populations may both disappear. Coexistence leads to global asymptotic
stability for symbiotic populations, or to Hopf bifurcations for predator-prey
systems. Finally, a new very interesting phenomenon is discovered in one of
these rather simple models. Indeed tristability may be achieved in the
competition case, for which competitive exclusion is allowed to occur together
with populations coexistence.
","[{""version"":""v1"",""created"":""Tue, 18 Mar 2014 11:53:25 GMT""}]","2014-03-19"
"1403.4420","Christiane Helling","Ch.Helling (1), P.Woitke (1), P.B.Rimmer (1), I.Kamp (2), W.-F.Thi (3)
  and R.Meijerink (2,4) (1 - University of St Andrews, 2 - Kapteyn Astronomical
  Institute Groningen, 3 - Laboratoire d'Astrophisique de Grenoble, 4 - Leiden
  Observatory)","Disk evolution, element abundances and cloud properties of young gas
  giant planets","32 pages, accepted for publication in the OA journal 'Life', Special
  issue 'Planet Formation and the Rise of Life'. Life (ISSN 2075-1729)","Life 2014, volume 4, issue 2, pages 142-173","10.3390/life4020142",,"astro-ph.EP astro-ph.IM astro-ph.SR","http://arxiv.org/licenses/nonexclusive-distrib/1.0/","  We discuss the chemical pre-conditions for planet formation, in terms of gas
and ice abundances in a protoplanetary disk, as function of time and position,
and the resulting chemical composition and cloud properties in the atmosphere
when young gas giant planets form. Large deviations between the abundances of
the host star and its gas giants seem likely to occur if the planet formation
follows the core-accretion scenario. These deviations stem from the separate
evolution of gas and dust in the disk, where the dust forms the planet cores,
followed by the final run-away accretion of the left-over gas. ProDiMo
protoplanetary disk models are used to predict the chemical evolution of gas
and ice in the midplane. We find that cosmic rays play a crucial role in slowly
un-blocking the CO, where the liberated oxygen forms water, which then freezes
out quickly. Therefore, the C/O ratio in the gas phase is found to gradually
increase with time, in a region bracketed by the water and CO ice-lines. In
this regions, C/O is found to approach unity after about 5 Myrs, scaling with
the cosmic ray ionisation rate. We then explore how the atmospheric chemistry
and cloud properties in young gas giants are affected when the non-solar C/O
ratios predicted by the disk models are assumed. The DRIFT cloud formation
model is applied to study the formation of atmospheric clouds under the
influence of varying primordial element abundances and its feedback onto the
local gas. We demonstrate that element depletion by cloud formation plays a
crucial role in converting an oxygen-rich atmosphere gas into carbon-rich gas
when non-solar, primordial element abundances are considered as suggested by
disk model.
","[{""version"":""v1"",""created"":""Tue, 18 Mar 2014 11:56:40 GMT""}]","2014-06-25"
"1403.4421","Boris Zaltzman","Isaak Rubinstein and Boris Zaltzman","Equilibrium Electro-osmotic Instability","5 pages, 4 figures, submitted",,"10.1103/PhysRevLett.114.114502",,"physics.flu-dyn cond-mat.soft","http://arxiv.org/licenses/nonexclusive-distrib/1.0/","  Since its prediction fifteen years ago, electro-osmotic instability has been
attributed to non-equilibrium electro-osmosis related to the extended space
charge which develops at the limiting current in the course of concentration
polarization at a charge-selective interface. This attribution had a double
basis. Firstly, it has been recognized that equilibrium electro-osmosis cannot
yield instability for a perfectly charge-selective solid. Secondly, it has been
shown that non-equilibrium electro-osmosis can. First theoretical studies in
which electro-osmotic instability was predicted and analyzed employed the
assumption of perfect charge-selectivity for the sake of simplicity and so did
the subsequent numerical studies of various time-dependent and nonlinear
features of electro-osmotic instability. In this letter, we show that relaxing
the assumption of perfect charge-selectivity (tantamount to fixing the
electrochemical potential in the solid) allows for equilibrium electro-osmotic
instability. Moreover, we suggest a simple experimental test for determining
the true, either equilibrium or non-equilibrium, origin of electro-osmotic
instability.
","[{""version"":""v1"",""created"":""Tue, 18 Mar 2014 11:57:12 GMT""}]","2015-06-19"
"1403.4422","Artem Bekzhanov","A. V. Bekzhanov, S. G. Bondarenko, V. V. Burov","Nucleon form factors for the elastic electron-deuteron scattering at
  high momentum transfer",,,"10.1134/S0021364014110034",,"nucl-th","http://arxiv.org/licenses/nonexclusive-distrib/1.0/","  The reaction of the elastic electron-deuteron scattering at high momentum
transfer is investigated within the Bethe-Salpeter approach. The relativistic
covariant Graz II separable kernel of nucleon-nucleon interactions is used to
analyze the deuteron structure functions, form factors and tensor of
polarization components. The modern data for the electromagmetic nucleons
structure from the double polarization experiments as well as some other models
of the nucleon form factors are considered.
","[{""version"":""v1"",""created"":""Tue, 18 Mar 2014 11:57:36 GMT""}]","2015-06-19"
"1403.4423","Kaninda Musumbu","Kaninda Musumbu (LaBRI)","Algorithms Visualization Tool for Students and Lectures in Computer
  Science",,"8th International Conference on e-Learning ICEL-2013 (ICEL 2013),
  Cape Town : South Africa (2013)",,,"cs.CY cs.HC","http://arxiv.org/licenses/nonexclusive-distrib/1.0/","  The best way to understand complex data structures or algorithm is to see
them in action. The present work presents a new tool, especially useful for
students and lecturers in computer science. It is written in Java and developed
at Bordeaux University of Sciences and Technology. Its purposes is to help
students in understanding classical algorithms by illustrating them in
different ways: graphical (animated), formal, and descriptive. We think that it
can be useful to everyone interested in algorithms, in particular to students
in computer science that want to beef up their readings and university
lecturers in their major effort to enhance the data structures and algorithms
course. The main new thing of this tool is the fact of making it possible to
the user to animate their own algorithms.
","[{""version"":""v1"",""created"":""Tue, 18 Mar 2014 12:07:39 GMT""}]","2014-03-19"
"1403.4424","Benoit Perthame","Pierre-Louis Lions (CEREMADE), Benoit Perthame (LJLL,
  INRIA-Paris-Rocquencourt), Panagiotis E. Souganidis","Scalar conservation laws with rough (stochastic) fluxes; the spatially
  dependent case",,,,,"math.AP math.PR","http://arxiv.org/licenses/nonexclusive-distrib/1.0/","  We continue the development of the theory of pathwise stochastic entropy
solutions for scalar conservation laws in $\R^N$ with quasilinear
multiplicative ''rough path'' dependence by considering inhomogeneous fluxes
and a single rough path like, for example, a Brownian motion. Following our
previous note where we considered spatially independent fluxes, we introduce
the notion of pathwise stochastic entropy solutions and prove that it is well
posed, that is we establish existence, uniqueness and continuous dependence in
the form of a (pathwise) $L^1$-contraction. Our approach is motivated by the
theory of stochastic viscosity solutions, which was introduced and developed by
two of the authors, to study fully nonlinear first- and second-order stochastic
pde with multiplicative noise. This theory relies on special test functions
constructed by inverting locally the flow of the stochastic characteristics.
For conservation laws this is best implemented at the level of the kinetic
formulation which we follow here.
","[{""version"":""v1"",""created"":""Tue, 18 Mar 2014 12:08:18 GMT""},{""version"":""v2"",""created"":""Fri, 4 Apr 2014 19:25:31 GMT""}]","2014-04-07"
"1403.4425","Sau Lan Wu","Sau Lan Wu","Brief history for the search and discovery of the Higgs particle - A
  personal perspective","32 pages, 26 figures, submitted to MPLA","Mod. Phys. Lett. A, Vol.29, No. 9 (2014) 1330027","10.1142/S0217732313300279","CERN-OPEN-2014-027","hep-ex hep-ph physics.hist-ph","http://arxiv.org/licenses/nonexclusive-distrib/1.0/","  In 1964, a new particle was proposed by several groups to answer the question
of where the masses of elementary particles come from; this particle is usually
referred to as the Higgs particle or the Higgs boson. In July 2012, this Higgs
particle was finally found experimentally, a feat accomplished by the ATLAS
Collaboration and the CMS Collaboration using the Large Hadron Collider at
CERN. It is the purpose of this review to give my personal perspective on a
brief history of the experimental search for this particle since the '80s and
finally its discovery in 2012. Besides the early searches, those at the LEP
collider at CERN, the Tevatron Collider at Fermilab, and the Large Hadron
Collider at CERN are described in some detail. This experimental discovery of
the Higgs boson is often considered to be the most important advance in
particle physics in the last half a century, and some of the possible
implications are briefly discussed.
  This review is partially based on a talk presented by the author at the
conference ``Higgs Quo Vadis,'' Aspen Center for Physics, Aspen, CO, USA, March
10-15, 2013.
","[{""version"":""v1"",""created"":""Tue, 18 Mar 2014 12:11:57 GMT""}]","2014-03-24"
"1403.4426","Matthias Keller","Matthias Keller, Daniel Lenz and Simone Warzel","An invitation to trees of finite cone type: random and deterministic
  operators","16 pages, 3 figures",,,,"math.SP math-ph math.MP math.PR","http://arxiv.org/licenses/nonexclusive-distrib/1.0/","  Trees of finite cone type have appeared in various contexts. In particular,
they come up as simplified models of regular tessellations of the hyperbolic
plane. The spectral theory of the associated Laplacians can thus be seen as
induced by geometry. Here we give an introduction focusing on background and
then turn to recent results for (random) perturbations of trees of finite cone
type and their spectral theory.
","[{""version"":""v1"",""created"":""Tue, 18 Mar 2014 12:14:39 GMT""}]","2014-03-19"
"1403.4427","Giorgio Cortiana","The ATLAS, CDF, CMS and D0 Collaborations","First combination of Tevatron and LHC measurements of the top-quark mass","34 pages, 7 figures",,,"ATLAS-CONF-2014-008; CDF Note 11071; CMS PAS TOP-13-014; D0 Note
  6416","hep-ex","http://arxiv.org/licenses/nonexclusive-distrib/1.0/","  We present a combination of measurements of the mass of the top quark,
$m_{\rm top}$, performed by the CDF and D0 experiments at the Tevatron collider
and the ATLAS and CMS experiments at the Large Hadron Collider (LHC). The
Tevatron data correspond to an integrated luminosity of up to 8.7 fb${^{-1}}$
of proton-antiproton collisions from Run II of the Tevatron at a centre-of-mass
energy of 1.96 TeV. The LHC data correspond to an integrated luminosity of up
to 4.9 fb${^{-1}}$ of proton-proton collisions from the run at a centre-of-mass
energy of 7 TeV. The combination includes measurements in the $t\bar t\to$
lepton+jets, $t\bar t\to$ dilepton, $t\bar t\to$ all jets and $t\bar t\to$
$E_{\rm T}^{\rm miss}$+jets final states. The resulting combined measurement of
$m_{\rm top}$ is $173.34 \pm 0.27 \mbox{(stat)} \pm 0.71 \mbox{(syst)}$ GeV,
with a total uncertainty of $0.76$ GeV.
","[{""version"":""v1"",""created"":""Tue, 18 Mar 2014 12:15:07 GMT""}]","2014-03-19"
"1403.4428","Kirk Soodhalter","Kirk M. Soodhalter","Two recursive GMRES-type methods for shifted linear systems with general
  preconditioning","25 pages, 4 figures, 6 tables",,,,"math.NA cs.NA","http://arxiv.org/licenses/nonexclusive-distrib/1.0/","  We present two minimum residual methods for solving sequences of shifted
linear systems, the right-preconditioned shifted GMRES and shifted recycled
GMRES algorithms which use a seed projection strategy often employed to solve
multiple related problems. These methods are compatible with general
preconditioning of all systems, and when restricted to right preconditioning,
require no extra applications of the operator or preconditioner. These seed
projection methods perform a minimum residual iteration for the base system
while improving the approximations for the shifted systems at little additional
cost. The iteration continues until the base system approximation is of
satisfactory quality. The method is then recursively called for the remaining
unconverged systems. We present both methods inside of a general framework
which allows these techniques to be extended to the setting of flexible
preconditioning and inexact Krylov methods. We present some analysis of such
methods and numerical experiments demonstrating the effectiveness of the
algorithms we have derived.
","[{""version"":""v1"",""created"":""Tue, 18 Mar 2014 12:20:45 GMT""},{""version"":""v2"",""created"":""Sun, 15 Jun 2014 14:54:24 GMT""},{""version"":""v3"",""created"":""Wed, 3 Feb 2016 11:24:33 GMT""}]","2016-02-04"
"1403.4429","Christian P. Robert","Christian P. Robert (Universite Paris-Dauphine and University of
  Warwick)","Des specificites de l'approche bayesienne et de ses justifications en
  statistique inferentielle","19 pages, in French, to appear in a philosophy of science volume on
  Bayesian statistics edited by editions Materiologiques",,,,"stat.ME","http://arxiv.org/licenses/nonexclusive-distrib/1.0/","  This book chapter (written in French) is a review of the foundations of the
Bayesian approach to statistical inference, relating to its historical roots
and some philosophical arguments, as well as a short presentation of its
practical implementation.
","[{""version"":""v1"",""created"":""Tue, 18 Mar 2014 12:25:12 GMT""}]","2014-03-19"
"1403.4430","Ealeal Bear PhD","Ealeal Bear, Noam Soker (Technion, Israel)","First versus second generation planet formation in post common envelope
  binary (PCEB) planetary systems","MNRAS in press",,"10.1093/mnras/stu1529",,"astro-ph.SR","http://arxiv.org/licenses/nonexclusive-distrib/1.0/","  We examine planets orbiting post-common envelope binaries (PCEBs) from the
perspective of angular momentum evolution, and conclude that the planets are
more likely to be first generation (FG) planets than second generation (SG)
planets. FG planets were born together with the parent stars, while SG planets
form later from a SG proto-planetary disk formed by mass-loss from the evolved
primary star during its red giant branch (RGB) phase or asymptotic giant branch
(AGB) phase. We find that in some systems the SG scenario requires that more
than twenty percent of the SG proto-planetary disk mass ends in planets.
Although we cannot rule out SG planet formation in these systems, this fraction
of mass that ends in planets is much higher than the value commonly used in
planet formation theories. On the other hand, we find that for each of the
systems we can build a progenitor system composed of a main-sequence binary
system orbited by the appropriate planets. This can be done if the secondary
star was in a resonance with the inner planet. To account for the progenitor
properties we suggest that in cases where the secondary star has a mass of ~
0.1-0.2Msun, it was formed in the same way planets are formed, i.e., from a
disk.
","[{""version"":""v1"",""created"":""Tue, 18 Mar 2014 12:25:23 GMT""},{""version"":""v2"",""created"":""Sun, 11 May 2014 10:44:47 GMT""},{""version"":""v3"",""created"":""Thu, 31 Jul 2014 20:29:17 GMT""}]","2015-06-19"
