"1403.4144","Qing He","Qing He, Vangelis Angelakis, Anthony Ephremides, and Di Yuan","Polynomial Complexity Minimum-Time Scheduling in a Class of Wireless
  Networks","Submitted to IEEE Transactions on Control of Network Systems on Dec.
  2013",,"10.1109/TCNS.2015.2512678",,"cs.NI","http://arxiv.org/licenses/nonexclusive-distrib/1.0/","  We consider a wireless network with a set of transmitter-receiver pairs, or
links, that share a common channel, and address the problem of emptying finite
traffic volume from the transmitters in minimum time. This, so called,
minimum-time scheduling problem has been proved to be NP-hard in general. In
this paper, we study a class of minimum-time scheduling problems in which the
link rates have a particular structure consistent with the assumed environment
and topology. We show that global optimality can be reached in polynomial time
and derive optimality conditions. Then we consider a more general case in which
we apply the same approach and thus obtain approximation as well as lower and
upper bounds to the optimal solution. Simulation results confirm and validate
our approach.
","[{""version"":""v1"",""created"":""Mon, 17 Mar 2014 16:00:16 GMT""}]","2016-11-18"
"1403.4145","Pryra T t","Miao-Xin Wu, Ming-Feng Wang, and Yi-Zhuang Zheng","Photon-echo-based quantum memory for optical squeezed states",,,,,"quant-ph","http://creativecommons.org/licenses/by/3.0/","  The ability to efficiently realize storage and readout of optical squeezed
states plays a key roll in continuous-variables quantum information processing.
Here we study the quantum memory (QM) for squeezed state of propagating light
in atoms based on the hybrid photon echo re-phasing (HYPER). The optical
quantum state is recorded in two sublevels of the ground state of an atomic
ensemble to realize long-lived QM. Taking into account the noise effect due to
atomic decay, our estimation indicates that, with currently available
technique, high fidelities larger than the classical fidelity threshold 81.5 %
are obtainable. Our work provides some practical guidance for realization of
efficient and faithful photon-echo-based memory for squeezed light.
","[{""version"":""v1"",""created"":""Mon, 17 Mar 2014 16:01:19 GMT""}]","2014-03-18"
"1403.4146","Akiko Ueda","Akiko Ueda and Takehito Yokoyama","Anomalous interference in Aharonov-Bohm rings with two Majorana bound
  states","5 pages, 4 figures","Phys. Rev. B 90, 081405 (2014)","10.1103/PhysRevB.90.081405",,"cond-mat.mes-hall cond-mat.supr-con","http://arxiv.org/licenses/nonexclusive-distrib/1.0/","  We investigate the conductance of an Aharonov-Bohm (AB) interferometer
coupled to a quantum dot and two Majorana bound states on the edge of the
topological superconductor with finite length. When the tunnel couplings
between the Majorana bound states and the Aharonov-Bohm interferometer are
fixed to the specific phase, the differential conductance becomes zero
irrespective of all the parameters as long as the hoppings to the two Majorana
fermions on the opposite side are equal. The conductance at the zero bias
voltage does not change with the magnetic flux penetrating the ring for all
cases. When the energy level of the quantum dot is equal to the energy of the
Majorana bound states, the AB oscillation shows \pi periodicity due to the
particle-hole symmetry. The breaking of the time-reversal symmetry of the
topological superconductor results in 2\pi periodicity of the AB oscillation
for the specific phase of the tunnel coupling while the time-reversal symmetry
breaking leads to the mixing of the triplet and singlet states in the quantum
dot in another specific phase.
","[{""version"":""v1"",""created"":""Mon, 17 Mar 2014 16:06:00 GMT""},{""version"":""v2"",""created"":""Tue, 19 Aug 2014 10:51:42 GMT""}]","2014-08-27"
"1403.4147","Markus P. Mueller","Howard Barnum, Markus P. Mueller, Cozmin Ududec","Higher-order interference and single-system postulates characterizing
  quantum theory","21 + 6 pages, 1 figure. v4: published version (includes several minor
  corrections)","New Journal of Physics 16, 123029 (2014)","10.1088/1367-2630/16/12/123029",,"quant-ph math-ph math.MP","http://arxiv.org/licenses/nonexclusive-distrib/1.0/","  We present a new characterization of quantum theory in terms of simple
physical principles that is different from previous ones in two important
respects: first, it only refers to properties of single systems without any
assumptions on the composition of many systems; and second, it is closer to
experiment by having absence of higher-order interference as a postulate, which
is currently the subject of experimental investigation. We give three
postulates -- no higher-order interference, classical decomposability of
states, and strong symmetry -- and prove that the only non-classical
operational probabilistic theories satisfying them are real, complex, and
quaternionic quantum theory, together with 3-level octonionic quantum theory
and ball state spaces of arbitrary dimension. Then we show that adding
observability of energy as a fourth postulate yields complex quantum theory as
the unique solution, relating the emergence of the complex numbers to the
possibility of Hamiltonian dynamics. We also show that there may be interesting
non-quantum theories satisfying only the first two of our postulates, which
would allow for higher-order interference in experiments while still respecting
the contextuality analogue of the local orthogonality principle.
","[{""version"":""v1"",""created"":""Mon, 17 Mar 2014 16:07:29 GMT""},{""version"":""v2"",""created"":""Thu, 10 Apr 2014 08:05:28 GMT""},{""version"":""v3"",""created"":""Sun, 24 Aug 2014 19:52:20 GMT""},{""version"":""v4"",""created"":""Sat, 3 Jan 2015 17:26:46 GMT""}]","2015-01-06"
"1403.4148","Friedrich Wagemann","Ulrich Kraehmer and Friedrich Wagemann","Racks, Leibniz algebras and Yetter-Drinfel'd modules","20 pages, no figures",,,,"math.QA","http://arxiv.org/licenses/nonexclusive-distrib/1.0/","  A Hopf algebra object in Loday and Pirashvili's category of linear maps
entails an ordinary Hopf algebra and a Yetter-Drinfel'd module. We equip the
latter with a structure of a braided Leibniz algebra. This provides a unified
framework for examples of racks in the category of coalgebras discussed
recently by Carter, Crans, Elhamdadi and Saito.
","[{""version"":""v1"",""created"":""Mon, 17 Mar 2014 16:09:07 GMT""}]","2014-03-18"
"1403.4149","Andreas Bill","Thomas E. Baker, Adam Richie-Halford, Ovidiu E. Icreverzi, and Andreas
  Bill","Cascading Proximity Effects in Rotating Magnetizations","5 pages, 4 figures","Europhys. Lett. 107, 17001 (2014)","10.1209/0295-5075/107/17001",,"cond-mat.supr-con cond-mat.mes-hall","http://arxiv.org/licenses/nonexclusive-distrib/1.0/","  We demonstrate two effects that occur in all diffusive
superconducting-magnetic heterostructures with rotating magnetization: the
reappearance of singlet $|0,0>$ correlations deep in the magnetic material and
a cascade of $s=1$, $m=0, \pm 1$ components (in the two spin-$1/2$ basis
$|s,m>$). We do so by examining the order parameter and Josephson current
through a multilayer with five mutually perpendicular ferromagnets. The
properties of the middle layer determine whether the current is due to $m=0$ or
$m\neq 0$ contributions. We conclude that so-called long- and short-range
components are present across a proximity system with rotating magnetization.
","[{""version"":""v1"",""created"":""Mon, 17 Mar 2014 16:12:07 GMT""}]","2014-10-29"
"1403.4150","Takahiro Ohgoe","Takahiro Ohgoe and Masatoshi Imada","Variational Monte Carlo Method for Electron-Phonon Coupled Systems",,"Phys. Rev. B 89, 195139 (2014)","10.1103/PhysRevB.89.195139",,"cond-mat.str-el","http://arxiv.org/licenses/nonexclusive-distrib/1.0/","  We develop a variational Monte Carlo (VMC) method for electron-phonon coupled
systems. The VMC method has been extensively used for investigating strongly
correlated electrons over the last decades. However, its applications to
electron-phonon coupled systems have been severely restricted because of its
large Hilbert space. Here, we propose a variational wave function with a large
number of variational parameters which is suitable and tractable for systems
with electron-phonon coupling. In the proposed wave function, we implement an
unexplored electron-phonon correlation factor which takes into account the
effect of the entanglement between electrons and phonons. The method is applied
to systems with diagonal electron-phonon interactions, i.e. interactions
between charge densities and lattice displacements (phonons). As benchmarks, we
compare VMC results with previous results obtained by the exact
diagonalization, the Green function Monte Carlo and the density matrix
renormalization group for the Holstein and Holstein-Hubbard model. From these
benchmarks, we show that the present method offers an efficient way to treat
strongly coupled electron-phonon systems.
","[{""version"":""v1"",""created"":""Mon, 17 Mar 2014 16:12:48 GMT""},{""version"":""v2"",""created"":""Fri, 30 May 2014 06:55:07 GMT""}]","2014-06-02"
"1403.4151","Nils Waterstraat","Nils Waterstraat","On bifurcation for semilinear elliptic Dirichlet problems on shrinking
  domains","18 pages; survey article based on arXiv:1305.3078 and arXiv:1301.1458","Springer Proc. Math. Stat. 119, 2015, 273--291",,,"math.AP math.DG math.FA","http://arxiv.org/licenses/nonexclusive-distrib/1.0/","  We consider the Dirichlet problem for semilinear elliptic equations on a
bounded domain which is diffeomorphic to a ball and investigate bifurcation
from a given (trivial) branch of solutions, where the radius of the ball serves
as bifurcation parameter. Our methods are based on well known results from
variational bifurcation theory, which we outline in a separate section for the
readers' convenience.
","[{""version"":""v1"",""created"":""Mon, 17 Mar 2014 16:22:41 GMT""}]","2017-02-07"
"1403.4152","Reza Rahimi","Reza Rahimi","Quick Safari Through Software Design",,,,,"cs.SE","http://arxiv.org/licenses/nonexclusive-distrib/1.0/","  This is a short tutorial about different software design methodologies.
","[{""version"":""v1"",""created"":""Mon, 17 Mar 2014 16:33:36 GMT""}]","2014-03-18"
"1403.4153","Delaram Kahrobaei","Bren Cavallo and Delaram Kahrobaei","A family of polycyclic groups over which the uniform conjugacy problem
  is NP-complete",,,"10.1142/S0218196714500234",,"math.GR cs.CC cs.CR","http://arxiv.org/licenses/nonexclusive-distrib/1.0/","  In this paper we study the conjugacy problem in polycyclic groups. Our main
result is that we construct polycyclic groups $G_n$ whose conjugacy problem is
at least as hard as the subset sum problem with $n$ indeterminates. As such,
the conjugacy problem over the groups $G_n$ is NP-complete where the parameters
of the problem are taken in terms of $n$ and the length of the elements given
on input.
","[{""version"":""v1"",""created"":""Mon, 17 Mar 2014 16:35:11 GMT""},{""version"":""v2"",""created"":""Wed, 19 Mar 2014 19:41:52 GMT""},{""version"":""v3"",""created"":""Mon, 20 Oct 2014 14:58:32 GMT""}]","2014-10-21"
"1403.4154","Konstantin Reich","K.V. Reich, Tianran Chen, B.I. Shklovskii","Theory of a field effect transistor based on semiconductor nanocrystal
  array",,"Phys. Rev. B 89, 235303 (2014)","10.1103/PhysRevB.89.235303",,"cond-mat.mes-hall","http://arxiv.org/licenses/nonexclusive-distrib/1.0/","  We study the surface conductivity of a field-effect transistor (FET) made of
periodic array of spherical semiconductor nanocrystals (NCs). We show that
electrons introduced to NCs by the gate voltage occupy one or two layers of the
array. Computer simulations and analytical theory are used to study the array
screening and corresponding evolution of electron concentrations of the first
and second layers with growing gate voltage. When first layer NCs have two
electrons per NC the quantization energy gap between its 1S and 1P levels
induces occupation of 1S levels of second layer NCs. Only at a larger gate
voltage electrons start leaving 1S levels of second layer NCs and filling 1P
levels of first layer NCs. By substantially larger gate voltage, all the
electrons vacate the second layer and move to 1P levels of first layer NCs. As
a result of this nontrivial evolution of the two layers concentrations, the
surface conductivity of FET non-monotonically depends on the gate voltage. The
same evolution of electron concentrations leads to non-monotonous behaviour of
the differential capacitance.
","[{""version"":""v1"",""created"":""Mon, 17 Mar 2014 16:35:43 GMT""},{""version"":""v2"",""created"":""Thu, 20 Mar 2014 01:07:02 GMT""}]","2014-06-11"
"1403.4155","Alla Tarighati","Alla Tarighati and Joakim Jalden","Bayesian Design of Tandem Networks for Distributed Detection With
  Multi-bit Sensor Decisions",,,"10.1109/TSP.2015.2401535",,"cs.IT math.IT","http://arxiv.org/licenses/nonexclusive-distrib/1.0/","  We consider the problem of decentralized hypothesis testing under
communication constraints in a topology where several peripheral nodes are
arranged in tandem. Each node receives an observation and transmits a message
to its successor, and the last node then decides which hypothesis is true. We
assume that the observations at different nodes are, conditioned on the true
hypothesis, independent and the channel between any two successive nodes is
considered error-free but rate-constrained. We propose a cyclic numerical
design algorithm for the design of nodes using a person-by-person methodology
with the minimum expected error probability as a design criterion, where the
number of communicated messages is not necessarily equal to the number of
hypotheses. The number of peripheral nodes in the proposed method is in
principle arbitrary and the information rate constraints are satisfied by
quantizing the input of each node. The performance of the proposed method for
different information rate constraints, in a binary hypothesis test, is
compared to the optimum rate-one solution due to Swaszek and a method proposed
by Cover, and it is shown numerically that increasing the channel rate can
significantly enhance the performance of the tandem network. Simulation results
for $M$-ary hypothesis tests also show that by increasing the channel rates the
performance of the tandem network significantly improves.
","[{""version"":""v1"",""created"":""Mon, 17 Mar 2014 16:36:39 GMT""},{""version"":""v2"",""created"":""Tue, 15 Jul 2014 14:41:31 GMT""},{""version"":""v3"",""created"":""Mon, 10 Nov 2014 08:26:34 GMT""}]","2015-06-19"
"1403.4156","Motohiko Kusakabe","Motohiko Kusakabe, K. S. Kim, Myung-Ki Cheoun, Toshitaka Kajino,
  Yasushi Kino, Grant. J. Mathews","Revised Big Bang Nucleosynthesis with long-lived negatively charged
  massive particles: updated recombination rates, primordial 9Be
  nucleosynthesis, and impact of new 6Li limits","41 pages, 34 figures, 15 tables, errors fixed, abstract cut down,
  Figs. 22-33 and Table 1 & 15 revised, Secs. 9.1 & 9.6 and Fig. 34 added,
  conclusion unchanged, accepted for publication in ApJ",,"10.1088/0067-0049/214/1/5",,"astro-ph.CO","http://arxiv.org/licenses/nonexclusive-distrib/1.0/","  We extensively reanalyze effects of a long-lived negatively charged massive
particle, X-, on big bang nucleosynthesis (BBN). The BBN model with an X-
particle was originally motivated by the discrepancy between 6,7Li abundances
predicted in standard BBN model and those inferred from observations of
metal-poor stars. In this model 7Be is destroyed via the recombination with an
X- particle followed by radiative proton capture. We calculate precise rates
for the radiative recombinations of 7Be, 7Li, 9Be, and 4He with X-. In
nonresonant rates we take into account respective partial waves of scattering
states and respective bound states. The finite sizes of nuclear charge
distributions cause deviations in wave functions from those of point-charge
nuclei. For a heavy X- mass, m_X \gtrsim 100 GeV, the d-wave --> 2P transition
is most important for 7Li and 7,9Be, unlike recombination with electrons. Our
new nonresonant rate of the 7Be recombination for m_X=1000 GeV is more than 6
times larger than the existing rate. Moreover, we suggest a new important
reaction for 9Be production: the recombination of 7Li and X- followed by
deuteron capture. We derive binding energies of X-nuclei along with reaction
rates and Q-values. We then calculate BBN and find that the amount of 7Be
destruction depends significantly on the charge distribution of 7Be. Finally,
updated constraints on the initial abundance and the lifetime of the X- are
derived in the context of revised upper limits to the primordial 6Li abundance.
Parameter regions for the solution to the 7Li problem are revised, and the
primordial 9Be abundances is revised.
","[{""version"":""v1"",""created"":""Mon, 17 Mar 2014 16:38:39 GMT""},{""version"":""v2"",""created"":""Wed, 18 Jun 2014 14:53:46 GMT""}]","2015-06-19"
"1403.4157","Giorgio Ottaviani","Luca Chiantini, Giorgio Ottaviani, Nick Vannieuwenhoven","An algorithm for generic and low-rank specific identifiability of
  complex tensors","22 pages, one C++ code and two Macaulay2 codes as ancillary files","SIAM Journal on Matrix Analysis and Applications 35(4), pp.
  1265-1287, 2014","10.1137/140961389",,"math.AG","http://arxiv.org/licenses/nonexclusive-distrib/1.0/","  We propose a new sufficient condition for verifying whether generic rank-r
complex tensors of arbitrary order admit a unique decomposition as a linear
combination of rank-1 tensors. A practical algorithm is proposed for verifying
this condition, with which it was established that in all spaces of dimension
less than 15000, with a few known exceptions, listed in the paper, generic
identifiability holds for ranks up to one less than the generic rank of the
space. This is the largest possible rank value for which generic
identifiability can hold, except for spaces with a perfect shape. The algorithm
can also verify the identifiability of a given specific rank-r decomposition,
provided that it can be shown to correspond to a nonsingular point of the r-th
order secant variety. For sufficiently small rank, which nevertheless improves
upon the known bounds for specific identifiability, some local equations of
this variety are known, allowing us to verify this property. As a particular
example of our approach, we prove the identifiability of a specific 5x5x5
tensor of rank 7, which cannot be handled by the conditions recently provided
in [I. Domanov and L. De Lathauwer, On the Uniqueness of the Canonical Polyadic
Decomposition of third-order tensors--Part II: Uniqueness of the overall
decomposition, SIAM J. Matrix Anal. Appl. 34(3), 2013]. Finally, we also
present a surprising new class of weakly-defective Segre varieties that
nevertheless turns out to admit a generically unique decomposition.
","[{""version"":""v1"",""created"":""Mon, 17 Mar 2014 16:40:55 GMT""}]","2022-09-02"
"1403.4158","Reza Rahimi","A. A. Milani, Reza Rahimi","A Methodology for Implementation of MMS Client on Embedded Platforms",,,,,"cs.MM","http://arxiv.org/licenses/nonexclusive-distrib/1.0/","  MMS (Multimedia Messaging Service) is the next generation of messaging
services in multimedia mobile communications. MMS enables messaging with full
multimedia content including images, audios, videos, texts and data, from
client to client or e-mail. MMS is based on WAP technology, so it is technology
independent. This means that enabling messages from a GSM/GPRS network to be
sent to a TDMA or WCDMA network. In this paper a methodology for implementing
MMS client on embedded platforms especially on Wince OS is described.
","[{""version"":""v1"",""created"":""Mon, 17 Mar 2014 16:42:43 GMT""}]","2014-03-18"
"1403.4159","Petr \v{C}erm\'ak","Petr \v{C}erm\'ak, Pavel Javorsk\'y, Marie Kratochv\'ilov\'a, Karel
  Pajskr, Bachir Ouladdiaf, Marie-H\'el\`ene Lem\'ee-Cailleau, Juan
  Rodriguez-Carvajal, and Martin Boehm","Magnetic structures of non-cerium analogues of heavy-fermion Ce2RhIn8:
  case of Nd2RhIn8, Dy2RhIn8 and Er2RhIn8","10 pages, 7 figures, submitted to PRB","Phys. Rev. B 89, 184409 (2014)","10.1103/PhysRevB.89.184409",,"cond-mat.supr-con cond-mat.str-el","http://arxiv.org/licenses/nonexclusive-distrib/1.0/","  R2RhIn8 compounds (space group P4/mmm, R is a rare-earth element) belong to a
large group of structurally related tetragonal materials which involves several
heavy-fermion superconductors based on Ce. We have succeeded to grow single
crystals of compounds with Nd, Dy and Er and following our previous bulk
measurements, we performed neutron-diffraction studies to determine their
magnetic structures. The Laue diffraction experiment showed that the
antiferromagnetic order below the N\'eel temperature is in all three compounds
characterized by the propagation vector k = (1/2, 1/2, 1/2). The amplitude and
direction of the magnetic moments, as well as the invariance symmetry of the
magnetic structure, were determined by subsequent experiments using two- and
four-circle diffractometers. The critical exponents were determined from the
temperature dependence of the intensities below TN.
","[{""version"":""v1"",""created"":""Mon, 17 Mar 2014 16:44:51 GMT""}]","2014-05-21"
"1403.4160","Axel D. Schwope","A.D. Schwope, B.D. Thinius","On the ephemeris of the eclipsing polar HU Aquarii","5 pages, 3 figures, AN, in press",,,,"astro-ph.SR","http://arxiv.org/licenses/nonexclusive-distrib/1.0/","  The magnetic cataclysmic variable HU Aquarii displayed pronounced
quasi-periodic modulations of its eclipse timing. These were interpreted in
terms of the light-travel time (LTT) effect caused by a circumbinary planet or
planetary system. We report new photometric observations that revealed another
precise eclipse timing for the October 2013 epoch, the first obtained in a high
accretion state after many years in low or intermediate states. The eclipse was
observed to occur earlier by 95.3 +- 2.0 s or 62.8 +- 2.0 s than expected for
an assumed linear or quadratic ephemeris, respectively. The implied apparent
strong evolution of the orbital period calls for a revision of the current
planetary model or the planetary parameters. The object deserves further
monitoring to uncover the true nature of the observed variability and to
constrain the properties of the proposed planet or planetary system. The new
observations prove that advanced amateur equipment can successfully be used in
the growing field of planet search in wide circumbinary orbits via the LTT
effect.
","[{""version"":""v1"",""created"":""Mon, 17 Mar 2014 16:46:53 GMT""}]","2014-03-18"
"1403.4161","Mikko Partanen","Mikko Partanen, Teppo H\""ayrynen, Jani Oksanen, Jukka Tulkki","Thermal balance and photon-number quantization in layered structures",,"Physical Review A 89, 033831 (2014)","10.1103/PhysRevA.89.033831",,"quant-ph physics.optics","http://arxiv.org/licenses/nonexclusive-distrib/1.0/","  The quantization of the electromagnetic field in lossy and dispersive
dielectric media has been widely studied during the last few decades. However,
several aspects of energy transfer and its relation to consistently defining
position-dependent ladder operators for the electromagnetic field in
nonequilibrium conditions have partly escaped the attention. In this work we
define the position-dependent ladder operators and an effective local
photon-number operator that are consistent with the canonical commutation
relations and use these concepts to describe the energy transfer and thermal
balance in layered geometries. This approach results in a position-dependent
photon-number concept that is simple and consistent with classical energy
conservation arguments. The operators are formed by first calculating the
vector potential operator using Green's function formalism and Langevin noise
source operators related to the medium and its temperature, and then defining
the corresponding position-dependent annihilation operator that is required to
satisfy the canonical commutation relations in arbitrary geometry. Our results
suggest that the effective photon number associated with the electric field is
generally position dependent and enables a straightforward method to calculate
the energy transfer rate between the field and the local medium. In particular,
our results predict that the effective photon number in a vacuum cavity formed
between two lossy material layers can oscillate as a function of the position
suggesting that also the local field temperature oscillates. These oscillations
are expected to be directly observable using relatively straightforward
experimental setups in which the field-matter interaction is dominated by the
coupling to the electric field.
","[{""version"":""v1"",""created"":""Mon, 17 Mar 2014 16:51:01 GMT""}]","2014-03-18"
