"1403.4232","Tanushri Chakravorty","Tanushri Chakravorty, Guillaume-Alexandre Bilodeau, Eric Granger","Automatic Image Registration in Infrared-Visible Videos using Polygon
  Vertices",,,,,"cs.CV","http://arxiv.org/licenses/nonexclusive-distrib/1.0/","  In this paper, an automatic method is proposed to perform image registration
in visible and infrared pair of video sequences for multiple targets. In
multimodal image analysis like image fusion systems, color and IR sensors are
placed close to each other and capture a same scene simultaneously, but the
videos are not properly aligned by default because of different fields of view,
image capturing information, working principle and other camera specifications.
Because the scenes are usually not planar, alignment needs to be performed
continuously by extracting relevant common information. In this paper, we
approximate the shape of the targets by polygons and use affine transformation
for aligning the two video sequences. After background subtraction, keypoints
on the contour of the foreground blobs are detected using DCE (Discrete Curve
Evolution)technique. These keypoints are then described by the local shape at
each point of the obtained polygon. The keypoints are matched based on the
convexity of polygon's vertices and Euclidean distance between them. Only good
matches for each local shape polygon in a frame, are kept. To achieve a global
affine transformation that maximises the overlapping of infrared and visible
foreground pixels, the matched keypoints of each local shape polygon are stored
temporally in a buffer for a few number of frames. The matrix is evaluated at
each frame using the temporal buffer and the best matrix is selected, based on
an overlapping ratio criterion. Our experimental results demonstrate that this
method can provide highly accurate registered images and that we outperform a
previous related method.
","[{""version"":""v1"",""created"":""Mon, 17 Mar 2014 19:58:14 GMT""}]","2014-03-18"
"1403.4233","Vijay Pal Singh","Vijay Pal Singh and Ludwig Mathey","Noise correlations of two-dimensional Bose gases","10 pages, 11 figures","Phys. Rev. A 89, 053612 (2014)","10.1103/PhysRevA.89.053612",,"cond-mat.quant-gas quant-ph","http://arxiv.org/licenses/nonexclusive-distrib/1.0/","  We analyze density-density correlations of expanding clouds of weakly
interacting two-dimensional Bose gases below and above the
Berezinskii-Kosterlitz-Thouless transition, with particular focus on short-time
expansions. During time-of-flight expansion, phase fluctuations of the trapped
system translate into density fluctuations, in addition to the density
fluctuations that exist in in-situ. We calculate the correlations of these
fluctuations both in real space and in momentum space, and derive analytic
expressions in momentum space. Below the transition, the correlation functions
show an oscillatory behavior, controlled by the scaling exponent of the
quasi-condensed phase, due to constructive interference. We argue that this can
be used to extract the scaling exponent of the quasi-condensate experimentally.
Above the transition, the interference is rapidly suppressed when the atoms
travel an average distance beyond the correlation length. This can be used to
distinguish the two phases qualitatively.
","[{""version"":""v1"",""created"":""Mon, 17 Mar 2014 19:59:05 GMT""}]","2014-05-13"
"1403.4234","Mark Lemmon","Mark T. Lemmon, Michael J. Wolff, James F. Bell III, Michael D. Smith,
  Bruce A. Cantor, Peter H. Smith","Dust aerosol, clouds, and the atmospheric optical depth record over 5
  Mars years of the Mars Exploration Rover mission","60 pages, 12 figures, to be published in Icarus",,"10.1016/j.icarus.2014.03.029",,"astro-ph.EP physics.ao-ph","http://arxiv.org/licenses/nonexclusive-distrib/1.0/","  Dust aerosol plays a fundamental role in the behavior and evolution of the
Martian atmosphere. The first five Mars years of Mars Exploration Rover data
provide an unprecedented record of the dust load at two sites. This record is
useful for characterization of the atmosphere at the sites and as ground truth
for orbital observations. Atmospheric extinction optical depths have been
derived from solar images after calibration and correction for time-varying
dust that has accumulated on the camera windows. The record includes local,
regional, and globally extensive dust storms. Comparison with contemporaneous
thermal infrared data suggests significant variation in the size of the dust
aerosols, with a 1 {\mu}m effective radius during northern summer and a 2
{\mu}m effective radius at the onset of a dust lifting event. The solar
longitude (LS) 20-136{\deg} period is also characterized by the presence of
cirriform clouds at the Opportunity site, especially near LS=50 and 115{\deg}.
In addition to water ice clouds, a water ice haze may also be present, and
carbon dioxide clouds may be present early in the season. Variations in dust
opacity are important to the energy balance of each site, and work with
seasonal variations in insolation to control dust devil frequency at the Spirit
site.
","[{""version"":""v1"",""created"":""Mon, 17 Mar 2014 21:17:24 GMT""}]","2014-03-25"
"1403.4238","Guohui Wang","Guohui Wang, Yingen Xiong, Jay Yun, and Joseph R. Cavallaro","Computer Vision Accelerators for Mobile Systems based on OpenCL GPGPU
  Co-Processing","15 pages, 15 figures. Submitted and accepted for publication in
  Journal of Signal Processing Systems, 2014",,"10.1007/s11265-014-0878-z",,"cs.DC cs.CV cs.MS","http://arxiv.org/licenses/nonexclusive-distrib/1.0/","  In this paper, we present an OpenCL-based heterogeneous implementation of a
computer vision algorithm -- image inpainting-based object removal algorithm --
on mobile devices. To take advantage of the computation power of the mobile
processor, the algorithm workflow is partitioned between the CPU and the GPU
based on the profiling results on mobile devices, so that the
computationally-intensive kernels are accelerated by the mobile GPGPU
(general-purpose computing using graphics processing units). By exploring the
implementation trade-offs and utilizing the proposed optimization strategies at
different levels including algorithm optimization, parallelism optimization,
and memory access optimization, we significantly speed up the algorithm with
the CPU-GPU heterogeneous implementation, while preserving the quality of the
output images. Experimental results show that heterogeneous computing based on
GPGPU co-processing can significantly speed up the computer vision algorithms
and makes them practical on real-world mobile devices.
","[{""version"":""v1"",""created"":""Mon, 17 Mar 2014 18:26:41 GMT""}]","2014-03-19"
"1403.4239","Francisco Fernandez Dr.","Paolo Amore, Francisco M. Fern\'andez, Javier Garcia","On the eigenvalues of some non-Hermitian Hamiltonians with space-time
  symmetry",,,,,"quant-ph","http://arxiv.org/licenses/nonexclusive-distrib/1.0/","  We calculate the eigenvalues of some two-dimensional non-Hermitian
Hamiltonians by means of a pseudospectral method and straightforward
diagonalization of the Hamiltonian matrix in a suitable basis set. Both sets of
results agree remarkably well but differ considerably from the eigenvalues
obtained some time ago by other authors. In particular, we do not observe the
multiple phase transitions claimed to occur in one of the anharmonic
oscillators.
","[{""version"":""v1"",""created"":""Mon, 17 Mar 2014 19:33:38 GMT""}]","2014-03-19"
"1403.4240","Jon Mauerhan","Jon C. Mauerhan, G. Grant Williams, Nathan Smith, Paul S. Smith,
  Alexei V. Filippenko, Jennifer L. Hoffman, Douglas C. Leonard, Peter Milne,
  Kelsey I. Clubb, Ori D. Fox, and Patrick L. Kelly","Multi-epoch spectropolarimetry of SN 2009ip: direct evidence for
  aspherical circumstellar material","Accepted to MNRAS 2014 Apr 7. Accepted version. 15 pages, 10 figures","2014, MNRAS, 442, 1166","10.1093/mnras/stu730",,"astro-ph.SR astro-ph.GA","http://arxiv.org/licenses/nonexclusive-distrib/1.0/","  We present spectropolarimetry of SN 2009ip throughout the evolution of its
2012 explosion. During the initial 2012a phase, when the source spectrum
exhibits broad P-Cygni lines, we measure a V-band polarization of P~0.9% at a
position angle of ~166 deg, indicating substantial asphericity for the 2012a
outflow. Near the subsequent peak of the 2012b phase, when the spectrum shows
signs of intense interaction with circumstellar material (CSM), we measure
P~1.7% at a position angle of 72 deg, indicating a separate physical component
of polarization, which has a higher degree of asphericity than the 2012a
outflow and an orthogonal axis of symmetry on the sky. Around 30 days past
peak, which is coincident with a bump in the declining light curve, we measure
P~0.7% and significant variations in P across some broad lines, particularly
HeI/NaI. By 60 days past peak the source appears to be approaching a low value
of interstellar polarization (P<0.2%). The results are consistent with a
scenario in which a potentially bipolar explosion during 2012a impacts a
toroidal distribution of CSM, thereby causing the 2012b brightening.
Orthogonality between the 2012a and 2012b geometries is inconsistent with the
hypothesis that the 2012a event launched the CSM that was hit 40 days later by
material from the 2012b event. Rather, the aspherical CSM probably has a
separate origin associated with the outbursts of the stellar progenitor during
prior years. Previous calculations that assumed spherical symmetry for the CSM
have underestimated the required explosion energy, as the results suggest that
<10% of the fast SN ejecta participated in strong CSM interaction during the
2012b phase. In light of the spectropolarimetric results, a kinetic energy of
1e51 erg for the ejecta is difficult to avoid, supporting the interpretation
that the 2012 outburst was the result of a core-collapse supernova explosion
(abridged)
","[{""version"":""v1"",""created"":""Mon, 17 Mar 2014 20:00:00 GMT""},{""version"":""v2"",""created"":""Wed, 19 Mar 2014 21:07:47 GMT""},{""version"":""v3"",""created"":""Mon, 15 Dec 2014 23:18:00 GMT""}]","2015-06-19"
"1403.4241","Andrew Gould","Andrew Gould (OSU)","WFIRST Ultra-Precise Astrometry I: Kuiper Belt Objects","13 pages, 4 figures. Submitted to the Journal of the Korean
  Astronomical Society",,"10.5303/JKAS.2014.47.6.279",,"astro-ph.EP","http://arxiv.org/licenses/nonexclusive-distrib/1.0/","  I show that the WFIRST microlensing survey will enable detection and
precision orbit determination of Kuiper Belt Objects (KBOs) down to H_=28.2
over an effective area of about 17 sq.deg. Typical fractional period errors
will be about 1.5% x 10^(0.4(H-28.2)) with similar errors in other parameters
for roughly 5000 KBOs. Binary companions to detected KBOs can be detected to
even fainter limits, H_vega=29, corresponding to $R\sim 30.5$ and effective
diameters D~7 km. For KBOs H~23, binary companions can be found with
separations down to 10 mas. This will provide an unprecedented probe of orbital
resonance and KBO mass measurements. More than a thousand stellar occultations
by KBOs can be combined to determine the mean size as a function of KBO
magnitude down to H~25. Current ground-based microlensing surveys can make a
significant start on finding and characterizing KBOs using existing and
soon-to-be-acquired data.
","[{""version"":""v1"",""created"":""Mon, 17 Mar 2014 20:00:01 GMT""},{""version"":""v2"",""created"":""Sat, 2 Aug 2014 16:09:39 GMT""}]","2015-06-19"
"1403.4242","M\'arton Kan\'asz-Nagy","M\'arton Kan\'asz-Nagy, Bal\'azs D\'ora, Eugene A. Demler and Gergely
  Zar\'and","Stabilizing the false vacuum: Mott skyrmions","11 pages, 6 figures","Scientific Reports 5, 7692 (2015)","10.1038/srep07692",,"cond-mat.quant-gas physics.atom-ph quant-ph","http://arxiv.org/licenses/nonexclusive-distrib/1.0/","  Topological excitations keep fascinating physicists since many decades. While
individual vortices and solitons emerge and have been observed in many areas of
physics, their most intriguing higher dimensional topological relatives,
skyrmions (smooth, topologically stable textures) and magnetic monopoles --
emerging almost necessarily in any grand unified theory and responsible for
charge quantization -- remained mostly elusive. Here we propose that loading a
three-component nematic superfluid such as $^{23}$Na into a deep optical
lattice and thereby creating an insulating core, one can create topologically
stable skyrmion textures and investigate their properties in detail. We show
furthermore that the spectrum of the excitations of the superfluid and their
quantum numbers change dramatically in the presence of the skyrmion, and they
reflect the presence of a trapped monopole, as imposed by the skyrmion's
topology.
","[{""version"":""v1"",""created"":""Mon, 17 Mar 2014 20:00:06 GMT""}]","2015-01-29"
"1403.4243","Satadru Bag","Satadru Bag, Varun Sahni, Yuri Shtanov and Sanil Unnikrishnan","Emergent Cosmology Revisited","Matches published version. Includes clarifications, an additional
  figure and updated references. Main results unchanged","JCAP 07 (2014) 034","10.1088/1475-7516/2014/07/034",,"astro-ph.CO gr-qc hep-ph","http://arxiv.org/licenses/nonexclusive-distrib/1.0/","  We explore the possibility of emergent cosmology using the effective
potential formalism. We discover new models of emergent cosmology which satisfy
the constraints posed by the cosmic microwave background (CMB). We demonstrate
that, within the framework of modified gravity, the emergent scenario can arise
in a universe which is spatially open/closed. By contrast, in general
relativity (GR) emergent cosmology arises from a spatially closed past-eternal
Einstein Static Universe (ESU). In GR the ESU is unstable, which creates fine
tuning problems for emergent cosmology. However, modified gravity models
including Braneworld models, Loop Quantum Cosmology (LQC) and Asymptotically
Free Gravity result in a stable ESU. Consequently, in these models emergent
cosmology arises from a larger class of initial conditions including those in
which the universe eternally oscillates about the ESU fixed point. We
demonstrate that such an oscillating universe is necessarily accompanied by
graviton production. For a large region in parameter space graviton production
is enhanced through a parametric resonance, casting serious doubts as to
whether this emergent scenario can be past-eternal.
","[{""version"":""v1"",""created"":""Mon, 17 Mar 2014 20:00:13 GMT""},{""version"":""v2"",""created"":""Fri, 21 Mar 2014 17:33:58 GMT""},{""version"":""v3"",""created"":""Thu, 17 Jul 2014 18:18:53 GMT""}]","2014-07-18"
"1403.4244","Jeffrey Fung","Jeffrey Fung and Pawel Artymowicz","Irradiation Instability at the Inner Edges of Accretion Disks","Accepted to Apj","The Astrophysical Journal, Volume 790, Issue 1, article id. 78, 11
  pp. (2014)","10.1088/0004-637X/790/1/78",,"astro-ph.EP","http://arxiv.org/licenses/nonexclusive-distrib/1.0/","  An instability can potentially operate in highly irradiated disks where the
disk sharply transitions from being radially transparent to opaque (the
'transition region'). Such conditions may exist at the inner edges of
transitional disks around T Tauri stars and accretion disks around AGNs. We
derive the criterion for this instability, which we term the 'irradiation
instability', or IRI. We also present the linear growth rate as a function of
beta, the ratio between radiation force and gravity, and c_s, the sound speed
of the disk, obtained using two methods: a semi-analytic analysis of the
linearized equations and a numerical simulation using the GPU-accelerated
hydrodynamical code PEnGUIn. In particular, we find that IRI occurs at beta~0.1
if the transition region extends as wide as ~0.05r, and at higher beta values
if it is wider. This threshold value applies to c_s ranging from 3% of the
Keplerian orbital speed to 5%, and becomes higher if c_s is lower. Furthermore,
in the nonlinear evolution of the instability, disks with a large beta and
small c_s exhibit 'clumping', extreme local surface density enhancements that
can reach over ten times the initial disk surface density.
","[{""version"":""v1"",""created"":""Mon, 17 Mar 2014 20:00:24 GMT""},{""version"":""v2"",""created"":""Tue, 1 Jul 2014 12:40:54 GMT""}]","2015-05-13"
"1403.4245","Nick Gnedin","Nickolay Y. Gnedin","Cosmic Reionization On Computers I. Design and Calibration of
  Simulations","Replaced with the final, accepted for publication in ApJ version",,"10.1088/0004-637X/793/1/29",,"astro-ph.CO","http://arxiv.org/licenses/nonexclusive-distrib/1.0/","  Cosmic Reionization On Computers (CROC) is a long-term program of numerical
simulations of cosmic reionization. Its goal is to model fully
self-consistently (albeit not necessarily from the first principles) all
relevant physics, from radiative transfer to gas dynamics and star formation,
in simulation volumes of up to 100 comoving Mpc, and with spatial resolution
approaching 100 pc in physical units. In this method paper we describe our
numerical method, the design of simulations, and the calibration of numerical
parameters. Using several sets (ensembles) of simulations in 20 Mpc/h and 40
Mpc/h boxes with spatial resolution reaching 125 pc at z=6, we are able to
match the observed galaxy UV luminosity functions at all redshifts between 6
and 10, as well as obtain reasonable agreement with the observational
measurements of the Gunn-Peterson optical depth at z<6.
","[{""version"":""v1"",""created"":""Mon, 17 Mar 2014 20:00:25 GMT""},{""version"":""v2"",""created"":""Mon, 28 Jul 2014 17:20:51 GMT""}]","2015-06-19"
"1403.4246","Brendan Miller","Brendan P. Miller, Elena Gallo, Jenny E. Greene, Brandon C. Kelly,
  Tommaso Treu, Jong-Hak Woo, Vivienne Baldassare","X-ray constraints on the local supermassive black hole occupation
  fraction","Changes from v1: slightly improved galaxy distances (analysis rerun
  with nearly identical results), added table with sample properties, expanded
  discussion of methodology, updated references. Resubmitted to ApJ",,"10.1088/0004-637X/799/1/98",,"astro-ph.GA astro-ph.CO","http://arxiv.org/licenses/nonexclusive-distrib/1.0/","  Distinct seed formation mechanisms are imprinted upon the fraction of dwarf
galaxies currently containing a central supermassive black hole. Seeding by Pop
III remnants is expected to produce a higher occupation fraction than is
generated with direct gas collapse precursors. Chandra observations of nearby
early-type galaxies can directly detect even low-level supermassive black hole
activity, and the active fraction immediately provides a firm lower limit to
the occupation fraction. Here, we use the volume-limited AMUSE surveys of ~200
optically-selected early-type galaxies to characterize simultaneously, for the
first time, the occupation fraction and the scaling of nuclear X-ray luminosity
with stellar mass, accounting for intrinsic scatter, measurement uncertainties,
and X-ray limits. For early-type galaxies with log(M_star/M_sun)<10, we obtain
a lower limit to the occupation fraction of >20% (at 95% confidence), but full
occupation cannot be excluded. The preferred dependence of log(L_X) upon
log(M_star) has a slope of about 0.7-0.8, consistent with the ""downsizing""
trend previously identified from the AMUSE dataset, and a uniform Eddington
efficiency is disfavored at ~2 sigma. We provide guidelines for the future
precision with which these parameters may be refined with larger or more
sensitive samples.
","[{""version"":""v1"",""created"":""Mon, 17 Mar 2014 20:00:25 GMT""},{""version"":""v2"",""created"":""Thu, 23 Oct 2014 16:28:07 GMT""}]","2015-06-19"
"1403.4247","William Langer","W. D. Langer, J. L. Pineda, and T. Velusamy","The scale height of gas traced by [CII] in the Galactic plane","7 pages, 5 figures, accepted for publication in A&A",,"10.1051/0004-6361/201323281",,"astro-ph.GA","http://arxiv.org/licenses/nonexclusive-distrib/1.0/","  The distribution of various interstellar gas components and the pressure in
the interstellar medium (ISM) is a result of the interplay of different
dynamical mechanisms and energy sources on the gas in the Milky Way. The scale
heights of the different gas tracers, such as HI and CO, are a measure of these
processes. The scale height of [CII] emission in the Galactic plane is
important for understanding those ISM components not traced by CO or HI. We
determine the average distribution of [CII] perpendicular to the plane in the
inner Galactic disk and compare it to the distributions of other key gas
tracers, such as CO and HI. We calculated the vertical, z, distribution of
[CII] in the inner Galactic disk by adopting a model for the emission that
combines the latitudinal, b, spectrally unresolved BICE survey, with the
spectrally resolved $Herschel$ Galactic plane survey of [CII] at b = 0 deg. Our
model assumed a Gaussian emissivity distribution vertical to the plane, and
related the distribution in z to that of the latitude b using the spectrally
resolved [CII] Herschel survey as the boundary solution for the emissivity at
b=0 deg. We find that the distribution of [CII] perpendicular to the plane has
a full-width half-maximum of 172 pc, larger than that of CO, which averages
~110 pc in the inner Galaxy, but smaller than that of HI, ~230 pc, and is
offset by -28 pc. We explain the difference in distributions of [CII], CO, and
HI as due to [CII] tracing a mix of ISM components. Models of hydrostatic
equilibrium of clouds in the disk predict different scale heights, for the same
interstellar pressure. The diffuse molecular clouds with [CII] but no CO
emission likely have a scale height intermediate between the low density atomic
hydrogen HI clouds and the dense CO molecular clouds.
","[{""version"":""v1"",""created"":""Mon, 17 Mar 2014 20:00:25 GMT""}]","2015-06-19"
"1403.4248","Philip Phillips","Kridsanaphong Limtragool and Philip W. Phillips","Divergent Thermopower without a Quantum Phase Transition","4.5 pages, 5 figures. An internal footnote is added regarding how the
  thermopower can be uniquely defined for the models treated here","Phys. Rev. Lett. 113, 086405 (2014)","10.1103/PhysRevLett.113.086405",,"cond-mat.str-el","http://arxiv.org/licenses/nonexclusive-distrib/1.0/","  A general principle of modern statistical physics is that divergences of
either thermodynamic or transport properties are only possible if the
correlation length diverges. We show by explicit calculation that the
thermopower in the quantum XY model $d=1+1$ and the Kitaev model in $d=2+1$ can
1) diverge even when the correlation length is finite and 2) remain finite even
when the correlation length diverges, thereby providing a counterexample to the
standard paradigm.Two conditions are necessary: 1) the sign of the charge
carriers and that of the group velocity must be uncorrelated and 2) the current
operator defined formally as the derivative of the Hamiltonian with respect to
the gauge field does not describe a set of excitations that have a particle
interpretation, as in strongly correlated electron matter. The recent
experimental\cite{2dtp} and theoretical\cite{kirkpatrick} findings on the
divergent thermopower of a 2D electron gas are discussed in this context.
","[{""version"":""v1"",""created"":""Mon, 17 Mar 2014 20:00:25 GMT""},{""version"":""v2"",""created"":""Thu, 27 Mar 2014 23:19:48 GMT""},{""version"":""v3"",""created"":""Tue, 29 Apr 2014 16:16:40 GMT""}]","2014-08-27"
"1403.4249","Brian McNamara","B. R. McNamara, H.R. Russell, P. E. J. Nulsen, A. C. Edge, N. W.
  Murray, R. A. Main, A. N. Vantyghem, F. Combes, A. C. Fabian, P. Salome, C.C.
  Kirkpatrick, S. A. Baum, J. N. Bregman, M. Donahue, E. Egami, S. Hamer, C. P.
  O'Dea, J.B.R. Oonk, G. Tremblay, G.M. Voit","A $10^{10}$ Solar Mass Flow of Molecular Gas in the Abell 1835 Brightest
  Cluster Galaxy","To appear in ApJ -- expanded discussion of inflow/outflow added to
  submitted version",,,,"astro-ph.GA","http://arxiv.org/licenses/nonexclusive-distrib/1.0/","  We report ALMA Early Science observations of the Abell 1835 brightest cluster
galaxy (BCG) in the CO (3-2) and CO (1-0) emission lines. We detect $5\times
10^{10}~\rm M_\odot$ of molecular gas within 10 kpc of the BCG. Its ensemble
velocity profile width of $\sim 130 ~\rm km~s^{-1}$ FWHM is too narrow for the
molecular cloud sto be supported in the galaxy by dynamic pressure. The gas may
instead be supported in a rotating, turbulent disk oriented nearly face-on.
Roughly $10^{10}~\rm M_\odot$ of molecular gas is projected $3-10 ~\rm kpc$ to
the north-west and to the east of the nucleus with line of sight velocities
lying between $-250 ~\rm km~s^{-1}$ to $+480 ~\rm km~s^{-1}$ with respect to
the systemic velocity. The high velocity gas may be either inflowing or
outflowing. However, the absence of high velocity gas toward the nucleus that
would be expected in a steady inflow, and its bipolar distribution on either
side of the nucleus, are more naturally explained as outflow. Star formation
and radiation from the AGN are both incapable of driving an outflow of this
magnitude. If so, the molecular outflow may be associated a hot outflow on
larger scales reported by Kirkpatrick and colleagues. The molecular gas flow
rate of approximately $200~\rm M_\odot ~yr^{-1}$ is comparable to the star
formation rate of $100-180~\rm M_\odot ~yr^{-1}$ in the central disk. How radio
bubbles would lift dense molecular gas in their updrafts, how much gas will be
lost to the BCG, and how much will return to fuel future star formation and AGN
activity are poorly understood. Our results imply that radio-mechanical (radio
mode) feedback not only heats hot atmospheres surrounding elliptical galaxies
and BCGs, it is able to sweep higher density molecular gas away from their
centers.
","[{""version"":""v1"",""created"":""Mon, 17 Mar 2014 20:00:26 GMT""}]","2014-03-19"
