"1403.4318","Fayin Wang","J. S. Wang, F. Y. Wang (NJU)","Cosmological model of the interaction between dark matter and dark
  energy","6 pages, 6 figures, published in A&A","2014,A&A, 564, A137","10.1051/0004-6361/201322606",,"astro-ph.CO","http://arxiv.org/licenses/nonexclusive-distrib/1.0/","  In this paper, we test the dark matter-dark energy interacting cosmological
model with a dynamic equation of state $w_{DE}(z)=w_{0}+w_{1}z/(1+z)$, using
type Ia supernovae (SNe Ia), Hubble parameter data, baryonic acoustic
oscillation (BAO) measurements, and the cosmic microwave background (CMB)
observation. This interacting cosmological model has not been studied before.
The best-fitted parameters with $1 \sigma$ uncertainties are $\delta=-0.022 \pm
0.006$, $\Omega_{DM}^{0}=0.213 \pm 0.008$, $w_0 =-1.210 \pm 0.033$ and
$w_1=0.872 \pm 0.072$ with $\chi^2_{min}/dof = 0.990$. At the $1 \sigma$
confidence level, we find $\delta<0$, which means that the energy transfer
prefers from dark matter to dark energy. We also find that the SNe Ia are in
tension with the combination of CMB, BAO and Hubble parameter data. The
evolution of $\rho_{DM}/\rho_{DE}$ indicates that this interacting model is a
good approach to solve the coincidence problem, because the $\rho_{DE}$
decrease with scale factor $a$. The transition redshift is $z_{tr}=0.63 \pm
0.07$ in this model.
","[{""version"":""v1"",""created"":""Tue, 18 Mar 2014 02:24:36 GMT""},{""version"":""v2"",""created"":""Wed, 15 Apr 2015 02:15:50 GMT""}]","2015-04-16"
"1403.4319","Michel Pleimling","Shahir Mowlaei, Ahmed Roman, and Michel Pleimling","Spirals and coarsening patterns in the competition of many species: A
  complex Ginzburg-Landau approach","22 pages, 5 figures, accepted for publication in the Journal of
  Physics A","J. Phys. A: Math. Theor. 47 (2014) 165001","10.1088/1751-8113/47/16/165001",,"q-bio.PE cond-mat.stat-mech","http://arxiv.org/licenses/nonexclusive-distrib/1.0/","  In order to model real ecological systems one has to consider many species
that interact in complex ways. However, most of the recent theoretical studies
have been restricted to few species systems with rather trivial interactions.
The few studies dealing with larger number of species and/or more complex
interaction schemes are mostly restricted to numerical explorations. In this
paper we determine, starting from the deterministic mean-field rate equations,
for large classes of systems the space of coexistence fixed points at which
biodiversity is maximal. For systems with a single coexistence fixed point we
derive complex Ginzburg-Landau equations that allow to describe space-time
pattern realized in two space dimensions. For selected cases we compare the
theoretical predictions with the pattern observed in numerical simulations.
","[{""version"":""v1"",""created"":""Tue, 18 Mar 2014 02:27:54 GMT""}]","2014-04-11"
"1403.4320","Matthew Ando","Matthew Ando, Andrew J. Blumberg, David Gepner, Michael J. Hopkins,
  and Charles Rezk","Units of ring spectra, orientations, and Thom spectra via rigid infinite
  loop space theory","arXiv admin note: substantial text overlap with arXiv:0810.4535",,"10.1112/jtopol/jtu009",,"math.AT","http://arxiv.org/licenses/nonexclusive-distrib/1.0/","  We extend the theory of Thom spectra and the associated obstruction theory
for orientations in order to support the construction of the string orientation
of tmf, the spectrum of topological modular forms. We also develop the
analogous theory of Thom spectra and orientations for associative ring spectra.
Our work is based on a new model of the Thom spectrum as a derived smash
product. An earlier version of this paper was part of arXiv:0810.4535.
","[{""version"":""v1"",""created"":""Tue, 18 Mar 2014 02:32:54 GMT""}]","2017-05-17"
"1403.4321","Naftaly Minsky","Naftaly Minsky","Dependable Management of Untrusted Distributed Systems",,,,,"cs.DC","http://arxiv.org/licenses/nonexclusive-distrib/1.0/","  The conventional approach to the online management of distributed
systems---represented by such standards as SNMP for network management, and
WSDM for systems based on service oriented computing (SOC)---relies on the
components of the managed system to cooperate in the management process, by
providing the managers with the means to monitor their state and activities,
and to control their behavior. Unfortunately, the trust thus placed in the
cooperation of the managed components is unwarranted for many types of
systems---such as systems based on SOA---making the conventional management of
such systems unreliable and insecure.
  This paper introduces a radically new approach to the management of
distributed systems, called governance-based management (GBM), which is based
on a middleware that can govern the exchange of messages between system
components. GBM has a substantial ability to manage distributed systems, in a
reliable and secure manner, even without any trustworthy cooperation of the
managed components.
  And it can fully incorporate the conventional management techniques wherever
such cooperation can be trusted. GBM also supports a reflexive mode of
management, which manages the management process itself, making it safer.
However, GBM is still a work in progress, as it raises several open problems
that needs to be addressed before this management technique can be put to
practice.
","[{""version"":""v1"",""created"":""Tue, 18 Mar 2014 02:35:30 GMT""}]","2014-03-19"
"1403.4322","Walter Loveland","R. Yanez, W. Loveland, L. Yao, J.s. Barrett, S. Zhu, B.B. Back, T.L.
  Khoo, M. Alcorta, and M. Albers","Measurement of the Survival Probabilities for Hot Fusion Reactions",,,"10.1103/PhysRevLett.112.152702",,"nucl-ex","http://arxiv.org/licenses/nonexclusive-distrib/1.0/","  We have studied the fission-neutron emission competition in highly excited
$^{274}$Hs (Z=108) (where the fission barrier is due to shell effects) formed
by a hot fusion reaction. Matching cross bombardments ($^{26}$Mg + $^{248}$Cm
and $^{25}$Mg + $^{248}$Cm) were used to identify the properties of first
chance fission of $^{274}$Hs. A Harding-Farley analysis of the fission neutrons
emitted in the $^{25,26}$Mg + $^{248}$Cm was performed to identify the pre- and
post-scission components of the neutron multiplicities in each system.
($\Gamma$$_{n}$/$\Gamma$$_{t}$) for the first chance fission of $^{274}$Hs
(E$^{\ast}$ = 63 MeV) is 0.89 $\pm$ 0.13, i.e., $\sim$ 90 $%$ of the highly
excited nuclei survive.The high value of that survival probability is due to
dissipative effects during de-excitation. A proper description of the survival
probabilities of excited superheavy nuclei formed in hot fusion reactions
requires consideration of both dynamic and static (shell-related) effects.
","[{""version"":""v1"",""created"":""Tue, 18 Mar 2014 02:36:34 GMT""}]","2015-06-19"
"1403.4323","Zhenyu Li","Ping Wu, Xiaofang Zhai, Zhenyu Li, Jinlong Yang","Bilayer Graphene Growth via a Penetration Mechanism","J. Phys. Chem. C accepted",,"10.1021/jp4108156",,"cond-mat.mtrl-sci physics.chem-ph","http://arxiv.org/licenses/nonexclusive-distrib/1.0/","  From both fundamental and technical points of view, a precise control of the
layer number of graphene samples is very important. To reach this goal, atomic
scale mechanisms of multilayer graphene growth on metal surfaces should be
understood. Although it is a geometrically favorable pathway to transport
carbon species to interface and then form a new graphene layer there,
penetration of a graphene overlayer is not a chemically straightforward
process. In this study, the possibility of different active species to
penetrate a graphene overlayer on Cu(111) surface is investigated based on
first principles calculations. It is found that carbon atom penetration can be
realized via an atom exchange process, which leads to a new graphene growth
mechanism. Based on this result, a bilayer graphene growth protocol is proposed
to obtain high quality samples. Such a penetration possibility also provides a
great flexibility for designed growth of graphene nanostructures.
","[{""version"":""v1"",""created"":""Tue, 18 Mar 2014 02:44:07 GMT""}]","2014-03-19"
"1403.4324","Aidan Sims","David Pask, Adam Sierakowski and Aidan Sims","Twisted k-graph algebras associated to Bratteli diagrams","28 pages, pictures prepared using tikz",,,,"math.OA","http://arxiv.org/licenses/nonexclusive-distrib/1.0/","  Given a system of coverings of k-graphs, we show that the cohomology of the
resulting (k+1)-graph is isomorphic to that of any one of the k-graphs in the
system. We then consider Bratteli diagrams of 2-graphs whose twisted
C*-algebras are matrix algebras over noncommutative tori. For such systems we
calculate the ordered K-theory and the gauge-invariant semifinite traces of the
resulting 3-graph C*-algebras. We deduce that every simple C*-algebra of this
form is Morita equivalent to the C*-algebra of a rank-2 Bratteli diagram in the
sense of Pask-Raeburn-R{\o}rdam-Sims.
","[{""version"":""v1"",""created"":""Tue, 18 Mar 2014 02:47:21 GMT""}]","2014-03-19"
"1403.4325","Matthew Ando","Matthew Ando, Andrew J. Blumberg, David Gepner, Michael J. Hopkins,
  and Charles Rezk","An $\infty$-categorical approach to $R$-line bundles, $R$-module Thom
  spectra, and twisted $R$-homology","arXiv admin note: substantial text overlap with arXiv:0810.4535",,"10.1112/jtopol/jtt035",,"math.AT","http://arxiv.org/licenses/nonexclusive-distrib/1.0/","  We develop a generalization of the theory of Thom spectra using the language
of infinity categories. This treatment exposes the conceptual underpinnings of
the Thom spectrum functor: we use a new model of parametrized spectra, and our
definition is motivated by the geometric definition of Thom spectra of
May-Sigurdsson. For an associative ring spectrum $R$, we associate a Thom
spectrum to a map of infinity categories from the infinity groupoid of a space
$X$ to the infinity category of free rank one $R$-modules, which we show is a
model for $BGL_1 R$; we show that $BGL_1 R$ classifies homotopy sheaves of rank
one $R$-modules, which we call $R$-line bundles. We use our $R$-module Thom
spectrum to define the twisted $R$-homology and cohomology of an $R$-line
bundle over a space $X$, classified by a map from $X$ to $BGL_1 R$, and we
recover the generalized theory of orientations in this context. In order to
compare this approach to the classical theory, we characterize the Thom
spectrum functor axiomatically, from the perspective of Morita theory. An
earlier version of this paper was part of arXiv:0810.4535.
","[{""version"":""v1"",""created"":""Tue, 18 Mar 2014 02:53:21 GMT""}]","2014-03-19"
"1403.4326","Jin-Wu Jiang","Jin-Wu Jiang and Harold S. Park","Negative Poisson's Ratio in Single-Layer Black Phosphorus","Nature Communications, accepted","Nature Communications 5, 4727 (2014)","10.1038/ncomms5727",,"cond-mat.mtrl-sci","http://arxiv.org/licenses/nonexclusive-distrib/1.0/","  The Poisson's ratio is a fundamental mechanical property that relates the
resulting lateral strain to applied axial strain. While this value can
theoretically be negative, it is positive for nearly all materials, though
negative values have been observed in so-called auxetic structures. However,
nearly all auxetic materials are bulk materials whose microstructure has been
specifically engineered to generate a negative Poisson's ratio. In the present
work, we report using first principles calculations the existence of a negative
Poisson's ratio in a single-layer, two-dimensional material, black phosphorus.
In contrast to engineered bulk auxetics, this behavior is intrinsic for single
layer black phosphorus, and originates from its unique, puckered structure,
where the pucker can be regarded as a re-entrant structure that is comprised of
two coupled orthogonal hinges. As a result of this atomic structure, a negative
Poisson's ratio is observed in the out-of-plane direction under uniaxial
deformation in the direction parallel to the pucker, with the Poisson's ratio
becoming increasingly negative with both increased tension and compression. The
puckered structure also results in highly anisotropic in-plane Poisson's
ratios, which are found to be 0.4 in the direction perpendicular and 1.28 in
the direction parallel to the pucker.
","[{""version"":""v1"",""created"":""Tue, 18 Mar 2014 03:01:58 GMT""},{""version"":""v2"",""created"":""Sat, 2 Aug 2014 23:26:24 GMT""}]","2014-08-19"
"1403.4327","Jin-Wu Jiang","Jin-Wu Jiang","Phonon Bandgap Engineering of Strained Monolayer MoS2","Nanoscale, published","Nanoscale, 6, 8326 (2014)","10.1039/c4nr00279b",,"cond-mat.mtrl-sci","http://arxiv.org/licenses/nonexclusive-distrib/1.0/","  The phonon band structure of monolayer MoS2 is characteristic for a large
energy gap between acoustic and optical branches, which protects the vibration
of acoustic modes from being scattered by optical phonon modes. Therefore, the
phonon bandgap engineering is of practical significance for the manipulation of
phonon-related mechanical or thermal properties in monolayer MoS2. We perform
both phonon analysis and molecular dynamics simulations to investigate the
tension effect on the phonon bandgap and the compression induced instability of
the monolayer MoS2. Our key finding is that the phonon bandgap can be narrowed
by the uniaxial tension, and is completely closed at epsilon=0.145; while the
biaxial tension only has limited effect on the phonon bandgap. We also
demonstrate the compression induced buckling for the monolayer MoS2. The
critical strain for buckling is extracted from the band structure analysis of
the flexure mode in the monolayer MoS2 and is further verified by molecular
dynamics simulations and the Euler buckling theory. Our study illustrates the
uniaxial tension as an efficient method for manipulating the phonon bandgap of
the monolayer MoS2, while the biaxial compression as a powerful tool to
intrigue buckling in the monolayer MoS2.
","[{""version"":""v1"",""created"":""Tue, 18 Mar 2014 03:06:46 GMT""},{""version"":""v2"",""created"":""Mon, 5 May 2014 06:07:07 GMT""},{""version"":""v3"",""created"":""Sat, 2 Aug 2014 23:16:33 GMT""}]","2014-08-05"
"1403.4328","Chao-Jun Feng","Chao-Jun Feng, Xin-Zhou Li and Li-Yan Liu","Bifurcation and Global Dynamical Behavior of the $f(T)$ Theory","17pages, 9figures","Modern Physics Letters A, Volume 29, Issue 07, 7 March 2014","10.1142/S0217732314500333",,"astro-ph.CO hep-th","http://arxiv.org/licenses/nonexclusive-distrib/1.0/","  Usually, in order to investigate the evolution of a theory, one may find the
critical points of the system and then perform perturbations around these
critical points to see whether they are stable or not. This local method is
very useful when the initial values of the dynamical variables are not far away
from the critical points. Essentially, the nonlinear effects are totally
neglected in such kind of approach. Therefore, one can not tell whether the
dynamical system will evolute to the stable critical points or not when the
initial values of the variables do not close enough to these critical points.
Furthermore, when there are two or more stable critical points in the system,
local analysis can not provide the informations that which one the system will
finally evolute to. In this paper, we have further developed the nullcline
method to study the bifurcation phenomenon and global dynamical behaviour of
the $f(T)$ theory. We overcome the shortcoming of local analysis. And it is
very clear to see the evolution of the system under any initial conditions.
","[{""version"":""v1"",""created"":""Tue, 18 Mar 2014 03:10:01 GMT""}]","2014-03-19"
"1403.4329","Nikolai Dokuchaev","Alexandra Rodkina and Nikolai Dokuchaev","On asymptotic optimality of Merton's myopic portfolio strategies for
  discrete time market",,,,,"q-fin.PM math.OC","http://arxiv.org/licenses/nonexclusive-distrib/1.0/","  This paper studies the properties of discrete time stochastic optimal control
problems associated with portfolio selection. We investigate if optimal
continuous time strategies can be used effectively for a discrete time market
after a straightforward discretization. We found that Merton's strategy
approximates the performance of the optimal strategy in a discrete time model
with the sufficiently small time steps
","[{""version"":""v1"",""created"":""Tue, 18 Mar 2014 03:19:45 GMT""},{""version"":""v2"",""created"":""Tue, 25 Nov 2014 06:14:22 GMT""}]","2014-11-26"
"1403.4330","Takashi Tanaka","Takashi Tanaka, Pablo A. Parrilo","Optimal Output Feedback Architecture for Triangular LQG Problems","To be presented at 2014 American Control Conference",,,,"math.OC","http://arxiv.org/licenses/nonexclusive-distrib/1.0/","  Distributed control problems under some specific information constraints can
be formulated as (possibly infinite dimensional) convex optimization problems.
The underlying motivation of this work is to develop an understanding of the
optimal decision making architecture for such problems. In this paper, we
particularly focus on the N-player triangular LQG problems and show that the
optimal output feedback controllers have attractive state space realizations.
The optimal controller can be synthesized using a set of stabilizing solutions
to 2N linearly coupled algebraic Riccati equations, which turn out to be easily
solvable under reasonable assumptions.
","[{""version"":""v1"",""created"":""Tue, 18 Mar 2014 03:29:08 GMT""}]","2014-03-19"
"1403.4331","Yasuyuki Okumura","Yasuyuki Okumura, Jamieson Olsen, Tiehui Ted Liu and Hang Yin","Prototype performance studies of a Full Mesh ATCA-based General Purpose
  Data Processing Board","Proceedings for 2013 IEEE NSS/MIC conference",,,"FERMILAB-CONF-13-527-CMS-PPD","physics.ins-det hep-ex","http://arxiv.org/licenses/nonexclusive-distrib/1.0/","  High luminosity conditions at the LHC pose many unique challenges for
potential silicon based track trigger systems. One of the major challenges is
data formatting, where hits from thousands of silicon modules must first be
shared and organized into overlapping eta-phi trigger towers. Communication
between nodes requires high bandwidth, low latency, and flexible real time data
sharing, for which a full mesh backplane is a natural solution. A custom
Advanced Telecommunications Computing Architecture data processing board is
designed with the goal of creating a scalable architecture abundant in
flexible, non-blocking, high bandwidth board to board communication channels
while keeping the design as simple as possible. We have performed the first
prototype board testing and our first attempt at designing the prototype system
has proven to be successful. Leveraging the experience we gained through
designing, building and testing the prototype board system we are in the final
stages of laying out the next generation board, which will be used in the ATLAS
Level-2 Fast TracKer as Data Formatter, as well as in the CMS Level-1 tracking
trigger R&D for early technical demonstrations.
","[{""version"":""v1"",""created"":""Tue, 18 Mar 2014 03:39:42 GMT""}]","2016-11-15"
"1403.4332","Artyom Kovalevskii","Artyom Kovalevskii and Evgeny Shatalin","A limit process for a sequence of partial sums of residuals of a simple
  regression against order statistics with Markov-modulated noise",,,,,"math.PR","http://arxiv.org/licenses/nonexclusive-distrib/1.0/","  We consider a simple regression model where a regressor is composed of order
statistics and a noise is Markov-modulated. We introduce an empirical bridge of
regression residuals and prove its weak convergence to a centered Gaussian
process.
","[{""version"":""v1"",""created"":""Tue, 18 Mar 2014 03:43:11 GMT""},{""version"":""v2"",""created"":""Thu, 23 Oct 2014 15:31:47 GMT""}]","2014-10-24"
"1403.4333","Tsung-Yi Chen","Tsung-Yi Chen, Adam R. Williamson and Richard D. Wesel","Increasing Flash Memory Lifetime by Dynamic Voltage Allocation for
  Constant Mutual Information","5 pages. 5 figures",,,,"cs.IT math.IT","http://arxiv.org/licenses/nonexclusive-distrib/1.0/","  The read channel in Flash memory systems degrades over time because the
Fowler-Nordheim tunneling used to apply charge to the floating gate eventually
compromises the integrity of the cell because of tunnel oxide degradation.
While degradation is commonly measured in the number of program/erase cycles
experienced by a cell, the degradation is proportional to the number of
electrons forced into the floating gate and later released by the erasing
process. By managing the amount of charge written to the floating gate to
maintain a constant read-channel mutual information, Flash lifetime can be
extended. This paper proposes an overall system approach based on information
theory to extend the lifetime of a flash memory device. Using the instantaneous
storage capacity of a noisy flash memory channel, our approach allocates the
read voltage of flash cell dynamically as it wears out gradually over time. A
practical estimation of the instantaneous capacity is also proposed based on
soft information via multiple reads of the memory cells.
","[{""version"":""v1"",""created"":""Tue, 18 Mar 2014 03:43:25 GMT""}]","2014-03-19"
"1403.4334","Mehrtash Harandi","Mehrtash Harandi and Mathieu Salzmann and Fatih Porikli","Bregman Divergences for Infinite Dimensional Covariance Matrices","IEEE Conference on Computer Vision and Pattern Recognition (2014)",,,,"cs.CV","http://arxiv.org/licenses/nonexclusive-distrib/1.0/","  We introduce an approach to computing and comparing Covariance Descriptors
(CovDs) in infinite-dimensional spaces. CovDs have become increasingly popular
to address classification problems in computer vision. While CovDs offer some
robustness to measurement variations, they also throw away part of the
information contained in the original data by only retaining the second-order
statistics over the measurements. Here, we propose to overcome this limitation
by first mapping the original data to a high-dimensional Hilbert space, and
only then compute the CovDs. We show that several Bregman divergences can be
computed between the resulting CovDs in Hilbert space via the use of kernels.
We then exploit these divergences for classification purposes. Our experiments
demonstrate the benefits of our approach on several tasks, such as material and
texture recognition, person re-identification, and action recognition from
motion capture data.
","[{""version"":""v1"",""created"":""Tue, 18 Mar 2014 03:55:33 GMT""},{""version"":""v2"",""created"":""Wed, 19 Mar 2014 00:52:09 GMT""},{""version"":""v3"",""created"":""Wed, 11 Jun 2014 08:15:19 GMT""}]","2014-06-12"
"1403.4335","Jong Hwan Lee","Jong Hwan Lee, Myung Gyoon Lee","A New Optical Survey of Supernova Remnant Candidates in M31","55 pages, 23 figures, 6 tables, Accepted for publication in ApJ",,"10.1088/0004-637X/786/2/130",,"astro-ph.GA astro-ph.CO","http://arxiv.org/licenses/nonexclusive-distrib/1.0/","  We present a survey of optically emitting supernova remnants (SNRs) in M31
based on H$\alpha$ and [SII] images in the Local Group Survey. Using these
images, we select objects that have [SII]:H$\alpha$ $>$ 0.4 and circular
shapes. We find 76 new SNR candidates. We also inspect 234 SNR candidates
presented in previous studies, finding that only 80 of them are SNR candidates
according to our criteria. Combining them with the new candidates, we produce a
master catalog of 156 SNR candidates in M31. We classify these SNR candidates
according to two criteria: the SNR progenitor type [Type Ia and core-collapse
(CC) SNRs] and the morphological type. Type Ia and CC SNR candidates make up
23% and 77%, respectively, of the total sample. Most of the CC SNR candidates
are concentrated in the spiral arms, while the Type Ia SNR candidates are
rather distributed over the entire galaxy, including the inner region. The CC
SNR candidates are brighter in H$\alpha$ and [SII] than the Type Ia SNR
candidates. We derive a cumulative size distribution of the SNR candidates,
finding that the distribution of the candidates with 17 $< D <$ 50 pc is fitted
well by a power law with the power law index $\alpha = 2.53\pm0.04$. This
indicates that most of the SNR candidates identified in this study appear to be
in the Sedov-Taylor phase. The [SII]:H$\alpha$ distribution of the SNR
candidates is bimodal, with peaks at [SII]:H$\alpha$ $\sim$ 0.4 and $\sim$ 0.9.
The properties of these SNR candidates vary little with the galactocentric
distance. The H$\alpha$ and [SII] surface brightnesses show a good correlation
with the X-ray luminosity of the SNR candidates that are center-bright. The SNR
candidates with X-ray counterparts have higher surface brightnesses in
H$\alpha$ and [SII] and smaller sizes than those without such counterparts.
","[{""version"":""v1"",""created"":""Tue, 18 Mar 2014 04:04:42 GMT""}]","2015-06-19"
