"1411.2418","Silvestro di Luise","M. Calviani, S. Di Luise, V. Galymov, P. Velten","Optimization of neutrino fluxes for future long baseline neutrino
  oscillation experiments",,,,,"physics.ins-det hep-ex physics.acc-ph","http://arxiv.org/licenses/nonexclusive-distrib/1.0/","  One of the main goals of the Long Baseline Neutrino Oscillation experiment
(LBNO) experiment is to study the L/E behaviour of the electron neutrino
appearance probability in order to determine the unknown phase $\delta_{CP}$.
In the standard neutrino 3-flavour mixing paradigm, this parameter encapsulates
a possibility of a CP violation in the lepton sector that in turn could help
explain the matter-antimatter asymmetry in the universe. In LBNO, the
measurement of $\delta_{CP}$ would rely on the observation of the electron
appearance probability in a broad energy range covering the 1$^{st}$ and
2$^{nd}$ maxima of the oscillation probability. An optimization of the energy
spectrum of the neutrino beam is necessary to find the best coverage of the
neutrino energies of interest. This in general is a complex task that requires
exploring a large parameter space describing hadron target and beamline
focusing elements. In this paper we will present a numerical approach of
finding a solution to this difficult optimization problem often encountered in
design of modern neutrino beamlines and we will show the improved LBNO
sensitivity to the presence of the leptonic CP violation attained after the
neutrino beam optimization.
","[{""version"":""v1"",""created"":""Mon, 10 Nov 2014 13:27:53 GMT""}]","2014-11-11"
"1411.2419","Tom\'a\v{s} Hejda","Tom\'a\v{s} Hejda and Wolfgang Steiner","Beta-expansions of rational numbers in quadratic Pisot bases","12 pages, 3 figures, 2 tables","Acta Arithmetica 183 (2018) , 35-51","10.4064/aa8260-11-2017",,"math.DS cs.DM math.CO math.NT","http://arxiv.org/licenses/nonexclusive-distrib/1.0/","  We study rational numbers with purely periodic R\'enyi $\beta$-expansions.
For bases $\beta$ satisfying $\beta^2=a\beta+b$ with $b$ dividing $a$, we give
a necessary and sufficient condition for $\gamma(\beta)=1$, i.e., that all
rational numbers $p/q\in[0,1)$ with $\gcd(q,b)=1$ have a purely periodic
$\beta$-expansion. A simple algorithm for determining the value of
$\gamma(\beta)$ for all quadratic Pisot numbers $\beta$ is described.
","[{""version"":""v1"",""created"":""Mon, 10 Nov 2014 13:30:20 GMT""}]","2018-03-15"
"1411.2420","Maxim Gurevich","Maxim Gurevich","On a local conjecture of Jacquet, ladder representations and standard
  modules","21 pages, to appear in Mathematische Zeitschrift",,,,"math.RT","http://arxiv.org/licenses/nonexclusive-distrib/1.0/","  Let $E/F$ be a quadratic extension of p-adic fields. We prove that every
smooth irreducible ladder representation of the group $GL_n(E)$ which is
contragredient to its own Galois conjugate, possesses the expected distinction
properties relative to the subgroup $GL_n(F)$. This affirms a conjecture
attributed to Jacquet for a large class of representations. Along the way, we
prove a reformulation of the conjecture which concerns standard modules in
place of irreducible representations.
","[{""version"":""v1"",""created"":""Mon, 10 Nov 2014 13:36:10 GMT""},{""version"":""v2"",""created"":""Mon, 14 Sep 2015 07:30:44 GMT""}]","2015-09-15"
"1411.2421","Andres Greco","Andres Greco and Matias Bejas","Pseudogap in cuprates driven by d-wave flux-phase order proximity
  effects: A theoretical analysis from Raman and ARPES experiments","12 pages, 6 figures","J. Phys.: Condens. Matter 26, 485701 (2014)","10.1088/0953-8984/26/48/485701",,"cond-mat.supr-con","http://arxiv.org/licenses/nonexclusive-distrib/1.0/","  One of the puzzling characteristics of the pseudogap phase of high-$T_c$
cuprates is the nodal-antinodal dichotomy. While the nodal quasiparticles have
a Fermi liquid behaviour, the antinodal ones show non-Fermi liquid features and
an associated pseudogap. Angle-resolved photoemission spectroscopy and
electronic Raman scattering are two valuable tools which have shown universal
features which are rather material-independent, and presumably intrinsic to the
pseudogap phase. The doping and temperature dependence of the Fermi arcs and
the pseudogap observed by photoemission near the antinode correlates with the
non-Fermi liquid behaviour observed by Raman for the B$_{1g}$ mode. In
contrast, and similar to the nodal quasiparticles detected by photoemission,
the Raman B$_{2g}$ mode shows Fermi liquid features. We show that these two
experiments can be analysed, in the context of the $t$-$J$ model, by
self-energy effects in the proximity to a d-wave flux-phase order instability.
This approach supports a crossover origin for the pseudogap, and a scenario of
two competing phases. The B$_{2g}$ mode shows, in an underdoped case, a
depletion at intermediate energy which has attracted a renewed interest. We
study this depletion and discuss its origin and relation with the pseudogap.
","[{""version"":""v1"",""created"":""Mon, 10 Nov 2014 13:41:19 GMT""}]","2015-06-23"
"1411.2422","Bernat Terr\'es","B. Terr\'es, S. Reichardt, C. Neumann, K. Watanabe, T. Taniguchi, and
  C. Stampfer","Raman spectroscopy on mechanically exfoliated pristine graphene ribbons",,,"10.1002/pssb.201451398","Phys. Status Solidi B, 251: 2551--2555, 2014","cond-mat.mes-hall","http://arxiv.org/licenses/nonexclusive-distrib/1.0/","  We present Raman spectroscopy measurements of non-etched graphene
nanoribbons, with widths ranging from 15 to 160 nm, where the D-line intensity
is strongly dependent on the polarization direction of the incident light. The
extracted edge disorder correlation length is approximately one order of
magnitude larger than on previously reported graphene ribbons fabricated by
reactive ion etching techniques. This suggests a more regular crystallographic
orientation of the non-etched graphene ribbons here presented. We further
report on the ribbons width dependence of the line-width and frequency of the
long-wavelength optical phonon mode (G-line) and the 2D-line of the studied
graphene ribbons.
","[{""version"":""v1"",""created"":""Mon, 10 Nov 2014 13:41:52 GMT""}]","2014-12-10"
"1411.2423","Mark Gerard Walsh","Mark Walsh","The Space of Positive Scalar Curvature Metrics on a Manifold with
  Boundary","66 pages, 38 figures. Significantly updated version",,,,"math.DG math.AT","http://arxiv.org/licenses/nonexclusive-distrib/1.0/","  We study the space of Riemannian metrics with positive scalar curvature on a
compact manifold with boundary. These metrics extend a fixed boundary metric
and take a product structure on a collar neighbourhood of the boundary. We show
that the weak homotopy type of this space is preserved by certain surgeries on
the boundary in co-dimension at least three. Thus, there is a weak homotopy
equivalence between the space of such metrics on a simply connected spin
manifold $W$, of dimension $n\geq 6$ and with simply connected boundary, and
the corresponding space of metrics of positive scalar curvature on the standard
disk $D^{n}$. Indeed, for certain boundary metrics, this space is weakly
homotopy equivalent to the space of all metrics of positive scalar curvature on
the standard sphere $S^{n}$. Finally, we prove analogous results for the more
general space where the boundary metric is left unfixed.
","[{""version"":""v1"",""created"":""Mon, 10 Nov 2014 13:42:58 GMT""},{""version"":""v2"",""created"":""Wed, 12 Nov 2014 20:02:22 GMT""},{""version"":""v3"",""created"":""Thu, 18 Jun 2015 18:20:50 GMT""},{""version"":""v4"",""created"":""Thu, 2 Jul 2015 23:22:11 GMT""},{""version"":""v5"",""created"":""Fri, 6 Sep 2019 08:00:43 GMT""}]","2019-09-09"
"1411.2424","Jacob D. Bekenstein","Jacob D. Bekenstein and Bibhas Ranjan Majhi","Is the principle of least action a must?","RevTeX, no figures, Eq. 3 corrected, a reference added, added sundry
  clarifying comments, no change in the results, 23 pages","Nucl. Phys. B892(2015)337","10.1016/j.nuclphysb.2015.01.015",,"hep-th gr-qc","http://arxiv.org/licenses/nonexclusive-distrib/1.0/","  The least action principle occupies a central part in contemporary physics.
Yet, as far as classical field theory is concerned, it may not be as essential
as generally thought. We show with three detailed examples of classical
interacting field theories that it is possible, in cases of physical interest,
to derive the correct field equations for all fields from the action (which we
regard as defining the theory), some of its symmetries, and the conservation
law of energy-momentum (this last regarded as ultimately coming from
experiment)
","[{""version"":""v1"",""created"":""Mon, 10 Nov 2014 13:44:02 GMT""},{""version"":""v2"",""created"":""Sat, 27 Dec 2014 17:15:38 GMT""}]","2015-02-02"
"1411.2425","Michele Campisi Dr","Michele Campisi","Construction of microcanonical entropy on thermodynamic pillars","7 pages, 2 figures. v4: published version","Phys. Rev. E 91, 052147 (2015)","10.1103/PhysRevE.91.052147",,"cond-mat.stat-mech","http://arxiv.org/licenses/nonexclusive-distrib/1.0/","  A question that is currently highly debated is whether the microcanonical
entropy should be expressed as the logarithm of the phase volume (volume
entropy, also known as the Gibbs entropy) or as the logarithm of the density of
states (surface entropy, also known as the Boltzmann entropy). Rather than
postulating them and investigating the consequence of each definition, as is
customary, here we adopt a bottom-up approach and construct the entropy
expression within the microcanonical formalism upon two fundamental
thermodynamic pillars: (i) The second law of thermodynamics as formulated for
quasi-static processes: $\delta Q/T$ is an exact differential, and (ii) the law
of ideal gases: $PV=k_B NT$. The first pillar implies that entropy must be some
function of the phase volume $\Omega$. The second pillar singles out the
logarithmic function among all possible functions. Hence the construction leads
uniquely to the expression $S= k_B \ln \Omega$, that is the volume entropy. As
a consequence any entropy expression other than that of Gibbs, e.g., the
Boltzmann entropy, can lead to inconsistencies with the two thermodynamic
pillars. We illustrate this with the prototypical example of a macroscopic
collection of non-interacting spins in a magnetic field, and show that the
Boltzmann entropy severely fails to predict the magnetization, even in the
thermodynamic limit. The uniqueness of the Gibbs entropy, as well as the
demonstrated potential harm of the Boltzmann entropy, provide compelling
reasons for discarding the latter at once.
","[{""version"":""v1"",""created"":""Mon, 10 Nov 2014 13:45:55 GMT""},{""version"":""v2"",""created"":""Tue, 20 Jan 2015 11:00:52 GMT""},{""version"":""v3"",""created"":""Wed, 18 Feb 2015 13:40:37 GMT""},{""version"":""v4"",""created"":""Mon, 25 May 2015 14:38:27 GMT""}]","2015-05-28"
"1411.2426","Antoine Pauthier","Antoine Pauthier","Uniform dynamics for Fisher-KPP propagation driven by a line of fast
  diffusion under a singular limit","30 pages",,"10.1088/0951-7715/28/11/3891",,"math.AP","http://arxiv.org/licenses/nonexclusive-distrib/1.0/","  The purpose of this paper is to understand the links between a model
introduced in 2012 by H. Berestycki, J.-M. Roquejofre and L. Rossi and a
nonlocal model studied by the author in 2014. The general question is to
investigate the influence of a line of fast diffusion on Fisher-KPP
propagation. In the initial model, the exchanges are modeled by a Robin
boundary condition, whereas in the nonlocal model the exchanges are described
by integral terms. For both models was showed the existence of an enhanced
spreading in the direction of the line. One way to retrieve the local model
from the nonlocal one is to consider integral terms tending to Dirac masses.
The question is then how the dynamics given by the nonlocal model resembles the
local one. We show here that the nonlocal dynamics tends to the local one in a
rather strong sense.
","[{""version"":""v1"",""created"":""Mon, 10 Nov 2014 13:49:23 GMT""},{""version"":""v2"",""created"":""Thu, 2 Jul 2015 14:57:50 GMT""}]","2015-10-13"
"1411.2427","Tiago Vieira","T. M. Vieira, G. M. Viswanathan, L. R. da Silva","How to efficiently destroy a network with limited information","10 pages, 3 figures",,,,"physics.soc-ph cs.SI","http://arxiv.org/licenses/nonexclusive-distrib/1.0/","  We address the general problem of how best to attack and destroy a network by
node removal, given limited or no prior information about the edges. We
consider a family of strategies in which nodes are randomly chosen, but not
removed. Instead, a random acquaintance (i.e., a first neighbour) of the chosen
node is removed from the network. By assigning an informal cost to the
information about the network structure, we show using cost-benefit analysis
that acquaintance removal is the optimal strategy to destroy networks
efficiently.
","[{""version"":""v1"",""created"":""Mon, 10 Nov 2014 13:54:03 GMT""}]","2014-11-11"
"1411.2428","Giorgio Ferrari","Tiziano De Angelis, Giorgio Ferrari and John Moriarty","A solvable two-dimensional singular stochastic control problem with non
  convex costs","25 pages, 3 figures. Improved exposition of the results. This is a
  revised version of ""A solvable two-dimensional degenerate singular stochastic
  control problem with non convex costs""",,,,"math.OC","http://arxiv.org/licenses/nonexclusive-distrib/1.0/","  In this paper we provide a complete theoretical analysis of a two-dimensional
degenerate non convex singular stochastic control problem. The optimisation is
motivated by a storage-consumption model in an electricity market, and features
a stochastic real-valued spot price modelled by Brownian motion. We find
analytical expressions for the value function, the optimal control and the
boundaries of the action and inaction regions. The optimal policy is
characterised in terms of two monotone and discontinuous repelling free
boundaries, although part of one boundary is constant and the smooth fit
condition holds there.
","[{""version"":""v1"",""created"":""Mon, 10 Nov 2014 13:58:08 GMT""},{""version"":""v2"",""created"":""Wed, 14 Jan 2015 12:23:43 GMT""},{""version"":""v3"",""created"":""Wed, 28 Oct 2015 11:52:18 GMT""}]","2015-10-29"
"1411.2429","Philipp Leitner","Philipp Leitner and Juergen Cito","Patterns in the Chaos - a Study of Performance Variation and
  Predictability in Public IaaS Clouds",,,,,"cs.DC","http://arxiv.org/licenses/nonexclusive-distrib/1.0/","  Benchmarking the performance of public cloud providers is a common research
topic. Previous research has already extensively evaluated the performance of
different cloud platforms for different use cases, and under different
constraints and experiment setups. In this paper, we present a principled,
large-scale literature review to collect and codify existing research regarding
the predictability of performance in public Infrastructure-as-a-Service (IaaS)
clouds. We formulate 15 hypotheses relating to the nature of performance
variations in IaaS systems, to the factors of influence of performance
variations, and how to compare different instance types. In a second step, we
conduct extensive real-life experimentation on Amazon EC2 and Google Compute
Engine to empirically validate those hypotheses. At the time of our research,
performance in EC2 was substantially less predictable than in GCE. Further, we
show that hardware heterogeneity is in practice less prevalent than anticipated
by earlier research, while multi-tenancy has a dramatic impact on performance
and predictability.
","[{""version"":""v1"",""created"":""Mon, 10 Nov 2014 13:58:58 GMT""},{""version"":""v2"",""created"":""Tue, 19 Jan 2016 14:09:15 GMT""}]","2016-01-20"
"1411.2430","Shakeel Mahmood","Shakeel Mahmood, Farida Tahir, Azeem Mir","New Physics Through Rare Decays Of Mesons","8 pages; three figures","International Journal of Modern Physics E (2015)","10.1142/S0218301315710019",,"hep-ph","http://arxiv.org/licenses/nonexclusive-distrib/1.0/","  We study the contribution of 2nd generation of quarks in NSIs. We investigate
it through the rare decays of mesons involving neutrinos in the final state. We
show the C and s quarks can effect NSIs just like u and s. We explore
constraints on free parameter of NSIs. For this purpose we select 6 FCNC
semi-leptonic processes of B, D and K mesons having neutrinos in the final
state
","[{""version"":""v1"",""created"":""Mon, 10 Nov 2014 14:00:25 GMT""},{""version"":""v2"",""created"":""Tue, 11 Nov 2014 14:12:14 GMT""},{""version"":""v3"",""created"":""Thu, 13 Nov 2014 18:11:53 GMT""},{""version"":""v4"",""created"":""Sat, 15 Nov 2014 02:37:03 GMT""},{""version"":""v5"",""created"":""Tue, 18 Nov 2014 09:07:25 GMT""},{""version"":""v6"",""created"":""Wed, 26 Nov 2014 16:24:40 GMT""}]","2022-02-16"
"1411.2431","Thomas Bauer","Thomas Bauer, Piotr Pokora, David Schmitz","On the boundedness of the denominators in the Zariski decomposition on
  surfaces","Example 3.4 expanded; and minor edits in the text","Journal fur die reine und angewandte Mathematik 733 : 251 - 259
  (2017)","10.1515/crelle-2015-0058",,"math.AG","http://arxiv.org/licenses/nonexclusive-distrib/1.0/","  Zariski decompositions play an important role in the theory of algebraic
surfaces. For making geometric use of the decomposition of a given divisor, one
needs to pass to a multiple of the divisor in order to clear denominators. It
is therefore an intriguing question whether the surface has a 'universal
denominator' that can be used to simultaneously clear denominators in all
Zariski decompositions on the surface. We prove in this paper that, somewhat
surprisingly, this condition of bounded Zariski denominators is equivalent to
the bounded negativity of curves that is addressed in the Bounded Negativity
Conjecture. Furthermore, we provide explicit bounds for Zariski denominators
and negativity of curves in terms of each other.
","[{""version"":""v1"",""created"":""Mon, 10 Nov 2014 14:02:35 GMT""},{""version"":""v2"",""created"":""Mon, 5 Oct 2015 09:54:34 GMT""}]","2017-12-18"
"1411.2432","Kiril Hristov","Kiril Hristov, Stefanos Katmadas","Wilson lines for AdS_5 black strings","13 pages; v2 improved discussion, added references",,"10.1007/JHEP02(2015)009",,"hep-th","http://arxiv.org/licenses/nonexclusive-distrib/1.0/","  We describe a simple method of extending AdS_5 black string solutions of 5d
gauged supergravity in a supersymmetric way by addition of Wilson lines along a
circular direction in space. When this direction is chosen along the string,
and due to the specific form of 5d supergravity that features Chern-Simons
terms, the existence of magnetic charges automatically generates conserved
electric charges in a 5d analogue of the Witten effect. Therefore we find a
rather generic, model-independent way of adding electric charges to already
existing solutions with no backreaction from the geometry or breaking of any
symmetry. We use this method to explicitly write down more general versions of
the Benini-Bobev black strings and comment on the implications for the dual
field theory and the similarities with generalizations of the Cacciatori-Klemm
black holes in AdS_4.
","[{""version"":""v1"",""created"":""Mon, 10 Nov 2014 14:02:38 GMT""},{""version"":""v2"",""created"":""Wed, 3 Dec 2014 15:14:01 GMT""}]","2015-06-23"
"1411.2433","Paola Ferrario","Juan Jose Gomez-Cadenas","The NEXT experiment","Proceedings of the ICHEP 2014 conference, held in Valencia (Spain)",,,,"physics.ins-det hep-ex","http://arxiv.org/licenses/nonexclusive-distrib/1.0/","  NEXT (Neutrino Experiment with a Xenon TPC) is an experiment to search
neutrinoless double beta decay processes (bb0nu) in Xe136. The NEXT technology
is based in the use of time projection chambers operating at a typical pressure
of 15 bar and using electroluminescence to amplify the signal (HPXE). The main
advantages of the experimental technique are: a) excellent energy resolution;
b) the ability to reconstruct the trajectory of the two electrons emitted in
the decays, which further contributes to the suppression of backgrounds; c)
scalability to large masses; and d) the possibility to reduce the background to
negligible levels thanks to the barium tagging technology (BATA). The NEXT
roadmap was designed in four stages: i) Demonstration of the HPXE technology
with prototypes deploying a mass of natural xenon in the range of 1 kg, using
the NEXT-DEMO (IFIC) and NEXT-DBDM (Berkeley) prototypes; ii) Characterisation
of the backgrounds to the bb0nu signal and measurement of the bb2nu signal with
the NEW detector, deploying 10 kg of enriched xenon and operating at the LSC;
iii) Search for bb0nu decays with the NEXT-100 detector, which deploys 100 kg
of enriched xenon; iv) Search for bb0nu decays with the BEXT detector, which
will deploy masses in the range of the ton and will introduce two additional
handles, only possible in a HPXE: a) A magnetic field, capable of further
enhancing the topological signal of NEXT; and b) barium-tagging (a technique
pioneered by the EXO experiment which is also accessible to NEXT).
","[{""version"":""v1"",""created"":""Mon, 10 Nov 2014 14:03:05 GMT""}]","2014-11-11"
"1411.2434","Michal Doucha","Marek Cuth, Michal Doucha","Lipschitz-free spaces over ultrametric spaces","The only change in the latest version is the second author's grant
  information. Question 1 from the previous version has been answered - see
  Remark 15 for the solution. Preprint was accepted in Mediterr. J. Math","Mediterr. J. Math., 13 (2016), 1893-1906","10.1007/s00009-015-0566-7",,"math.FA","http://arxiv.org/licenses/nonexclusive-distrib/1.0/","  We prove that the Lipschitz-free space over a separable ultrametric space has
a monotone Schauder basis and is isomorphic to $\ell_1$. This extends results
of A. Dalet using an alternative approach.
","[{""version"":""v1"",""created"":""Mon, 10 Nov 2014 14:10:24 GMT""},{""version"":""v2"",""created"":""Mon, 20 Apr 2015 10:05:46 GMT""},{""version"":""v3"",""created"":""Thu, 8 Feb 2018 17:25:51 GMT""}]","2018-02-09"
"1411.2435","Yifan Zhou","Yifan Zhou, Zhifeng Zhao, Qianlan Ying, Rongpeng Li, Xuan Zhou, Xianfu
  Chen, and Honggang Zhang","Large-scale Spatial Distribution Identification of Base Stations in
  Cellular Networks",,,,,"cs.NI","http://arxiv.org/licenses/nonexclusive-distrib/1.0/","  The performance of cellular system significantly depends on its network
topology, where the spatial deployment of base stations (BSs) plays a key role
in the downlink scenario. Moreover, cellular networks are undergoing a
heterogeneous evolution, which introduces unplanned deployment of smaller BSs,
thus complicating the performance evaluation even further. In this paper, based
on large amount of real BS locations data, we present a comprehensive analysis
on the spatial modeling of cellular network structure. Unlike the related
works, we divide the BSs into different subsets according to geographical
factor (e.g. urban or rural) and functional type (e.g. macrocells or
microcells), and perform detailed spatial analysis to each subset. After
examining the accuracy of Poisson point process (PPP) in BS locations modeling,
we take into account the Gibbs point processes as well as Neyman-Scott point
processes and compare their accuracy in view of large-scale modeling test.
Finally, we declare the inaccuracy of the PPP model, and reveal the general
clustering nature of BSs deployment, which distinctly violates the traditional
assumption. This paper carries out a first large-scale identification regarding
available literatures, and provides more realistic and more general results to
contribute to the performance analysis for the forthcoming heterogeneous
cellular networks.
","[{""version"":""v1"",""created"":""Mon, 10 Nov 2014 14:12:40 GMT""}]","2014-11-11"
"1411.2436","Gautam Rupak","Gautam Rupak and Pranaam Ravi (Mississippi State U.)","Proton-proton fusion in lattice effective field theory","11 pages, 2 figures",,"10.1016/j.physletb.2014.12.055",,"nucl-th","http://arxiv.org/licenses/nonexclusive-distrib/1.0/","  The proton-proton fusion rate is calculated at low energy in a lattice
effective field theory (EFT) formulation. The strong and the Coulomb
interactions are treated non-perturbatively at leading order in the EFT. The
lattice results are shown to accurately describe the low energy cross section
within the validity of the theory at energies relevant to solar physics. In
prior work in the literature, Coulomb effects were generally not included in
non-perturbative lattice calculations. Work presented here is of general
interest in nuclear lattice EFT calculations that involve Coulomb effects at
low energy. It complements recent developments of the adiabatic projection
method for lattice calculations of nuclear reactions.
","[{""version"":""v1"",""created"":""Mon, 10 Nov 2014 14:14:05 GMT""}]","2018-05-09"
