"1411.2361","Nicolas Rougerie Dr","Nicolas Rougerie and Jakob Yngvason","Incompressibility estimates for the Laughlin phase, part II",,,,,"math-ph cond-mat.quant-gas cond-mat.str-el math.MP","http://arxiv.org/licenses/nonexclusive-distrib/1.0/","  We consider fractional quantum Hall states built on Laughlin's original
N-body wave-functions, i.e., they are of the form holomorphic times gaussian
and vanish when two particles come close, with a given polynomial rate. Such
states appear naturally when looking for the ground state of 2D particles in
strong magnetic fields, interacting via repulsive forces and subject to an
external potential due to trapping and/or disorder. We prove that all functions
in this class satisfy a universal local density upper bound, in a suitable weak
sense. Such bounds are useful to investigate the response of fractional quantum
Hall phases to variations of the external potential. Contrary to our previous
results for a restricted class of wave-functions, the bound we obtain here is
not optimal, but it does not require any additional assumptions on the
wave-function, besides analyticity and symmetry of the pre-factor modifying the
Laughlin function.
","[{""version"":""v1"",""created"":""Mon, 10 Nov 2014 09:35:18 GMT""},{""version"":""v2"",""created"":""Mon, 1 Dec 2014 16:28:16 GMT""},{""version"":""v3"",""created"":""Tue, 10 Nov 2015 10:46:47 GMT""},{""version"":""v4"",""created"":""Tue, 5 Jan 2016 14:26:57 GMT""}]","2016-01-06"
"1411.2362","Vyacheslav Kungurtsev","Vyacheslav Kungurtsev, Wim Michiels, Moritz Diehl","An Inequality Constrained SL/QP Method for Minimizing the Spectral
  Abscissa",,,,,"math.OC","http://arxiv.org/licenses/nonexclusive-distrib/1.0/","  We consider a problem in eigenvalue optimization, in particular finding a
local minimizer of the spectral abscissa - the value of a parameter that
results in the smallest value of the largest real part of the spectrum of a
matrix system. This is an important problem for the stabilization of control
systems. Many systems require the spectra to lie in the left half plane in
order for them to be stable. The optimization problem, however, is difficult to
solve because the underlying objective function is nonconvex, nonsmooth, and
non-Lipschitz. In addition, local minima tend to correspond to points of
non-differentiability and locally non-Lipschitz behavior. We present a
sequential linear and quadratic programming algorithm that solves a series of
linear or quadratic subproblems formed by linearizing the surfaces
corresponding to the largest eigenvalues. We present numerical results
comparing the algorithms to the state of the art.
","[{""version"":""v1"",""created"":""Mon, 10 Nov 2014 09:38:17 GMT""}]","2014-11-11"
"1411.2363","Amaresh Jaiswal","Chandrodoy Chattopadhyay, Amaresh Jaiswal, Subrata Pal, and Radoslaw
  Ryblewski","Relativistic third-order viscous corrections to the entropy four-current
  from kinetic theory","8 pages, 8 figures, published version","Phys. Rev. C 91, 024917 (2015)","10.1103/PhysRevC.91.024917",,"nucl-th hep-ph","http://arxiv.org/licenses/nonexclusive-distrib/1.0/","  By employing a Chapman-Enskog like iterative solution of the Boltzmann
equation in relaxation-time approximation, we derive a new expression for the
entropy four-current up to third order in gradient expansion. We show that
unlike second-order and third-order entropy four-current obtained using Grad's
method, there is a non-vanishing entropy flux in the present third-order
expression. We further quantify the effect of the higher-order entropy density
in the case of boost-invariant one-dimensional longitudinal expansion of a
system. We demonstrate that the results obtained using third-order evolution
equation for shear stress tensor, derived by employing the method of
Chapman-Enskog expansion, show better agreement with the exact solution of the
Boltzmann equation as well as with the parton cascade BAMPS, as compared to
those obtained using the third-order equations from the method of Grad's
14-moment approximation.
","[{""version"":""v1"",""created"":""Mon, 10 Nov 2014 09:41:19 GMT""},{""version"":""v2"",""created"":""Fri, 27 Feb 2015 18:20:38 GMT""}]","2015-03-02"
"1411.2364","Vincenzo Zambianchi","Vincenzo Zambianchi and Enrico Paolini and Davide Dardari","Capacity Achieving Peak Power Limited Probability Measures: Sufficient
  Conditions for Finite Discreteness","23 pages, 1 figure",,,,"cs.IT math.IT","http://arxiv.org/licenses/nonexclusive-distrib/1.0/","  The problem of capacity achieving (optimal) input probability measures has
been widely investigated for several channel models with constrained inputs. So
far, no outstanding generalizations have been derived. This paper does a
forward step in this direction, by introducing a set of new requirements, for
the class of real scalar conditional output probability measures, under which
the optimal input probability measure is shown to be discrete with a finite
number of probability mass points, when peak power limited.
","[{""version"":""v1"",""created"":""Mon, 10 Nov 2014 09:41:32 GMT""}]","2014-11-11"
"1411.2365","Marcin Hajduk","Marcin Hajduk, Peter A. M. van Hoof and Albert A. Zijlstra","Evolution of the central stars of young planetary nebulae","Accepted for publication in A&A",,"10.1051/0004-6361/201423629",,"astro-ph.SR","http://arxiv.org/licenses/nonexclusive-distrib/1.0/","  The evolution of central stars of planetary nebulae was so far documented in
just a few cases. However, spectra collected a few decades ago may provide a
good reference for studying the evolution of central stars using the emission
line fluxes of their nebulae. We investigated evolutionary changes of the
[OIII] 5007 A line flux in the spectra of planetary nebulae. We compared
nebular fluxes collected during a decade or longer. We used literature data and
newly obtained spectra. A grid of Cloudy models was computed using existing
evolutionary models, and the models were compared with the observations. An
increase of the [OIII] 5007 A line flux is frequently observed in young
planetary nebulae hosting H-rich central stars. The increasing nebular
excitation is the response to the increasing temperature and hardening
radiation of the central stars. We did not observe any changes in the nebular
fluxes in the planetary nebulae hosting late-type Wolf-Rayet (WR) central
stars. This may indicate a slower temperature evolution (which may stem from a
different evolutionary status) of late-[WR] stars. In young planetary nebulae
with H-rich central stars, the evolution can be followed using optical spectra
collected during a decade or longer. The observed evolution of H-rich central
stars is consistent with the predictions of the evolutionary models provided in
the literature. Late-[WR] stars possibly follow a different evolutionary path.
","[{""version"":""v1"",""created"":""Mon, 10 Nov 2014 09:46:02 GMT""}]","2014-11-11"
"1411.2366","Alix Deruelle","Alix Deruelle","Asymptotic estimates and compactness of expanding gradient Ricci
  solitons","39 pages",,,,"math.DG","http://arxiv.org/licenses/nonexclusive-distrib/1.0/","  We first investigate the asymptotics of conical expanding gradient Ricci
solitons by proving sharp decay rates to the asymptotic cone both in the
generic and the asymptotically Ricci flat case. We then establish a compactness
theorem concerning nonnegatively curved expanding gradient Ricci solitons.
","[{""version"":""v1"",""created"":""Mon, 10 Nov 2014 09:51:22 GMT""}]","2014-11-11"
"1411.2367","Shuiyin Liu","Shuiyin Liu, Yi Hong, and Emanuele Viterbo","Unshared Secret Key Cryptography: Finite Constellation Inputs and Ideal
  Secrecy Outage","7 pages, 2 figures. arXiv admin note: text overlap with
  arXiv:1410.5021",,,,"cs.CR","http://arxiv.org/licenses/nonexclusive-distrib/1.0/","  The Unshared Secret Key Cryptography (USK), recently proposed by the authors,
guarantees Shannon's ideal secrecy and perfect secrecy for MIMO wiretap
channels, without requiring secret key exchange. However, the requirement of
infinite constellation inputs limits its applicability to practical systems. In
this paper, we propose a practical USK scheme using finite constellation
inputs. The new scheme is based on a cooperative jamming technique, and is
valid for the case where the eavesdropper has more antennas than the
transmitter. We show that Shannon's ideal secrecy can be achieved with an
arbitrarily small outage probability.
","[{""version"":""v1"",""created"":""Mon, 10 Nov 2014 10:02:02 GMT""}]","2014-11-11"
"1411.2368","Liqun Qi","Qun Wang, Guoyin Li, Liqun Qi and Yi Xu","New Classes of Positive Semi-Definite Hankel Tensors","arXiv admin note: substantial text overlap with arXiv:1410.6989",,,,"math.SP","http://arxiv.org/licenses/nonexclusive-distrib/1.0/","  A Hankel tensor is called a strong Hankel tensor if the Hankel matrix
generated by its generating vector is positive semi-definite. It is known that
an even order strong Hankel tensor is a sum-of-squares tensor, and thus a
positive semi-definite tensor. The SOS decomposition of strong Hankel tensors
has been well-studied by Ding, Qi and Wei \cite{DQW1}. On the other hand, very
little is known for positive semi-definite Hankel tensors which are not strong
Hankel tensors. In this paper, we study some classes of positive semi-definite
Hankel tensors which are not strong Hankel tensors. These include truncated
Hankel tensors and quasi-truncated Hankel tensors. Then we show that a strong
Hankel tensor generated by an absoluate integrable function is always
completely decomposable, and give a class of SOS Hankel tensors which are not
completely decomposable.
","[{""version"":""v1"",""created"":""Mon, 10 Nov 2014 10:05:44 GMT""},{""version"":""v2"",""created"":""Tue, 11 Nov 2014 14:22:01 GMT""},{""version"":""v3"",""created"":""Thu, 13 Nov 2014 08:05:37 GMT""},{""version"":""v4"",""created"":""Sun, 16 Nov 2014 10:07:01 GMT""},{""version"":""v5"",""created"":""Tue, 21 Jun 2016 23:48:01 GMT""},{""version"":""v6"",""created"":""Sat, 9 Jul 2016 23:02:18 GMT""},{""version"":""v7"",""created"":""Wed, 21 Sep 2016 07:19:38 GMT""}]","2016-09-22"
"1411.2369","Thomas Willwacher","Anton Khoroshkin and Thomas Willwacher and Marko \v{Z}ivkovi\'c","Differentials on graph complexes",,,,,"math.QA","http://arxiv.org/licenses/nonexclusive-distrib/1.0/","  We study the cohomology of complexes of ordinary (non-decorated) graphs,
introduced by M. Kontsevich. We construct spectral sequences converging to zero
whose first page contains the graph cohomology. In particular, these series may
be used to show the existence of an infinite series of previously unknown and
provably non-trivial cohomology classes, and put constraints on the structure
of the graph cohomology as a whole.
","[{""version"":""v1"",""created"":""Mon, 10 Nov 2014 10:13:29 GMT""},{""version"":""v2"",""created"":""Fri, 20 Feb 2015 09:43:36 GMT""}]","2015-02-23"
"1411.2370","Wuqiong Luo","Wuqiong Luo, Wee Peng Tay, Mei Leng","On the Universality of Jordan Centers for Estimating Infection Sources
  in Tree Networks",,,"10.1109/TIT.2017.2698504",,"cs.SI physics.soc-ph","http://arxiv.org/licenses/nonexclusive-distrib/1.0/","  Finding the infection sources in a network when we only know the network
topology and infected nodes, but not the rates of infection, is a challenging
combinatorial problem, and it is even more difficult in practice where the
underlying infection spreading model is usually unknown a priori. In this
paper, we are interested in finding a source estimator that is applicable to
various spreading models, including the Susceptible-Infected (SI),
Susceptible-Infected-Recovered (SIR), Susceptible-Infected-Recovered-Infected
(SIRI), and Susceptible-Infected-Susceptible (SIS) models. We show that under
the SI, SIR and SIRI spreading models and with mild technical assumptions, the
Jordan center is the infection source associated with the most likely infection
path in a tree network with a single infection source. This conclusion applies
for a wide range of spreading parameters, while it holds for regular trees
under the SIS model with homogeneous infection and recovery rates. Since the
Jordan center does not depend on the infection, recovery and reinfection rates,
it can be regarded as a universal source estimator. We also consider the case
where there are k>1 infection sources, generalize the Jordan center definition
to a k-Jordan center set, and show that this is an optimal infection source set
estimator in a tree network for the SI model. Simulation results on various
general synthetic networks and real world networks suggest that Jordan
center-based estimators consistently outperform the betweenness, closeness,
distance, degree, eigenvector, and pagerank centrality based heuristics, even
if the network is not a tree.
","[{""version"":""v1"",""created"":""Mon, 10 Nov 2014 10:25:10 GMT""},{""version"":""v2"",""created"":""Thu, 27 Oct 2016 04:57:49 GMT""}]","2017-05-03"
"1411.2371","Anders Oberg","Anders \""Oberg and Konstantinos Tsougkas","The Kusuoka measure and the energy Laplacian on level-$k$ Sierpi\'nski
  gaskets","1 figure",,,,"math.AP","http://arxiv.org/licenses/nonexclusive-distrib/1.0/","  We extend and survey results in the theory of analysis on fractal sets from
the standard Laplacian on the Sierpi\'nski gasket to the energy Laplacian,
which is defined weakly by using the Kusuoka energy measure. We also extend
results from the Sierpi\'nski gasket to level-$k$ Sierpi\'nski gaskets, for all
$k\geq 2$. We observe that the pointwise formula for the energy Laplacian is
valid for all level-$k$ Sierpi\'nski gaskets, $SG_k$, and we provide a proof of
a known formula for the renormalization constants of the Dirichlet form for
post-critically finite self-similar sets along with a probabilistic
interpretation of the Laplacian pointwise formula. We also provide a vector
self-similar formula and a variable weight self-similar formula for the Kusuoka
measure on $SG_k$, as well as a formula for the scaling of the energy
Laplacian.
","[{""version"":""v1"",""created"":""Mon, 10 Nov 2014 10:29:15 GMT""},{""version"":""v2"",""created"":""Fri, 10 Jun 2016 13:33:17 GMT""},{""version"":""v3"",""created"":""Sat, 21 Oct 2017 19:29:51 GMT""}]","2017-10-24"
"1411.2372","Avelino Vicente","Avelino Vicente","Theory and phenomenology of lepton flavor violation","Proceedings of the 8th International Workshop on the CKM Unitarity
  Triangle (CKM 2014), Vienna, Austria, September 8-12, 2014",,,,"hep-ph","http://arxiv.org/licenses/nonexclusive-distrib/1.0/","  The field of lepton flavor violation will live an era of unprecedented
developments in the near future, with dedicated experiments in different
fronts. The observation of a flavor violating process involving charged leptons
would be a clear evidence of physics beyond the Standard Model, thus motivating
the great effort in this direction. Furthermore, in case a positive signal is
found, a proper theoretical understanding of the lepton flavor anatomy of a
given model would become necessary. Here I briefly review the current
situation, emphasizing the most relevant theoretical and phenomenological
aspects of several processes. Finally, I discuss two topics that have received
some attention recently: lepton flavor violation in low-scale seesaw models and
lepton flavor violating Higgs decays.
","[{""version"":""v1"",""created"":""Mon, 10 Nov 2014 10:40:31 GMT""}]","2014-11-11"
"1411.2373","Pedro M.  d'Orey","Pedro M. d'Orey, Nitin Maslekar, Idoia de la Iglesia and Nikola K.
  Zahariev","NAVI: Neighbor Aware Virtual Infrastructure for Information
  Dissemination in Vehicular Networks",,,,,"cs.NI","http://arxiv.org/licenses/nonexclusive-distrib/1.0/","  Vehicular Networks enable a vast number of innovative applications, which
rely on the efficient exchange of information between vehicles. However,
efficient and reliable data dissemination is a particularly challenging task in
the context of vehicular networks due to the underlying properties of these
networks, limited availability of network infrastructure and variable
penetration rates for distinct communication technologies. This paper presents
a novel system and mechanism for information dissemination based on virtual
infrastructure selection in combination with multiple communication
technologies. The system has been evaluated using a simulation framework,
involving network simulation in conjugation with realistic vehicular mobility
traces. The presented simulation results show the feasibility of the proposed
mechanism to achieve maximum message penetration with reduced overhead.
Compared with a cellular-based only solution, our mechanism shows that the
judicious vehicle selection can lead to improved network utilization through
the offload of traffic to the short-range communication network.
","[{""version"":""v1"",""created"":""Mon, 10 Nov 2014 10:40:44 GMT""}]","2014-11-11"
"1411.2374","Aur\'elien Bellet","Kuan Liu and Aur\'elien Bellet and Fei Sha","Similarity Learning for High-Dimensional Sparse Data","14 pages. Proceedings of the 18th International Conference on
  Artificial Intelligence and Statistics (AISTATS 2015). Matlab code:
  https://github.com/bellet/HDSL",,,,"cs.LG cs.AI stat.ML","http://arxiv.org/licenses/nonexclusive-distrib/1.0/","  A good measure of similarity between data points is crucial to many tasks in
machine learning. Similarity and metric learning methods learn such measures
automatically from data, but they do not scale well respect to the
dimensionality of the data. In this paper, we propose a method that can learn
efficiently similarity measure from high-dimensional sparse data. The core idea
is to parameterize the similarity measure as a convex combination of rank-one
matrices with specific sparsity structures. The parameters are then optimized
with an approximate Frank-Wolfe procedure to maximally satisfy relative
similarity constraints on the training data. Our algorithm greedily
incorporates one pair of features at a time into the similarity measure,
providing an efficient way to control the number of active features and thus
reduce overfitting. It enjoys very appealing convergence guarantees and its
time and memory complexity depends on the sparsity of the data instead of the
dimension of the feature space. Our experiments on real-world high-dimensional
datasets demonstrate its potential for classification, dimensionality reduction
and data exploration.
","[{""version"":""v1"",""created"":""Mon, 10 Nov 2014 10:40:47 GMT""},{""version"":""v2"",""created"":""Wed, 21 Oct 2015 13:45:00 GMT""},{""version"":""v3"",""created"":""Mon, 9 Sep 2019 16:53:40 GMT""}]","2019-09-10"
"1411.2375","Maciej Misiorny","Maciej Misiorny and J\'ozef Barna\'s","Spin-dependent thermoelectric effects in transport through a nanoscopic
  junction involving spin impurity","24 pages with 7 figures, version as published","Physical Review B 89, 235438 (2014)","10.1103/PhysRevB.89.235438",,"cond-mat.mes-hall cond-mat.mtrl-sci","http://arxiv.org/licenses/nonexclusive-distrib/1.0/","  Conventional and spin-related thermoelectric effects in transport through a
magnetic tunnel junction with a large-spin impurity, such as a magnetic
molecule or atom, embedded into the corresponding barrier are studied
theoretically in the linear-response regime. The impurity is described by the
giant spin Hamiltonian, with both uniaxial and transverse magnetic anisotropy
taken into account. Owing to the presence of transverse component of magnetic
anisotropy, spin of a tunneling electron can be reversed during scattering on
the impurity, even in the low temperature regime. This reversal appears due to
exchange interaction of tunneling electrons with the magnetic impurity. We
calculate Seebeck and spin Seebeck coefficients, and analyze their dependence
on various parameters of the spin impurity and tunnel junction. In addition,
conventional and spin figures of merit, as well as the electronic contribution
to heat conductance are considered. We also show that pure spin current can be
driven by a spin bias applied to the junction with spin impurity, even if no
electron transfer between the electrodes can take place. The underlying
mechanism employs single-electrode tunneling processes (electrode-spin exchange
interaction) and the impurity as an intermediate reservoir of angular momentum.
","[{""version"":""v1"",""created"":""Mon, 10 Nov 2014 10:49:40 GMT""}]","2014-11-11"
"1411.2376","Marco Ornigotti Dr.","Marco Ornigotti, Andrea Aiello and Claudio Conti","Goos-H\""anchen and Imbert-Fedorov shifts for paraxial X-Waves",,,"10.1364/OL.40.000558",,"physics.optics","http://arxiv.org/licenses/nonexclusive-distrib/1.0/","  We present a theoretical analysis for the \GH and \IF shifts experienced by
an X-wave upon reflection from a dielectric interface. We show that the
temporal chirp, as well as the bandwidth of the X-wave directly affect the
spatial shifts in a way that can be experimentally observed, while the angular
shifts do not depend on the spectral features of the X-Wave. A dependence of
the spatial shifts on the spatial structure of the X-wave is also discussed.
","[{""version"":""v1"",""created"":""Mon, 10 Nov 2014 10:51:57 GMT""},{""version"":""v2"",""created"":""Mon, 5 Jan 2015 09:35:30 GMT""}]","2015-06-23"
"1411.2377","Tomonori Kouya","Tomonori Kouya","A Highly Efficient Implementation of Multiple Precision Sparse
  Matrix-Vector Multiplication and Its Application to Product-type Krylov
  Subspace Methods",,"International Journal of Numerical Methods and Applications,
  Vol.7, Issue 2, 2012, Pages 107 - 119",,,"math.NA cs.NA","http://arxiv.org/licenses/nonexclusive-distrib/1.0/","  We evaluate the performance of the Krylov subspace method by using highly
efficient multiple precision sparse matrix-vector multiplication (SpMV).
BNCpack is our multiple precision numerical computation library based on
MPFR/GMP, which is one of the most efficient arbitrary precision floating-point
arithmetic libraries. However, it does not include functions that can
manipulate multiple precision sparse matrices. Therefore, by using benchmark
tests, we show that SpMV implemented in these functions can be more efficient.
Finally, we also show that product-type Krylov subspace methods such as BiCG
and GPBiCG in which we have embedded SpMV, can efficiently solve large-scale
linear systems of equations provided in the UF sparse matrix collections in a
memory-restricted computing environment.
","[{""version"":""v1"",""created"":""Mon, 10 Nov 2014 10:58:18 GMT""}]","2014-11-11"
"1411.2378","Eduardo Hermo Reyes","Eduardo Hermo Reyes and Joost J. Joosten","The Selfish Algorithm",,,,,"cs.CC nlin.CG","http://arxiv.org/licenses/nonexclusive-distrib/1.0/","  The principle of Generalized Natural Selection (GNS) states that in nature,
computational processes of high computational sophistication are more likely to
maintain/abide than processes of lower computational sophistication provided
that sufficiently many resources are around to sustain the processes. In this
paper we give a concrete set-up how to test GNS in a weak sense. In particular,
we work in the setting of Cellular Automata and see how GNS can manifest itself
in this setting.
","[{""version"":""v1"",""created"":""Mon, 10 Nov 2014 11:01:58 GMT""}]","2014-11-11"
"1411.2379","Changhwa Woo","Doo Hyun Hwang, Hyunjin Lee, and Changhwa Woo","Semi-parallel symmetric operators for Hopf hypersurfaces in complex
  two-plane Grassmannians","arXiv admin note: text overlap with arXiv:1410.2690",,,,"math.DG","http://arxiv.org/licenses/nonexclusive-distrib/1.0/","  In this paper, we introduce new notions of semi-parallel shape operators and
structure Jacobi operators in complex two-plane Grassmannians $G_2({\mathbb
C}^{m+2})$. By using such a semi-parallel condition, we give a complete
classification of Hopf hypersurfaces in $G_2({\mathbb C}^{m+2})$.
","[{""version"":""v1"",""created"":""Mon, 10 Nov 2014 11:04:45 GMT""}]","2014-11-11"
"1411.2380","Andrzej Bobyk","Andrzej Bobyk, Wies{\l}aw A. Kami\'nski","Generator Coordinate Method framework for Double Beta Decay","7 pages, Proceedings of XXI Nuclear Physics Workshop, Kazimierz
  Dolny, Poland, 23-28 September 2014",,,,"nucl-th","http://arxiv.org/licenses/nonexclusive-distrib/1.0/","  We propose a consistent prescription for the derivation of the particle
number and angular momentum projected QRPA (PQRPA) equation in the Generator
Coordinate Method (GCM) framework for calculation of NME's of double-beta decay
of axially deformed nuclei. We derive closed formulae for the calculation of
excitation energies and wave functions of the intermediate nucleus.
","[{""version"":""v1"",""created"":""Mon, 10 Nov 2014 11:09:34 GMT""}]","2014-11-11"
