"1411.2305","Xun Zheng","Xun Zheng, Jin Kyu Kim, Qirong Ho, Eric P. Xing","Model-Parallel Inference for Big Topic Models",,,,,"cs.DC cs.LG stat.ML","http://arxiv.org/licenses/nonexclusive-distrib/1.0/","  In real world industrial applications of topic modeling, the ability to
capture gigantic conceptual space by learning an ultra-high dimensional topical
representation, i.e., the so-called ""big model"", is becoming the next
desideratum after enthusiasms on ""big data"", especially for fine-grained
downstream tasks such as online advertising, where good performances are
usually achieved by regression-based predictors built on millions if not
billions of input features. The conventional data-parallel approach for
training gigantic topic models turns out to be rather inefficient in utilizing
the power of parallelism, due to the heavy dependency on a centralized image of
""model"". Big model size also poses another challenge on the storage, where
available model size is bounded by the smallest RAM of nodes. To address these
issues, we explore another type of parallelism, namely model-parallelism, which
enables training of disjoint blocks of a big topic model in parallel. By
integrating data-parallelism with model-parallelism, we show that dependencies
between distributed elements can be handled seamlessly, achieving not only
faster convergence but also an ability to tackle significantly bigger model
size. We describe an architecture for model-parallel inference of LDA, and
present a variant of collapsed Gibbs sampling algorithm tailored for it.
Experimental results demonstrate the ability of this system to handle topic
modeling with unprecedented amount of 200 billion model variables only on a
low-end cluster with very limited computational resources and bandwidth.
","[{""version"":""v1"",""created"":""Mon, 10 Nov 2014 01:25:30 GMT""}]","2014-11-11"
"1411.2306","Mariko Ohara","Mariko Ohara","A representation for algebraic K-theory of quasi-coherent modules over
  affine spectral schemes","24 pages",,,,"math.KT","http://arxiv.org/licenses/nonexclusive-distrib/1.0/","  In this paper, we study K-theory of spectral schemes by using locally free
sheaves. Let us regard the K-theory as a functor K on affine spectral schemes.
Then, we prove that the group completion $\Omega
B^{\mathcal{G}}(B^{\mathcal{G}}GL)$ represents the sheafification of K with
respect to Zariski (resp. Nisnevich) topology $\mathcal{G}$, where
$B^{\mathcal{G}}GL$ is a classifying space of a colimit of affine spectral
schemes $GL_n$.
","[{""version"":""v1"",""created"":""Mon, 10 Nov 2014 01:33:31 GMT""},{""version"":""v2"",""created"":""Thu, 27 Nov 2014 07:01:30 GMT""},{""version"":""v3"",""created"":""Tue, 11 Aug 2015 02:40:22 GMT""},{""version"":""v4"",""created"":""Fri, 5 Aug 2016 05:49:41 GMT""}]","2016-08-08"
"1411.2307","Satoru Odake","Satoru Odake and Ryu Sasaki","Reflectionless Potentials for Difference Schr\""odinger Equations","24 pages. Comments and references added. To appear in J. Phys. A","J. Phys. A: Math. Theor. 48 (2015) 115204 (21pp)","10.1088/1751-8113/48/11/115204","DPSU-14-2","math-ph hep-th math.CA math.MP nlin.SI quant-ph","http://arxiv.org/licenses/nonexclusive-distrib/1.0/","  As a part of the program `discrete quantum mechanics,' we present general
reflectionless potentials for difference Schr\""odinger equations with pure
imaginary shifts. By combining contiguous integer wave number reflectionless
potentials, we construct the discrete analogues of the $h(h+1)/\cosh^2x$
potential with the integer $h$, which belong to the recently constructed
families of solvable dynamics having the $q$-ultraspherical polynomials with
$|q|=1$ as the main part of the eigenfunctions. For the general
($h\in\mathbb{R}_{>0}$) scattering theory for these potentials, we need the
connection formulas for the basic hypergeometric function
${}_2\phi_1(\genfrac{}{}{0pt}{}{a,b}{c}|q;z)$ with $|q|=1$, which is not known.
The connection formulas are expected to contain the quantum dilogarithm
functions as the $|q|=1$ counterparts of the $q$-gamma functions. We propose a
conjecture of the connection formula of the ${}_2\phi_1$ function with $|q|=1$.
Based on the conjecture, we derive the transmission and reflection amplitudes,
which have all the desirable properties. They provide a strong support to the
conjectured connection formula.
","[{""version"":""v1"",""created"":""Mon, 10 Nov 2014 01:34:12 GMT""},{""version"":""v2"",""created"":""Sat, 31 Jan 2015 09:41:58 GMT""}]","2015-03-17"
"1411.2308","Takayasu Sekihara","Takayasu Sekihara (RCNP, Osaka U.), Tetsuo Hyodo (Kyoto U., Yukawa
  Inst., Kyoto), Daisuke Jido (Tokyo Metropolitan U.)","Comprehensive analysis of the wave function of a hadronic resonance and
  its compositeness","34 pages, 1 figure, version accepted for publication in PTEP","PTEP 2015 6, 063D04","10.1093/ptep/ptv081",,"hep-ph nucl-th","http://arxiv.org/licenses/nonexclusive-distrib/1.0/","  We develop a theoretical framework to investigate the two-body composite
structure of a resonance as well as a bound state from its wave function. For
this purpose, we introduce both one-body bare states and two-body scattering
states, and define the compositeness as a fraction of the contribution of the
two-body wave function to the normalization of the total wave function. Writing
down explicitly the wave function for a resonance state obtained with a general
separable interaction, we formulate the compositeness in terms of the position
of the resonance pole, the residue of the scattering amplitude at the pole and
the derivative of the Green function of the free two-body scattering system. At
the same time, our formulation provides the elementariness expressed with the
resonance properties and the two-body effective interaction, and confirms the
sum rule showing that the summation of the compositeness and elementariness
gives unity. In this formulation the Weinberg's relation for the scattering
length and effective range can be derived in the weak binding limit. The
extension to the resonance states is performed with the Gamow vector, and a
relativistic formulation is also established. As its applications, we study the
compositeness of the $\Lambda (1405)$ resonance and the light scalar and vector
mesons described with refined amplitudes in coupled-channel models with
interactions up to the next to leading order in chiral perturbation theory. We
find that $\Lambda (1405)$ and $f_{0}(980)$ are dominated by the $\bar{K} N$
and $K \bar{K}$ composite states, respectively, while the vector mesons $\rho
(770)$ and $K^{\ast} (892)$ are elementary. We also briefly discuss the
compositeness of $N (1535)$ and $\Lambda (1670)$ obtained in a leading-order
chiral unitary approach.
","[{""version"":""v1"",""created"":""Mon, 10 Nov 2014 01:49:39 GMT""},{""version"":""v2"",""created"":""Thu, 27 Nov 2014 17:15:37 GMT""},{""version"":""v3"",""created"":""Tue, 7 Apr 2015 08:41:33 GMT""},{""version"":""v4"",""created"":""Wed, 8 Jul 2015 04:42:18 GMT""}]","2015-07-09"
"1411.2309","Akimichi Takemura","Toshifumi Fujiyama and Chihiro Matsui and Akimichi Takemura","A power-law decay model with autocorrelation for posting data to social
  networking services",,"PLoS ONE 11(8): e0160592. 2016","10.1371/journal.pone.0160592",,"math.ST stat.TH","http://arxiv.org/licenses/nonexclusive-distrib/1.0/","  We propose a power-law decay model with autocorrelation for posting data to
social networking services concerning particular events such as national
holidays or major sport events. In these kinds of events we observe people's
interest both before and after the events. In our model the number of postings
has a Poisson distribution whose expected value decays as a power law. Our
model also incorporates autocorrelations by autoregressive specification of the
expected value. We show that our proposed model well fits the data from social
networking services.
","[{""version"":""v1"",""created"":""Mon, 10 Nov 2014 01:56:29 GMT""}]","2016-08-11"
"1411.2310","Horace P. Yuen","Horace Yuen","Security Issues Associated With Error Correction And Privacy
  Amplification In Quantum Key Distribution",,,,,"quant-ph","http://arxiv.org/licenses/nonexclusive-distrib/1.0/","  Privacy amplification is a necessary step in all quantum key distribution
protocols, and error correction is needed in each except when signals of many
photons are used in the key communication in quantum noise approach. No
security analysis of error correcting code information leak to the attacker has
ever been provided, while an ad hoc formula is currently employed to account
for such leak in the key generation rate. It is also commonly believed that
privacy amplification allows the users to at least establish a short key of
arbitrarily close to perfect security. In this paper we show how the lack of
rigorous error correction analysis makes the otherwise valid privacy
amplification results invalid, and that there exists a limit on how close to
perfect a generated key can be obtained from privacy amplification. In
addition, there is a necessary tradeoff between key rate and security, and the
best theoretical values from current theories would not generate enough
near-uniform key bits to cover the message authentication key cost in
disturbance-information tradeoff protocols of the BB84 variety.
","[{""version"":""v1"",""created"":""Mon, 10 Nov 2014 01:57:37 GMT""}]","2014-11-11"
"1411.2311","Jos\'e A. Soto","Jos\'e A. Soto, Claudio Telha","Independent sets and hitting sets of bicolored rectangular families","36 pages, A preliminary version of this work appeared in IPCO 2011
  under the name ""Jump Number of Two-Directional Orthogonal Ray Graphs""",,,,"cs.CG cs.DS","http://arxiv.org/licenses/nonexclusive-distrib/1.0/","  A bicolored rectangular family BRF is a collection of all axis-parallel
rectangles contained in a given region Z of the plane formed by selecting a
bottom-left corner from a set A and an upper-right corner from a set B. We
prove that the maximum independent set and the minimum hitting set of a BRF
have the same cardinality and devise polynomial time algorithms to compute
both. As a direct consequence, we obtain the first polynomial time algorithm to
compute minimum biclique covers, maximum cross-free matchings and jump numbers
in a class of bipartite graphs that significantly extends convex bipartite
graphs and interval bigraphs. We also establish several connections between our
work and other seemingly unrelated problems. Furthermore, when the bicolored
rectangular family is weighted, we show that the problem of finding the maximum
weight of an independent set is NP-hard, and provide efficient algorithms to
solve it on certain subclasses.
","[{""version"":""v1"",""created"":""Mon, 10 Nov 2014 02:09:58 GMT""}]","2014-11-11"
"1411.2312","Ryokichi Tanaka","Ryokichi Tanaka","Hausdorff spectrum of harmonic measure",,,"10.1017/etds.2015.48",,"math.PR math.DS","http://arxiv.org/licenses/nonexclusive-distrib/1.0/","  For every non-elementary hyperbolic group, we show that for every random walk
with finitely supported admissible step distribution, the associated entropy
equals the drift times the logarithmic volume growth if and only if the
corresponding harmonic measure is comparable with Hausdorfff measure on the
boundary. Moreover, we introduce one parameter family of probability measures
which interpolates a Patterson-Sullivan measure and the harmonic measure, and
establish a formula of Hausdorff spectrum (multifractal spectrum) of the
harmonic measure. We also give some finitary versions of dimensional properties
of the harmonic measure.
","[{""version"":""v1"",""created"":""Mon, 10 Nov 2014 02:13:56 GMT""},{""version"":""v2"",""created"":""Thu, 7 May 2015 07:34:34 GMT""}]","2015-07-29"
"1411.2313","Eric Rowell","Paul Bruillard, C\'esar Galindo, Siu-Hung Ng, Julia Plavnik, Eric C.
  Rowell and Zhenghan Wang","On the Classification of Weakly Integral Modular Categories","Version 2: fixed missing metadata, version 3: corrected incomplete
  introduction and added theorem numbers, version 4: 32 pages, significant
  cosmetic revisions, version 5: final revision pre-submission",,,,"math.QA math.CT","http://arxiv.org/licenses/nonexclusive-distrib/1.0/","  We classify all modular categories of dimension $4m$, where $m$ is an odd
square-free integer, and all ranks $6$ and $7$ weakly integral modular
categories. This completes the classification of weakly integral modular
categories through rank $7$. Our results imply that all integral modular
categories of rank at most $7$ are pointed (that is, every simple object has
dimension $1$). All strictly weakly integral (weakly integral but non-integral)
modular categories of ranks $6$ and $7$ have dimension $4m$, with $m$ an odd
square free integer, so their classification is an application of our main
result. The classification of rank $7$ integral modular categories is
facilitated by an analysis of two actions on modular categories: the Galois
group of the field generated by the entries of the $S$-matrix and the group of
isomorphism classes of invertible simple objects. The interplay of these two
actions is of independent interest, and we derive some valuable arithmetic
consequences from their actions.
","[{""version"":""v1"",""created"":""Mon, 10 Nov 2014 02:19:18 GMT""},{""version"":""v2"",""created"":""Tue, 11 Nov 2014 02:45:30 GMT""},{""version"":""v3"",""created"":""Thu, 13 Nov 2014 14:32:22 GMT""},{""version"":""v4"",""created"":""Thu, 23 Apr 2015 16:55:54 GMT""},{""version"":""v5"",""created"":""Wed, 13 May 2015 00:25:28 GMT""}]","2015-05-14"
"1411.2314","Hamed Hatami","Hamed Hatami, Pooya Hatami, Yaqiao Li","A characterization of functions with vanishing averages over products of
  disjoint sets",,,,,"math.CO math.PR","http://arxiv.org/licenses/nonexclusive-distrib/1.0/","  Given $\alpha_1,...,\alpha_m \in (0,1)$, we characterize all integrable
functions $f:[0,1]^m \to \mathbb{C}$ satisfying $\int_{A_1 \times ...\times
A_m} f =0$ for any collection of disjoint sets $A_1,...,A_m \subseteq [0,1]$ of
respective measures $\alpha_1,...,\alpha_m$. We use this characterization to
settle some of the conjectures in [S. Janson and V. S\'os, More on quasi-random
graphs, subgraph counts and graph limits, arXiv:1405.6808].
","[{""version"":""v1"",""created"":""Mon, 10 Nov 2014 02:45:00 GMT""},{""version"":""v2"",""created"":""Fri, 16 Jan 2015 19:17:24 GMT""}]","2015-01-19"
"1411.2315","Xiaodi Wu","Kai-Min Chung, Xin Li, Xiaodi Wu","Multi-Source Randomness Extractors Against Quantum Side Information, and
  their Applications","52 pages; comments are welcome!",,,,"quant-ph cs.CC","http://arxiv.org/licenses/nonexclusive-distrib/1.0/","  We study the problem of constructing multi-source extractors in the quantum
setting, which extract almost uniform random bits against quantum side
information collected from several initially independent classical random
sources. This is a natural generalization of seeded randomness extraction
against quantum side information and classical independent source extraction.
With new challenges such as potential entanglement in the side information, it
is not a prior clear under what conditions do quantum multi-source extractors
exist; the only previous work is [KK12], where the classical inner-product
two-source extractors of [CG88] and [DEOR04] are shown to be quantum secure in
the restricted Independent Adversary (IA) Model and entangled Bounded Storage
(BS) Model.
  In this paper we propose a new model called General Entangled (GE) Adversary
Model, which allows arbitrary entanglement in the side information and subsumes
both the IA model and the BS model. We proceed to show how to construct
GE-secure quantum multi-source extractors. To that end, we propose another
model called One-sided Adversary (OA) Model, which is weaker than all the above
models. Somewhat surprisingly, we establish equivalence between strong
OA-security and strong GE-security. As a result, all classical multi-source
extractors can either directly work, or be modified to work in the GE model at
the cost of one extra random source. Thus, our constructions essentially match
the best known constructions of classical multi-source extractors.
  We also apply our techniques to two important problems in cryptography and
distributed computing --- privacy amplification and network extractor. We show
that as long as the sources have certain amounts of conditional min-entropy in
our GE model (even with entangled quantum side information), we can design very
efficient privacy amplification protocols and network extractors.
","[{""version"":""v1"",""created"":""Mon, 10 Nov 2014 03:40:05 GMT""}]","2014-11-11"
"1411.2316","Vishnu Naresh Boddeti","Joseph A. Fernandez, Vishnu Naresh Boddeti, Andres Rodriguez, B. V. K.
  Vijaya Kumar","Zero-Aliasing Correlation Filters for Object Recognition","14 pages, to appear in IEEE Transactions on Pattern Analysis and
  Machine Intelligence (PAMI)",,"10.1109/TPAMI.2014.2375215",,"cs.CV stat.ML","http://arxiv.org/licenses/nonexclusive-distrib/1.0/","  Correlation filters (CFs) are a class of classifiers that are attractive for
object localization and tracking applications. Traditionally, CFs have been
designed in the frequency domain using the discrete Fourier transform (DFT),
where correlation is efficiently implemented. However, existing CF designs do
not account for the fact that the multiplication of two DFTs in the frequency
domain corresponds to a circular correlation in the time/spatial domain.
Because this was previously unaccounted for, prior CF designs are not truly
optimal, as their optimization criteria do not accurately quantify their
optimization intention. In this paper, we introduce new zero-aliasing
constraints that completely eliminate this aliasing problem by ensuring that
the optimization criterion for a given CF corresponds to a linear correlation
rather than a circular correlation. This means that previous CF designs can be
significantly improved by this reformulation. We demonstrate the benefits of
this new CF design approach with several important CFs. We present experimental
results on diverse data sets and present solutions to the computational
challenges associated with computing these CFs. Code for the CFs described in
this paper and their respective zero-aliasing versions is available at
http://vishnu.boddeti.net/projects/correlation-filters.html
","[{""version"":""v1"",""created"":""Mon, 10 Nov 2014 03:48:21 GMT""},{""version"":""v2"",""created"":""Wed, 19 Nov 2014 15:10:22 GMT""}]","2016-11-18"
"1411.2317","Miguel Angel Garcia Aspeitia","Aldrin Cervantes and Miguel A. Garc\'ia-Aspeitia","Numerical Prediction of cusps or kinks in the Nambu-Goto dynamics","17 pages, 4 figures. Accepted for Publication in Mod. Phys. Lett. A",,"10.1142/S0217732315502107",,"gr-qc","http://arxiv.org/licenses/nonexclusive-distrib/1.0/","  It is known that Nambu-Goto extended objects present some pathological
structures, such as cusps and kinks, during their evolution. In this paper, we
propose a model through the generalized Raychaudhuri equation [Rh] for
membranes to determine if there are cusps and kinks in the world-sheet. We
extend the generalized Rh equation for membranes to allow the study of the
effect of higher order curvature terms in the action on the issue of cusps and
kinks, using it as a tool for determining when a Nambu-Goto string generates
cusps or kinks in its evolution. Furthermore, we present three examples where
we test graphically this approach.
","[{""version"":""v1"",""created"":""Mon, 10 Nov 2014 03:54:04 GMT""},{""version"":""v2"",""created"":""Tue, 29 Sep 2015 13:45:38 GMT""}]","2015-12-16"
"1411.2318","Daniel Spector","Armin Schikorra, Daniel Spector, Jean Van Schaftingen","An $L^1$-type estimate for Riesz potentials","13 pages, improves previous version with full spectrum of result and
  with elementary proof, references display correctly in this version","Revista Matem\'atica Iberoamericana 33 (2017), no. 1, 291-304","10.4171/rmi/937",,"math.FA math.AP","http://arxiv.org/licenses/nonexclusive-distrib/1.0/","  In this paper we establish new $L^1$-type estimates for the classical Riesz
potentials of order $\alpha \in (0, N)$: \[
  \|I_\alpha u\|_{L^{N/(N-\alpha)}(\mathbb{R}^N)} \leq C
\|Ru\|_{L^1(\mathbb{R}^N;\mathbb{R}^N)}. \] This sharpens the result of Stein
and Weiss on the mapping properties of Riesz potentials on the real Hardy space
$\mathcal{H}^1(\mathbb{R}^N)$ and provides a new family of $L^1$-Sobolev
inequalities for the Riesz fractional gradient.
","[{""version"":""v1"",""created"":""Mon, 10 Nov 2014 04:28:56 GMT""},{""version"":""v2"",""created"":""Wed, 4 Feb 2015 10:23:40 GMT""},{""version"":""v3"",""created"":""Thu, 5 Feb 2015 09:15:37 GMT""},{""version"":""v4"",""created"":""Thu, 1 Sep 2016 20:41:56 GMT""}]","2017-07-04"
"1411.2319","Niels Martin Moller","Niels Martin M{\o}ller","Non-existence for self-translating solitons","15 pages",,,,"math.DG","http://arxiv.org/licenses/nonexclusive-distrib/1.0/","  This paper establishes geometric obstructions to the existence of complete,
properly embedded, mean curvature flow self-translating solitons
$\Sigma^n\subseteq \mathbb{R}^{n+1}$, generalizing previously known
non-existence conditions such as cylindrical boundedness.
","[{""version"":""v1"",""created"":""Mon, 10 Nov 2014 04:29:20 GMT""}]","2014-11-11"
"1411.2320","Laurentiu Maxim","Manuel Gonzalez Villa, Anatoly Libgober, Laurentiu Maxim","Motivic infinite cyclic covers","published version","Adv. Math. 298 (2016), 413-447",,,"math.AT","http://arxiv.org/licenses/nonexclusive-distrib/1.0/","  We associate with an infinite cyclic cover of a punctured neighborhood of a
simple normal crossing divisor on a complex quasi-projective manifold (assuming
certain finiteness conditions are satisfied) an element in the Grothendieck
ring $K_0({\rm Var}^{\hat \mu}_{\mathbb{C}})$, which we call {\it motivic
infinite cyclic cover}, and show its birational invariance. Our construction
provides a unifying approach for the Denef-Loeser motivic Milnor fibre of a
complex hypersurface singularity germ, and the motivic Milnor fiber of a
rational function, respectively.
","[{""version"":""v1"",""created"":""Mon, 10 Nov 2014 04:38:53 GMT""},{""version"":""v2"",""created"":""Tue, 23 Dec 2014 03:59:18 GMT""},{""version"":""v3"",""created"":""Mon, 16 Mar 2015 17:21:14 GMT""},{""version"":""v4"",""created"":""Mon, 23 May 2016 10:28:45 GMT""}]","2016-05-24"
"1411.2321","Jose D'Incao","J. P. D'Incao, Fatima Anis, and B. D. Esry","Ultracold Three-body Recombination in Two Dimensions","11 pages, 7 figures",,,,"quant-ph cond-mat.quant-gas","http://arxiv.org/licenses/nonexclusive-distrib/1.0/","  We study three-body recombination in two dimensions for systems interacting
via short-range two-body interactions in the regime of large scattering
lengths. Using the adiabatic hyperspherical representation, we derive
semi-analytical formulas for three-body recombination in both weakly and deeply
bound diatom states. Our results demonstrate the importance of long-range
corrections to the three-body potentials by showing how they alter the
low-energy and scattering length dependence of the recombination rate for both
bosonic and fermionic systems, which exhibit suppressed recombination if
compared to the three-dimensional case. We verify these results through
numerical calculations of recombination for systems with finite-range
interactions and supporting a few two-body bound states. We also study
finite-range effects for the energies of the universal three-identical-bosons
states and found a slow approach to universal predictions as a function of the
scattering length.
","[{""version"":""v1"",""created"":""Mon, 10 Nov 2014 04:41:46 GMT""}]","2014-11-11"
"1411.2322","Payal Mohanty","Payal Mohanty, Mahatsab Mandal, Pradip K Roy","Effect of anisotropy on HBT radii using leptonpair interferometry","5 pages, 4 figures",,,,"nucl-th","http://arxiv.org/licenses/nonexclusive-distrib/1.0/","  The effect of initial state momentum-space anisotropy on invariant mass
dependence of HBT radii extracted from the leptonpair interferometry is
presented here. We have studied the Bose-Einstein Correlation Function (BECF)
for two identical virtual photons decaying to leptonpairs at most central
collision of LHC energy having fixed transverse momentum of one of the virtual
photons ($k_{1T}$= 2 GeV). The {\em free streaming interpolating} model with
fixed initial condition has been used for the evolution in anisotropic Quark
Gluon Plasma (aQGP) and the relativistic (1+2)d hydrodynamics model with
cylindrical symmetry and longitudinal boost invariance has been used for both
isotropic Quark Gluon Plasma (iQGP) and hadronic phases. We found a significant
change in the spatial and temporal dimension of the evolving system in presence
of initial state momentum-space anisotropy.
","[{""version"":""v1"",""created"":""Mon, 10 Nov 2014 04:52:02 GMT""}]","2014-11-11"
"1411.2323","Uma  Papnoi","Uma Papnoi, Megan Govender, Sushant G Ghosh","Thermodynamic structure of field equations near apparent horizon for
  radiating black holes",,"Modern Physics Letters A Vol. 29, No. 34 (2014) 1450188","10.1142/S0217732314501880",,"gr-qc","http://arxiv.org/licenses/nonexclusive-distrib/1.0/","  We study the intriguing analogy between gravitational dynamics of the horizon
and thermodynamics for the case of nonstationary radiating spherically
symmetric black holes both in four dimensions and higher dimensions. By
defining all kinematical parameters of nonstationary radiating black holes in
terms of null vectors, we demonstrate that it is possible to interpret the
Einstein field equations near the apparent horizon in the form of a
thermodynamical identity $TdS=dE+PdV$.
","[{""version"":""v1"",""created"":""Mon, 10 Nov 2014 04:55:24 GMT""}]","2014-11-11"
