"1411.7557","Liu Hong","Liu Hong, Ya-Jing Huang, Wen-An Yong","A Kinetic Model for Cell Damage Caused by Oligomer Formation","16 pages+ 5 figures for maintext; 8 pages+ 4 figures for Supporting
  Materials",,,,"q-bio.BM q-bio.CB","http://arxiv.org/licenses/nonexclusive-distrib/1.0/","  It is well-known that the formation of amyloid fiber may cause invertible
damage to cells, while the underlying mechanism has not been fully uncovered.
In this paper, we construct a mathematical model, consisting of infinite ODEs
in the form of mass-action equations together with two reaction-convection
PDEs, and then simplify it to a system of 5 ODEs by using the maximum entropy
principle. This model is based on four simple assumptions, one of which is that
cell damage is raised by oligomers rather than mature fibrils. With the
simplified model, the effects of nucleation and elongation, fragmentation,
protein and seeds concentrations on amyloid formation and cell damage are
extensively explored and compared with experiments. We hope that our results
can provide a valuable insight into the processes of amyloid formation and cell
damage thus raised.
","[{""version"":""v1"",""created"":""Thu, 27 Nov 2014 11:46:33 GMT""}]","2014-12-01"
"1411.7558","Georg Engel","Georg P. Engel","Chiral condensate in nf=2 QCD from the Banks-Casher relation","7 pages, 6 figures, talk presented at the 32nd International
  Symposium on Lattice Field Theory - Lattice 2014, June 23-28, 2014, Columbia
  University New York, NY","PoS(LATTICE2014)073",,,"hep-lat","http://arxiv.org/licenses/nonexclusive-distrib/1.0/","  Exploiting the Banks-Casher relation, we present a direct determination of
the chiral condensate in two-flavor QCD, computing the mode number of the
O(a)-improved Wilson-Dirac operator below various cutoffs. We make use of
CLS-configurations with three different lattice spacings in the range of
0.05-0.08 fm and pion masses down to 190 MeV. Our data indicate a non-zero
density of eigenmodes near the origin and hence points to spontaneous chiral
symmetry breaking. We extrapolate our results to the continuum and chiral limit
to give a result for the chiral condensate.
","[{""version"":""v1"",""created"":""Thu, 27 Nov 2014 11:50:21 GMT""},{""version"":""v2"",""created"":""Wed, 3 Dec 2014 08:09:35 GMT""}]","2014-12-04"
"1411.7559","Sergio Scopetta","Sergio Scopetta, Alessio Del Dotto, Leonid Kaptari, Emanuele Pace,
  Matteo Rinaldi, Giovanni Salm\`e","A Light-Front approach to the $^3$He spectral function","6 pages, 1 figure, invited talk at the Conference ""Light Cone 2014
  (LC2014)"", Raleigh, North Carolina, May 26-30, 2014. Submitted to Few-Body
  Systems",,"10.1007/s00601-014-0935-y",,"nucl-th hep-ph","http://arxiv.org/licenses/nonexclusive-distrib/1.0/","  The analysis of semi-inclusive deep inelastic electron scattering off
polarized $^3$He at finite momentum transfers, aimed at the extraction of the
quark transverse-momentum distributions in the neutron, requires the use of a
distorted spin-dependent spectral function for $^3$He, which takes care of the
final state interaction effects. This quantity is introduced in the
non-relativistic case, and its generalization in a Poincar\'e covariant
framework, in plane wave impulse approximation for the moment being, is
outlined. Studying the light-front spin-dependent spectral function for a J=1/2
system, such as the nucleon, it is found that, within the light-front dynamics
with a fixed number of constituents and in the valence approximation, only
three of the six leading twist T-even transverse-momentum distributions are
independent.
","[{""version"":""v1"",""created"":""Thu, 27 Nov 2014 11:53:29 GMT""}]","2015-09-30"
"1411.7560","Marta Abad","M. Abad, A. Recati, S. Stringari, and F. Chevy","Counter-flow instability of a quantum mixture of two superfluids","5 pages, 2 figues",,"10.1140/epjd/e2015-50851-y",,"cond-mat.quant-gas","http://arxiv.org/licenses/nonexclusive-distrib/1.0/","  We study the instability of a mixture of two interacting counter-flowing
superfluids. For a homogeneous system, we show that superfluid hydrodynamics
leads to the existence of a dynamical instability at a critical value of the
relative velocity $v_{cr}$. When the interspecies coupling is small the
critical value approaches the value $v_{cr}=c_1+c_2$, given by the sum of the
sound velocities of the two uncoupled superfluids, in agreement with the recent
prediction of [1] based on Landau's argument. The crucial dependence of the
critical velocity on the interspecies coupling is explicitly discussed. Our
results agree with previous predictions for weakly interacting Bose-Bose
mixtures and applies to Bose-Fermi superfluid mixtures as well. Results for the
stability of transversally trapped mixtures are also presented.
","[{""version"":""v1"",""created"":""Thu, 27 Nov 2014 11:57:38 GMT""}]","2015-06-11"
"1411.7561","Kiril Stoyanov","K. A. Stoyanov, R. K. Zamanov, G. Y. Latev, A. Y. Abedin, N. A. Tomov","Orbital parameters of the high-mass X-ray binary 4U 2206+54","4 pages, 4 figures. Accepted for publication in Astronomische
  Nachrichten",,"10.1002/asna.201412127",,"astro-ph.SR astro-ph.HE","http://arxiv.org/licenses/nonexclusive-distrib/1.0/","  We present new radial velocities of the high-mass X-ray binary star 4U
2206+54 based on optical spectra obtained with the Coude spectrograph at the 2m
RCC telescope at the Rozhen National Astronomical Observatory, Bulgaria in the
period November 2011 -- July 2013. The radial velocity curve of the HeI
$\lambda$6678 \AA\ line is modeled with an orbital period P$_{orb}$ = 9.568~d
and an eccentricity of $e$ = 0.3. These new measurements of the radial velocity
resolve the disagreements of the orbital period discussions.
","[{""version"":""v1"",""created"":""Thu, 27 Nov 2014 12:01:07 GMT""}]","2015-06-23"
"1411.7562","Srihari Keshavamurthy","Archana Shukla and Srihari Keshavamurthy","Bichromatic control of dynamical tunneling: influence of the irregular
  Floquet states","8 pages, 7 figures, to be submitted",,,,"nlin.CD","http://arxiv.org/licenses/nonexclusive-distrib/1.0/","  Bichromatic control, in terms of the amplitude and relative phase of the
second field as control knobs, is an useful approach for controlling a variety
of quantum processes. In this context, understanding the features of the
control landscape is important to assess the extent and efficiency of the
control process. A key question is whether, for a given quantum process, one
can have regions wherein there is a complete lack of control. In this work we
show that such regions do exist and can be explained on the basis of the phase
space nature of the quantum Floquet states. Specifically, we show that robust
regions of no control arise due to the phenomenon of chaos-assisted tunneling.
We also comment on the possible influence of such regions on the phenomenon of
directed transport in quantum Hamiltonian ratchets.
","[{""version"":""v1"",""created"":""Thu, 27 Nov 2014 12:03:51 GMT""}]","2014-12-01"
"1411.7563","Pawe{\l} Pilarczyk","Shaun Harker, Hiroshi Kokubu, Konstantin Mischaikow, Pawe{\l}
  Pilarczyk","Inducing a map on homology from a correspondence",,,,,"math.AT","http://arxiv.org/licenses/nonexclusive-distrib/1.0/","  We study the homomorphism induced in homology by a closed correspondence
between topological spaces, using projections from the graph of the
correspondence to its domain and codomain. We provide assumptions under which
the homomorphism induced by an outer approximation of a continuous map
coincides with the homomorphism induced in homology by the map. In contrast to
more classical results we do not require that the projection to the domain have
acyclic preimages. Moreover, we show that it is possible to retrieve correct
homological information from a correspondence even if some data is missing or
perturbed. Finally, we describe an application to combinatorial maps that are
either outer approximations of continuous maps or reconstructions of such maps
from a finite set of data points.
","[{""version"":""v1"",""created"":""Thu, 27 Nov 2014 12:04:09 GMT""}]","2014-12-01"
"1411.7564","Chunhua Shen","Peng Wang, Chunhua Shen, Anton van den Hengel, Philip H. S. Torr","Large-scale Binary Quadratic Optimization Using Semidefinite Relaxation
  and Applications","Fixed some typos. 18 pages. Accepted to IEEE Transactions on Pattern
  Analysis and Machine Intelligence",,"10.1109/TPAMI.2016.2541146",,"cs.CV","http://arxiv.org/licenses/nonexclusive-distrib/1.0/","  In computer vision, many problems such as image segmentation, pixel
labelling, and scene parsing can be formulated as binary quadratic programs
(BQPs). For submodular problems, cuts based methods can be employed to
efficiently solve large-scale problems. However, general nonsubmodular problems
are significantly more challenging to solve. Finding a solution when the
problem is of large size to be of practical interest, however, typically
requires relaxation. Two standard relaxation methods are widely used for
solving general BQPs--spectral methods and semidefinite programming (SDP), each
with their own advantages and disadvantages. Spectral relaxation is simple and
easy to implement, but its bound is loose. Semidefinite relaxation has a
tighter bound, but its computational complexity is high, especially for large
scale problems. In this work, we present a new SDP formulation for BQPs, with
two desirable properties. First, it has a similar relaxation bound to
conventional SDP formulations. Second, compared with conventional SDP methods,
the new SDP formulation leads to a significantly more efficient and scalable
dual optimization approach, which has the same degree of complexity as spectral
methods. We then propose two solvers, namely, quasi-Newton and smoothing Newton
methods, for the dual problem. Both of them are significantly more efficiently
than standard interior-point methods. In practice, the smoothing Newton solver
is faster than the quasi-Newton solver for dense or medium-sized problems,
while the quasi-Newton solver is preferable for large sparse/structured
problems. Our experiments on a few computer vision applications including
clustering, image segmentation, co-segmentation and registration show the
potential of our SDP formulation for solving large-scale BQPs.
","[{""version"":""v1"",""created"":""Thu, 27 Nov 2014 12:05:06 GMT""},{""version"":""v2"",""created"":""Sun, 22 Nov 2015 23:27:30 GMT""},{""version"":""v3"",""created"":""Tue, 23 Feb 2016 02:19:18 GMT""},{""version"":""v4"",""created"":""Mon, 2 May 2016 00:32:58 GMT""}]","2016-11-17"
"1411.7565","Jesse Hemerik","Jesse Hemerik, Jelle Goeman","Exact testing with random permutations",,"Test, 2017 (Online First version)","10.1007/s11749-017-0571-1",,"math.ST stat.TH","http://arxiv.org/licenses/nonexclusive-distrib/1.0/","  When permutation methods are used in practice, often a limited number of
random permutations are used to decrease the computational burden. However,
most theoretical literature assumes that the whole permutation group is used,
and methods based on random permutations tend to be seen as approximate. There
exists a very limited amount of literature on exact testing with random
permutations and only recently a thorough proof of exactness was given. In this
paper we provide an alternative proof, viewing the test as a ""conditional Monte
Carlo test"" as it has been called in the literature. We also provide extensions
of the result. Importantly, our results can be used to prove properties of
various multiple testing procedures based on random permutations.
","[{""version"":""v1"",""created"":""Thu, 27 Nov 2014 12:05:10 GMT""},{""version"":""v2"",""created"":""Tue, 26 Jul 2016 09:58:46 GMT""},{""version"":""v3"",""created"":""Fri, 17 Aug 2018 08:40:30 GMT""}]","2018-08-20"
"1411.7566","Sergio Scopetta","Matteo Rinaldi, Sergio Scopetta, Marco Traini, Vicente Vento","Double parton distributions in Light-Front constituent quark models","6 pages, 3 figures, invited talk at the Conference ""Light Cone 2014
  (LC2014)"", Raleigh, North Carolina, May 26-30, 2014. Submitted to Few-Body
  Systems",,"10.1007/s00601-014-0933-0",,"hep-ph nucl-th","http://arxiv.org/licenses/nonexclusive-distrib/1.0/","  Double parton distribution functions (dPDF), accessible in high energy
proton-proton and proton nucleus collisions, encode information on how partons
inside a proton are correlated among each other and could represent a tool to
explore the 3D proton structure. In recent papers, double parton correlations
have been studied in the valence quark region, by means of constituent quark
models. This framework allows to understand clearly the dynamical origin of the
correlations and to establish which, among the features of the results, are
model independent. Recent relevant results, obtained in a relativistic
light-front scheme, able to overcome some drawbacks of previous calculations,
such as the poor support, will be presented. Peculiar transverse momentum
correlations, generated by the correct treatment of the boosts, are obtained.
The role of spin correlations will be also shown. In this covariant approach,
the symmetries of the dPDFs are unambiguously reproduced. The study of the QCD
evolution of the model results has been performed in the valence sector,
showing that, in some cases, the effect of evolution does not cancel that of
correlations.
","[{""version"":""v1"",""created"":""Thu, 27 Nov 2014 12:06:26 GMT""}]","2015-09-30"
"1411.7567","Wojciech Kozlowski","Wojciech Kozlowski, Santiago F. Caballero-Benitez, Igor B. Mekhov","Probing Matter-Field and Atom-Number Correlations in Optical Lattices by
  Global Nondestructive Addressing","8 pages, 6 figures; To be published in Phys. Rev. A (2015)","Physical Review A 92, 013613 (2015)","10.1103/PhysRevA.92.013613",,"quant-ph cond-mat.quant-gas physics.atom-ph physics.optics","http://arxiv.org/licenses/nonexclusive-distrib/1.0/","  We show that light scattering from an ultracold gas reveals not only density
correlations, but also matter-field interference at its shortest possible
distance in an optical lattice, which defines key properties such as tunneling
and matter-field phase gradients. This signal can be enhanced by concentrating
probe light between lattice sites rather than at density maxima. As addressing
between two single sites is challenging, we focus on global nondestructive
scattering, allowing probing order parameters, matter-field quadratures and
their squeezing. The scattering angular distribution displays peaks even if
classical diffraction is forbidden and we derive generalized Bragg conditions.
Light scattering distinguishes all phases in the Mott insulator - superfluid -
Bose glass phase transition.
","[{""version"":""v1"",""created"":""Thu, 27 Nov 2014 12:10:19 GMT""},{""version"":""v2"",""created"":""Mon, 1 Jun 2015 11:42:24 GMT""}]","2015-07-14"
"1411.7568","Kathrin Egberts","H.E.S.S. Collaboration: A. Abramowski, F. Aharonian, F. Ait Benkhali,
  A.G. Akhperjanian, E.O. Ang\""uner, M. Backes, S. Balenderan, A. Balzer, A.
  Barnacka, Y. Becherini, J. Becker Tjus, D. Berge, S. Bernhard, K. Bernl\""ohr,
  E. Birsin, J. Biteau, M. B\""ottcher, C. Boisson, J. Bolmont, P. Bordas, J.
  Bregeon, F. Brun, P. Brun, M. Bryan, T. Bulik, S. Carrigan, S. Casanova, P.M.
  Chadwick, N. Chakraborty, R. Chalme-Calvet, R.C.G. Chaves, M. Chr\'etien, S.
  Colafrancesco, G. Cologna, J. Conrad, C. Couturier, Y. Cui, I.D. Davids, B.
  Degrange, C. Deil, P. deWilt, A. Djannati-Ata\""i, W. Domainko, A. Donath,
  L.O'C. Drury, G. Dubus, K. Dutson, J. Dyks, M. Dyrda, T. Edwards, K. Egberts,
  P. Eger, P. Espigat, C. Farnier, S. Fegan, F. Feinstein, M.V. Fernandes, D.
  Fernandez, A. Fiasson, G. Fontaine, A. F\""orster, M. F\""u{\ss}ling, S.
  Gabici, M. Gajdus, Y.A. Gallant, T. Garrigoux, G. Giavitto, B. Giebels, J.F.
  Glicenstein, D. Gottschall, M.-H. Grondin, M. Grudzi\'nska, D. Hadasch, S.
  H\""affner, J. Hahn, J. Harris, G. Heinzelmann, G. Henri, G. Hermann, O.
  Hervet, A. Hillert, J.A. Hinton, W. Hofmann, P. Hofverberg, M. Holler, D.
  Horns, A. Ivascenko, A. Jacholkowska, C. Jahn, M. Jamrozy, M. Janiak, F.
  Jankowsky, I. Jung-Richardt, M.A. Kastendieck, K. Katarzy\'nski, U. Katz, S.
  Kaufmann, B. Kh\'elifi, M. Kieffer, S. Klepser, D. Klochkov, W. Klu\'zniak,
  D. Kolitzus, Nu. Komin, K. Kosack, S. Krakau, F. Krayzel, P.P. Kr\""uger, H.
  Laffon, G. Lamanna, J. Lefaucheur, V. Lefranc, A. Lemi\`ere, M.
  Lemoine-Goumard, J.-P. Lenain, T. Lohse, A. Lopatin, C.-C. Lu, V. Marandon,
  A. Marcowith, R. Marx, G. Maurin, N. Maxted, M. Mayer, T.J.L. McComb, J.
  M\'ehault, P.J. Meintjes, U. Menzler, M. Meyer, A.M.W. Mitchell, R. Moderski,
  M. Mohamed, K. Mor{\aa}, E. Moulin, T. Murach, M. de Naurois, J. Niemiec,
  S.J. Nolan, L. Oakes, H. Odaka, S. Ohm, B. Opitz, M. Ostrowski, I. Oya, M.
  Panter, R.D. Parsons, M. Paz Arribas, N.W. Pekeur, G. Pelletier, P.-O.
  Petrucci, B. Peyaud, S. Pita, H. Poon, G. P\""uhlhofer, M. Punch, A.
  Quirrenbach, S. Raab, I. Reichardt, A. Reimer, O. Reimer, M. Renaud, R. de
  los Reyes, F. Rieger, C. Romoli, S. Rosier-Lees, G. Rowell, B. Rudak, C.B.
  Rulten, V. Sahakian, D. Salek, D.A. Sanchez, A. Santangelo, R. Schlickeiser,
  F. Sch\""ussler, A. Schulz, U. Schwanke, S. Schwarzburg, S. Schwemmer, H. Sol,
  F. Spanier, G. Spengler, F. Spies, {\L}. Stawarz, R. Steenkamp, C. Stegmann,
  F. Stinzing, K. Stycz, I. Sushch, J.-P. Tavernet, T. Tavernier, A.M. Taylor,
  R. Terrier, M. Tluczykont, C. Trichard, K. Valerius, C. van Eldik, B. van
  Soelen, G. Vasileiadis, J. Veh, C. Venter, A. Viana, P. Vincent, J. Vink,
  H.J. V\""olk, F. Volpe, M. Vorster, T. Vuillaume, S.J. Wagner, P. Wagner, R.M.
  Wagner, M. Ward, M. Weidinger, Q. Weitzel, R. White, A. Wierzcholska, P.
  Willmann, A. W\""ornlein, D. Wouters, R. Yang, V. Zabalza, D. Zaborov, M.
  Zacharias, A.A. Zdziarski, A. Zech, H.-S. Zechlin, and Y. Fukui","Diffuse Galactic gamma-ray emission with H.E.S.S","8 pages, 2 figures, accepted for publication in Physical Review D",,"10.1103/PhysRevD.90.122007",,"astro-ph.HE","http://arxiv.org/licenses/nonexclusive-distrib/1.0/","  Diffuse $\gamma$-ray emission is the most prominent observable signature of
celestial cosmic-ray interactions at high energies. While already being
investigated at GeV energies over several decades, assessments of diffuse
$\gamma$-ray emission at TeV energies remain sparse. After completion of the
systematic survey of the inner Galaxy, the H.E.S.S. experiment is in a prime
position to observe large-scale diffuse emission at TeV energies. Data of the
H.E.S.S. Galactic Plane Survey are investigated in regions off known
$\gamma$-ray sources. Corresponding $\gamma$-ray flux measurements were made
over an extensive grid of celestial locations. Longitudinal and latitudinal
profiles of the observed $\gamma$-ray fluxes show characteristic excess
emission not attributable to known $\gamma$-ray sources. For the first time
large-scale $\gamma$-ray emission along the Galactic Plane using imaging
atmospheric Cherenkov telescopes has been observed. While the background
subtraction technique limits the ability to recover modest variation on the
scale of the H.E.S.S. field of view or larger, which is characteristic of the
inverse Compton scatter-induced Galactic diffuse emission, contributions of
neutral pion decay as well as emission from unresolved $\gamma$-ray sources can
be recovered in the observed signal to a large fraction. Calculations show that
the minimum $\gamma$-ray emission from $\pi^0$-decay represents a significant
contribution to the total signal. This detection is interpreted as a mix of
diffuse Galactic $\gamma$-ray emission and unresolved sources.
","[{""version"":""v1"",""created"":""Thu, 27 Nov 2014 12:10:34 GMT""}]","2016-08-10"
"1411.7569","Francisco Jose Herranz","Angel Ballesteros, Alberto Enciso, Francisco J. Herranz, Orlando
  Ragnisco and Danilo Riglioni","Exactly solvable deformations of the oscillator and Coulomb systems and
  their generalization","12 pages, 2 figures. Based on the contribution presented at ""The 30th
  International Colloquium on Group Theoretical Methods in Physics"", July
  14-18, 2014, Ghent, Belgium. Some comments added. To appear in Journal of
  Physics: Conference Series","J. Phys.: Conf. Ser. 597 (2015) 012014","10.1088/1742-6596/597/1/012014",,"quant-ph math-ph math.MP nlin.SI","http://arxiv.org/licenses/nonexclusive-distrib/1.0/","  We present two maximally superintegrable Hamiltonian systems ${\cal
H}_\lambda$ and ${\cal H}_\eta$ that are defined, respectively, on an
$N$-dimensional spherically symmetric generalization of the Darboux surface of
type III and on an $N$-dimensional Taub-NUT space. Afterwards, we show that the
quantization of ${\cal H}_\lambda$ and ${\cal H}_\eta$ leads, respectively, to
exactly solvable deformations (with parameters $\lambda$ and $\eta$) of the two
basic quantum mechanical systems: the harmonic oscillator and the Coulomb
problem. In both cases the quantization is performed in such a way that the
maximal superintegrability of the classical Hamiltonian is fully preserved. In
particular, we prove that this strong condition is fulfilled by applying the
so-called conformal Laplace-Beltrami quantization prescription, where the
conformal Laplacian operator contains the usual Laplace-Beltrami operator on
the underlying manifold plus a term proportional to its scalar curvature (which
in both cases has non-constant value). In this way, the eigenvalue problems for
the quantum counterparts of ${\cal H}_\lambda$ and ${\cal H}_\eta$ can be
rigorously solved, and it is found that their discrete spectrum is just a
smooth deformation (in terms of the parameters $\lambda$ and $\eta$) of the
oscillator and Coulomb spectrum, respectively. Moreover, it turns out that the
maximal degeneracy of both systems is preserved under deformation. Finally, new
further multiparametric generalizations of both systems that preserve their
superintegrability are envisaged.
","[{""version"":""v1"",""created"":""Thu, 27 Nov 2014 12:16:04 GMT""},{""version"":""v2"",""created"":""Thu, 25 Dec 2014 20:04:06 GMT""}]","2015-04-15"
"1411.7570","Qiang Gao","Qiang Gao, Huan-huan Xie, Lei Li, Gang Lei, Jian-Bo Deng, Xian-Ru Hu","$Ab$ $intito$ study on some new spin-gapless semiconductors: The
  Zr-based quanternary Heusler alloys","14 pages, 4 figures, 2 tables","Superlattices and Microstructures 85 (2015) 536-542","10.1016/j.spmi.2015.05.049",,"cond-mat.mtrl-sci physics.comp-ph","http://arxiv.org/licenses/nonexclusive-distrib/1.0/","  Employing $ab$ $intito$ electronic structure calculations, we have
investigated electronic and magnetic properties of the Zr-based quanternary
Heusler alloys: ZrCoVIn, ZrFeVGe, ZrCoFeP, ZrCoCrBe and ZrFeCrZ (Z=In and Ga).
Our $ab$ $intito$ calculation results show that all the alloys are (or nearly)
spin-gapless semiconductors. All the alloys have large band gaps, indicating
the stability of them at room temperature. The Slater-Pauling behaviours of
these alloys are discussed as well. The values of Curie temperature of all the
alloys are estimated. And it is found that the values of the Curie temperature
for all our calculated quanternary Heusler alloys are higher than that of room
temperature.
","[{""version"":""v1"",""created"":""Thu, 27 Nov 2014 12:24:35 GMT""},{""version"":""v2"",""created"":""Tue, 20 Jan 2015 03:34:45 GMT""}]","2015-09-01"
"1411.7571","Durba Bhattacharya ms","Durba Bhattacharya and Sourabh Bhattacharya","A Bayesian Semiparametric Approach to Learning About Gene-Gene
  Interactions in Case-Control Studies","To appear in Journal of Applied Statistics",,,,"stat.AP","http://arxiv.org/licenses/nonexclusive-distrib/1.0/","  Gene-gene interactions are often regarded as playing significant roles in
influencing variabilities of complex traits. Although much research has been
devoted to this area, to date a comprehensive statistical model that addresses
the various sources of uncertainties, seem to be lacking. In this paper, we
propose and develop a novel Bayesian semiparametric approach composed of finite
mixtures based on Dirichlet processes and a hierarchical matrix-normal
distribution that can comprehensively account for the unknown number of
sub-populations and gene-gene interactions. Then, by formulating novel and
suitable Bayesian tests of hypotheses we attempt to single out the roles of the
genes, individually, and in interaction with other genes, in case-control
studies. We also attempt to identify the significant loci associated with the
disease. Our model facilitates a highly efficient parallel computing
methodology, combining Gibbs sampling and Transformation based MCMC (TMCMC).
Application of our ideas to biologically realistic data sets revealed quite
encouraging performance. We also applied our ideas to a real, myocardial
infarction dataset, and obtained interesting results that partly agree with,
and also complement, the existing works in this area, to reveal the importance
of sophisticated and realistic modeling of gene-gene interactions.
","[{""version"":""v1"",""created"":""Thu, 27 Nov 2014 12:27:58 GMT""},{""version"":""v2"",""created"":""Thu, 19 May 2016 12:15:00 GMT""},{""version"":""v3"",""created"":""Tue, 15 Nov 2016 17:22:12 GMT""},{""version"":""v4"",""created"":""Tue, 14 Mar 2017 17:14:03 GMT""},{""version"":""v5"",""created"":""Fri, 21 Jul 2017 09:17:29 GMT""},{""version"":""v6"",""created"":""Tue, 17 Apr 2018 12:57:03 GMT""}]","2018-04-18"
