"1411.7457","Adam Jacob","Adam Jacob and Shing-Tung Yau","A special Lagrangian type equation for holomorphic line bundles","29 pages",,,,"math.DG","http://arxiv.org/licenses/nonexclusive-distrib/1.0/","  Let $L$ be a holomorphic line bundle over a compact K\""ahler manifold $X$.
Motivated by mirror symmetry, we study the deformed Hermitian-Yang-Mills
equation on $L$, which is the line bundle analogue of the special Lagrangian
equation in the case that $X$ is Calabi-Yau. We show that this equation is the
Euler-Lagrange equation for a positive functional, and that solutions are
unique global minimizers. We provide a necessary and sufficient criterion for
existence in the case that $X$ is a K\""ahler surface. For the higher
dimensional cases, we introduce a line bundle version of the Lagrangian mean
curvature flow, and prove convergence when $L$ is ample and $X$ has
non-negative orthogonal bisectional curvature.
","[{""version"":""v1"",""created"":""Thu, 27 Nov 2014 03:31:57 GMT""}]","2014-12-01"
"1411.7458","Tingzeng Wu","Tingzeng Wu, Weigen Yan and Heping Zhang","Extremal matching energy of complements of trees","14 pages, 7 figures",,,,"math.CO","http://arxiv.org/licenses/nonexclusive-distrib/1.0/","  The matching energy is defined as the sum of the absolute values of the zeros
of the matching polynomial of a graph, which is proposed first by Gutman and
Wagner [The matching energy of a graph, Discrete Appl. Math. 160 (2012)
2177--2187]. And they gave some properties and asymptotic results of the
matching energy. In this paper, we characterize the trees with $n$ vertices
whose complements have the maximal, second-maximal and minimal matching energy.
Further, we determine the trees with a perfect matching whose complements have
the second-maximal matching energy. In particular, show that the trees with
edge-independence number number $p$ whose complements have the minimum matching
energy for $p=1,2,\ldots, \lfloor\frac{n}{2}\rfloor$.
","[{""version"":""v1"",""created"":""Thu, 27 Nov 2014 03:32:12 GMT""}]","2014-12-01"
"1411.7459","Dinh Nguyen Dinh","D. N. Dinh, S. T. Petcov","Radiative Emission of Neutrino Pairs in Atoms and Light Sterile
  Neutrinos","LATEX file, 19 pages, the effects of the 3-4 mixing taken into
  account, one table and four figures added, version to be published in Phys.
  Lett. B",,"10.1016/j.physletb.2015.01.020",,"hep-ph","http://arxiv.org/licenses/nonexclusive-distrib/1.0/","  The process of Radiative Emission of Neutrino Pair (RENP) in atoms is
sensitive to the absolute neutrino mass scale, the type of spectrum neutrino
masses obey and the nature - Dirac or Majorana - of massive neutrinos. We
analyse the possibility to test the hypothesis of existence of neutrinos with
masses at the eV scale coupled to the electron in the weak charged lepton
current in an RENP experiment. The presence of eV scale neutrinos in the
neutrino mixing is associated with the existence of sterile neutrinos which mix
with the active flavour neutrinos. At present there are a number of hints for
active-sterile neutrino oscillations driven by $\Delta m^2 \sim 1~{\rm eV^2}$.
We perform a detailed analysis of the RENP phenomenology within the ""3 + 1""
scheme with one sterile neutrino.
","[{""version"":""v1"",""created"":""Thu, 27 Nov 2014 03:37:52 GMT""},{""version"":""v2"",""created"":""Thu, 22 Jan 2015 04:01:38 GMT""}]","2015-06-23"
"1411.7460","Bharath Pattabiraman","Bharath Pattabiraman, Md. Mostofa Ali Patwary, Assefaw H. Gebremedhin,
  Wei-keng Liao, and Alok Choudhary","Fast Algorithms for the Maximum Clique Problem on Massive Graphs with
  Applications to Overlapping Community Detection","28 pages, 7 figures, 10 tables, 2 algorithms. arXiv admin note:
  substantial text overlap with arXiv:1209.5818","Internet Mathematics 2014, Special Issue (WAW'13)","10.1080/15427951.2014.986778",,"cs.DS cs.SI","http://arxiv.org/licenses/nonexclusive-distrib/1.0/","  The maximum clique problem is a well known NP-Hard problem with applications
in data mining, network analysis, information retrieval and many other areas
related to the World Wide Web. There exist several algorithms for the problem
with acceptable runtimes for certain classes of graphs, but many of them are
infeasible for massive graphs. We present a new exact algorithm that employs
novel pruning techniques and is able to find maximum cliques in very large,
sparse graphs quickly. Extensive experiments on different kinds of synthetic
and real-world graphs show that our new algorithm can be orders of magnitude
faster than existing algorithms. We also present a heuristic that runs orders
of magnitude faster than the exact algorithm while providing optimal or
near-optimal solutions. We illustrate a simple application of the algorithms in
developing methods for detection of overlapping communities in networks.
","[{""version"":""v1"",""created"":""Thu, 27 Nov 2014 03:40:06 GMT""}]","2014-12-01"
"1411.7461","Yoshifumi Nakamura","Xiao-Yong Jin, Yoshinobu Kuramashi, Yoshifumi Nakamura, Shinji Takeda,
  Akira Ukawa","Critical endpoint of finite temperature phase transition for three
  flavor QCD","24 pages, 14 figures",,"10.1103/PhysRevD.91.014508",,"hep-lat","http://arxiv.org/licenses/nonexclusive-distrib/1.0/","  We investigate the critical endpoint of finite temperature phase transition
of $N_f=3$ QCD at zero chemical potential. We employ the renormalization-group
improved Iwasaki gauge action and non-perturbatively $O(a)$-improved
Wilson-clover fermion action. The critical endpoint is determined by using the
intersection point of kurtosis for the temporal size $N_t$=4, 6, 8. Spatial
sizes of $N_l$=6-16 ($N_t$=4), 10-24 ($N_t$=6), and 12-24 ($N_t$=8) are
employed. We find that $N_t$=4 is out of the scaling region. Using results for
$N_t$=6 and 8, and making linear extrapolations in $1/N_t^2$, we obtain
$\sqrt{t_0}T_{\rm E}=0.0975(14)(8)$, $\sqrt{t_0}m_{\rm PS,E}=0.2254(52)(105)$
and $m_{\rm PS,E}/T_{\rm E}=2.311(63)(13)$, where the first error is
statistical error, the second error is systematic error, and $m_{\rm PS}$ is
the pseudo scalar meson mass. If one uses $1/\sqrt{t_0}=1.347(30)$ GeV reported
by Borsanyi et al., one finds $T_{\rm E}=131(2)(1)(3)$ MeV, $m_{\rm
PS,E}=304(7)(14)(7)$ MeV and $m_{\rm PS,E}/m_{\rm PS,E}^{\rm phys,
sym}=0.739(17)(34)(17)$, where the third error comes from error of $\sqrt{t_0}$
and $m_{\rm PS}^{\rm phys, sym}=\sqrt{(m_\pi^2+2m_K^2)/3}$. Our current
estimation of $\sqrt{t_0}m_{\rm PS,E}$ in the continuum limit is about 25%
smaller than the SU(3) symmetric point.
","[{""version"":""v1"",""created"":""Thu, 27 Nov 2014 03:43:31 GMT""}]","2015-06-23"
"1411.7462","Chao Xu","Tehuan Chen and Chao Xu and Zhigang Ren and Ryan Loxton","Optimal Boundary Control for Water Hammer Suppression in Fluid
  Transmission Pipelines",,,,,"cs.CE","http://arxiv.org/licenses/nonexclusive-distrib/1.0/","  When fluid flow in a pipeline is suddenly halted, a pressure surge or wave is
created within the pipeline. This phenomenon, called water hammer, can cause
major damage to pipelines, including pipeline ruptures. In this paper, we model
the problem of mitigating water hammer during valve closure by an optimal
boundary control problem involving a nonlinear hyperbolic PDE system that
describes the fluid flow along the pipeline. The control variable in this
system represents the valve boundary actuation implemented at the pipeline
terminus. To solve the boundary control problem, we first use {the method of
lines} to obtain a finite-dimensional ODE model based on the original PDE
system. Then, for the boundary control design, we apply the control
parameterization method to obtain an approximate optimal parameter selection
problem that can be solved using nonlinear optimization techniques such as
Sequential Quadratic Programming (SQP). We conclude the paper with simulation
results demonstrating the capability of optimal boundary control to
significantly reduce flow fluctuation.
","[{""version"":""v1"",""created"":""Thu, 27 Nov 2014 03:45:43 GMT""}]","2014-12-01"
"1411.7463","Gao-Chan Yong","He-Lei Liu, Gao-Chan Yong, and De-Hua Wen","Probing the momentum-dependence of the symmetry potential by the free
  n/p ratio of preequilibrium emission","4 pages, 5 figures","Phsy. Rev. C 91, 024604 (2015)","10.1103/PhysRevC.91.024604",,"nucl-th nucl-ex","http://arxiv.org/licenses/nonexclusive-distrib/1.0/","  Based on an isospin and momentum-dependent transport model, we studied the
effect of momentum-dependent symmetry potential on the free neutron to proton
ratio of preequilibrium nucleon emission. It is found that for
$^{132}Sn+^{124}Sn$ reaction at 400 MeV/nucleon incident beam energy, free n/p
ratio of preequilibrium nucleon emission mainly probe the momentum-dependence
of symmetry potential at nucleon momentum around 400 $\sim$ 600 MeV/c. Whereas
for 200 MeV/nucleon incident beam energy, this observable mainly probe the
momentum-dependence of symmetry potential at nucleon momentum around 200 $\sim$
400 MeV/c. To probe the symmetry energy/potential using free n/p ratio, not all
the details of the momentum-dependence of the symmetry potential are important,
the values of symmetry potential at only certain momentum range are crucial for
an observable. It is important to input reasonable density- and
momentum-dependence of the symmetry potential according to the magnitude of
incident beam energy of heavy-ion collisions. The present experimental data on
the symmetry potential are not enough for probing the density-dependent
symmetry energy. More experimental data (such as nucleon and nuclei's
scattering experiments at different nucleonic momenta and densities) on the
symmetry potential are therefore needed to pin down the density-dependent
symmetry energy.
","[{""version"":""v1"",""created"":""Thu, 27 Nov 2014 04:02:23 GMT""},{""version"":""v2"",""created"":""Wed, 7 Jan 2015 10:20:35 GMT""}]","2015-02-11"
"1411.7464","Xiaobing Feng Dr.","Xiaobing Feng, Zhihao Ge, and Yukun Li","Multiphysics Finite Element Methods for a Poroelasticity Model","8 figures and 1 table",,,,"math.NA","http://arxiv.org/licenses/nonexclusive-distrib/1.0/","  This paper concerns with finite element approximations of a quasi-static
poroelasticity model in displacement-pressure formulation which describes the
dynamics of poro-elastic materials under an applied mechanical force on the
boundary. To better describe the multiphysics process of deformation and
diffusion for poro-elastic materials, we first present a reformulation of the
original model by introducing two pseudo-pressures, one of them is shown to
satisfy a diffusion equation, we then propose a time-stepping algorithm which
decouples (or couples) the reformulated PDE problem at each time step into two
sub-problems, one of which is a generalized Stokes problem for the displacement
vector field (of the solid network of the poro-elastic material) along with one
pseudo-pressure field and the other is a diffusion problem for the other
pseudo-pressure field (of the solvent of the material). In the paper, the
Taylor-Hood mixed finite element method combined with the $P_1$-conforming
finite element method is used as an example to demonstrate the viability of the
proposed multiphysics approach. It is proved that the solutions of the fully
discrete finite element methods fulfill a discrete energy law which mimics the
differential energy law satisfied by the PDE solution and converges optimally
in the energy norm. Moreover, it is showed that the proposed formulation also
has a built-in mechanism to overcome so-called ""locking phenomenon"" associated
with the numerical approximations of the poroelasticity model. Numerical
experiments are presented to show the performance of the proposed approach and
methods and to demonstrate the absence of ""locking phenomenon"" in our numerical
experiments.
","[{""version"":""v1"",""created"":""Thu, 27 Nov 2014 04:04:38 GMT""}]","2014-12-01"
"1411.7465","A.K. Srivastava Dr.","K. Murawski, A. Solov'ev, J. Kraskiewicz, A.K. Srivastava","New analytical and numerical models of solar coronal loop: I.
  Application to forced vertical kink oscillations","6 Pages; 5 Figures; A&A","A&A 576, A22 (2015)","10.1051/0004-6361/201424684",,"astro-ph.SR","http://arxiv.org/licenses/nonexclusive-distrib/1.0/","  Aims. We construct a new analytical model of a solar coronal loop that is
embedded in a gravitationally stratified and magnetically confined atmosphere.
On the basis of this analytical model, we devise a numerical model of solar
coronal loops. We adopt it to perform the numerical simulations of its vertical
kink oscillations excited by an external driver. Methods. Our model of the
solar atmosphere is constructed by adopting a realistic temperature
distribution and specifying the curved magnetic field lines that constitute a
coronal loop. This loop is described by 2D, ideal magnetohydro- dynamic
equations that are numerically solved by the FLASH code. Results. The vertical
kink oscillations are excited by a periodic driver in the vertical component of
velocity, acting at the top of the photosphere. For this forced driver with its
amplitude 3 km/s, the excited oscillations exhibit about 1.2 km/s amplitude in
their velocity and the loop apex oscillates with its amplitude in displacement
of about 100 km. Conclusions. The newly devised analytical model of the coronal
loops is utilized for the numerical simulations of the vertical kink
oscillations, which match well with the recent observations of decay-less kink
oscillations excited in solar loops. The model will have further implications
on the study of waves and plasma dynamics in coronal loops, revealing physics
of energy and mass transport mechanisms in the localized solar atmosphere.
","[{""version"":""v1"",""created"":""Thu, 27 Nov 2014 04:07:42 GMT""}]","2015-03-25"
"1411.7466","Chunhua Shen","Lingqiao Liu, Chunhua Shen, Anton van den Hengel","The Treasure beneath Convolutional Layers: Cross-convolutional-layer
  Pooling for Image Classification",,,,,"cs.CV","http://arxiv.org/licenses/nonexclusive-distrib/1.0/","  A number of recent studies have shown that a Deep Convolutional Neural
Network (DCNN) pretrained on a large dataset can be adopted as a universal
image description which leads to astounding performance in many visual
classification tasks. Most of these studies, if not all, adopt activations of
the fully-connected layer of a DCNN as the image or region representation and
it is believed that convolutional layer activations are less discriminative.
  This paper, however, advocates that if used appropriately convolutional layer
activations can be turned into a powerful image representation which enjoys
many advantages over fully-connected layer activations. This is achieved by
adopting a new technique proposed in this paper called
cross-convolutional-layer pooling. More specifically, it extracts subarrays of
feature maps of one convolutional layer as local features and pools the
extracted features with the guidance of feature maps of the successive
convolutional layer. Compared with exising methods that apply DCNNs in the
local feature setting, the proposed method is significantly faster since it
requires much fewer times of DCNN forward computation. Moreover, it avoids the
domain mismatch issue which is usually encountered when applying fully
connected layer activations to describe local regions. By applying our method
to four popular visual classification tasks, it is demonstrated that the
proposed method can achieve comparable or in some cases significantly better
performance than existing fully-connected layer based image representations
while incurring much lower computational cost.
","[{""version"":""v1"",""created"":""Thu, 27 Nov 2014 04:12:57 GMT""}]","2014-12-01"
"1411.7467","Giuseppe Sellaroli","Giuseppe Sellaroli","Wigner-Eckart theorem for the non-compact algebra sl(2,R)","20 pages, typos corrected","J. Math. Phys. 56, 041701 (2015)","10.1063/1.4916889",,"math-ph gr-qc hep-th math.MP math.RT","http://arxiv.org/licenses/nonexclusive-distrib/1.0/","  The Wigner-Eckart theorem is a well known result for tensor operators of
su(2) and, more generally, any compact Lie algebra. In this paper the theorem
will be generalized to the particular non-compact case of sl(2,R). In order to
do so, recoupling theory between representations that are not necessarily
unitary will be studied, namely between finite-dimensional and
infinite-dimensional representations. As an application, the Wigner-Eckart
theorem will be used to construct an analogue of the Jordan-Schwinger
representation, previously known only for representations in the discrete
class, which also covers the continuous class.
","[{""version"":""v1"",""created"":""Thu, 27 Nov 2014 04:33:44 GMT""},{""version"":""v2"",""created"":""Wed, 11 Mar 2015 15:36:17 GMT""}]","2015-04-09"
"1411.7468","Tyas Fiantoro","Tyas Pandu Fiantoro, Lussya Eveline","Single Channel Cutaneous Electrogastrography on Local White Rabbit
  (Oryctolagus cuniculus) and Its Electrogastrogram Classification Algorithm","5 pages, 8 figures; typo corrected",,,,"q-bio.QM","http://arxiv.org/licenses/nonexclusive-distrib/1.0/","  It has been a common practice to place electrodes based on external
landmarks, rather than locating the appropriate organ first by imaging
technuiqes such as CT scan, ultrasound, etc. Therefore, aside from abiding the
cutaneous EGG (electrogastrography) electrodes placement rule, identification
of its waveform should be performed to ease the validation of one's EGG
recording method. This research focused on the assembly of EGG instrument, its
performance testing, and its usage on local white rabbit (O. cuniculus). A
total of 72 recordings obtained and processed. Data procession implies EGG
parameterization based on segmentation and time domain analysis. Therefore this
research gives an insight of an EGG recording method that could be applied on
another preclinical, veterinary, and even for clinical examination.
","[{""version"":""v1"",""created"":""Thu, 27 Nov 2014 04:49:10 GMT""},{""version"":""v2"",""created"":""Wed, 3 Dec 2014 18:03:05 GMT""},{""version"":""v3"",""created"":""Fri, 5 Dec 2014 15:23:00 GMT""}]","2014-12-08"
"1411.7469","Sanjay Chakraborty","Lopamudra Dey and Sanjay Chakraborty","Canonical PSO Based k-Means Clustering Approach for Real Datasets",,,,,"cs.DB","http://creativecommons.org/licenses/by/3.0/","  ""Clustering"" the significance and application of this technique is spread
over various fields. Clustering is an unsupervised process in data mining, that
is why the proper evaluation of the results and measuring the compactness and
separability of the clusters are important issues.The procedure of evaluating
the results of a clustering algorithm is known as cluster validity measure.
Different types of indexes are used to solve different types of problems and
indices selection depends on the kind of available data.This paper first
proposes Canonical PSO based K-means clustering algorithm and also analyses
some important clustering indices (intercluster, intracluster) and then
evaluates the effects of those indices on real-time air pollution
database,wholesale customer, wine, and vehicle datasets using typical K-means,
Canonical PSO based K-means, simple PSO based K-means,DBSCAN, and Hierarchical
clustering algorithms.This paper also describes the nature of the clusters and
finally compares the performances of these clustering algorithms according to
the validity assessment. It also defines which algorithm will be more desirable
among all these algorithms to make proper compact clusters on this particular
real life datasets. It actually deals with the behaviour of these clustering
algorithms with respect to validation indexes and represents their results of
evaluation in terms of mathematical and graphical forms.
","[{""version"":""v1"",""created"":""Thu, 27 Nov 2014 04:50:30 GMT""}]","2014-12-01"
"1411.7470","Toru  Sasahara","Toru Sasahara","Tangentially biharmonic Lagrangian H-umbilical submanifolds in complex
  space forms",,,,,"math.DG","http://arxiv.org/licenses/nonexclusive-distrib/1.0/","  The notion of Lagrangian $H$-umbilical submanifolds was introduced by B. Y.
Chen in 1997, and these submanifolds have appeared in several important
problems in the study of Lagrangian submanifolds from the Riemannian geometric
point of view. Recently, the author introduced the notion of tangentially
biharmonic submanifolds, which are defined as submanifolds such that the
bitension field of the inclusion map has vanishing tangential component. The
normal bundle of a round hypersphere in $\mathbb{R}^n$ can be immersed as a
tangentially biharmonic Lagrangian $H$-umbilical submanifold in $\mathbb{C}^n$.
Motivated by this fact, we classify tangentially biharmonic Lagrangian
$H$-umbilical submanifolds in complex space forms.
","[{""version"":""v1"",""created"":""Thu, 27 Nov 2014 04:51:10 GMT""},{""version"":""v2"",""created"":""Wed, 19 Oct 2022 06:58:40 GMT""}]","2022-10-20"
"1411.7471","Primitivo B. Acosta-Humanez","Primitivo B. Acosta-Hum\'anez, Maximiliano Machado-Higuera and
  Alexander V. Sinitsyn","A model of anaerobic digestion for biogas production using Abel
  equations","12 pages, 3 figures",,,,"math-ph math.MP","http://arxiv.org/licenses/nonexclusive-distrib/1.0/","  Some time ago has been studied mathematical models for biogas production due
to its importance in the use of control and optimization of re\-new\-able
resources and clean energy. In this paper we combine two algebraic methods to
obtain solutions of Abel equation of first kind that arise from a mathematical
model to biogas production formulated in France on 2001. The aim of this paper
is obtain Liouvillian solutions of Abel's equations through Hamiltonian
Algebrization. As an illustration, we present graphics of solutions for Abel
equations and solutions for algebrized Abel equations.
","[{""version"":""v1"",""created"":""Thu, 27 Nov 2014 04:56:52 GMT""},{""version"":""v2"",""created"":""Wed, 3 Aug 2016 03:29:22 GMT""},{""version"":""v3"",""created"":""Fri, 19 Aug 2016 19:50:58 GMT""}]","2016-08-22"
"1411.7472","Yichong Xu","Pingzhong Tang, Yifeng Teng, Zihe Wang, Shenke Xiao, Yichong Xu","Computational issues in time-inconsistent planning","20 pages, 7 figures, submitted to EC'15",,,,"cs.GT cs.CC cs.DS cs.SI","http://arxiv.org/licenses/nonexclusive-distrib/1.0/","  Time-inconsistency refers to a paradox in decision making where agents
exhibit inconsistent behaviors over time. Examples are procrastination where
agents tends to costly postpone easy tasks, and abandonments where agents start
a plan and quit in the middle. These behaviors are undesirable in the sense
that agents make clearly suboptimal decisions over optimal ones. To capture
such behaviors and more importantly, to quantify inefficiency caused by such
behaviors, [Kleinberg & Oren 2014] propose a graph model which is essentially
same as the standard planning model except for the cost structure. Using this
model, they initiate the study of several interesting problems: 1) cost ratio:
the worst ratio between the actual cost of the agent and the optimal cost, over
all graph instances; 2) motivating subgraph: how to motivate the agent to reach
the goal by deleting nodes and edges; 3) Intermediate rewards: how to motivate
agents to reach the goal by placing intermediate rewards. Kleinberg and Oren
give partial answers to these questions, but the main problems are still open.
In fact, they raise these problems explicitly as open problems in their paper.
In this paper, we give answers to all three open problems in [Kleinberg & Oren
2014]. First, we show a tight upper bound of cost ratio for graphs without
Akerlof's structure, thus confirm the conjecture by Kleinberg and Oren that
Akerlof's structure is indeed the worst case for cost ratio. Second, we prove
that finding a motivating subgraph is NP-hard, showing that it is generally
inefficient to motivate agents by deleting nodes and edges in the graph. Last
but not least, we show that computing a strategy to place minimum amount of
total reward is also NP-hard. Therefore, it is computational inefficient to
motivate agents by placing intermediate rewards. The techniques we use to prove
these results are nontrivial and of independent interests.
","[{""version"":""v1"",""created"":""Thu, 27 Nov 2014 05:15:08 GMT""},{""version"":""v2"",""created"":""Wed, 11 Feb 2015 07:41:27 GMT""},{""version"":""v3"",""created"":""Thu, 2 Apr 2015 14:37:34 GMT""}]","2015-04-03"
"1411.7473","Shuji Watanabe","Shuji Watanabe and Ken Kuriyama","Lipschitz continuity and monotone decreasingness of the solution to the
  BCS gap equation for superconductivity","For an revised version of this article, see arXiv:1609.07224",,,,"math-ph cond-mat.supr-con math.AP math.FA math.MP","http://arxiv.org/licenses/nonexclusive-distrib/1.0/","  In the preceding work \cite{watanabe3}, it is shown that the solution to the
BCS gap equation for superconductivity is continuous with respect to both the
temperature and the energy under the restriction that the temperature is very
small. Without this restriction, we show in this paper that the solution is
continuous with respect to both the temperature and the energy, and that the
solution is Lipschitz continuous and monotonically decreasing with respect to
the temperature.
","[{""version"":""v1"",""created"":""Thu, 27 Nov 2014 05:18:27 GMT""},{""version"":""v2"",""created"":""Mon, 13 Jun 2016 02:50:34 GMT""},{""version"":""v3"",""created"":""Fri, 3 Mar 2017 03:07:22 GMT""}]","2017-03-06"
