"1409.1052","Yuzhe Zhou","Yuzhe Zhou, Bo Ai","Provide High-QoS of the High-Speed Railway Mobile Communications in
  Cyber-Physical Systems","6 pages, 5 figures, The IEEE International Conference on Cyber,
  Physical and Social Computing (CPSCom 2012), accepted for publication,
  November, 2012. arXiv admin note: text overlap with arXiv:0805.2854 by other
  authors",,,,"cs.NI","http://arxiv.org/licenses/nonexclusive-distrib/1.0/","  Technical advances in networks, embedded computing, and wireless
communications are leading to the next generation of complex intelligent
systems called Cyber-Physical Systems (CPS). CPS promises to transform the way
we interact with the physical world. Efficient and reliable operation of the
CTCS-3 (Chinese Train Control System Level 3) is great protection of the
national economy and public safety. The CTCS-3 is based on GSM-R (GSM for
Railway) to achieve a continuous and two-way transmission of information
between ground and the train. To ensure the growing needs of safety, fastness
and service diversity of China's railway, the pursuit of high-QoS has been the
key of the relative study. This paper examines the main characteristics of
GSM-R and the requirements of all-layers' QoS indicators for GSM-R. Several
main technologies of improving QoS indicators of all-layers are summarized. As
a solution, a comprehensive scheme is proposed to improve the delay and packet
loss indicators. An example is also presented that illustrates the real-time
features of the proposed solution. Based on the CPS characteristics are highly
correlated with the QoS indicators, conclusions are made that GSM-R can provide
a reliable and real-time way for message.
","[{""version"":""v1"",""created"":""Wed, 3 Sep 2014 12:09:27 GMT""}]","2014-09-04"
"1409.1053","Uwe Aickelin","Jenna M. Reps, Uwe Aickelin and Jonathan M. Garibaldi","Tuning a Multiple Classifier System for Side Effect Discovery using
  Genetic Algorithms","Proceedings of the 2014 World Congress on Computational Intelligence
  (WCCI 2014), pp. 910-917, IEEE, Beijing, 2014",,,,"cs.LG cs.CE","http://arxiv.org/licenses/nonexclusive-distrib/1.0/","  In previous work, a novel supervised framework implementing a binary
classifier was presented that obtained excellent results for side effect
discovery. Interestingly, unique side effects were identified when different
binary classifiers were used within the framework, prompting the investigation
of applying a multiple classifier system. In this paper we investigate tuning a
side effect multiple classifying system using genetic algorithms. The results
of this research show that the novel framework implementing a multiple
classifying system trained using genetic algorithms can obtain a higher partial
area under the receiver operating characteristic curve than implementing a
single classifier. Furthermore, the framework is able to detect side effects
efficiently and obtains a low false positive rate.
","[{""version"":""v1"",""created"":""Wed, 3 Sep 2014 12:11:54 GMT""}]","2014-09-04"
"1409.1054","Adam  Kanigowski","Bassam Fayad and Adam Kanigowski","Multiple mixing for a class of conservative surface flows",,,,,"math.DS","http://arxiv.org/licenses/nonexclusive-distrib/1.0/","  Arnol'd and Kochergin mixing conservative flows on surfaces stand as the main
and almost only natural class of mixing transformations for which higher order
mixing has not been established, nor disproved. Under suitable arithmetic
conditions on their unique rotation vector, of full Lebesgue measure in the
first case and of full Hausdorff dimension in the second, we show that these
flows are mixing of any order. For this, we show that they display a
generalization of the so called Ratner property on slow divergence of nearby
orbits, that implies strong restrictions on their joinings, that in turn yield
higher order mixing. This is the first case in which the Ratner property is
used to prove multiple mixing outside its original context of horocycle flows
and we expect our approach will have further applications.
","[{""version"":""v1"",""created"":""Wed, 3 Sep 2014 12:13:57 GMT""}]","2014-09-04"
"1409.1055","Uwe Aickelin","Diman Hassan, Uwe Aickelin and Christian Wagner","Comparison of Distance Metrics for Hierarchical Data in Medical
  Databases","Proceedings of the 2014 World Congress on Computational Intelligence
  (WCCI 2014), pp. 3636-3643, 2014",,,,"cs.DB cs.CE","http://arxiv.org/licenses/nonexclusive-distrib/1.0/","  Distance metrics are broadly used in different research areas and
applications, such as bio-informatics, data mining and many other fields.
However, there are some metrics, like pq-gram and Edit Distance used
specifically for data with a hierarchical structure. Other metrics used for
non-hierarchical data are the geometric and Hamming metrics. We have applied
these metrics to The Health Improvement Network (THIN) database which has some
hierarchical data. The THIN data has to be converted into a tree-like structure
for the first group of metrics. For the second group of metrics, the data are
converted into a frequency table or matrix, then for all metrics, all distances
are found and normalised. Based on this particular data set, our research
question: which of these metrics is useful for THIN data? This paper compares
the metrics, particularly the pq-gram metric on finding the similarities of
patients' data. It also investigates the similar patients who have the same
close distances as well as the metrics suitability for clustering the whole
patient population. Our results show that the two groups of metrics perform
differently as they represent different structures of the data. Nevertheless,
all the metrics could represent some similar data of patients as well as
discriminate sufficiently well in clustering the patient population using
$k$-means clustering algorithm.
","[{""version"":""v1"",""created"":""Wed, 3 Sep 2014 12:19:19 GMT""}]","2014-09-04"
"1409.1056","L\'aszl\'o De\'ak","L De\'ak, L. Botty\'an, D.L. Nagy, and H. Spiering","A common optical algorithm for the evaluation of specular spin polarized
  neutron and M\""ossbauer reflectivities","4 pages, no figures, PNCMI2000 - Proceeding of the Third
  International Workshop on Polarized Neutrons","Physica B297 (2001) 113-117","10.1016/S0921-4526(00)00817-6",,"cond-mat.other physics.optics","http://arxiv.org/licenses/nonexclusive-distrib/1.0/","  Using the general approach of Lax for multiple scattering of waves a 2x2
covariant expression for the reflectivity of polarized slow neutrons of a
magnetic layer structure of arbitrary complexity is given including
polarization effects of the external magnetic field. The present formalism is
identical to the earlier published one for the (nuclear) resonant X-ray
(Mossbauer) reflectivity and properly takes the effect of the external magnetic
field of arbitrary direction on the neutron beam into account. The form of the
reflectivity matrix allows for an efficient numerical calculation.
","[{""version"":""v1"",""created"":""Wed, 3 Sep 2014 12:23:30 GMT""}]","2015-03-04"
"1409.1057","Uwe Aickelin","Alexandros Ladas, Jonathan M. Garibaldi, Rodrigo Scarpel and Uwe
  Aickelin","Augmented Neural Networks for Modelling Consumer Indebtness","Proceedings of the 2014 World Congress on Computational Intelligence
  (WCCI 2014), pp. 3086-3093, 2014",,,,"cs.CE cs.LG cs.NE","http://arxiv.org/licenses/nonexclusive-distrib/1.0/","  Consumer Debt has risen to be an important problem of modern societies,
generating a lot of research in order to understand the nature of consumer
indebtness, which so far its modelling has been carried out by statistical
models. In this work we show that Computational Intelligence can offer a more
holistic approach that is more suitable for the complex relationships an
indebtness dataset has and Linear Regression cannot uncover. In particular, as
our results show, Neural Networks achieve the best performance in modelling
consumer indebtness, especially when they manage to incorporate the significant
and experimentally verified results of the Data Mining process in the model,
exploiting the flexibility Neural Networks offer in designing their topology.
This novel method forms an elaborate framework to model Consumer indebtness
that can be extended to any other real world application.
","[{""version"":""v1"",""created"":""Wed, 3 Sep 2014 12:23:50 GMT""}]","2014-09-04"
"1409.1058","Maxim Zabzine","Jian Qiu and Maxim Zabzine","On twisted N=2 5D super Yang-Mills theory","30 pages, the vanishing theorem is improved, refs added","Lett.Math.Phys. 106 (2016) 1-27","10.1007/s11005-015-0804-8",,"hep-th math-ph math.DG math.MP math.SG","http://arxiv.org/licenses/nonexclusive-distrib/1.0/","  On a five dimensional simply connected Sasaki-Einstein manifold, one can
construct Yang-Mills theories coupled to matter with at least two
supersymmetries. The partition function of these theories localises on the
contact instantons, however the contact instanton equations are not elliptic.
It turns out that these equations can be embedded into the Haydys-Witten
equations (which are elliptic) in the same way the 4D anti-self-dual instanton
equations are embedded in the Vafa-Witten equations. We show that under some
favourable circumstances, the latter equations will reduce to the former by
proving some vanishing theorems. It was also known that the Haydys-Witten
equations on product manifolds $M_5=M_4\times \mathbb{R}$ arise in the context
of twisting the 5D maximally supersymmetric Yang-Mills theory. In this paper,
we present the construction of twisted $N=2$ Yang-Mills theory on
Sasaki-Einstein manifolds, and more generally on $K$-contact manifolds. The
localisation locus of this new theory thus provides a covariant version of the
Haydys-Witten equation.
","[{""version"":""v1"",""created"":""Wed, 3 Sep 2014 12:27:35 GMT""},{""version"":""v2"",""created"":""Sat, 15 Aug 2015 17:38:42 GMT""}]","2016-01-05"
"1409.1059","Uwe Aickelin","Yihui Liu and Uwe Aickelin","Detecting adverse drug reactions for the drug Simvastatin","Fourth International Conference on Multimedia Information Networking
  and Security (MINES), pp. 246-249, 2012. arXiv admin note: substantial text
  overlap with arXiv:1409.0658",,,,"cs.CE","http://arxiv.org/licenses/nonexclusive-distrib/1.0/","  Adverse drug reactions (ADR) are widely concerning for public health issue.
In this study we propose an original approach to detect ADRs using a feature
matrix and feature selection. The experiments are carried out on the drug
Simvastatin. Major side effects for the drug are detected and better
performance is achieved compared to other computerized methods. Because
currently the detected ADRs are based solely on computerized methods, further
expert investigation is needed.
","[{""version"":""v1"",""created"":""Wed, 3 Sep 2014 12:30:05 GMT""}]","2014-09-04"
"1409.1060","Willem Fouch\'e","Willem L. Fouche","Kolmogorov complexity and the geometry of Brownian motion","Paper accepted by Mathematical Structures in Computer Science","Math. Struct. Comp. Sci. 25 (2015) 1590-1606","10.1017/S0960129513000273",,"cs.CC","http://arxiv.org/licenses/nonexclusive-distrib/1.0/","  In this paper, we continue the study of the geometry of Brownian motions
which are encoded by Kolmogorov-Chaitin random reals (complex oscillations). We
unfold Kolmogorov-Chaitin complexity in the context of Brownian motion and
specifically to phenomena emerging from the random geometric patterns generated
by a Brownian motion.
","[{""version"":""v1"",""created"":""Wed, 3 Sep 2014 12:30:24 GMT""}]","2019-02-20"
"1409.1061","Sambit Roychowdhury","Sambit Roychowdhury, Jayaram N. Chengalur, Serafim S. Kaisin and Igor
  D. Karachentsev","The relation between atomic gas and star formation rate densities in
  faint irregular galaxies","11 pages (+1 as appendix), 10 Figures (+1 in appendix), 2 Tables.
  Accepted for publication in MNRAS Main Journal. For the definitive version
  visit http://mnras.oxfordjournals.org/",,"10.1093/mnras/stu1814",,"astro-ph.GA astro-ph.CO","http://arxiv.org/licenses/nonexclusive-distrib/1.0/","  We use data for faint (M_B > -14.5) dwarf irregular galaxies drawn from the
FIGGS survey to study the correlation between the atomic gas density
(Sigma_gas,atomic) and star formation rate (Sigma_SFR) in the galaxies. The
estimated gas phase metallicity of our sample galaxies is Z ~ 0.1 Z_sun.
Understanding star formation in such molecule poor gas is of particular
importance since it is likely to be of direct relevance to simulations of early
galaxy formation. For about 20% (9/43) of our sample galaxies, we find that the
HI distribution is significantly disturbed, with little correspondence between
the optical and HI distributions. We exclude these galaxies from the
comparison. We also exclude galaxies with very low star formation rates, for
which stochastic effects make it difficult to estimate the true star formation
rates. For the remaining galaxies we compute the Sigma_gas,atomic and Sigma_SFR
averaged over the entire star forming disk of the galaxy. For these galaxies we
find a nearly linear relation between the star formation rate and the atomic
gas surface densities. The corresponding gas consumption timescale is ~ 10 Gyr,
i.e. significantly smaller than the ~ 100 Gyr estimated for the outer regions
of spiral galaxies. We also estimate the gas consumption timescale computed
using the global gas content and the global star formation rate for all
galaxies with a reliable measurement of the star formation rate, regardless of
whether the HI distribution is disturbed or not. The mean gas consumption
timescale computed using this entire gas reservoir is ~ 18 Gyr, i.e. still
significantly smaller than that estimated for the outer parts of spirals. The
gas consumption timescale for dwarfs is intermediate between the values of ~
100 Gyr and ~ 2 Gyr estimated for the outer molecule poor and inner molecule
rich regions of spiral disks.
","[{""version"":""v1"",""created"":""Wed, 3 Sep 2014 12:35:12 GMT""}]","2015-06-22"
"1409.1062","Fanhua Shang","Fanhua Shang, Yuanyuan Liu, Hanghang Tong, James Cheng, Hong Cheng","Structured Low-Rank Matrix Factorization with Missing and Grossly
  Corrupted Observations","28 pages, 9 figures",,,,"cs.LG cs.CV stat.ML","http://arxiv.org/licenses/nonexclusive-distrib/1.0/","  Recovering low-rank and sparse matrices from incomplete or corrupted
observations is an important problem in machine learning, statistics,
bioinformatics, computer vision, as well as signal and image processing. In
theory, this problem can be solved by the natural convex joint/mixed
relaxations (i.e., l_{1}-norm and trace norm) under certain conditions.
However, all current provable algorithms suffer from superlinear per-iteration
cost, which severely limits their applicability to large-scale problems. In
this paper, we propose a scalable, provable structured low-rank matrix
factorization method to recover low-rank and sparse matrices from missing and
grossly corrupted data, i.e., robust matrix completion (RMC) problems, or
incomplete and grossly corrupted measurements, i.e., compressive principal
component pursuit (CPCP) problems. Specifically, we first present two
small-scale matrix trace norm regularized bilinear structured factorization
models for RMC and CPCP problems, in which repetitively calculating SVD of a
large-scale matrix is replaced by updating two much smaller factor matrices.
Then, we apply the alternating direction method of multipliers (ADMM) to
efficiently solve the RMC problems. Finally, we provide the convergence
analysis of our algorithm, and extend it to address general CPCP problems.
Experimental results verified both the efficiency and effectiveness of our
method compared with the state-of-the-art methods.
","[{""version"":""v1"",""created"":""Wed, 3 Sep 2014 12:36:25 GMT""}]","2014-09-04"
"1409.1063","Tanmoy Banerjee","Debarati Ghosh and Tanmoy Banerjee","Transitions among the diverse oscillation quenching states induced by
  the interplay of direct and indirect coupling","Accepted for publication in Physical Review E (25/11/2014) (with
  detailed analysis and experiment)",,"10.1103/PhysRevE.90.062908",,"nlin.CD nlin.PS","http://arxiv.org/licenses/nonexclusive-distrib/1.0/","  We report the transitions among different oscillation quenching states
induced by the interplay of diffusive (direct) coupling and environmental
(indirect) coupling in coupled identical oscillators. This coupling scheme was
introduced by Resmi {\it et al}. [Phys. Rev. E, 84, 046212 (2011)] as a general
scheme to induce amplitude death (AD) in nonlinear oscillators. Using a
detailed bifurcation analysis we show that in addition to AD, which actually
occurs only in a small region of parameter space, this coupling scheme can
induce other oscillation quenching states, namely oscillation death (OD) and a
novel nontrvial AD (NAD) state, which is a nonzero {\it bistable} homogeneous
steady state; more importantly, this coupling mediates a transition from AD to
OD state and a new transition from AD to NAD state. We identify diverse routes
to the NAD state and map all the transition scenarios in the parameter space
for periodic oscillators. Finally, we present the first experimental evidence
of oscillation quenching states and their transitions induced by the interplay
of direct and indirect coupling.
","[{""version"":""v1"",""created"":""Wed, 3 Sep 2014 12:38:53 GMT""},{""version"":""v2"",""created"":""Tue, 9 Sep 2014 11:04:24 GMT""},{""version"":""v3"",""created"":""Sun, 30 Nov 2014 19:14:35 GMT""}]","2015-06-22"
"1409.1064","Liane Gabora","Liane Gabora","Physical Light as a Metaphor for Inner Light","17 pages; In a special issue of Aisthesis
  (http://www.fupress.net/index.php/aisthesis/index) on ""Giving form through
  metaphors""; seeking collaborators in computer graphics, visualization, and
  optics for further development of these projects. arXiv admin note:
  substantial text overlap with arXiv:1501.00029","Aisthesis, 7(2), 43-61 (2014)","10.13128/Aisthesis-15289",,"q-bio.NC cs.CG cs.MM","http://arxiv.org/licenses/nonexclusive-distrib/1.0/","  The metaphor between physical light and inner light has a long history that
permeates diverse languages and cultures. This paper outlines a system for
using basic principles from optics to visually represent psychological states
and processes such as ideation, enlightenment, mindfulness, and fragmentation
versus integrity, as well as situations that occur between people involving
phenomena such as honest versus deceptive communication, and understanding
versus misunderstanding. The paper summarizes two ongoing projects based on
this system: The Light and Enlightenment art installation project, and the
Soultracker virtual reality project. These projects enable people to depict
their inner lives and external worlds including situations and relationships
with others, both as they are and as they could be, and explore alternative
paths for navigating challenges and living to their fullest potential. The
projects aim to be of clinical value as therapeutic tools, as well as of
pedagogical value by providing a concrete language for depicting aspects of
human nature that can otherwise seem elusive and intangible.
","[{""version"":""v1"",""created"":""Wed, 3 Sep 2014 12:39:00 GMT""},{""version"":""v2"",""created"":""Mon, 15 Sep 2014 16:16:39 GMT""},{""version"":""v3"",""created"":""Thu, 22 Jan 2015 17:32:58 GMT""}]","2015-01-23"
"1409.1065","Merve Avci","Ahmet Ocak Akdemir, Merve Avci Ardic and M. Emin \""Ozdemir","Inequalities via s-convexity and log-convexity",,,,,"math.CA","http://arxiv.org/licenses/nonexclusive-distrib/1.0/","  In this paper, we obtain some new inequalities for functions whose second
derivatives' absolute value is s-convex and log-convex. Also, we give some
applications for numerical integration.
","[{""version"":""v1"",""created"":""Wed, 3 Sep 2014 12:42:50 GMT""}]","2014-09-04"
"1409.1066","Hamed Haddadi","Marjan Falahrastegar, Hamed Haddadi, Steve Uhlig, Richard Mortier","Anatomy of the Third-Party Web Tracking Ecosystem",,,,,"cs.SI cs.CY","http://arxiv.org/licenses/nonexclusive-distrib/1.0/","  The presence of third-party tracking on websites has become customary.
However, our understanding of the third-party ecosystem is still very
rudimentary. We examine third-party trackers from a geographical perspective,
observing the third-party tracking ecosystem from 29 countries across the
globe. When examining the data by region (North America, South America, Europe,
East Asia, Middle East, and Oceania), we observe significant geographical
variation between regions and countries within regions. We find trackers that
focus on specific regions and countries, and some that are hosted in countries
outside their expected target tracking domain. Given the differences in
regulatory regimes between jurisdictions, we believe this analysis sheds light
on the geographical properties of this ecosystem and on the problems that these
may pose to our ability to track and manage the different data silos that now
store personal data about us all.
","[{""version"":""v1"",""created"":""Wed, 3 Sep 2014 12:44:43 GMT""}]","2014-09-04"
"1409.1067","Arturo C. Marti","Rodrigo A. Garc\'ia, Nicol\'as Rubido, Arturo C. Marti and Cecilia
  Cabeza","The role of intermediaries in the synchronization of pulse-coupled
  oscillators","11 pages, 8 figures",,"10.1140/epjst/e2014-02295-6",,"nlin.CD nlin.AO","http://arxiv.org/licenses/nonexclusive-distrib/1.0/","  The role of intermediaries in the synchronization of small groups of light
controlled oscillators (LCO) is addressed. A single LCO is a two-time-scale
phase oscillator. When pulse-coupling two LCOs, the synchronization time
decreases monotonously as the coupling strength increases, independent of the
initial conditions and frequency detuning. In this work we study numerically
the effects that a third LCO induces to the collective behavior of the system.
We analyze the new system by dealing with directed heterogeneous couplings
among the units. We report a novel and robust phenomenon, absent when coupling
two LCOs, which consists of a discontinuous relationship between the
synchronization time and coupling strength or initial conditions. The mechanism
responsible for the appearance of such discontinuities is discussed.
","[{""version"":""v1"",""created"":""Wed, 3 Sep 2014 12:55:12 GMT""}]","2015-06-22"
"1409.1068","Gang Rong","G. Rong, Y. Fang and H. L. Ma","Determinations of quark mixing matrix elements $|V_{cd}|$ and $|V_{cs}|$
  from leptonic and semileptonic $D$ Decays",,,,,"hep-ex","http://arxiv.org/licenses/nonexclusive-distrib/1.0/","  With the recent measurements of purely leptonic $D^+_{(s)}$ decays and
semileptonic $D$ decays in conjunction with decay constants $f_{D^+_{(s)}}$ and
form factors $f^{\pi(K)}_+(0)$ calculated in LQCD, we extract the magnitudes of
$V_{cd}$ and $V_{cs}$ to be $|V_{cd}|=0.218\pm0.005$ and
$|V_{cs}|=0.987\pm0.016$. Compared to those given in PDG2013, the precisions of
these newly extracted $|V_{cd}|$ and $|V_{cs}|$ are improved by more than 2.0
and 1.5 factors, respectively. With the newly extracted $|V_{cd}|$ and
$|V_{cs}|$ together with other CKM matrix elements given in PDG2013, we check
the unitarity of the CKM matrix, which are
$|V_{ud}|^2+|V_{cd}|^2+|V_{td}|^2=0.997\pm0.002$,
$|V_{us}|^2+|V_{cs}|^2+|V_{ts}|^2=1.027\pm0.032$ and
$|V_{cd}|^2+|V_{cs}|^2+|V_{cb}|^2=1.023\pm0.032$.
","[{""version"":""v1"",""created"":""Wed, 3 Sep 2014 12:56:45 GMT""},{""version"":""v2"",""created"":""Thu, 4 Sep 2014 14:31:14 GMT""}]","2014-09-05"
"1409.1069","Roman Gr\""oger","R. Gr\""oger","Calculation of dislocation positions and curved transition pathways in
  BCC crystals from atomic displacements","8 pages, 5 figures",,,,"cond-mat.mtrl-sci","http://arxiv.org/licenses/nonexclusive-distrib/1.0/","  The thermodynamic description of dislocation glide in crystals depends
crucially on the shape of the Peierls barrier that the dislocation has to
overcome when moving in the lattice. While the height of this barrier can be
obtained unequivocally using saddle-point search algorithms such as the Nudged
Elastic Band (NEB) method, its exact shape depends on the chosen approximation
of the transition pathway of the system. The purpose of this paper is to
formulate a procedure that allows to identify the position of the dislocation
directly from the displacements of atoms in its core. We investigate the
performance of this model by calculating curved paths of a 1/2[111] screw
dislocation in tungsten from a series of images obtained recently using the NEB
method at zero applied stress and for positive/negative shear stresses
perpendicular to the slip direction. The Peierls barriers plotted along these
curved paths are shown to be quite different from those obtained previously by
assuming the straight dislocation path.
","[{""version"":""v1"",""created"":""Wed, 3 Sep 2014 13:01:57 GMT""}]","2014-09-04"
