"1409.0860","Intae Jung","Intae Jung, Jaehyun Lee and Sukyoung K. Yi","Effects of large-scale environment on the assembly history of central
  galaxies","7 pages, 5 figures","2014 ApJ 794 74","10.1088/0004-637X/794/1/74",,"astro-ph.GA astro-ph.CO","http://arxiv.org/licenses/nonexclusive-distrib/1.0/","  We examine whether large-scale environment affects the mass assembly history
of their central galaxies. To facilitate this, we constructed dark matter halo
merger trees from a cosmological N-body simulation and calculated the formation
and evolution of galaxies using a semi-analytic method. We confirm earlier
results that smaller halos show a notable difference in formation time with a
mild dependence on large-scale environment. However, using a semi-analytic
model, we found that on average the growth rate of the stellar mass of central
galaxies is largely insensitive to large-scale environment. Although our
results show that the star formation rate (SFR) and the stellar mass of central
galaxies in smaller halos are slightly affected by the assembly bias of halos,
those galaxies are faint, and the difference in the SFR is minute, and
therefore it is challenging to detect it in real galaxies given the current
observational accuracy. Future galaxy surveys, such as the BigBOSS experiment
and the Large Synoptic Survey Telescope, which are expected to provide
observational data for fainter objects, will provide a chance to test our model
predictions.
","[{""version"":""v1"",""created"":""Tue, 2 Sep 2014 20:00:07 GMT""}]","2014-10-02"
"1409.0861","Kevin France","Kevin France (Colorado), Gregory J. Herczeg (KIAA/Peking University),
  Matthew McJunkin (Colorado), Steven V. Penton (STScI)","CO/H2 Abundance Ratio ~ 10^{-4} in a Protoplanetary Disk","ApJ - accepted. 13 pages, 8 figures",,"10.1088/0004-637X/794/2/160",,"astro-ph.SR","http://arxiv.org/licenses/nonexclusive-distrib/1.0/","  The relative abundances of atomic and molecular species in planet-forming
disks around young stars provide important constraints on photochemical disk
models and provide a baseline for calculating disk masses from measurements of
trace species. A knowledge of absolute abundances, those relative to molecular
hydrogen (H2), are challenging because of the weak rovibrational transition
ladder of H$_{2}$ and the inability to spatially resolve different emission
components within the circumstellar environment. To address both of these
issues, we present new contemporaneous measurements of CO and H2 absorption
through the ""warm molecular layer"" of the protoplanetary disk around the
Classical T Tauri Star RW Aurigae A. We use a newly commissioned observing mode
of the Hubble Space Telescope-Cosmic Origins Spectrograph to detect warm H2
absorption in this region for the first time. An analysis of the emission and
absorption spectrum of RW Aur shows components from the accretion region near
the stellar photosphere, the molecular disk, and several outflow components.
The warm H2 and CO absorption lines are consistent with a disk origin. We model
the 1092-1117A spectrum of RW Aur to derive log10
N(H2)~=~19.90$^{+0.33}_{-0.22}$ at T$_{rot}$(H2) ~=~440~+/-~39 K. The CO
$A$~--~$X$ bands observed from 1410-1520A are best fit by log10
N(CO)~=~16.1~$^{+0.3}_{-0.5}$ at T$_{rot}$(CO) ~=~200$^{+650}_{-125}$ K.
Combining direct measurements of the HI, H2, and CO column densities, we find a
molecular fraction in the warm disk surface of $f_{H2}$~>=~0.47 and derive a
molecular abundance ratio of CO/H2~=~1.6$^{+4.7}_{-1.3}$~x~10$^{-4}$, both
consistent with canonical interstellar dense cloud values.
","[{""version"":""v1"",""created"":""Tue, 2 Sep 2014 20:00:14 GMT""}]","2015-06-22"
"1409.0862","B\'arbara Rojas Ayala","B\'arbara Rojas-Ayala (1), Daniela Iglesias (2), Dante Minniti (3, 4,
  5 and 6), Roberto K. Saito (7) and Francisco Surot (3) ((1) Instituto de
  Astrof\'isica e Ci\^encias do Espa\c{c}o, Universidade do Porto, CAUP, (2)
  Universidad de Valpara\'iso, (3) Pontificia Universidad Cat\'olica de Chile,
  (4) Millennium Institute of Astrophysics, (5) Vatican Observatory, (6)
  Universidad Andr\'es Bello, (7) Universidade Federal de Sergipe)","M dwarfs in the b201 tile of the VVV survey: Colour-based Selection,
  Spectral Types and Light Curves","11 pages, 4 figures. Accepted for publication in Catalogs and data of
  Astronomy and Astrophysics","A&A 571, A36 (2014)","10.1051/0004-6361/201424066",,"astro-ph.SR","http://arxiv.org/licenses/nonexclusive-distrib/1.0/","  The intrinsically faint M dwarfs are the most numerous stars in the Galaxy,
have main-sequence lifetimes longer than the Hubble time, and host some of the
most interesting planetary systems known to date. Their identification and
classification throughout the Galaxy is crucial to unravel the processes
involved in the formation of planets, stars and the Milky Way. The ESO Public
Survey VVV is a deep near-IR survey mapping the Galactic bulge and southern
plane. The VVV b201 tile, located in the border of the bulge, was specifically
selected for the characterisation of M dwarfs. We used VISTA photometry to
identify M dwarfs in the VVV b201 tile, to estimate their subtypes, and to
search for transit-like light curves from the first 26 epochs of the survey.
UKIDSS photometry from SDSS spectroscopically identified M dwarfs was used to
calculate their expected colours in the $YJHK_s$ VISTA system. A colour-based
spectral subtype calibration was computed. Possible giants were identified by a
$(J-K_s, H_{J})$ reduced proper motion diagram. The light curves of
12.8<$K_s$<15.8 colour-selected M dwarfs were inspected for signals consistent
with transiting objects. We identified 23,345 objects in VVV b201 with colours
consistent with M dwarfs. We provided their spectral types and photometric
distances, up to $\sim$ 300 pc for M9s and $\sim$ 1.2 kpc for M4s, from
photometry. In the range 12<$K_s$<16, we identified 753 stars as possible
giants out of 9,232 M dwarf candidates. While only the first 26 epochs of VVV
were available, and 1 epoch was excluded, we were already able to identify
transit-like signals in the light curves of 95 M dwarfs and of 12 possible
giants. Thanks to its deeper photometry ($\sim$4 magnitudes deeper than 2MASS),
the VVV survey will be a major contributor to the discovery and study of M
dwarfs and possible companions towards the center of the Milky Way.
","[{""version"":""v1"",""created"":""Tue, 2 Sep 2014 20:00:16 GMT""}]","2014-11-05"
"1409.0863","Marika Asgari","Marika Asgari and Peter Schneider","A New Data Compression Method and its Application to Cosmic Shear
  Analysis","10 pages, 6 figures","A&A 578, A50 (2015)","10.1051/0004-6361/201424905",,"astro-ph.CO","http://arxiv.org/licenses/nonexclusive-distrib/1.0/","  Future large scale cosmological surveys will provide huge data sets whose
analysis requires efficient data compression. Calculating accurate covariances
is extremely challenging with increasing number of statistics used. Here we
introduce a formalism for achieving efficient data compression, based on a
local expansion of statistical measures around a fiducial cosmological model.
We specifically apply and test this approach for the case of cosmic shear
statistics. We demonstrate the performance of our approach, using a Fisher
analysis on cosmic shear tomography described in terms of E-/B-mode separating
statistics (COSEBIs). We show that our data compression is highly effective in
extracting essentially the full cosmological information from a strongly
reduced number of observables. Specifically, the number of statistics needed
decreases by at least one order of magnitude relative to the COSEBIs, which
already compress the data substantially compared to the shear two-point
correlation functions. The efficiency appears to be affected only slightly if a
highly inaccurate covariance is used for defining the compressed statistics,
showing the robustness of the method. We conclude that an efficient data
compression is achievable and that the number of compressed statistics depends
on the number of model parameters.
  In addition, we study how well band powers can be obtained from measuring
shear correlation functions over a finite interval of separations. We show the
strong limitations on the possibility to construct top-hat filters in Fourier
space, for which the real-space analog has a finite support, yielding strong
bounds on the accuracy of band power estimates. The error on an estimated
band-power is larger for a narrower filter and a smaller angular range which
for relevant cases can be as large as 10%.
","[{""version"":""v1"",""created"":""Tue, 2 Sep 2014 20:00:19 GMT""}]","2015-06-03"
"1409.0864","Stefano Forte","Marco Bonvini, Stefano Forte, Giovanni Ridolfi and Luca Rottoli","Resummation prescriptions and ambiguities in SCET vs. direct QCD: Higgs
  production as a case study","21 pages, 4 figures; final version, to be published in JHEP. Eq. 2.39
  and subsequent discussion added, fig.1 and corresponding discussion added,
  discussion on sqrt{z} prefactor added on pag.17",,"10.1007/JHEP01(2015)046","DESY 14-154, IFUM-1033-FT","hep-ph","http://arxiv.org/licenses/nonexclusive-distrib/1.0/","  We perform a comparison of soft-gluon resummation in SCET vs. direct QCD
(dQCD), using Higgs boson production in gluon fusion as a case study, with the
goal of tracing the quantitative impact of each source of difference between
the two approaches. We show that saddle-point methods enable a direct
quantitative comparison despite the fact that the scale which is resummed in
the two approaches is not the same. As a byproduct, we put in one-to-one
analytic correspondence various features of either approach: specifically, we
show how the SCET method for treating the Landau pole can be implemented in
dQCD, and how the resummation of the optimal partonic scale of dQCD can be
implemented in SCET. We conclude that the main quantitative difference comes
from power-suppressed subleading contributions, which could in fact be freely
tuned in either approach, and not really characteristic of either. This
conclusion holds for Higgs production in gluon fusion, but it is in fact
generic for processes with similar kinematics. For Higgs production, everything
else being equal, SCET resummation at NNLL in the Becher-Neubert implementation
leads to essentially no enhancement of the NNLO cross-section, unlike dQCD in
the standard implementation of Catani et al..
","[{""version"":""v1"",""created"":""Tue, 2 Sep 2014 20:00:20 GMT""},{""version"":""v2"",""created"":""Thu, 8 Jan 2015 11:54:24 GMT""}]","2015-06-22"
"1409.0865","Mar\'ia Carmen Mora Esp\'i","PANDA Collaboration: B.P. Singh, W. Erni, I. Keshelashvili, B.
  Krusche, M. Steinacher %, B. Liu, H. Liu, Z. Liu, X. Shen, C. Wang, J. Zhao
  %, M. Albrecht, M. Fink, F.H. Heinsius, T. Held, T. Holtmann, H. Koch, B.
  Kopf, M. K\""ummel, G. Kuhl, M. Kuhlmann, M. Leyhe, M. Mikirtychyants, P.
  Musiol, A. Mustafa, M. Peliz\""aus, J. Pychy, M. Richter, C. Schnier, T.
  Schr\""oder, C. Sowa, M. Steinke, T. Triffterer, U. Wiedner, R. Beck, C.
  Hammann, D. Kaiser, B. Ketzer, M. Kube, P. Mahlberg, M. Rossbach, C. Schmidt,
  R. Schmitz, U. Thoma, D. Walther, C. Wendel, A. Wilson, A. Bianconi, M.
  Bragadireanu, M. Caprini, D. Pantea, D. Pietreanu, M.E. Vasile, B. Patel, D.
  Kaplan, P. Brandys, T. Czyzewski, W. Czyzycki, M. Domagala, M. Hawryluk, G.
  Filo, M. Krawczyk, D. Kwiatkowski, E. Lisowski, F. Lisowski, T. Fiutowski, M.
  Idzik, B. Mindur, D. Przyborowski, K. Swientek, B. Czech, S. Kliczewski, K.
  Korcyl, A. Kozela, P. Kulessa, P. Lebiedowicz, K. Malgorzata, K. Pysz, W.
  Sch\""afer, R. Siudak, A. Szczurek, J. Biernat, S. Jowzaee, B. Kamys, S.
  Kistryn, G. Korcyl, W. Krzemien, A. Magiera, P. Moskal, M. Palka, A.
  Psyzniak, Z. Rudy, P. Salabura, J. Smyrski, P. Strzempek, A. Wro\'nska, I.
  Augustin, I. Lehmann, D. Nicmorus, G. Schepers, L. Schmitt, M. Al-Turany, U.
  Cahit, L. Capozza, A. Dbeyssi, H. Deppe, R. Dzhygadlo, A. Ehret, H. Flemming,
  A. Gerhardt, K. G\""otzen, R. Karabowicz, R. Kliemt, J. Kunkel, U. Kurilla, D.
  Lehmann, J. L\""uhning, F. Maas, C. Morales Morales, M.C. Mora Esp\'i, F.
  Nerling, H. Orth, K. Peters, D. Rodr\'iguez Pineiro, N. Saito, T. Saito, A.
  S\'anchez Lorente, C.J. Schmidt, C. Schwarz, J.Schwiening, M. Traxler, R.
  Valente, B. Voss, P. Wieczorek, A. Wilms, M. Z\""uhlsdorf, V.M. Abazov, G.
  Alexeev, A. Arefiev, V.I. Astakhov, M.Yu. Barabanov, B.V. Batyunya, Yu.I.
  Davydov, V.Kh. Dodokhov, A.A. Efremov, A.G. Fedunov, A.A. Festchenko, A.S.
  Galoyan, S. Grigoryan, A. Karmokov, E.K. Koshurnikov, V.I. Lobanov, Yu.Yu.
  Lobanov, A.F. Makarov, L.V. Malinina, V.L. Malyshev, G.A. Mustafaev, A.
  Olshevskiy, M.A. Pasyuk, E.A. Perevalova, A.A. Piskun, T.A. Pocheptsov, G.
  Pontecorvo, V.K. Rodionov, Yu.N. Rogov, R.A. Salmin, A.G. Samartsev, M.G.
  Sapozhnikov, G.S. Shabratova, N.B. Skachkov, A.N. Skachkova, E.A. Strokovsky,
  M.K. Suleimanov, R.Sh. Teshev, V.V. Tokmenin, V.V. Uzhinsky, A.S. Vodopyanov,
  S.A. Zaporozhets, N.I. Zhuravlev, A.G. Zorin, D. Branford, D. Glazier, D.
  Watts, P. Woods, A. Britting, W. Eyrich, A. Lehmann, F. Uhlig, S. Dobbs, K.
  Seth, A. Tomaradze, T. Xiao, D. Bettoni, V. Carassiti, A. Cotta Ramusino, P.
  Dalpiaz, A. Drago, E. Fioravanti, I. Garzia, M. Savri\`e, G. Stancari, V.
  Akishina, I. Kisel, I. Kulakov, M. Zyzak, R. Arora, T. Bel, A. Gromliuk, G.
  Kalicy, M. Krebs, M. Patsyuk, M. Zuehlsdorf, N. Bianchi, P. Gianotti, C.
  Guaraldo, V. Lucherini, E. Pace, A. Bersani, G. Bracco, M. Macri, R.F.
  Parodi, S. Bianco, D. Bremer, K.T. Brinkmann, S. Diehl, V. Dormenev, P.
  Drexler, M. D\""uren, T. Eissner, E. Etzelm\""uller, K. F\""ohl, M. Galuska, T.
  Gessler, E. Gutz, A. Hayrapetyan, J. Hu, B. Kr\""ock, W. K\""uhn, T. Kuske, S.
  Lange, Y. Liang, O. Merle, V. Metag, D. M\""ulhheim, D. M\""unchow, M. Nanova,
  R. Novotny, A. Pitka, T. Quagli, J. Rieke, C. Rosenbaum, R. Schnell, B.
  Spruck, H. Stenzel, U. Th\""oring, M. Ullrich, T. Wasem, M. Werner, H.G.
  Zaunick, D. Ireland, G. Rosner, B. Seitz, P.N. Deepak, A.V. Kulkarni, A.
  Apostolou, M. Babai, M. Kavatsyuk, P. Lemmens, M.Lindemulder, H. L\""ohner, J.
  Messchendorp, P. Schakel, H. Smit, J.C. van der Weele, M. Tiemens, R.
  Veenstra, S. Vejdani, K. Kalita, D.P. Mohanta, A. Kumar, A. Roy, R. Sahoo, H.
  Sohlbach, M. B\""uscher, L. Cao, A. Cebulla, D. Deermann, R. Dosdall, S. Esch,
  I. Georgadze, A. Gillitzer, A. Goerres, F. Goldenbaum, D. Grunwald, A.
  Herten, Q. Hu, G. Kemmerling, H. Kleines, V. Kozlov, A. Lehrach, S. Leiber,
  R. Maier, R. Nellen, H. Ohm, S. Orfanitski, D. Prasuhn, E. Prencipe, J.
  Ritman, S. Schadmand, J. Schumann, T. Sefzick, V. Serdyuk, G. Sterzenbach, T.
  Stockmanns, P. Wintz, P. W\""ustner, H. Xu, S. Li, Z. Li, Z. Sun, H. Xu, V.
  Rigato, S. Fissum, K. Hansen, L. Isaksson, M. Lundin, B. Schr\""oder, P.
  Achenbach, S. Bleser, M. Cardinali, O. Corell, M. Deiseroth, A. Denig, M.
  Distler, F. Feldbauer, M. Fritsch, P. Jasinski, M. Hoek, D. Kangh, A.
  Karavdina, W. Lauth, H. Leithoff, H. Merkel, M. Michel, C. Motzko, U.
  M\""uller, O. Noll, S. Plueger, J. Pochodzalla, S. Sanchez, S. Schlimme, C.
  Sfienti, M. Steinen, M. Thiel, T. Weber, M. Zambrana, V.I. Dormenev, A.A.
  Fedorov, M.V. Korzihik, O.V. Missevitch, P. Balanutsa, V. Balanutsa, V.
  Chernetsky, A. Demekhin, A. Dolgolenko, P. Fedorets, A. Gerasimov, V.
  Goryachev, V. Varentsov, A. Boukharov, O. Malyshev, I. Marishev, A. Semenov,
  I. Konorov, S. Paul, S. Grieser, A.K. Hergem\""oller, A. Khoukaz, E. K\""ohler,
  A. T\""aschner, J. Wessels, S. Dash, M. Jadhav, S. Kumar, P. Sarin, R. Varma,
  V.B. Chandratre, V. Datar, D. Dutta, V. Jha, H. Kumawat, A.K. Mohanty, B.
  Roy, Y. Yan, K. Chinorat, K. Khanchai, L. Ayut, S. Pornrad, A.Y. Barnyakov,
  A.E. Blinov, V.E. Blinov, V.S. Bobrovnikov, S.A. Kononov, E.A. Kravchenko,
  I.A. Kuyanov, A.P. Onuchin, A.A. Sokolov, Y.A. Tikhonov, E. Atomssa, T.
  Hennino, M. Imre, R. Kunne, C. Le Galliard, B. Ma, D. Marchand, S. Ong, B.
  Ramstein, P. Rosier, E. Tomasi-Gustafsson, J. Van de Wiele, G. Boca, S.
  Costanza, P. Genova, L. Lavezzi, P. Montagna, A. Rotondi, V. Abramov, N.
  Belikov, S. Bukreeva, A. Davidenko, A. Derevschikov, Y. Goncharenko, V.
  Grishin, V. Kachanov, V. Kormilitsin, Y. Melnik, A. Levin, N. Minaev, V.
  Mochalov, D. Morozov, L. Nogach, S. Poslavskiy, A. Ryazantsev, S. Ryzhikov,
  P. Semenov, I. Shein, A. Uzunian, A. Vasiliev, A. Yakutin, B. Yabsley, T.
  B\""ack, B. Cederwall, K. Mak\'onyi, P.E. Tegn\'er, K.M. von W\""urtemberg, S.
  Belostotski, G. Gavrilov, A. Izotov, A. Kashchuk, O. Levitskaya, S.
  Manaenkov, O. Miklukho, Y. Naryshkin, K. Suvorov, D. Veretennikov, A.
  Zhadanov, A.K. Rai, S.S. Godre, R. Duchat, A. Amoroso, M.P. Bussa, L. Busso,
  F. De Mori, M. Destefanis, L. Fava, L. Ferrero, M. Greco, M. Maggiora, G.
  Maniscalco, S. Marcello, S. Sosio, S. Spataro, L. Zotti, D. Calvo, S. Coli,
  P. De Remigis, A. Filippi, G. Giraudo, S. Lusso, G. Mazza, M. Mingnore, A.
  Rivetti, R. Wheadon, F. Balestra, F. Iazzi, R. Introzzi, A. Lavagno, H.
  Younis, R. Birsa, F. Bradamante, A. Bressan, A. Martin, H. Clement, B.
  G{\aa}lnander, L. Caldeira Balkest{\aa}hl, H. Cal\'en, K. Fransson, T.
  Johansson, A. Kupsc, P. Marciniewski, J. Pettersson, K. Sch\""onning, M.
  Wolke, J. Zlomanczuk, J. D\'iaz, A. Ortiz, P.C. Vinodkumar, A. Parmar, A.
  Chlopik, D. Melnychuk, B. Slowinski, A. Trzcinski, M. Wojciechowski, S.
  Wronka, B. Zwieglinski, P. B\""uhler, J. Marton, K. Suzuki, E. Widmann, J.
  Zmeskal, B. Fr\""ohlich, D. Khaneft, D. Lin, I. Zimmermann, K.
  Semenov-Tian-Shansky","Experimental access to Transition Distribution Amplitudes with the
  \={P}ANDA experiment at FAIR","19 pages, 7 figures (some multiple), 2 tables (each double), preprint
  of an article for epj - v2",,,,"hep-ex hep-ph nucl-ex","http://arxiv.org/licenses/nonexclusive-distrib/1.0/","  Baryon-to-meson Transition Distribution Amplitudes (TDAs) encoding valuable
new information on hadron structure appear as building blocks in the collinear
factorized description for several types of hard exclusive reactions. In this
paper, we address the possibility of accessing nucleon-to-pion ($\pi N$) TDAs
from $\bar{p}p \to e^+e^- \pi^0$ reaction with the future \={P}ANDA detector at
the FAIR facility. At high center of mass energy and high invariant mass
squared of the lepton pair $q^2$, the amplitude of the signal channel $\bar{p}p
\to e^+e^- \pi^0$ admits a QCD factorized description in terms of $\pi N$ TDAs
and nucleon Distribution Amplitudes (DAs) in the forward and backward kinematic
regimes. Assuming the validity of this factorized description, we perform
feasibility studies for measuring $\bar{p}p \to e^+e^- \pi^0$ with the
\={P}ANDA detector. Detailed simulations on signal reconstruction efficiency as
well as on rejection of the most severe background channel, i.e. $\bar{p}p \to
\pi^+\pi^- \pi^0$ were performed for the center of mass energy squared $s = 5$
GeV$^2$ and $s = 10$ GeV$^2$, in the kinematic regions $3.0 < q^2 < 4.3$
GeV$^2$ and $5 < q^2 < 9$ GeV$^2$, respectively, with a neutral pion scattered
in the forward or backward cone $| \cos\theta_{\pi^0}| > 0.5 $ in the
proton-antiproton center of mass frame. Results of the simulation show that the
particle identification capabilities of the \={P}ANDA detector will allow to
achieve a background rejection factor of $5\cdot 10^7$ ($1\cdot 10^7$) at low
(high) $q^2$ for $s=5$ GeV$^2$, and of $1\cdot 10^8$ ($6\cdot 10^6$) at low
(high) $q^2$ for $s=10$ GeV$^2$, while keeping the signal reconstruction
efficiency at around $40\%$. At both energies, a clean lepton signal can be
reconstructed with the expected statistics corresponding to $2$ fb$^{-1}$ of
integrated luminosity. (.../...)
","[{""version"":""v1"",""created"":""Tue, 2 Sep 2014 20:00:23 GMT""},{""version"":""v2"",""created"":""Wed, 30 Nov 2016 15:41:41 GMT""}]","2016-12-01"
"1409.0866","Meagan Morscher","Meagan Morscher, Bharath Pattabiraman, Carl Rodriguez, Frederic A.
  Rasio, and Stefan Umbreit","The Dynamical Evolution of Stellar Black Holes in Globular Clusters","40 pages in preprint format, 13 figures, 4 tables, accepted for
  publication in ApJ",,"10.1088/0004-637X/800/1/9",,"astro-ph.GA astro-ph.SR","http://arxiv.org/licenses/nonexclusive-distrib/1.0/","  Our current understanding of the stellar initial mass function and massive
star evolution suggests that young globular clusters may have formed hundreds
to thousands of stellar-mass black holes, the remnants of stars with initial
masses from $\sim 20 - 100\, M_\odot$. Birth kicks from supernova explosions
may eject some black holes from their birth clusters, but most should be
retained. Using a Monte Carlo method we investigate the long-term dynamical
evolution of globular clusters containing large numbers of stellar black holes.
We describe numerical results for 42 models, covering a range of realistic
initial conditions, including up to $1.6\times10^6$ stars. In almost all models
we find that significant numbers of black holes (up to $\sim10^3$) are retained
all the way to the present. This is in contrast to previous theoretical
expectations that most black holes should be ejected dynamically within a few
Gyr. The main reason for this difference is that core collapse driven by black
holes (through the Spitzer ""mass segregation instability"") is easily reverted
through three-body processes, and involves only a small number of the most
massive black holes, while lower-mass black holes remain well-mixed with
ordinary stars far from the central cusp. Thus the rapid segregation of stellar
black holes does not lead to a long-term physical separation of most black
holes into a dynamically decoupled inner core, as often assumed previously.
Combined with the recent detections of several black hole X-ray binary
candidates in Galactic globular clusters, our results suggest that stellar
black holes could still be present in large numbers in many globular clusters
today, and that they may play a significant role in shaping the long-term
dynamical evolution and the present-day dynamical structure of many clusters.
","[{""version"":""v1"",""created"":""Tue, 2 Sep 2014 20:00:26 GMT""},{""version"":""v2"",""created"":""Mon, 8 Dec 2014 21:00:26 GMT""}]","2015-06-22"
"1409.0867","Andreas Kapfer","Thomas W. Grimm, Andreas Kapfer, Severin Lust","Partial Supergravity Breaking and the Effective Action of Consistent
  Truncations","44 pages, v2: minor changes, references added",,"10.1007/JHEP02(2015)093",,"hep-th","http://arxiv.org/licenses/nonexclusive-distrib/1.0/","  We study vacua of N = 4 half-maximal gauged supergravity in five dimensions
and determine crucial properties of the effective theory around the vacuum. The
main focus is on configurations with exactly two broken supersymmetries, since
they frequently appear in consistent truncations of string theory and
supergravity. Evaluating one-loop corrections to the Chern-Simons terms we find
necessary conditions to ensure that a consistent truncation also gives rise to
a proper effective action of an underlying more fundamental theory. To obtain
concrete examples, we determine the N=4 action of M-theory on six-dimensional
SU(2)-structure manifolds with background fluxes. Calabi-Yau threefolds with
vanishing Euler number are examples of SU(2)-structure manifolds that yield N=2
Minkowski vacua. We find that that one-loop corrections to the Chern-Simons
terms vanish trivially and thus do not impose constraints on identifying
effective theories. This result is traced back to the absence of isometries on
these geometries. Examples with isometries arise from type IIB supergravity on
squashed Sasaki-Einstein manifolds. In this case the one-loop gauge
Chern-Simons terms vanish due to non-trivial cancellations, while the one-loop
gravitational Chern-Simons terms are non-zero.
","[{""version"":""v1"",""created"":""Tue, 2 Sep 2014 20:00:38 GMT""},{""version"":""v2"",""created"":""Thu, 18 Sep 2014 08:57:00 GMT""}]","2015-06-22"
"1409.0868","Rodrigo Alonso Dr","Rodrigo Alonso, Elizabeth E. Jenkins, and Aneesh V. Manohar","Holomorphy without Supersymmetry in the Standard Model Effective Field
  Theory","Minor corrections in Table I, see note added at end of paper. The
  complete SMEFT RGE will be maintained at http://einstein.ucsd.edu/smeft",,"10.1016/j.physletb.2014.10.045",,"hep-ph hep-th","http://arxiv.org/licenses/nonexclusive-distrib/1.0/","  The anomalous dimensions of dimension-six operators in the Standard Model
Effective Field Theory (SMEFT) respect holomorphy to a large extent. The
holomorphy conditions are reminiscent of supersymmetry, even though the SMEFT
is not a supersymmetric theory.
","[{""version"":""v1"",""created"":""Tue, 2 Sep 2014 20:00:44 GMT""},{""version"":""v2"",""created"":""Thu, 6 Nov 2014 01:08:17 GMT""},{""version"":""v3"",""created"":""Thu, 30 Jul 2015 19:32:44 GMT""}]","2015-07-31"
"1409.0869","J. E. Hirsch","J. E. Hirsch","Proposed experimental test of an alternative electrodynamic theory of
  superconductors",,"Physica C Vol 508, 21 (2015)","10.1016/j.physc.2014.10.018",,"cond-mat.supr-con","http://arxiv.org/licenses/nonexclusive-distrib/1.0/","  An alternative form of London's electrodynamic theory of superconductors
predicts that the electrostatic screening length is the same as the magnetic
penetration depth. We argue that experiments performed to date do not rule out
this alternative formulation and propose an experiment to test it. Experimental
evidence in its favor would have fundamental implications for the understanding
of superconductivity.
","[{""version"":""v1"",""created"":""Tue, 2 Sep 2014 20:02:17 GMT""},{""version"":""v2"",""created"":""Fri, 14 Nov 2014 01:01:08 GMT""}]","2015-01-20"
