"1409.0768","Uwe Aickelin","Jenna Reps, Jonathan M. Garibaldi, Uwe Aickelin, Daniele Soria, Jack
  E. Gibson, Richard B. Hubbard","A Novel Semi-Supervised Algorithm for Rare Prescription Side Effect
  Discovery",,"IEEE Journal of Biomedical and Health Informatics, 18 (2), pp.
  537-547, 2014","10.2139/ssrn.2823251",,"cs.LG cs.CE","http://arxiv.org/licenses/nonexclusive-distrib/1.0/","  Drugs are frequently prescribed to patients with the aim of improving each
patient's medical state, but an unfortunate consequence of most prescription
drugs is the occurrence of undesirable side effects. Side effects that occur in
more than one in a thousand patients are likely to be signalled efficiently by
current drug surveillance methods, however, these same methods may take decades
before generating signals for rarer side effects, risking medical morbidity or
mortality in patients prescribed the drug while the rare side effect is
undiscovered. In this paper we propose a novel computational meta-analysis
framework for signalling rare side effects that integrates existing methods,
knowledge from the web, metric learning and semi-supervised clustering. The
novel framework was able to signal many known rare and serious side effects for
the selection of drugs investigated, such as tendon rupture when prescribed
Ciprofloxacin or Levofloxacin, renal failure with Naproxen and depression
associated with Rimonabant. Furthermore, for the majority of the drug
investigated it generated signals for rare side effects at a more stringent
signalling threshold than existing methods and shows the potential to become a
fundamental part of post marketing surveillance to detect rare side effects.
","[{""version"":""v1"",""created"":""Tue, 2 Sep 2014 16:00:23 GMT""}]","2016-11-15"
"1409.0769","Tadeusz Pudlik","Tadeusz Pudlik, Holger Hennig, Dirk Witthaut, David K. Campbell","Tunneling in the self-trapped regime of a two-well BEC","12 pages, 12 figures. Submitted to Physical Review A",,,,"quant-ph cond-mat.quant-gas","http://arxiv.org/licenses/nonexclusive-distrib/1.0/","  Starting from a mean-field model of the Bose-Einstein condensate dimer, we
reintroduce classically forbidden tunneling through a Bohr-Sommerfeld
quantization approach. We find closed-form approximations to the tunneling
frequency more accurate than those previously obtained using different
techniques. We discuss the central role that tunneling in the self-trapped
regime plays in a quantitatively accurate model of a dissipative dimer leaking
atoms to the environment. Finally, we describe the prospects of experimental
observation of tunneling in the self-trapped regime, both with and without
dissipation.
","[{""version"":""v1"",""created"":""Tue, 2 Sep 2014 16:07:33 GMT""},{""version"":""v2"",""created"":""Tue, 16 Sep 2014 14:03:54 GMT""},{""version"":""v3"",""created"":""Mon, 29 Sep 2014 14:03:10 GMT""}]","2014-09-30"
"1409.0770","Chenyan Wu","Chenyan Wu","Irreducibility of Theta Lifting for Unitary Groups","Journal of Number Theory 2013",,"10.1016/j.jnt.2013.04.014",,"math.NT","http://arxiv.org/licenses/nonexclusive-distrib/1.0/","  This article shows that for unitary dual reductive pairs the first occurrence
of theta lift of an irreducible cuspidal automorphic representation is
irreducible. It also proves a refined tower property for theta lifts and the
involutive property for twisted theta lifts.
","[{""version"":""v1"",""created"":""Tue, 2 Sep 2014 16:15:12 GMT""}]","2014-09-03"
"1409.0771","Philipp Habegger","Philipp Habegger and Jonathan Pila","O-minimality and certain atypical intersections",,,,,"math.NT math.LO","http://arxiv.org/licenses/nonexclusive-distrib/1.0/","  We show that the strategy of point counting in o-minimal structures can be
applied to various problems on unlikely intersections that go beyond the
conjectures of Manin-Mumford and Andr\'e-Oort. We verify the so-called
Zilber-Pink Conjecture in a product of modular curves on assuming a lower bound
for Galois orbits and a sufficiently strong modular Ax-Schanuel Conjecture. In
the context of abelian varieties we obtain the Zilber-Pink Conjecture for
curves unconditionally when everything is defined over a number field. For
higher dimensional subvarieties of abelian varieties we obtain some weaker
results and some conditional results.
","[{""version"":""v1"",""created"":""Tue, 2 Sep 2014 16:16:55 GMT""}]","2014-09-03"
"1409.0772","Uwe Aickelin","Jenna M. Reps, Jonathan M. Garibaldi, Uwe Aickelin, Daniele Soria,
  Jack E. Gibson, Richard B. Hubbard","Signalling Paediatric Side Effects using an Ensemble of Simple Study
  Designs","Drug Safety, 37 (3), pp. 163-170, 2014",,,,"cs.LG cs.CE","http://arxiv.org/licenses/nonexclusive-distrib/1.0/","  Background: Children are frequently prescribed medication off-label, meaning
there has not been sufficient testing of the medication to determine its safety
or effectiveness. The main reason this safety knowledge is lacking is due to
ethical restrictions that prevent children from being included in the majority
of clinical trials. Objective: The objective of this paper is to investigate
whether an ensemble of simple study designs can be implemented to signal
acutely occurring side effects effectively within the paediatric population by
using historical longitudinal data. The majority of pharmacovigilance
techniques are unsupervised, but this research presents a supervised framework.
Methods: Multiple measures of association are calculated for each drug and
medical event pair and these are used as features that are fed into a
classiffier to determine the likelihood of the drug and medical event pair
corresponding to an adverse drug reaction. The classiffier is trained using
known adverse drug reactions or known non-adverse drug reaction relationships.
Results: The novel ensemble framework obtained a false positive rate of 0:149,
a sensitivity of 0:547 and a specificity of 0:851 when implemented on a
reference set of drug and medical event pairs. The novel framework consistently
outperformed each individual simple study design. Conclusion: This research
shows that it is possible to exploit the mechanism of causality and presents a
framework for signalling adverse drug reactions effectively.
","[{""version"":""v1"",""created"":""Tue, 2 Sep 2014 16:17:25 GMT""}]","2014-09-03"
"1409.0773","Eugenio  Megias","E. Megias, E. Ruiz Arriola, L.L. Salcedo","Polyakov loop spectroscopy in the confined phase of gluodynamics and QCD","4 pages, 3 figures. Talk given by E.Megias at the 17th International
  Conference in Quantum Chromodynamics (QCD 14), Montpellier, France, 30 Jun -
  4 Jul 2014",,,"UAB-FT-760","hep-ph hep-lat hep-th nucl-th","http://arxiv.org/licenses/nonexclusive-distrib/1.0/","  By using a simple relativistic model, we compute the glueball and gluelump
spectra and relate these quantities, respectively, to the trace anomaly and
Polyakov loop in the adjoint representation of gluodynamics. This spectroscopic
description of thermodynamics is extended with the inclusion of quarks. The
relation between the hadron resonance gas and the Polyakov loop in the
fundamental and higher representations is addressed.
","[{""version"":""v1"",""created"":""Tue, 2 Sep 2014 16:17:43 GMT""}]","2014-09-03"
"1409.0774","Jianwei Miao","Jianwei Miao, M. C. Scott, Chien-Chun Chen, Chun Zhu, Edward R. White,
  Chin-Yi Chiu, B. C. Regan, Yu Huang, Laurence D. Marks","Reply to ""Local Filtering Fundamentally Against Wide Spectrum""","2 pages, 9 references",,,,"physics.data-an","http://arxiv.org/licenses/nonexclusive-distrib/1.0/","  After carefully studying the comment by Wang et al. (arXiv:1408.6420), we
found it includes several mistakes and unjustified statements and Wang et al.
lack very basic knowledge of dislocations. Moreover, there is clear evidence
indicating that Wang et al. significantly misrepresented our method and claimed
something that they actually did not implement.
","[{""version"":""v1"",""created"":""Tue, 2 Sep 2014 16:18:11 GMT""}]","2014-09-03"
"1409.0775","Uwe Aickelin","Yihui Liu and Uwe Aickelin","Feature selection in detection of adverse drug reactions from the Health
  Improvement Network (THIN) database","International Journal of Information Technology and Computer Science
  (IJITCS), in print, 2014",,,,"cs.LG cs.CE","http://arxiv.org/licenses/nonexclusive-distrib/1.0/","  Adverse drug reaction (ADR) is widely concerned for public health issue. ADRs
are one of most common causes to withdraw some drugs from market. Prescription
event monitoring (PEM) is an important approach to detect the adverse drug
reactions. The main problem to deal with this method is how to automatically
extract the medical events or side effects from high-throughput medical events,
which are collected from day to day clinical practice. In this study we propose
a novel concept of feature matrix to detect the ADRs. Feature matrix, which is
extracted from big medical data from The Health Improvement Network (THIN)
database, is created to characterize the medical events for the patients who
take drugs. Feature matrix builds the foundation for the irregular and big
medical data. Then feature selection methods are performed on feature matrix to
detect the significant features. Finally the ADRs can be located based on the
significant features. The experiments are carried out on three drugs:
Atorvastatin, Alendronate, and Metoclopramide. Major side effects for each drug
are detected and better performance is achieved compared to other computerized
methods. The detected ADRs are based on computerized methods, further
investigation is needed.
","[{""version"":""v1"",""created"":""Tue, 2 Sep 2014 16:25:58 GMT""}]","2014-09-03"
"1409.0776","Xinmiao Sun","Xinmiao Sun, Christos G. Cassandras and Kagan Gokbayrak","Escaping Local Optima in a Class of Multi-Agent Distributed Optimization
  Problems: A Boosting Function Approach",,,,,"math.OC","http://arxiv.org/licenses/nonexclusive-distrib/1.0/","  We address the problem of multiple local optima commonly arising in
optimization problems for multi-agent systems, where objective functions are
nonlinear and nonconvex. For the class of coverage control problems, we propose
a systematic approach for escaping a local optimum, rather than randomly
perturbing controllable variables away from it. We show that the objective
function for these problems can be decomposed to facilitate the evaluation of
the local partial derivative of each node in the system and to provide insights
into its structure. This structure is exploited by defining ""boosting
functions"" applied to the aforementioned local partial derivative at an
equilibrium point where its value is zero so as to transform it in a way that
induces nodes to explore poorly covered areas of the mission space until a new
equilibrium point is reached. The proposed boosting process ensures that, at
its conclusion, the objective function is no worse than its pre-boosting value.
However, the global optima cannot be guaranteed. We define three families of
boosting functions with different properties and provide simulation results
illustrating how this approach improves the solutions obtained for this class
of distributed optimization problems.
","[{""version"":""v1"",""created"":""Tue, 2 Sep 2014 16:28:04 GMT""},{""version"":""v2"",""created"":""Thu, 4 Sep 2014 19:14:16 GMT""},{""version"":""v3"",""created"":""Sat, 6 Sep 2014 17:38:38 GMT""}]","2014-09-09"
"1409.0777","Peter Nelson","Jim Geelen, Peter Nelson","Matroids denser than a clique",,,,,"math.CO","http://arxiv.org/licenses/nonexclusive-distrib/1.0/","  The growth-rate function for a minor-closed class $\mathcal{M}$ of matroids
is the function $h$ where, for each non-negative integer $r$, $h(r)$ is the
maximum number of elements of a simple matroid in $\mathcal{M}$ with rank at
most $r$. The Growth-Rate Theorem of Geelen, Kabell, Kung, and Whittle shows,
essentially, that the growth-rate function is always either linear, quadratic,
exponential, or infinite. Morover, if the growth-rate function is quadratic,
then $h(r)\ge \binom{r+1}{2}$, with the lower bound coming from the fact that
such classes necessarily contain all graphic matroids. We characterise the
classes that satisfy $h(r) = \binom{r+1}{2}$ for all sufficiently large $r$.
","[{""version"":""v1"",""created"":""Tue, 2 Sep 2014 16:30:03 GMT""},{""version"":""v2"",""created"":""Fri, 15 Apr 2016 15:10:59 GMT""}]","2016-04-18"
"1409.0778","Harry Thacker","H. B. Thacker and Gabriel Wong","Bosonization and the Berry connection in two-dimensional QED","16 pages, 3 figures","Phys. Rev. D 91, 065009 (2015)","10.1103/PhysRevD.91.065009",,"hep-th hep-lat quant-ph","http://arxiv.org/licenses/nonexclusive-distrib/1.0/","  The dynamical effects of topological charge in two-dimensional QED can be
expressed in terms of a topological order parameter via a Berry phase
construction. The Berry phase describes the electric charge polarization of the
vacuum in a manner similar to the theory of polarization in topological
insulators. The topological order parameter labels discrete vacua which differ
by units of electric flux. Here the associated Berry connection is explicitly
constructed from the Dirac Hamiltonian eigenstates by introducing a small
attractive Thirring coupling, so that there is still a stable boson in the
limit of zero EM coupling. The Berry connection arises from the analytic
structure of the Bethe ansatz states in complex rapidity near the free fermion
point.
","[{""version"":""v1"",""created"":""Tue, 2 Sep 2014 16:30:44 GMT""}]","2015-03-18"
"1409.0779","Peter Nelson","Peter Nelson","Matroids denser than a projective geometry",,,,,"math.CO","http://arxiv.org/licenses/nonexclusive-distrib/1.0/","  The growth-rate function for a minor-closed class $\mathcal{M}$ of matroids
is the function $h$ where, for each non-negative integer $r$, $h(r)$ is the
maximum number of elements of a simple matroid in $\mathcal{M}$ with rank at
most $r$. The Growth-Rate Theorem of Geelen, Kabell, Kung, and Whittle shows,
essentially, that the growth-rate function is always either linear, quadratic,
exponential with some prime power $q$ as the base, or infinite. Morover, if the
growth-rate function is exponential with base $q$, then the class contains all
GF$(q)$-representable matroids, and so $h(r)\ge \frac{q^r-1}{q-1}$ for each
$r$. We characterise the classes that satisfy $h(r) = \frac{q^r-1}{q-1}$ for
all sufficiently large $r$. As a consequence, we determine the eventual value
of the growth rate function for most classes defined by excluding lines, free
spikes and/or free swirls.
","[{""version"":""v1"",""created"":""Tue, 2 Sep 2014 16:32:36 GMT""},{""version"":""v2"",""created"":""Tue, 8 Sep 2015 13:36:42 GMT""},{""version"":""v3"",""created"":""Fri, 15 Apr 2016 15:05:28 GMT""}]","2016-04-18"
"1409.0780","Danny Tsebrenko","Danny Tsebrenko and Noam Soker (Technion, Israel)","The fraction of type Ia supernovae exploding inside planetary nebulae
  (SNIPs)","17 pages, 2 tables. Accepted to MNRAS",,"10.1093/mnras/stu2567",,"astro-ph.SR astro-ph.HE","http://arxiv.org/licenses/nonexclusive-distrib/1.0/","  Using three independent directions we estimate that the fraction of type Ia
supernovae (SNe Ia) exploding inside planetary nebulae (PNe), termed SNIPs,is
at least ~20%. Our three directions are as follows. (i) Taking the variable
sodium absorption lines in some SN Ia to originate in a massive circumstellar
matter (CSM), as has been claimed recently, we use the results of Sternberg et
al. (2014) to imply that > ~20% of SN Ia occur inside a PN (or a PN
descendant), hence classify them as SNIPs. (ii) We next use results that show
that whenever there are hydrogen lines in SN Ia the hydrogen mass in the CSM is
large (> 1 M_Sun), hence the explosion is a SNIP. We make the simplest
assumption that the probability for explosion is constant in time for up to
about 10^5 yrs after the merger of the core with the white dwarf (WD) in the
frame of the core-degenerate scenario. This results with at least few x10 of
SNe Ia that may have a SNIP origin. (iii) We examine the X-ray morphologies of
13 well-resolved close-by SN remnants (SNRs) Ia and derive a crude upper limit,
according to which 10-30% of all SNRs Ia possess opposite ear-like features,
which we take as evidence of SNIP origin. Our results, together with several
other recent results, lead us to conclude that the two scenarios most
contributing to SNe Ia are the core degenerate and the double degenerate
scenarios. Together these two account for >95% of all SNe Ia.
","[{""version"":""v1"",""created"":""Tue, 2 Sep 2014 16:35:34 GMT""},{""version"":""v2"",""created"":""Mon, 8 Sep 2014 14:13:22 GMT""},{""version"":""v3"",""created"":""Wed, 3 Dec 2014 13:55:03 GMT""}]","2014-12-05"
"1409.0781","Nicholas J. Curro","D. M. Nisson, A. P. Dioguardi, X. Peng, D. Yu, N. J. Curro","Anomalous nuclear magnetic resonance spectra in Bi$_2$Se$_3$ nanowires","7 pages, 8 figures, to appear in Phys. Rev. B","Phys. Rev. B 90, 125121 (2014)","10.1103/PhysRevB.90.125121",,"cond-mat.mtrl-sci","http://arxiv.org/licenses/nonexclusive-distrib/1.0/","  We report $^{209}$Bi nuclear magnetic resonance (NMR) spectra of in nanowires
and single crystals of Bi$_2$Se$_3$. Crystals were powdered to simulate the
random orientation of the nanowires, and the spectra are compared with
theoretical expectations derived via an orientational study of a single
crystal. The nanowire spectra are consistent with the randomly oriented
powders, however we find an unusual suppression of signal intensity as a
function of field orientation that may be associated with screening by surface
currents.
","[{""version"":""v1"",""created"":""Tue, 2 Sep 2014 16:42:58 GMT""}]","2014-09-22"
"1409.0783","E. V. Sampathkumaran Professor","Tathamay Basu, Kartik K. Iyer, Kiran Singh, K. Mukherjee, P.L. Paulose
  and E.V. Sampathkumaran","Anisotropic magnetodielectric coupling behavior of Ca3Co1.4Rh0.6O6 due
  to geometrically frustrated magnetism","Applied Physics Letters, in press. Supplementary Material is included",,"10.1063/1.4895699",,"cond-mat.str-el cond-mat.mtrl-sci","http://arxiv.org/licenses/nonexclusive-distrib/1.0/","  We have investigated the magnetic, dielectric and magnetodielectric (MDE)
behavior of a geometrically frustrated spin-chain system, Ca3Co1.4Rh0.6O6, in
the single crystalline form for different orientations. The results bring out
that the magnetic behavior of this compound is by itself interesting in the
sense that this compound exhibits an anisotropic glassy-like magnetic behavior
with a huge frequency dependence of ac susceptibility peak for an orientation
along the spin-chain in the range 30-60 K; this behavior is robust to
applications of large external magnetic fields (H) unlike in canonical
spin-glasses. The temperature dependence of dielectric constant also shows
strong frequency dependence with similar robustness to H. The isothermal
H-dependent dielectric results at low temperatures establishes anisotropic MDE
coupling. It is intriguing to note that there is a 'step' roughly at one-third
of saturation values as in the case of isothermal magnetization curves for same
temperatures (for orientation along spin-chain), a correlation hitherto
unrealized for geometrically frustrated systems.
","[{""version"":""v1"",""created"":""Tue, 2 Sep 2014 16:45:34 GMT""}]","2015-06-22"
"1409.0784","Shumpei Masuda","Shumpei Masuda and Stuart A. Rice","Selective Vibrational Population Transfer using Combined STIRAP and
  Counter-Diabatic Fields",,,,,"quant-ph","http://arxiv.org/licenses/nonexclusive-distrib/1.0/","  We report studies of state-to-state vibrational energy transfer in an
isolated polyatomic molecule driven by combined stimulated Raman adiabatic
passage (STIRAP) and counter-diabatic fields (CDF), using as vehicles selective
population of one of a pair of near degenerate states in SCCl$_2$ and enhancing
the yield of HNC in the HCN/HNC isomerization reaction. The efficiency of the
population transfer within a subset of states embedded in a dense manifold of
states is examined for the cases that the transition dipole moments between the
initial and target states are much smaller than and comparable to the
transition dipole moments between background states, and for the case that the
subset states have large transition dipole moments with the background states.
We show that, in a subset of states that is coupled to background states, a
combination of STIRAP fields and CDFs that do not individually generate
processes that are competitive with the desired population transfer can
generate greater population transfer efficiency than can ordinary STIRAP with
field strength and/or pulse duration similarly restricted. We also show that
the exact CDF for an isolated three level system is a useful approximation to
the exact CDF for three and five state systems embedded in background states,
and we report a study of the stability of the STIRAP + approximate CDF control
protocol to variation of the CDF.
","[{""version"":""v1"",""created"":""Tue, 2 Sep 2014 16:47:18 GMT""}]","2014-09-03"
"1409.0786","Vesna Mitrovic","H. Mayaffre, S. Kramer, M. Horvati\'c, C. Berthier, K. Miyagawa, K.
  Kanoda, V. F. Mitrovi\'c","Evidence of Andreev bound states as a hallmark of the FFLO phase in
  $\kappa$-(BEDT-TTF)$_2$Cu(NCS)$_2$","6 pages, 5 figs",,"10.1038/nphys3121",,"cond-mat.supr-con cond-mat.quant-gas cond-mat.str-el","http://arxiv.org/licenses/nonexclusive-distrib/1.0/","  Superconductivity is a quantum phenomena arising, in its simplest form, from
pairing of fermions with opposite spin into a state with zero net momentum.
Whether superconductivity can occur in fermionic systems with unequal number of
two species distinguished by spin, atomic hyperfine states, flavor, presents an
important open question in condensed matter, cold atoms, and quantum
chromodynamics, physics. In the former case the imbalance between spin-up and
spin-down electrons forming the Cooper pairs is indyced by the magnetic field.
Nearly fifty years ago Fulde, Ferrell, Larkin and Ovchinnikov (FFLO) proposed
that such imbalanced system can lead to exotic superconductivity in which pairs
acquire finite momentum. The finite pair momentum leads to spatially
inhomogeneous state consisting of of a periodic alternation of ""normal"" and
""superconducting"" regions. Here, we report nuclear magnetic resonance (NMR)
measurements providing microscopic evidence for the existence of this new
superconducting state through the observation of spin-polarized quasiparticles
forming so-called Andreev bound states.
","[{""version"":""v1"",""created"":""Tue, 2 Sep 2014 16:48:36 GMT""}]","2015-06-22"
"1409.0787","Hans Moritz G\""unther","Hans Moritz G\""unther, Zhi-Yun Li, P. C. Schneider","Recollimation boundary layers as X-ray sources in young stellar jets","accepted by ApJ, 14 pages, 9 figures",,"10.1088/0004-637X/795/1/51",,"astro-ph.SR","http://arxiv.org/licenses/nonexclusive-distrib/1.0/","  Young stars accrete mass from circumstellar disks and in many cases, the
accretion coincides with a phase of massive outflows, which can be highly
collimated. Those jets emit predominantly in the optical and IR wavelength
range. However, in several cases X-ray and UV observations reveal a weak but
highly energetic component in those jets. X-rays are observed both from
stationary regions close to the star and from knots in the jet several hundred
AU from the star. In this article we show semi-analytically that a fast stellar
wind which is recollimated by the pressure from a slower, more massive disk
wind can have the right properties to power stationary X-ray emission. The size
of the shocked regions is compatible with observational constraints. Our
calculations support a wind-wind interaction scenario for the high energy
emission near the base of YSO jets. For the specific case of DG Tau, a stellar
wind with a mass loss rate of $5\cdot10^{-10}\;M_{\odot}\;\mathrm{yr}^{-1}$ and
a wind speed of 800 km s$^{-1}$ reproduces the observed X-ray spectrum. We
conclude that a stellar wind recollimation shock is a viable scenario to power
stationary X-ray emission close to the jet launching point.
","[{""version"":""v1"",""created"":""Tue, 2 Sep 2014 16:49:07 GMT""}]","2015-06-22"
"1409.0788","Uwe Aickelin","Chris Roadknight, Uwe Aickelin, John Scholefield, Lindy Durrant","Ensemble Learning of Colorectal Cancer Survival Rates","IEEE International Conference on Computational Intelligence and
  Virtual Environments for Measurement Systems and Applications (CIVEMSA) 2013,
  pp. 82 - 86, 2013",,"10.1109/CIVEMSA.2013.6617400",,"cs.LG cs.CE","http://arxiv.org/licenses/nonexclusive-distrib/1.0/","  In this paper, we describe a dataset relating to cellular and physical
conditions of patients who are operated upon to remove colorectal tumours. This
data provides a unique insight into immunological status at the point of tumour
removal, tumour classification and post-operative survival. We build on
existing research on clustering and machine learning facets of this data to
demonstrate a role for an ensemble approach to highlighting patients with
clearer prognosis parameters. Results for survival prediction using 3 different
approaches are shown for a subset of the data which is most difficult to model.
The performance of each model individually is compared with subsets of the data
where some agreement is reached for multiple models. Significant improvements
in model accuracy on an unseen test set can be achieved for patients where
agreement between models is achieved.
","[{""version"":""v1"",""created"":""Tue, 2 Sep 2014 16:52:16 GMT""}]","2016-11-15"
