"1409.0939","Polina Zemko","P. Zemko, M. Orio, K. Mukai, S. Shugarov","X-ray observations of VY Scl type nova-like binaries in the high and low
  state","13 pages, 8 figures, 7 tables. Accepted for publication by MNRAS",,"10.1093/mnras/stu1783","IFN-14-09","astro-ph.SR astro-ph.HE","http://arxiv.org/licenses/nonexclusive-distrib/1.0/","  Four VY Scl-type nova-like systems were observed in X-rays during both the
low and the high optical states. We examined Chandra, ROSAT, Swift and Suzaku
archival observations of BZ Cam, MV Lyr, TT Ari, and V794 Aql. The X-ray flux
of BZ Cam is higher during the low state, but there is no supersoft X-ray
source (SSS) as hypothesized in previous articles. No SSS was detected in the
low state of the any of the other systems, with the X-ray flux decreasing by a
factor between 2 and 50. The best fit to the Swift X-ray spectra is obtained
with a multi-component model of plasma in collisional ionization equilibrium.
The high state high resolution spectra of TT Ari taken with Chandra ACIS-S and
the HETG gratings show a rich emission line spectrum, with prominent lines of
in Mg, Si, Ne, and S. The complexity of this spectrum seems to have origin in
more than one region, or more than one single physical mechanism. While several
emission lines are consistent with a cooling flow in an accretion stream, there
is at least an additional component. We discuss the origin of this component,
which is probably arising in a wind from the system. We also examine the
possibility that the VY Scl systems may be intermediate polars, and that while
the boundary layer of the accretion disk emits only in the extreme ultraviolet,
part of the X-ray flux may be due to magnetically driven accretion.
","[{""version"":""v1"",""created"":""Wed, 3 Sep 2014 02:26:35 GMT""}]","2015-06-22"
"1409.0940","Haim Avron","Vikas Sindhwani and Haim Avron","High-performance Kernel Machines with Implicit Distributed Optimization
  and Randomization","Work presented at MMDS 2014 (June 2014) and JSM 2014",,,,"stat.ML cs.DC cs.LG","http://arxiv.org/licenses/nonexclusive-distrib/1.0/","  In order to fully utilize ""big data"", it is often required to use ""big
models"". Such models tend to grow with the complexity and size of the training
data, and do not make strong parametric assumptions upfront on the nature of
the underlying statistical dependencies. Kernel methods fit this need well, as
they constitute a versatile and principled statistical methodology for solving
a wide range of non-parametric modelling problems. However, their high
computational costs (in storage and time) pose a significant barrier to their
widespread adoption in big data applications.
  We propose an algorithmic framework and high-performance implementation for
massive-scale training of kernel-based statistical models, based on combining
two key technical ingredients: (i) distributed general purpose convex
optimization, and (ii) the use of randomization to improve the scalability of
kernel methods. Our approach is based on a block-splitting variant of the
Alternating Directions Method of Multipliers, carefully reconfigured to handle
very large random feature matrices, while exploiting hybrid parallelism
typically found in modern clusters of multicore machines. Our implementation
supports a variety of statistical learning tasks by enabling several loss
functions, regularization schemes, kernels, and layers of randomized
approximations for both dense and sparse datasets, in a highly extensible
framework. We evaluate the ability of our framework to learn models on data
from applications, and provide a comparison against existing sequential and
parallel libraries.
","[{""version"":""v1"",""created"":""Wed, 3 Sep 2014 02:28:51 GMT""},{""version"":""v2"",""created"":""Tue, 23 Dec 2014 21:38:15 GMT""},{""version"":""v3"",""created"":""Thu, 16 Apr 2015 18:06:53 GMT""}]","2015-04-17"
"1409.0941","Jingzhou Sun","JIngzhou Sun","A new method in the Jacobian Conjecture",,,,,"math.AG","http://arxiv.org/licenses/nonexclusive-distrib/1.0/","  We introduce a new method in the attempt to prove the Jacobian conjecture. In
the complex dimension 2 case, we apply this method to prove some new results
related the Jacobian conjecture.
","[{""version"":""v1"",""created"":""Wed, 3 Sep 2014 02:34:43 GMT""}]","2014-09-04"
"1409.0942","Meng Fai Lim","Meng Fai Lim","Comparing the $\pi$-primary submodules of the dual Selmer groups","36 pages. Some further minor corrections. The work of this paper
  generalizes the results in a previous article of the author in
  arXiv:1405.5289","Asian Journal of Mathematics Vol. 21, No. 6, pp. 1153-1182, Dec
  2017","10.4310/AJM.2017.v21.n6.a7",,"math.NT","http://arxiv.org/licenses/nonexclusive-distrib/1.0/","  In this paper, we compare the structure of Selmer groups of certain classes
of Galois representations over an admissible $p$-adic Lie extension. Namely, we
show that the $\pi$-primary submodules of the Pontryagin dual of the Selmer
groups of two Galois representations have the same elementary representations
when the two Galois representations in question are either Tate dual to each
other or are congruent to each other. In the first situation, our result gives
a partial answer to the question of Greenberg on whether the Pontryagin dual of
the Selmer groups of two Galois representations that are Tate dual to each
other are pseudo-isomorphic (up to a twist of the Iwasawa algebra). In the
second situation, our result will be applied to study the variation of the
$\pi$-primary submodules of the dual Selmer groups of certain specialization of
a big Galois representation. One of the important ingredient in our proofs is
an asymptotic formula for $\pi$-primary modules over a noncommutative Iwasawa
algebra which can be viewed as a generalization of a weak analog of the
classical Iwasawa asymptotic formula.
","[{""version"":""v1"",""created"":""Wed, 3 Sep 2014 03:21:28 GMT""},{""version"":""v2"",""created"":""Tue, 30 Dec 2014 23:35:32 GMT""},{""version"":""v3"",""created"":""Mon, 21 Sep 2015 03:03:52 GMT""},{""version"":""v4"",""created"":""Tue, 15 Dec 2015 08:33:10 GMT""},{""version"":""v5"",""created"":""Fri, 7 Oct 2016 02:29:19 GMT""}]","2020-09-07"
"1409.0943","Jin-Jian Zhou","Jin-Jian Zhou, Wanxiang Feng, Gui-Bin Liu, and Yugui Yao","Topological edge states in single- and multi-layer Bi$_{4}$Br$_{4}$","4 pages, 4 figures","New J. Phys. 17 (2015) 015004","10.1088/1367-2630/17/1/015004",,"cond-mat.mtrl-sci cond-mat.mes-hall","http://arxiv.org/licenses/nonexclusive-distrib/1.0/","  Topological edge states at the boundary of quantum spin Hall (QSH) insulators
hold great promise for dissipationless electron transport. The device
application of topological edge states has several critical requirements for
the QSH insulator materials, e.g., large band gap, appropriate insulating
substrates, and multiple conducting channels. In this paper, based on
first-principle calculations, we show that Bi$_{4}$Br$_{4}$ is a suitable
candidate. Single-layer Bi$_{4}$Br$_{4}$ was demonstrated to be QSH insulator
with sizable gap recently. Here, we find that, in multilayer systems, both the
band gaps and low-energy electronic structures are only slightly affected by
the interlayer coupling. On the intrinsic insulating substrate of
Bi$_{4}$Br$_{4}$, the single-layer Bi$_{4}$Br$_{4}$ well preserves its
topological edge states. Moreover, at the boundary of multilayer
Bi$_{4}$Br$_{4}$, the topological edge states stemming from different
single-layers are weakly coupled, and can be fully decoupled via constructing a
stair-stepped edge. The decoupled topological edge states are well suitable for
multi-channel dissipationless transport.
","[{""version"":""v1"",""created"":""Wed, 3 Sep 2014 03:38:23 GMT""}]","2015-01-13"
"1409.0944","Sunder Sethuraman","Sunder Sethuraman","On microscopic derivation of a fractional stochastic Burgers equation","24 pages",,"10.1007/s00220-015-2524-4",,"math.PR","http://arxiv.org/licenses/nonexclusive-distrib/1.0/","  We derive from a class of microscopic asymmetric interacting particle systems
on ${\mathbb Z}$, with long range jump rates of order $|\cdot|^{-(1+\alpha)}$
for $0<\alpha<2$, different continuum fractional SPDEs. More specifically, we
show the equilibrium fluctuations of the hydrodynamics mass density field of
zero-range processes, depending on the stucture of the asymmetry, and whether
the field is translated with process characteristics velocity, is governed in
various senses by types of fractional stochastic heat or Burgers equations.
  The main result: Suppose the jump rate is such that its symmetrization is
long range but its (weak) asymmetry is nearest-neighbor. Then, when
$\alpha<3/2$, the fluctuation field in space-time scale $1/\alpha:1$,
translated with process characteristic velocity, irrespective of the strength
of the asymmetry, converges to a fractional stochastic heat equation, the limit
also for the symmetric process. However, when $\alpha\geq 3/2$ and the strength
of the weak asymmetry is tuned in scale $1-3/2\alpha$, the associated limit
points satisfy a martingale formulation of a fractional stochastic Burgers
equation.
","[{""version"":""v1"",""created"":""Wed, 3 Sep 2014 04:02:27 GMT""}]","2016-01-27"
"1409.0945","Mohammad Hossein Ehsani","M. E. Ehsani, M.E. Ghazi, P. Kameli, F.S. Razavi","DC magnetization studies of nano- and micro-particles of bilayered
  manganite LaSr2Mn2O7",,"J. Alloys and Compounds, 586, 2014,261",,,"cond-mat.mtrl-sci cond-mat.str-el cond-mat.supr-con","http://arxiv.org/licenses/nonexclusive-distrib/1.0/","  Systematic studies of magnetic properties of LaSr2Mn2O7 as a function of
crystalline grain size provide information on how the crystalline grain size
affects the magnetic and charge ordering in this compound. The half-doped
bi-layered manganite LaSr2Mn2O7 (x=0.5) in its bulk form has CE-type
antiferromagnetic (CE-AFM) charge ordering phase transition. In this work, we
have prepared LaSr2Mn2O7 ceramic samples using Pechini sol-gel method to
produce different grain sizes and the effect of crystalline grain sizes between
150 200 to 1000 nm on magnetic properties results obtained by the SQUID
magnetometer have been investigated. The DC magnetization (DCM) measurements
for all samples indicate that the crystalline grain size has no considerable
effect on TCO. Just the temperature of charge ordering peak becomes sharper,
and susceptibility measurement in the zero field cooling (ZFC) and filed
cooling (FC) increases as the grain sizes becomes systematically smaller. The
results obtained from magnetic hysteresis curves confirm the anti-ferromagnetic
phase formation as a ground state and Arrott plots obtained manifest the
existence of first and second order magnetic phase transition in all samples.
In addition, in sample with a grain size of 150 200 nm, enhancement of the
magnetic properties, which is accompanied with the formation of FM phase on the
surface of grain or particle, is observed.
","[{""version"":""v1"",""created"":""Wed, 3 Sep 2014 04:12:10 GMT""},{""version"":""v2"",""created"":""Sun, 14 Sep 2014 10:14:49 GMT""}]","2014-09-16"
"1409.0946","Shirali Kadyrov","Shirali Kadyrov","Effective uniqueness of Parry measure and exceptional sets in ergodic
  theory",,,,,"math.DS math.NT","http://arxiv.org/licenses/nonexclusive-distrib/1.0/","  It is known that hyperbolic dynamical systems admit a unique invariant
probability measure with maximal entropy. We prove an effective version of this
statement and use it to estimate an upper bound for Hausdorff dimension of
exceptional sets arising from dynamics.
","[{""version"":""v1"",""created"":""Wed, 3 Sep 2014 04:13:28 GMT""}]","2014-09-04"
"1409.0947","Qizhong Lin","Qizhong Lin and Yusheng Li","A Folkman Linear Family","11 pages",,,,"math.CO","http://arxiv.org/licenses/nonexclusive-distrib/1.0/","  For graphs $F$ and $G$, let $F\to (G,G)$ signify that any red/blue edge
coloring of $F$ contains a monochromatic $G$. Define Folkman number $f(G;p)$ to
be the smallest order of a graph $F$ such that $F\to (G,G)$ and $\omega(F) \le
p$. It is shown that $f(G;p)\le cn$ for graphs $G$ of order $n$ with
$\Delta(G)\le \Delta$, where $\Delta\ge 3$, $c=c(\Delta)$ and $p=p(\Delta)$ are
positive constants.
","[{""version"":""v1"",""created"":""Wed, 3 Sep 2014 04:40:56 GMT""}]","2014-09-04"
"1409.0948","Hyun Su Lee","H.S. Lee, H. Bhang, J.H. Choi, S. Choi, I.S. Hahn, E.J. Jeon, H.W.
  Joo, W.G. Kang, G.B. Kim, H.J. Kim, K.W. Kim, S.C. Kim, S.K. Kim, Y.D. Kim,
  Y.H. Kim, J.H. Lee, J.K. Lee, D.S. Leonard, J. Li, S.S. Myung, S.L. Olsen,
  and J.H. So","Neutron calibration facility with an Am-Be source for pulse shape
  discrimination measurement of CsI(Tl) crystals","Accepted in JINST","JINST 9, P11015 (2014)","10.1088/1748-0221/9/11/P11015",,"physics.ins-det astro-ph.IM hep-ex","http://arxiv.org/licenses/nonexclusive-distrib/1.0/","  We constructed a neutron calibration facility based on a 300-mCi Am-Be source
in conjunction with a search for weakly interacting massive particle candidates
for dark matter. The facility is used to study the response of CsI(Tl) crystals
to nuclear recoils induced by neutrons from the Am-Be source and comparing them
with the response to electron recoils produced by Compton scattering of 662-keV
$\gamma$-rays from a $^{137}$Cs source. The measured results on pulse shape
discrimination (PSD) between nuclear- and electron-recoil events are quantified
in terms of quality factors. A comparison with similar result from a neutron
reactor demonstrate the feasibility of performing calibrations of PSD
measurements using neutrons from a Am-Be source.
","[{""version"":""v1"",""created"":""Wed, 3 Sep 2014 04:47:49 GMT""},{""version"":""v2"",""created"":""Thu, 9 Oct 2014 13:21:14 GMT""},{""version"":""v3"",""created"":""Thu, 6 Nov 2014 01:08:46 GMT""}]","2014-11-17"
"1409.0949","Hyun-Joo Kim","Hyun-Joo Kim","Time-Average Based on Scaling Law in Anomalous Diffusions",,,"10.1142/S0217984915500591",,"cond-mat.stat-mech","http://arxiv.org/licenses/nonexclusive-distrib/1.0/","  To solve the obscureness in measurement brought about from the weak
ergodicity breaking appeared in anomalous diffusions we have suggested the
time-averaged mean squared displacement (MSD) $\bar{\delta^2 (\tau)}_\tau$ with
a integral interval depending linearly on the lag time $\tau$. For the
continuous time random walk describing a subdiffusive behavior, we have found
that $\bar{\delta^2 (\tau)}_\tau \sim \tau^\gamma$ like that of the
ensemble-averaged MSD, which makes it be possible to measure the proper
exponent values through time-average in experiments like a single molecule
tracking. Also we have found that it is originated from the scaling nature of
the MSD at a aging time in anomalous diffusion and confirmed them through
numerical results of the other microscopic non-Markovian model showing
subdiffusions and superdiffusions with the origin of memory enhancement.
","[{""version"":""v1"",""created"":""Wed, 3 Sep 2014 04:48:01 GMT""},{""version"":""v2"",""created"":""Thu, 11 Sep 2014 05:09:15 GMT""}]","2015-06-11"
"1409.0950","Michael Taylor","Michael A. Taylor and Warwick P. Bowen","Quantum metrology and its application in biology","Submitted review article, comments and suggestions welcome",,,,"quant-ph","http://arxiv.org/licenses/nonexclusive-distrib/1.0/","  Quantum metrology provides a route to overcome practical limits in sensing
devices. It holds particular relevance to biology, where sensitivity and
resolution constraints restrict applications both in fundamental biophysics and
in medicine. Here, we review quantum metrology from this biological context,
focusing on optical techniques due to their particular relevance for biological
imaging, sensing, and stimulation. Our understanding of quantum mechanics has
already enabled important applications in biology, including positron emission
tomography (PET) with entangled photons, magnetic resonance imaging (MRI) using
nuclear magnetic resonance, and bio-magnetic imaging with superconducting
quantum interference devices (SQUIDs). In quantum metrology an even greater
range of applications arise from the ability to not just understand, but to
engineer, coherence and correlations at the quantum level. In the past few
years, quite dramatic progress has been seen in applying these ideas into
biological systems. Capabilities that have been demonstrated include enhanced
sensitivity and resolution, immunity to imaging artifacts and technical noise,
and characterization of the biological response to light at the single-photon
level. New quantum measurement techniques offer even greater promise, raising
the prospect for improved multi-photon microscopy and magnetic imaging, among
many other possible applications. Realization of this potential will require
cross-disciplinary input from researchers in both biology and quantum physics.
In this review we seek to communicate the developments of quantum metrology in
a way that is accessible to biologists and biophysicists, while providing
sufficient detail to allow the interested reader to obtain a solid
understanding of the field. We further seek to introduce quantum physicists to
some of the central challenges of optical measurements in biological science.
","[{""version"":""v1"",""created"":""Wed, 3 Sep 2014 04:52:32 GMT""},{""version"":""v2"",""created"":""Fri, 2 Oct 2015 11:42:18 GMT""}]","2015-10-05"
"1409.0951","Takashi Ichikawa","Takashi Ichikawa","Arithmetic geometry of algebraic curves and their moduli space","This is a lecture note on the arithmetic geometry of algebraic curves
  and their moduli space",,,,"math.NT","http://arxiv.org/licenses/nonexclusive-distrib/1.0/","  We review the following subjects: 1. Basic theory on algebraic curves and
their moduli space, 2. Schottky uniformization theory of Riemann surfaces, and
its extension called arithmetic uniformization theory, 3. Application to these
theories to the arithmetic of the moduli space of algebraic curves, especially
to automorphic forms on this space.
","[{""version"":""v1"",""created"":""Wed, 3 Sep 2014 05:21:01 GMT""},{""version"":""v2"",""created"":""Sun, 21 Sep 2014 06:11:00 GMT""}]","2014-09-23"
"1409.0952","Anyu Wang","Anyu Wang and Zhifang Zhang","An Integer Programming Based Bound for Locally Repairable Codes","23 pages",,,,"cs.IT math.IT","http://arxiv.org/licenses/nonexclusive-distrib/1.0/","  The locally repairable code (LRC) studied in this paper is an $[n,k]$ linear
code of which the value at each coordinate can be recovered by a linear
combination of at most $r$ other coordinates. The central problem in this work
is to determine the largest possible minimum distance for LRCs. First, an
integer programming based upper bound is derived for any LRC. Then by solving
the programming problem under certain conditions, an explicit upper bound is
obtained for LRCs with parameters $n_1>n_2$, where $n_1 = \left\lceil
\frac{n}{r+1} \right\rceil$ and $n_2 = n_1 (r+1) - n$. Finally, an explicit
construction for LRCs attaining this upper bound is presented over the finite
field $\mathbb{F}_{2^m}$, where $m\geq n_1r$. Based on these results, the
largest possible minimum distance for all LRCs with $r \le \sqrt{n}-1$ has been
definitely determined, which is of great significance in practical use.
","[{""version"":""v1"",""created"":""Wed, 3 Sep 2014 05:21:35 GMT""}]","2014-09-04"
"1409.0953","Amir Haji-Akbari","Amir Haji-Akbari and Ryan S. DeFever and Sapna Sarupria and Pablo G.
  Debenedetti","Suppression of Sub-surface Freezing in Free-Standing Thin Films of a
  Coarse-grained Model of Water","13 pages, 10 figures",,"10.1039/C4CP03948C",,"cond-mat.stat-mech physics.chem-ph physics.comp-ph","http://arxiv.org/licenses/nonexclusive-distrib/1.0/","  Freezing in the vicinity of water-vapor interfaces is of considerable
interest to a wide range of disciplines, most notably the atmospheric sciences.
In this work, we use molecular dynamics and two advanced sampling techniques,
forward flux sampling and umbrella sampling, to study homogeneous nucleation of
ice in free-standing thin films of supercooled water. We use a coarse-grained
monoatomic model of water, known as mW, and we find that in this model a
vapor-liquid interface suppresses crystallization in its vicinity. This
suppression occurs in the vicinity of flat interfaces where no net Laplace
pressure in induced. Our free energy calculations reveal that the pre-critical
crystalline nuclei that emerge near the interface are thermodynamically less
stable than those that emerge in the bulk. We investigate the origin of this
instability by computing the average asphericity of nuclei that form in
different regions of the film, and observe that average asphericity increases
closer to the interface, which is consistent with an increase in the free
energy due to increased surface-to-volume ratios.
","[{""version"":""v1"",""created"":""Wed, 3 Sep 2014 05:21:37 GMT""},{""version"":""v2"",""created"":""Mon, 3 Nov 2014 01:54:02 GMT""}]","2014-11-04"
"1409.0954","Danilo Sergi","Danilo Sergi, Loris Grossi, Tiziano Leidi, Alberto Ortona","Lattice Boltzmann simulations on the role of channel structure for
  reactive capillary infiltration","Publication: http://dx.doi.org/10.1080/19942060.2015.1026432
  Material: https://sites.google.com/site/lbmodule/. Engineering Applications
  of Computational Fluid Mechanics (2015)",,"10.1080/19942060.2015.1026432",,"cond-mat.soft cond-mat.mtrl-sci physics.flu-dyn","http://arxiv.org/licenses/nonexclusive-distrib/1.0/","  It is widely recognized that the structure of porous media is of relevance
for a variety of mechanical and physical phenomena. The focus of the present
work is on capillarity, a pore-scale process occurring at the micron scale. We
attempt to characterize the influence of pore shape for capillary infiltration
by means of Lattice Boltzmann simulations in 2D with reactive boundaries
leading to surface growth and ultimately to pore closure. The systems under
investigation consist of single channels with different simplified
morphologies: namely, periodic profiles with sinusoidal, step-shaped and
zig-zag walls, as well as constrictions and expansions with rectangular, convex
and concave steps. This is a useful way to decompose the complexity of typical
porous media into basic structures. The simulations show that the minimum
radius alone fails to characterize properly the infiltration dynamics. The
structure of the channels emerge as the dominant property controlling the
process. A factor responsible for this behavior is identified as being the
occurrence of pinning of the contact line. It turns out that the optimal
configuration for the pore structure arises from the packing of large particles
with round shapes. In this case, the probability to have flow paths wide and
straight is higher. Faceted surfaces presenting sharp edges should be avoided
because of the phenomenon of pinning near narrow-to-wide parts. This study is
motivated by the infiltration of molten metals into carbon preforms. This is a
manufacturing technique for ceramic components devised to advanced
applications. Guidelines for experimental work are discussed.
","[{""version"":""v1"",""created"":""Wed, 3 Sep 2014 05:44:37 GMT""},{""version"":""v2"",""created"":""Thu, 21 May 2015 07:22:46 GMT""}]","2015-05-22"
"1409.0955","Riccarda Rossi","Alexander Mielke, Riccarda Rossi, Giuseppe Savar\'e","Balanced-Viscosity solutions for multi-rate systems",,"J. Physics, Conf. Series 727 (2016) 012010/26pp","10.1088/1742-6596/727/1/012010","WIAS preprint 2001","math.AP","http://arxiv.org/licenses/nonexclusive-distrib/1.0/","  Several mechanical systems are modeled by the static momentum balance for the
displacement $u$ coupled with a rate-independent flow rule for some internal
variable $z$. We consider a class of abstract systems of ODEs which have the
same structure, albeit in a finite-dimensional setting, and regularize both the
static equation and the rate-independent flow rule by adding viscous
dissipation terms with coefficients $\varepsilon^\alpha$ and $\varepsilon$,
where $0<\varepsilon \ll 1$ and $\alpha>0$ is a fixed parameter. Therefore for
$\alpha \neq 1$ $u$ and $z$ have different relaxation rates.
  We address the vanishing-viscosity analysis as $\varepsilon \downarrow 0$ of
the viscous system. We prove that, up to a subsequence, (reparameterized)
viscous solutions converge to a parameterized curve yielding a Balanced
Viscosity solution to the original rate-independent system, and providing an
accurate description of the system behavior at jumps. We also give a
reformulation of the notion of Balanced Viscosity solution in terms of a system
of subdifferential inclusions, showing that the viscosity in $u$ and the one in
$z$ are involved in the jump dynamics in different ways, according to whether
$\alpha>1$, $\alpha=1$, and $\alpha \in (0,1)$.
","[{""version"":""v1"",""created"":""Wed, 3 Sep 2014 05:47:06 GMT""}]","2018-10-16"
