"1409.7393","Xinyi Guo","Xinyi Guo, Lorenzo Sironi, Ramesh Narayan (Harvard)","Non-Thermal Electron Acceleration in Low Mach Number Collisionless
  Shocks. II. Firehose-Mediated Fermi Acceleration and its Dependence on
  Pre-Shock Conditions","17 pages, 10 figures, accepted to ApJ","ApJ, 797, (2014), 47","10.1088/0004-637X/797/1/47",,"astro-ph.HE","http://arxiv.org/licenses/nonexclusive-distrib/1.0/","  Electron acceleration to non-thermal energies is known to occur in low Mach
number (M<5) shocks in galaxy clusters and solar flares, but the electron
acceleration mechanism remains poorly understood. Using two-dimensional (2D)
particle-in-cell (PIC) plasma simulations, we showed in Paper I that electrons
are efficiently accelerated in low Mach number (M=3) quasi-perpendicular shocks
via a Fermi-like process. The electrons bounce between the upstream region and
the shock front, with each reflection at the shock resulting in energy gain via
shock drift acceleration. The upstream scattering is provided by oblique
magnetic waves, that are self-generated by the electrons escaping ahead of the
shock. In the present work, we employ additional 2D PIC simulations to address
the nature of the upstream oblique waves. We find that the waves are generated
by the shock-reflected electrons via the firehose instability, which is driven
by an anisotropy in the electron velocity distribution. We systematically
explore how the efficiency of wave generation and of electron acceleration
depend on the magnetic field obliquity, the flow magnetization (or
equivalently, the plasma beta), and the upstream electron temperature. We find
that the mechanism works for shocks with high plasma beta (>20) at nearly all
magnetic field obliquities, and for electron temperatures in the range relevant
for galaxy clusters. Our findings offer a natural solution to the conflict
between the bright radio synchrotron emission observed from the outskirts of
galaxy clusters and the low electron acceleration efficiency usually expected
in low Mach number shocks.
","[{""version"":""v1"",""created"":""Thu, 25 Sep 2014 20:00:09 GMT""},{""version"":""v2"",""created"":""Thu, 23 Oct 2014 20:00:00 GMT""}]","2014-11-26"
"1409.7394","Lucas Ellerbroek","L. E. Ellerbroek, M. Benisty, S. Kraus, K. Perraut, J. Kluska, J. B.
  le Bouquin, M. Borges Fernandes, A. Domiciano de Souza, K. M. Maaskant, L.
  Kaper, F. Tramper, D. Mourard, I. Tallon-Bosc, T. ten Brummelaar, M. L.
  Sitko, D. K. Lynch, R. W. Russell","A resolved, au-scale gas disk around the B[e] star HD 50138","19 pages, 12 images. Accepted for publication in Astronomy &
  Astrophysics",,"10.1051/0004-6361/201424143",,"astro-ph.SR","http://arxiv.org/licenses/nonexclusive-distrib/1.0/","  HD 50138 is a B[e] star surrounded by a large amount of circumstellar gas and
dust. Its spectrum shows characteristics which may indicate either a pre- or a
post-main-sequence system. Mapping the kinematics of the gas in the inner few
au of the system contributes to a better understanding of its physical nature.
We present the first high spatial and spectral resolution interferometric
observations of the Br-gamma line of HD~50138, obtained with VLTI/AMBER. The
line emission originates from a region more compact (up to 3 au) than the
continuum-emitting region. Blue- and red-shifted emission originates from the
two different hemispheres of an elongated structure perpendicular to the
polarization angle. The velocity of the emitting medium decreases radially. An
overall offset along the NW direction between the line- and continuum-emitting
regions is observed. We compare the data with a geometric model of a thin
Keplerian disk and a spherical halo on top of a Gaussian continuum. Most of the
data are well reproduced by this model, except for the variability, the global
offset and the visibility at the systemic velocity. The evolutionary state of
the system is discussed; most diagnostics are ambiguous and may point either to
a post-main-sequence or a pre-main-sequence nature.
","[{""version"":""v1"",""created"":""Thu, 25 Sep 2014 20:00:11 GMT""}]","2015-06-23"
"1409.7395","Philip Hopkins","Philip F. Hopkins (Caltech)","GIZMO: A New Class of Accurate, Mesh-Free Hydrodynamic Simulation
  Methods","57 pages, 33 figures. MNRAS. A public version of the GIZMO code,
  user's guide, test problem setups, and movies are available at
  http://www.tapir.caltech.edu/~phopkins/Site/GIZMO.html","MNRAS, 450, 53, (2015)","10.1093/mnras/stv195",,"astro-ph.CO astro-ph.GA astro-ph.IM physics.comp-ph physics.flu-dyn","http://arxiv.org/licenses/nonexclusive-distrib/1.0/","  We present two new Lagrangian methods for hydrodynamics, in a systematic
comparison with moving-mesh, SPH, and stationary (non-moving) grid methods. The
new methods are designed to simultaneously capture advantages of both
smoothed-particle hydrodynamics (SPH) and grid-based/adaptive mesh refinement
(AMR) schemes. They are based on a kernel discretization of the volume coupled
to a high-order matrix gradient estimator and a Riemann solver acting over the
volume 'overlap.' We implement and test a parallel, second-order version of the
method with self-gravity & cosmological integration, in the code GIZMO: this
maintains exact mass, energy and momentum conservation; exhibits superior
angular momentum conservation compared to all other methods we study; does not
require 'artificial diffusion' terms; and allows the fluid elements to move
with the flow so resolution is automatically adaptive. We consider a large
suite of test problems, and find that on all problems the new methods appear
competitive with moving-mesh schemes, with some advantages (particularly in
angular momentum conservation), at the cost of enhanced noise. The new methods
have many advantages vs. SPH: proper convergence, good capturing of
fluid-mixing instabilities, dramatically reduced 'particle noise' & numerical
viscosity, more accurate sub-sonic flow evolution, & sharp shock-capturing.
Advantages vs. non-moving meshes include: automatic adaptivity, dramatically
reduced advection errors & numerical overmixing, velocity-independent errors,
accurate coupling to gravity, good angular momentum conservation and
elimination of 'grid alignment' effects. We can, for example, follow hundreds
of orbits of gaseous disks, while AMR and SPH methods break down in a few
orbits. However, fixed meshes minimize 'grid noise.' These differences are
important for a range of astrophysical problems.
","[{""version"":""v1"",""created"":""Thu, 25 Sep 2014 20:00:11 GMT""},{""version"":""v2"",""created"":""Sun, 13 Dec 2015 23:39:39 GMT""}]","2015-12-15"
"1409.7396","Mariangela Vitale","M. Vitale, L. Fuhrmann, M. Garcia-Marin, A. Eckart, J. Zuther and A.
  M. Hopkins","Galaxy evolution across the optical emission-line diagnostic diagrams?","20 pages, 19 figures, accepted for publication in A&A","A&A 573, A93 (2015)","10.1051/0004-6361/201423993",,"astro-ph.GA astro-ph.CO","http://arxiv.org/licenses/nonexclusive-distrib/1.0/","  The discovery of the M-sigma relation, the local galaxy bimodality, and the
link between black-hole and host-galaxy properties, have raised the question
whether AGN play a role in galaxy evolution. Several theoretical models
implement AGN feedback to explain the observed galaxy luminosity function, and
possibly the color and morphological transformation of spiral galaxies into
passive ellipticals. To understand the importance of AGN feedback, a study of
the AGN populations in the radio-optical domain is crucial. A mass sequence
linking star-forming galaxies and AGN has been already noted in previous works,
and it is now investigated as possible evolutionary sequence. We observed a
sample of 119 intermediate-redshift (0.04<z<0.4) SDSS-FIRST radio emitters with
the Effelsberg 100-m telescope at 4.85 and 10.45 GHz and obtained spectral
indices. We find indications of spectral index flattening in high-metallicity
star-forming galaxies, composite galaxies, and Seyferts. This ""flattening
sequence"" along the [NII]-based emission-line diagnostic diagram is consistent
with the hardening of galaxy ionizing field, due to nuclear activity. After
combining our data with FIRST measurements at 1.4 GHz, we find that the
three-point radio spectra of Seyferts and LINERs show substantial differences,
attributable to small radio core components and larger (arcsecond sized)
jet/lobe components, respectively. A visual inspection of FIRST images seems to
confirm this hypothesis. Galaxies along this sequence are hypothesized to be
transitioning from the active star-forming galaxies (blue cloud) to the passive
elliptical galaxies (red sequence). This supports the suggestion that AGN play
a role in shutting down star-formation, and allow the transition from one
galaxy class to the other.
","[{""version"":""v1"",""created"":""Thu, 25 Sep 2014 20:00:12 GMT""}]","2014-12-24"
"1409.7397","Richard Evans","R. F. L. Evans, U. Atxitia, and R. W. Chantrell","Quantitative simulation of temperature dependent magnetization dynamics
  and equilibrium properties of elemental ferromagnets",,"Phys. Rev. B 91, 144425 (2015)","10.1103/PhysRevB.91.144425",,"cond-mat.mes-hall","http://arxiv.org/licenses/nonexclusive-distrib/1.0/","  Atomistic spin model simulations are immensely useful in determining
temperature dependent magnetic prop- erties, but are known to give the
incorrect dependence of the magnetization on temperature compared to exper-
iment owing to their classical origin. We find a single parameter rescaling of
thermal fluctuations which gives quantitative agreement of the temperature
dependent magnetization between atomistic simulations and experi- ment for the
elemental ferromagnets Ni, Fe, Co and Gd. Simulating the sub-picosecond
magnetization dynam- ics of Ni under the action of a laser pulse we also find
quantitative agreement with experiment in the ultrafast regime. This enables
the quantitative determination of temperature dependent magnetic properties
allowing for accurate simulations of magnetic materials at all temperatures.
","[{""version"":""v1"",""created"":""Thu, 25 Sep 2014 20:00:12 GMT""},{""version"":""v2"",""created"":""Sun, 10 May 2015 17:43:35 GMT""}]","2015-05-12"
"1409.7398","L. Ilsedore Cleeves","L. Ilsedore Cleeves (1), Edwin A. Bergin (1), Conel M. O'D. Alexander
  (2), Fujun Du (1), Dawn Graninger (3), Karin I. \""Oberg (3), Tim J. Harries
  (4) ((1) University of Michigan (2) Carnegie DTM (3) Harvard-Smithsonian CfA
  (4) University of Exeter)","The ancient heritage of water ice in the solar system","33 pages, 7 figures including main text and supplementary materials.
  Published in Science","Science, Vol. 345 no. 6204 pp. 1590-1593 (2014)","10.1126/science.1258055",,"astro-ph.SR","http://arxiv.org/licenses/nonexclusive-distrib/1.0/","  Identifying the source of Earth's water is central to understanding the
origins of life-fostering environments and to assessing the prevalence of such
environments in space. Water throughout the solar system exhibits
deuterium-to-hydrogen enrichments, a fossil relic of low-temperature,
ion-derived chemistry within either (i) the parent molecular cloud or (ii) the
solar nebula protoplanetary disk. Utilizing a comprehensive treatment of disk
ionization, we find that ion-driven deuterium pathways are inefficient,
curtailing the disk's deuterated water formation and its viability as the sole
source for the solar system's water. This finding implies that if the solar
system's formation was typical, abundant interstellar ices are available to all
nascent planetary systems.
","[{""version"":""v1"",""created"":""Thu, 25 Sep 2014 20:00:13 GMT""}]","2014-09-29"
"1409.7399","Laurence Perreault Levasseur","Laurence Perreault Levasseur (DAMTP and KIPAC) and Evan McDonough
  (McGill U.)","Backreaction and Stochastic Effects in Single Field Inflation","24 pages, 5 figures","Phys. Rev. D 91, 063513 (2015)","10.1103/PhysRevD.91.063513",,"hep-th astro-ph.CO gr-qc","http://arxiv.org/licenses/nonexclusive-distrib/1.0/","  The formalism of stochastic inflation is a powerful tool for analyzing the
backreaction of cosmological perturbations, and making precise predictions for
inflationary observables. We demonstrate this with the simple $m^2\phi^2$ model
of inflation, wherein we obtain an effective field theory for IR modes of the
inflaton, which remains coupled to UV modes through a classical noise. We
compute slow-roll corrections to the evolution of UV modes (i.e. quantum
fluctuations), and track this effect from the UV theory to the IR theory, where
it manifests as a correction to the classical noise. We compute the stochastic
correction to the spectral index of primordial perturbations, finding a small
effect, and discuss models in which this effect can become large. We extend our
analysis to tensor modes, and demonstrate that the stochastic approach allows
us to recover the standard tensor tilt $n_T$, plus corrections.
","[{""version"":""v1"",""created"":""Thu, 25 Sep 2014 20:00:13 GMT""},{""version"":""v2"",""created"":""Thu, 12 Mar 2015 21:03:07 GMT""},{""version"":""v3"",""created"":""Mon, 31 Aug 2015 23:38:05 GMT""}]","2015-09-02"
"1409.7400","Rub\'en Garc\'ia-Benito","R. Cid Fernandes, E. A. D. Lacerda, R. M. Gonz\'alez Delgado, N. Vale
  Asari, R. Garc\'ia-Benito, E. P\'erez, A. L. de Amorim, C. Cortijo-Ferrero,
  R. L\'opez Fern\'andez, S. F. S\'anchez, and the CALIFA collaboration","Spectral synthesis of stellar populations in the 3D era: The CALIFA
  experience","6 pages, 4 figures. Galaxies in 3D across the Universe. Proceedings
  IAU Symposium No. 309, 2014",,"10.1017/S1743921314009387",,"astro-ph.GA","http://arxiv.org/licenses/nonexclusive-distrib/1.0/","  Methods to recover the fossil record of galaxy evolution encoded in their
optical spectra have been instrumental in processing the avalanche of data from
mega-surveys along the last decade, effectively transforming observed spectra
onto a long and rich list of physical properties: from stellar masses and mean
ages to full star formation histories. This promoted progress in our
understanding of galaxies as a whole. Yet, the lack of spatial resolution
introduces undesirable aperture effects, and hampers advances on the internal
physics of galaxies. This is now changing with 3D surveys. The mapping of
stellar populations in data-cubes allows us to figure what comes from where,
unscrambling information previously available only in integrated form. This
contribution uses our starlight-based analysis of 300 CALIFA galaxies to
illustrate the power of spectral synthesis applied to data-cubes. The selected
results highlighted here include: (a) The evolution of the mass-metallicity and
mass-density-metallicity relations, as traced by the mean stellar metallicity.
(b) A comparison of star formation rates obtained from H{\alpha} to those
derived from full spectral fits. (c) The relation between star formation rate
and dust optical depth within galaxies, which turns out to mimic the
Schmidt-Kennicutt law. (d) PCA tomography experiments.
","[{""version"":""v1"",""created"":""Thu, 25 Sep 2014 20:00:15 GMT""}]","2015-06-23"
"1409.7401","Yi-Zhuang You","Kevin Slagle, Yi-Zhuang You, Cenke Xu","Exotic Quantum Phase Transitions of $(2+1)d$ Dirac fermions","12 pages, 9 figures","Phys. Rev. B 91, 115121 (2015)","10.1103/PhysRevB.91.115121",,"cond-mat.str-el","http://arxiv.org/licenses/nonexclusive-distrib/1.0/","  Using determinant quantum Monte Carlo (d-QMC) simulations, we demonstrate
that an extended Hubbard model on a bilayer honeycomb lattice has two novel
quantum phase transitions. The first is a quantum phase transition between the
weakly interacting gapless Dirac fermion phase and a strongly interacting fully
gapped and symmetric trivial phase, which cannot be described by the standard
Gross-Neveu model. The second is a quantum critical point between a quantum
spin Hall insulator with spin $S^z$ conservation and the previously mentioned
strongly interacting fully gapped phase. At the latter quantum critical point
the single particle excitations remain gapped, while spin and charge gap both
close. We argue that the first quantum phase transition is related to the
$\mathbb{Z}_{16}$ classification of the topological superconductor
$^3\text{He-B}$ phase with interactions, while the second quantum phase
transition is a topological phase transition described by a bosonic O(4)
nonlinear sigma model field theory with a $\Theta$-term.
","[{""version"":""v1"",""created"":""Thu, 25 Sep 2014 20:00:22 GMT""},{""version"":""v2"",""created"":""Wed, 1 Oct 2014 19:52:37 GMT""},{""version"":""v3"",""created"":""Thu, 17 Sep 2015 04:09:18 GMT""}]","2015-09-18"
"1409.7402","William Webber","W.R. Webber and D.S. Intriligator","A Forecast for a South Heliopause Crossing by Voyager 2 in Late 2014
  Using Intensity-time Features of Energetic Particles Observed by V1 and V2 in
  the North and South Heliosheaths","8 pages, 3 figures",,,,"physics.space-ph","http://arxiv.org/licenses/nonexclusive-distrib/1.0/","  We have used corresponding marker features in the intensity vs. time profile
of termination shock particles coming from within the heliosheath and also 5-12
MeV electrons which are coming from beyond the heliopause that are both
observed at both V1 and V2 in the outer N and S heliosheaths, to estimate the
thickness of the S heliosheath. These features in the N heliosheath have been
observed on the CRS instrument on V1 in the N heliosheath beyond 110 AU or
within 12 AU of the heliopause. Although the intensity-time features in the S
heliosheath are quite different overall, certain features stand out at both V1
and V2. The correspondence of these features in the N and S heliosheath allows
us to estimate that V2 will reach the S heliopause near the end of 2014.
","[{""version"":""v1"",""created"":""Thu, 25 Sep 2014 20:00:35 GMT""}]","2014-09-29"
"1409.7403","Simon DeDeo","David H. Wolpert, Joshua A. Grochow, Eric Libby, Simon DeDeo","Optimal high-level descriptions of dynamical systems","33 pages. Updated discussion and references",,,"SFI Working Paper #15-06-017","cs.IT cond-mat.stat-mech cs.AI cs.CE math.IT q-bio.PE","http://arxiv.org/licenses/nonexclusive-distrib/1.0/","  To analyze high-dimensional systems, many fields in science and engineering
rely on high-level descriptions, sometimes called ""macrostates,""
""coarse-grainings,"" or ""effective theories"". Examples of such descriptions
include the thermodynamic properties of a large collection of point particles
undergoing reversible dynamics, the variables in a macroeconomic model
describing the individuals that participate in an economy, and the summary
state of a cell composed of a large set of biochemical networks.
  Often these high-level descriptions are constructed without considering the
ultimate reason for needing them in the first place. Here, we formalize and
quantify one such purpose: the need to predict observables of interest
concerning the high-dimensional system with as high accuracy as possible, while
minimizing the computational cost of doing so. The resulting State Space
Compression (SSC) framework provides a guide for how to solve for the {optimal}
high-level description of a given dynamical system, rather than constructing it
based on human intuition alone.
  In this preliminary report, we introduce SSC, and illustrate it with several
information-theoretic quantifications of ""accuracy"", all with different
implications for the optimal compression. We also discuss some other possible
applications of SSC beyond the goal of accurate prediction. These include SSC
as a measure of the complexity of a dynamical system, and as a way to quantify
information flow between the scales of a system.
","[{""version"":""v1"",""created"":""Thu, 25 Sep 2014 20:01:47 GMT""},{""version"":""v2"",""created"":""Wed, 3 Jun 2015 19:31:07 GMT""}]","2015-06-19"
"1409.7404","Marc Schartmann","M. Schartmann, K. Wada, M.A. Prieto, A. Burkert and K.R.W. Tristram","Time-resolved infrared emission from radiation-driven central obscuring
  structures in Active Galactic Nuclei","16 pages, 12 figures, accepted for publication in MNRAS",,"10.1093/mnras/stu2020",,"astro-ph.GA","http://arxiv.org/licenses/nonexclusive-distrib/1.0/","  The central engines of Seyfert galaxies are thought to be enshrouded by
geometrically thick gas and dust structures. In this article, we derive
observable properties for a self-consistent model of such toroidal gas and dust
distributions, where the geometrical thickness is achieved and maintained with
the help of X-ray heating and radiation pressure due to the central engine.
Spectral energy distributions (SEDs) and images are obtained with the help of
dust continuum radiative transfer calculations with RADMC-3D. For the first
time, we are able to present time-resolved SEDs and images for a physical model
of the central obscurer. Temporal changes are mostly visible at shorter
wavelengths, close to the combined peak of the dust opacity as well as the
central source spectrum and are caused by variations in the column densities of
the generated outflow. Due to the three-component morphology of the
hydrodynamical models -- a thin disc with high density filaments, a surrounding
fluffy component (the obscurer) and a low density outflow along the rotation
axis -- we find dramatic differences depending on wavelength: whereas the
mid-infrared images are dominated by the elongated appearance of the outflow
cone, the long wavelength emission is mainly given by the cold and dense disc
component. Overall, we find good agreement with observed characteristics,
especially for those models, which show clear outflow cones in combination with
a geometrically thick distribution of gas and dust, as well as a geometrically
thin, but high column density disc in the equatorial plane.
","[{""version"":""v1"",""created"":""Thu, 25 Sep 2014 20:03:27 GMT""}]","2015-06-23"
"1409.7405","Stephan Stieberger","G. Dvali, C. Gomez, R.S. Isermann, D. Lust, and S. Stieberger","Black Hole Formation and Classicalization in Ultra-Planckian 2 -> N
  Scattering","55 pages, 7 figures, LaTeX; v2: typos removed; final version to
  appear in Nucl. Phys. B",,"10.1016/j.nuclphysb.2015.02.004","MPP-2014-320, LMU-ASC 52/14","hep-th gr-qc","http://arxiv.org/licenses/nonexclusive-distrib/1.0/","  We establish a connection between the ultra-Planckian scattering amplitudes
in field and string theory and unitarization by black hole formation in these
scattering processes. Using as a guideline an explicit microscopic theory in
which the black hole represents a bound-state of many soft gravitons at the
quantum critical point, we were able to identify and compute a set of
perturbative amplitudes relevant for black hole formation. These are the
tree-level N-graviton scattering S-matrix elements in a kinematical regime
(called classicalization limit) where the two incoming ultra-Planckian
gravitons produce a large number N of soft gravitons. We compute these
amplitudes by using the Kawai-Lewellen-Tye relations, as well as scattering
equations and string theory techniques. We discover that this limit reveals the
key features of the microscopic corpuscular black hole N-portrait. In
particular, the perturbative suppression factor of a N-graviton final state,
derived from the amplitude, matches the non-perturbative black hole entropy
when N reaches the quantum criticality value, whereas final states with
different value of N are either suppressed or excluded by non-perturbative
corpuscular physics. Thus we identify the microscopic reason behind the black
hole dominance over other final states including non-black hole classical
object. In the parameterization of the classicalization limit the scattering
equations can be solved exactly allowing us to obtain closed expressions for
the high-energy limit of the open and closed superstring tree-level scattering
amplitudes for a generic number N of external legs. We demonstrate matching and
complementarity between the string theory and field theory in different large-s
and large-N regimes.
","[{""version"":""v1"",""created"":""Thu, 25 Sep 2014 20:04:04 GMT""},{""version"":""v2"",""created"":""Sat, 7 Feb 2015 11:17:56 GMT""}]","2015-05-20"
"1409.7406","Eoin \'O Colg\'ain","\""Ozg\""ur Kelekci, Yolanda Lozano, Niall T. Macpherson, Eoin \'O
  Colg\'ain","Supersymmetry and non-Abelian T-duality in type II supergravity","34 pages, v2, wording improved, references updated, v3 references
  added, matches published version; v4 signs in section 6 changed to make
  consistent with earlier sections, erroneous statement about supersymmetry of
  AdS3 S3 S3 S1 non-Abelian T-dual corrected, reference added","Class. Quantum Grav. 32 (2015) 035014","10.1088/0264-9381/32/3/035014","FPAUO-14/07, DMUS-MP-14/12, YITP-SB-1432","hep-th","http://arxiv.org/licenses/nonexclusive-distrib/1.0/","  We study the effect of T-duality on supersymmetry in the context of type II
supergravity. For both U(1) Abelian and SU(2) non-Abelian T-duality, we
demonstrate that the supersymmetry variations after T-duality are related to
the variations before T-duality through the Kosmann spinorial Lie derivative,
which vanishes when the Killing spinors are independent of the T-duality
directions. As a byproduct of our analysis, we present closed expressions for
SU(2) T-duality in a class of spacetimes with diagonal Bianchi IX symmetry and
comment on specific examples of T-dual geometries, including a novel AdS3
geometry with large N = (0,4) superconformal symmetry.
","[{""version"":""v1"",""created"":""Thu, 25 Sep 2014 20:05:56 GMT""},{""version"":""v2"",""created"":""Sun, 5 Oct 2014 13:51:27 GMT""},{""version"":""v3"",""created"":""Mon, 12 Jan 2015 14:17:55 GMT""},{""version"":""v4"",""created"":""Wed, 30 Nov 2016 09:17:07 GMT""}]","2016-12-01"
