"1409.7463","Ruben Buceta","R. C. Buceta and D. Hansmann and B. von Haeften","Revisiting random deposition with surface relaxation: approaches from
  growth rules to Edwards-Wilkinson equation","12 pages, 4 figures","J. Stat. Mech. (2014) P12028","10.1088/1742-5468/2014/12/P12028",,"cond-mat.stat-mech","http://arxiv.org/licenses/nonexclusive-distrib/1.0/","  We present several approaches for deriving the coarse-grained continuous
Langevin equation (or Edwards-Wilkinson equation) from a random deposition with
surface relaxation (RDSR) model. First we introduce a novel procedure to divide
the first transition moment into the three fundamental processes involved:
deposition, diffusion and volume conservation. We show how the diffusion
process is related to antisymmetric contribution and the volume conservation
process is related to symmetric contribution, which renormalizes to zero in the
coarse-grained limit. In another approach, we find the coefficients of the
continuous Langevin equation, by regularizing the discrete Langevin equation.
Finally, in a third approach, we derive these coefficients from the set of test
functions supported by the stationary probability density function (SPDF) of
the discrete model. The applicability of the used approaches to other discrete
random deposition models with instantaneous relaxation to a neighboring site is
discussed.
","[{""version"":""v1"",""created"":""Fri, 26 Sep 2014 02:42:00 GMT""},{""version"":""v2"",""created"":""Tue, 23 Dec 2014 02:10:45 GMT""}]","2014-12-24"
"1409.7464","Hengfei Ding","Hengfei Ding, Changpin Li","High-order Numerical Methods for Riesz Space Fractional Turbulent
  Diffusion Equation",,"Fract. Calc. Appl. Anal., 2016","10.1515/fca-2016-0003",,"math.NA","http://arxiv.org/licenses/nonexclusive-distrib/1.0/","  Numerical methods for fractional calculus attract increasing interests due to
its wide applications in various fields such as physics, mechanics, etc. In
this paper, we focus on constructing high-order algorithms for Riesz
derivatives, where the convergence orders cover from the second order to the
sixth order. Then we apply the established schemes to the Riesz space
fractional turbulent diffusion equation. Numerical experiments are displayed
which support the theoretical analysis.
","[{""version"":""v1"",""created"":""Fri, 26 Sep 2014 02:46:54 GMT""},{""version"":""v2"",""created"":""Thu, 2 Oct 2014 05:41:24 GMT""},{""version"":""v3"",""created"":""Sat, 8 Nov 2014 10:42:40 GMT""}]","2016-11-22"
"1409.7465","Ayaka Sakata","Rafah El-Khatib, Jean Barbier, Ayaka Sakata, and R\""udiger Urbanke","Error correcting codes and spatial coupling","Chapter of ""Statistical Physics, Optimization, Inference, and
  Message-Passing Algorithms"", Eds.: F. Krzakala, F. Ricci-Tersenghi, L.
  Zdeborov\`a, R. Zecchina, E. W. Tramel, L. F. Cugliandolo (Oxford University
  Press, to appear)",,,,"cs.IT cond-mat.dis-nn cond-mat.stat-mech math.IT","http://arxiv.org/licenses/nonexclusive-distrib/1.0/","  These are notes from the lecture of R\""udiger Urbanke given at the autumn
school ""Statistical Physics, Optimization, Inference, and Message-Passing
Algorithms"", that took place in Les Houches, France from Monday September 30th,
2013, till Friday October 11th, 2013. The school was organized by Florent
Krzakala from UPMC and ENS Paris, Federico Ricci-Tersenghi from La Sapienza
Roma, Lenka Zdeborov\`a from CEA Saclay and CNRS, and Riccardo Zecchina from
Politecnico Torino. The first three sections cover the basics of polar codes
and low density parity check codes. In the last three sections, we see how the
spatial coupling helps belief propagation decoding.
","[{""version"":""v1"",""created"":""Fri, 26 Sep 2014 03:13:03 GMT""}]","2014-09-29"
"1409.7466","Christelle Vincent","Christelle Vincent","Weierstrass points on the Drinfeld modular curve $X_0(\mathfrak{p})$","Main theorem has been strengthened. Mistakes in the proof of Theorems
  5.7 and 6.2 have been fixed. A new section on the behavior of W(z) at the
  cusps has been added. Various typos corrected and clarifications made",,,,"math.NT","http://arxiv.org/licenses/nonexclusive-distrib/1.0/","  Consider the Drinfeld modular curve $X_0(\mathfrak{p})$ for $\mathfrak{p}$ a
prime ideal of $\mathbb{F}_q[T]$. It was previously known that if $j$ is the
$j$-invariant of a Weierstrass point of $X_0(\mathfrak{p})$, then the reduction
of $j$ modulo $\mathfrak{p}$ is a supersingular $j$-invariant. In this paper we
show the converse: Every supersingular $j$-invariant is the reduction modulo
$\mathfrak{p}$ of the $j$-invariant of a Weierstrass point of
$X_0(\mathfrak{p})$.
","[{""version"":""v1"",""created"":""Fri, 26 Sep 2014 03:40:00 GMT""},{""version"":""v2"",""created"":""Wed, 15 Apr 2015 21:30:16 GMT""}]","2015-04-17"
"1409.7467","Antony Valentini","Antony Valentini","Trans-Planckian fluctuations and the stability of quantum mechanics","33 pages, 1 figure",,,,"hep-th astro-ph.CO gr-qc quant-ph","http://arxiv.org/licenses/nonexclusive-distrib/1.0/","  We present arguments suggesting that deviations from the Born probability
rule could be generated for trans-Planckian field modes during inflation. Such
deviations are theoretically possible in the de Broglie-Bohm pilot-wave
formulation of quantum mechanics, according to which the Born rule describes a
state of statistical equilibrium. We suggest that a stable equilibrium state
can exist only in restricted conditions: on a classical background spacetime
that is globally hyperbolic or in a mild quantum-gravity regime in which there
is an effective Schr\""odinger equation with a well-defined time parameter.
These arguments suggest that quantum equilibrium will be unstable at the Planck
scale. We construct a model in which quantum nonequilibrium is generated by a
time-dependent regulator for pilot-wave dynamics, where the regulator is
introduced to eliminate phase singularities. Applying our model to
trans-Planckian modes that exit the Planck radius, we calculate the corrected
primordial power spectrum and show that it displays a power excess (above a
critical wavenumber). We briefly consider how our proposals could be tested by
measurements of the cosmic microwave background.
","[{""version"":""v1"",""created"":""Fri, 26 Sep 2014 04:08:32 GMT""}]","2014-09-29"
"1409.7468","Erkan Nane","Jebessa B. Mijena and Erkan Nane","Intermittence and time fractional stochastic partial differential
  equations","20 pages, Submitted for publication. arXiv admin note: text overlap
  with arXiv:1409.7366","Potential Anal. Vol. 44 (2016) 295--312",,,"math.PR math-ph math.AP math.MP","http://arxiv.org/licenses/nonexclusive-distrib/1.0/","  We consider time fractional stochastic heat type equation
$$\partial^\beta_tu(t,x)=-\nu(-\Delta)^{\alpha/2}
u_t(x)+I^{1-\beta}_t[\sigma(u)\stackrel{\cdot}{W}(t,x)]$$ in $(d+1)$
dimensions, where $\nu>0$, $\beta\in (0,1)$, $\alpha\in (0,2]$,
$d<\min\{2,\beta^{-1}\}\a$, $\partial^\beta_t$ is the Caputo fractional
derivative, $-(-\Delta)^{\alpha/2} $ is the generator of an isotropic stable
process, $\stackrel{\cdot}{W}(t,x)$ is space-time white noise, and
$\sigma:\RR{R}\to\RR{R}$ is Lipschitz continuous.
  The time fractional stochastic heat type equations might be used to model
phenomenon with random effects with thermal memory. We prove: (i) absolute
moments of the solutions of this equation grows exponentially; and (ii) the
distances to the origin of the farthest high peaks of those moments grow
exactly linearly with time. These results extend the results of Foondun and
Khoshnevisan \cite{foondun-khoshnevisan-09}
  %(Mohammud Foondun and Davar Khoshnevisan, Intermittence and nonlinear
parabolic %stochastic partial differential equations, Electron. J. Probab. 14
(2009), no. 21, 548--568) and Conus and Khoshnevisan \cite{conus-khoshnevisan}
% (On the existence and position of the farthest peaks of a family of
stochastic %heat and wave equations, Probab. Theory Related Fields 152 (2012),
no. 3-4, 681--701) on the parabolic stochastic heat equations.
","[{""version"":""v1"",""created"":""Fri, 26 Sep 2014 04:36:45 GMT""}]","2016-11-29"
"1409.7469","Atsuko Ichikawa","K.Abe, J.Adam, H.Aihara, T.Akiri, C.Andreopoulos, S.Aoki, A.Ariga,
  S.Assylbekov, D.Autiero, M.Barbi, G.J.Barker, G.Barr, P.Bartet-Friburg,
  M.Bass, M.Batkiewicz, F.Bay, V.Berardi, B.E.Berger, S.Berkman, S.Bhadra,
  F.d.M.Blaszczyk, A.Blondel, C.Bojechko, S.Bordoni, S.B.Boyd, D.Brailsford,
  A.Bravar, C.Bronner, N.Buchanan, R.G.Calland, J.Caravaca Rodr'iguez,
  S.L.Cartwright, R.Castillo, M.G.Catanesi, A.Cervera, D.Cherdack,
  G.Christodoulou, A.Clifton, J.Coleman, S.J.Coleman, G.Collazuol, K.Connolly,
  L.Cremonesi, A.Dabrowska, I.Danko, R.Das, S.Davis, P.de Perio, G.De Rosa,
  T.Dealtry, S.R.Dennis, C.Densham, D.Dewhurst, F.Di Lodovico, S.Di Luise,
  O.Drapier, T.Duboyski, K.Duffy, J.Dumarchez, S.Dytman, M.Dziewiecki,
  S.Emery-Schrenk, A.Ereditato, L.Escudero, T.Feusels, A.J.Finch,
  G.A.Fiorentini, M.Friend, Y.Fujii, Y.Fukuda, A.P.Furmanski, V.Galymov,
  A.Garcia, S.Giffin, C.Giganti, K.Gilje, D.Goeldi, T.Golan, M.Gonin, N.Grant,
  D.Gudin, D.R.Hadley, L.Haegel, A.Haesler, M.D.Haigh, P.Hamilton, D.Hansen,
  T.Hara, M.Hartz, T.Hasegawa, N.C.Hastings, T.Hayashino, Y.Hayato, C.Hearty,
  R.L.Helmer, M.Hierholzer, J.Hignight, A.Hillairet, A.Himmel, T.Hiraki,
  S.Hirota, J.Holeczek, S.Horikawa, K.Huang, A.K.Ichikawa, K.Ieki, M.Ieva,
  M.Ikeda, J.Imber, J.Insler, T.J.Irvine, T.Ishida, T.Ishii, E.Iwai, K.Iwamoto,
  K.Iyogi, A.Izmaylov, A.Jacob, B.Jamieson, R.A.Johnson, S.Johnson, J.H.Jo,
  P.Jonsson, C.K.Jung, M.Kabirnezhad, A.C.Kaboth, T.Kajita, H.Kakuno, J.Kameda,
  Y.Kanazawa, D.Karlen, I.Karpikov, T.Katori, E.Kearns, M.Khabibullin,
  A.Khotjantsev, D.Kielczewska, T.Kikawa, A.Kilinski, J.Kim, S.King, J.Kisiel,
  P.Kitching, T.Kobayashi, L.Koch, T.Koga, A.Kolaceke, A.Konaka, L.L.Kormos,
  A.Korzenev, Y.Koshio, W.Kropp, H.Kubo, Y.Kudenko, R.Kurjata, T.Kutter,
  J.Lagoda, K.Laihem, I.Lamont, E.Larkin, M.Laveder, M.Lawe, M.Lazos,
  T.Lindner, C.Lister, R.P.Litchfield, A.Longhin, J.P.Lopez, L.Ludovici,
  L.Magaletti, K.Mahn, M.Malek, S.Manly, A.D.Marino, J.Marteau, J.F.Martin,
  P.Martins, S.Martynenko, T.Maruyama, V.Matveev, K.Mavrokoridis, E.Mazzucato,
  M.McCarthy, N.McCauley, K.S.McFarland, C.McGrew, A.Mefodiev, C.Metelko,
  M.Mezzetto, P.Mijakowski, C.A.Miller, A.Minamino, O.Mineev, A.Missert,
  M.Miura, S.Moriyama, Th.A.Mueller, A.Murakami, M.Murdoch, S.Murphy, J.Myslik,
  T.Nakadaira, M.Nakahata, K.G.Nakamura, K.Nakamura, S.Nakayama, T.Nakaya,
  K.Nakayoshi, C.Nantais, C.Nielsen, M.Nirkko, K.Nishikawa, Y.Nishimura,
  J.Nowak, H.M.O'Keeffe, R.Ohta, K.Okumura, T.Okusawa, W.Oryszczak, S.M.Oser,
  T.Ovsyannikova, R.A.Owen, Y.Oyama, V.Palladino, J.L.Palomino, V.Paolone,
  D.Payne, O.Perevozchikov, J.D.Perkin, Y.Petrov, L.Pickard, E.S.Pinzon Guerra,
  C.Pistillo, P.Plonski, E.Poplawska, B.Popov, M.Posiadala-Zezula,
  J.-M.Poutissou, R.Poutissou, P.Przewlocki, B.Quilain, E.Radicioni,
  P.N.Ratoff, M.Ravonel, M.A.M.Rayner, A.Redij, M.Reeves, E.Reinherz-Aronis,
  C.Riccio, P.A.Rodrigues, P.Rojas, E.Rondio, S.Roth, A.Rubbia, D.Ruterbories,
  R.Sacco, K.Sakashita, F.S'anchez, F.Sato, E.Scantamburlo, K.Scholberg,
  S.Schoppmann, J.Schwehr, M.Scott, Y.Seiya, T.Sekiguchi, H.Sekiya,
  D.Sgalaberna, R.Shah, F.Shaker, M.Shiozawa, S.Short, Y.Shustrov, P.Sinclair,
  B.Smith, M.Smy, J.T.Sobczyk, H.Sobel, M.Sorel, L.Southwell, P.Stamoulis,
  J.Steinmann, B.Still, Y.Suda, A.Suzuki, K.Suzuki, S.Y.Suzuki, Y.Suzuki,
  R.Tacik, M.Tada, S.Takahashi, A.Takeda, Y.Takeuchi, H.K.Tanaka, H.A.Tanaka,
  M.M.Tanaka, D.Terhorst, R.Terri, L.F.Thompson, A.Thorley, S.Tobayama, W.Toki,
  T.Tomura, Y.Totsuka, C.Touramanis, T.Tsukamoto, M.Tzanov, Y.Uchida,
  A.Vacheret, M.Vagins, G.Vasseur, T.Wachala, A.V.Waldron, K.Wakamatsu,
  C.W.Walter, D.Wark, W.Warzycha, M.O.Wascko, A.Weber, R.Wendell, R.J.Wilkes,
  M.J.Wilking, C.Wilkinson, Z.Williamson, J.R.Wilson, R.J.Wilson, T.Wongjirad,
  Y.Yamada, K.Yamamoto, C.Yanagisawa, T.Yano, S.Yen, N.Yershov, M.Yokoyama,
  K.Yoshida, T.Yuan, M.Yu, A.Zalewska, J.Zalipska, L.Zambelli, K.Zaremba,
  M.Ziembicki, E.D.Zimmerman, M.Zito, J.Zmuda","Neutrino Oscillation Physics Potential of the T2K Experiment","40 pages, 27 figures, accepted by PTEP",,"10.1093/ptep/ptv031",,"hep-ex","http://arxiv.org/licenses/nonexclusive-distrib/1.0/","  The observation of the recent electron neutrino appearance in a muon neutrino
beam and the high-precision measurement of the mixing angle $\theta_{13}$ have
led to a re-evaluation of the physics potential of the T2K long-baseline
neutrino oscillation experiment. Sensitivities are explored for CP violation in
neutrinos, non-maximal $\sin^22\theta_{23}$, the octant of $\theta_{23}$, and
the mass hierarchy, in addition to the measurements of $\delta_{CP}$,
$\sin^2\theta_{23}$, and $\Delta m^2_{32}$, for various combinations of
$\nu$-mode and \(\bar{\nu}\)-mode data-taking.
  With an exposure of $7.8\times10^{21}$~protons-on-target, T2K can achieve
1-$\sigma$ resolution of 0.050(0.054) on $\sin^2\theta_{23}$ and
$0.040(0.045)\times10^{-3}~\rm{eV}^2$ on $\Delta m^2_{32}$ for 100\%(50\%)
neutrino beam mode running assuming $\sin^2\theta_{23}=0.5$ and $\Delta
m^2_{32} = 2.4\times10^{-3}$ eV$^2$. T2K will have sensitivity to the
CP-violating phase $\delta_{\rm{CP}}$ at 90\% C.L. or better over a significant
range. For example, if $\sin^22\theta_{23}$ is maximal (i.e
$\theta_{23}$=$45^\circ$) the range is $-115^\circ<\delta_{\rm{CP}}<-60^\circ$
for normal hierarchy and $+50^\circ<\delta_{\rm{CP}}<+130^\circ$ for inverted
hierarchy. When T2K data is combined with data from the NO$\nu$A experiment,
the region of oscillation parameter space where there is sensitivity to observe
a non-zero $\delta_{CP}$ is substantially increased compared to if each
experiment is analyzed alone.
","[{""version"":""v1"",""created"":""Fri, 26 Sep 2014 05:04:50 GMT""},{""version"":""v2"",""created"":""Tue, 10 Feb 2015 09:58:25 GMT""}]","2015-04-01"
"1409.7470","Hua-Zhong Ke","Hua-Zhong Ke","On a conjectural solution to open KdV and Virasoro","6 pages. Comments are welcome!",,,,"math-ph math.AG math.MP math.SG","http://arxiv.org/licenses/nonexclusive-distrib/1.0/","  In this note, we present a recursive formula for the full partition function
Z of descendent integrals over moduli spaces of open and closed Riemann
surfaces, assuming the conjecture recently proposed by Pandharipande, Solomon
and Tessler that Z satisfies the open KdV and Virasoro equations.
","[{""version"":""v1"",""created"":""Fri, 26 Sep 2014 05:19:34 GMT""}]","2014-09-29"
"1409.7471","Hassan Safouhi","Philippe Gaudreau, Richard Slevinsky and Hassan Safouhi","The Double Exponential Sinc Collocation Method for Singular
  Sturm-Liouville Problems","21 pages, 3 figures",,,,"math.NA","http://arxiv.org/licenses/nonexclusive-distrib/1.0/","  Sturm-Liouville problems are abundant in the numerical treatment of
scientific and engineering problems. In the present contribution, we present an
efficient and highly accurate method for computing eigenvalues of singular
Sturm-Liouville boundary value problems. The proposed method uses the double
exponential formula coupled with Sinc collocation method. This method produces
a symmetric positive-definite generalized eigenvalue system and has exponential
convergence rate. Numerical examples are presented and comparisons with single
exponential Sinc collocation method clearly illustrate the advantage of using
the double exponential formula.
","[{""version"":""v1"",""created"":""Fri, 26 Sep 2014 05:46:41 GMT""},{""version"":""v2"",""created"":""Mon, 29 Sep 2014 03:25:54 GMT""},{""version"":""v3"",""created"":""Tue, 7 Jul 2015 13:44:06 GMT""}]","2015-07-08"
"1409.7472","Jiannan Wang","Jiannan Wang, Guoliang Li, Tim Kraska, Michael J. Franklin, Jianhua
  Feng","The Expected Optimal Labeling Order Problem for Crowdsourced Joins and
  Entity Resolution","This is a note for explaining an incorrect claim in our SIGMOD 2013
  paper",,,,"cs.DB","http://arxiv.org/licenses/nonexclusive-distrib/1.0/","  In the SIGMOD 2013 conference, we published a paper extending our earlier
work on crowdsourced entity resolution to improve crowdsourced join processing
by exploiting transitive relationships [Wang et al. 2013]. The VLDB 2014
conference has a paper that follows up on our previous work [Vesdapunt et al.,
2014], which points out and corrects a mistake we made in our SIGMOD paper.
Specifically, in Section 4.2 of our SIGMOD paper, we defined the ""Expected
Optimal Labeling Order"" (EOLO) problem, and proposed an algorithm for solving
it. We incorrectly claimed that our algorithm is optimal. In their paper,
Vesdapunt et al. show that the problem is actually NP-Hard, and based on that
observation, propose a new algorithm to solve it. In this note, we would like
to put the Vesdapunt et al. results in context, something we believe that their
paper does not adequately do.
","[{""version"":""v1"",""created"":""Fri, 26 Sep 2014 06:01:00 GMT""}]","2014-09-29"
"1409.7473","Hendra Nurdin","Hendra I. Nurdin and John E. Gough","Modular Quantum Memories Using Passive Linear Optics and Coherent
  Feedback","24 pages, 8 figures. Submitted. Comments welcome","Quantum Inf. Comput. 15, pp 1017-1040 (2015)",,,"quant-ph cs.SY","http://arxiv.org/licenses/nonexclusive-distrib/1.0/","  In this paper, we show that quantum memory for qudit states encoded in a
single photon pulsed optical field has a conceptually simple modular
realization using only passive linear optics and coherent feedback. We exploit
the idea that two decaying optical cavities can be coupled in a coherent
feedback configuration to create an internal mode of the coupled system which
is isolated and decoherence-free for the purpose of qubit storage. The qubit
memory can then be switched between writing/read-out mode and storage mode
simply by varying the routing of certain freely propagating optical fields in
the network. It is then shown that the qubit memories can be interconnected
with one another to form a qudit quantum memory. We explain each of the phase
of writing, storage, and read-out for this modular quantum memory scheme. The
results point a way towards modular architectures for complex compound quantum
memories.
","[{""version"":""v1"",""created"":""Fri, 26 Sep 2014 06:02:00 GMT""}]","2015-08-03"
"1409.7474","Zhongbin Li","Zhongbin Li, Wenzhong Shi, Qunming Wang, and Zelang Miao","Extracting man-made objects from remote sensing images via fast level
  set evolutions","This paper includes 31 pages and 12 figures","IEEE Transactions on Geoscience and Remote Sensing, Vol.53(2),
  pp.883-899, 2015","10.1109/TGRS.2015.2454251",,"cs.CV","http://arxiv.org/licenses/nonexclusive-distrib/1.0/","  Object extraction from remote sensing images has long been an intensive
research topic in the field of surveying and mapping. Most existing methods are
devoted to handling just one type of object and little attention has been paid
to improving the computational efficiency. In recent years, level set evolution
(LSE) has been shown to be very promising for object extraction in the
community of image processing and computer vision because it can handle
topological changes automatically while achieving high accuracy. However, the
application of state-of-the-art LSEs is compromised by laborious parameter
tuning and expensive computation. In this paper, we proposed two fast LSEs for
man-made object extraction from high spatial resolution remote sensing images.
The traditional mean curvature-based regularization term is replaced by a
Gaussian kernel and it is mathematically sound to do that. Thus a larger time
step can be used in the numerical scheme to expedite the proposed LSEs. In
contrast to existing methods, the proposed LSEs are significantly faster. Most
importantly, they involve much fewer parameters while achieving better
performance. The advantages of the proposed LSEs over other state-of-the-art
approaches have been verified by a range of experiments.
","[{""version"":""v1"",""created"":""Fri, 26 Sep 2014 06:17:23 GMT""}]","2015-10-28"
"1409.7475","Carlos Gershenson","Carlos Gershenson","Requisite Variety, Autopoiesis, and Self-organization","Invited keynote at WOSC 2014","Kybernetes, 44(6-7):866-873. 2015",,,"nlin.AO cs.OH","http://arxiv.org/licenses/nonexclusive-distrib/1.0/","  Ashby's law of requisite variety states that a controller must have at least
as much variety (complexity) as the controlled. Maturana and Varela proposed
autopoiesis (self-production) to define living systems. Living systems also
require to fulfill the law of requisite variety. A measure of autopoiesis has
been proposed as the ratio between the complexity of a system and the
complexity of its environment. Self-organization can be used as a concept to
guide the design of systems towards higher values of autopoiesis, with the
potential of making technology more ""living"", i.e. adaptive and robust.
","[{""version"":""v1"",""created"":""Fri, 26 Sep 2014 06:19:46 GMT""},{""version"":""v2"",""created"":""Thu, 6 Nov 2014 00:29:07 GMT""}]","2016-04-01"
"1409.7476","Michel Fliess","C\'edric Join (INRIA Lille - Nord Europe, CRAN, AL.I.E.N.), Cyril
  Voyant (SPE), Michel Fliess (AL.I.E.N., LIX), Marc Muselli (SPE), Marie Laure
  Nivet (SPE), Christophe Paoli, Fr\'ed\'eric Chaxel (CRAN)","Short-term solar irradiance and irradiation forecasts via different time
  series techniques: A preliminary study",,"3rd International Symposium on Environment-Friendly Energies and
  Applications (EFEA 2014), Pars : France (2014)",,,"cs.LG physics.ao-ph","http://arxiv.org/licenses/nonexclusive-distrib/1.0/","  This communication is devoted to solar irradiance and irradiation short-term
forecasts, which are useful for electricity production. Several different time
series approaches are employed. Our results and the corresponding numerical
simulations show that techniques which do not need a large amount of historical
data behave better than those which need them, especially when those data are
quite noisy.
","[{""version"":""v1"",""created"":""Fri, 26 Sep 2014 06:27:30 GMT""}]","2014-09-29"
"1409.7477","Tristan Guillot","Tristan Guillot (LAGRANGE), Douglas N. C. Lin, Pierre Morel
  (LAGRANGE), Mathieu Havel (LAGRANGE), Vivien Parmentier (LAGRANGE)","Evolution of Exoplanets and their Parent Stars","appears in The age of stars - 23rd Evry Schatzman School on Stellar
  Astrophysics, Roscoff : France (2013)",,"10.1051/eas/1465009",,"astro-ph.SR astro-ph.EP","http://arxiv.org/licenses/nonexclusive-distrib/1.0/","  Studying exoplanets with their parent stars is crucial to understand their
population, formation and history. We review some of the key questions
regarding their evolution with particular emphasis on giant gaseous exoplanets
orbiting close to solar-type stars. For masses above that of Saturn, transiting
exoplanets have large radii indicative of the presence of a massive
hydrogen-helium envelope. Theoretical models show that this envelope
progressively cools and contracts with a rate of energy loss inversely
proportional to the planetary age. The combined measurement of planetary mass,
radius and a constraint on the (stellar) age enables a global determination of
the amount of heavy elements present in the planet interior. The comparison
with stellar metallicity shows a correlation between the two, indicating that
accretion played a crucial role in the formation of planets. The dynamical
evolution of exoplanets also depends on the properties of the central star. We
show that the lack of massive giant planets and brown dwarfs in close orbit
around G-dwarfs and their presence around F-dwarfs are probably tied to the
different properties of dissipation in the stellar interiors. Both the
evolution and the composition of stars and planets are intimately linked.
","[{""version"":""v1"",""created"":""Fri, 26 Sep 2014 06:28:27 GMT""}]","2015-06-23"
"1409.7478","Sebastien Verel","Hernan Aguirre, Arnaud Liefooghe (INRIA Lille - Nord Europe, LIFL),
  S\'ebastien Verel (LISIC), Kiyoshi Tanaka","An Analysis on Selection for High-Resolution Approximations in
  Many-Objective Optimization","apperas in Parallel Problem Solving from Nature - PPSN XIII,
  Ljubljana : Slovenia (2014)",,,,"cs.NE","http://arxiv.org/licenses/nonexclusive-distrib/1.0/","  This work studies the behavior of three elitist multi- and many-objective
evolutionary algorithms generating a high-resolution approximation of the
Pareto optimal set. Several search-assessment indicators are defined to trace
the dynamics of survival selection and measure the ability to simultaneously
keep optimal solutions and discover new ones under different population sizes,
set as a fraction of the size of the Pareto optimal set.
","[{""version"":""v1"",""created"":""Fri, 26 Sep 2014 06:32:52 GMT""}]","2014-09-29"
"1409.7479","Tanvi Jain","Rajendra Bhatia and Tanvi Jain","On some positive definite functions","9 pages",,,,"math.FA","http://arxiv.org/licenses/nonexclusive-distrib/1.0/","  We study the function $(1 - \|x\|)\slash (1 - \|x\|^r),$ and its reciprocal,
on the Euclidean space $\mathbb{R}^n,$ with respect to properties like being
positive definite, conditionally positive definite, and infinitely divisible.
","[{""version"":""v1"",""created"":""Fri, 26 Sep 2014 06:45:53 GMT""}]","2014-09-29"
