"1409.7540","Christina Roschat","Christina Roschat and Thomas Slawig","Nontrivial Periodic Solutions of Marine Ecosystem Models of N-DOP type",,,,,"math.AP","http://arxiv.org/licenses/nonexclusive-distrib/1.0/","  We investigate marine ecosystem models of N-DOP type with regard to
nontrivial periodic solutions. The elements of this important, widely-used
model class typically consist of two coupled advection-diffusion-reaction
equations. The corresponding reaction terms are divided into a linear part,
describing the transformation of one model variable into the other, and a
bounded nonlinear part. Additionally, the model equations conserve the mass
contained in the system, i.e. the masses of both variables add up to a constant
total mass. In particular, the trivial function is a periodic solution. In this
paper, we prove that there is at least one periodic solution for every
prescribed total mass. The proof makes use of the typical properties of N-DOP
type models by combining results from monotone operator theory and a fixed
point argument. In the end, we apply the theorem to the PO4-DOP model, an N-DOP
type model which is well-known and often used.
","[{""version"":""v1"",""created"":""Fri, 26 Sep 2014 11:34:33 GMT""}]","2014-09-29"
"1409.7541","Parongama Sen","Parongama Sen and Purusattam Ray","$A+A \rightarrow \emptyset $ model with a bias towards nearest neighbor","Fig 1 replaced with correct label, typos in published version
  corrected","Physical Review E 92 012109 (2015)","10.1103/PhysRevE.92.012109",,"cond-mat.stat-mech","http://creativecommons.org/licenses/by/4.0/","  We have studied $A+A \rightarrow \emptyset$ reaction-diffusion model on a
ring, with a bias $\epsilon$ $(0 \leq \epsilon \leq 0.5)$ of the random walkers
$A$ to hop towards their nearest neighbor. Though the bias is local in space
and time, we show that it alters the universality class of the problem. The $z$
exponent, which describes the growth of average spacings between the walkers
with time, changes from the value 2 at $\epsilon=0$ to the mean-field value of
unity for any non-zero $\epsilon$. We study the problem analytically using
independent interval approximation and compare the scaling results with that
obtained from simulation. The distribution $P(k,t)$ of the spacing $k$ between
two walkers (per site) is given by $t^{-2/z} f(k/t^{1/z})$ as expected;
however, the scaling function shows different behaviour in the two approaches.
","[{""version"":""v1"",""created"":""Fri, 26 Sep 2014 11:37:03 GMT""},{""version"":""v2"",""created"":""Tue, 21 Jul 2015 05:27:58 GMT""},{""version"":""v3"",""created"":""Tue, 6 Oct 2015 09:02:01 GMT""},{""version"":""v4"",""created"":""Mon, 14 Mar 2022 11:30:42 GMT""}]","2022-03-15"
"1409.7542","Pierre Clairambault","Simon Castellan (LIP), Pierre Clairambault (LIP, PLUME), Glynn Winskel","Thin Games with Symmetry and Concurrent Hyland-Ong Games",,"Logical Methods in Computer Science, Volume 15, Issue 1 (March 4,
  2019) lmcs:5248","10.23638/LMCS-15(1:18)2019",,"cs.LO math.LO","http://arxiv.org/licenses/nonexclusive-distrib/1.0/","  We build a cartesian closed category, called Cho, based on event structures.
It allows an interpretation of higher-order stateful concurrent programs that
is refined and precise: on the one hand it is conservative with respect to
standard Hyland-Ong games when interpreting purely functional programs as
innocent strategies, while on the other hand it is much more expressive. The
interpretation of programs constructs compositionally a representation of their
execution that exhibits causal dependencies and remembers the points of
non-deterministic branching.The construction is in two stages. First, we build
a compact closed category Tcg. It is a variant of Rideau and Winskel's category
CG, with the difference that games and strategies in Tcg are equipped with
symmetry to express that certain events are essentially the same. This is
analogous to the underlying category of AJM games enriching simple games with
an equivalence relations on plays. Building on this category, we construct the
cartesian closed category Cho as having as objects the standard arenas of
Hyland-Ong games, with strategies, represented by certain events structures,
playing on games with symmetry obtained as expanded forms of these arenas.To
illustrate and give an operational light on these constructions, we interpret
(a close variant of) Idealized Parallel Algol in Cho.
","[{""version"":""v1"",""created"":""Fri, 26 Sep 2014 11:39:59 GMT""},{""version"":""v2"",""created"":""Fri, 6 Jan 2017 15:32:10 GMT""},{""version"":""v3"",""created"":""Wed, 30 Aug 2017 09:05:16 GMT""},{""version"":""v4"",""created"":""Thu, 20 Dec 2018 09:48:49 GMT""},{""version"":""v5"",""created"":""Fri, 1 Mar 2019 15:33:48 GMT""}]","2019-04-29"
"1409.7543","Maciej Bochenski","Maciej Bochenski, Anna Szczepkowska, Aleksy Tralle, Artur Woike","On symplectically fat twistor bundles","Corrected version. To prove the main result, we use the expression of
  fatness condition in terms of the isotropy representation related to the
  G-structure over some homogeneous spaces derived in our paper
  arxiv:1503.02511","Annals of Global Analysis and Geometry: Volume 48, Issue 2 (2015),
  Page 181-194","10.1007/s10455-015-9464-2",,"math-ph math.MP","http://arxiv.org/licenses/nonexclusive-distrib/1.0/","  This paper deals with the question when are twistor bundles over homogeneous
spaces symplectically fat? It shows that twistor bundles over even dimensional
Grassmannians of maximal rank have this property.
","[{""version"":""v1"",""created"":""Fri, 26 Sep 2014 11:40:55 GMT""},{""version"":""v2"",""created"":""Tue, 10 Mar 2015 14:45:58 GMT""}]","2015-08-11"
"1409.7544","Couvreur Alain","Alain Couvreur","An upper bound on the number of rational points of arbitrary projective
  varieties over finite fields",,,,,"math.AG math.CO math.NT","http://arxiv.org/licenses/nonexclusive-distrib/1.0/","  We give an upper bound on the number of rational points of an arbitrary
Zariski closed subset of a projective space over a finite field. This bound
depends only on the dimensions and degrees of the irreducible components and
holds for very general varieties, even reducible and non equidimensional. As a
consequence, we prove a conjecture of Ghorpade and Lachaud on the maximal
number of rational points of an equidimensional projective variety.
","[{""version"":""v1"",""created"":""Fri, 26 Sep 2014 11:43:28 GMT""},{""version"":""v2"",""created"":""Tue, 27 Oct 2015 16:06:27 GMT""},{""version"":""v3"",""created"":""Mon, 2 Nov 2015 13:56:47 GMT""}]","2015-11-03"
"1409.7545","Razieh Morad","R. Morad and W. A. Horowitz","Strong-coupling Jet Energy Loss from AdS/CFT","28 pages, 9 figures",,"10.1007/JHEP11(2014)017",,"hep-th hep-ph nucl-th","http://arxiv.org/licenses/nonexclusive-distrib/1.0/","  We propose a novel definition of a holographic light hadron jet and consider
the phenomenological consequences, including the very first fully
self-consistent, completely strong-coupling calculation of the jet nuclear
modification factor $R_{AA}$, which we find compares surprisingly well with
recent preliminary data from LHC. We show that the thermalization distance for
light parton jets is an extremely sensitive function of the \emph{a priori}
unspecified string initial conditions and that worldsheets corresponding to
non-asymptotic energy jets are not well approximated by a collection of null
geodesics. Our new string jet prescription, which is defined by a separation of
scales from plasma to jet, leads to the re-emergence of the late-time Bragg
peak in the instantaneous jet energy loss rate; unlike heavy quarks, the energy
loss rate is unusually sensitive to the very definition of the string theory
object itself. A straightforward application of the new jet definition leads to
significant jet quenching, even in the absence of plasma. By renormalizing the
in-medium suppression by that in the vacuum we find qualitative agreement with
preliminary CMS $R_{AA}^{jet}(p_T)$ data in our simple plasma brick model. We
close with comments on our results and an outlook on future work.
","[{""version"":""v1"",""created"":""Fri, 26 Sep 2014 11:50:03 GMT""}]","2014-11-17"
"1409.7546","Dariush Akbarian","Dariush Akbarian","On Characterizing weak defining hyperplanes (weak Facets) in DEA with
  Constant Returns to Scale Technology","38 pages; 5 figures","Journal of Data Envelopment Analysis and Decision Scienc 2017","10.5899/2017/dea-00145",,"math.OC","http://arxiv.org/licenses/nonexclusive-distrib/1.0/","  The Production Possibility Set (PPS) is defined as a set of inputs and
outputs of a system in which inputs can produce outputs. The Production
Possibility Set of the Data Envelopment Analysis (DEA) model is contain of two
types defining hyperplanes (facets); strong and weak efficient facets. In this
paper, the problem of finding weak defining hyperplanes of the PPS of the
CCR-technology is dealt with. We state and prove some properties relative to
our method. To illustrate the applicability of the proposed model, some
numerical examples are finally provided. Our algorithm can easily be
implemented using existing packages for operation research, such as GAMS.
","[{""version"":""v1"",""created"":""Fri, 26 Sep 2014 11:50:35 GMT""}]","2021-09-21"
"1409.7547","Dariush Akbarian","Dariush Akbarian","A new DEA ranking system based on interval Cross Efficiency and interval
  Analytic Hierarchy Process methods","This paper has been withdrawn by the author due to a crucial sign
  error in equation 8","International Journal of Management and Decision Making 2020","10.1504/IJMDM.2020.108641",,"math.OC","http://arxiv.org/licenses/nonexclusive-distrib/1.0/","  The aim of this paper is to present a novel approach for ranking of all DMUs
using the interval Cross-Efficiency (ICE) and interval Analytic Hierarchy
Process (IAHP) methods. The approach includes two basic stages. In the first
stage using DEA models the interval cross-efficiency values of each DMU are
specified. In the second stage, the interval pairwise comparison matrix
generated in the first stage is utilized to rank the units (DMUs) via the one
step process of interval AHP (i.e. the AHP model with interval decision maker
judgements). The numerical example is presented in this paper and we compare
our approach with some other approaches.
","[{""version"":""v1"",""created"":""Fri, 26 Sep 2014 12:01:03 GMT""},{""version"":""v2"",""created"":""Tue, 18 Nov 2014 18:56:07 GMT""}]","2021-09-21"
"1409.7548","Walid Hachem","Walid Hachem, Adrien Hardy, Jamal Najim","Large complex correlated Wishart matrices: Fluctuations and asymptotic
  independence at the edges","Published at http://dx.doi.org/10.1214/15-AOP1022 in the Annals of
  Probability (http://www.imstat.org/aop/) by the Institute of Mathematical
  Statistics (http://www.imstat.org)","Annals of Probability 2016, Vol. 44, No. 3, 2264-2348","10.1214/15-AOP1022","IMS-AOP-AOP1022","math.PR math.ST stat.TH","http://arxiv.org/licenses/nonexclusive-distrib/1.0/","  We study the asymptotic behavior of eigenvalues of large complex correlated
Wishart matrices at the edges of the limiting spectrum. In this setting, the
support of the limiting eigenvalue distribution may have several connected
components. Under mild conditions for the population matrices, we show that for
every generic positive edge of that support, there exists an extremal
eigenvalue which converges almost surely toward that edge and fluctuates
according to the Tracy-Widom law at the scale $N^{2/3}$. Moreover, given
several generic positive edges, we establish that the associated extremal
eigenvalue fluctuations are asymptotically independent. Finally, when the
leftmost edge is the origin (hard edge), the fluctuations of the smallest
eigenvalue are described by mean of the Bessel kernel at the scale $N^2$.
","[{""version"":""v1"",""created"":""Fri, 26 Sep 2014 12:01:42 GMT""},{""version"":""v2"",""created"":""Mon, 6 Jun 2016 05:57:22 GMT""}]","2016-06-07"
"1409.7549","Fernando Falceto","J.F. Cari\~nena, F. Falceto, J. Grabowski, M.F. Ra\~nada","Geometry of Lie integrability by quadratures","18 pages","Journal of Physics A. Mathematical and Theoretical 48(21), 2014","10.1088/1751-8113/48/21/215206",,"math-ph math.CA math.MP nlin.SI","http://arxiv.org/licenses/nonexclusive-distrib/1.0/","  In this paper we extend the Lie theory of integration in two different ways.
First we consider a finite dimensional Lie algebra of vector fields and discuss
the most general conditions under which the integral curves of one of the
fields can be obtained by quadratures in a prescribed way. It turns out that
the conditions can be expressed in a purely algebraic way. In a second step we
generalize the construction to the case in which we substitute the Lie algebra
of vector fields by a module (generalized distribution). We obtain much larger
class of integrable systems replacing standard concepts of solvable (or
nilpotent) Lie algebra with distributional solvability (nilpotency).
","[{""version"":""v1"",""created"":""Fri, 26 Sep 2014 12:11:02 GMT""}]","2019-07-18"
"1409.7550","Mar\'ia Florencia Muratore","M. F. Muratore, M. Kraus, M. E. Oksala, M. L. Arias, L. Cidale, M.
  Borges Fernandes, A. Liermann","Evidence of the Evolved Nature of the B[e] Star MWC 137","17 pages, 5 figures; accepted for publication in AJ",,"10.1088/0004-6256/149/1/13",,"astro-ph.SR","http://arxiv.org/licenses/nonexclusive-distrib/1.0/","  The evolutionary phase of B[e] stars is difficult to establish due to the
uncertainties in their fundamental parameters. For instance, possible
classifications for the Galactic B[e] star MWC 137 include pre-main-sequence
and post-main-sequence phases, with a large range in luminosity. Our goal is to
clarify the evolutionary stage of this peculiar object, and to study the CO
molecular component of its circumstellar medium. To this purpose, we modeled
the CO molecular bands using high-resolution K-band spectra. We find that MWC
137 is surrounded by a detached cool (T = 1900 +-100 K) and dense (N = (3 +- 1)
x 10^21 cm^(-2)) ring of CO gas orbiting the star with a rotational velocity,
projected to the line of sight, of 84 +- 2 km/s. We also find that the
molecular gas is enriched in the isotope 13C, excluding the classification of
the star as a Herbig Be. The observed isotopic abundance ratio (12C / 13C = 25
+- 2) derived from our modeling is compatible with a proto-PN, main-sequence or
supergiant evolutionary phase. However, based on some observable
characteristics of MWC 137, we propose that the supergiant scenario seems to be
the most plausible. Hence, we suggest that MWC 137 could be in an extremely
short-lived phase, evolving from a B[e] supergiant to a blue supergiant with a
bipolar ring nebula.
","[{""version"":""v1"",""created"":""Fri, 26 Sep 2014 12:11:08 GMT""}]","2015-06-23"
"1409.7551","Krishna Chaitanya A","Krishna Chaitanya A, Utpal Mukherji, Vinod Sharma","Algorithms for Stochastic Games on Interference Channels",,,,,"cs.IT cs.GT math.IT","http://arxiv.org/licenses/nonexclusive-distrib/1.0/","  We consider a wireless channel shared by multiple transmitter-receiver pairs.
Their transmissions interfere with each other. Each transmitter-receiver pair
aims to maximize its long-term average transmission rate subject to an average
power constraint. This scenario is modeled as a stochastic game. We provide
sufficient conditions for existence and uniqueness of a Nash equilibrium (NE).
We then formulate the problem of finding NE as a variational inequality (VI)
problem and present an algorithm to solve the VI using regularization. We also
provide distributed algorithms to compute Pareto optimal solutions for the
proposed game.
","[{""version"":""v1"",""created"":""Fri, 26 Sep 2014 12:16:59 GMT""}]","2014-09-29"
"1409.7552","Johannes Kulick","Johannes Kulick, Robert Lieck and Marc Toussaint","The Advantage of Cross Entropy over Entropy in Iterative Information
  Gathering","24 pages",,,,"stat.ML cs.LG","http://arxiv.org/licenses/nonexclusive-distrib/1.0/","  Gathering the most information by picking the least amount of data is a
common task in experimental design or when exploring an unknown environment in
reinforcement learning and robotics. A widely used measure for quantifying the
information contained in some distribution of interest is its entropy. Greedily
minimizing the expected entropy is therefore a standard method for choosing
samples in order to gain strong beliefs about the underlying random variables.
We show that this approach is prone to temporally getting stuck in local optima
corresponding to wrongly biased beliefs. We suggest instead maximizing the
expected cross entropy between old and new belief, which aims at challenging
refutable beliefs and thereby avoids these local optima. We show that both
criteria are closely related and that their difference can be traced back to
the asymmetry of the Kullback-Leibler divergence. In illustrative examples as
well as simulated and real-world experiments we demonstrate the advantage of
cross entropy over simple entropy for practical applications.
","[{""version"":""v1"",""created"":""Fri, 26 Sep 2014 12:25:33 GMT""},{""version"":""v2"",""created"":""Wed, 16 Sep 2015 10:03:11 GMT""}]","2015-09-17"
"1409.7553","Kjartan Thor Wikfeldt","Andreas Pedersen, Kjartan T. Wikfeldt, Leendertjan Karssemeijer, Herma
  Cuppen and Hannes J\'onsson","Molecular reordering processes on ice (0001) surfaces from long
  timescale simulations","27 pages, 7 figures",,"10.1063/1.4903812",,"physics.chem-ph","http://arxiv.org/licenses/nonexclusive-distrib/1.0/","  We report results of long timescale adaptive kinetic Monte Carlo simulations
aimed at identifying possible molecular reordering processes on both
proton-disordered and ordered (Fletcher) basal plane (0001) surfaces of
hexagonal ice. The simulations are based on a force field for flexible
molecules and span a time interval of up to 50 {\mu}s at a temperature of 100
K, which represents a lower bound to the temperature range of Earth's
atmosphere. Additional calculations using both density functional theory and an
ab initio based polarizable potential function are performed to test and refine
the force field predictions. Several distinct processes are found to occur
readily even at this low temperature, including concerted reorientation
(flipping) of neighboring surface molecules, which changes the pattern of
dangling H-atoms, and the formation of interstitial defects by the downwards
motion of upper-bilayer molecules. On the proton-disordered surface, one major
surface roughening process is observed that significantly disrupts the
crystalline structure. Despite much longer simulation time, such roughening
processes are not observed on the highly ordered Fletcher surface which is
energetically more stable because of smaller repulsive interaction between
neighboring dangling H-atoms. However, a more localized process takes place on
the Fletcher surface involving a surface molecule transiently leaving its
lattice site. The flipping process provides a facile pathway of increasing
proton-order and stabilizing the surface, supporting a predominantly
Fletcher-like ordering of low-temperature ice surfaces, but our simulations
also show that proton- disordered patches on the surface may induce significant
local reconstructions. Further, a subset of the molecules on the Fletcher
surface are susceptible to forming interstitial defects.
","[{""version"":""v1"",""created"":""Fri, 26 Sep 2014 12:26:05 GMT""},{""version"":""v2"",""created"":""Fri, 28 Nov 2014 09:29:34 GMT""}]","2015-06-23"
"1409.7554","Rupert Wei Tze Yu","Michel Duflo and Rupert W.T. Yu","On compositions associated to Frobenius parabolic and seaweed
  subalgebras of $\mathrm{sl}_{n}(\Bbbk )$",,,,,"math.RT","http://arxiv.org/licenses/nonexclusive-distrib/1.0/","  By using a free monoid of operators on the set of compositions (resp. pairs
of compositions), we establish in this paper a bijective correspondence between
Frobenius standard parabolic (resp. seaweed) subalgebras and certain elements
of this monoid. We prove via this correspondence a conjecture of one of the
authors on the number of Frobenius standard parabolic (resp. seaweed)
subalgebras of $\mathrm{sl}_{n}(\Bbbk )$ associated to compositions (resp.
pairs of compositions) with $n-t$ parts (resp. parts in total).
","[{""version"":""v1"",""created"":""Fri, 26 Sep 2014 12:28:06 GMT""}]","2014-09-29"
"1409.7555","Ionel-Dumitrel Ghiba","Patrizio Neff and Ionel-Dumitrel Ghiba","The exponentiated Hencky-logarithmic strain energy. Part III: Coupling
  with idealized isotropic finite strain plasticity",,,"10.1007/s00161-015-0449-y",,"math-ph math.CA math.MP","http://arxiv.org/licenses/nonexclusive-distrib/1.0/","  We investigate an immediate application in finite strain multiplicative
plasticity of the family of isotropic volumetric-isochoric decoupled strain
energies \begin{align*} F\mapsto W_{_{\rm eH}}(F):=\hat{W}_{_{\rm
eH}}(U):=\{\begin{array}{lll} \frac{\mu}{k}\,e^{k\,\|{\rm dev}_n\log
{U}\|^2}+\frac{\kappa}{{\text{}}{2\, {\hat{k}}}}\,e^{\hat{k}\,[{\rm tr}(\log
U)]^2}&\text{if}& {\rm det}\, F>0,\\ +\infty &\text{if} &{\rm det} F\leq 0,
\end{array}.\quad \end{align*} based on the Hencky-logarithmic (true, natural)
strain tensor $\log U$. Here, $\mu>0$ is the infinitesimal shear modulus,
$\kappa=\frac{2\mu+3\lambda}{3}>0$ is the infinitesimal bulk modulus with
$\lambda$ the first Lam\'{e} constant, $k,\hat{k}$ are dimensionless fitting
parameters, $F=\nabla \varphi$ is the gradient of deformation, $U=\sqrt{F^T F}$
is the right stretch tensor and ${\rm dev}_n\log {U} =\log {U}-\frac{1}{n}\,
{\rm tr}(\log {U})\cdot 1\!\!1$ is the deviatoric part of the strain tensor
$\log U$. Based on the multiplicative decomposition $F=F_e\, F_p$, we couple
these energies with some isotropic elasto-plastic flow rules $F_p\,\frac{\rm
d}{{\rm d} t}[F_p^{-1}]\in-\partial \chi({\rm dev}_3 \Sigma_{e})$ defined in
the plastic distortion $F_p$, where $\partial \chi$ is the subdifferential of
the indicator function $\chi$ of the convex elastic domain $\mathcal{E}_{\rm
e}(W_{\rm iso},{\Sigma_{e}},\frac{1}{3}{\boldsymbol{\sigma}}_{\!\mathbf{y}}^2)$
in the mixed-variant $\Sigma_{e}$-stress space and $\Sigma_{e}=F_e^T D_{F_e}
W_{\rm iso}(F_e)$. While $W_{_{\rm eH}}$ may loose ellipticity, we show that
loss of ellipticity is effectively prevented by the coupling with plasticity,
since the ellipticity domain of $W_{_{\rm eH}}$ on the one hand, and the
elastic domain in $\Sigma_{e}$-stress space on the other hand, are closely
related.
","[{""version"":""v1"",""created"":""Fri, 26 Sep 2014 12:35:27 GMT""},{""version"":""v2"",""created"":""Wed, 8 Oct 2014 13:08:17 GMT""}]","2016-02-17"
"1409.7556","Basura Fernando","Basura Fernando, Tatiana Tommasi, Tinne Tuytelaars","Location Recognition Over Large Time Lags",,,,,"cs.CV","http://arxiv.org/licenses/nonexclusive-distrib/1.0/","  Would it be possible to automatically associate ancient pictures to modern
ones and create fancy cultural heritage city maps? We introduce here the task
of recognizing the location depicted in an old photo given modern annotated
images collected from the Internet. We present an extensive analysis on
different features, looking for the most discriminative and most robust to the
image variability induced by large time lags. Moreover, we show that the
described task benefits from domain adaptation.
","[{""version"":""v1"",""created"":""Fri, 26 Sep 2014 12:36:54 GMT""},{""version"":""v2"",""created"":""Sat, 7 Mar 2015 15:58:17 GMT""},{""version"":""v3"",""created"":""Tue, 26 May 2015 03:14:19 GMT""}]","2015-05-27"
"1409.7557","Rabindra N. Mohapatra","Rabindra N. Mohapatra","From Old Symmetries to New Symmetries: Quarks, Leptons and B-L","17 pages; 5 figures; Invited article for ""Fifty years of Quarks"" ed.
  by H. Fritzsch, to be published by World Scientific; some typos corrected",,"10.1142/S0217751X1430066X",,"hep-ph","http://arxiv.org/licenses/nonexclusive-distrib/1.0/","  The Baryon-Lepton difference ($B-L$) is increasingly emerging as a possible
new symmetry of the weak interactions of quarks and leptons as a way to
understand the small neutrino masses. There is the possibility that current and
future searches at colliders and in low energy rare processes may provide
evidence for this symmetry. This paper provides a brief overview of the early
developments that led to B-L as a possible symmetry beyond the standard model,
and also discusses some recent developments.
","[{""version"":""v1"",""created"":""Fri, 26 Sep 2014 12:46:07 GMT""},{""version"":""v2"",""created"":""Mon, 29 Sep 2014 23:45:46 GMT""}]","2015-06-23"
