"1409.7858","Hiroki Isobe","Hiroki Isobe and Naoto Nagaosa","Generalized Hund's rule for two-atom systems","10 pages, 8 figures","Phys. Rev. B 90, 115122 (2014)","10.1103/PhysRevB.90.115122",,"cond-mat.str-el","http://arxiv.org/licenses/nonexclusive-distrib/1.0/","  Hund's rule is one of the fundamentals of the correlation physics at the
atomic level, determining the ground state multiplet of the electrons. It
consists of three laws: (i) maximum $S$ (total spin), (ii) maximum $L$ (total
orbital angular momentum) under the constraint of (i), and (iii) the total
angular momentum $J$ is $|L-S|$ for electron number less than half, while
$J=L+S$ for more than half due to the relativistic spin-orbit interaction
(SOI). In real systems, the electrons hop between the atoms and gain the
itinerancy, which is usually described by the band theory. The whole content of
theories on correlation is to provide a reliable way to describe the
intermediate situation between the two limits. Here we propose an approach
toward this goal, i.e., we study the two-atom systems of three $t_{2g}$
orbitals and see how the Hund's rule is modified by the transfer integral $t$
between them. It is found that the competition between $t$ and the Hund's
coupling $J$ at each atom determines the crossover from the molecular orbital
limit to the strong correlation limit. Especially, the focus is on the
generalization of the third rule, i.e., the inter-and intra-atomic SOI's in the
presence of the correlation. We have found that there are cases where the
effective SOI's are appreciably enhanced by the Hund's coupling. The conditions
for the enhancement are the intermediate Hund's coupling and the filling of
four or five electrons.
","[{""version"":""v1"",""created"":""Sun, 28 Sep 2014 00:29:31 GMT""}]","2014-09-30"
"1409.7859","Huiqiu Yuan","W. B. Jiang, C. Y. Guo, Z. F. Weng, Y. F. Wang, Y. H. Chen, Y. Chen,
  G. M. Pang, T. Shang, X. Lu and H. Q. Yuan","Superconductivity and structural distortion in BaPt$_2$As$_2$","6 pages, 6 figures, minor revision","J. Phys.: Condens. Matter 27, 022202 (2015) (Fast Track
  Communication)","10.1088/0953-8984/27/2/022202",,"cond-mat.supr-con","http://arxiv.org/licenses/nonexclusive-distrib/1.0/","  We successfully synthesized the BaPt$_2$As$_2$ single crystals and studied
their structural and physical properties at low temperatures. BaPt$_2$As$_2$
crystallizes in the CaBe$_2$Ge$_2$-type tetragonal structure (P4/nmm) at room
temperature and undergoes a first-order structural transition at $T_S\simeq
275$ K, which is likely associated with a charge-density-wave (CDW)
instability. BCS-type superconductivity with two subsequent transitions at
$T_{c1}=1.67$K and $T_{c2}$=1.33K are observed in this compound. Thus,
BaPt$_2$As$_2$ may serve as a new system for studying the interplay of
superconductivity and the CDW order.
","[{""version"":""v1"",""created"":""Sun, 28 Sep 2014 01:18:58 GMT""},{""version"":""v2"",""created"":""Tue, 9 Dec 2014 06:45:52 GMT""}]","2015-06-23"
"1409.7860","Tom Leinster","Marie Bjerrum, Peter Johnstone, Tom Leinster, William F. Sawin","Notes on commutation of limits and colimits","5 pages. Version 2: very minor edits","Theory and Applications of Categories 30 (2015), 527-532",,,"math.CT math.GR","http://arxiv.org/licenses/nonexclusive-distrib/1.0/","  We show that there are infinitely many distinct closed classes of colimits
(in the sense of the Galois connection induced by commutation of limits and
colimits in Set) which are intermediate between the class of pseudo-filtered
colimits and that of all (small) colimits. On the other hand, if the
corresponding class of limits contains either pullbacks or equalizers, then the
class of colimits is contained in that of pseudo-filtered colimits.
","[{""version"":""v1"",""created"":""Sun, 28 Sep 2014 01:23:58 GMT""},{""version"":""v2"",""created"":""Mon, 4 May 2015 20:27:24 GMT""}]","2015-05-06"
"1409.7861","Insoon Yang","Insoon Yang, Samuel A. Burden, Ram Rajagopal, S. Shankar Sastry,
  Claire J. Tomlin","Approximation Algorithms for Optimization of Combinatorial Dynamical
  Systems",,,,,"math.OC","http://arxiv.org/licenses/nonexclusive-distrib/1.0/","  This paper considers an optimization problem for a dynamical system whose
evolution depends on a collection of binary decision variables. We develop
scalable approximation algorithms with provable suboptimality bounds to provide
computationally tractable solution methods even when the dimension of the
system and the number of the binary variables are large. The proposed method
employs a linear approximation of the objective function such that the
approximate problem is defined over the feasible space of the binary decision
variables, which is a discrete set. To define such a linear approximation, we
propose two different variation methods: one uses continuous relaxation of the
discrete space and the other uses convex combinations of the vector field and
running payoff. The approximate problem is a 0-1 linear program, which can be
solved by existing polynomial-time exact or approximation algorithms, and does
not require the solution of the dynamical system. Furthermore, we characterize
a sufficient condition ensuring the approximate solution has a provable
suboptimality bound. We show that this condition can be interpreted as the
concavity of the objective function. The performance and utility of the
proposed algorithms are demonstrated with the ON/OFF control problems of
interdependent refrigeration systems.
","[{""version"":""v1"",""created"":""Sun, 28 Sep 2014 01:25:19 GMT""},{""version"":""v2"",""created"":""Wed, 7 Jan 2015 06:32:20 GMT""}]","2016-10-31"
"1409.7862","Juan Pablo C\'ardenas","Juan Pablo C\'ardenas, Gerardo Vidal, Gast\'on Olivares","Complexity, Selectivity and Asymmetry in the Conformation of the Power
  Phenomenon. Analysis of Chilean Society",,,,,"physics.soc-ph cs.SI","http://arxiv.org/licenses/nonexclusive-distrib/1.0/","  In this work we analyzed the relationships between powerful politicians and
businessmen of Chile in order to study the phenomenon of social power. We
developed our study according to Complex Network Theory but also using
traditional sociological theories of Power and Elites. Our analyses suggest
that the studied network displays common properties of Complex Networks, such
as scaling in connectivity distribution, properties of small-world networks,
and modular structure, among others. We also observed that social power (a
proposed metric is presented in this work) is also distributed inhomogeneously.
However, the most interesting observation is that this inhomogeneous power and
connectivity distribution, among other observed properties, may be the result
of a dynamic and unregulated process of network growth in which powerful people
tend to link to similar others. The compatibility between people, increasingly
selective as the network grows, could generate the presence of extremely
powerful people, but also a constant inequality of power where the difference
between the most powerful is the same as among the least powerful. Our results
are also in accordance with sociological theories.
","[{""version"":""v1"",""created"":""Sun, 28 Sep 2014 01:37:45 GMT""},{""version"":""v2"",""created"":""Tue, 4 Nov 2014 20:10:52 GMT""}]","2014-11-05"
"1409.7863","Hanming Zhou","Leonid Pestov, Gunther Uhlmann, Hanming Zhou","An Inverse Kinematic Problem with Internal Sources","7 pages",,"10.1088/0266-5611/31/5/055006",,"math.DG math.AP","http://arxiv.org/licenses/nonexclusive-distrib/1.0/","  Given a bounded domain $M$ in $\mathbb{R}^n$ with a conformally Euclidean
metric $g=\rho\,dx^2$, in this paper we consider the inverse problem of
recovering a semigeodesic neighborhood of a domain $\Gamma\subset \partial M$
and the conformal factor $\rho$ in the neighborhood from the travel time data
(defined below) and the Cartesian coordinates of $\Gamma$. We develop an
explicit reconstruction procedure for this problem. The key ingredient is the
relation between the reconstruction and a Cauchy problem of the conformal
Killing equation.
","[{""version"":""v1"",""created"":""Sun, 28 Sep 2014 02:10:58 GMT""}]","2015-05-20"
"1409.7864","Jinmian Li","Jun Guo, Jinmian Li, Tianjun Li, Anthony G. Williams","NMSSM explanations of the Galactic center gamma ray excess and promising
  LHC searches","31 pages, 7 figures, 5 tables. Matches PRD version","Phys. Rev. D 91, 095003 (2015)","10.1103/PhysRevD.91.095003",,"hep-ph","http://arxiv.org/licenses/nonexclusive-distrib/1.0/","  The Galactic Center Excess (GCE) is explained in the framework of the
Next-to-Minimal Supersymmetric Standard Model (NMSSM) with a $Z_3$ discrete
symmetry. We show that a resonant CP-odd Higgs boson with mass twice that of
the Dark Matter (DM) candidate is favoured. Meanwhile, the DM candidate is
required to have relatively large coupling with the $Z$ boson through its
Higgsino component in order to obtain correct DM relic density. Its LHC
discovery potential via four signatures is discussed in detail. We find that
the most sensitive signals are provided by the Higgsino-like chargino and
neutralino pair production with their subsequent decays into $W$ bosons, $Z$
bosons, and DM. The majority of the relevant parameter space can be probed at
the Large Hadron Collider with a centre-of-mass energy of 14 TeV and an
integrated luminosity 1000 fb$^{-1}$.
","[{""version"":""v1"",""created"":""Sun, 28 Sep 2014 02:46:42 GMT""},{""version"":""v2"",""created"":""Thu, 2 Oct 2014 12:12:10 GMT""},{""version"":""v3"",""created"":""Sat, 2 May 2015 01:37:20 GMT""}]","2015-05-13"
"1409.7865","Clifford Chafin","Clifford Chafin","Humblonium: Classical Atoms and the Earnshaw Plasma",,,,,"physics.atm-clus","http://arxiv.org/licenses/nonexclusive-distrib/1.0/","  It is shown that electrostatic and diamagnetic forces can combine to give
long lasting metastable bound dimers of macro and mesoscopically sized objects
for a physically attainable material regime. This can be a large enough effect
to support itself in a trap against Earth's gravity and they can stable at very
high temperatures. For a more restricted material parameter set, we investigate
the possibility of stable many particle collections that lose their identity as
bound pairs and create a kind of plasma. These would constitute a kind of
transitional state between fluids and granular materials but, unlike usual
approaches, the fluid is a gas rather than a liquid.
","[{""version"":""v1"",""created"":""Sun, 28 Sep 2014 02:48:11 GMT""}]","2014-09-30"
"1409.7866","Philip Judge Dr","Philip Judge, Lucia Kleint, Han Uitenbroek, Matthias Rempel, Yoshinori
  Suematsu, Saku Tsuneta","Photon mean free paths, scattering, and ever-increasing telescope
  resolution","Solar Physics, in press",,"10.1007/s11207-014-0643-2",,"astro-ph.SR","http://arxiv.org/licenses/nonexclusive-distrib/1.0/","  We revisit an old question: what are the effects of observing stratified
atmospheres on scales below a photon mean free path? The mean free path of
photons emerging from the solar photosphere and chromosphere is near 100 km.
Using current 1m-class telescopes, the mean free path is on the order of the
angular resolution. But the Daniel K. Inoue Solar Telescope will have a
diffraction limit of 0.020'' near the atmospheric cutoff at 310nm,
corresponding to 14 km at the solar surface. Even a small amount of scattering
in the source function leads to physical smearing due to this solar 'fog', with
effects similar to a degradation of the telescope PSF. We discuss a unified
picture that depends simply on the nature and amount of scattering in the
source function. Scalings are derived from which the scattering in the solar
atmosphere can be transcribed into an effective Strehl ratio, a quantity useful
to observers. Observations in both permitted (e.g., Fe I 630.2 nm) and
forbidden (Fe I 525.0 nm) lines will shed light on both instrumental
performance as well as on small scale structures in the solar atmosphere.
","[{""version"":""v1"",""created"":""Sun, 28 Sep 2014 02:53:16 GMT""}]","2015-06-23"
"1409.7867","Sunxiang Huang","S. X. Huang, Fei Chen, Jian Kang, Jiadong Zang, G. J. Shu, F. C. Chou,
  and C. L. Chien","Magnetoresistance due to Broken C4 Symmetry in Cubic B20 Chiral Magnets",,,,,"cond-mat.mtrl-sci cond-mat.str-el","http://arxiv.org/licenses/nonexclusive-distrib/1.0/","  The B20 chiral magnets with broken inversion symmetry and C4 rotation
symmetry have attracted much attention. The broken inversion symmetry leads to
the Dzyaloshinskii-Moriya that gives rise to the helical and Skyrmion states.
We report the unusual magnetoresistance (MR) of B20 chiral magnet
Fe0.85Co0.15Si that directly reveals the broken C4 rotation symmetry. We
present a microscopic theory, a minimal theory with two spin-orbit terms, that
satisfies all the symmetry requirements and accounts for the transport
experiments.
","[{""version"":""v1"",""created"":""Sun, 28 Sep 2014 03:09:18 GMT""}]","2014-09-30"
"1409.7868","Jian Zhai","Jian Zhai","Regularity of weak solutions to the Navier-Stokes equations
  (III)-frequency overlapping","This paper has been withdrawn by the author due to a crucial error in
  section 6",,,,"math.AP","http://arxiv.org/licenses/nonexclusive-distrib/1.0/","  If $u$ is a Leray-Hopf solution to the Navier-Stokes equations with the
initial data in $ L^2(\mathbb{R}^3)$, then $u$ is regular.
","[{""version"":""v1"",""created"":""Sun, 28 Sep 2014 03:20:37 GMT""},{""version"":""v2"",""created"":""Wed, 10 Dec 2014 06:36:43 GMT""},{""version"":""v3"",""created"":""Mon, 8 Feb 2016 07:18:28 GMT""},{""version"":""v4"",""created"":""Wed, 24 Feb 2016 13:52:16 GMT""}]","2016-02-25"
"1409.7869","Sunxiang Huang","S. X. Huang, Jian Kang, Fei Chen, Jiadong Zang, G. J. Shu, F. C. Chou,
  S. V. Grigoriev, V. A. Dyadkin, and C. L. Chien","Universal Ratio of Intrinsic Resistivities of Spin Helix in B20
  (Fe-Co)Si Magnets",,,,,"cond-mat.mtrl-sci cond-mat.str-el","http://arxiv.org/licenses/nonexclusive-distrib/1.0/","  The B20 magnets with the Dzyaloshinskii-Moriya (D-M) interaction exhibit spin
helix and Skyrmion spin textures unattainable in traditional Heisenberg
ferromagnets. We have determined the intrinsic resistivity of the spin helix,
which is a macroscopic Bloch domain wall, in B20 (Fe-Co)Si magnets. We found a
universal resistance ratio of gamma = 1.35 with current parallel and
perpendicular to the helix, independent of composition and temperature. This
gamma value is much smaller than 3, the well-known minimum value for domain
wall resistivity in traditional ferromagnets, due to the significant spin-orbit
coupling in the B20 magnets.
","[{""version"":""v1"",""created"":""Sun, 28 Sep 2014 03:23:38 GMT""}]","2014-09-30"
"1409.7870","Lixin Xu","Lixin Xu","Detecting Primordial Gravitational Waves Signal from BICEP2 and {\it
  Planck} HFI $353$GHz Dust Polarization","5 pages, 4 figures, title changed, n_{run} was included",,,,"astro-ph.CO","http://arxiv.org/licenses/nonexclusive-distrib/1.0/","  The dust polarization is parameterized as a power law form of the multipole
$l$: $D^{XX}_{l}=A^{XX}l(l+1)l^{\alpha_{XX}}/(2\pi)$ ($XX$ denotes $BB$ or
$EE$), where $A^{XX}$ is its amplitude with the ratio $A^{BB}/A^{EE}=0.52\pm
0.02$ and $\alpha_{BB,EE}=-2.42\pm 0.02$. Extrapolating to $150$GHz from
$353$GHz yields a value of $D^{BB}_{l=80}=(1.32\pm 0.29)\times 10^{-2}\mu K^2$
(and an additional uncertainty $(+0.28,-0.24)\times 10^{-2}\mu K^2$) over the
range $40<l<120$. Based on these data, we report the tensor-to-scalar ratio
$r=A_{t}/A_{s}$ defined at $k_0=0.05 \text{Mpc} ^{-1}$ by joining the
BICEP2+{\it Planck}2013+WMAP9+BAO+HST and {\it Planck} HFI $353$GHz dust
polarization and its implication to the detection of the primordial
gravitational waves. Considering the $\Lambda$CDM+$r$ model, we found $r<0.108$
at $95\%$ confidence level with $\sigma_{stat}=0.29$ and $r<0.129$ at $95\%$
confidence level with $\sigma_{stat+extr}=0.29+0.28$. The results imply no
significant evidence for the primordial gravitational waves in $1\sigma$
regions. However the post probability distribution of $r$ peaks at a small
positive value. And $r$ moves to larger positive values when the extrapolation
error bars are included. This might imply a very weak signal of the primordial
gravitational waves. It also implies the crucial fact in calibrating the
amplitude of the dust polarizations in detecting the primordial gravitational
waves in the future. When the running of the scalar spectral tilt is included,
we found $r<0.079$ at $95\%$ confidence level with $\sigma_{stat}=0.29$ and
$r=0.091_{-0.069}^{+0.042}$ at $95\%$ confidence level with
$\sigma_{stat+extr}=0.29+0.28$. The later one implies the detection of the
primordial gravitational waves in $1\sigma$ regions at the cost of decreasing
the value of $D^{BB}_{l=80}$ to $0.67_{-0.25}^{+0.25}$.
","[{""version"":""v1"",""created"":""Sun, 28 Sep 2014 04:53:42 GMT""},{""version"":""v2"",""created"":""Sun, 26 Oct 2014 01:46:01 GMT""}]","2014-10-28"
"1409.7871","Clifford M. Will","Clifford M. Will","Was Einstein Right? A Centenary Assessment","33 pages, 8 figures, to be published in General Relativity and
  Gravitation: A Centennial Perspective, eds. A. Ashtekar, B. Berger, J.
  Isenberg and M. A. H. MacCallum (Cambridge University Press), 2015. Abridged
  version of arXiv:1403.7377",,,,"gr-qc physics.hist-ph","http://arxiv.org/licenses/nonexclusive-distrib/1.0/","  This article is an overview of 100 years of testing general relativity, to be
published in the book General Relativity and Gravitation: A Centennial
Perspective, to commemorate the 100th anniversary of general relativity. It is
effectively an abridged version of the recent update of the author's Living
Review in Relativity.
","[{""version"":""v1"",""created"":""Sun, 28 Sep 2014 05:18:45 GMT""}]","2014-09-30"
"1409.7872","Sunil Maharaj","Apratim Ganguly, Sushant G. Ghosh and Sunil D. Maharaj","Accretion onto a black hole in a string cloud background","9 pages, To appear in Phys. Rev. D","Phys. Rev. D 90, 064037 (2014)","10.1103/PhysRevD.90.064037",,"gr-qc","http://arxiv.org/licenses/nonexclusive-distrib/1.0/","  We examine the accretion process onto the black hole with a string cloud
background, where the horizon of the black hole has an enlarged radius $r_H=2
M/(1-\alpha)$, due to the string cloud parameter $\alpha\; (0 \leq \alpha <
1)$. The problem of stationary, spherically symmetric accretion of a polytropic
fluid is analysed to obtain an analytic solution for such a perturbation.
Generalised expressions for the accretion rate $\dot{M}$, critical radius
$r_s$, and other flow parameters are found. The accretion rate $\dot{M}$ is an
explicit function of the black hole mass $M$, as well as the gas boundary
conditions and the string cloud parameter $\alpha$. We also find the gas
compression ratios and temperature profiles below the accretion radius and at
the event horizon. It is shown that the mass accretion rate, for both the
relativistic and the non-relativistic fluid by a black hole in the string cloud
model, increases with increase in $\alpha$.
","[{""version"":""v1"",""created"":""Sun, 28 Sep 2014 07:18:50 GMT""}]","2015-06-23"
"1409.7873","Sukhbinder Singh","Sukhwinder Singh","Identifying quantum phases from injectivity of symmetric matrix product
  states","9 pages, 6 figures, 1 table (minor changes from previous version)","Phys. Rev. B 91, 115145 (2015)","10.1103/PhysRevB.91.115145",,"cond-mat.str-el","http://arxiv.org/licenses/nonexclusive-distrib/1.0/","  Given a local gapped Hamiltonian with a global symmetry on a one dimensional
lattice we describe a method to identify if the Hamiltonian belongs to a
quantum phase in which the symmetry is spontaneously broken in the ground
states or to a specific symmetry protected phase, without using local or string
order parameters. We obtain different matrix product state (MPS) descriptions
of the symmetric ground state(s) of the Hamiltonian by restricting the MPS
matrices to transform under different projective representations of the
symmetry. The phase of the Hamiltonian is identified by examining which MPS
descriptions, if any, are injective, namely, whether the largest eigenvalue of
the ""transfer matrix"" obtained from the MPS is unique. We demonstrate the
method for translation invariant Hamiltonians with a global SO(3), Z_2 and Z_2
x Z_2 symmetry on an infinite chain.
","[{""version"":""v1"",""created"":""Sun, 28 Sep 2014 07:31:47 GMT""},{""version"":""v2"",""created"":""Sun, 22 Mar 2015 23:20:23 GMT""}]","2015-04-08"
"1409.7874","Sunil Maharaj","Sushant G. Ghosh and Sunil D. Maharaj","Cloud of strings for radiating black holes in Lovelock gravity","9 pages, To appear in Phys. Rev. D","Phys. Rev. D 89, 084027 (2014)","10.1103/PhysRevD.89.084027",,"gr-qc","http://arxiv.org/licenses/nonexclusive-distrib/1.0/","  We present exact spherically symmetric null dust solutions in the third order
Lovelock gravity with a string cloud background in arbitrary $N$ dimensions,.
This represents radiating black holes and generalizes the well known Vaidya
solution to Lovelock gravity with a string cloud in the background. We also
discuss the energy conditions and horizon structures, and explicitly bring out
the effect of the string clouds on the horizon structure of black hole
solutions for the higher dimensional general relativity and
Einstein-Gauss-Bonnet theories. It turns out that the presence of the coupling
constant of the Gauss-Bonnet terms and/or background string clouds completely
changes the structure of the horizon and this may lead to a naked singularity.
We recover known spherically symmetric radiating models as well as static black
holes in the appropriate limits.
","[{""version"":""v1"",""created"":""Sun, 28 Sep 2014 07:41:22 GMT""}]","2015-06-23"
"1409.7875","Xiongfeng Ma","Xiao Yuan, Zhu Cao, Xiongfeng Ma","Randomness Requirement on CHSH Bell Test in the Multiple Run Scenario","15 pages, 3 figures, comments are welcome","Phys. Rev. A 91, 032111 (2015)","10.1103/PhysRevA.91.032111",,"quant-ph","http://arxiv.org/licenses/nonexclusive-distrib/1.0/","  The Clauser-Horne-Shimony-Holt inequality test is widely used as a mean of
invalidating the local deterministic theories and a tool of device independent
quantum cryptographic tasks. There exists a randomness (freewill) loophole in
the test, which is widely believed impossible to be closed perfectly. That is,
certain random inputs are required for the test. Following a randomness
quantification method used in literature, we investigate the randomness
required in the test under various assumptions. By comparing the results, one
can conclude that the key to make the test result reliable is to rule out
correlations between multiple runs.
","[{""version"":""v1"",""created"":""Sun, 28 Sep 2014 07:44:26 GMT""}]","2015-03-18"
"1409.7876","Yvan Martel","Yvan Martel, Frank Merle","On the nonexistence of pure multi-solitons for the quartic gKdV equation","to appear in Int Math Res Notices",,,,"math.AP","http://arxiv.org/licenses/nonexclusive-distrib/1.0/","  We consider the quartic (nonintegrable) (gKdV) equation. Let u(t) be an
outgoing 2-soliton of the equation, i.e. a solution behaving exactly as the sum
of two solitons (of speeds c1 and c2) for large positive time.
  In arXiv:0910.3204, for nearly equal solitons, the solution u(t) is computed
up to some order of epsilon=1-c2/c1, everywhere in time and space. In
particular, it is deduced that u(t) is not a multi-soliton for large negative
time, proving the nonexistence of pure multi-soliton in this context.
  In the present paper, we prove the same result for an explicit range of
speeds: 3/4 c1< c2< c1, by a different approach, which does not longer require
a precise description of the solution. In fact, the nonexistence result holds
for outgoing N-solitons, for any N>1, under an explicit assumption on the
speeds, which is a natural generalization of the condition for N=2.
","[{""version"":""v1"",""created"":""Sun, 28 Sep 2014 08:10:19 GMT""}]","2014-09-30"
"1409.7877","Dominic William Berry","Dominic W. Berry, Mankei Tsang, Michael J. W. Hall, Howard M. Wiseman","The quantum Bell-Ziv-Zakai bounds and Heisenberg limits for waveform
  estimation","18 pages, 6 figures, comments welcome","Phys. Rev. X 5, 031018 (2015)","10.1103/PhysRevX.5.031018",,"quant-ph","http://arxiv.org/licenses/nonexclusive-distrib/1.0/","  We propose quantum versions of the Bell-Ziv-Zakai lower bounds on the error
in multiparameter estimation. As an application we consider measurement of a
time-varying optical phase signal with stationary Gaussian prior statistics and
a power law spectrum $\sim 1/|\omega|^p$, with $p>1$. With no other
assumptions, we show that the mean-square error has a lower bound scaling as
$1/{\cal N}^{2(p-1)/(p+1)}$, where ${\cal N}$ is the time-averaged mean photon
flux. Moreover, we show that this accuracy is achievable by sampling and
interpolation, for any $p>1$. This bound is thus a rigorous generalization of
the Heisenberg limit, for measurement of a single unknown optical phase, to a
stochastically varying optical phase.
","[{""version"":""v1"",""created"":""Sun, 28 Sep 2014 08:22:15 GMT""}]","2015-08-26"
"1409.7878","Alessandro Berti Dr","Alessandro Berti","An Improved Node Ranking for Label Propagation and Modularity based
  Clustering","2 pages, 2 tables, conference",,,,"cs.SI physics.soc-ph","http://arxiv.org/licenses/nonexclusive-distrib/1.0/","  In this paper I'll speak about non-spectral clustering techniques and see how
a node ordering based on centrality measures can improve the quality of
communities detected. I'll also discuss an improvement to existing techniques,
which further improves modularity.
","[{""version"":""v1"",""created"":""Sun, 28 Sep 2014 08:41:10 GMT""}]","2014-09-30"
