"1409.7839","Elizabeth Jerison","Elizabeth R. Jerison, Sergey Kryazhimskiy, Michael M. Desai","Pleiotropic consequences of adaptation across gradations of
  environmental stress in budding yeast",,,,,"q-bio.PE","http://arxiv.org/licenses/nonexclusive-distrib/1.0/","  Adaptation to one environment often results in fitness gains and losses in
other conditions. To characterize how these consequences of adaptation depend
on the physical similarity between environments, we evolved 180 populations of
Saccharomyces cerevisiae at different degrees of stress induced by either salt,
temperature, pH, or glucose depletion. We measure how the fitness of clones
adapted to each environment depends on the intensity of the corresponding type
of stress. We find that clones evolved in a given type and intensity of stress
tend to gain fitness in other similar intensities of that stress, and lose
progressively more fitness in more physically dissimilar environments. These
fitness trade-offs are asymmetric: adaptation to permissive conditions incurred
a smaller trade-off in stressful conditions than vice versa. We also find that
fitnesses of clones are highly correlated across similar intensities of stress,
but these correlations decay towards zero in more dissimilar environments. To
interpret these results, we introduce the concept of a joint distribution of
fitness effects of new mutations in multiple environments (the JDFE), which
describes the probability that a given mutation has particular fitness effects
in some set of conditions. We find that our observations are consistent with
JDFEs that are highly correlated between physically similar environments, and
that become less correlated and asymmetric as the environments become more
dissimilar. The JDFE provides a framework for quantifying evolutionary
similarity between conditions, and forms a useful basis for theoretical work
aimed at predicting the outcomes of evolution in fluctuating environments.
","[{""version"":""v1"",""created"":""Sat, 27 Sep 2014 20:52:09 GMT""}]","2014-09-30"
"1409.7840","Pierre-Henri Chavanis","Pierre-Henri Chavanis, Mohammed Lemou, Florian M\'ehats","Models of dark matter halos based on statistical mechanics: II. The
  fermionic King model",,"Physical Review D 92, 123527 (2015)","10.1103/PhysRevD.92.123527",,"astro-ph.CO","http://arxiv.org/licenses/nonexclusive-distrib/1.0/","  We discuss the nature of phase transitions in the fermionic King model which
describes tidally truncated quantum self-gravitating systems. This distribution
function takes into account the escape of high energy particles and has a
finite mass. On the other hand, the Pauli exclusion principle puts an upper
bound on the phase space density of the system and stabilizes it against
gravitational collapse. As a result, there exists a statistical equilibrium
state for any accessible values of energy and temperature. We plot the caloric
curves and investigate the nature of phase transitions as a function of the
degeneracy parameter in both microcanonical and canonical ensembles. We
consider stable and metastable states and emphasize the importance of the
latter for systems with long-range interactions. Phase transitions can take
place between a ""gaseous"" phase unaffected by quantum mechanics and a
""condensed"" phase dominated by quantum mechanics. The phase diagram exhibits
two critical points, one in each ensemble, beyond which the phase transitions
disappear. There also exist a region of negative specific heats and a situation
of ensemble inequivalence for sufficiently large systems. We apply the
fermionic King model to the case of dark matter halos made of massive
neutrinos. The gaseous phase describes large halos and the condensed phase
describes dwarf halos. Partially degenerate configurations describe
intermediate size halos. We argue that large dark matter halos cannot harbor a
fermion ball because these nucleus-halo configurations are thermodynamically
unstable (saddle points of entropy). Large dark matter halos may rather contain
a central black hole resulting from a dynamical instability of relativistic
origin occurring during the gravothermal catastrophe.
","[{""version"":""v1"",""created"":""Sat, 27 Sep 2014 20:57:36 GMT""}]","2016-07-12"
"1409.7841","Martin Strecker","Nadezhda Baklanova and Wilmer Ricciotti and Jan-Georg Smaus and Martin
  Strecker","Abstracting an operational semantics to finite automata",,,,,"cs.PL","http://arxiv.org/licenses/nonexclusive-distrib/1.0/","  There is an apparent similarity between the descriptions of small-step
operational semantics of imperative programs and the semantics of finite
automata, so defining an abstraction mapping from semantics to automata and
proving a simulation property seems to be easy. This paper aims at identifying
the reasons why simple proofs break, among them artifacts in the semantics that
lead to stuttering steps in the simulation. We then present a semantics based
on the zipper data structure, with a direct interpretation of evaluation as
navigation in the syntax tree. The abstraction function is then defined by
equivalence class construction.
","[{""version"":""v1"",""created"":""Sat, 27 Sep 2014 21:05:38 GMT""}]","2014-09-30"
"1409.7842","Indranil Pan","Indranil Pan and Saptarshi Das","When Darwin meets Lorenz: Evolving new chaotic attractors through
  genetic programming","81 pages, 128 figures","Chaos, Solitons & Fractals, Volume 76, Pages 141-155, 2015","10.1016/j.chaos.2015.03.017",,"nlin.CD cs.NE math.DS","http://arxiv.org/licenses/nonexclusive-distrib/1.0/","  In this paper, we propose a novel methodology for automatically finding new
chaotic attractors through a computational intelligence technique known as
multi-gene genetic programming (MGGP). We apply this technique to the case of
the Lorenz attractor and evolve several new chaotic attractors based on the
basic Lorenz template. The MGGP algorithm automatically finds new nonlinear
expressions for the different state variables starting from the original Lorenz
system. The Lyapunov exponents of each of the attractors are calculated
numerically based on the time series of the state variables using time delay
embedding techniques. The MGGP algorithm tries to search the functional space
of the attractors by aiming to maximise the largest Lyapunov exponent (LLE) of
the evolved attractors. To demonstrate the potential of the proposed
methodology, we report over one hundred new chaotic attractor structures along
with their parameters, which are evolved from just the Lorenz system alone.
","[{""version"":""v1"",""created"":""Sat, 27 Sep 2014 21:09:33 GMT""},{""version"":""v2"",""created"":""Wed, 25 Mar 2015 22:13:02 GMT""},{""version"":""v3"",""created"":""Sun, 3 May 2015 18:18:42 GMT""}]","2015-06-22"
"1409.7843","Radhakrishna  Sureshkumar PhD","Abhinanden Sambasivam, Ashish V. Sangwai and Radhakrishna Sureshkumar","Dynamics and Scission of Rodlike Cationic Surfactant Micelles in Shear
  Flow","5 pages, 3 figures",,"10.1103/PhysRevLett.114.158302",,"cond-mat.soft","http://arxiv.org/licenses/nonexclusive-distrib/1.0/","  Flow-induced configuration dynamics and scission of rodlike micelles are
studied for the first time using molecular dynamics simulations in presence of
explicit solvent and salt. Predicted dependence of tumbling frequency and
orientation distribution on shear rate S agrees with mesoscopic theories.
However, micelle stretching increases the distance between the cationic head
groups and adsorbed counter ions, which reduces electrostatic screening and
increases the overall energy Phi linearly with micelle length. Micelle scission
occurs when Phi exceeds a threshold value, independent of S.
","[{""version"":""v1"",""created"":""Sat, 27 Sep 2014 21:10:04 GMT""},{""version"":""v2"",""created"":""Wed, 17 Dec 2014 02:02:18 GMT""}]","2015-05-20"
"1409.7844","Dhagash Mehta","Souvik Chandra, Dhagash Mehta, Aranya Chakrabortty","Exploring the Impact of Wind Penetration on Power System Equilibrium
  Using a Numerical Continuation Approach","7 pages, 14 figures. Submitted to a Special Session of American
  Control Conference to be held in Palmer House Hilton, Chicago, IL, USA, in
  July 2015",,,,"cs.SY","http://arxiv.org/licenses/nonexclusive-distrib/1.0/","  In this paper we investigate how the equilibrium characteristics of
conventional power systems may change with an increase in wind penetration. We
first derive a differential-algebraic model of a power system network
consisting of synchronous generators, loads and a wind power plant modeled by a
wind turbine and a doubly-fed induction generator (DFIG). The models of these
three components are coupled via nonlinear power flow equations. In contrast to
the traditional approach for solving the power flows via iterative methods that
often lead to only local solutions, we apply a recently developed
parameter-homotopy based numerical continuation algorithm to compute all
possible solutions. The method solves the power flow equations over multiple
values of the wind penetration level with far less computational effort instead
of solving them at each value individually. We observe that depending on the
penetration limit and the setpoint value for the magnitude of the wind bus
voltage, the system may exhibit several undesired or even unstable equilibria.
We illustrate these results through a detailed simulation of a 5-machine power
system model with wind injection, and highlight how the solutions may be
helpful for small-signal stability assessment.
","[{""version"":""v1"",""created"":""Sat, 27 Sep 2014 21:21:22 GMT""}]","2014-09-30"
"1409.7845","Nicole Yunger Halpern","Nicole Yunger Halpern","Beyond heat baths II: Framework for generalized thermodynamic resource
  theories","Minor updates (contributions clarified, material restored from v1,
  references updated). 18 pages (including 2 figures) + appendices","J. Phys. A 51, 094001 (2018)
  http://iopscience.iop.org/article/10.1088/1751-8121/aaa62f/meta. For special
  issue ""Shannon's Information Theory: 70 years on.""","10.1088/1751-8121/aaa62f",,"quant-ph cond-mat.stat-mech","http://arxiv.org/licenses/nonexclusive-distrib/1.0/","  Thermodynamics, which describes vast systems, has been reconciled with small
scales, relevant to single-molecule experiments, in resource theories. Resource
theories have been used to model exchanges of energy and information. Recently,
particle exchanges were modeled; and an umbrella family of thermodynamic
resource theories was proposed to model diverse baths, interactions, and free
energies. This paper motivates and details the family's structure and
prospective applications. How to model electrochemical, gravitational,
magnetic, and other thermodynamic systems is explained. Szilard's engine and
Landauer's Principle are generalized, as resourcefulness is shown to be
convertible not only between information and gravitational energy, but also
among diverse degrees of freedom. Extensive variables are associated with
quantum operators that might fail to commute, introducing extra nonclassicality
into thermodynamic resource theories. An early version of this paper partially
motivated the later development of noncommutative thermalization. This
generalization expands the theories' potential for modeling realistic systems
with which small-scale statistical mechanics might be tested experimentally.
","[{""version"":""v1"",""created"":""Sat, 27 Sep 2014 21:25:18 GMT""},{""version"":""v2"",""created"":""Wed, 17 Jun 2015 20:01:11 GMT""},{""version"":""v3"",""created"":""Fri, 5 Jan 2018 19:02:58 GMT""}]","2018-02-05"
"1409.7846","Andrei Maimistov","A. A. Dovgiy, A. I. Maimistov","Modulation instability in nonlinear positive-negative index waveguide
  array","13 pages, 8 figures",,,,"nlin.PS","http://creativecommons.org/licenses/by/3.0/","  Modulation instability in a nonlinear optical waveguide array with
alternating positive and negative refractive indices is investigated
analytically. Particular solutions of a system of coupled nonlinear equations
are found. These solutions describe propagation of the continuum backward and
forward waves in longitudinal direction of considered system. Instability of
these waves is investigated with a linear stability analysis. A gain spectrum
depending on different parameters of considered system: electromagnetic field
power and ratio of the backward to forward wave amplitude, is studied
analytically and numerically. It was shown that in case of Bragg resonance the
continuum waves are stable. If nonlinearity assists at one kind of waveguides
only and another one is linear one then the modulation instability does not
occur. Out of Bragg resonance in defocusing waveguides the instability of the
continuum waves is reduced.
","[{""version"":""v1"",""created"":""Sat, 27 Sep 2014 21:34:29 GMT""}]","2014-09-30"
"1409.7847","Robert Martin","Robert Martin and Patrizio Neff","Some remarks on the monotonicity of primary matrix functions on the set
  of symmetric matrices",,,,,"math.CA","http://arxiv.org/licenses/nonexclusive-distrib/1.0/","  This note contains some observations on primary matrix functions and
different notions of monotonicity with relevance towards constitutive relations
in nonlinear elasticity. Focussing on primary matrix functions on the set of
symmetric matrices, we discuss and compare different criteria for monotonicity.
The demonstrated results are particularly applicable to computations involving
the true-stress-true-strain monotonicity condition, a constitutive inequality
recently introduced in an Arch. Appl. Mech. article by C.S. Jog and K.D. Patil.
We also clarify a statement by Jog and Patil from the same article which could
be misinterpreted.
","[{""version"":""v1"",""created"":""Sat, 27 Sep 2014 21:37:35 GMT""},{""version"":""v2"",""created"":""Thu, 16 Oct 2014 15:03:28 GMT""}]","2014-10-17"
"1409.7848","Alexey Rogozhnikov","F. C. Alcaraz, J. G. Brankov, V. B. Priezzhev, V. Rittenberg, A. M.
  Rogozhnikov","Non-contractible loops in the dense O(n) loop model on the cylinder","arXiv admin note: text overlap with arXiv:0810.2231","Phys. Rev. E 90, 052138 (2014)","10.1103/PhysRevE.90.052138",,"cond-mat.stat-mech","http://arxiv.org/licenses/nonexclusive-distrib/1.0/","  A lattice model of critical dense polymers $O(0)$ is considered for the
finite cylinder geometry. Due to the presence of non-contractible loops with a
fixed fugacity $\xi$, the model is a generalization of the critical dense
polymers solved by Pearce, Rasmussen and Villani. We found the free energy for
any height $N$ and circumference $L$ of the cylinder. The density $\rho$ of
non-contractible loops is found for $N \rightarrow \infty$ and large $L$. The
results are compared with those obtained for the anisotropic quantum chain with
twisted boundary conditions. Using the latter method we obtained $\rho$ for any
$O(n)$ model and an arbitrary fugacity.
","[{""version"":""v1"",""created"":""Sat, 27 Sep 2014 21:40:19 GMT""},{""version"":""v2"",""created"":""Fri, 2 Jan 2015 19:06:58 GMT""}]","2015-01-05"
"1409.7849","Robert Martin","Robert Martin and Patrizio Neff","Minimal geodesics on GL(n) for left-invariant, right-O(n)-invariant
  Riemannian metrics",,,,,"math.DG","http://arxiv.org/licenses/nonexclusive-distrib/1.0/","  We provide an easy approach to the geodesic distance on the general linear
group GL(n) for left-invariant Riemannian metrics which are also
right-O(n)-invariant. The parametrization of geodesic curves and the global
existence of length minimizing geodesics are deduced using simple methods based
on the calculus of variations and classical analysis only. The geodesic
distance is discussed for some special cases and applications towards the
theory of nonlinear elasticity are indicated.
","[{""version"":""v1"",""created"":""Sat, 27 Sep 2014 21:56:08 GMT""},{""version"":""v2"",""created"":""Wed, 17 Feb 2016 12:02:20 GMT""}]","2016-02-18"
"1409.7850","Junil Choi","Junil Choi and David J. Love and D. Richard Brown III and Mireille
  Boutin","Distributed Reception with Spatial Multiplexing: MIMO Systems for the
  Internet of Things","11 pages, 7 figures, submitted to IEEE Transactions on Signal
  Processing",,,,"cs.IT math.IT","http://arxiv.org/licenses/nonexclusive-distrib/1.0/","  The Internet of things (IoT) holds much commercial potential and could
facilitate distributed multiple-input multiple-output (MIMO) communication in
future systems. We study a distributed reception scenario in which a
transmitter equipped with multiple antennas sends multiple streams via spatial
multiplexing to a large number of geographically separated single antenna
receive nodes. The receive nodes then quantize their received signals and
forward the quantized received signals to a receive fusion center. With global
channel knowledge and forwarded quantized information from the receive nodes,
the fusion center attempts to decode the transmitted symbols. We assume the
transmit vector consists of phase shift keying (PSK) constellation points, and
each receive node quantizes its received signal with one bit for each of the
real and imaginary parts of the signal to minimize the transmission overhead
between the receive nodes and the fusion center. Fusing this data is a
non-trivial problem because the receive nodes cannot decode the transmitted
symbols before quantization. Instead, each receive node processes a single
quantity, i.e., the received signal, regardless of the number of transmitted
symbols. We develop an optimal maximum likelihood (ML) receiver and a
low-complexity zero-forcing (ZF)-type receiver at the fusion center. Despite
its suboptimality, the ZF-type receiver is simple to implement and shows
comparable performance with the ML receiver in the low signal-to-noise ratio
(SNR) regime but experiences an error rate floor at high SNR. It is shown that
this error floor can be overcome by increasing the number of receive nodes.
Hence, the ZF-type receiver would be a practical solution for distributed
reception with spatial multiplexing in the era of the IoT where we can easily
have a large number of receive nodes.
","[{""version"":""v1"",""created"":""Sat, 27 Sep 2014 22:01:04 GMT""}]","2014-09-30"
"1409.7851","Matthew Badger","Matthew Badger, Stephen Lewis","Local set approximation: Mattila-Vuorinen type sets, Reifenberg type
  sets, and tangent sets","52 pages, 5 figures","Forum Math. Sigma 3 (2015), e24, 63pp",,,"math.CA math.AP math.MG","http://arxiv.org/licenses/nonexclusive-distrib/1.0/","  We investigate the interplay between the local and asymptotic geometry of a
set $A \subseteq \mathbb{R}^n$ and the geometry of model sets $\mathcal{S}
\subset \mathcal{P}(\mathbb{R}^n)$, which approximate $A$ locally uniformly on
small scales. The framework for local set approximation developed in this paper
unifies and extends ideas of Jones, Mattila and Vuorinen, Reifenberg, and
Preiss. We indicate several applications of this framework to variational
problems that arise in geometric measure theory and partial differential
equations. For instance, we show that the singular part of the support of an
$(n-1)$-dimensional asymptotically optimally doubling measure in $\mathbb{R}^n$
($n\geq 4$) has upper Minkowski dimension at most $n-4$.
","[{""version"":""v1"",""created"":""Sat, 27 Sep 2014 22:20:36 GMT""}]","2020-07-21"
"1409.7852","Sivaram Ambikasaran","Sivaram Ambikasaran","Generalized Rybicki Press algorithm","13 pages, 11 figures, 1 table",,,,"math.NA cs.DS cs.NA stat.CO","http://arxiv.org/licenses/nonexclusive-distrib/1.0/","  This article discusses a more general and numerically stable Rybicki Press
algorithm, which enables inverting and computing determinants of covariance
matrices, whose elements are sums of exponentials. The algorithm is true in
exact arithmetic and relies on introducing new variables and corresponding
equations, thereby converting the matrix into a banded matrix of larger size.
Linear complexity banded algorithms for solving linear systems and computing
determinants on the larger matrix enable linear complexity algorithms for the
initial semi-separable matrix as well. Benchmarks provided illustrate the
linear scaling of the algorithm.
","[{""version"":""v1"",""created"":""Sat, 27 Sep 2014 22:24:03 GMT""},{""version"":""v2"",""created"":""Tue, 30 Sep 2014 01:10:27 GMT""},{""version"":""v3"",""created"":""Wed, 8 Oct 2014 20:31:33 GMT""},{""version"":""v4"",""created"":""Sat, 2 May 2015 02:35:51 GMT""}]","2015-05-05"
"1409.7853","Fatiha Merazka FM","Aziz Mouzali, Fatiha Merazka","Quantum correction with three codes","24 pages",,,,"cs.IT math.IT quant-ph","http://arxiv.org/licenses/nonexclusive-distrib/1.0/","  In this paper, we provise an implementation of five, seven and nine-qubits
error correcting codes on a classical computer using the quantum simulator
Feynman program. We also compare the three codes by computing the fidelity when
double errors occurs in a depolarizing channel. As triple errors and more are
considered very unlikely, it has negligible effect on the next results
","[{""version"":""v1"",""created"":""Sat, 27 Sep 2014 22:46:57 GMT""}]","2014-09-30"
"1409.7854","Gui-Qiang Chen G.","Gui-Qiang G. Chen and Mikhail Perepelitsa","Vanishing Viscosity Solutions of the Compressible Euler Equations with
  Spherical Symmetry and Large Initial Data","29 pages",,"10.1007/s00220-015-2376-y",,"math.AP","http://arxiv.org/licenses/nonexclusive-distrib/1.0/","  We are concerned with spherically symmetric solutions of the Euler equations
for multidimensional compressible fluids, which are motivated by many important
physical situations. Various evidences indicate that spherically symmetric
solutions of the compressible Euler equations may blow up near the origin at
certain time under some circumstance. The central feature is the strengthening
of waves as they move radially inward. A longstanding open, fundamental
question is whether concentration could form at the origin. In this paper, we
develop a method of vanishing viscosity and related estimate techniques for
viscosity approximate solutions, and establish the convergence of the
approximate solutions to a global finite-energy entropy solution of the
compressible Euler equations with spherical symmetry and large initial data.
This indicates that concentration does not form in the vanishing viscosity
limit, even though the density may blow up at certain time. To achieve this, we
first construct global smooth solutions of appropriate initial-boundary value
problems for the Euler equations with designed viscosity terms, an approximate
pressure function, and boundary conditions, and then we establish the strong
convergence of the viscosity approximate solutions to a finite-energy entropy
solutions of the Euler equations.
","[{""version"":""v1"",""created"":""Sat, 27 Sep 2014 22:47:06 GMT""}]","2015-06-11"
"1409.7855","Folkert M\""uller-Hoissen","Aristophanes Dimakis and Folkert M\""uller-Hoissen","Simplex and Polygon Equations",,"SIGMA 11 (2015), 042, pp. 49","10.3842/SIGMA.2015.042",,"math-ph math.MP math.QA nlin.SI","http://creativecommons.org/licenses/by-nc-sa/3.0/","  It is shown that higher Bruhat orders admit a decomposition into a higher
Tamari order, the corresponding dual Tamari order, and a ""mixed order."" We
describe simplex equations (including the Yang-Baxter equation) as realizations
of higher Bruhat orders. Correspondingly, a family of ""polygon equations""
realizes higher Tamari orders. They generalize the well-known pentagon
equation. The structure of simplex and polygon equations is visualized in terms
of deformations of maximal chains in posets forming 1-skeletons of polyhedra.
The decomposition of higher Bruhat orders induces a reduction of the
$N$-simplex equation to the $(N+1)$-gon equation, its dual, and a compatibility
equation.
","[{""version"":""v1"",""created"":""Sat, 27 Sep 2014 22:51:20 GMT""},{""version"":""v2"",""created"":""Fri, 5 Jun 2015 04:23:58 GMT""}]","2015-06-08"
"1409.7856","Nikita Kozin","Nikita Kozin, Deepak Majeti","On the arithmetic of one del Pezzo surface over the field with three
  elements",,,,,"math.NT","http://arxiv.org/licenses/nonexclusive-distrib/1.0/","  We discuss the problem of existence of rational curves on a certain del Pezzo
surface from a computational point of view and suggest a computer algorithm
implementing search. In particular, our computations reveal that the surface
contains 920 rational curves with parametrizations of degree 8 and does not
contain rational curves for a smaller degree.
","[{""version"":""v1"",""created"":""Sun, 28 Sep 2014 00:06:21 GMT""},{""version"":""v2"",""created"":""Sat, 17 Oct 2015 01:16:21 GMT""},{""version"":""v3"",""created"":""Tue, 15 Dec 2015 03:11:37 GMT""}]","2015-12-16"
"1409.7857","Andrzej Luczak","Andrzej {\L}uczak","On the commutativity of states in von Neumann algebras","9 pages",,,,"math.OA","http://arxiv.org/licenses/nonexclusive-distrib/1.0/","  The notion of commutativity of two normal states on a von Neumann algebra was
defined some time ago by means of the Pedersen-Takesaki theorem. In this note
we aim at generalizing this notion to an arbitrary number of states, and
obtaining some results on so defined joint commutativity. Also relations
between commutativity and broadcastability of states are investigated.
","[{""version"":""v1"",""created"":""Sun, 28 Sep 2014 00:16:28 GMT""}]","2014-09-30"
