"1405.6629","Kourosh Nozari","A. Behboodi, S. Akhshabi and K. Nozari","Braneworld setup and embedding in teleparallel gravity","21 pages, no figure, Title Changed, Accepted for Publication in Phys.
  Lett. B",,"10.1016/j.physletb.2014.11.053",,"gr-qc hep-th","http://arxiv.org/licenses/nonexclusive-distrib/1.0/","  We construct the setup of a five-dimensional braneworld scenario in
teleparallel gravity. Both cases of Minkowski and Friedmann-Robertson-Walker
branes embedded in Anti de Sitter bulk are studied and the effective 4-D action
were studied. 4-dimensional local Lorentz invariance is found to be recovered
in both cases. However, due to different junction conditions, the equations
governing the 4-D cosmological evolution differ from general relativistic case.
Using the results of Ref. [13], we consider a simple inflationary scenario in
this setup. The inflation parameters are found to be modified compared to
general relativistic case.
","[{""version"":""v1"",""created"":""Mon, 26 May 2014 16:19:15 GMT""},{""version"":""v2"",""created"":""Thu, 11 Dec 2014 11:04:43 GMT""}]","2015-06-19"
"1405.6630","Piotr Faliszewski","Krzysztof Wojtas, Krzysztof Magiera, Tomasz Mi\k{a}sko, Piotr
  Faliszewski","Possible Winners in Noisy Elections","34 pages",,,,"cs.GT cs.CC cs.MA","http://arxiv.org/licenses/nonexclusive-distrib/1.0/","  We consider the problem of predicting winners in elections, for the case
where we are given complete knowledge about all possible candidates, all
possible voters (together with their preferences), but where it is uncertain
either which candidates exactly register for the election or which voters cast
their votes. Under reasonable assumptions, our problems reduce to counting
variants of election control problems. We either give polynomial-time
algorithms or prove #P-completeness results for counting variants of control by
adding/deleting candidates/voters for Plurality, k-Approval, Approval,
Condorcet, and Maximin voting rules. We consider both the general case, where
voters' preferences are unrestricted, and the case where voters' preferences
are single-peaked.
","[{""version"":""v1"",""created"":""Mon, 26 May 2014 16:23:22 GMT""}]","2016-03-27"
"1405.6631","Ioannis Parissis","Paul A. Hagelstein, Ioannis Parissis","Weighted Solyanik Estimates for the Hardy-Littlewood maximal operator
  and embedding of $A_\infty$ into $A_p$","20 pages, submitted for publication, v.2 this is the final version,
  numbering has changed to match the published version, one reference updated,
  incorporates referee's report, to appear in J. Geom. Anal","J. Geom. Anal. 26 (2016), no. 2, 924--946","10.1007/s12220-015-9578-6",,"math.CA","http://arxiv.org/licenses/nonexclusive-distrib/1.0/","  Let $w$ denote a weight in $\mathbb{R}^n$ which belongs to the Muckenhoupt
class $A_\infty$ and let $\mathsf{M}_w$ denote the uncentered Hardy-Littlewood
maximal operator defined with respect to the measure $w(x)dx$. The \emph{sharp
Tauberian constant} of $\mathsf M_w$ with respect to $\alpha$, denoted by
$\mathsf{C}_w (\alpha)$, is defined by \[ \mathsf{C}_w (\alpha) := \sup_{E:\, 0
< w(E) < \infty}w(E)^{-1}w\big(\big\{x \in \mathbb{R}^n:\, \mathsf{M}_w \chi_E
(x) > \alpha\big\}\big). \] In this paper, we show that the Solyanik estimate
\[ \lim_{\alpha \rightarrow 1^-}\mathsf{C}_w(\alpha) = 1 \] holds. Following
the classical theme of weighted norm inequalities we also consider the sharp
Tauberian constants defined with respect to the usual uncentered
Hardy-Littlewood maximal operator $\mathsf M$ and a weight $w$: \[ \mathsf C ^w
(\alpha) := \sup_{E:\, 0 < w(E) < \infty} w(E)^{-1} w\big(\big\{x \in \mathbb
R^n:\, \mathsf{M} \chi_E (x) > \alpha\big\}\big). \] We show that we have
$\lim_{\alpha\to 1^{-}}\mathsf{C}^w(\alpha)=1$ if and only if $w\in A_\infty$.
As a corollary of our methods we obtain a quantitative embedding of $A_\infty$
into $A_p$.
","[{""version"":""v1"",""created"":""Mon, 26 May 2014 16:23:50 GMT""},{""version"":""v2"",""created"":""Wed, 21 Jan 2015 14:25:26 GMT""}]","2018-01-23"
"1405.6632","Michael Devin","Michael Devin","Postselected quantum circuits",,,,,"quant-ph","http://arxiv.org/licenses/nonexclusive-distrib/1.0/","  The purpose of this paper is to show the unusual behavior of a number of
simple circuits under the effects of post-selection. A useful duality exists
between post-selected ensembles and a consistent picture of acausal physics
embodying the application of Novikov's consistency postulate to the
wave-function of a time machine. A competing view applies this postulate to
density matrices instead, but that lies outside the scope of this paper. To
find out the result of a measurement on a particular circuit, we consider a
weighted distribution of histories between some initial and final time, such
that each individually obeys ordinary quantum mechanics. The weight of a
particular history is given by a joint distribution over the values of a part
of the system dubbed the time machine, at two chosen times. In the dual
post-selection picture the weight is simply the probability for the 'periodic
bit' to satisfy the constraint, plus a small noise part, often assumed
constant, representing the error rate of the time machine's channel. The
emerging bit is one of a Bell pair, its partner kept in reserve to test that
the bit entering the time machine later matches the one which emerged. This is
done by interfering the incoming bit with the reserve member of the pair and
keeping the experimental runs that interfere constructively. Noise can be
effectively simulated by keeping a small proportion of runs that interfere
destructively, or by perturbing the reserve bit to decohere it by a similar
amount. Paradoxes remain but are tractable.
","[{""version"":""v1"",""created"":""Mon, 26 May 2014 16:27:07 GMT""}]","2014-05-27"
"1405.6633","Fernando Moraes","Jonas R.F. Lima, Julio Brandao, Marcio M. Cunha, and F. Moraes","Effects of rotation in the energy spectrum of $C_{60}$",,"Eur. Phys. J. D (2014) 68: 94","10.1140/epjd/e2014-40570-4",,"cond-mat.mes-hall","http://arxiv.org/licenses/nonexclusive-distrib/1.0/","  In this paper, motivated by the experimental evidence of rapidly rotating
$C_{60}$ molecules in fullerite, we study the low-energy electronic states of
rotating fullerene within a continuum model. In this model, the low-energy
spectrum is obtained from an effective Dirac equation including non-Abelian
gauge fields that simulate the pentagonal rings of the molecule. Rotation is
incorporated into the model by solving the effective Dirac equation in the
rotating referential frame. The exact analytical solution for the
eigenfunctions and energy spectrum is obtained, yielding the previously known
static results in the no rotation limit. Due to the coupling between rotation
and total angular momentum, that appears naturally in the rotating frame, the
zero modes of static $C_{60}$ are shifted and also suffer a Zeeman splitting
whithout the presence of a magnetic field.
","[{""version"":""v1"",""created"":""Mon, 26 May 2014 16:35:31 GMT""}]","2014-05-27"
"1405.6634","Ji Oon Lee","Ji Oon Lee, Kevin Schnelli, Ben Stetler, Horng-Tzer Yau","Bulk universality for deformed Wigner matrices","Published at http://dx.doi.org/10.1214/15-AOP1023 in the Annals of
  Probability (http://www.imstat.org/aop/) by the Institute of Mathematical
  Statistics (http://www.imstat.org)","Annals of Probability 2016, Vol. 44, No. 3, 2349-2425","10.1214/15-AOP1023","IMS-AOP-AOP1023","math.PR","http://arxiv.org/licenses/nonexclusive-distrib/1.0/","  We consider $N\times N$ random matrices of the form $H=W+V$ where $W$ is a
real symmetric or complex Hermitian Wigner matrix and $V$ is a random or
deterministic, real, diagonal matrix whose entries are independent of $W$. We
assume subexponential decay for the matrix entries of $W$, and we choose $V$ so
that the eigenvalues of $W$ and $V$ are typically of the same order. For a
large class of diagonal matrices $V$, we show that the local statistics in the
bulk of the spectrum are universal in the limit of large $N$.
","[{""version"":""v1"",""created"":""Mon, 26 May 2014 16:37:11 GMT""},{""version"":""v2"",""created"":""Wed, 30 Jul 2014 12:22:08 GMT""},{""version"":""v3"",""created"":""Tue, 7 Jun 2016 05:51:09 GMT""}]","2016-06-08"
"1405.6635","Erbil G\""ugercino\u{g}lu","Erbil G\""ugercino\u{g}lu and M. Ali Alpar","Vortex Creep Against Toroidal Flux Lines, Crustal Entrainment, and
  Pulsar Glitches","Published in The Astrophysical Journal Letters","ApJ, 788, L11 (2014)","10.1088/2041-8205/788/1/L11",,"astro-ph.HE","http://arxiv.org/licenses/nonexclusive-distrib/1.0/","  A region of toroidally oriented quantized flux lines must exist in the proton
superconductor in the core of the neutron star. This region will be a site of
vortex pinning and creep. Entrainment of the neutron superfluid with the
crustal lattice leads to a requirement of superfluid moment of inertia
associated with vortex creep in excess of the available crustal moment of
inertia. This will effect constraints on the equation of state. The toroidal
flux region provides the moment of inertia necessary to complement the crust
superfluid with postglitch relaxation behavior fitting the observations.
","[{""version"":""v1"",""created"":""Mon, 26 May 2014 16:39:05 GMT""}]","2014-05-27"
"1405.6636","Binnan Zhuang","Binnan Zhuang, Dongning Guo and Michael L. Honig","Traffic Driven Resource Allocation in Heterogenous Wireless Networks","6 pages, 5 figures IEEE GLOBECOM 2014 (accepted for publication)",,"10.1109/GLOCOM.2014.7037028",,"cs.IT math.IT","http://arxiv.org/licenses/nonexclusive-distrib/1.0/","  Most work on wireless network resource allocation use physical layer
performance such as sum rate and outage probability as the figure of merit.
These metrics may not reflect the true user QoS in future heterogenous networks
(HetNets) with many small cells, due to large traffic variations in overlapping
cells with complicated interference conditions. This paper studies the spectrum
allocation problem in HetNets using the average packet sojourn time as the
performance metric. To be specific, in a HetNet with $K$ base terminal stations
(BTS's), we determine the optimal partition of the spectrum into $2^K$ possible
spectrum sharing combinations. We use an interactive queueing model to
characterize the flow level performance, where the service rates are decided by
the spectrum partition. The spectrum allocation problem is formulated using a
conservative approximation, which makes the optimization problem convex. We
prove that in the optimal solution the spectrum is divided into at most $K$
pieces. A numerical algorithm is provided to solve the spectrum allocation
problem on a slow timescale with aggregate traffic and service information.
Simulation results show that the proposed solution achieves significant gains
compared to both orthogonal and full spectrum reuse allocations with moderate
to heavy traffic.
","[{""version"":""v1"",""created"":""Mon, 26 May 2014 16:40:24 GMT""},{""version"":""v2"",""created"":""Thu, 18 Sep 2014 21:57:50 GMT""}]","2016-11-18"
"1405.6637","Miroslav Bacak","Miroslav Bacak and Simeon Reich","The asymptotic behavior of a class of nonlinear semigroups in Hadamard
  spaces","Accepted in JFPTA",,,,"math.FA","http://arxiv.org/licenses/nonexclusive-distrib/1.0/","  We study a nonlinear semigroup associated to a nonexpansive mapping on a
Hadamard space and establish its weak convergence to a fixed point. A
discrete-time counterpart of such a semigroup, the proximal point algorithm,
turns out to have the same asymptotic behavior. This complements several
results in the literature -- both classical and more recent ones. As an
application, we obtain a new approach to heat flows in singular spaces for
discrete, as well as continuous times.
","[{""version"":""v1"",""created"":""Mon, 26 May 2014 16:44:51 GMT""},{""version"":""v2"",""created"":""Thu, 24 Jul 2014 17:27:26 GMT""}]","2014-07-25"
"1405.6638","Luis F. Rodriguez","L. F. Rodriguez, B. Reipurth, H.-F. Chiang","Radio Continuum Sources associated with the HH~92 and HH~34 Jets","8 pages, 4 figures",,,,"astro-ph.SR astro-ph.GA","http://arxiv.org/licenses/nonexclusive-distrib/1.0/","  We present high angular resolution, high sensitivity 8.46 GHz (3.6 cm) radio
continuum observations made toward the core of the HH~92 outflow with the Very
Large Array in 2002-2003 and with the Expanded Very Large Array in 2011. We
detect a group of three compact sources distributed in a region 2$''$ in
extension and discuss their nature. We conclude that one of the objects (VLA 1)
is the exciting source of the giant outflow associated with HH~92. In the case
of HH~34 we present new 43.3 GHz (7 mm) observations that reveal the presence
of a structure associated with the exciting source and elongated perpendicular
to the highly collimated optical jet in the region. We propose that this 7 mm
source is a circumstellar disk with radius of $\sim$80 AU and mass of
$\sim$0.21 $M_\odot$.
","[{""version"":""v1"",""created"":""Mon, 26 May 2014 16:48:13 GMT""}]","2014-05-27"
"1405.6639","Victor Ilisie","Victor Ilisie and Antonio Pich","Low-mass fermiophobic charged Higgs phenomenology in two-Higgs-doublet
  models","40 pages, 11 figures. Minor typos corrected","JHEP 1409 (2014) 089","10.1007/JHEP09(2014)089","FTUV/14-0526; IFIC/14-36","hep-ph hep-ex","http://arxiv.org/licenses/nonexclusive-distrib/1.0/","  After the recent discovery of a Higgs-like boson, the possibility of an
enlarged scalar sector arises as a natural question. Experimental searches for
charged scalars have been already performed with negative results. We analyze
the phenomenology associated with a fermiophobic charged Higgs (it does not
couple to fermions at tree level), in two-Higgs-doublet models. All present
experimental bounds are evaded trivially in this case, and one needs to
consider other decay and production channels. We study the associated
production of a charged Higgs with either a $W$ or a neutral scalar boson, and
the relevant decays for a light fermiophobic charged Higgs. The interesting
features of this scenario should result encouraging for the LHC collaborations
to perform searches for such a particle.
","[{""version"":""v1"",""created"":""Mon, 26 May 2014 16:59:43 GMT""},{""version"":""v2"",""created"":""Wed, 22 Oct 2014 16:12:55 GMT""},{""version"":""v3"",""created"":""Mon, 18 May 2015 14:11:13 GMT""}]","2015-05-19"
"1405.6640","Victor Goncalves","V. P. Goncalves, M. L. L. da Silva","Deciphering charmoniumlike exotic states in photon - hadron interactions
  at RHIC and LHC energies","6 pages, 4 figures, 1 Table. Version to be published in Physical
  Review D","Phys. Rev. D 89, 114005 (2014)","10.1103/PhysRevD.89.114005",,"hep-ph hep-ex","http://arxiv.org/licenses/nonexclusive-distrib/1.0/","  In this paper we propose the study of the photoproduction of charmoniumlike
states in $pp$ collisions at RHIC and LHC energies and estimate the rapidity
distribution and total cross sections for the production of the exotic hadrons
$Y(3940)$, $X(3915)$, $Z(4430)$ and $Z_c(3900)$. We demonstrate that the
experimental analysis of this process can provide complementary and independent
checks on these states, and help to understand their underlying nature.
","[{""version"":""v1"",""created"":""Mon, 26 May 2014 17:00:06 GMT""}]","2014-06-24"
"1405.6641","Jan Carl Budich","J. C. Budich, J. Eisert, E. J. Bergholtz, S. Diehl, and P. Zoller","Search for localized Wannier functions of topological band structures
  via compressed sensing",,"Phys. Rev. B 90, 115110 (2014)","10.1103/PhysRevB.90.115110",,"cond-mat.mes-hall quant-ph","http://arxiv.org/licenses/nonexclusive-distrib/1.0/","  We investigate the interplay of band structure topology and localization
properties of Wannier functions. To this end, we extend a recently proposed
compressed sensing based paradigm for the search for maximally localized
Wannier functions [Ozolins et al., PNAS 110, 18368 (2013)]. We develop a
practical toolbox that enables the search for maximally localized Wannier
functions which exactly obey the underlying physical symmetries of a
translationally invariant quantum lattice system under investigation. Most
saliently, this allows us to systematically identify the most localized
representative of a topological equivalence class of band structures, i.e., the
most localized set of Wannier functions that is adiabatically connected to a
generic initial representative. We also elaborate on the compressed sensing
scheme and find a particularly simple and efficient implementation in which
each step of the iteration is an $O(N \log N)$ algorithm in the number of
lattice sites $N$. We present benchmark results on one-dimensional topological
superconductors demonstrating the power of these tools. Furthermore, we employ
our method to address the open question whether compact Wannier functions can
exist for symmetry protected topological states like topological insulators in
two dimensions. The existence of such functions would imply exact flat band
models with strictly finite range hopping. Here, we find numerical evidence for
the absence of such functions. We briefly discuss applications in dissipative
state preparation and in devising variational sets of states for tensor network
methods.
","[{""version"":""v1"",""created"":""Mon, 26 May 2014 17:01:23 GMT""},{""version"":""v2"",""created"":""Sun, 15 Jun 2014 20:00:19 GMT""},{""version"":""v3"",""created"":""Thu, 11 Sep 2014 09:12:38 GMT""}]","2014-09-12"
"1405.6642","Guang Cheng","Wei Sun (Yahoo Labs), Xingye Qiao (Binghamton) and Guang Cheng
  (Purdue)","Stabilized Nearest Neighbor Classifier and Its Statistical Properties","48 Pages, 11 Figures. To Appear in JASA--T&M",,,,"stat.ML cs.LG","http://arxiv.org/licenses/nonexclusive-distrib/1.0/","  The stability of statistical analysis is an important indicator for
reproducibility, which is one main principle of scientific method. It entails
that similar statistical conclusions can be reached based on independent
samples from the same underlying population. In this paper, we introduce a
general measure of classification instability (CIS) to quantify the sampling
variability of the prediction made by a classification method. Interestingly,
the asymptotic CIS of any weighted nearest neighbor classifier turns out to be
proportional to the Euclidean norm of its weight vector. Based on this concise
form, we propose a stabilized nearest neighbor (SNN) classifier, which
distinguishes itself from other nearest neighbor classifiers, by taking the
stability into consideration. In theory, we prove that SNN attains the minimax
optimal convergence rate in risk, and a sharp convergence rate in CIS. The
latter rate result is established for general plug-in classifiers under a
low-noise condition. Extensive simulated and real examples demonstrate that SNN
achieves a considerable improvement in CIS over existing nearest neighbor
classifiers, with comparable classification accuracy. We implement the
algorithm in a publicly available R package snn.
","[{""version"":""v1"",""created"":""Mon, 26 May 2014 17:07:10 GMT""},{""version"":""v2"",""created"":""Sun, 30 Aug 2015 18:56:05 GMT""}]","2015-09-01"
"1405.6643","Victor Goncalves","V. P. Goncalves, W. K. Sauter, M. Thiel","Diffractive $Z$ boson pair production at LHC in the large extra
  dimensions scenario","15 pages, 7 figures, 1 table. Published in Phys. Rev. D89, 076003
  (2014)",,"10.1103/PhysRevD.89.076003",,"hep-ph hep-ex","http://arxiv.org/licenses/nonexclusive-distrib/1.0/","  In this paper we study the diffractive $Z$ boson pair production mediated by
the Kaluza-Klein graviton in the large extra dimensions scenario at the CERN
Large Hadron Collider energies. Considering the Durham model we estimate the
total cross section for the central inclusive and exclusive diffractive
production of a $Z$ boson pair in $pp/pPb/PbPb$ collisions. Our results
indicate that the experimental analysis of the central inclusive production in
$pp$ collisions is feasible at CERN LHC.
","[{""version"":""v1"",""created"":""Mon, 26 May 2014 17:10:37 GMT""}]","2014-05-27"
"1405.6644","Edouard Bernard","Edouard J. Bernard, Annette M. N. Ferguson, Edward F. Schlafly, Imants
  Platais, Eric F. Bell, Nicolas F. Martin, Hans-Walter Rix, Colin T. Slater,
  William S. Burgett, Kenneth C. Chambers, Peter W. Draper, Klaus W. Hodapp,
  Nicholas Kaiser, Rolf-Peter Kudritzki, Eugene A. Magnier, Nigel Metcalfe,
  John L. Tonry, Richard J. Wainscoat, Christopher Waters","Galactic Globular and Open Cluster Fiducial Sequences in the Pan-STARRS1
  Photometric System","6 pages, 5 figures (+15 figures in Appendix). Re-submitted to MNRAS
  after addressing the referee's comments. Some figures degraded due to size
  limitations",,"10.1093/mnras/stu1081",,"astro-ph.GA","http://arxiv.org/licenses/nonexclusive-distrib/1.0/","  We present the fiducial sequences of a sample of Galactic star clusters in
the five bands of the Pan-STARRS1 (PS1) photometric system (g_P1, r_P1, i_P1,
z_P1, y_P1). These empirical sequences -- which include the red giant and
sub-giant branches, the main sequence, and the horizontal branch -- were
defined from deep colour-magnitude diagrams reaching below the oldest
main-sequence turn-offs of 13 globular and 3 old open clusters covering a wide
range of metallicities (-2.4 < [Fe/H] < +0.4). We find excellent agreement for
the nine clusters in common with previous studies in similar photometric
systems when transformed to the PS1 system. Because the photometric and
spectroscopic properties of these stellar populations are accurately known, the
fiducials provide a solid basis for the interpretation of observations in the
PS1 system, as well as valuable constraints to improve the empirical
colour--$T_{eff}$ relations.
","[{""version"":""v1"",""created"":""Mon, 26 May 2014 17:12:24 GMT""}]","2015-06-19"
"1405.6645","Edouard Bernard","Edouard J. Bernard, Annette M. N. Ferguson, Edward F. Schlafly,
  Mohamad Abbas, Eric F. Bell, Niall R. Deacon, Nicolas F. Martin, Hans-Walter
  Rix, Branimir Sesar, Colin T. Slater, Jorge Pe\~narrubia, Rosemary F. G.
  Wyse, William S. Burgett, Kenneth C. Chambers, Peter W. Draper, Klaus W.
  Hodapp, Nicholas Kaiser, Rolf-Peter Kudritzki, Eugene A. Magnier, Nigel
  Metcalfe, Jeffrey S. Morgan, Paul A. Price, John L. Tonry, Richard J.
  Wainscoat, Christopher Waters","Serendipitous Discovery of a Thin Stellar Stream near the Galactic Bulge
  in the Pan-STARRS1 3Pi Survey","5 pages, 3 figures. MNRAS, in press",,"10.1093/mnrasl/slu089",,"astro-ph.GA","http://arxiv.org/licenses/nonexclusive-distrib/1.0/","  We report the discovery of a thin stellar stream found in Pan-STARRS1
photometry near the Galactic bulge in the constellation of Ophiuchus. It
appears as a coherent structure in the colour-selected stellar density maps
produced to search for tidal debris around nearby globular clusters. The stream
is exceptionally short and narrow; it is about 2.5{\deg} long and 6' wide in
projection. The colour-magnitude diagram of this object, which harbours a blue
horizontal-branch, is consistent with an old and relatively metal-poor
population ([Fe/H]~-1.3) located 9.5 +/- 0.9 kpc away at (l,b) ~
(5{\deg},+32{\deg}), and 5.0 +/- 1.0 kpc from the Galactic centre. These
properties argue for a globular cluster as progenitor. The finding of such a
prominent, nearby stream suggests that many streams could await discovery in
the more densely populated regions of our Galaxy.
","[{""version"":""v1"",""created"":""Mon, 26 May 2014 17:12:28 GMT""},{""version"":""v2"",""created"":""Mon, 9 Jun 2014 17:27:49 GMT""}]","2015-06-19"
"1405.6646","S\'ergio Medeiros","Andr\'e Murbach Maidl, S\'ergio Medeiros, Fabio Mascarenhas, Roberto
  Ierusalimschy","Error Reporting in Parsing Expression Grammars","Preprint (plus appendix) submitted to Science of Computer Programming",,,,"cs.PL cs.FL","http://arxiv.org/licenses/nonexclusive-distrib/1.0/","  Parsing Expression Grammars (PEGs) describe top-down parsers. Unfortunately,
the error-reporting techniques used in conventional top-down parsers do not
directly apply to parsers based on Parsing Expression Grammars (PEGs), so they
have to be somehow simulated. While the PEG formalism has no account of
semantic actions, actual PEG implementations add them, and we show how to
simulate an error-reporting heuristic through these semantic actions.
  We also propose a complementary error reporting strategy that may lead to
better error messages: labeled failures. This approach is inspired by exception
handling of programming languages, and lets a PEG define different kinds of
failure, with each ordered choice operator specifying which kinds it catches.
Labeled failures give a way to annotate grammars for better error reporting, to
express some of the error reporting strategies used by deterministic parser
combinators, and to encode predictive top-down parsing in a PEG.
","[{""version"":""v1"",""created"":""Mon, 26 May 2014 17:14:52 GMT""},{""version"":""v2"",""created"":""Tue, 23 Feb 2016 13:24:53 GMT""},{""version"":""v3"",""created"":""Wed, 13 Jul 2016 15:33:47 GMT""}]","2016-07-14"
