"1405.6892","Yuriy Lomachuk","Anatoly V. Titov and Yuriy V. Lomachuk and Leonid V. Skripnikov","Concept of effective states of atoms in compounds to describe properties
  determined by the densities of valence electrons in atomic cores","10 pages, 2 figures","Phys. Rev. A 90, 052522 (2014)","10.1103/PhysRevA.90.052522",,"physics.chem-ph physics.atom-ph","http://arxiv.org/licenses/nonexclusive-distrib/1.0/","  A new approach for describing the effective electronic states of ""atoms in
compounds"" to study the properties of molecules and condensed matter which are
circumscribed by the operators heavily concentrated in atomic cores is
proposed. Among the properties are hyperfine structure, space parity (P) and
time reversal invariance (T) nonconservation effects, chemical shifts of x-ray
emission lines (XES), M\""{o}ssbauer effect, etc. Advantage of the approach is
that a good quantitative agreement of predicted and experimental data can be
attained even for such difficult cases as XES chemical shifts providing correct
quantum-mechanical interpretation of the experimental data. From computational
point of view the method can be quite efficient being implemented in the
framework of the relativistic pseudopotential theory [Int.J. Quantum Chem. 71,
359 (1999)] and procedures of recovering the wave functions in heavy-atom cores
[Int.J. Quantum Chem. 104, 223 (2005)] after a molecular, cluster or periodic
structure calculation performed on the basis of pseudoorbitals smoothed near
the nuclei within the pseudopotential approximation. We report results of our
studies of a number of atomic and molecular systems to demonstrate the
capabilities of the approach.
","[{""version"":""v1"",""created"":""Tue, 27 May 2014 12:51:42 GMT""},{""version"":""v2"",""created"":""Fri, 30 May 2014 11:25:03 GMT""},{""version"":""v3"",""created"":""Mon, 2 Jun 2014 13:21:42 GMT""},{""version"":""v4"",""created"":""Mon, 1 Dec 2014 03:02:37 GMT""}]","2014-12-02"
"1405.6893","Juho Lauri","Melissa Keranen, Juho Lauri","Computing Minimum Rainbow and Strong Rainbow Colorings of Block Graphs","13 pages, 3 figures","Discrete Mathematics & Theoretical Computer Science, Vol. 20 no.
  1, Graph Theory (June 4, 2018) dmtcs:4547","10.23638/DMTCS-20-1-22",,"cs.DM","http://arxiv.org/licenses/nonexclusive-distrib/1.0/","  A path in an edge-colored graph $G$ is rainbow if no two edges of it are
colored the same. The graph $G$ is rainbow-connected if there is a rainbow path
between every pair of vertices. If there is a rainbow shortest path between
every pair of vertices, the graph $G$ is strongly rainbow-connected. The
minimum number of colors needed to make $G$ rainbow-connected is known as the
rainbow connection number of $G$, and is denoted by $\text{rc}(G)$. Similarly,
the minimum number of colors needed to make $G$ strongly rainbow-connected is
known as the strong rainbow connection number of $G$, and is denoted by
$\text{src}(G)$. We prove that for every $k \geq 3$, deciding whether
$\text{src}(G) \leq k$ is NP-complete for split graphs, which form a subclass
of chordal graphs. Furthermore, there exists no polynomial-time algorithm for
approximating the strong rainbow connection number of an $n$-vertex split graph
with a factor of $n^{1/2-\epsilon}$ for any $\epsilon > 0$ unless P = NP. We
then turn our attention to block graphs, which also form a subclass of chordal
graphs. We determine the strong rainbow connection number of block graphs, and
show it can be computed in linear time. Finally, we provide a polynomial-time
characterization of bridgeless block graphs with rainbow connection number at
most 4.
","[{""version"":""v1"",""created"":""Tue, 27 May 2014 12:54:39 GMT""},{""version"":""v2"",""created"":""Wed, 21 Jan 2015 14:35:27 GMT""},{""version"":""v3"",""created"":""Thu, 5 Feb 2015 16:05:11 GMT""},{""version"":""v4"",""created"":""Wed, 17 Feb 2016 07:24:03 GMT""},{""version"":""v5"",""created"":""Thu, 18 May 2017 11:05:35 GMT""},{""version"":""v6"",""created"":""Wed, 21 Mar 2018 11:51:11 GMT""},{""version"":""v7"",""created"":""Fri, 25 May 2018 16:51:09 GMT""},{""version"":""v8"",""created"":""Mon, 28 May 2018 15:12:50 GMT""}]","2019-03-14"
"1405.6894","Wojciech Samotij","Wojciech Samotij and Benny Sudakov","On the number of monotone sequences","24 pages, 2 figures",,,,"math.CO","http://arxiv.org/licenses/nonexclusive-distrib/1.0/","  One of the most classical results in Ramsey theory is the theorem of
Erd\H{o}s and Szekeres from 1935, which says that every sequence of more than
$k^2$ numbers contains a monotone subsequence of length $k+1$. We address the
following natural question motivated by this result: Given integers $k$ and $n$
with $n \geq k^2+1$, how many monotone subsequences of length $k+1$ must every
sequence of $n$ numbers contain? We answer this question precisely for all
sufficiently large $k$ and $n \leq k^2 + c k^{3/2} / \log k$, where $c$ is some
absolute positive constant.
","[{""version"":""v1"",""created"":""Tue, 27 May 2014 12:55:00 GMT""}]","2014-05-28"
"1405.6895","Santabrata Das","Santabrata Das, Indranil Chattopadhyay, Anuj Nandi and Biplob Sarkar","On the possibilities of mass loss from an advective accretion disc
  around stationary black holes","7 pages, 1 figure, To appear in the Bulletin of the Astronomical
  Society of India",,,,"astro-ph.HE","http://arxiv.org/licenses/nonexclusive-distrib/1.0/","  We study the coupled disc-jet system around the black hole where the outflow
solutions are obtained in terms of the inflow parameters. We observe that an
advective accretion disc can eject outflows/jets for wide range of viscosity
parameter. However, such possibility is reduced if the cooling is active as the
energy dissipative process inside the disc. For mass outflow, we obtain the
parameter space spanned by the inflow angular momentum and the viscosity in
terms of cooling and quantify the limits of viscosity parameter.
","[{""version"":""v1"",""created"":""Tue, 27 May 2014 13:02:45 GMT""}]","2014-05-28"
"1405.6896","Dmitry Pikulin","Shuo Mi, D. I. Pikulin, M. Marciani, and C. W. J. Beenakker","X-shaped and Y-shaped Andreev resonance profiles in a superconducting
  quantum dot","Contribution for the JETP special issue in honor of A.F. Andreev's
  75th birthday. 9 pages, 8 figures","JETP 119, 1018-1027 (2014)","10.1134/S1063776114120176",,"cond-mat.supr-con cond-mat.mes-hall","http://arxiv.org/licenses/nonexclusive-distrib/1.0/","  The quasi-bound states of a superconducting quantum dot that is weakly
coupled to a normal metal appear as resonances in the Andreev reflection
probability, measured via the differential conductance. We study the evolution
of these Andreev resonances when an external parameter (such as magnetic field
or gate voltage) is varied, using a random-matrix model for the $N\times N$
scattering matrix. We contrast the two ensembles with broken time-reversal
symmetry, in the presence or absence of spin-rotation symmetry (class C or D).
The poles of the scattering matrix in the complex plane, encoding the center
and width of the resonance, are repelled from the imaginary axis in class C. In
class D, in contrast, a number $\propto\sqrt{N}$ of the poles has zero real
part. The corresponding Andreev resonances are pinned to the middle of the gap
and produce a zero-bias conductance peak that does not split over a range of
parameter values (Y-shaped profile), unlike the usual conductance peaks that
merge and then immediately split (X-shaped profile).
","[{""version"":""v1"",""created"":""Tue, 27 May 2014 13:03:41 GMT""},{""version"":""v2"",""created"":""Wed, 4 Jun 2014 14:07:12 GMT""}]","2015-01-14"
"1405.6897","Stefan Dittmaier","Stefan Dittmaier, Alexander Huss, Christian Schwinn","O(\alpha_s\alpha) corrections to Drell-Yan processes in the resonance
  region","9 pages, latex, postscript figures, contribution to the proceedings
  of the conference ""Loops and Legs in Quantum Field Theory - LL 2014, 27 April
  - 2 May 2014, Weimar, Germany, discussion of factorizable O(\alpha_s\alpha)
  corrections extended in version 2",,,"FR-PHENO-2014-005","hep-ph","http://arxiv.org/licenses/nonexclusive-distrib/1.0/","  Drell-Yan-like W-boson and Z-boson production in the resonance region allows
for some high-precision measurements that are crucial to carry experimental
tests of the Standard Model to the extremes, such as the determinations of the
W-boson mass and the effective weak mixing angle. We describe how the Standard
Model prediction can be successfully performed in terms of a consistent
expansion about the resonance pole, which classifies the corrections in terms
of factorizable and non-factorizable contributions. The former can be
attributed to the W/Z production and decay subprocesses individually, while the
latter link production and decay by soft-photon exchange. At next-to-leading
order we compare the full electroweak corrections with the pole-expanded
approximations, confirming the validity of the approximation. At
O(\alpha_s\alpha), we describe the concept of the expansion and report on
results on the non-factorizable contributions, which turn out to be
phenomenologically negligible. Moreover, we present first (preliminary) results
on the dominant factorizable O(\alpha_s\alpha) corrections, which originate
from the interplay of initial-state QCD and final-state electroweak
corrections. Numerically those corrections significantly differ from a mere
product of the two next-to-leading-order correction factors.
","[{""version"":""v1"",""created"":""Tue, 27 May 2014 13:03:55 GMT""},{""version"":""v2"",""created"":""Mon, 14 Jul 2014 16:25:06 GMT""}]","2014-07-15"
"1405.6898","Andres Felipe Santander-Syro","T. C. R\""odel, C. Bareille, F. Fortuna, C. Baumier, F. Bertran, P. Le
  F\`evre, M. Gabay, O. Hijano Cubelos, M. J. Rozenberg, T. Maroutian, P.
  Lecoeur, and A. F. Santander-Syro","Orientational tuning of the Fermi sea of confined electrons at the
  SrTiO3 (110) and (111) surfaces","Accepted for publication as a Letter in Physical Review Applied","Phys. Rev. Applied 1, 051002 (2014)","10.1103/PhysRevApplied.1.051002",,"cond-mat.mtrl-sci","http://arxiv.org/licenses/nonexclusive-distrib/1.0/","  We report the existence of confined electronic states at the (110) and (111)
surfaces of SrTiO3. Using angle-resolved photoemission spectroscopy, we find
that the corresponding Fermi surfaces, subband masses, and orbital ordering are
different from the ones at the (001) surface of SrTiO3. This occurs because the
crystallographic symmetries of the surface and sub-surface planes, and the
electron effective masses along the confinement direction, influence the
symmetry of the electronic structure and the orbital ordering of the t2g
manifold. Remarkably, our analysis of the data also reveals that the carrier
concentration and thickness are similar for all three surface orientations,
despite their different polarities. The orientational tuning of the microscopic
properties of two-dimensional electron states at the surface of SrTiO3 echoes
the tailoring of macroscopic (e.g. transport) properties reported recently in
LaAlO3/SrTiO3 (110) and (111) interfaces, and is promising for searching new
types of 2D electronic states in correlated-electron oxides.
","[{""version"":""v1"",""created"":""Tue, 27 May 2014 13:15:27 GMT""}]","2014-06-20"
"1405.6899","Piotr Ka\'zmierczak","Truls Pedersen, Sjur Dyrkolbotn and Piotr Ka\'zmierczak","Big, but not unruly: Tractable norms for anonymous game structures","Accepted at COIN@PRIMA 2013 workshop and presented on December 3rd,
  2013 in Dunedin, New Zealand. http://coin2013-prima.tudelft.nl/",,,,"cs.MA cs.LO","http://arxiv.org/licenses/nonexclusive-distrib/1.0/","  We present a new strategic logic NCHATL that allows for reasoning about norm
compliance on concurrent game structures that satisfy anonymity. We represent
such game structures compactly, avoiding models that have exponential size in
the number of agents. Then we show that model checking can be done in
polynomial time with respect to this compact representation, even for normative
systems that are not anonymous. That is, as long as the underlying game
structures are anonymous, model checking normative formulas is tractable even
if norms can prescribe different sets of forbidden actions to different agents.
","[{""version"":""v1"",""created"":""Tue, 27 May 2014 13:15:48 GMT""}]","2014-05-28"
"1405.6900","C\'ecile Chauvel","C\'ecile Chauvel and John O'Quigley","Survival model construction guided by fit and predictive strength","30 pages, 6 figures, 3 tables",,,,"stat.ME stat.AP","http://creativecommons.org/licenses/by/3.0/","  We describe a unified framework within which we can build survival models.
The motivation for this work comes from a study on the prediction of relapse
among breast cancer patients treated at the Curie Institute in Paris, France.
Our focus is on how to best code, or characterize, the effects of the
variables, either alone or in combination with others. We consider simple
graphical techniques that not only provide an immediate indication as to the
goodness of fit but, in cases of departure from model assumptions, point in the
direction of a more involved alternative model. These techniques help support
our intuition. This intuition is backed up by formal theorems that underlie the
process of building richer models from simpler ones. Goodness-of-fit techniques
are used alongside measures of predictive strength and, again, formal theorems
show that these measures can be used to help identify models closest to the
unknown non-proportional hazards mechanism that we can suppose generates the
observations. We consider many examples and show how these tools can be of help
in guiding the practical problem of efficient model construction for survival
data.
","[{""version"":""v1"",""created"":""Tue, 27 May 2014 13:16:30 GMT""}]","2014-05-28"
"1405.6901","Daisuke Nakauchi","Daisuke Nakauchi, Kohei Inayoshi, Kazuyuki Omukai","Conditions for HD Cooling in the First Galaxies Revisited: Interplay
  between Far-Ultraviolet and Cosmic Ray Feedback in Population III Star
  Formation","15 pages, 12 figures, 1 table, accepted for publication in MNRAS",,"10.1093/mnras/stu1042",,"astro-ph.GA astro-ph.CO","http://arxiv.org/licenses/nonexclusive-distrib/1.0/","  HD dominates the cooling of primordial clouds with enhanced ionization, e.g.
shock-heated clouds in structure formation or supernova remnants, relic HII
regions of Pop III stars, and clouds with cosmic-ray (CR) irradiation. There,
the temperature decreases to several 10 K and the characteristic stellar mass
decreases to $\sim 10\ {\rm M}_{\odot}$, in contrast with first stars formed
from undisturbed pristine clouds ($\sim 100\ {\rm M}_{\odot}$). However,
without CR irradiation, even weak far ultra-violet (FUV) irradiation suppresses
HD formation/cooling. Here, we examine conditions for HD cooling in primordial
clouds including both FUV and CR feedback. At the beginning of collapse, the
shock-compressed gas cools with its density increasing, while the relic HII
region gas cools at a constant density. Moreover, shocks tend to occur in
denser environments than HII regions. Owing to the higher column density and
the more effective shielding, the critical FUV intensity for HD cooling in a
shock-compressed gas becomes $\sim 10$ times higher than in relic HII regions.
Consequently, in the shock-compressed gas, the critical FUV intensity exceeds
the background level for most of the redshift we consider ($6 \lesssim z
\lesssim 15$), while in relic HII regions, HD cooling becomes effective after
the CR intensity increases enough at $z \lesssim 10$. Our result suggests that
less massive ($\sim 10\ {\rm M}_{\odot}$) Pop III stars may be more common than
previously considered and could be the dominant population of Pop III stars.
","[{""version"":""v1"",""created"":""Tue, 27 May 2014 13:17:32 GMT""}]","2015-06-19"
"1405.6902","Keshava Prasad Halemane","Keshava Prasad Halemane","Unbelievable $O(L^{1.5})$ worst case computational complexity achieved
  by $spdspds$ algorithm for linear programming problem","22 pages, 7 figures","KREC Research Bulletin (ISSN-0971-3603) Vol.9, No.1, June 2000,
  pp16-26",,"NITK-Res-Bull_ISSN0972-6985_Vol20_No1_JUL2011_pp62-80","math.OC","http://arxiv.org/licenses/nonexclusive-distrib/1.0/","  The Symmetric Primal-Dual Symplex Pivot Decision Strategy (spdspds) is a
novel iterative algorithm to solve linear programming problems. Here, a symplex
pivoting operation is considered simply as an exchange between a basic
(dependent) variable and a non-basic (independent) variable, in the Tucker's
Compact Symmetric Tableau (CST) which is a unique symmetric representation
common to both the primal as well as the dual of a linear programming problem
in its standard canonical form. From this viewpoint, the classical simplex
pivoting operation of Dantzig may be considered as a restricted special case.
  The infeasibility index associated with a symplex tableau is defined as the
sum of the number of primal variables and the number of dual variables, which
are infeasible. A measure of goodness as a global effectiveness measure of a
pivot selection is defined/determined as/by the decrease in the infeasibility
index associated with such a pivot selection. At each iteration the selection
of the symplex pivot element is governed by the anticipated decrease in the
infeasibility index - seeking the best possible decrease in the infeasibility
index - from among a wide range of candidate choices with non-zero values -
limited only by considerations of potential numerical instability. The
algorithm terminates when further reduction in the infeasibility index is not
possible; then the tableau is checked for the terminal tableau type to
facilitate the problem classification - a termination with an infeasibility
index of zero indicates optimum solution. The worst case computational
complexity of spdspds is shown to be $O(L^{1.5})$.
","[{""version"":""v1"",""created"":""Tue, 27 May 2014 13:19:02 GMT""},{""version"":""v10"",""created"":""Mon, 17 Feb 2020 01:33:46 GMT""},{""version"":""v11"",""created"":""Mon, 18 May 2020 17:14:15 GMT""},{""version"":""v12"",""created"":""Mon, 1 Jun 2020 06:07:21 GMT""},{""version"":""v13"",""created"":""Wed, 1 Jul 2020 06:27:14 GMT""},{""version"":""v14"",""created"":""Sat, 1 Aug 2020 04:06:02 GMT""},{""version"":""v15"",""created"":""Tue, 1 Sep 2020 01:17:11 GMT""},{""version"":""v16"",""created"":""Wed, 7 Oct 2020 09:41:04 GMT""},{""version"":""v17"",""created"":""Sun, 1 Nov 2020 03:14:07 GMT""},{""version"":""v18"",""created"":""Tue, 1 Dec 2020 03:54:13 GMT""},{""version"":""v19"",""created"":""Sat, 20 Feb 2021 15:25:18 GMT""},{""version"":""v2"",""created"":""Tue, 8 Oct 2019 15:19:47 GMT""},{""version"":""v20"",""created"":""Sat, 13 Mar 2021 09:32:52 GMT""},{""version"":""v21"",""created"":""Thu, 2 Dec 2021 08:21:41 GMT""},{""version"":""v22"",""created"":""Tue, 1 Feb 2022 03:42:46 GMT""},{""version"":""v23"",""created"":""Mon, 21 Feb 2022 14:53:29 GMT""},{""version"":""v24"",""created"":""Wed, 10 Aug 2022 05:04:30 GMT""},{""version"":""v3"",""created"":""Thu, 10 Oct 2019 14:10:10 GMT""},{""version"":""v4"",""created"":""Mon, 14 Oct 2019 09:15:54 GMT""},{""version"":""v5"",""created"":""Wed, 16 Oct 2019 11:44:46 GMT""},{""version"":""v6"",""created"":""Tue, 22 Oct 2019 03:48:09 GMT""},{""version"":""v7"",""created"":""Mon, 30 Dec 2019 09:46:27 GMT""},{""version"":""v8"",""created"":""Sun, 5 Jan 2020 05:09:45 GMT""},{""version"":""v9"",""created"":""Sun, 2 Feb 2020 14:07:16 GMT""}]","2022-08-11"
"1405.6903","Scott Aaronson","Scott Aaronson and Sean M. Carroll and Lauren Ouellette","Quantifying the Rise and Fall of Complexity in Closed Systems: The
  Coffee Automaton","22 pages, lots of figures",,,"CALT-68-2927","cond-mat.stat-mech gr-qc nlin.CG","http://arxiv.org/licenses/nonexclusive-distrib/1.0/","  In contrast to entropy, which increases monotonically, the ""complexity"" or
""interestingness"" of closed systems seems intuitively to increase at first and
then decrease as equilibrium is approached. For example, our universe lacked
complex structures at the Big Bang and will also lack them after black holes
evaporate and particles are dispersed. This paper makes an initial attempt to
quantify this pattern. As a model system, we use a simple, two-dimensional
cellular automaton that simulates the mixing of two liquids (""coffee"" and
""cream""). A plausible complexity measure is then the Kolmogorov complexity of a
coarse-grained approximation of the automaton's state, which we dub the
""apparent complexity."" We study this complexity measure, and show analytically
that it never becomes large when the liquid particles are non-interacting. By
contrast, when the particles do interact, we give numerical evidence that the
complexity reaches a maximum comparable to the ""coffee cup's"" horizontal
dimension. We raise the problem of proving this behavior analytically.
","[{""version"":""v1"",""created"":""Tue, 27 May 2014 13:21:57 GMT""}]","2014-05-28"
"1405.6904","Nathan Reading","Nathan Reading","Noncrossing arc diagrams and canonical join representations","16 pages, 7 figures. Version 2: Changes only in Section 4. Now
  mentioning several more immediate consequences of the results, including the
  most general pattern-avoidance description of lattice quotients of the weak
  order on permutations. Version 3: Added figure showing the canonical join
  complex for S_4. Other very minor changes. Version 4: Minor expository
  changes",,,,"math.CO","http://arxiv.org/licenses/nonexclusive-distrib/1.0/","  We consider two problems that appear at first sight to be unrelated. The
first problem is to count certain diagrams consisting of noncrossing arcs in
the plane. The second problem concerns the weak order on the symmetric group.
Each permutation $x$ has a canonical join representation: a unique lowest set
of permutations joining to $x$. The second problem is to determine which sets
of permutations appear as canonical join representations. The two problems turn
out to be closely related because the noncrossing arc diagrams provide a
combinatorial model for canonical join representations. The same considerations
apply to more generally to lattice quotients of the weak order. Considering
quotients produces, for example, a new combinatorial object counted by the
Baxter numbers and an analogous new object in bijection with generic
rectangulations.
","[{""version"":""v1"",""created"":""Tue, 27 May 2014 13:24:02 GMT""},{""version"":""v2"",""created"":""Wed, 4 Jun 2014 12:51:05 GMT""},{""version"":""v3"",""created"":""Tue, 10 Jun 2014 12:41:34 GMT""},{""version"":""v4"",""created"":""Thu, 8 Jan 2015 22:09:25 GMT""}]","2015-01-12"
"1405.6905","Jean-David Fermanian","Jean-David Fermanian, Hassan Malongo","On the stationarity of Dynamic Conditional Correlation models","Revised version: correction of typos, reduction of the number of
  figures, etc",,,,"q-fin.MF math.ST stat.TH","http://arxiv.org/licenses/nonexclusive-distrib/1.0/","  We provide conditions for the existence and the unicity of strictly
stationary solutions of the usual Dynamic Conditional Correlation GARCH models
(DCC-GARCH). The proof is based on Tweedie's (1988) criteria, after having
rewritten DCC-GARCH models as nonlinear Markov chains. Moreover, we study the
existence of their finite moments.
","[{""version"":""v1"",""created"":""Tue, 27 May 2014 13:37:03 GMT""},{""version"":""v2"",""created"":""Tue, 29 Mar 2016 09:21:49 GMT""}]","2016-03-30"
"1405.6906","Yong-Chang Huang","Meng Sun and Yong-Chang Huang","Kerr Black string flow","14 pages, 3 figures","Nucl. Phys,, B897(2015)98","10.1016/j.nuclphysb.2015.05.017","ITP No.04 BJUT","hep-th","http://arxiv.org/licenses/nonexclusive-distrib/1.0/","  We give a general theory of a rotated black string stream into a rotational
horizon in dimension D=5. It is a configuration about one smooth intersection
between these two objects when the spacetime is axisymmetric and in the limit
that the thickness of the black hole is much larger than the thickness of the
black string. Following this configuration we extend to a more general
situation, the rotational charged flows.
","[{""version"":""v1"",""created"":""Tue, 27 May 2014 13:39:40 GMT""},{""version"":""v2"",""created"":""Wed, 28 May 2014 12:37:41 GMT""},{""version"":""v3"",""created"":""Thu, 14 Aug 2014 15:04:50 GMT""},{""version"":""v4"",""created"":""Mon, 18 Aug 2014 12:58:57 GMT""},{""version"":""v5"",""created"":""Sat, 13 Jun 2015 16:42:30 GMT""}]","2015-12-09"
"1405.6907","Sibo Zheng","Sibo Zheng","Perturbative $\lambda$-Supersymmetry and Small $\kappa$-Phenomenology","Revtex, 7 pages; v4: new U(1) model proposed, journal version","Eur. Phys. J. C75 (2015) 195","10.1140/epjc/s10052-015-3416-7",,"hep-ph","http://creativecommons.org/licenses/by/3.0/","  For the minimal $\lambda$-supersymmetry, it stays perturbative to the GUT
scale for $\lambda \leq 0.7$. This upper bound is relaxed when one either takes
the criteria that all couplings close to $\sim 4\pi$ for non-perturbation or
allows new fields at the intermediate scale between the weak and GUT scale. We
show that a hidden $U(1)_X$ gauge sector with spontaneously broken scale
$\sim10$ TeV improves this bound as $\lambda\leq1.23$ instead. This may induce
significant effects on Higgs physics such as decreasing fine tuning involving
the Higgs scalar mass, as well as on the small $\kappa$-phenomenology.
","[{""version"":""v1"",""created"":""Tue, 27 May 2014 13:47:15 GMT""},{""version"":""v2"",""created"":""Mon, 25 Aug 2014 09:59:59 GMT""},{""version"":""v3"",""created"":""Sat, 7 Feb 2015 06:41:47 GMT""},{""version"":""v4"",""created"":""Fri, 17 Apr 2015 15:16:23 GMT""}]","2015-05-08"
