"1405.6712","Christoph Sieg","Jan Fokken, Christoph Sieg, Matthias Wilhelm","A piece of cake: the ground-state energies in gamma_i-deformed N=4 SYM
  theory","21 pages, LaTeX, BibTeX, pstricks, feynmp","JHEP 09 (2014) 078","10.1007/JHEP09(2014)078","HU-MATH-2014-07, HU-EP-14/15","hep-th","http://arxiv.org/licenses/nonexclusive-distrib/1.0/","  In the non-supersymmetric gamma_i-deformed N=4 SYM theory, the scaling
dimensions of the operators tr[Z^L] composed of L scalar fields Z receive
finite-size wrapping and prewrapping corrections in the 't Hooft limit. In this
paper, we calculate these scaling dimensions to leading wrapping order directly
from Feynman diagrams. For L>=3, the result is proportional to the maximally
transcendental `cake' integral. It matches with an earlier result obtained from
the integrability-based Luescher corrections, TBA and Y-system equations. At
L=2, where the integrability-based equations yield infinity, we find a finite
rational result. This result is renormalization-scheme dependent due to the
non-vanishing beta-function of an induced quartic scalar double-trace coupling,
on which we have reported earlier. This explicitly shows that conformal
invariance is broken - even in the 't Hooft limit.
","[{""version"":""v1"",""created"":""Mon, 26 May 2014 20:00:03 GMT""}]","2022-08-24"
"1405.6713","Francisco Villaescusa-Navarro","Francisco Villaescusa-Navarro, Matteo Viel, Kanan K. Datta, T. Roy
  Choudhury","Modeling the neutral hydrogen distribution in the post-reionization
  Universe: intensity mapping","46 pages, 21 figures; published on JCAP","JCAP09(2014)050","10.1088/1475-7516/2014/09/050",,"astro-ph.CO","http://arxiv.org/licenses/nonexclusive-distrib/1.0/","  We model the distribution of neutral hydrogen (HI) in the post-reionization
era and investigate its detectability in 21 cm intensity mapping with the
future SKA radio telescope. We rely on high resolution hydrodynamical N-body
simulations. The HI is assigned a-posteriori to the gas particles following two
different approaches: a halo-based method in which HI is assigned only to gas
particles residing within dark matter halos; a particle-based method that
assigns HI to all gas particles using a prescription based on the physical
properties of the particles. The HI statistical properties are then compared to
the observational properties of Damped Lyman-$\alpha$ Absorbers (DLAs) and of
lower column density systems and reasonable good agreement is found for all the
cases. Among the halo-based method, we further consider two different schemes
that aim at reproducing the observed properties of DLAs by distributing HI
inside halos: one of this results in a much higher bias for DLAs, in agreement
with recent observations, which boosts the 21 cm power spectrum by a factor
$\sim 4$ with respect to the other recipe. We compute the 21 cm power spectrum
from the simulated HI distribution and calculate the expected signal for both
SKA1-mid and SKA1-low configurations at $2.4 \leq z \leq 4$. We find that SKA
will be able to detect the 21 cm power spectrum, in the non-linear regime, up
to $k\sim 1\,h$/Mpc for SKA1-mid and $k\sim 5\,h$/Mpc for SKA1-low with 100
hours of observations. We also investigate the perspective of imaging the HI
distribution. Our findings indicate that SKA1-low could detect the most massive
HI peaks with a signal to noise ratio (SNR) higher than 5 for an observation
time of about 1000 hours at $z=4$, for a synthesized beam width of $2'$.
Detection at redshifts $z\geqslant2.4$ with SKA1-mid would instead require a
much longer observation time to achieve a comparable SNR level.
","[{""version"":""v1"",""created"":""Mon, 26 May 2014 20:00:05 GMT""},{""version"":""v2"",""created"":""Mon, 27 Oct 2014 17:17:04 GMT""}]","2015-06-19"
"1405.6714","Junya Yagi","Junya Yagi","\Omega-deformation and quantization","24 pages. v2: minor changes, references added; v3: minor changes, a
  reference added, published version","JHEP08(2014)112","10.1007/JHEP08(2014)112","SISSA 31/2014/FISI","hep-th","http://arxiv.org/licenses/nonexclusive-distrib/1.0/","  We formulate a deformation of Rozansky-Witten theory analogous to the
$\Omega$-deformation. It is applicable when the target space $X$ is
hyperk\""ahler and the spacetime is of the form $\mathbb{R} \times \Sigma$, with
$\Sigma$ being a Riemann surface. In the case that $\Sigma$ is a disk, the
$\Omega$-deformed Rozansky-Witten theory quantizes a symplectic submanifold of
$X$, thereby providing a new perspective on quantization. As applications, we
elucidate two phenomena in four-dimensional gauge theory from this point of
view. One is a correspondence between the $\Omega$-deformation and quantization
of integrable systems. The other concerns supersymmetric loop operators and
quantization of the algebra of holomorphic functions on a hyperk\""ahler
manifold.
","[{""version"":""v1"",""created"":""Mon, 26 May 2014 20:00:05 GMT""},{""version"":""v2"",""created"":""Mon, 9 Jun 2014 09:56:41 GMT""},{""version"":""v3"",""created"":""Sat, 30 Aug 2014 17:10:24 GMT""}]","2014-09-02"
"1405.6715","Xiaopeng Li","Xiaopeng Li, Stefan S. Natu, Arun Paramekanti and S. Das Sarma","Chiral spin superfluidity and spontaneous spin Hall effect of
  interacting bosons","7+4 pages, 6 figures","Nature Communications 5:5174 (2014)","10.1038/ncomms6174",,"cond-mat.quant-gas cond-mat.str-el","http://arxiv.org/licenses/nonexclusive-distrib/1.0/","  Recent experiments on ultracold atoms in optical lattices have synthesized a
variety of tunable bands with degenerate double-well structures in momentum
space. Such degeneracies in the single particle spectrum strongly enhance
quantum fluctuations, and may lead to exotic many-body ground states. Here we
consider weakly interacting spinor Bose gases in such bands, and discover a
universal quantum ""order by disorder"" phenomenon which selects a novel chiral
spin superfluid with remarkable properties such as spontaneous anomalous spin
Hall effect and momentum space antiferromagnetism. For bosons in the excited
Dirac band of a hexagonal lattice, such a state supports staggered spin loop
currents in real space. We show that Bloch oscillations provide a powerful
dynamical route to quantum state preparation of such a chiral spin superfluid.
Our predictions can be readily tested in spin resolved time-of-flight
experiments.
","[{""version"":""v1"",""created"":""Mon, 26 May 2014 20:00:06 GMT""}]","2014-10-13"
"1405.6716","Matthew Cahill-Rowley","Matthew Cahill-Rowley, Randy Cotta, Alex Drlica-Wagner, Stefan Funk,
  JoAnne Hewett, Ahmed Ismail, Tom Rizzo, Matthew Wood","Complementarity of Dark Matter Searches in the pMSSM","36 pages, 17 figures. arXiv admin note: substantial text overlap with
  arXiv:1305.6921","Phys. Rev. D 91, 055011 (2015)","10.1103/PhysRevD.91.055011","SLAC-PUB-15862","hep-ph","http://arxiv.org/licenses/nonexclusive-distrib/1.0/","  As is well known, the search for and eventual identification of dark matter
in supersymmetry requires a simultaneous, multi-pronged approach with important
roles played by the LHC as well as both direct and indirect dark matter
detection experiments. We examine the capabilities of these approaches in the
19-parameter p(henomenological)MSSM which provides a general framework for
complementarity studies of neutralino dark matter. We summarize the sensitivity
of dark matter searches at the 7, 8 (and eventually 14) TeV LHC, combined with
those by \Fermi, CTA, IceCube/DeepCore, COUPP, LZ and XENON. The strengths and
weaknesses of each of these techniques are examined and contrasted and their
interdependent roles in covering the model parameter space are discussed in
detail. We find that these approaches explore orthogonal territory and that
advances in each are necessary to cover the Supersymmetric WIMP parameter
space. We also find that different experiments have widely varying
sensitivities to the various dark matter annihilation mechanisms, some of which
would be completely excluded by null results from these experiments.
","[{""version"":""v1"",""created"":""Mon, 26 May 2014 20:00:12 GMT""}]","2015-03-18"
"1405.6717","Sarang Gopalakrishnan","Sarang Gopalakrishnan, Colin V. Parker, Eugene Demler","Mobile magnetic impurities in a Fermi superfluid: a route to designer
  molecules","5pp., 4 figures, plus appendix","Phys. Rev. Lett. 114, 045301 (2015)","10.1103/PhysRevLett.114.045301",,"cond-mat.quant-gas cond-mat.mes-hall cond-mat.supr-con quant-ph","http://arxiv.org/licenses/nonexclusive-distrib/1.0/","  A magnetic impurity in a fermionic superfluid hosts bound quasiparticle
states known as Yu-Shiba-Rusinov (YSR) states. We argue here that, if the
impurity is mobile (i.e., has a finite mass), the impurity and its bound YSR
quasiparticle move together as a midgap molecule, which has an unusual
""Mexican-hat"" dispersion that is tunable via the fermion density. We map out
the impurity dispersion, which consists of an ""atomic"" branch (in which the
impurity is dressed by quasiparticle pairs) and a ""molecular"" branch (in which
the impurity binds a quasiparticle). We discuss the experimental realization
and detection of midgap Shiba molecules, focusing on lithium-cesium mixtures,
and comment on the prospects they offer for realizing exotic many-body states.
","[{""version"":""v1"",""created"":""Mon, 26 May 2014 20:00:15 GMT""},{""version"":""v2"",""created"":""Sun, 8 Mar 2015 16:47:51 GMT""}]","2015-03-10"
"1405.6718","Tyler Desjardins","Tyler D. Desjardins, Sarah C. Gallagher, Ann E. Hornschemeier, John S.
  Mulchaey, Lisa May Walker, William N. Brandt, Jane C. Charlton, Kelsey E.
  Johnson, Panayiotis Tzanavaris","Some Like It Hot: Linking Diffuse X-ray Luminosity, Baryonic Mass, and
  Star Formation Rate in Compact Groups of Galaxies","20 pages, 7 figures, accepted for publication in ApJ",,"10.1088/0004-637X/790/2/132",,"astro-ph.HE astro-ph.CO astro-ph.GA","http://arxiv.org/licenses/nonexclusive-distrib/1.0/","  We present an analysis of the diffuse X-ray emission in 19 compact groups of
galaxies (CGs) observed with Chandra. The hottest, most X-ray luminous CGs
agree well with the galaxy cluster X-ray scaling relations in $L_X-T$ and
$L_X-\sigma$, even in CGs where the hot gas is associated with only the
brightest galaxy. Using Spitzer photometry, we compute stellar masses and
classify HCGs 19, 22, 40, and 42 and RSCGs 32, 44, and 86 as fossil groups
using a new definition for fossil systems that includes a broader range of
masses. We find that CGs with total stellar and HI masses $\gtrsim10^{11.3}$
M$_\odot$ are often X-ray luminous, while lower-mass CGs only sometimes exhibit
faint, localized X-ray emission. Additionally, we compare the diffuse X-ray
luminosity against both the total UV and 24 $\mu$m star formation rates of each
CG and optical colors of the most massive galaxy in each of the CGs. The most
X-ray luminous CGs have the lowest star formation rates, likely because there
is no cold gas available for star formation, either because the majority of the
baryons in these CGs are in stars or the X-ray halo, or due to gas stripping
from the galaxies in CGs with hot halos. Finally, the optical colors that trace
recent star formation histories of the most massive group galaxies do not
correlate with the X-ray luminosities of the CGs, indicating that perhaps the
current state of the X-ray halos is independent of the recent history of
stellar mass assembly in the most massive galaxies.
","[{""version"":""v1"",""created"":""Mon, 26 May 2014 20:00:16 GMT""}]","2015-06-19"
"1405.6719","Natalie Hinkel","Natalie R. Hinkel, F.X. Timmes, Patrick A. Young, Michael D. Pagano,
  Margaret C. Turnbull","Stellar Abundances in the Solar Neighborhood: The Hypatia Catalog","66pgs, 32 figures, 6 tables, accepted for publication in the
  Astronomical Journal",,"10.1088/0004-6256/148/3/54",,"astro-ph.SR","http://arxiv.org/licenses/nonexclusive-distrib/1.0/","  We compile spectroscopic abundance data from 84 literature sources for 50
elements across 3058 stars in the solar neighborhood, within 150 pc of the Sun,
to produce the Hypatia Catalog. We evaluate the variability of the spread in
abundance measurements reported for the same star by different surveys. We also
explore the likely association of the star within the Galactic disk, the
corresponding observation and abundance determination methods for all catalogs
in Hypatia, the influence of specific catalogs on the overall abundance trends,
and the effect of normalizing all abundances to the same solar scale. The
resulting large number of stellar abundance determinations in the Hypatia
Catalog are analyzed only for thin-disk stars with observations that are
consistent between literature sources. As a result of our large dataset, we
find that the stars in the solar neighborhood may be reveal an asymmetric
abundance distribution, such that a [Fe/H]-rich group near to the mid-plane is
deficient in Mg, Si, S, Ca, Sc II, Cr II, and Ni as compared to stars further
from the plane. The Hypatia Catalog has a wide number of applications,
including exoplanet hosts, thick and thin disk stars, or stars with different
kinematic properties.
","[{""version"":""v1"",""created"":""Mon, 26 May 2014 20:00:16 GMT""}]","2015-06-19"
"1405.6720","Ben Stefanek","Yang Bai and Ben A. Stefanek","Natural Milli-Charged Inflation","5 pages, 3 figures","Phys. Rev. D 91, 096012 (2015)","10.1103/PhysRevD.91.096012",,"hep-ph hep-th","http://arxiv.org/licenses/nonexclusive-distrib/1.0/","  We construct a natural inflation model with the inflaton as a linear
combination of the fifth components of Abelian gauge fields in a
five-dimensional theory. A seesaw mechanism is introduced to provide a natural
milli-charge for matter fields under one combination of the gauge symmetries.
As a result, the effective decay constant of the inflaton field can be above
the Planck scale with all scales in the model below the Planck scale. Our model
predicts a tensor-to-scalar ratio r between 0.033 and 0.125 for sixty e-folds
and a reheating temperature of a few 10^11 GeV.
","[{""version"":""v1"",""created"":""Mon, 26 May 2014 20:00:16 GMT""}]","2015-06-03"
"1405.6721","Adrian M. Price-Whelan","Adrian M. Price-Whelan, David W. Hogg, Kathryn V. Johnston, David
  Hendel","Inferring the gravitational potential of the Milky Way with a few
  precisely measured stars","30 pages, 12 figures, submitted to ApJ",,"10.1088/0004-637X/794/1/4",,"astro-ph.GA","http://arxiv.org/licenses/nonexclusive-distrib/1.0/","  The dark matter halo of the Milky Way is expected to be triaxial and filled
with substructure. It is hoped that streams or shells of stars produced by
tidal disruption of stellar systems will provide precise measures of the
gravitational potential to test these predictions. We develop a method for
inferring the Galactic potential with tidal streams based on the idea that the
stream stars were once close in phase space. Our method can flexibly adapt to
any form for the Galactic potential: it works in phase-space rather than
action-space and hence relies neither on our ability to derive actions nor on
the integrability of the potential. Our model is probabilistic, with a
likelihood function and priors on the parameters. The method can properly
account for finite observational uncertainties and missing data dimensions. We
test our method on synthetic datasets generated from N-body simulations of
satellite disruption in a static, multi-component Milky Way including a
triaxial dark matter halo with observational uncertainties chosen to mimic
current and near-future surveys of various stars. We find that with just four
well-measured stream stars, we can infer properties of a triaxial potential
with precisions of order 5-7 percent. Without proper motions we obtain 15
percent constraints on potential parameters and precisions around 25 percent
for recovering missing phase-space coordinates. These results are encouraging
for the eventual goal of using flexible, time-dependent potential models
combined with larger data sets to unravel the detailed shape of the dark matter
distribution around the Milky Way.
","[{""version"":""v1"",""created"":""Mon, 26 May 2014 20:00:16 GMT""}]","2015-06-19"
"1405.6722","Wouter Waalewijn","Iain W. Stewart, Frank J. Tackmann, Wouter J. Waalewijn","Dissecting Soft Radiation with Factorization","11 pages, 11 figures, v2: PRL version, text rearranged","Phys. Rev. Lett. 114, 092001 (2015)","10.1103/PhysRevLett.114.092001","MIT-CTP 4530, DESY 14-008, NIKHEF 2014-002","hep-ph hep-ex nucl-th","http://arxiv.org/licenses/nonexclusive-distrib/1.0/","  An essential part of high-energy hadronic collisions is the soft hadronic
activity that underlies the primary hard interaction. It includes soft
radiation from the primary hard partons, secondary multiple parton interactions
(MPI), and factorization-violating effects. The invariant mass spectrum of the
leading jet in $Z$+jet and $H$+jet events is directly sensitive to these
effects, and we use a QCD factorization theorem to predict its dependence on
the jet radius $R$, jet $p_T$, jet rapidity, and partonic process for both the
perturbative and nonperturbative components of primary soft radiation. We prove
that the nonperturbative contributions involve only odd powers of $R$, and the
linear $R$ term is universal for quark and gluon jets. The hadronization model
in PYTHIA8 agrees well with these properties. The perturbative soft initial
state radiation (ISR) has a contribution that depends on the jet area in the
same way as the underlying event, but this degeneracy is broken by dependence
on the jet $p_T$. The size of this soft ISR contribution is proportional to the
color state of the initial partons, yielding the same positive contribution for
$gg\to Hg$ and $gq\to Zq$, but a negative interference contribution for $q\bar
q\to Z g$. Hence, measuring these dependencies allows one to separate
hadronization, soft ISR, and MPI contributions in the data.
","[{""version"":""v1"",""created"":""Mon, 26 May 2014 20:00:16 GMT""},{""version"":""v2"",""created"":""Tue, 10 Feb 2015 19:33:37 GMT""}]","2015-03-11"
"1405.6723","Adam Falkowski","Yi Chen, Adam Falkowski, Ian Low, Roberto Vega-Morales","New Observables for CP Violation in Higgs Decays","11 pages; v2: minor corrections, references added",,"10.1103/PhysRevD.90.113006","LPT Orsay 14-25","hep-ph hep-ex","http://arxiv.org/licenses/nonexclusive-distrib/1.0/","  Current experimental data on the 125 GeV Higgs boson still allow room for
large CP violation. The observables usually considered in this context are
triple product asymmetries, which require an input of four visible particles
after imposing momentum conservation. We point out a new class of CP violating
observables in Higgs physics which require only three reconstructed momenta.
They may arise if the process involves an interference of amplitudes with
different intermediate particles, which provide distinct strong phases in the
form of the Breit-Wigner widths, in addition to possible weak phases that arise
from CP violating couplings of the Higgs in the Lagrangian. As an example, we
propose a forward-backward asymmetry of the charged lepton in the three-body
Higgs decay, $h\to \ell^-\ell^+ \gamma$, as a probe for CP-violating Higgs
couplings to $Z\gamma$ and $\gamma\gamma$ pairs. Other processes exhibiting
this type of CP-violation are also discussed.
","[{""version"":""v1"",""created"":""Mon, 26 May 2014 20:00:17 GMT""},{""version"":""v2"",""created"":""Thu, 12 Jun 2014 10:45:46 GMT""}]","2015-06-19"
"1405.6724","Katharine Schlesinger","Katharine J. Schlesinger, Jennifer A. Johnson, Constance M. Rockosi,
  Young Sun Lee, Timothy C. Beers, Paul Harding, Carlos Allende Prieto,
  Jonathan C. Bird, Ralph Schoenrich, Brian Yanny, Donald P. Schneider,
  Benjamin A. Weaver, Jon Brinkmann","The Vertical Metallicity Gradient of the Milky Way Disk: Transitions in
  [a/Fe] Populations","62 pages, 12 figures, accepted by The Astrophysical Journal",,"10.1088/0004-637X/791/2/112",,"astro-ph.GA astro-ph.SR","http://arxiv.org/licenses/nonexclusive-distrib/1.0/","  Using G dwarfs from the Sloan Extension for Galactic Understanding and
Exploration (SEGUE) survey, we have determined a vertical metallicity gradient
over a large volume of the Milky Way's disk, and examined how this gradient
varies for different [a/Fe] subsamples. This sample contains over 40,000 stars
with low-resolution spectroscopy over 144 lines of sight. We employ the SEGUE
Stellar Parameter Pipeline (SSPP) to obtain estimates of effective temperature,
surface gravity, [Fe/H], and [a/Fe] for each star and extract multiple
volume-complete subsamples of approximately 1000 stars each. Based on the
survey's consistent target-selection algorithm, we adjust each subsample to
determine an unbiased picture of the disk in [Fe/H] and [a/Fe]; consequently,
each individual star represents the properties of many. The SEGUE sample allows
us to constrain the vertical metallicity gradient for a large number of stars
over a significant volume of the disk, between ~0.3 and 1.6 kpc from the
Galactic plane, and examine the in situ structure, in contrast to previous
analyses which are more limited in scope. This work does not pre-suppose a disk
structure, whether composed of a single complex population or a distinct thin
and thick disk component. The metallicity gradient is -0.243 +0.039 -0.053
dex/kpc for the sample as a whole, which we compare to various literature
results. Each [a/Fe] subsample dominates at a different range of heights above
the plane of the Galaxy, which is exhibited in the gradient found in the sample
as a whole. Stars over a limited range in [a/Fe] show little change in median
[Fe/H] with height. If we associate [a/Fe] with age, our consistent vertical
metallicity gradients with [a/Fe] suggest that stars formed in different epochs
exhibit comparable vertical structure, implying similar star-formation
processes and evolution.
","[{""version"":""v1"",""created"":""Mon, 26 May 2014 20:00:21 GMT""}]","2015-06-19"
"1405.6725","Isabella Paola Carucci","Isabella P. Carucci, Martin Sparre, Steen H. Hansen and Michael Joyce","Particle ejection during mergers of dark matter halos","18 pages, 12 figures. Accepted for publication in JCAP","JCAP06(2014)057","10.1088/1475-7516/2014/06/057",,"astro-ph.CO","http://arxiv.org/licenses/nonexclusive-distrib/1.0/","  Dark matter halos are built from accretion and merging. During merging some
of the dark matter particles may be ejected with velocities higher than the
escape velocity. We use both N-body simulations and single-particle
smooth-field simulations to demonstrate that rapid changes to the mean field
potential are responsible for such ejection, and in particular that dynamical
friction plays no significant role in it. Studying a range of minor mergers, we
find that typically between 5-15% of the particles from the smaller of the two
merging structures are ejected. We also find that the ejected particles
originate essentially from the small halo, and more specifically are particles
in the small halo which pass later through the region in which the merging
occurs.
","[{""version"":""v1"",""created"":""Mon, 26 May 2014 20:00:41 GMT""}]","2014-07-01"
"1405.6726","Albert Bosma","E. Athanassoula, E. Laurikainen, H. Salo, A. Bosma","On the nature of the barlens component in barred galaxies: what do
  boxy/peanut bulges look like when viewed face-on?","21 pages, 11 figures, revised version as published in MNRAS","MNRAS, 454, 3843-3863, 2015","10.1093/mnras/stv2231",,"astro-ph.GA","http://arxiv.org/licenses/nonexclusive-distrib/1.0/","  Barred galaxies have interesting morphological features whose presence and
properties set constraints on galactic evolution. Here we examine barlenses,
i.e. lens-like components whose extent along the bar major axis is shorter than
that of the bar and whose outline is oval or circular. We identify and analyse
barlenses in $N$-body plus SPH simulations, compare them extensively with those
from the NIRS0S (Near-IR S0 galaxy survey) and the S$^4$G samples (Spitzer
Survey of Stellar Structure in Galaxies) and find very good agreement. We
observe barlenses in our simulations from different viewing angles. This
reveals that barlenses are the vertically thick part of the bar seen face-on,
i.e. a barlens seen edge-on is a boxy/peanut/X bulge. In morphological studies,
and in the absence of kinematics or photometry, a barlens, or part of it, may
be mistaken for a classical bulge. Thus the true importance of classical
bulges, both in numbers and mass, is smaller than currently assumed, which has
implications for galaxy formation studies. Finally, using the shape of the
isodensity curves, we propose a rule of thumb for measuring the barlens extent
along the bar major axis of moderately inclined galaxies, thus providing an
estimate of which part of the bar is thicker.
","[{""version"":""v1"",""created"":""Mon, 26 May 2014 20:01:24 GMT""},{""version"":""v2"",""created"":""Mon, 29 Feb 2016 13:50:52 GMT""}]","2016-03-01"
"1405.6727","Yiming Xu","Emanuel Katz, Gustavo Marques Tavares, Yiming Xu","A solution of 2D QCD at Finite $N$ using a conformal basis","18 pages, 5 figures",,,,"hep-th","http://arxiv.org/licenses/nonexclusive-distrib/1.0/","  We study 2D QCD with a fundamental fermion at small-$N$ using the recently
proposed conformal basis approach. We find that effective conformal dominance
still holds, namely that the spectrum converges efficiently, with high
scaling-dimension operators decoupling exponentially quickly from the stable
single-particle states. Consequently, for these stable bound states, accurate,
analytic expressions for wavefunctions and parton distribution functions can be
given, even for $N=3$.
","[{""version"":""v1"",""created"":""Mon, 26 May 2014 20:01:30 GMT""}]","2014-05-28"
