"1405.6801","Tatsuki Hashimoto","Tatsuki Hashimoto, Keiji Yada, Ai Yamakage, Masatoshi Sato and Yukio
  Tanaka","Effect of Fermi surface evolution on superconducting gap in
  superconducting topological insulator","12 pages, 6 figures","Supercond. Sci. Technol. 27 (2014) 104002","10.1088/0953-2048/27/10/104002",,"cond-mat.supr-con","http://arxiv.org/licenses/nonexclusive-distrib/1.0/","  We study bulk electronic states of superconducting topological insulator,
which is the promising candidate for topological superconductor. Recent
experiments suggest that the three-dimensional Fermi surface evolves into
two-dimensional one. We show that the superconducting energy gap structure on
the Fermi surface systematically changes with this evolution. It is clarified
that the bulk electronic properties such as spin-lattice relaxation rate and
specific heat depend on the shape of the Fermi surface and the type of the
energy gap function. These results serve as a guide to determine the pairing
symmetry of Cu$_x$Bi$_2$Se$_3$.
","[{""version"":""v1"",""created"":""Tue, 27 May 2014 06:13:31 GMT""}]","2014-10-22"
"1405.6802","Tony Guttmann","Andrew R Conway and Anthony J Guttmann","On the growth rate of 1324-avoiding permutations","20 pages, 10 figures",,,,"math.CO cs.DS math-ph math.MP","http://arxiv.org/licenses/nonexclusive-distrib/1.0/","  We give an improved algorithm for counting the number of $1324$-avoiding
permutations, resulting in 5 further terms of the generating function. We
analyse the known coefficients and find compelling evidence that unlike other
classical length-4 pattern-avoiding permutations, the generating function in
this case does not have an algebraic singularity. Rather, the number of
1324-avoiding permutations of length $n$ behaves as $$B\cdot \mu^n \cdot
\mu_1^{n^{\sigma}} \cdot n^g.$$ We estimate $\mu=11.60 \pm 0.01,$ $\sigma=1/2,$
$\mu_1 = 0.0398 \pm 0.0010,$ $g = -1.1 \pm 0.2$ and $B =9.5 \pm 1.0.$
","[{""version"":""v1"",""created"":""Tue, 27 May 2014 06:15:16 GMT""}]","2014-05-28"
"1405.6803","A. Buja","A. Buja, L. Brown","Discussion: ""A significance test for the lasso""","Published in at http://dx.doi.org/10.1214/14-AOS1175F the Annals of
  Statistics (http://www.imstat.org/aos/) by the Institute of Mathematical
  Statistics (http://www.imstat.org)","Annals of Statistics 2014, Vol. 42, No. 2, 509-517","10.1214/14-AOS1175F","IMS-AOS-AOS1175F","math.ST stat.ME stat.TH","http://arxiv.org/licenses/nonexclusive-distrib/1.0/","  Discussion of ""A significance test for the lasso"" by Richard Lockhart,
Jonathan Taylor, Ryan J. Tibshirani, Robert Tibshirani [arXiv:1301.7161].
","[{""version"":""v1"",""created"":""Tue, 27 May 2014 06:20:58 GMT""}]","2014-05-28"
"1405.6804","Zhuowen Tu","Zhuowen Tu and Piotr Dollar and Yingnian Wu","Layered Logic Classifiers: Exploring the `And' and `Or' Relations",,,,,"stat.ML cs.LG","http://arxiv.org/licenses/nonexclusive-distrib/1.0/","  Designing effective and efficient classifier for pattern analysis is a key
problem in machine learning and computer vision. Many the solutions to the
problem require to perform logic operations such as `and', `or', and `not'.
Classification and regression tree (CART) include these operations explicitly.
Other methods such as neural networks, SVM, and boosting learn/compute a
weighted sum on features (weak classifiers), which weakly perform the 'and' and
'or' operations. However, it is hard for these classifiers to deal with the
'xor' pattern directly. In this paper, we propose layered logic classifiers for
patterns of complicated distributions by combining the `and', `or', and `not'
operations. The proposed algorithm is very general and easy to implement. We
test the classifiers on several typical datasets from the Irvine repository and
two challenging vision applications, object segmentation and pedestrian
detection. We observe significant improvements on all the datasets over the
widely used decision stump based AdaBoost algorithm. The resulting classifiers
have much less training complexity than decision tree based AdaBoost, and can
be applied in a wide range of domains.
","[{""version"":""v1"",""created"":""Tue, 27 May 2014 06:29:01 GMT""},{""version"":""v2"",""created"":""Wed, 28 May 2014 00:51:08 GMT""}]","2014-05-29"
"1405.6805","Robert Tibshirani","Richard Lockhart, Jonathan Taylor, Ryan J. Tibshirani, Robert
  Tibshirani","Rejoinder: ""A significance test for the lasso""","Published in at http://dx.doi.org/10.1214/14-AOS1175REJ the Annals of
  Statistics (http://www.imstat.org/aos/) by the Institute of Mathematical
  Statistics (http://www.imstat.org). With Correction","Annals of Statistics 2014, Vol. 42, No. 2, 518-531","10.1214/14-AOS1175REJ","IMS-AOS-AOS1175REJ","math.ST stat.TH","http://arxiv.org/licenses/nonexclusive-distrib/1.0/","  Rejoinder of ""A significance test for the lasso"" by Richard Lockhart,
Jonathan Taylor, Ryan J. Tibshirani, Robert Tibshirani [arXiv:1301.7161].
","[{""version"":""v1"",""created"":""Tue, 27 May 2014 06:30:23 GMT""},{""version"":""v2"",""created"":""Tue, 21 Oct 2014 10:40:47 GMT""}]","2014-10-22"
"1405.6806","Young Sun","Shi-Peng Shen, Yi-Sheng Chai, Jun-Zhuang Cong, Pei-Jie Sun, Jun Lu,
  Li-Qin Yan, Shou-Guo Wang, and Young Sun","Non-d$^0$ Electric Dipole in FeO$_5$ bipyramid: a New Resource for
  Quantum Paraelectrics, Ferroelectrics and Multiferroics","19 pages, 4 figures","Phys. Rev. B 90, 180404(R) (2014)","10.1103/PhysRevB.90.180404",,"cond-mat.str-el","http://arxiv.org/licenses/nonexclusive-distrib/1.0/","  Electric polarization in conventional ferroelectric oxides usually involves
nonmagnetic transition-metal ions with an empty d shell (the d$^0$ rule). Here
we unravel a new mechanism for local electric dipoles based on magnetic
Fe$^{3+}$ (3d$^5$) ion violating the d$^0$ rule. The competition between the
long-range Coulomb interaction and short-range Pauli repulsion in a FeO$_5$
bipyramid with proper lattice parameters would favor an off-center displacement
of Fe$^{3+}$ that induces a local electric dipole. The manipulation of this
kind of non-d$^0$ electric dipoles opens up a new route for generating
unconventional dielectrics, ferroelectrics, and multiferroics. As a prototype
example, we show that the non-d$^0$ electric dipoles in ferrimagnetic
hexaferrites (Ba,Sr)Fe$_{12}$O$_{19}$ lead to a new family of magnetic quantum
paraelectrics.
","[{""version"":""v1"",""created"":""Tue, 27 May 2014 06:33:01 GMT""}]","2015-07-07"
"1405.6807","Xubo Ma","X.B. Ma, F.Lu, L.Z. Wang, Y.X. Chen, W.L. Zhong, F.P. An","Uncertainties analysis of fission fraction for reactor antineutrino
  experiments","arXiv admin note: substantial text overlap with arXiv:1109.5379,
  arXiv:1101.2266 by other authors",,,,"nucl-ex physics.ins-det","http://arxiv.org/licenses/nonexclusive-distrib/1.0/","  Reactor antineutrino experiment are used to study neutrino oscillation,
search for signatures of nonstandard neutrino interaction, and monitor reactor
operation for safeguard application. Reactor simulation is an important source
of uncertainties for a reactor neutrino experiment. Commercial code is used for
reactor simulation to evaluate fission fraction in Daya Bay neutrino
experiment, but the source code doesn't open to our researcher results from
commercial secret. In this study, The open source code DRAGON was improved to
calculate the fission rates of the four most important isotopes in fissions,
$^{235}$U,$^{238}$U,$^{239}$Pu and $^{241}$Pu, and then was validated for PWRs
using the Takahama-3 benchmark. The fission fraction results are consistent
with those of MIT's results. Then, fission fraction of Daya Bay reactor core
was calculated by using improved DRAGON code, and the fission fraction
calculated by DRAGON agreed well with these calculated by SCIENCE. The average
deviation less than 5\% for all the four isotopes. The correlation coefficient
matrix between $^{235}$U,$^{238}$U,$^{239}$Pu and $^{241}$Pu were also studied
using DRAGON, and then the uncertainty of the antineutrino flux by the fission
fraction was calculated by using the correlation coefficient matrix. The
uncertainty of the antineutrino flux by the fission fraction simulation is
0.6\% per core for Daya Bay antineutrino experiment. The uncertainties source
of fission fraction calculation need further to be studied in the future.
","[{""version"":""v1"",""created"":""Tue, 27 May 2014 06:35:46 GMT""},{""version"":""v2"",""created"":""Tue, 17 Mar 2015 18:16:55 GMT""}]","2015-03-18"
"1405.6808","Svante Janson","Svante Janson and Vera T. S\'os","More on quasi-random graphs, subgraph counts and graph limits","35 pages",,,,"math.CO","http://arxiv.org/licenses/nonexclusive-distrib/1.0/","  We study some properties of graphs (or, rather, graph sequences) defined by
demanding that the number of subgraphs of a given type, with vertices in
subsets of given sizes, approximatively equals the number expected in a random
graph. It has been shown by several authors that several such conditions are
quasi-random, but that there are exceptions. In order to understand this
better, we investigate some new properties of this type. We show that these
properties too are quasi-random, at least in some cases; however, there are
also cases that are left as open problems, and we discuss why the proofs fail
in these cases.
  The proofs are based on the theory of graph limits; and on the method and
results developed by Janson (2011), this translates the combinatorial problem
to an analytic problem, which then is translated to an algebraic problem.
","[{""version"":""v1"",""created"":""Tue, 27 May 2014 06:40:10 GMT""}]","2014-05-28"
"1405.6809","Huy Tai Ha","Huy Tai Ha and Mengyao Sun","Squarefree monomial ideals that fail the persistence property and
  non-increasing depth","14 pp; minor revision; to appear in Acta Mathematica Vietnamica",,,,"math.AC","http://arxiv.org/licenses/nonexclusive-distrib/1.0/","  In a recent work, Kaiser, Stehl\'ik and \v{S}krekovski provide a family of
critically 3-chromatic graphs whose expansions do not result in critically
4-chromatic graphs, and thus give counterexamples to a conjecture of Francisco,
Ha and Van Tuyl. The cover ideal of the smallest member of this family also
gives a counterexample to the persistence and non-increasing depth properties.
In this paper, we show that the cover ideals of all members of their family of
graphs indeed fail to have the persistence and non-increasing depth properties.
","[{""version"":""v1"",""created"":""Tue, 27 May 2014 06:49:08 GMT""},{""version"":""v2"",""created"":""Fri, 5 Sep 2014 14:23:22 GMT""}]","2014-09-08"
"1405.6810","Santanu Maiti K.","Paramita Dutta, Santanu K. Maiti and S. N. Karmakar","Electric field induced localization phenomena in a ladder network with
  superlattice configuration: Effect of backbone environment","9 pages, 6 figures","AIP Advances, Volume 4, Issue 9, (2014), Page 097126 [11 pages]","10.1063/1.4896281",,"cond-mat.mes-hall","http://creativecommons.org/licenses/by/3.0/","  Electric field induced localization properties of a tight-binding ladder
network in presence of backbone sites are investigated. Based on Green's
function formalism we numerically calculate two-terminal transport together
with density of states for different arrangements of atomic sites in the ladder
and its backbone. Our results lead to a possibility of getting multiple
mobility edges which essentially plays a switching action between a completely
opaque to fully or partly conducting region upon the variation of system Fermi
energy, and thus, support in fabricating mesoscopic or DNA-based switching
devices.
","[{""version"":""v1"",""created"":""Tue, 27 May 2014 06:52:47 GMT""}]","2014-09-23"
"1405.6811","Florian Richter","Florian Richter, Daniel Becker, C\'edric B\'eny, Torben A. Schulze,
  Silke Ospelkaus, Tobias J. Osborne","Ultracold Chemistry and its Reaction Kinetics","15 pages, 5 figures","New J. Phys. 17 (2015) 055005","10.1088/1367-2630/17/5/055005",,"quant-ph cond-mat.quant-gas physics.chem-ph","http://arxiv.org/licenses/nonexclusive-distrib/1.0/","  We study the reaction kinetics of chemical processes occurring in the
ultracold regime and systematically investigate their dynamics. Quantum
entanglement is found to play a key role in driving an ultracold reaction
towards a dynamical equilibrium. In case of multiple concurrent reactions
Hamiltonian chaos dominates the phase space dynamics in the mean field
approximation.
","[{""version"":""v1"",""created"":""Tue, 27 May 2014 06:53:44 GMT""},{""version"":""v2"",""created"":""Thu, 8 Jan 2015 13:35:18 GMT""}]","2015-05-13"
"1405.6812","Subhasish Dutta Gupta","K. Nireekshan Reddy and S. Dutta Gupta","Cavity controlled spectral singularity",,,"10.1364/OL.39.004595",,"physics.optics","http://arxiv.org/licenses/nonexclusive-distrib/1.0/","  We study theoretically a PT-symmetric saturable balanced gain-loss system in
a ring cavity configuration. The saturable gain and loss are modeled by
two-level medium with or without population inversion. We show that the
specifics of the spectral singularity can be fully controlled by the cavity and
the atomic detuning parameters. The theory is based on the mean-field
approximation as in standard theory of optical bistability. Further, in the
linear regime we demonstrate the regularization of the singularity in detuned
systems, while larger input power levels are shown to be adequate to limit the
infinite growth in absence of detuning
","[{""version"":""v1"",""created"":""Tue, 27 May 2014 06:59:29 GMT""}]","2015-06-19"
"1405.6813","Miles Simon","Miles Simon and Glen Wheeler","Some local estimates and a uniqueness result for the entire biharmonic
  heat equation",,,,,"math.AP","http://arxiv.org/licenses/nonexclusive-distrib/1.0/","  We consider smooth solutions to the biharmonic heat equation on Euclidean
space for which the square of the Laplacian at time t is globally bounded from
above by k/t for some k in R, for all t in [0,T]. We prove local, in space and
time, estimates for such solutions. We explain how these estimates imply
uniqueness of smooth solutions in this class.
","[{""version"":""v1"",""created"":""Tue, 27 May 2014 06:59:46 GMT""}]","2014-05-28"
"1405.6814","Matthias Rempel","M. Rempel","Numerical simulations of quiet Sun magnetism: On the contribution from a
  small-scale dynamo","23 pages, 17 figures, accepted for publication in ApJ",,"10.1088/0004-637X/789/2/132",,"astro-ph.SR","http://arxiv.org/licenses/nonexclusive-distrib/1.0/","  We present a series of radiative MHD simulations addressing the origin and
distribution of mixed polarity magnetic field in the solar photosphere. To this
end we consider numerical simulations that cover the uppermost 2-6 Mm of the
solar convection zone and we explore scales ranging from 2 km to 25 Mm. We
study how the strength and distribution of magnetic field in the photosphere
and subsurface layers depend on resolution, domain size and boundary
conditions. We find that 50% of the magnetic energy at the \tau=1 level comes
from field with the less than 500 G strength and that 50% of the energy resides
on scales smaller than about 100 km. While probability distribution functions
are essentially independent of resolution, properly describing the spectral
energy distribution requires grid spacings of 8 km or smaller. The formation of
flux concentrations in the photosphere exceeding 1 kG requires a mean vertical
field strength greater than 30-40 G at \tau=1. The filling factor of kG flux
concentrations increases with overall domain size as magnetic field becomes
organized by larger, longer lived flow structures. A solution with a mean
vertical field strength of around 85 G at \tau=1 requires a subsurface RMS
field strength increasing with depth at the same rate as the equipartition
field strength. We consider this an upper limit for the quiet Sun field
strength, which implies that most of the convection zone is magnetized close to
equipartition. We discuss these findings in view of recent high-resolution
spectropolarimetric observations of quiet Sun magnetism.
","[{""version"":""v1"",""created"":""Tue, 27 May 2014 07:00:10 GMT""}]","2015-06-19"
"1405.6815","Uma Gupta","Uma Gupta","Research On Permanent Magnet BLDC for small electric vehicle",,,,,"cs.SY","http://arxiv.org/licenses/nonexclusive-distrib/1.0/","  In this paper, different electric motors are studied and compared to see the
benefits of each motor and the one that is more suitable to be used in the
electric vehicle applications. There are five main electric motor types, DC,
induction, permanent magnet synchronous, switched reluctance and brush-less DC
motors are studied.
","[{""version"":""v1"",""created"":""Tue, 27 May 2014 07:00:56 GMT""}]","2014-05-28"
"1405.6816","Stefano Viaggiu","Stefano Viaggiu","Bekenstein-Hawking entropy in expanding universes from black hole
  theorems","Accepted for publication in Mod. Phys. Lett A Vol. 29, Issue 17
  (2014)",,"10.1142/S0217732314500916",,"hep-th astro-ph.CO gr-qc","http://arxiv.org/licenses/nonexclusive-distrib/1.0/","  We show that the use of suitable theorems for black hole formation in
Friedmann expanding universes leads to a modification of the Bekenstein-Hawking
entropy. By adopting an argument similar to the original Bekenstein one, we
write down the expression for the Bekenstein-Hawking entropy suitable for
non-static isotropic expanding universes together with the equation of state of
a black hole. This equation can be put in a form similar to the one of an ideal
gas but with a factor depending on the Hubble radius. Moreover, we give some
argument on a possible relation between our entropy expression and the
Cardy-Verlinde one. Finally, we explore the possibility that primordial
inflation is due to black hole evaporation in our context.
","[{""version"":""v1"",""created"":""Tue, 27 May 2014 07:04:28 GMT""}]","2014-05-29"
"1405.6817","Gregory Nain","Fouquet Francois (SnT), Gr\'egory Nain (SnT), Brice Morin, Erwan
  Daubert (INRIA - IRISA), Olivier Barais (INRIA - IRISA), No\""el Plouzeau
  (INRIA - IRISA), Jean-Marc J\'ez\'equel (INRIA - IRISA)","Kevoree Modeling Framework (KMF): Efficient modeling techniques for
  runtime use","ISBN 978-2-87971-131-7; N&deg; TR-SnT-2014-11 (2014)",,,"TR-SnT-2014-11","cs.SE","http://arxiv.org/licenses/nonexclusive-distrib/1.0/","  The creation of Domain Specific Languages(DSL) counts as one of the main
goals in the field of Model-Driven Software Engineering (MDSE). The main
purpose of these DSLs is to facilitate the manipulation of domain specific
concepts, by providing developers with specific tools for their domain of
expertise. A natural approach to create DSLs is to reuse existing modeling
standards and tools. In this area, the Eclipse Modeling Framework (EMF) has
rapidly become the defacto standard in the MDSE for building Domain Specific
Languages (DSL) and tools based on generative techniques. However, the use of
EMF generated tools in domains like Internet of Things (IoT), Cloud Computing
or Models@Runtime reaches several limitations. In this paper, we identify
several properties the generated tools must comply with to be usable in other
domains than desktop-based software systems. We then challenge EMF on these
properties and describe our approach to overcome the limitations. Our approach,
implemented in the Kevoree Modeling Framework (KMF), is finally evaluated
according to the identified properties and compared to EMF.
","[{""version"":""v1"",""created"":""Tue, 27 May 2014 07:05:04 GMT""}]","2014-05-28"
"1405.6818","Wei Zhou","Wei Zhou, Yue Sun, Shuo Zhang, Jincheng Zhuang, Feifei Yuan, Xiong Li,
  Zhixiang Shi, Tatsuhiro Yamada, Yuji Tsuchiya, and Tsuyoshi Tamegai","Bulk Superconductivity in Fe1+yTe0.6Se0.4 Induced by Removal of Excess
  Fe",,"J. Phys. Soc. Jpn., 83 (2014) 064704","10.7566/jpsj.83.064704",,"cond-mat.supr-con","http://arxiv.org/licenses/nonexclusive-distrib/1.0/","  Experimental evidences from transport, magnetic, and magneto-optical (MO)
image measurements confirmed that arsenic (As) vapor annealing was another
effective way to induce bulk superconductivity with isotropic, large, and
homogenous superconducting critical current density (Jc) in Fe1+yTe0.6Se0.4
single crystal. Since As is an exotic and easily detectable heavy element to
Fe1+yTe0.6Se0.4 single crystal, As vapor annealing is very advantageous for the
study of annealing mechanism. Detailed micro-structural and elemental analyses
exclude the possibility that intercalating or doping effect may happen in the
other post-annealing methods, proving that Fe reacts with As on the surface of
the crystal and the reaction itself acts as a driving force to drag excess Fe
out. The removal of excess Fe results in the good superconductivity
performance.
","[{""version"":""v1"",""created"":""Tue, 27 May 2014 07:11:42 GMT""}]","2014-05-28"
"1405.6819","Noam Berger","Noam Berger, Moran Cohen, Ron Rosenthal","Local limit theorem and equivalence of dynamic and static points of view
  for certain ballistic random walks in i.i.d. environments","Published at http://dx.doi.org/10.1214/15-AOP1038 in the Annals of
  Probability (http://www.imstat.org/aop/) by the Institute of Mathematical
  Statistics (http://www.imstat.org)","Annals of Probability 2016, Vol. 44, No. 4, 2889-2979","10.1214/15-AOP1038","IMS-AOP-AOP1038","math.PR","http://arxiv.org/licenses/nonexclusive-distrib/1.0/","  In this work, we discuss certain ballistic random walks in random
environments on $\mathbb{Z}^d$, and prove the equivalence between the static
and dynamic points of view in dimension $d\geq4$. Using this equivalence, we
also prove a version of a local limit theorem which relates the local behavior
of the quenched and annealed measures of the random walk by a prefactor.
","[{""version"":""v1"",""created"":""Tue, 27 May 2014 07:17:28 GMT""},{""version"":""v2"",""created"":""Fri, 2 Sep 2016 09:12:21 GMT""}]","2016-09-05"
"1405.6820","Philipp Hoffmann","Javier Esparza and Philipp Hoffmann","Negotiation Games (with abstract)",,,,,"cs.LO","http://arxiv.org/licenses/nonexclusive-distrib/1.0/","  Negotiations, a model of concurrency with multi party negotiation as
primitive, have been recently introduced in arXiv:1307.2145, arXiv:1403.4958.
We initiate the study of games for this model. We study coalition problems: can
a given coalition of agents force that a negotiation terminates (resp. block
the negotiation so that it goes on forever)?; can the coalition force a given
outcome of the negotiation? We show that for arbitrary negotiations the
problems are EXPTIME-complete. Then we show that for sound and deterministic or
even weakly deterministic negotiations the problems can be solved in PTIME.
Notice that the input of the problems is a negotiation, which can be
exponentially more compact than its state space.
","[{""version"":""v1"",""created"":""Tue, 27 May 2014 07:25:27 GMT""},{""version"":""v2"",""created"":""Tue, 10 Jun 2014 13:21:17 GMT""},{""version"":""v3"",""created"":""Wed, 29 Jul 2015 08:26:32 GMT""}]","2015-07-30"
"1405.6821","Vardarajan Suneeta","Bhavesh Khamesra, V Suneeta","Stability analysis of (a class of) anisotropic spacetimes","25 pages, references added, version to appear in Phys. Rev. D","Phys. Rev. D 90, 024044 (2014)","10.1103/PhysRevD.90.024044",,"gr-qc hep-th","http://arxiv.org/licenses/nonexclusive-distrib/1.0/","  We consider spherically symmetric spacetimes sourced by a fluid with pressure
anisotropy in the radial direction. We use gauge-invariant perturbation theory
to study the stability of this class of spacetimes under axial perturbations.
We apply our results to three diverse examples. Two examples arise as endpoints
of collapse of a ball of fluid --- one describes a well-behaved stellar
interior and the other has a naked singularity. We prove the stability of the
stellar interior both with respect to Dirichlet and quasinormal mode boundary
conditions on the perturbation. Surprisingly, the naked singularity is also
stable under axial perturbations. Lastly, we take the example of anisotropic
cosmology to show that in this case, the relevant perturbations are those in
which the direction of anisotropy is also perturbed.
","[{""version"":""v1"",""created"":""Tue, 27 May 2014 07:25:44 GMT""},{""version"":""v2"",""created"":""Mon, 7 Jul 2014 05:09:52 GMT""}]","2014-07-23"
"1405.6822","Hiba Zaidi","Hiba Zaidi","Mobile Application for GBAS Air Traffic Status Unit",,,,,"cs.OH","http://arxiv.org/licenses/nonexclusive-distrib/1.0/","  At present, the Air Traffic Status Unit is a windows PC based application,
which receives the status of ground based augmentation system station over
Ethernet and displays on the screen. The objective of this project is to
convert the PC based Application into Mobile application using Android OS.
","[{""version"":""v1"",""created"":""Tue, 27 May 2014 07:26:37 GMT""}]","2014-05-28"
