"1405.7222","Jo Verbeeck","J. Verbeeck H. Tian A. B\'ech\'e","A new way of producing electron vortex probes for STEM",,"Ultramicroscopy, vol. 113, pp. 83 87, Feb. 2012","10.1016/j.ultramic.2011.10.008",,"physics.optics cond-mat.mtrl-sci","http://arxiv.org/licenses/nonexclusive-distrib/1.0/","  A spiral holographic aperture is used in the condensor plane of a scanning
transmission electron microscope to produce a focussed electron vortex probe
carrying a topological charge of either $-1,0$ or $+1$. The spiral aperture
design has a major advantage over the previously used forked aperture in that
the three beams with topological charge $m=-1,0,1$ are not side by side in the
specimen plane, but rather on top of each other, focussed at different height.
This allows us to have only one selected beam in focus on the sample while the
others contribute only to a background signal. In this paper we describe the
working principle as well as first experimental results demonstrating atomic
resolution HAADF STEM images obtained with electron vortex probes. These
results pave the way for atomic resolution magnetic information when combined
with electron energy loss spectroscopy.
","[{""version"":""v1"",""created"":""Wed, 28 May 2014 13:09:50 GMT""}]","2014-05-29"
"1405.7223","Steven R. Blusk","LHCb collaboration: R. Aaij, B. Adeva, M. Adinolfi, A. Affolder, Z.
  Ajaltouni, S. Akar, J. Albrecht, F. Alessio, M. Alexander, S. Ali, G.
  Alkhazov, P. Alvarez Cartelle, A.A. Alves Jr, S. Amato, S. Amerio, Y. Amhis,
  L. An, L. Anderlini, J. Anderson, R. Andreassen, M. Andreotti, J.E. Andrews,
  R.B. Appleby, O. Aquines Gutierrez, F. Archilli, A. Artamonov, M. Artuso, E.
  Aslanides, G. Auriemma, M. Baalouch, S. Bachmann, J.J. Back, A. Badalov, V.
  Balagura, W. Baldini, R.J. Barlow, C. Barschel, S. Barsuk, W. Barter, V.
  Batozskaya, V. Battista, A. Bay, L. Beaucourt, J. Beddow, F. Bedeschi, I.
  Bediaga, S. Belogurov, K. Belous, I. Belyaev, E. Ben-Haim, G. Bencivenni, S.
  Benson, J. Benton, A. Berezhnoy, R. Bernet, M.-O. Bettler, M. van Beuzekom,
  A. Bien, S. Bifani, T. Bird, A. Bizzeti, P.M. Bj{\o}rnstad, T. Blake, F.
  Blanc, J. Blouw, S. Blusk, V. Bocci, A. Bondar, N. Bondar, W. Bonivento, S.
  Borghi, A. Borgia, M. Borsato, T.J.V. Bowcock, E. Bowen, C. Bozzi, T.
  Brambach, J. van den Brand, J. Bressieux, D. Brett, M. Britsch, T. Britton,
  J. Brodzicka, N.H. Brook, H. Brown, A. Bursche, G. Busetto, J. Buytaert, S.
  Cadeddu, R. Calabrese, M. Calvi, M. Calvo Gomez, A. Camboni, P. Campana, D.
  Campora Perez, A. Carbone, G. Carboni, R. Cardinale, A. Cardini, H.
  Carranza-Mejia, L. Carson, K. Carvalho Akiba, G. Casse, L. Cassina, L.
  Castillo Garcia, M. Cattaneo, Ch. Cauet, R. Cenci, M. Charles, Ph.
  Charpentier, S. Chen, S.-F. Cheung, N. Chiapolini, M. Chrzaszcz, K. Ciba, X.
  Cid Vidal, G. Ciezarek, P.E.L. Clarke, M. Clemencic, H.V. Cliff, J. Closier,
  V. Coco, J. Cogan, E. Cogneras, P. Collins, A. Comerma-Montells, A. Contu, A.
  Cook, M. Coombes, S. Coquereau, G. Corti, M. Corvo, I. Counts, B. Couturier,
  G.A. Cowan, D.C. Craik, M. Cruz Torres, S. Cunliffe, R. Currie, C.
  D'Ambrosio, J. Dalseno, P. David, P.N.Y. David, A. Davis, K. De Bruyn, S. De
  Capua, M. De Cian, J.M. De Miranda, L. De Paula, W. De Silva, P. De Simone,
  D. Decamp, M. Deckenhoff, L. Del Buono, N. D\'el\'eage, D. Derkach, O.
  Deschamps, F. Dettori, A. Di Canto, H. Dijkstra, S. Donleavy, F. Dordei, M.
  Dorigo, A. Dosil Su\'arez, D. Dossett, A. Dovbnya, K. Dreimanis, G. Dujany,
  F. Dupertuis, P. Durante, R. Dzhelyadin, A. Dziurda, A. Dzyuba, S. Easo, U.
  Egede, V. Egorychev, S. Eidelman, S. Eisenhardt, U. Eitschberger, R. Ekelhof,
  L. Eklund, I. El Rifai, Ch. Elsasser, S. Ely, S. Esen, H.-M. Evans, T. Evans,
  A. Falabella, C. F\""arber, C. Farinelli, N. Farley, S. Farry, RF Fay, D.
  Ferguson, V. Fernandez Albor, F. Ferreira Rodrigues, M. Ferro-Luzzi, S.
  Filippov, M. Fiore, M. Fiorini, M. Firlej, C. Fitzpatrick, T. Fiutowski, M.
  Fontana, F. Fontanelli, R. Forty, O. Francisco, M. Frank, C. Frei, M.
  Frosini, J. Fu, E. Furfaro, A. Gallas Torreira, D. Galli, S. Gallorini, S.
  Gambetta, M. Gandelman, P. Gandini, Y. Gao, J. Garofoli, J. Garra Tico, L.
  Garrido, C. Gaspar, R. Gauld, L. Gavardi, G. Gavrilov, E. Gersabeck, M.
  Gersabeck, T. Gershon, Ph. Ghez, A. Gianelle, S. Giani', V. Gibson, L.
  Giubega, V.V. Gligorov, C. G\""obel, D. Golubkov, A. Golutvin, A. Gomes, H.
  Gordon, C. Gotti, M. Grabalosa G\'andara, R. Graciani Diaz, L.A. Granado
  Cardoso, E. Graug\'es, G. Graziani, A. Grecu, E. Greening, S. Gregson, P.
  Griffith, L. Grillo, O. Gr\""unberg, B. Gui, E. Gushchin, Yu. Guz, T. Gys, C.
  Hadjivasiliou, G. Haefeli, C. Haen, S.C. Haines, S. Hall, B. Hamilton, T.
  Hampson, X. Han, S. Hansmann-Menzemer, N. Harnew, S.T. Harnew, J. Harrison,
  T. Hartmann, J. He, T. Head, V. Heijne, K. Hennessy, P. Henrard, L. Henry,
  J.A. Hernando Morata, E. van Herwijnen, M. He\ss, A. Hicheur, D. Hill, M.
  Hoballah, C. Hombach, W. Hulsbergen, P. Hunt, N. Hussain, D. Hutchcroft, D.
  Hynds, M. Idzik, P. Ilten, R. Jacobsson, A. Jaeger, J. Jalocha, E. Jans, P.
  Jaton, A. Jawahery, F. Jing, M. John, D. Johnson, C.R. Jones, C. Joram, B.
  Jost, N. Jurik, M. Kaballo, S. Kandybei, W. Kanso, M. Karacson, T.M. Karbach,
  S. Karodia, M. Kelsey, I.R. Kenyon, T. Ketel, B. Khanji, C. Khurewathanakul,
  S. Klaver, O. Kochebina, M. Kolpin, I. Komarov, R.F. Koopman, P. Koppenburg,
  M. Korolev, A. Kozlinskiy, L. Kravchuk, K. Kreplin, M. Kreps, G. Krocker, P.
  Krokovny, F. Kruse, W. Kucewicz, M. Kucharczyk, V. Kudryavtsev, K. Kurek, T.
  Kvaratskheliya, V.N. La Thi, D. Lacarrere, G. Lafferty, A. Lai, D. Lambert,
  R.W. Lambert, E. Lanciotti, G. Lanfranchi, C. Langenbruch, B. Langhans, T.
  Latham, C. Lazzeroni, R. Le Gac, J. van Leerdam, J.-P. Lees, R. Lef\`evre, A.
  Leflat, J. Lefran\c{c}ois, S. Leo, O. Leroy, T. Lesiak, B. Leverington, Y.
  Li, M. Liles, R. Lindner, C. Linn, F. Lionetto, B. Liu, G. Liu, S. Lohn, I.
  Longstaff, J.H. Lopes, N. Lopez-March, P. Lowdon, H. Lu, D. Lucchesi, H. Luo,
  A. Lupato, E. Luppi, O. Lupton, F. Machefert, I.V. Machikhiliyan, F. Maciuc,
  O. Maev, S. Malde, G. Manca, G. Mancinelli, J. Maratas, J.F. Marchand, U.
  Marconi, C. Marin Benito, P. Marino, R. M\""arki, J. Marks, G. Martellotti, A.
  Martens, A. Mart\'in S\'anchez, M. Martinelli, D. Martinez Santos, F.
  Martinez Vidal, D. Martins Tostes, A. Massafferri, R. Matev, Z. Mathe, C.
  Matteuzzi, A. Mazurov, M. McCann, J. McCarthy, A. McNab, R. McNulty, B.
  McSkelly, B. Meadows, F. Meier, M. Meissner, M. Merk, D.A. Milanes, M.-N.
  Minard, N. Moggi, J. Molina Rodriguez, S. Monteil, M. Morandin, P. Morawski,
  A. Mord\`a, M.J. Morello, J. Moron, A.-B. Morris, R. Mountain, F. Muheim, K.
  M\""uller, R. Muresan, M. Mussini, B. Muster, P. Naik, T. Nakada, R.
  Nandakumar, I. Nasteva, M. Needham, N. Neri, S. Neubert, N. Neufeld, M.
  Neuner, A.D. Nguyen, T.D. Nguyen, C. Nguyen-Mau, M. Nicol, V. Niess, R. Niet,
  N. Nikitin, T. Nikodem, A. Novoselov, D.P. O'Hanlon, A. Oblakowska-Mucha, V.
  Obraztsov, S. Oggero, S. Ogilvy, O. Okhrimenko, R. Oldeman, G. Onderwater, M.
  Orlandea, J.M. Otalora Goicochea, P. Owen, A. Oyanguren, B.K. Pal, A. Palano,
  F. Palombo, M. Palutan, J. Panman, A. Papanestis, M. Pappagallo, C. Parkes,
  C.J. Parkinson, G. Passaleva, G.D. Patel, M. Patel, C. Patrignani, A. Pazos
  Alvarez, A. Pearce, A. Pellegrino, M. Pepe Altarelli, S. Perazzini, E. Perez
  Trigo, P. Perret, M. Perrin-Terrin, L. Pescatore, E. Pesen, K. Petridis, A.
  Petrolini, E. Picatoste Olloqui, B. Pietrzyk, T. Pila\v{r}, D. Pinci, A.
  Pistone, S. Playfer, M. Plo Casasus, F. Polci, A. Poluektov, E. Polycarpo, A.
  Popov, D. Popov, B. Popovici, C. Potterat, E. Price, J. Prisciandaro, A.
  Pritchard, C. Prouve, V. Pugatch, A. Puig Navarro, G. Punzi, W. Qian, B.
  Rachwal, J.H. Rademacker, B. Rakotomiaramanana, M. Rama, M.S. Rangel, I.
  Raniuk, N. Rauschmayr, G. Raven, S. Reichert, M.M. Reid, A.C. dos Reis, S.
  Ricciardi, S. Richards, M. Rihl, K. Rinnert, V. Rives Molina, D.A. Roa
  Romero, P. Robbe, A.B. Rodrigues, E. Rodrigues, P. Rodriguez Perez, S.
  Roiser, V. Romanovsky, A. Romero Vidal, M. Rotondo, J. Rouvinet, T. Ruf, F.
  Ruffini, H. Ruiz, P. Ruiz Valls, G. Sabatino, J.J. Saborido Silva, N.
  Sagidova, P. Sail, B. Saitta, V. Salustino Guimaraes, C. Sanchez Mayordomo,
  B. Sanmartin Sedes, R. Santacesaria, C. Santamarina Rios, E. Santovetti, M.
  Sapunov, A. Sarti, C. Satriano, A. Satta, D.M. Saunders, M. Savrie, D.
  Savrina, M. Schiller, H. Schindler, M. Schlupp, M. Schmelling, B. Schmidt, O.
  Schneider, A. Schopper, M.-H. Schune, R. Schwemmer, B. Sciascia, A. Sciubba,
  M. Seco, A. Semennikov, I. Sepp, N. Serra, J. Serrano, L. Sestini, P.
  Seyfert, M. Shapkin, I. Shapoval, Y. Shcheglov, T. Shears, L. Shekhtman, V.
  Shevchenko, A. Shires, R. Silva Coutinho, G. Simi, M. Sirendi, N. Skidmore,
  T. Skwarnicki, N.A. Smith, E. Smith, E. Smith, J. Smith, M. Smith, H. Snoek,
  M.D. Sokoloff, F.J.P. Soler, F. Soomro, D. Souza, B. Souza De Paula, B.
  Spaan, A. Sparkes, P. Spradlin, F. Stagni, M. Stahl, S. Stahl, O. Steinkamp,
  O. Stenyakin, S. Stevenson, S. Stoica, S. Stone, B. Storaci, S. Stracka, M.
  Straticiuc, U. Straumann, R. Stroili, V.K. Subbiah, L. Sun, W. Sutcliffe, K.
  Swientek, S. Swientek, V. Syropoulos, M. Szczekowski, P. Szczypka, D.
  Szilard, T. Szumlak, S. T'Jampens, M. Teklishyn, G. Tellarini, F. Teubert, C.
  Thomas, E. Thomas, J. van Tilburg, V. Tisserand, M. Tobin, S. Tolk, L.
  Tomassetti, D. Tonelli, S. Topp-Joergensen, N. Torr, E. Tournefier, S.
  Tourneur, M.T. Tran, M. Tresch, A. Tsaregorodtsev, P. Tsopelas, N. Tuning, M.
  Ubeda Garcia, A. Ukleja, A. Ustyuzhanin, U. Uwer, V. Vagnoni, G. Valenti, A.
  Vallier, R. Vazquez Gomez, P. Vazquez Regueiro, C. V\'azquez Sierra, S.
  Vecchi, J.J. Velthuis, M. Veltri, G. Veneziano, M. Vesterinen, B. Viaud, D.
  Vieira, M. Vieites Diaz, X. Vilasis-Cardona, A. Vollhardt, D. Volyanskyy, D.
  Voong, A. Vorobyev, V. Vorobyev, C. Vo\ss, H. Voss, J.A. de Vries, R. Waldi,
  C. Wallace, R. Wallace, J. Walsh, S. Wandernoth, J. Wang, D.R. Ward, N.K.
  Watson, D. Websdale, M. Whitehead, J. Wicht, D. Wiedner, G. Wilkinson, M.P.
  Williams, M. Williams, F.F. Wilson, J. Wimberley, J. Wishahi, W. Wislicki, M.
  Witek, G. Wormser, S.A. Wotton, S. Wright, S. Wu, K. Wyllie, Y. Xie, Z. Xing,
  Z. Xu, Z. Yang, X. Yuan, O. Yushchenko, M. Zangoli, M. Zavertyaev, L. Zhang,
  W.C. Zhang, Y. Zhang, A. Zhelezov, A. Zhokhov, L. Zhong, A. Zvyagin","Precision measurement of the mass and lifetime of the $\Xi_b^0$ baryon","7 pages, 4 figures","Phys. Rev. Lett. 113, 032001 (2014)","10.1103/PhysRevLett.113.032001","LHCb-PAPER-2014-021, CERN-PH-EP-2014-107","hep-ex","http://creativecommons.org/licenses/by/3.0/","  Using a proton-proton collision data sample corresponding to an integrated
luminosity of 3 fb$^{-1}$ collected by LHCb at center-of-mass energies of 7 and
8 TeV, about 3800 $\Xi_b^0\to\Xi_c^+\pi^-$, $\Xi_c^+\to pK^-\pi^+$ signal
decays are reconstructed. From this sample, the first measurement of the
$\Xi_b^0$ baryon lifetime is made, relative to that of the $\Lambda_b^0$
baryon. The mass differences $M(\Xi_b^0)-M(\Lambda_b^0)$ and
$M(\Xi_c^+)-M(\Lambda_c^+)$ are also measured with precision more than four
times better than the current world averages. The resulting values are
$\frac{\tau_{\Xi_b^0}}{\tau_{\Lambda_b^0}} = 1.006\pm0.018\pm0.010$,
$M(\Xi_b^0) - M(\Lambda_b^0) = 172.44\pm0.39\pm0.17 MeV/c^2$, $M(\Xi_c^+) -
M(\Lambda_c^+) = 181.51\pm0.14\pm0.10 MeV/c^2$, where the first uncertainty is
statistical and the second is systematic. The relative rate of $\Xi_b^0$ to
$\Lambda_b^0$ baryon production is measured to be
$\frac{f_{\Xi_b^0}}{f_{\Lambda_b^0}}\frac{{\cal{B}}(\Xi_b^0\to\Xi_c^+\pi^-)}{{\cal{B}}(\Lambda_b^0\to\Lambda_c^+\pi^-)}\frac{{\cal{B}}(\Xi_c^+\to
pK^-\pi^+)}{{\cal{B}}(\Lambda_c^+\to pK^-\pi^+)} =
(1.88\pm0.04\pm0.03)\times10^{-2}$, where the first factor is the ratio of
fragmentation fractions, $b\to\Xi_b^0$ relative to $b\to\Lambda_b^0$. Relative
production rates as functions of transverse momentum and pseudorapidity are
also presented.
","[{""version"":""v1"",""created"":""Wed, 28 May 2014 13:16:20 GMT""},{""version"":""v2"",""created"":""Tue, 3 Jun 2014 00:32:42 GMT""},{""version"":""v3"",""created"":""Wed, 16 Jul 2014 17:55:03 GMT""}]","2014-07-23"
"1405.7224","Glenn Eric Johnson","Glenn Eric Johnson","Measurement and self-adjoint operators","17 pages",,,,"quant-ph","http://arxiv.org/licenses/nonexclusive-distrib/1.0/","  The approximations of classical mechanics resulting from quantum mechanics
are richer than a correspondence of classical dynamical variables with
self-adjoint Hilbert space operators. Assertion that classical dynamic
variables correspond to self-adjoint Hilbert space operators is disputable and
sets unnatural limits on quantum mechanics. Well known examples of classical
dynamical variables not associated with self-adjoint Hilbert space operators
are discussed as a motivation for the realizations of quantum field theory that
lack Hermitian field operators but exhibit interaction.
","[{""version"":""v1"",""created"":""Wed, 28 May 2014 13:24:03 GMT""},{""version"":""v2"",""created"":""Thu, 10 Jul 2014 17:17:13 GMT""},{""version"":""v3"",""created"":""Fri, 5 Sep 2014 00:49:18 GMT""}]","2014-09-08"
"1405.7225","Cms Collaboration","CMS Collaboration","Measurement of differential cross sections for the production of a pair
  of isolated photons in pp collisions at sqrt(s) = 7 TeV","Replaced with published version. Added journal reference and DOI","Eur. Phys. J. C 74 (2014) 3129","10.1140/epjc/s10052-014-3129-3","CMS-SMP-13-001, CERN-PH-EP-2014-067","hep-ex","http://arxiv.org/licenses/nonexclusive-distrib/1.0/","  A measurement of differential cross sections for the production of a pair of
isolated photons in proton-proton collisions at sqrt(s) = 7 TeV is presented.
The data sample corresponds to an integrated luminosity of 5.0 inverse
femtobarns collected with the CMS detector. A data-driven isolation template
method is used to extract the prompt diphoton yield. The measured cross section
for two isolated photons, with transverse energy above 40 and 25 GeV
respectively, in the pseudorapidity range abs(eta) < 2.5, abs(eta) not in
[1.44,1.57] and with an angular separation Delta R > 0.45, is 17.2 +/- 0.2
(stat.) +/- 1.9 (syst.) +/- 0.4 (lum.) pb. Differential cross sections are
measured as a function of the diphoton invariant mass, the diphoton transverse
momentum, the azimuthal angle difference between the two photons, and the
cosine of the polar angle in the Collins-Soper reference frame of the diphoton
system. The results are compared to theoretical predictions at leading,
next-to-leading, and next-to-next-to-leading order in quantum chromodynamics.
","[{""version"":""v1"",""created"":""Wed, 28 May 2014 13:24:49 GMT""},{""version"":""v2"",""created"":""Tue, 18 Nov 2014 15:54:38 GMT""}]","2014-11-19"
"1405.7226","Efrat Shimshoni","Victoria Mazo (BIU), Chia-Wei Huang (MPI Stuttgart), Efrat Shimshoni
  (BIU), Sam T. Carr (U Kent) and H. A. Fertig (IU)","Helical quantum Hall Edge modes in bilayer graphene: a realization of
  quantum spin-ladders","Prepared for a special volume of Physica Scripta summarizing the
  proceedings of the conference ""Frontiers of Quantum and Mesoscopic
  Thermodynamics"" (FQMT13), Prague, July 29 - August 3, 2013","Phys. Scr. T165 (2015) 014019","10.1088/0031-8949/2015/T165/014019",,"cond-mat.mes-hall cond-mat.str-el","http://arxiv.org/licenses/nonexclusive-distrib/1.0/","  The rich phase diagram of quantum spin-ladder systems has attracted much
attention in the theoretical literature. The progress in experimental
realisations of this fascinating physics however has been much slower. While
materials with a ladder-like structure exist, one always has coupling between
the ladders to muddy the waters. In addition, such materials exhibit limited
(if any) tunability in terms of the magnetic exchange parameters, and
experimental probing of the different phases is a great challenge. In this
work, we show that a realisation of spin-ladder physics can occur in an
engineered nanostructure made out of bilayer graphene in the zero-filling
quantum Hall state. Specifically, we describe a split-double-gated setup in
which a domain wall is explicitly induced in the middle of the sample, and show
that an effective spin-ladder forms along this domain wall. The interaction
strengths of the ladder are tunable by adjusting magnetic and electric fields
as well as the spacing between the gates. Furthermore, we demonstrate that the
effective spin ladder has a helical nature, meaning that the spin-correlations
may be probed rather simply with charge transport experiments. We describe the
phase diagram of this system, and show that certain transport measurements are
very sensitive to the phase.
","[{""version"":""v1"",""created"":""Wed, 28 May 2014 13:27:21 GMT""}]","2015-11-05"
"1405.7227","Jonathan Bradley","Jonathan R. Bradley, Christopher K. Wikle, Scott H. Holan","Bayesian Spatial Change of Support for Count-Valued Survey Data",,,,,"stat.AP","http://arxiv.org/licenses/nonexclusive-distrib/1.0/","  We introduce Bayesian spatial change of support methodology for count-valued
survey data with known survey variances. Our proposed methodology is motivated
by the American Community Survey (ACS), an ongoing survey administered by the
U.S. Census Bureau that provides timely information on several key demographic
variables. Specifically, the ACS produces 1-year, 3-year, and 5-year
""period-estimates,"" and corresponding margins of errors, for published
demographic and socio-economic variables recorded over predefined geographies
within the United States. Despite the availability of these predefined
geographies it is often of interest to data users to specify customized
user-defined spatial supports. In particular, it is useful to estimate
demographic variables defined on ""new"" spatial supports in ""real-time."" This
problem is known as spatial change of support (COS), which is typically
performed under the assumption that the data follows a Gaussian distribution.
However, count-valued survey data is naturally non-Gaussian and, hence, we
consider modeling these data using a Poisson distribution. Additionally,
survey-data are often accompanied by estimates of error, which we incorporate
into our analysis. We interpret Poisson count-valued data in small areas as an
aggregation of events from a spatial point process. This approach provides us
with the flexibility necessary to allow ACS users to consider a variety of
spatial supports in ""real-time."" We demonstrate the effectiveness of our
approach through a simulated example as well as through an analysis using
public-use ACS data.
","[{""version"":""v1"",""created"":""Wed, 28 May 2014 13:33:36 GMT""},{""version"":""v2"",""created"":""Tue, 28 Oct 2014 17:58:03 GMT""}]","2014-10-29"
"1405.7228","Stephen Glasby","S. P. Glasby and R. B. Howlett","Extraspecial towers and Weil representations","26 pages","J. Algebra 151 (1992), 236--260",,,"math.RT","http://arxiv.org/licenses/nonexclusive-distrib/1.0/","  This paper was motivated by a remarkable group, the maximal subgroup
$M=S_3\ltimes 2^{2+1}_{-}\ltimes3^{2+1}\ltimes2^{6+1}_{-}$ of the sporadic
simple group ${\rm Fi}_{23}$, where $S_3$ is the symmetric group of degree 3,
and $2^{2+1}_{-}$, $3^{2+1}$ and $2^{6+1}_{-}$ denote extraspecial groups. The
representation $3^{2+1}\to{\rm GL}(3,\mathbb{F}_4)\to{\rm GL}(6,\mathbb{F}_2)$
extends (remarkably) to $S_3\ltimes 2^{2+1}_{-}\ltimes3^{2+1}$ and preserves a
quadratic form (of minus type) which allows the construction of $M$. The paper
describes certain (Weil) representations of extraspecial groups which extend,
and preserve various forms. Incidentally, $M$ is a remarkable solvable group
with derived length 10, and composition length 24.
","[{""version"":""v1"",""created"":""Wed, 28 May 2014 13:36:08 GMT""}]","2016-08-18"
"1405.7229","Erik Cuevas E","Erik Cuevas, Felipe Sencion, Daniel Zaldivar, Marco Perez, Humberto
  Sossa","A Multi-threshold Segmentation Approach Based on Artificial Bee Colony
  Optimization","16 Pages","Applied Intelligence 37 (3), (2012), pp. 321-336",,,"cs.CV cs.NE","http://arxiv.org/licenses/nonexclusive-distrib/1.0/","  This paper explores the use of the Artificial Bee Colony (ABC) algorithm to
compute threshold selection for image segmentation. ABC is a heuristic
algorithm motivated by the intelligent behavior of honey-bees which has been
successfully employed to solve complex optimization problems. In this approach,
an image 1D histogram is approximated through a Gaussian mixture model whose
parameters are calculated by the ABC algorithm. For the approximation scheme,
each Gaussian function represents a pixel class and therefore a threshold.
Unlike the Expectation Maximization (EM) algorithm, the ABC based method shows
fast convergence and low sensitivity to initial conditions. Remarkably, it also
improves complex time consuming computations commonly required by
gradient-based methods. Experimental results demonstrate the algorithms ability
to perform automatic multi threshold selection yet showing interesting
advantages by comparison to other well known algorithms.
","[{""version"":""v1"",""created"":""Wed, 28 May 2014 13:39:20 GMT""}]","2014-05-29"
"1405.7230","Micha\""el Fanuel","Micha\""el Fanuel (1), Jan Govaerts (1,2) ((1) CP3, UCL,
  Louvain-la-Neuve, Belgium, (2) ICMPA-UNESCO, Cotonou, Rep. Benin)","Non-Perturbative Dynamics, Pair Condensation, Confinement and Dynamical
  Masses in Massless QED2+1","40 pages, 4 figures","J. Phys. A: Math. Theor. 47 (2014) 405401","10.1088/1751-8113/47/40/405401","CP3-14-22","hep-th","http://arxiv.org/licenses/nonexclusive-distrib/1.0/","  Quantum electrodynamics in three spacetime dimensions, with one massless
fermion species, is studied using a non-perturbative variational approach.
Quantization of the theory follows Dirac's Hamiltonian procedure, with a gauge
invariant factorization of the physical degrees of freedom. Due to pair
condensation in the vacuum state, the symmetry of parity is spontaneously
broken. As a consequence, fermionic quasi-particles propagating in the
condensate can be identified and are seen to possess a confining dynamical
mass, while the propagating physical electromagnetic mode also acquires a
non-vanishing dynamical mass. The issues of gauge invariance and confinement of
the constituent fermions are carefully discussed.
","[{""version"":""v1"",""created"":""Wed, 28 May 2014 13:42:34 GMT""}]","2017-02-10"
"1405.7231","Cunlai Pu","Cunlai Pu and Wei Cui","Longest-path attacks on complex networks","5 figures, 6pages",,,,"physics.data-an","http://arxiv.org/licenses/nonexclusive-distrib/1.0/","  We investigate the longest-path attacks on complex networks. Specifically, we
remove approximately the longest simple path from a network iteratively until
there are no paths left in the network. We propose two algorithms, the random
augmenting approach (RPA) and the Hamilton-path based approach (HPA), for
finding the approximately longest simple path in a network. Results demonstrate
that steps of longest-path attacks increase with network density linearly for
random networks, while exponentially increasing for scale-free networks. The
more homogeneous the degree distribution is, the more fragile the network,
which is totally different from the previous results of node or edge attacks.
HPA is generally more efficient than RPA in the longest-path attacks of complex
networks. These findings further help us understand the vulnerability of
complex systems, better protect complex systems, and design more tolerant
complex systems.
","[{""version"":""v1"",""created"":""Wed, 28 May 2014 13:42:41 GMT""}]","2014-05-29"
"1405.7232","Elias Assmann","T. Ribic, E. Assmann, A. Toth, and K. Held","Cubic interaction parameters for t2g Wannier orbitals","9 pages, 3 figures, 6 tables; as published","Phys. Rev. B 90, 165105 (2014)","10.1103/PhysRevB.90.165105",,"cond-mat.str-el cond-mat.mtrl-sci","http://arxiv.org/licenses/nonexclusive-distrib/1.0/","  Many-body calculations for multi-orbital systems at present typically employ
Slater or Kanamori interactions which implicitly assume a full rotational
invariance of the orbitals, whereas the real crystal has a lower symmetry. In
cubic symmetry, the low-energy $t_{2g}$ orbitals have an on-site Kanamori
interaction, albeit without the constraint $U = U' + 2J$ implied by spherical
symmetry ($U$: intra-orbital interaction, $U'$: inter-orbital interaction, $J$:
Hund's exchange). Using maximally localized Wannier functions we show that
deviations from the standard, spherically symmetric interactions are indeed
significant for $5d$ orbitals ($\sim25%$ for BaOsO$_3$ ; $\sim12%$ if screening
is included), but less important for $3d$ orbitals ($\sim6\%$ for SrVO$_3$;
$\sim1\%$ if screened).
","[{""version"":""v1"",""created"":""Wed, 28 May 2014 13:44:05 GMT""},{""version"":""v2"",""created"":""Tue, 7 Oct 2014 07:18:31 GMT""}]","2014-10-09"
