"1405.7129","Kayvan Sadeghi","Kayvan Sadeghi","Marginalization and Conditioning for LWF Chain Graphs","48 pages, 9 figures, 2 tables","Annals of Statistics, 44 (4), 1792--1816, 2016","10.1214/16-AOS1451",,"stat.OT math.ST stat.ML stat.TH","http://arxiv.org/licenses/nonexclusive-distrib/1.0/","  In this paper, we deal with the problem of marginalization over and
conditioning on two disjoint subsets of the node set of chain graphs (CGs) with
the LWF Markov property. For this purpose, we define the class of chain mixed
graphs (CMGs) with three types of edges and, for this class, provide a
separation criterion under which the class of CMGs is stable under
marginalization and conditioning and contains the class of LWF CGs as its
subclass. We provide a method for generating such graphs after marginalization
and conditioning for a given CMG or a given LWF CG. We then define and study
the class of anterial graphs, which is also stable under marginalization and
conditioning and contains LWF CGs, but has a simpler structure than CMGs.
","[{""version"":""v1"",""created"":""Wed, 28 May 2014 06:29:35 GMT""},{""version"":""v2"",""created"":""Wed, 16 Sep 2015 15:15:11 GMT""},{""version"":""v3"",""created"":""Sun, 31 Jan 2016 22:06:58 GMT""},{""version"":""v4"",""created"":""Sun, 28 Aug 2016 20:00:42 GMT""}]","2016-08-30"
"1405.7130","Jonathan Kish","P. D. T. A. Elliott, Jonathan Kish","Harmonic Analysis on the Positive Rationals I: Basic Results",,,,,"math.NT","http://arxiv.org/licenses/nonexclusive-distrib/1.0/","  This is the first of two coupled papers estimating the mean values of
multiplicative functions, of unknown support, on arithmetic progressions with
large differences. Applications are made to the study of primes in arithmetic
progression and to the Fourier coefficients of automorphic cusp forms.
","[{""version"":""v1"",""created"":""Wed, 28 May 2014 06:37:08 GMT""}]","2014-05-29"
"1405.7131","Pramod Kumar Dr.","Pramod Kumar, Danish Shamoon, Dhirendra P. Singh, Sudip Mandal and
  Kamal P. Singh","Unveiling spatial correlations in biophotonic architecture of
  transparent insect wings","5, 4 figures, Conference on Photonics,Optics and Laser Technology
  2013","Proceedings of the International Conference on Photonics,Optics
  and Laser Technology,2013","10.5220/0004339001060110",,"physics.optics","http://arxiv.org/licenses/nonexclusive-distrib/1.0/","  We probe the natural complex structures in the transparent insect wings by a
simple, non-invasive, real time optical technique using both monochromatic and
broadband femtosecond lasers. A stable, reproducible and novel diffraction
pattern is observed unveiling long range spatial correlations and
structural-symmetry at various length scales for a large variety of wings.
While matching the sensitivity of SEM for such microstructures, it is highly
efficient for extracting long range structural organization with potentially
broad applicability.
","[{""version"":""v1"",""created"":""Wed, 28 May 2014 06:40:53 GMT""}]","2014-05-29"
"1405.7132","Jonathan Kish","P. D. T. A. Elliott, Jonathan Kish","Harmonic Analysis on the Positive Rationals II: Multiplicative Functions
  and Maass Forms",,,,,"math.NT","http://arxiv.org/licenses/nonexclusive-distrib/1.0/","  This is the second of two coupled papers estimating the mean values of
multiplicative functions, of unknown support, on arithmetic progressions with
large differences. Applications are made to the study of primes in arithmetic
progression and to the Fourier coefficients of automorphic cusp forms.
","[{""version"":""v1"",""created"":""Wed, 28 May 2014 06:42:47 GMT""}]","2014-05-29"
"1405.7133","Eli Friedman","E. Friedman and A. Gal","Testing in-medium $\pi N$ dynamics on pionic atoms","V2 minor rephrasing, 15 pages, 3 figures, to be published in Nuclear
  Physics A special issue in memory of Gerry Brown","Nuclear Physics A 928 (2014) 128","10.1016/j.nuclphysa.2014.05.017",,"nucl-th hep-ph nucl-ex","http://arxiv.org/licenses/nonexclusive-distrib/1.0/","  A general algorithm for handling the energy dependence of meson-nucleon
amplitudes in the nuclear medium has been recently applied to antikaons and to
eta mesons. Here we test this approach on $\pi N$ amplitudes in pionic atoms
where direct comparison can be made with ample experimental results. Applying
this algorithm to a large-scale fit of 100 pionic-atom data points across the
periodic table, which also include the `deeply-bound' states in Sn and Pb,
reaffirms earlier conclusions on the density-dependent renormalization of the
$\pi N$ threshold isovector amplitude $b_1$, or equivalently the
renormalization of the pion decay constant $f_{\pi}$ in the nuclear medium.
","[{""version"":""v1"",""created"":""Wed, 28 May 2014 06:51:14 GMT""},{""version"":""v2"",""created"":""Mon, 16 Jun 2014 06:54:59 GMT""}]","2015-03-11"
"1405.7134","Ryan Rossi","Ryan A. Rossi and Nesreen K. Ahmed","Role Discovery in Networks","Published in IEEE TKDE. Manuscript received Jan. 7, 2014; revised
  July 10, 2014; accepted July 29, 2014. Date of publication Aug. 19, 2014","IEEE Transactions on Knowledge & Data Engineering (TKDE), vol. 27,
  no. 4, pp. 1112-1131, 2015","10.1109/TKDE.2014.2349913",,"cs.SI physics.soc-ph","http://arxiv.org/licenses/nonexclusive-distrib/1.0/","  Roles represent node-level connectivity patterns such as star-center,
star-edge nodes, near-cliques or nodes that act as bridges to different regions
of the graph. Intuitively, two nodes belong to the same role if they are
structurally similar. Roles have been mainly of interest to sociologists, but
more recently, roles have become increasingly useful in other domains.
Traditionally, the notion of roles were defined based on graph equivalences
such as structural, regular, and stochastic equivalences. We briefly revisit
these early notions and instead propose a more general formulation of roles
based on the similarity of a feature representation (in contrast to the graph
representation). This leads us to propose a taxonomy of three general classes
of techniques for discovering roles that includes (i) graph-based roles, (ii)
feature-based roles, and (iii) hybrid roles. We also propose a flexible
framework for discovering roles using the notion of similarity on a
feature-based representation. The framework consists of two fundamental
components: (a) role feature construction and (b) role assignment using the
learned feature representation. We discuss the different possibilities for
discovering feature-based roles and the tradeoffs of the many techniques for
computing them. Finally, we discuss potential applications and future
directions and challenges.
","[{""version"":""v1"",""created"":""Wed, 28 May 2014 06:59:47 GMT""},{""version"":""v2"",""created"":""Mon, 25 Aug 2014 00:47:06 GMT""},{""version"":""v3"",""created"":""Thu, 3 Nov 2016 22:55:05 GMT""}]","2016-11-07"
"1405.7135","Samir Lemes","Samir Leme\v{s}","Odr\v{z}avanje ra\v{c}unarskih sistema","3. konferencija Odr\v{z}avanje - Maintenance 2014 (S. Brdarevi\'c, S.
  Ja\v{s}arevi\'c, editors), ISSN 1986-583X, Zenica",,,,"cs.OH","http://arxiv.org/licenses/nonexclusive-distrib/1.0/","  Computer hardware and software are resources without which the modern
business of any organization, from manufacturing to services, is impossible.
Not enough attention is being payed to maintenance of computer systems as an
aspect of business. This paper gives some recommendations for the selection of
the computer systems maintenance approach, based on many years of experience
maintaining these systems at the University of Zenica.
","[{""version"":""v1"",""created"":""Wed, 28 May 2014 07:01:00 GMT""}]","2014-05-29"
"1405.7136","Raj Kumar Pan","Francesco Becattini and Arnab Chatterjee and Santo Fortunato and
  Marija Mitrovi\'c and Raj Kumar Pan and Pietro Della Briotta Parolo","The Nobel Prize delay","Extended version of Nature 508, 186 (2014)
  http://www.nature.com/nature/journal/v508/n7495/full/508186a.html ;
  http://scitation.aip.org/content/aip/magazine/physicstoday/news/10.1063/PT.5.2012",,,,"physics.soc-ph cs.DL","http://arxiv.org/licenses/nonexclusive-distrib/1.0/","  The time lag between the publication of a Nobel discovery and the conferment
of the prize has been rapidly increasing for all disciplines, especially for
Physics. Does this mean that fundamental science is running out of
groundbreaking discoveries?
","[{""version"":""v1"",""created"":""Wed, 28 May 2014 07:05:39 GMT""}]","2014-05-29"
"1405.7137","Jeewan C. Pandey","J. C. Pandey, S. B. Pandey, and Subhajeet Karmakar (ARIES Nainital,
  India)","Phase-resolved XMM-Newton and swift observations of WR 25","12 pages, 7 figures, 5 tables, ApJ","The Astrophysical Journal Vol 788, No. 1, 84, 2014","10.1088/0004-637X/788/1/84",,"astro-ph.SR","http://arxiv.org/licenses/nonexclusive-distrib/1.0/","  We present an analysis of long-term X-ray and optical observations of the
Wolf-Rayet binary WR 25. Using archival data from observations with the
XMM-Newton and the Swift observatories spanning over ~10 yr, we show that WR 25
is a periodic variable in X-rays with a period of $208 \pm 3$ days. X-ray light
curves in the 0.5-10.0 keV energy band show phase-locked variability, where the
flux increased by a factor of ~2 from minimum to maximum, being maximum near
periastron passage. The light curve in the soft energy band (0.5-2.0 keV) shows
two minima indicating the presence of two eclipses. However, the light curve in
the hard energy band (2.0-10.0 keV) shows only one minimum during the apastron
passage. The X-ray spectra of WR 25 were explained by a two-temperature plasma
model. Both the cool and the hot plasmas were constant at 0.628+/-0.008 and
2.75+/-0.06 keV throughout an orbital cycle, where the cooler plasma could be
due to the small scale shocks in a radiation-driven outflow and the high
temperature plasma could be due to the collision of winds. The column density
varied with the orbital phase and was found to be maximum after the periastron
passage, when the WN star is in front of the O star. The abundances of WR 25
were found to be non-solar. Optical V-band data of WR 25 also show the
phase-locked variability, being at maximum near periastron passage. The results
based on the present analysis indicate that WR 25 is a colliding wind binary
where the presence of soft X-rays is attributed to individual components;
however, hard X-rays are due to the collision of winds.
","[{""version"":""v1"",""created"":""Wed, 28 May 2014 07:08:30 GMT""}]","2014-05-29"
"1405.7138","Christian Fr{\o}nsdal","Christian Fr{\o}nsdal","Action Principle for Hydrodynamics and Thermodynamics including general,
  rotational flows","This is a major revision. 28 pages,9 figures","Int.J,Mod.Phys. A32, 1741016 (2017","10.1142/S0217751X17410160",,"physics.gen-ph physics.flu-dyn","http://arxiv.org/licenses/nonexclusive-distrib/1.0/","  The restriction of hydrodynamics to non-viscous, potential (gradient,
irrotational) flows is a theory both simple and elegant; a favorite topic of
introductory textbooks. It is known that this theory can be formulated as an
action principle and expanded to include thermodynamicics. This paper presents
an action principle for hydrodynamics that includes general, rotational flows.
  The new theory is a combination of Eulerian and Lagrangian hydrodynamics,
with an extension to thermodynamics that includes all the elements of the
Gibbsean variational principle. In the first place it is an action principle
for adiabatic systems, including the usual conservation laws. Viscosity can be
introduced in the usual way, by adding a dissipative term to the momentum
equation. The equation for energy dissipation then follows. It is an ideal
framework for the description of quasi-static processes, including dissipation.
It is a major development of the Navier-Stokes-Fourier approach, the principal
advantage being a hamiltonian structure with a natural concept of energy in the
form of a first integral of the motion, conserved by virtue of the
Euler-Lagrange equations.
","[{""version"":""v1"",""created"":""Wed, 28 May 2014 07:10:37 GMT""},{""version"":""v2"",""created"":""Sun, 28 Sep 2014 20:46:04 GMT""},{""version"":""v3"",""created"":""Fri, 19 Jun 2015 13:40:44 GMT""},{""version"":""v4"",""created"":""Tue, 12 Jan 2016 17:39:19 GMT""}]","2019-05-29"
"1405.7139","Antti J Harju","Antti J. Harju","On Noncommutative Geometry of Orbifolds",,,"10.1142/S0219199715500273",,"math.DG math-ph math.MP math.OA","http://arxiv.org/licenses/nonexclusive-distrib/1.0/","  An orbifold is a Morita equivalence class of a proper {\' e}tale Lie
groupoid. A unitary equivalence class of spectral triples over the algebra of
smooth invariant functions are associated with any compact spin orbifold. In
the case of an effective spin orbifold we construct a collection of spectral
triples over the smooth convolution algebras of the representatives of the
Morita equivalence class.
","[{""version"":""v1"",""created"":""Wed, 28 May 2014 07:10:51 GMT""},{""version"":""v2"",""created"":""Tue, 10 Jun 2014 07:43:29 GMT""},{""version"":""v3"",""created"":""Sun, 29 Jun 2014 07:59:35 GMT""},{""version"":""v4"",""created"":""Mon, 15 Dec 2014 13:39:58 GMT""}]","2015-04-07"
"1405.7140","Hans-Joachim Hein","Ronan J. Conlon, Hans-Joachim Hein","Asymptotically conical Calabi-Yau manifolds, III","added more details concerning deformation to the normal cone and
  fixed a gap in the argument (normality of the central fibre)",,,,"math.DG","http://arxiv.org/licenses/nonexclusive-distrib/1.0/","  In a recent preprint, Chi Li proved that aymptotically conical complex
manifolds with regular tangent cone at infinity admit holomorphic
compactifications (his result easily extends to the quasiregular case). In this
short note, we show that if the open manifold is Calabi-Yau, then Chi Li's
compactification is projective algebraic. This has two applications. First,
every Calabi-Yau manifold of this kind can be constructed using our refined
Tian-Yau type theorem from the second article in this series. Secondly, we
prove classification theorems for such manifolds via deformation to the normal
cone. This includes Kronheimer's classification of ALE spaces and a uniqueness
theorem for Stenzel's metric.
","[{""version"":""v1"",""created"":""Wed, 28 May 2014 07:15:41 GMT""},{""version"":""v2"",""created"":""Fri, 27 Jun 2014 23:17:53 GMT""},{""version"":""v3"",""created"":""Sun, 10 Aug 2014 17:00:53 GMT""}]","2014-08-12"
"1405.7141","Ernst-Erich Doberkat","Ernst-Erich Doberkat and Pedro S\'anchez Terraf","Stochastic Nondeterminism and Effectivity Functions","Minor changes in the text, correction of typos; new and extended
  abstract; added an acknowledgement (paper accepted by J. Logic Comput.)",,,"SWT-Memo 200","cs.LO math.LO","http://arxiv.org/licenses/nonexclusive-distrib/1.0/","  This paper investigates stochastic nondeterminism on continuous state spaces
by relating nondeterministic kernels and stochastic effectivity functions to
each other. Nondeterministic kernels are functions assigning each state a set o
subprobability measures, and effectivity functions assign to each state an
upper-closed set of subsets of measures. Both concepts are generalizations of
Markov kernels used for defining two different models: Nondeterministic
labelled Markov processes and stochastic game models, respectively. We show
that an effectivity function that maps into principal filters is given by an
image-countable nondeterministic kernel, and that image-finite kernels give
rise to effectivity functions. We define state bisimilarity for the latter,
considering its connection to morphisms. We provide a logical characterization
of bisimilarity in the finitary case. A generalization of congruences (event
bisimulations) to effectivity functions and its relation to the categorical
presentation of bisimulation are also studied.
","[{""version"":""v1"",""created"":""Wed, 28 May 2014 07:21:03 GMT""},{""version"":""v2"",""created"":""Wed, 12 Nov 2014 09:27:02 GMT""},{""version"":""v3"",""created"":""Thu, 2 Jul 2015 12:19:44 GMT""},{""version"":""v4"",""created"":""Sun, 5 Jul 2015 11:00:49 GMT""}]","2015-07-07"
"1405.7142","Satadeep Bhattacharjee","Satadeep Bhattacharjee, Surendra Singh, Dawei Wang, Michel Viret and
  Laurent Bellaiche","Prediction of novel interface-driven spintronic effects","Accepted in J. Phys.::Condens. Matter",,"10.1088/0953-8984/26/31/315008",,"cond-mat.mtrl-sci cond-mat.mes-hall","http://arxiv.org/licenses/nonexclusive-distrib/1.0/","  The recently-proposed coupling between the angular momentum density and
magnetic moment [A. Raeliarijaona et al, Phys. Rev. Lett. 110, 137205 (2013)]
is shown here to result in the prediction of (i) novel spin currents generated
by an electrical current and (ii) new electrical currents induced by a spin
current in systems possessing specific interfaces between two different
materials. Some of these spin (electrical) currents can be reversed near the
interface by reversing the applied electrical (spin) current. Similarities and
differences between these novel spintronic effects and the well-known spin Hall
and inverse spin Hall effects are also discussed.
","[{""version"":""v1"",""created"":""Wed, 28 May 2014 07:22:08 GMT""}]","2015-06-19"
"1405.7143","Vimalkumar Jeyakumar","Vimalkumar Jeyakumar, Mohammad Alizadeh, Yilong Geng, Changhoon Kim,
  and David Mazi\`eres","Millions of Little Minions: Using Packets for Low Latency Network
  Programming and Visibility (Extended Version)",,,,,"cs.NI","http://arxiv.org/licenses/nonexclusive-distrib/1.0/","  This paper presents a practical approach to rapidly introduce new dataplane
functionality into networks: End-hosts embed tiny programs into packets to
actively query and manipulate a network's internal state. We show how this
""tiny packet program"" (TPP) interface gives end-hosts unprecedented visibility
into network behavior, enabling them to work with the network to achieve a
common goal. Our design leverages what each component does best: (a) switches
forward and execute tiny packet programs (at most 5 instructions) at line rate,
and (b) end-hosts perform arbitrary computation on network state, which are
easy to evolve. Using a hardware prototype on a NetFPGA, we show our design is
feasible, at a reasonable cost. By implementing three different research
proposals, we show that TPPs are also useful. And finally, we present an
architecture in which they can be made secure.
","[{""version"":""v1"",""created"":""Wed, 28 May 2014 07:22:23 GMT""},{""version"":""v2"",""created"":""Tue, 3 Jun 2014 08:00:30 GMT""},{""version"":""v3"",""created"":""Sat, 7 Jun 2014 01:59:56 GMT""}]","2014-06-10"
"1405.7144","Daniel Ahlberg","Daniel Ahlberg, Jeffrey E. Steif and G\'abor Pete","Scaling limits for the threshold window: When does a monotone Boolean
  function flip its outcome?","33 pages, 3 figure. A paper by Daniel Ahlberg and Jeffery E. Steif,
  with an appendix by G\'abor Pete. Added to the second version is the appendix
  (earlier published as arXiv:1507.05522) and a significant strengthening of
  Theorem 3, obtained jointly with Anders Martinsson. The third version updates
  the conjecture of the appendix","Annales de l'Institut Henri Poincar\'e Probabilit\'es et
  Statistiques, 53(4): 2135-2161, 2017",,,"math.PR math.CO","http://arxiv.org/licenses/nonexclusive-distrib/1.0/","  Consider a monotone Boolean function $f:\{0,1\}^n\to\{0,1\}$ and the
canonical monotone coupling $\{\eta_p:p\in[0,1]\}$ of an element in $\{0,1\}^n$
chosen according to product measure with intensity $p\in[0,1]$. The random
point $p\in[0,1]$ where $f(\eta_p)$ flips from $0$ to $1$ is often concentrated
near a particular point, thus exhibiting a threshold phenomenon. For a sequence
of such Boolean functions, we peer closely into this threshold window and
consider, for large $n$, the limiting distribution (properly normalized to be
nondegenerate) of this random point where the Boolean function switches from
being 0 to 1. We determine this distribution for a number of the Boolean
functions which are typically studied and pay particular attention to the
functions corresponding to iterated majority and percolation crossings. It
turns out that these limiting distributions have quite varying behavior. In
fact, we show that any nondegenerate probability measure on $\mathbb{R}$ arises
in this way for some sequence of Boolean functions.
","[{""version"":""v1"",""created"":""Wed, 28 May 2014 07:22:48 GMT""},{""version"":""v2"",""created"":""Mon, 24 Aug 2015 13:32:15 GMT""},{""version"":""v3"",""created"":""Fri, 29 Apr 2016 13:02:00 GMT""}]","2018-10-08"
"1405.7145","Ulrike Gr\""{o}mping","Ulrike Gr\""omping, Hongquan Xu","Generalized resolution for orthogonal arrays","Published in at http://dx.doi.org/10.1214/14-AOS1205 the Annals of
  Statistics (http://www.imstat.org/aos/) by the Institute of Mathematical
  Statistics (http://www.imstat.org)","Annals of Statistics 2014, Vol. 42, No. 3, 918-939","10.1214/14-AOS1205","IMS-AOS-AOS1205","math.ST stat.TH","http://arxiv.org/licenses/nonexclusive-distrib/1.0/","  The generalized word length pattern of an orthogonal array allows a ranking
of orthogonal arrays in terms of the generalized minimum aberration criterion
(Xu and Wu [Ann. Statist. 29 (2001) 1066-1077]). We provide a statistical
interpretation for the number of shortest words of an orthogonal array in terms
of sums of $R^2$ values (based on orthogonal coding) or sums of squared
canonical correlations (based on arbitrary coding). Directly related to these
results, we derive two versions of generalized resolution for qualitative
factors, both of which are generalizations of the generalized resolution by
Deng and Tang [Statist. Sinica 9 (1999) 1071-1082] and Tang and Deng [Ann.
Statist. 27 (1999) 1914-1926]. We provide a sufficient condition for one of
these to attain its upper bound, and we provide explicit upper bounds for two
classes of symmetric designs. Factor-wise generalized resolution values provide
useful additional detail.
","[{""version"":""v1"",""created"":""Wed, 28 May 2014 07:37:47 GMT""}]","2014-05-29"
"1405.7146","Martin Stefanak","Martin Stefanak, Iva Bezdekova and Igor Jex","Limit distributions of three-state quantum walks: the role of coin
  eigenstates",,"Phys. Rev. A 90, 012342 (2014)","10.1103/PhysRevA.90.012342",,"quant-ph","http://arxiv.org/licenses/nonexclusive-distrib/1.0/","  We analyze two families of three-state quantum walks which show the
localization effect. We focus on the role of the initial coin state and its
coherence in controlling the properties of the quantum walk. In particular, we
show that the description of the walk simplifies considerably when the initial
coin state is decomposed in the basis formed by the eigenvectors of the coin
operator. This allows us to express the limit distributions in a much more
convenient form. Consequently, striking features which are hidden in the
standard basis description are easily identified. Moreover, the dependence of
moments of the position distribution on the initial coin state can be analyzed
in full detail. In particular, we find that in the eigenvector basis the even
moments and the localization probability at the origin depend only on
incoherent combination of probabilities. In contrast, odd moments and
localization outside the origin are affected by the coherence of the initial
coin state.
","[{""version"":""v1"",""created"":""Wed, 28 May 2014 07:44:03 GMT""},{""version"":""v2"",""created"":""Thu, 28 Aug 2014 12:56:13 GMT""}]","2014-08-29"
"1405.7147","Abidin Kaya","Abidin Kaya, Bahattin Yildiz, and Irfan Siap","New extremal binary self-dual codes from F_4 + uF_4-lifts of quadratic
  double circulant codes over F_4","Under review since May 2014, 11 pages, 6 tables","Finite Fileds and Their Applications Volume 35 2015","10.1016/j.ffa.2015.05.004",,"math.CO cs.IT math.IT","http://arxiv.org/licenses/nonexclusive-distrib/1.0/","  In this work, quadratic double and quadratic bordered double circulant
constructions are applied to F_4 + uF_4 as well as F_4, as a result of which
extremal binary self-dual codes of length 56 and 64 are obtained. The binary
extension theorems as well as the ring extension version are used to obtain 7
extremal self-dual binary codes of length 58, 24 extremal self-dual binary
codes of length 66 and 29 extremal self-dual binary codes of length 68, all
with new weight enumerators, updating the list of all the known extremal
self-dual codes in the literature.
","[{""version"":""v1"",""created"":""Wed, 28 May 2014 07:53:14 GMT""}]","2016-02-25"
"1405.7148","Nicolae Sandu","N.I. Sandu","On identities in centrally nilpotent Moufang loops and centrally
  nilpotent A-loops","26 pages",,,,"math.GR","http://arxiv.org/licenses/nonexclusive-distrib/1.0/","  This paper proves that the variety generated by a centrally nilpotent Moufang
loop (or centrally nilpotent A-loop) is finitely based.
","[{""version"":""v1"",""created"":""Wed, 28 May 2014 07:53:54 GMT""}]","2014-05-29"
