"1405.7042","Guillermo Barro","G. Barro, J. R. Trump, D. C. Koo, A. Dekel, S. A. Kassin, D. D.
  Kocevski, S. M. Faber, A. van der Wel, Y. Guo, P. G. Perez-Gonzalez, E.
  Toloba, J. J. Fang, C. Pacifici, R. Simons, R D. Campbell, D. Ceverino, S. L.
  Finkelstein, B. Goodrich, M. Kassis, A. M. Koekemoer, N. P. Konidaris, R. C.
  Livermore, J. E. Lyke, B. Mobasher, H. Nayyeri, M. Peth, J. R. Primack, L.
  Rizzi, R. S. Somerville, G. D. Wirth, A. Zolotov","Keck-I MOSFIRE spectroscopy of compact star-forming galaxies at
  z$\gtrsim$2: High velocity dispersions in progenitors of compact quiescent
  galaxies","12 pages, 7 figures, submitted to ApJ",,"10.1088/0004-637X/795/2/145",,"astro-ph.GA","http://arxiv.org/licenses/nonexclusive-distrib/1.0/","  We present Keck-I MOSFIRE near-infrared spectroscopy for a sample of 13
compact star-forming galaxies (SFGs) at redshift $2\leq z \leq2.5$ with star
formation rates of SFR$\sim$100M$_{\odot}$ y$^{-1}$ and masses of
log(M/M$_{\odot}$)$\sim10.8$. Their high integrated gas velocity dispersions of
$\sigma_{\rm{int}}$=230$^{+40}_{-30}$ km s$^{-1}$, as measured from emission
lines of H$_{\alpha}$ and [OIII], and the resultant
M$_{\star}-\sigma_{\rm{int}}$ relation and M$_{\star}$$-$M$_{\rm{dyn}}$ all
match well to those of compact quiescent galaxies at $z\sim2$, as measured from
stellar absorption lines. Since log(M$_{\star}$/M$_{\rm{dyn}}$)$=-0.06\pm0.2$
dex, these compact SFGs appear to be dynamically relaxed and more evolved,
i.e., more depleted in gas and dark matter ($<$13$^{+17}_{-13}$\%) than their
non-compact SFG counterparts at the same epoch. Without infusion of external
gas, depletion timescales are short, less than $\sim$300 Myr. This discovery
adds another link to our new dynamical chain of evidence that compact SFGs at
$z\gtrsim2$ are already losing gas to become the immediate progenitors of
compact quiescent galaxies by $z\sim2$.
","[{""version"":""v1"",""created"":""Tue, 27 May 2014 20:00:15 GMT""}]","2015-06-19"
"1405.7043","Brian Metzger","Andrey D. Vlasov, Brian D. Metzger, Todd A. Thompson","Neutrino-heated winds from rotating proto-magnetars","15 pages, 14 figures, 4 tables, submitted to MNRAS",,"10.1093/mnras/stu1667",,"astro-ph.HE","http://arxiv.org/licenses/nonexclusive-distrib/1.0/","  We calculate the steady-state properties of neutrino-driven winds from
strongly magnetized, rotating proto-neutron stars (`proto-magnetars') under the
assumption that the outflow geometry is set by the force-free magnetic field of
an aligned dipole. Our goal is to assess proto-magnetars as sites of r-process
nucleosynthesis and gamma-ray burst engines. One dimensional solutions
calculated along flux tubes corresponding to different polar field lines are
stitched together to determine the global properties of the flow at a given
neutrino luminosity and rotation period. Proto-magnetars with rotation periods
of P~2-5 ms are shown to produce outflows more favorable for the production of
third-peak r-process nuclei due to their much shorter expansion times through
the seed nucleus formation region, yet only moderately lower entropies, as
compared to normal spherical PNS winds. Proto-magnetars with moderately rapid
birth periods P~3-5 ms may thus represent a promising Galactic r-process site
which is compatible with a variety of other observations, including the recent
discovery of possible magnetar-powered supernovae in metal poor galaxies. We
also confirm previous results that the outflows from proto-magnetars with P~1-2
ms can achieve maximum Lorentz factors Gamma ~ 100-1000 in the range necessary
to power gamma-ray bursts (GRBs). The implications of GRB jets with a heavy
nuclei-dominated composition as sources of ultra-high energy cosmic rays are
also addressed.
","[{""version"":""v1"",""created"":""Tue, 27 May 2014 20:00:15 GMT""}]","2015-06-19"
"1405.7044","Ander Retolaza","Sebastian Franco, Daniele Galloni, Ander Retolaza, Angel Uranga","Axion Monodromy Inflation on Warped Throats","39 pages, 18 figures. v3: version published in JHEP with references
  added",,"10.1007/JHEP02(2015)086","IFT-UAM/CSIC-14-046, FTUAM-14-19, IPPP/14/49, DCPT/14/98","hep-th hep-ph","http://arxiv.org/licenses/nonexclusive-distrib/1.0/","  Recent models of axion monodromy inflation in string theory link the
inflationary potential and the moduli stabilization potential. Realistic
inflationary models require mechanisms to moderately suppress the inflaton mass
with respect to the moduli stabilization scale. In this paper we explore the
realization of this idea using warped throats, whose redshifted infrared region
supports the inflaton mode. The inflaton potential and its monodromy arise from
couplings to the fluxes supporting the throat. We provide explicit realizations
of such throats in type IIB with NSNS and RR 3-form field strength fluxes, and
in type IIA with RR 2-form fluxes. Once embedded in a global CY, these systems
would provide a mechanism to realize chaotic inflation at scales parametrically
suppressed with respect to bulk physics. The construction of the throats is
systematically carried out using geometric transitions in systems of D-branes
at singularities, whose properties and dynamics are efficiently encoded using
dimer diagrams. The holographic dual of the axion monodromy is a quasi-periodic
chain of Seiberg dualities.
","[{""version"":""v1"",""created"":""Tue, 27 May 2014 20:00:15 GMT""},{""version"":""v2"",""created"":""Fri, 10 Apr 2015 00:05:29 GMT""},{""version"":""v3"",""created"":""Thu, 21 May 2015 09:18:06 GMT""}]","2015-06-19"
"1405.7045","Steven Gubser","Steven S. Gubser and Wei Song","An axial gauge ansatz for higher spin theories","12 pages. v2: Noted a complication with spacetime interpretation. v3:
  Revised section 4, correcting a limiting process",,"10.1007/JHEP11(2014)036","PUPT-2464","hep-th","http://arxiv.org/licenses/nonexclusive-distrib/1.0/","  We present an ansatz which makes the equations of motion more tractable for
the simplest of Vasiliev's four-dimensional higher spin theories. The ansatz is
similar to axial gauge in electromagnetism. We present a broad class of
solutions in the gauge where the spatial connection vanishes, and we discuss
the lift of one of these solutions to a full spacetime solution via a gauge
transformation.
","[{""version"":""v1"",""created"":""Tue, 27 May 2014 20:00:16 GMT""},{""version"":""v2"",""created"":""Thu, 17 Jul 2014 20:38:15 GMT""},{""version"":""v3"",""created"":""Fri, 7 Nov 2014 19:02:24 GMT""}]","2015-06-19"
"1405.7046","Nikolaos Kidonakis","Nikolaos Kidonakis","NNNLO soft-gluon corrections for the top-antitop pair production cross
  section","11 pages, 3 tables, 4 figures","Phys. Rev. D 90, 014006 (2014)","10.1103/PhysRevD.90.014006",,"hep-ph","http://arxiv.org/licenses/nonexclusive-distrib/1.0/","  I present a calculation of next-to-next-to-next-to-leading-order (NNNLO)
soft-gluon corrections for top-antitop pair production in hadronic collisions.
Approximate NNNLO (aNNNLO) results are obtained by adding the NNNLO soft-gluon
corrections to the complete next-to-next-to-leading-order (NNLO) cross section.
Theoretical predictions are shown for the total aNNNLO $t{\bar t}$ cross
section at LHC and Tevatron energies. The aNNNLO cross sections are larger but
have smaller theoretical uncertainties than at NNLO.
","[{""version"":""v1"",""created"":""Tue, 27 May 2014 20:00:16 GMT""}]","2014-07-09"
"1405.7047","Xinyu Dai","Rhiannon D. Griffin (1), Xinyu Dai (1), Christopher S. Kochanek (2)
  ((1) University of Oklahoma, (2) Ohio State University)","New Limits On Gamma-Ray Emission From Galaxy Clusters","5 pages, 3 figures, 2 tables, Accepted by ApJ Letters",,"10.1088/2041-8205/795/1/L21",,"astro-ph.HE astro-ph.CO","http://arxiv.org/licenses/nonexclusive-distrib/1.0/","  Galaxy clusters are predicted to produce gamma-rays through cosmic ray
interactions and/or dark matter annihilation, potentially detectable by the
Fermi Large Area Telescope (Fermi-LAT). We present a new, independent stacking
analysis of Fermi-LAT photon count maps using the 78 richest nearby clusters
(z<0.12) from the Two Micron All-Sky Survey (2MASS) cluster catalog. We obtain
the lowest limit on the photon flux to date, 2.3e-11 ph/s/cm^2 (95% confidence)
per cluster in the 0.8-100 GeV band, which corresponds to a luminosity limit of
3.5e44 ph/s. We also constrain the emission limits in a range of narrower
energy bands. Scaling to recent cosmic ray acceleration and gamma-ray emission
models, we find that cosmic rays represent a negligible contribution to the
intra-cluster energy density and gas pressure.
","[{""version"":""v1"",""created"":""Tue, 27 May 2014 20:00:16 GMT""},{""version"":""v2"",""created"":""Thu, 2 Oct 2014 18:22:16 GMT""}]","2015-06-19"
"1405.7048","Guo Chen","Guo Chen (1 and 2), Roy van Boekel (2), Hongchi Wang (1), Nikolay
  Nikolov (2 and 3), Ulf Seemann (4), Thomas Henning (2) ((1) PMO, (2) MPIA,
  (3) U. Exeter, (4) IAG)","Observed spectral energy distribution of the thermal emission from the
  dayside of WASP-46b","8 pages, 7 figures, accepted for publication in A&A",,"10.1051/0004-6361/201423795",,"astro-ph.EP astro-ph.SR","http://arxiv.org/licenses/nonexclusive-distrib/1.0/","  We aim to construct a spectral energy distribution (SED) for the emission
from the dayside atmosphere of the hot Jupiter WASP-46b and to investigate its
energy budget. We observed a secondary eclipse of WASP-46b simultaneously in
the g'r'i'z'JHK bands using the GROND instrument on the MPG/ESO 2.2m telescope.
Eclipse depths of the acquired light curves were derived to infer the
brightness temperatures at multibands that cover the SED peak. We report the
first detection of the thermal emission from the dayside of WASP-46b in the K
band at 4.2-sigma level and tentative detections in the H (2.5-sigma) and J
(2.3-sigma) bands, with flux ratios of 0.253 +0.063/-0.060%, 0.194 +/- 0.078%,
and 0.129 +/- 0.055%, respectively. The derived brightness temperatures (2306
+177/-187K, 2462 +245/-302K, and 2453 +198/-258K, respectively) are consistent
with an isothermal temperature profile of 2386K, which is significantly higher
than the dayside-averaged equilibrium temperature, indicative of very poor heat
redistribution efficiency. We also investigate the tentative detections in the
g'r'i' bands and the 3-sigma upper limit in the z' band, which might indicate
the existence of reflective clouds if these tentative detections do not arise
from systematics.
","[{""version"":""v1"",""created"":""Tue, 27 May 2014 20:00:16 GMT""}]","2014-07-09"
"1405.7049","Brian Batell","Brian Batell, Patrick deNiverville, David McKeen, Maxim Pospelov, Adam
  Ritz","Leptophobic Dark Matter at Neutrino Factories","15 pages, 8 figures","Phys. Rev. D 90, 115014 (2014)","10.1103/PhysRevD.90.115014",,"hep-ph hep-ex","http://arxiv.org/licenses/nonexclusive-distrib/1.0/","  High-luminosity fixed-target neutrino experiments present a new opportunity
to search for light sub-GeV dark matter and associated new forces. We analyze
the physics reach of these experiments to light leptophobic dark states coupled
to the Standard Model via gauging the $U(1)_B$ baryon current. When the
baryonic vector is light, and can decay to dark matter, we find that the
MiniBooNE experiment in its current beam-dump configuration can extend
sensitivity to the baryonic fine structure constant down to $\alpha_B\sim
10^{-6}$. This is significantly below the existing limits over much of the
sub-GeV mass range currently inaccessible to direct detection experiments.
","[{""version"":""v1"",""created"":""Tue, 27 May 2014 20:00:20 GMT""}]","2014-12-31"
"1405.7050","Richard Parker","Richard J. Parker (Liverpool John Moores University, UK)","Probing brown dwarf formation mechanisms with Gaia","4 pages. Proceedings of the GREAT-ESF workshop ""Gaia and the unseen -
  the brown dwarf question"", Torino, 24-26 March 2014, to be published in
  Memorie della Societa' Astronomica Italiana (SAIt), eds Ricky Smart, David
  Barrado, Jackie Faherty",,,,"astro-ph.GA","http://arxiv.org/licenses/nonexclusive-distrib/1.0/","  One of the fundamental questions in star formation is whether or not brown
dwarfs form in the same way as stars, or more like giant planets. If their
formation scenarios are different, we might expect brown dwarfs to have a
different spatial distribution to stars in nearby star-forming regions. In this
contribution, we discuss methods to look for differences in their spatial
distributions and show that in the only nearby star-forming region with a
significantly different spatial distribution (the Orion Nebula Cluster), this
is likely due to dynamical evolution. We then present a method for unravelling
the past dynamical history of a star-forming region, and show that in tandem
with Gaia, we will be able to discern whether observed differences are due to
distinct formation mechanisms for brown dwarfs compared to stars.
","[{""version"":""v1"",""created"":""Tue, 27 May 2014 20:00:41 GMT""}]","2014-05-29"
"1405.7051","Gregory Feiden","Gregory A. Feiden, Brian Chaboyer","Revised age for CM Draconis and WD 1633+572: Toward a resolution of
  model-observation radius discrepancies","Accepted to A&A, 7 pages, 3 figures, 1 table","A&A 571, A70 (2014)","10.1051/0004-6361/201424288",,"astro-ph.SR","http://arxiv.org/licenses/nonexclusive-distrib/1.0/","  We report an age revision for the low-mass detached eclipsing binary CM
Draconis and its common proper motion companion, WD 1633+572. An age of 8.5
$\pm$ 3.5 Gyr is found by combining an age estimate for the lifetime of WD
1633+572 and an estimate from galactic space motions. The revised age is
greater than a factor of two older than previous estimates. Our results provide
consistency between the white dwarf age and the system's galactic kinematics,
which reveal the system is a highly probable member of the galactic thick disk.
We find the probability that CM Draconis and WD 1633+572 are members of the
thick disk is 8500 times greater than the probability that they are members of
the thin disk and 170 times greater than the probability they are halo
interlopers. If CM Draconis is a member of the thick disk, it is likely
enriched in $\alpha$-elements compared to iron by at least 0.2 dex relative to
the Sun. This leads to the possibility that previous studies under-estimate the
[Fe/H] value, suggesting the system has a near-solar [Fe/H]. Implications for
the long-standing discrepancies between the radii of CM Draconis and
predictions from stellar evolution theory are discussed. We conclude that CM
Draconis is only inflated by about 2% compared to stellar evolution
predictions.
","[{""version"":""v1"",""created"":""Tue, 27 May 2014 20:02:51 GMT""},{""version"":""v2"",""created"":""Thu, 18 Sep 2014 14:04:39 GMT""}]","2014-11-11"
"1405.7052","Kenneth Long","J. Cao, A. de Gouv\^ea, D. Duchesneau, R. Funchal, S. Geer, S.B. Kim,
  T. Kobayashi, K. Long, M. Maltoni, M. Mezzetto, N. Mondal, M. Shiozawa, J.
  Sobczyk, H. A. Tanaka, M. Wascko, G. Zeller","Initial report from the ICFA Neutrino Panel","ICFA Neutrino Panel 2014(01)",,,,"physics.acc-ph hep-ex physics.ins-det","http://arxiv.org/licenses/nonexclusive-distrib/1.0/","  In July 2013 ICFA established the Neutrino Panel with the mandate ""To promote
international cooperation in the development of the accelerator-based
neutrino-oscillation program and to promote international collaboration in the
development a neutrino factory as a future intense source of neutrinos for
particle physics experiments"". This, the Panel's Initial Report, presents the
conclusions drawn by the Panel from three regional ""Town Meetings"" that took
place between November 2013 and February 2014.
  After a brief introduction and a short summary of the status of the knowledge
of the oscillation parameters, the report summarises the approved programme and
identifies opportunities for the development of the field. In its conclusions,
the Panel recognises that to maximise the discovery potential of the
accelerator-based neutrino-oscillation programme it will be essential to
exploit the infrastructures that exist at CERN, FNAL and J-PARC and the
expertise and resources that reside in laboratories and institutes around the
world. Therefore, in its second year, the Panel will consult with the
accelerator-based neutrino-oscillation community and its stakeholders to:
develop a road-map for the future accelerator-based neutrino-oscillation
programme that exploits the ambitions articulated at CERN, FNAL and J-PARC and
includes the programme of measurement and test-beam exposure necessary to
ensure the programme is able to realise its potential; develop a proposal for a
coordinated ""Neutrino RD"" programme, the accelerator and detector R&D programme
required to underpin the next generation of experiments; and to explore the
opportunities for the international collaboration necessary to realise the
Neutrino Factory.
","[{""version"":""v1"",""created"":""Tue, 27 May 2014 20:07:30 GMT""}]","2014-05-29"
"1405.7053","Diego Rossi Gratieri","D. R. Gratieri and O. L. G. Peres","Searching for non-diagonal Mass varying mechanism in the
  $\nu_{\mu}$-$\nu_{\tau}$ system","16 pages, 9 figures",,"10.1103/PhysRevD.90.013011",,"hep-ph","http://arxiv.org/licenses/nonexclusive-distrib/1.0/","  We use atmospheric neutrino data and MINOS data to constrain the MaVaN (Mass
Varying Neutrinos) mechanism. The MaVaN model was largely studied in cosmology
scenarios and comes from the coupling of the neutrinos with a neutral scalar
depending on the local matter density. For atmospheric neutrinos, this new
interaction affects the neutrino propagation inside the Earth, and as
consequence, induces modifications in their oscillation pattern. To perform
such test for a non-standard oscillation mechanism with a non-diagonal neutrino
coupling in the mass basis, we analyze the angular distribution of atmospheric
neutrino events as seen by the Super-Kamiokande experiment for the events in
the Sub-GeV and multi-GeV range and muon neutrinos (anti-neutrinos) in MINOS
experiment. From the combined analysis of these two sets of data we obtain the
best fit for $\Delta m^{2}_{32}=2.45 \times 10^{-3}$ eV$^{2}$,
$sin^{2}(\theta_{23})=0.42 $ and MaVaN parameter $\alpha_{32}=0.28$ with modest
improvement, $\Delta \chi^{2}= 1.8$, over the standard oscillation scenario.
The combination of MINOS data and Super-Kamiokande data prefers small values of
MaVaN parameter $\alpha_{32} < 0.31 $ at $90 \%$ C. L..
","[{""version"":""v1"",""created"":""Tue, 27 May 2014 20:08:35 GMT""}]","2014-11-26"
"1405.7054","Roman Rafikov","Roman R. Rafikov and Kedron Silsbee (Princeton)","Planet formation in stellar binaries I: planetesimal dynamics in massive
  protoplanetary disks","18 pages, 9 figures, resubmitted after addressing ApJ referee report",,"10.1088/0004-637X/798/2/69",,"astro-ph.EP","http://arxiv.org/licenses/nonexclusive-distrib/1.0/","  About $20\%$ of exoplanets discovered by radial velocity surveys reside in
stellar binaries. To clarify their origin one has to understand the dynamics of
planetesimals in protoplanetary disks within binaries. The standard
description, accounting for only gas drag and gravity of the companion star has
been challenged recently, as the gravity of the protoplanetary disk was shown
to play a crucial role in planetesimal dynamics. An added complication is the
tendency of protoplanetary disks in binaries to become eccentric, giving rise
to additional excitation of planetesimal eccentricity. Here, for the first
time, we analytically explore secular dynamics of planetesimals in binaries
such as $\alpha$ Cen and $\gamma$ Cep under the combined action of (1) gravity
of the eccentric protoplanetary disk, (2) perturbations due to the (coplanar)
eccentric companion, and (3) gas drag. We derive explicit solutions for the
behavior of planetesimal eccentricity ${\bf e}_p$ in non-precessing disks (and
in precessing disks in certain limits). We obtain the analytical form of the
distribution of relative velocities of planetesimals, which is a key input for
understanding their collisional evolution. Disk gravity strongly influences
relative velocities and tends to push sizes of planetesimals colliding with
comparable objects at the highest speed to small values, $\sim 1$ km. We also
find that planetesimals in eccentric protoplanetary disks apsidally aligned
with the binary orbit collide at lower relative velocities than in mis-aligned
disks. Our results highlight a decisive role that disk gravity plays in
planetesimal dynamics in binaries.
","[{""version"":""v1"",""created"":""Tue, 27 May 2014 20:11:17 GMT""},{""version"":""v2"",""created"":""Thu, 21 Aug 2014 19:51:13 GMT""}]","2015-06-19"
"1405.7055","Christopher Stark","Christopher C. Stark, Glenn Schneider, Alycia J. Weinberger, John H.
  Debes, Carol A. Grady, Hannah Jang-Condell, Marc J. Kuchner","Revealing Asymmetries in the HD 181327 Debris Disk: A Recent Massive
  Collision or ISM Warping","Accepted for publication in ApJ",,"10.1088/0004-637X/789/1/58",,"astro-ph.SR astro-ph.EP","http://arxiv.org/licenses/nonexclusive-distrib/1.0/","  New multi-roll coronagraphic images of the HD 181327 debris disk obtained
using the Space Telescope Imaging Spectrograph (STIS) on board the Hubble Space
Telescope (HST) reveal the debris ring in its entirety at high S/N and
unprecedented spatial resolution. We present and apply a new multi-roll image
processing routine to identify and further remove quasi-static PSF-subtraction
residuals and quantify systematic uncertainties. We also use a new iterative
image deprojection technique to constrain the true disk geometry and
aggressively remove any surface brightness asymmetries that can be explained
without invoking dust density enhancements/deficits. The measured empirical
scattering phase function for the disk is more forward scattering than
previously thought and is not well-fit by a Henyey-Greenstein function. The
empirical scattering phase function varies with stellocentric distance,
consistent with the expected radiation pressured-induced size segregation
exterior to the belt. Within the belt, the empirical scattering phase function
contradicts unperturbed debris ring models, suggesting the presence of an
unseen planet. The radial profile of the flux density is degenerate with a
radially-varying scattering phase function; therefore estimates of the ring's
true width and edge slope may be highly uncertain. We detect large scale
asymmetries in the disk, consistent with either the recent catastrophic
disruption of a body with mass >1% the mass of Pluto, or disk warping due to
strong interactions with the interstellar medium (ISM).
","[{""version"":""v1"",""created"":""Tue, 27 May 2014 20:11:35 GMT""}]","2015-06-19"
"1405.7056","Daniele Pranzetti","Amit Ghosh and Daniele Pranzetti","CFT/Gravity Correspondence on the Isolated Horizon","22 pages, 2 figure; some important passages have been explained more
  in detail","Nuclear Physics B 889 (2014) 1","10.1016/j.nuclphysb.2014.10.002",,"gr-qc hep-th","http://arxiv.org/licenses/nonexclusive-distrib/1.0/","  A quantum isolated horizon can be modeled by an SU(2) Chern-Simons theory on
a punctured 2-sphere. We show how a local 2-dimensional conformal symmetry
arises at each puncture inducing an infinite set of new observables localized
at the horizon which satisfy a Kac-Moody algebra. By means of the isolated
horizon boundary conditions, we represent the gravitational fluxes degrees of
freedom in terms of the zero modes of the Kac-Moody algebra defined on the
boundary of a punctured disk. In this way, our construction encodes a precise
notion of CFT/gravity correspondence. The higher modes in the algebra represent
new nongeometric charges which can be represented in terms of free matter field
degrees of freedom. When computing the CFT partition function of the system,
these new states induce an extra degeneracy factor, representing the density of
horizon states at a given energy level, which reproduces the Bekenstein's
holographic bound for an imaginary Immirzi parameter. This allows us to recover
the Bekenstein-Hawking entropy formula without the large quantum gravity
corrections associated with the number of punctures.
","[{""version"":""v1"",""created"":""Tue, 27 May 2014 20:30:22 GMT""},{""version"":""v2"",""created"":""Fri, 17 Oct 2014 15:52:50 GMT""}]","2014-10-20"
"1405.7057","Brett McGuire","Brett A. McGuire, P. Brandon Carroll, James L. Sanders III, Susanna L.
  Widicus Weaver, Geoffrey A. Blake, and Anthony J. Remijan","A CSO Search for $l$-C$_3$H$^+$: Detection in the Orion Bar PDR","9 pages, 8 figures, 4 tables",,"10.1093/mnras/stu1047",,"astro-ph.GA","http://arxiv.org/licenses/nonexclusive-distrib/1.0/","  The results of a Caltech Submillimeter Observatory (CSO) search for
$l$-C$_3$H$^+$, first detected by Pety et al. (2012) in observations toward the
Horsehead photodissociation region (PDR), are presented. A total of 39 sources
were observed in the 1 mm window. Evidence of emission from $l$-C$_3$H$^+$ is
found in only a single source - the Orion Bar PDR region, which shows a
rotational temperature of 178(13) K and a column density of 7(2) x $10^{11}$
cm$^{-2}$. In the remaining sources, upper limits of ~10$^{11} - 10^{13}$
cm$^{-2}$ are found. These results are discussed in the context of guiding
future observational searches for this species.
","[{""version"":""v1"",""created"":""Tue, 27 May 2014 20:32:17 GMT""}]","2015-06-19"
