"1406.1424","Francesco Cefal\`a","Stefan Antusch, Francesco Cefala, David Nolde and Stefano Orani","False vacuum energy dominated inflation with large $r$ and the
  importance of $\kappa_s$","16 pages, 5 figures; v2: matches publication in JCAP","JCAP 1410 (2014) 10, 015","10.1088/1475-7516/2014/10/015",,"hep-ph astro-ph.CO hep-th","http://arxiv.org/licenses/nonexclusive-distrib/1.0/","  We investigate to which extent and under which circumstances false vacuum
energy ($V_0$) dominated slow-roll inflation is compatible with a large
tensor-to-scalar ratio $r = O(0.1)$, as indicated by the recent BICEP2
measurement. With $V_0$ we refer to a constant contribution to the inflaton
potential, present before a phase transition takes place and absent in the true
vacuum of the theory, like e.g. in hybrid inflation. Based on model-independent
considerations, we derive an upper bound on the possible amount of $V_0$
domination and highlight the importance of higher-order runnings of the scalar
spectral index (beyond $\alpha_s$) in order to realise scenarios of $V_0$
dominated inflation. We study the conditions for $V_0$ domination explicitly
with an inflaton potential reconstruction around the inflaton field value 50
e-folds before the end of inflation, taking into account the present
observational data. To this end, we provide the up-to-date parameter
constraints within $\Lambda$CDM + $r$ + $\alpha_s$ + $\kappa_s$ using the
cosmological parameter estimation code Monte Python together with the Boltzmann
code CLASS.
","[{""version"":""v1"",""created"":""Thu, 5 Jun 2014 16:01:30 GMT""},{""version"":""v2"",""created"":""Wed, 22 Oct 2014 18:21:51 GMT""}]","2014-10-23"
"1406.1425","Davide Rotta","Davide Rotta, Marco De Michielis, Elena Ferraro, Marco Fanciulli,
  Enrico Prati","Maximum density of quantum information in a scalable CMOS implementation
  of the hybrid qubit architecture",,"Quantum Information Processing, Topical Collection 15, 2253-2274
  (2016)",,,"quant-ph cond-mat.mes-hall","http://arxiv.org/licenses/nonexclusive-distrib/1.0/","  Scalability from single qubit operations to multi-qubit circuits for quantum
information processing requires architecture-specific implementations.
Semiconductor hybrid qubit architecture is a suitable candidate to realize
large scale quantum information processing, as it combines a universal set of
logic gates with fast and all-electrical manipulation of qubits. We propose an
implementation of hybrid qubits, based on Si Metal-Oxide-Semiconductor (MOS)
quantum dots, compatible with the CMOS industrial technologic standards. We
discuss the realization of multi-qubit circuits capable of fault-tolerant
computation and quantum error correction, by evaluating the time and space
resources needed for their implementation. As a result, the maximum density of
quantum information is extracted from a circuit including 8 logical qubits
encoded by the [[7,1,3]] Steane code. The corresponding surface density of
logical qubits is 2.6 Mqubit/cm$^2$.
","[{""version"":""v1"",""created"":""Thu, 5 Jun 2014 16:03:36 GMT""}]","2018-09-05"
"1406.1426","Charles Epstein","Charles L. Epstein and Rafe Mazzeo","Harnack Inequalities and Heat-kernel Estimates for Degenerate Diffusion
  Operators Arising in Population Biology","This version corrects a small gap in the argument used to estimate
  the contribution of vector fields and potentials with log-divergent
  coefficients (the old Lemma B.2)",,,,"math.AP math.PR math.SP q-bio.PE","http://arxiv.org/licenses/nonexclusive-distrib/1.0/","  This paper continues the analysis, started in [2, 3], of a class of
degenerate elliptic operators defined on manifolds with corners, which arise in
Population Biology. Using techniques pioneered by J. Moser, and extended and
refined by L. Saloff-Coste, Grigoryan, and Sturm, we show that weak solutions
to the parabolic problem defined by a sub-class of these operators, which
consists of those that can be defined by Dirichlet forms and have non-vanishing
transverse vector field, satisfy a Harnack inequality. This allows us to
conclude that the solutions to these equations belong, for positive times, to
the natural anisotropic Holder spaces, and also leads to upper and, in some
cases, lower bounds for the heat kernels of these operators. These results
imply that these operators have a compact resolvent when acting on $C^0$ or
$L^2.$ The proof relies upon a scale invariant Poincare inequality that we
establish for a large class of weighted Dirichlet forms, as well as estimates
to handle certain mildly singular perturbation terms. The weights that we
consider are neither Ahlfors regular, nor do they generally belong to the
Muckenhaupt class $A_2.$
","[{""version"":""v1"",""created"":""Thu, 5 Jun 2014 16:04:11 GMT""},{""version"":""v2"",""created"":""Mon, 11 Aug 2014 14:55:36 GMT""}]","2014-08-12"
"1406.1427","Igor Vaskivskyi","Damjan Svetin, Igor Vaskivskyi, Petra Sutar, Jan Gospodaric, Tomaz
  Mertelj, Dragan Mihailovic","The effect of strain on the thawing of the hidden state and other
  transitions in 1T-TaS2",,,,,"cond-mat.mtrl-sci cond-mat.str-el","http://arxiv.org/licenses/nonexclusive-distrib/1.0/","  We investigate the effect of 2-dimensional (in-plane) strain on the critical
transition temperature TH from the photoexcited hidden state in 1T-TaS$_2$ thin
films on different substrates. We also measure the effect of in-plane strain on
the transition temperature $T_{c2}$ between the nearly commensurate
charge-density wave state and the commensurate state near 200 K. In each case,
the strain is caused by the differential contraction of the sample and the
substrate, and ranges from 0.5 % compressive strain (CaF$_2$) to 2 % tensile
strain (sapphire). Strain appears to have an opposite effect on the H state and
the NC-C state transitions. TH shows a large and negative strain coefficient of
dT$_H$/de = - 8900+/-500 K, while $T_{c2}$ is not strongly affected by tensile
strain and shows a positive coefficient for compressive strain, which is
opposite to the effect observed for hydrostatic pressure.
","[{""version"":""v1"",""created"":""Thu, 5 Jun 2014 16:06:40 GMT""}]","2014-06-06"
"1406.1428","Carlo Felice Manara","C.F. Manara (1), L. Testi (1,2,3), A. Natta (2,4), G. Rosotti (5,6),
  M. Benisty (7), B. Ercolano (5,3), L. Ricci (8) ((1) ESO-Garching, (2)
  INAF-Arcetri, (3) Excellence Cluster Universe, (4) Dublin Institute for
  Advanced Studies, (5) Universitats-Sternwarte Munich, (6) MPE-Garching, (7)
  Institut de Planetologie et Astrophysique Grenoble, (8) Caltech)","On the gas content of transitional disks: a VLT/X-Shooter study of
  accretion and winds","Accepted on Astronomy & Astrophysics. Abstract shortened to fit arXiv
  constraints","A&A 568, A18 (2014)","10.1051/0004-6361/201323318",,"astro-ph.SR","http://arxiv.org/licenses/nonexclusive-distrib/1.0/","  Transitional disks (TDs) are thought to be a late evolutionary stage of
protoplanetary disks with dust depleted inner regions. The mechanism
responsible for this depletion is still under debate. To constrain the models
it is mandatory to have a good understanding of the properties of the gas
content of the inner disk. Using X-Shooter broad band -UV to NIR- medium
resolution spectroscopy we derive the stellar, accretion, and wind properties
of a sample of 22 TDs. The analysis of these properties allows us to put strong
constraints on the gas content in a region very close to the star (<0.2 AU)
which is not accessible with any other observational technique. We fit the
spectra with a self-consistent procedure to derive simultaneously SpT,Av,and
mass accretion rates (Macc) of the targets. From forbidden emission lines we
derive the wind properties of the targets. Comparing our findings to values for
cTTs, we find that Macc and wind properties of 80% of the TDs in our sample,
which is strongly biased towards strongly accreting objects, are comparable to
those of cTTs. Thus, there are (at least) some TDs with Macc compatible with
those of cTTs, irrespective of the size of the dust inner hole.Only in 2 cases
Macc are much lower, while the wind properties are similar. We do not see any
strong trend of Macc with the size of the dust depleted cavity, nor with the
presence of a dusty optically thick disk close to the star. In the TDs in our
sample there is a gas rich inner disk with density similar to that of cTTs
disks. At least for some TDs, the process responsible of the inner disk
clearing should allow for a transfer of gas from the outer disk to the inner
region. This should proceed at a rate that does not depend on the physical
mechanism producing the gap seen in the dust emission and results in a gas
density in the inner disk similar to that of unperturbed disks around stars of
similar mass.
","[{""version"":""v1"",""created"":""Thu, 5 Jun 2014 16:07:14 GMT""}]","2014-09-05"
"1406.1429","Zhi Wang","Zhi Wang, Qi-Feng Liang, Dao-Xin Yao, and Xiao Hu","Viewing Majorana Bound States by Rabi Oscillations",,"Scientific Reports 5, 11686 (2015)","10.1038/srep11686",,"cond-mat.mes-hall cond-mat.supr-con","http://arxiv.org/licenses/nonexclusive-distrib/1.0/","  Rabi oscillation is a pure quantum phenomenon where the system jumps forth
and back between two quantum levels under stimulation of a microwave, and a
resonance occurs when the energy difference is matched by the photon energy.
Rabi oscillations have been observed in various quantum systems so far, and
especially are used to demonstrate the quantum coherence of quantum bits. In
the present work, we explore Rabi oscillation in a system accommodating the
elusive Majorana bound states (MBSs) under intensive search recently. The
proposed setup is constructed by a quantum dot (QD) and a superconducting
quantum interference device (SQUID), where a semiconductor nanowire with
spin-orbital coupling in the topological state is introduced to form Josephson
junction. When the coupling between QD and the Josephson junction is tuned by
an ac gate voltage, Rabi oscillation takes place among quantum states formed by
QD and MBSs, which makes it possible to reveal bizarre properties of MBSs by
sensing the electron occupation on QD. Especially, one should be able to
observe the fractional Josephson relation $\cos(\pi\Phi/\Phi_0)$ unique to MBSs
with $\Phi$ the magnetic flux applied in the SQUID and $\Phi_0=hc/2e$ the flux
quantum. The system has been investigated in terms of the analytic Floquet
theorem and numerical simulations with fine agreement.
","[{""version"":""v1"",""created"":""Thu, 5 Jun 2014 16:15:01 GMT""}]","2015-07-13"
"1406.1430","Mattias Jonsson","Mattias Jonsson","Degenerations of amoebae and Berkovich spaces","To appear in Math. Ann",,,,"math.AG math.CV","http://arxiv.org/licenses/nonexclusive-distrib/1.0/","  We prove a continuity result for the fibers of the Berkovich analytification
of a complex algebraic variety with respect to the the maximum of the
Archimedean norm and the trivial norm. As a consequence, we obtain
generalizations of a result of Mikhalkin and Rullgard about degenerations of
amoebae onto tropical varieties.
","[{""version"":""v1"",""created"":""Thu, 5 Jun 2014 16:16:11 GMT""},{""version"":""v2"",""created"":""Tue, 7 Apr 2015 19:22:30 GMT""}]","2015-04-08"
"1406.1432","Aser Cortines","Aser Cortines","The genealogy of a solvable population model under selection with
  dynamics related to directed polymers","Published at http://dx.doi.org/10.3150/15-BEJ726 in the Bernoulli
  (http://isi.cbs.nl/bernoulli/) by the International Statistical
  Institute/Bernoulli Society (http://isi.cbs.nl/BS/bshome.htm)","Bernoulli 2016, Vol. 22, No. 4, 2209-2236","10.3150/15-BEJ726","IMS-BEJ-BEJ726","math.PR","http://arxiv.org/licenses/nonexclusive-distrib/1.0/","  We consider a stochastic model describing a constant size $N$ population that
may be seen as a directed polymer in random medium with $N$ sites in the
transverse direction. The population dynamics is governed by a noisy traveling
wave equation describing the evolution of the individual fitnesses. We show
that under suitable conditions the generations are independent and the model is
characterized by an extended Wright-Fisher model, in which the individual $i$
has a random fitness $\eta_i$ and the joint distribution of offspring
$(\nu_1,\ldots,\nu_N)$ is given by a multinomial law with $N$ trials and
probability outcomes $\eta_i$'s. We then show that the average coalescence
times scales like $\log N$ and that the limit genealogical trees are governed
by the Bolthausen-Sznitman coalescent, which validates the predictions by
Brunet, Derrida, Mueller and Munier for this class of models. We also study the
extended Wright-Fisher model, and show that, under certain conditions on
$\eta_i$, the limit may be Kingman's coalescent, a coalescent with multiple
collisions, or a coalescent with simultaneous multiple collisions.
","[{""version"":""v1"",""created"":""Thu, 5 Jun 2014 16:20:01 GMT""},{""version"":""v2"",""created"":""Mon, 6 Jun 2016 07:19:32 GMT""}]","2016-06-07"
"1406.1433","Nicolas Bousquet","Marthe Bonamy and Nicolas Bousquet","Reconfiguring Independent Sets in Cographs",,,,,"cs.DM math.CO","http://arxiv.org/licenses/nonexclusive-distrib/1.0/","  Two independent sets of a graph are adjacent if they differ on exactly one
vertex (i.e. we can transform one into the other by adding or deleting a
vertex). Let $k$ be an integer. We consider the reconfiguration graph
$TAR_k(G)$ on the set of independent sets of size at least $k$ in a graph $G$,
with the above notion of adjacency. Here we provide a cubic-time algorithm to
decide whether $TAR_k(G)$ is connected when $G$ is a cograph, thus solving an
open question of~[Bonsma 2014]. As a by-product, we also describe a linear-time
algorithm which decides whether two elements of $TAR_k(G)$ are in the same
connected component.
","[{""version"":""v1"",""created"":""Thu, 5 Jun 2014 16:21:51 GMT""}]","2014-06-06"
"1406.1434","J. D. Burton","Xiaohui Liu, J. D. Burton and Evgeny Y. Tsymbal","Electric control of spin injection into a ferroelectric semiconductor","4 pages, 4 figures",,"10.1103/PhysRevLett.114.046601",,"cond-mat.mtrl-sci","http://arxiv.org/licenses/nonexclusive-distrib/1.0/","  Electric-field control of spin-dependent properties has become one of the
most attractive phenomena in modern materials research due the promise of new
device functionalities. One of the paradigms in this approach is to
electrically toggle the spin polarization of carriers injected into a
semiconductor using ferroelectric polarization as a control parameter. Using
first-principles density functional calculations, we explore the effect of
ferroelectric polarization of electron-doped BaTiO3 (n-BaTiO3) on the
spin-polarized transmission across the SrRuO3/n-BaTiO3 (001) interface. Our
study reveals that the interface transmission is negatively spin-polarized and
that ferroelectric polarization reversal leads to a change in the transport
spin polarization from -65% to -98%. We show that this effect stems from the
large difference in Fermi wave vectors between up- and down-spins in
ferromagnetic SrRuO3 and a change in the transport regime driven by
ferroelectric polarization switching. The predicted sizeable change in the spin
polarization provides a non-volatile mechanism to electrically control spin
injection in semiconductor-based spintronics devices.
","[{""version"":""v1"",""created"":""Thu, 5 Jun 2014 16:23:40 GMT""}]","2015-06-19"
"1406.1435","Thomas Hangelbroek","Thomas Hangelbroek, Francis J. Narcowich, Christian Rieger, Joseph D.
  Ward","Direct and Inverse Results on Bounded Domains for Meshless Methods via
  Localized Bases on Manifolds","29 pages. To appear in Festschrift for the 80th Birthday of Ian Sloan",,,,"math.NA math.CA","http://arxiv.org/licenses/nonexclusive-distrib/1.0/","  This article develops direct and inverse estimates for certain finite
dimensional spaces arising in kernel approximation. Both the direct and inverse
estimates are based on approximation spaces spanned by local Lagrange functions
which are spatially highly localized. The construction of such functions is
computationally efficient and generalizes the construction given by the authors
for restricted surface splines on $\mathbb{R}^d$. The kernels for which the
theory applies includes the Sobolev-Mat\'ern kernels for closed, compact,
connected, $C^\infty$ Riemannian manifolds.
","[{""version"":""v1"",""created"":""Thu, 5 Jun 2014 16:25:59 GMT""},{""version"":""v2"",""created"":""Wed, 6 Sep 2017 18:57:43 GMT""}]","2017-09-08"
"1406.1436","Mang Feng","M. Feng, Y.P. Zhong, T. Liu, L.L. Yan, W.L. Yang, J. Twamley and H.
  Wang","Exploring the quantum critical behaviour in a driven Tavis-Cummings
  circuit","Main text with 3 figures",,"10.1038/ncomms8111",,"quant-ph","http://arxiv.org/licenses/nonexclusive-distrib/1.0/","  Quantum phase transitions play an important role in many-body systems and
have been a research focus in conventional condensed matter physics over the
past few decades. Artificial atoms, such as superconducting qubits that can be
individually manipulated, provide a new paradigm of realising and exploring
quantum phase transitions by engineering an on-chip quantum simulator. Here we
demonstrate experimentally the quantum critical behaviour in a
highly-controllable superconducting circuit, consisting of four qubits coupled
to a common resonator mode. By off-resonantly driving the system to renormalise
the critical spin-field coupling strength, we have observed a four-qubit
non-equilibrium quantum phase transition in a dynamical manner, i.e., we sweep
the critical coupling strength over time and monitor the four-qubit scaled
moments for a signature of a structural change of the system's eigenstates. Our
observation of the non-equilibrium quantum phase transition, which is in good
agreement with the driven Tavis-Cummings theory under decoherence, offers new
experimental approaches towards exploring quantum phase transition related
science, such as scaling behaviours, parity breaking and long-range quantum
correlations.
","[{""version"":""v1"",""created"":""Thu, 5 Jun 2014 16:34:57 GMT""},{""version"":""v2"",""created"":""Mon, 25 May 2015 09:23:05 GMT""}]","2015-05-26"
"1406.1437","Howard E. Bond","Howard E. Bond","Episodic Mass Loss from the Hydrogen-Deficient Central Star of the
  Planetary Nebula Longmore 4","Accepted by Astronomical Journal",,"10.1088/0004-6256/148/3/44",,"astro-ph.SR","http://arxiv.org/licenses/nonexclusive-distrib/1.0/","  A spectacular transient mass-loss episode from the extremely hot,
hydrogen-deficient central star of the planetary nebula (PN) Longmore 4 was
discovered in 1992 by Werner et al. During that event, the star temporarily
changed from its normal PG 1159 spectrum to that of an emission-line
low-luminosity early-type Wolf-Rayet [WCE] star. After a few days, Lo 4
reverted to its normal, predominantly absorption-line PG 1159 type. To
determine whether such events recur, and if so how often, I monitored the
optical spectrum of Lo 4 from early 2003 to early 2012. Out of 81 spectra taken
at random dates, four of them revealed mass-loss outbursts similar to that seen
in 1992. This indicates that the episodes recur approximately every 100 days
(if the recurrence rate has been approximately constant and the duration of a
typical episode is ~5 days), and that the star is in a high-mass-loss state
about 5% of the time. Since the enhanced stellar wind is hydrogen-deficient, it
arises from the photosphere and is unlikely to be related to phenomena such as
a binary or planetary companion or infalling dust. I speculate on plausible
mechanisms for these unique outbursts, including the possibility that they are
related to the non-radial GW Vir-type pulsations exhibited by Lo 4. The central
star of the PN NGC 246 has stellar parameters similar to those of Lo 4, and it
is also a GW Vir-type pulsator with similar pulsation periods. I obtained 167
spectra of NGC 246 between 2003 and 2011, but no mass ejections were found.
","[{""version"":""v1"",""created"":""Thu, 5 Jun 2014 16:36:39 GMT""}]","2015-06-19"
"1406.1438","Zhi Ren","Z. Ren, L. V. Pourovskii, G. Giriat, G. Lapertot, A. Georges, and D.
  Jaccard","Giant overlap between the magnetic and superconducting phases of
  CeAu2Si2 under pressure","10 pages, 4 figures. Supplemental Material available on request","Phys. Rev. X 4, 031055 (2014)",,,"cond-mat.supr-con","http://arxiv.org/licenses/nonexclusive-distrib/1.0/","  High pressure provides a powerful means for exploring unconventional
superconductivity which appears mostly on the border of magnetism. Here we
report the discovery of pressure-induced heavy fermion superconductivity up to
2.5 K in the antiferromanget CeAu2Si2 (TN ~ 10 K). Remarkably, the magnetic and
superconducting phases are found to overlap across an unprecedentedly wide
pressure interval from 11.8 to 22.3 GPa. Moreover, both the bulk Tc and TM are
strongly enhanced when increasing the pressure from 16.7 to 20.2 GPa. Tc
reaches a maximum at a pressure slightly below pc ~ 22.5 GPa, at which magnetic
order disappears. Furthermore, the scaling behavior of the resistivity provides
evidence for a continuous delocalization of the Ce 4f-electrons associated with
a critical endpoint lying just above pc. We show that the maximum Tc of
CeAu2Si2 actually occurs at almost the same unit-cell volume as that of
CeCu2Si2 and CeCu2Ge2, and when the Kondo and crystal field splitting energies
becomes comparable. Dynamical mean-filed theory calculations suggest that the
peculiar behavior in pressurized CeAu2Si2 might be related to its Ce 4f-orbital
occupancy. Our results not only provide a unique example of the interplay
between superconductivity and magnetism, but also underline the role of orbital
physics in understanding Ce-based heavy fermion systems.
","[{""version"":""v1"",""created"":""Thu, 5 Jun 2014 16:40:59 GMT""},{""version"":""v2"",""created"":""Mon, 29 Sep 2014 12:56:03 GMT""}]","2014-09-30"
"1406.1439","Koustuban Ravi","Koustuban Ravi, Wenqian Ronny Huang, Sergio Carbajo, Xiaojun Wu and
  Franz Kartner","Limitations to THz generation by optical rectification using tilted
  pulse fronts",,,"10.1364/OE.22.020239",,"physics.optics","http://arxiv.org/licenses/nonexclusive-distrib/1.0/","  Terahertz (THz) generation by optical rectification (OR) using
tilted-pulse-fronts is studied. One-dimensional (1-D) and 2-D spatial models,
which simultaneously account for (i) the nonlinear coupled interaction of the
THz and optical radiation, (ii) angular and material dispersion, (iii)
absorption, iv) self-phase modulation and (v) stimulated Raman scattering are
presented. We numerically show that the large experimentally observed cascaded
frequency down-shift and spectral broadening (cascading effects) of the optical
pump pulse is a direct consequence of THz generation. In the presence of this
large spectral broadening, the phase mismatch due to angular dispersion is
greatly enhanced. Consequently, this cascading effect in conjunction with
angular dispersion is shown to be the strongest limitation to THz generation in
lithium niobate for pumping at 1 micron. It is seen that the exclusion of these
cascading effects in modeling OR, leads to a significant overestimation of the
optical-to-THz conversion efficiency. The simulation results are supported by
experiments.
","[{""version"":""v1"",""created"":""Thu, 5 Jun 2014 16:43:04 GMT""},{""version"":""v2"",""created"":""Tue, 17 Jun 2014 03:44:32 GMT""}]","2014-08-20"
"1406.1440","Pierre Alquier","Pierre Alquier, Vincent Cottet, Nicolas Chopin, Judith Rousseau","Bayesian matrix completion: prior specification",,,,,"stat.ML math.ST stat.CO stat.TH","http://arxiv.org/licenses/nonexclusive-distrib/1.0/","  Low-rank matrix estimation from incomplete measurements recently received
increased attention due to the emergence of several challenging applications,
such as recommender systems; see in particular the famous Netflix challenge.
While the behaviour of algorithms based on nuclear norm minimization is now
well understood, an as yet unexplored avenue of research is the behaviour of
Bayesian algorithms in this context. In this paper, we briefly review the
priors used in the Bayesian literature for matrix completion. A standard
approach is to assign an inverse gamma prior to the singular values of a
certain singular value decomposition of the matrix of interest; this prior is
conjugate. However, we show that two other types of priors (again for the
singular values) may be conjugate for this model: a gamma prior, and a discrete
prior. Conjugacy is very convenient, as it makes it possible to implement
either Gibbs sampling or Variational Bayes. Interestingly enough, the maximum a
posteriori for these different priors is related to the nuclear norm
minimization problems. We also compare all these priors on simulated datasets,
and on the classical MovieLens and Netflix datasets.
","[{""version"":""v1"",""created"":""Thu, 5 Jun 2014 16:46:46 GMT""},{""version"":""v2"",""created"":""Wed, 11 Jun 2014 15:32:24 GMT""},{""version"":""v3"",""created"":""Wed, 22 Oct 2014 15:34:33 GMT""}]","2014-10-23"
