"1406.1499","Ivan Avramidi","Ivan G Avramidi","Heat Trace and Functional Determinant in One Dimension","28 pages","J. Math. Phys. 55 (2014) 123501","10.1063/1.4902379",,"math-ph hep-th math.MP math.SP","http://arxiv.org/licenses/nonexclusive-distrib/1.0/","  We study the spectral properties of the Laplace type operator on the circle.
We discuss various approximations for the heat trace, the zeta function and the
zeta-regularized determinant. We obtain a differential equation for the heat
kernel diagonal and a recursive system for the diagonal heat kernel
coefficients, which enables us to find closed approximate formulas for the heat
trace and the functional determinant which become exact in the limit of
infinite radius. The relation to the generalized KdV hierarchy is discussed as
well.
","[{""version"":""v1"",""created"":""Thu, 5 Jun 2014 19:56:11 GMT""},{""version"":""v2"",""created"":""Mon, 10 Nov 2014 16:34:33 GMT""}]","2015-12-18"
"1406.1500","Jonathan Lee","Jonathan D. Lee and Ago-Erik Riet","F-Saturation Games","13 pages, 2 figures",,,,"math.CO","http://arxiv.org/licenses/nonexclusive-distrib/1.0/","  We study F-saturation games, first introduced by F\""uredi, Reimer and Seress
in 1991, and named as such by West. The main question is to determine the
length of the game whilst avoiding various classes of graph, playing on a large
complete graph. We show lower bounds on the length of path-avoiding games, and
more precise results for short paths. We show sharp results for the tree
avoiding game and the star avoiding game.
","[{""version"":""v1"",""created"":""Thu, 5 Jun 2014 19:59:35 GMT""}]","2014-06-06"
"1406.1502","Martin  Biehl","Martin Biehl, Christoph Salge, Daniel Polani","Towards designing artificial universes for artificial agents under
  interaction closure","8 pages, 3 figures; accepted for publication in ALIFE 14 proceedings",,"10.7551/978-0-262-32621-6-ch154",,"cs.MA","http://arxiv.org/licenses/nonexclusive-distrib/1.0/","  We are interested in designing artificial universes for artifi- cial agents.
We view artificial agents as networks of high- level processes on top of of a
low-level detailed-description system. We require that the high-level processes
have some intrinsic explanatory power and we introduce an extension of
informational closure namely interaction closure to capture this. Then we
derive a method to design artificial universes in the form of finite Markov
chains which exhibit high-level pro- cesses that satisfy the property of
interaction closure. We also investigate control or information transfer which
we see as an building block for networks representing artificial agents.
","[{""version"":""v1"",""created"":""Thu, 5 Jun 2014 16:27:15 GMT""}]","2016-05-19"
"1406.1503","Michele Trenti","Michele Trenti (1,2), Rosalba Perna (3) and Raul Jimenez (4) ((1)
  Cambridge, (2) University of Melbourne, (3) StonyBrook, (4) U. Barcelona)","The luminosity and stellar mass functions of GRB host galaxies: Insight
  into the metallicity bias","15 pages, 12 figures, 2 tables, ApJ accepted, revision includes new
  predictions for GRB host metallicity. Model data publicly available at:
  http://www.ast.cam.ac.uk/~trenti/release_modeldata_20150119.tar.gz","The Astrophysical Journal. 802, 103, 2015","10.1088/0004-637X/802/2/103",,"astro-ph.GA astro-ph.HE","http://arxiv.org/licenses/nonexclusive-distrib/1.0/","  Long-Duration Gamma-Ray Bursts (GRBs) are powerful probes of the Universe
star formation history, but correlation between the two depends on the highly
debated presence/strength of a metallicity bias. To investigate this
correlation, we use a phenomenological model that successfully describes star
formation rates, luminosities and stellar masses of star forming galaxies,
applying it to GRB production. We predict luminosities, stellar masses, and
metallicities of host galaxies depending on the metallicity bias. Our
best-fitting model includes a moderate metallicity bias, broadly consistent
with the large majority of long-duration GRBs in metal-poor environments
originating from collapsars (probability ~83%), but with a secondary
contribution (~17%) from metal-independent production channels, such as binary
evolution. Because of the mass-metallicity relation of galaxies, the maximum
likelihood model predicts that the metal-independent channel becomes dominant
at z<2, where hosts have higher metallicities and collapsars are suppressed.
This possibly explains why some studies find no clear evidence of a metal-bias
based on low-z samples. However, while metallicity predictions match
observations well at high redshift, there is tension with low redshift
observations, since a significant fraction of GRB hosts are predicted to have
(near-)solar metallicity. This is in contrast to observations, unless obscured,
metal-rich hosts are preferentially missed in current datasets, and suggests
that lower efficiencies of the metal-independent GRB channel might be preferred
following a comprehensive fit from complete samples. Overall, we are able to
establish the presence of a metallicity bias for GRB production, but continued
characterization of GRB host galaxies is needed to quantify its strength.
","[{""version"":""v1"",""created"":""Thu, 5 Jun 2014 20:00:05 GMT""},{""version"":""v2"",""created"":""Tue, 27 Jan 2015 06:40:04 GMT""}]","2022-01-24"
"1406.1504","Ruth Shir Ms","Barak Kol and Ruth Shir","1-loop Color structures and sunny diagrams","12 pages, v2: typo corrected in Table 1",,"10.1007/JHEP02(2015)085",,"hep-th","http://arxiv.org/licenses/nonexclusive-distrib/1.0/","  Recently the space of tree level color structures for gluon scattering was
determined in arXiv:1403.6837 together with its transformation properties under
permutations. Here we generalize the discussion to loops, demonstrating a
reduction of an arbitrary color diagram to its vacuum skeleton plus rays. For
1-loop there are no residual relations and we determine the space of color
structures both diagrammatically and algebraically in terms of certain sunny
diagrams. We present the generating function for the characteristic polynomials
and a list of irreducible representations for $3 \le n \le 9$ external legs.
Finally we present a new proof for the 1-loop shuffle relations based on the
cyclic shuffle and split operations.
","[{""version"":""v1"",""created"":""Thu, 5 Jun 2014 20:00:07 GMT""},{""version"":""v2"",""created"":""Thu, 25 May 2017 10:13:43 GMT""}]","2017-05-26"
"1406.1505","Sean Weinberg","Yasunori Nomura and Sean J. Weinberg","Black Holes, Entropies, and Semiclassical Spacetime in Quantum Gravity","37 pages; v2: clarifications added and discussion on mining
  corrected; v3: typos corrected; v4: version to appear in JHEP",,"10.1007/JHEP10(2014)185","UCB-PTH-14/31","hep-th gr-qc","http://arxiv.org/licenses/nonexclusive-distrib/1.0/","  We present a coherent picture of the quantum mechanics of black holes. The
picture does not require the introduction of any drastically new physical
effect beyond what is already known; it arises mostly from synthesizing and
(re)interpreting existing results in appropriate manners. We identify the
Bekenstein-Hawking entropy as the entropy associated with coarse-graining
performed to obtain semiclassical field theory from a fundamental microscopic
theory of quantum gravity. This clarifies the issues around the unitary
evolution, the existence of the interior spacetime, and the thermodynamic
nature in black hole physics--any result in semiclassical field theory is a
statement about the maximally mixed ensemble of microscopic quantum states
consistent with the specified background, within the precision allowed by
quantum mechanics. We present a detailed analysis of information transfer in
Hawking emission and black hole mining processes, clarifying what aspects of
the underlying dynamics are (not) visible in semiclassical field theory. We
also discuss relations between the black hole entropy and the entanglement
entropy across the horizon. We then extend our discussions to more general
contexts in quantum gravity. The subjects include extensions to de Sitter and
Minkowski spaces and implications for complementarity and cosmology, especially
the eternally inflating multiverse.
","[{""version"":""v1"",""created"":""Thu, 5 Jun 2014 20:00:11 GMT""},{""version"":""v2"",""created"":""Mon, 16 Jun 2014 15:50:14 GMT""},{""version"":""v3"",""created"":""Sun, 29 Jun 2014 21:39:19 GMT""},{""version"":""v4"",""created"":""Fri, 31 Oct 2014 20:59:22 GMT""}]","2015-06-19"
"1406.1506","William Dawson","William A. Dawson, Michael D. Schneider, J. Anthony Tyson, and M.
  James Jee","The Ellipticity Distribution of Ambiguously Blended Objects","Accepted ApJ, 11 pages, 6 figures",,"10.3847/0004-637X/816/1/11",,"astro-ph.CO astro-ph.GA","http://arxiv.org/licenses/nonexclusive-distrib/1.0/","  Using overlapping fields with space-based Hubble Space Telescope (HST) and
ground-based Subaru Telescope imaging we identify a population of blended
galaxies that are blended to such a large degree that they are detected as
single objects in the ground-based monochromatic imaging, which we label as
'ambiguous blends'. For deep imaging data, such as the depth targeted with the
Large Synoptic Survey Telescope (LSST), the ambiguous blend population is both
large ($\sim 14$%) and has a distribution of ellipticities that is different
from that of unblended objects in a way that will likely be important for the
weak lensing measurements. Most notably, for a limiting magnitude of $i \sim
27$ we find that ambiguous blending results in a ~14% increase in shear noise
(or ~12% decrease in the effective projected number density of lensed galaxies;
neff) due to 1) larger intrinsic ellipticity dispersion, 2) a scaling with the
galaxy number density $N_{gal}$ that is shallower than 1/$\sqrt{N_{gal}}$. For
the LSST Gold Sample ($i < 25.3$) there is a ~7% increase in shear noise (or
~7% decrease in $n_{eff}$). More importantly than these increases in the shear
noise, we find that the ellipticity distribution of ambiguous blends has an RMS
13% larger than that of non-blended galaxies. Given the need of future weak
lensing surveys to constrain the ellipticity distribution of galaxies to better
than a percent in order to mitigate cosmic shear multiplicative biases, the
different ellipticity distribution of ambiguous blends could be a dominant
systematic if unaccounted for.
","[{""version"":""v1"",""created"":""Thu, 5 Jun 2014 20:00:13 GMT""},{""version"":""v2"",""created"":""Thu, 24 Sep 2015 17:18:10 GMT""}]","2017-02-15"
"1406.1507","Alexander Protogenov","Alexander P. Protogenov, Valery A. Verbus, and Evgueni V. Chulkov","The Density of Surface States in Weyl Semimetals","3 pages, 2 figures",,,,"cond-mat.mes-hall","http://arxiv.org/licenses/nonexclusive-distrib/1.0/","  Weyl semimetal is a three-dimensional material with a conical spectrum near
an even number of point nodes, where two bands touch each other. Here we study
spectral properties of surface electron states in such a system. We show that
the density of surface states possesses a logarithmic singularity for the
energy $\varepsilon \to 0$. It decreases linearly at the intermediate energy of
surface electron states and approaches zero as $\sqrt{1-\varepsilon}$ for
$\varepsilon \to 1$. This universal behavior is a hallmark of the topological
order that offers a new wide range of applications.
","[{""version"":""v1"",""created"":""Thu, 5 Jun 2014 20:06:30 GMT""}]","2014-06-09"
"1406.1508","Matthew Ondrus","Georgia Benkart, Samuel A. Lopes, Matthew Ondrus","A Parametric Family of Subalgebras of the Weyl Algebra III. Derivations","48 pages. Sections 4 and 5 have been reorganized somewhat to
  highlight the main results",,,,"math.RA","http://arxiv.org/licenses/nonexclusive-distrib/1.0/","  An Ore extension over a polynomial algebra F[x] is either a quantum plane, a
quantum Weyl algebra, or an infinite-dimensional unital associative algebra A_h
generated by elements x,y, which satisfy yx-xy = h, where h is in F[x]. When h
is nonzero, these algebras are subalgebras of the Weyl algebra A_1 and can be
viewed as differential operators with polynomial coefficients. In previous
work, we investigated the structure of A_h, determined its automorphisms and
their invariants, and studied the irreducible A_h-modules. Here we determine
the derivations of A_h over an arbitrary field.
","[{""version"":""v1"",""created"":""Thu, 5 Jun 2014 20:10:17 GMT""},{""version"":""v2"",""created"":""Mon, 13 Oct 2014 20:19:42 GMT""}]","2014-10-15"
"1406.1509","Wojciech Ja\'skowski","Wojciech Ja\'skowski","Systematic N-tuple Networks for Position Evaluation: Exceeding 90% in
  the Othello League","Added technical report number","ICGA Journal 37(2), 2014, pp. 85-96",,"RA-06/2014","cs.NE cs.AI cs.LG","http://arxiv.org/licenses/nonexclusive-distrib/1.0/","  N-tuple networks have been successfully used as position evaluation functions
for board games such as Othello or Connect Four. The effectiveness of such
networks depends on their architecture, which is determined by the placement of
constituent n-tuples, sequences of board locations, providing input to the
network. The most popular method of placing n-tuples consists in randomly
generating a small number of long, snake-shaped board location sequences. In
comparison, we show that learning n-tuple networks is significantly more
effective if they involve a large number of systematically placed, short,
straight n-tuples. Moreover, we demonstrate that in order to obtain the best
performance and the steepest learning curve for Othello it is enough to use
n-tuples of size just 2, yielding a network consisting of only 288 weights. The
best such network evolved in this study has been evaluated in the online
Othello League, obtaining the performance of nearly 96% --- more than any other
player to date.
","[{""version"":""v1"",""created"":""Thu, 5 Jun 2014 20:10:48 GMT""},{""version"":""v2"",""created"":""Tue, 24 Jun 2014 10:06:29 GMT""},{""version"":""v3"",""created"":""Wed, 25 Jun 2014 20:12:19 GMT""}]","2014-12-10"
"1406.1510","Remy Haemmerle","R\'emy Haemmerl\'e and Jon Sneyers","Proceedings of the Eleventh Workshop on Constraint Handling Rules",,,,,"cs.PL","http://arxiv.org/licenses/nonexclusive-distrib/1.0/","  This volume contains the papers presented at the eleventh Workshop on
Constraint Handling Rules (CHR 2014), which will be held in Vienna at the
occasion of the Vienna Summer of Logic (VSL)
","[{""version"":""v1"",""created"":""Thu, 5 Jun 2014 20:11:27 GMT""}]","2014-06-09"
"1406.1511","Brandon Harris","B. J. Harris, L. S. Matthews, T. W. Hyde","Dusty plasma cavities: probe-induced and natural","10 pages, 12 figures",,,"CASPER-14-1","physics.plasm-ph","http://arxiv.org/licenses/nonexclusive-distrib/1.0/","  A comprehensive exploration of regional dust evacuation in complex plasma
crystals is presented. Voids created in 3D crystals on the International Space
Station have provided a rich foundation for experiments, but cavities in dust
crystals formed in ground-based experiments have not received as much
attention. Inside a modified GEC RF cell, a powered vertical probe was used to
clear the central area of a dust crystal, producing a cavity with high
cylindrical symmetry. Cavities generated by three mechanisms are examined.
First, repulsion of micrometer-sized particles by a negatively charged probe is
investigated. A model of this effect developed for a DC plasma is modified and
applied to explain new experimental data in RF plasma. Second, the formation of
natural cavities is surveyed; a radial ion drag proposed to occur due to a
curved sheath is considered in conjunction with thermophoresis and a flattened
confinement potential above the center of the electrode. Finally, cavity
formation unexpectedly occurs upon increasing the probe potential above the
plasma floating potential. The cavities produced by these methods appear
similar, but each are shown to be facilitated by fundamentally different
processes.
","[{""version"":""v1"",""created"":""Thu, 5 Jun 2014 20:11:52 GMT""}]","2014-06-09"
"1406.1512","Andreas  Pedersen","S{\o}ren Smidstrup, Andreas Pedersen, Kurt Stokbro and Hannes
  J\'onsson","Improved initial guess for minimum energy path calculations",,"J. Chem. Phys. 140, 214106 (2014)","10.1063/1.4878664",,"cond-mat.mtrl-sci physics.comp-ph","http://arxiv.org/licenses/nonexclusive-distrib/1.0/","  A method is presented for generating a good initial guess of a transition
path between given initial and final states of a system without evaluation of
the energy. An objective function surface is constructed using an interpolation
of pairwise distances at each discretization point along the path and the
nudged elastic band method then used to find an optimal path on this image
dependent pair potential (IDPP) surface. This provides an initial path for the
more computationally intensive calculations of the true minimum energy path
using some method of choice for evaluating the energy and atomic forces, for
example by ab initio or density functional theory. The optimal path on the IDPP
surface is significantly closer to the true minimum energy path than a linear
interpolation of the Cartesian coordinates and, therefore, reduces the number
of iterations needed to reach convergence and averts divergence in the
electronic structure calculations when atoms are brought too close to each
other in the initial path. The method is illustrated with three examples: (1)
rotation of a methyl group in an ethane molecule, (2) an exchange of atoms in
an island on a crystal surface, and (3) an exchange of two Si-atoms in
amorphous silicon. In all three cases, the computational effort in finding the
minimum energy path with DFT was reduced by a factor ranging from 50 % to an
order of magnitude by using an IDPP path as the initial path. The time required
for parallel computations was reduced even more because of load imbalance when
linear interpolation of Cartesian coordinates was used.
","[{""version"":""v1"",""created"":""Thu, 5 Jun 2014 20:16:13 GMT""}]","2014-06-19"
"1406.1513","Anton Ilderton","Anton Ilderton","Localisation in worldline pair production and lightfront zero-modes","7 pages, 2 pdf figures. Version 3: minor update to simplify
  presentation, results and conclusions unchanged","JHEP 09 (2014) 166","10.1007/JHEP09(2014)166",,"hep-th hep-ph","http://arxiv.org/licenses/nonexclusive-distrib/1.0/","  The nonperturbative probability of pair production in electric fields
depending on lightfront time is given exactly by the locally constant
approximation. We explain this by showing that the worldline path integral
defining the effective action contains a constraint, which localises
contributing paths on hypersurfaces of constant lightfront time. These paths
are lightfront zero-modes and there can be no pair production without them; the
effective action vanishes if they are projected out.
","[{""version"":""v1"",""created"":""Thu, 5 Jun 2014 20:28:19 GMT""},{""version"":""v2"",""created"":""Wed, 24 Sep 2014 08:05:21 GMT""},{""version"":""v3"",""created"":""Fri, 1 Jul 2016 07:52:49 GMT""}]","2016-07-04"
"1406.1514","Alexander Schenkel","Christian Becker, Alexander Schenkel, Richard J. Szabo","Differential cohomology and locally covariant quantum field theory","35 pages. v2: Final version published in Reviews in Mathematical
  Physics","Rev. Math. Phys. 29, 1750003 (2017)","10.1142/S0129055X17500039","EMPG-14-11","hep-th math-ph math.DG math.MP","http://arxiv.org/licenses/nonexclusive-distrib/1.0/","  We study differential cohomology on categories of globally hyperbolic
Lorentzian manifolds. The Lorentzian metric allows us to define a natural
transformation whose kernel generalizes Maxwell's equations and fits into a
restriction of the fundamental exact sequences of differential cohomology. We
consider smooth Pontryagin duals of differential cohomology groups, which are
subgroups of the character groups. We prove that these groups fit into smooth
duals of the fundamental exact sequences of differential cohomology and equip
them with a natural presymplectic structure derived from a generalized Maxwell
Lagrangian. The resulting presymplectic Abelian groups are quantized using the
CCR-functor, which yields a covariant functor from our categories of globally
hyperbolic Lorentzian manifolds to the category of C*-algebras. We prove that
this functor satisfies the causality and time-slice axioms of locally covariant
quantum field theory, but that it violates the locality axiom. We show that
this violation is precisely due to the fact that our functor has topological
subfunctors describing the Pontryagin duals of certain singular cohomology
groups. As a byproduct, we develop a Fr\'echet-Lie group structure on
differential cohomology groups.
","[{""version"":""v1"",""created"":""Thu, 5 Jun 2014 20:30:56 GMT""},{""version"":""v2"",""created"":""Thu, 8 Dec 2016 11:05:59 GMT""}]","2017-01-13"
"1406.1515","Tim Jenness","Tim Jenness and Martin C. Shepherd and Reinhold Schaaf and Jack Sayers
  and Volker Ossenkopf and Thomas Nikola and Gaelen Marsden and Ronan Higgins
  and Kevin Edwards and Adam Brazier","An overview of the planned CCAT software system","17 pages, 6 figures, to appear in Software and Cyberinfrastructure
  for Astronomy III, Chiozzi & Radziwill (eds), Proc. SPIE 9152, paper ID
  9152-109",,"10.1117/12.2056516",,"astro-ph.IM","http://arxiv.org/licenses/nonexclusive-distrib/1.0/","  CCAT will be a 25m diameter sub-millimeter telescope capable of operating in
the 0.2 to 2.1mm wavelength range. It will be located at an altitude of 5600m
on Cerro Chajnantor in northern Chile near the ALMA site. The anticipated first
generation instruments include large format (60,000 pixel) kinetic inductance
detector (KID) cameras, a large format heterodyne array and a direct detection
multi-object spectrometer. The paper describes the architecture of the CCAT
software and the development strategy.
","[{""version"":""v1"",""created"":""Thu, 5 Jun 2014 20:36:22 GMT""}]","2014-08-01"
"1406.1516","Zhiguo Ding","Zhiguo Ding and Zheng Yang and Pingzhi Fan and H. Vincent Poor","On the Performance of Non-Orthogonal Multiple Access in 5G Systems with
  Randomly Deployed Users",,,"10.1109/LSP.2014.2343971",,"cs.IT math.IT","http://arxiv.org/licenses/nonexclusive-distrib/1.0/","  In this letter, the performance of non-orthogonal multiple access (NOMA) is
investigated in a cellular downlink scenario with randomly deployed users. The
developed analytical results show that NOMA can achieve superior performance in
terms of ergodic sum rates; however, the outage performance of NOMA depends
critically on the choices of the users' targeted data rates and allocated
power. In particular, a wrong choice of the targeted data rates and allocated
power can lead to a situation in which the user's outage probability is always
one, i.e. the user's targeted quality of service will never be met.
","[{""version"":""v1"",""created"":""Thu, 5 Jun 2014 20:36:58 GMT""}]","2015-06-19"
"1406.1517","Markus Kunze","Markus Kunze","Yet another criterion for global existence in the 3D relativistic
  Vlasov-Maxwell system","24 pages",,,,"math.AP math-ph math.MP","http://arxiv.org/licenses/nonexclusive-distrib/1.0/","  We prove that solutions of the 3D relativistic Vlasov-Maxwell system can be
extended, as long as the quantity $\sigma_{-1}(t, x) = \max_{|\omega|=1}
\,\int_{R^3} \frac{dp}{\sqrt{1+p^2}}\, \frac{1}{(1+v\cdot\omega)}\, f(t, x, p)$
is bounded in $L^2_x$.
","[{""version"":""v1"",""created"":""Thu, 5 Jun 2014 20:37:41 GMT""}]","2014-06-09"
