"1401.0826","Pietro Colangelo","L. Agozzino, P. Castorina, P. Colangelo","Nuclear Structure Functions at Low-$x$ in a Holographic Approach","10 pages, 10 figures",,"10.1140/epjc/s10052-014-2828-0","CERN-PH-TH/2013-281, BARI-TH/694-13","hep-ph","http://arxiv.org/licenses/nonexclusive-distrib/1.0/","  Nuclear effects in deep inelastic scattering at low$-x$ are
phenomenologically described changing the typical dynamical and/or kinematical
scales characterizing the free nucleon case. In a holographic approach, this
rescaling is an analytical property of the computed structure function
$F_2(x,Q^2)$. This function is given by the sum of a conformal term and of a
contribution due to quark confinement, depending on IR hard-wall parameter
$z_0$ and on the mean square distances, related to a parameter $Q^\prime$,
among quarks and gluons in the target. The holographic structure function per
nucleon in a nucleus $A$ is evaluated showing that a rescaling of the typical
nucleon size, $z_0$ and $Q^\prime$, due to nuclear binding, can be reabsorbed
in a $Q^2$-rescaling scheme. The difference between neutron and proton
structure functions and the effects of the longitudinal structure functions can
also be taken into account. The obtained theoretical results favourably compare
with the experimental data.
","[{""version"":""v1"",""created"":""Sat, 4 Jan 2014 16:16:25 GMT""}]","2015-06-18"
"1401.0827","Kamel Ibn Aziz Derouiche kiaderouiche","K.I.A.Derouiche","Interaction entre math\'ematique et informatique Libre/Open Source par
  le logiciel math\'ematique","11 pages, written in French, In Proceedings of the S\'eminaire
  National sur la didactique des Math\'ematiques, 25-26 Novembre Tebessa,
  Alg\'erie (SNDM'13). 2013",,,,"cs.MS cs.CY math.HO","http://creativecommons.org/licenses/by/3.0/","  This article focuses on the application of model development and opening the
source code available and implemented by the Free Software and Open Source
FLOSS to the instructional and teaching has both mathematics and computer by
the read-write(R/W) of mathematical software, including the most famous cases
are numerical and symbolic computation. The article analysis the development of
the mathematical model of Free/Open Source(math FLOSS) software has proven its
importance in the area of research in mathematics and computer science .
However, although their actual use, is very readable in higher education
courses. We discuss the feasibility of this model to the characteristics of the
domain, actors, interaction they have and the communities they form during the
development of the software. Finally, we propose a mathematical example of
Free/Open Source(Math FlOSS) software as analysis device .
","[{""version"":""v1"",""created"":""Sat, 4 Jan 2014 16:42:05 GMT""}]","2014-01-07"
"1401.0828","Igor Rivin","Igor Rivin","Some Thoughts on the Teaching of Mathematics -- ten years later","10 pages, to appear in Notices of the AMS",,,,"math.HO","http://arxiv.org/licenses/nonexclusive-distrib/1.0/","  I describe some deep-seated problems in higher mathematical education, and
give some ideas for their solution -- I advocate a move away from the
traditional introduction of mathematics through calculus, and towards
computation and discrete mathematics.
","[{""version"":""v1"",""created"":""Sat, 4 Jan 2014 17:14:39 GMT""}]","2014-01-07"
"1401.0829","Alan Hammond","Alan Hammond","Coagulation and diffusion: a probabilistic perspective on the
  Smoluchowski PDE","83 pages with three figures",,,,"math.PR math-ph math.AP math.MP","http://arxiv.org/licenses/nonexclusive-distrib/1.0/","  The Smoluchowski coagulation-diffusion PDE is a system of partial
differential equations modelling the evolution in time of mass-bearing Brownian
particles which are subject to short-range pairwise coagulation. This survey
presents a fairly detailed exposition of the kinetic limit derivation of the
Smoluchowski PDE from a microscopic model of many coagulating Brownian
particles that was undertaken in [11]. It presents heuristic explanations of
the form of the main theorem before discussing the proof, and presents key
estimates in that proof using a novel probabilistic technique. The survey's
principal aim is an exposition of this kinetic limit derivation, but it also
contains an overview of several topics which either motivate or are motivated
by this derivation.
","[{""version"":""v1"",""created"":""Sat, 4 Jan 2014 17:19:14 GMT""},{""version"":""v2"",""created"":""Wed, 13 Feb 2019 00:56:58 GMT""}]","2019-02-14"
"1401.0830","Willard Miller Jr.","Ernest G. Kalnins and Willard Miller Jr","Quadratic algebra contractions and 2nd order superintegrable systems","28 pages",,,,"math-ph math.MP","http://arxiv.org/licenses/nonexclusive-distrib/1.0/","  Quadratic algebras are generalizations of Lie algebras; they include the
symmetry algebras of 2nd order superintegrable systems in 2 dimensions as
special cases. The superintegrable systems are exactly solvable physical
systems in classical and quantum mechanics. For constant curvature spaces we
show that the free quadratic algebras generated by the 1st and 2nd order
elements in the enveloping algebras of their Euclidean and orthogonal symmetry
algebras correspond one-to-one with the possible superintegrable systems with
potential defined on these spaces. We describe a contraction theory for
quadratic algebras and show that for constant curvature superintegrable
systems, ordinary Lie algebra contractions induce contractions of the quadratic
algebras of the superintegrable systems that correspond to geometrical
pointwise limits of the physical systems. One consequence is that by
contracting function space realizations of representations of the generic
superintegrable quantum system on the 2-sphere (which give the structure
equations for Racah/Wilson polynomials) to the other superintegrable systems
one obtains the full Askey scheme of orthogonal hypergeometric polynomials.
","[{""version"":""v1"",""created"":""Sat, 4 Jan 2014 17:28:21 GMT""}]","2014-01-07"
"1401.0831","Niharika Sravan","Niharika Sravan (1), Francesca Valsecchi (1), Vassiliki Kalogera (1),
  Leandro G. Althaus (2) ((1) Center for Interdisciplinary Exploration and
  Research in Astrophysics (CIERA) and Department of Physics and Astronomy,
  Northwestern University, (2) Grupo de Evolucion Estelar y Pulsaciones,
  Facultad de Ciencias Astronomicas y Geofisicas, Universidad Nacional de La
  Plata)","Importance of Tides for Periastron Precession in Eccentric Neutron Star
  - White Dwarf Binaries","Published in The Astrophysical Journal","Sravan et al. 2014, ApJ, 792, 138","10.1088/0004-637X/792/2/138",,"astro-ph.SR astro-ph.HE","http://arxiv.org/licenses/nonexclusive-distrib/1.0/","  Although not nearly as numerous as binaries with two white dwarfs, eccentric
neutron star-white dwarf (NS-WD) binaries are important gravitational-wave (GW)
sources for the next generation of space-based detectors sensitive to low
frequency waves. Here we investigate periastron precession in these sources as
a result of general relativistic, tidal, and rotational effects; such
precession is expected to be detectable for at least some of the detected
binaries of this type. Currently, two eccentric NS-WD binaries are known in the
galactic field, PSR J1141-6545 and PSR B2303+46, both of which have orbits too
wide to be relevant in their current state to GW observations. However,
population synthesis studies predict the existence of a significant Galactic
population of such systems. Though small in most of these systems, we find that
tidally induced periastron precession becomes important when tides contribute
to more than 3% of the total precession rate. For these systems, accounting for
tides when analyzing periastron precession rate measurements can improve
estimates of the WD component mass inferred and, in some cases, will prevent us
from misclassifying the object. However, such systems are rare due to rapid
orbital decay. To aid the inclusion of tidal effects when using periastron
precession as a mass measurement tool, we derive a function that relates the WD
radius and periastron precession constant to the WD mass.
","[{""version"":""v1"",""created"":""Sat, 4 Jan 2014 17:32:38 GMT""},{""version"":""v2"",""created"":""Thu, 18 Sep 2014 22:43:20 GMT""}]","2015-06-18"
"1401.0832","Vladyslav Pauk","Vladyslav Pauk, Marc Vanderhaeghen","Single meson contributions to the muon's anomalous magnetic moment","13 pages, 3 figures",,"10.1140/epjc/s10052-014-3008-y",,"hep-ph","http://arxiv.org/licenses/nonexclusive-distrib/1.0/","  We develop the formalism to provide an improved estimate for the hadronic
light-by-light correction to the muon's anomalous magnetic moment a_{\mu}, by
considering single meson contributions beyond the leading pseudo-scalar mesons.
We incorporate available experimental input as well as constraints from
light-by-light scattering sum rules to estimate the effects of axial-vector,
scalar, and tensor mesons. We give numerical evaluations for the hadronic
light-by-light contribution of these states to a_{\mu}. The presented formalism
allows to further improve on these estimates, once new data for such meson
states will become available.
","[{""version"":""v1"",""created"":""Sat, 4 Jan 2014 17:40:40 GMT""}]","2015-06-18"
"1401.0833","Dibyendu Roy","Dibyendu Roy and Nilanjan Bondyopadhaya","Statistics of scattered photons from a driven three-level emitter in a
  one-dimensional open space","10 pages, 4 figures","Phys. Rev. A 89, 043806 (2014)","10.1103/PhysRevA.89.043806","LA-UR-14-20057","physics.optics physics.atom-ph quant-ph","http://arxiv.org/licenses/nonexclusive-distrib/1.0/","  We derive the statistics of scattered photons from a $\Lambda$- or
ladder-type three-level emitter (3LE) embedded in a 1D open waveguide. The weak
probe photons in the waveguide are coupled to one of the two allowed
transitions of the 3LE, and the other transition is driven by a control beam.
This system shows electromagnetically induced transparency (EIT) which is
accompanied with the Autler-Townes splitting (ATS) at a strong driving by the
control beam, and some of these effects have been observed recently. We show
that the nature of second-order coherence of the transmitted probe photons near
two-photon resonance changes from bunching to antibunching to constant as
strength of the control beam is ramped up from zero to a higher value where the
ATS appears.
","[{""version"":""v1"",""created"":""Sat, 4 Jan 2014 18:14:08 GMT""},{""version"":""v2"",""created"":""Mon, 12 May 2014 23:35:41 GMT""}]","2014-05-14"
"1401.0834","Orlando Cigarroa Velazquez","O.V. Cigarroa, S.T. Renosto, A.J.S. Machado","Conventional Superconductivity properties of the ternary boron-nitride
  Nb2BN","5 Pages, 8 figures, accepted for publication on Supercond. Sci.
  Technol",,"10.1088/0953-2048/27/3/035005",,"cond-mat.supr-con","http://arxiv.org/licenses/nonexclusive-distrib/1.0/","  Superconducting bulk properties of ternary Nb2 BN are confirmed and are
described by means of magnetization, electronic transport and specific-heat
measurements. BCS conventional super- conductivity is found with Tc = 4.4 K.
Critical fields Hc1 (0)= 93 Oe and Hc2 (0)= 2082 Oe are extrapolated by
magnetic and resistivity measurements. The specific heat data reveals {\gamma}
= 6.3 mJ/mol K2 and {\beta} = 0.293 mJ/mol K4 in good agreement with the BCS
Theory.
","[{""version"":""v1"",""created"":""Sat, 4 Jan 2014 18:15:43 GMT""}]","2015-06-18"
"1401.0835","Mehedi  Kalam","Mehedi Kalam, Farook Rahaman, Sajahan Molla, Md. Abdul Kayum Jafry and
  Sk. Monowar Hossein","Analytical model of strange star in the low-mass X-ray binary 4U 1820-30","Some revisions have been made. Accepted in Eur.Phys.J.C",,"10.1140/epjc/s10052-014-2971-7",,"gr-qc","http://arxiv.org/licenses/nonexclusive-distrib/1.0/","  In this article, we have proposed a model for a realistic strange star under
Tolman VII metric\citep{Tolman1939}. Here the field equations are reduced to a
system of three algebraic equations for anisotropic pressure. Mass, central
density and surface density of strange star in the low-mass X-ray binary 4U
1820-30 has been matched with the observational data according to our model.
Strange materials clearly satisfies the stability condition (i.e. sound
velocities < 1) and TOV-equation. Here also surface red shift of the star has
been found to be within reasonable limit.
","[{""version"":""v1"",""created"":""Sat, 4 Jan 2014 18:30:39 GMT""},{""version"":""v2"",""created"":""Sat, 19 Jul 2014 05:02:08 GMT""}]","2015-06-18"
"1401.0836","Petros Petrosyan","Petros A. Petrosyan","Sequential edge-coloring on the subset of vertices of almost regular
  graphs","4 pages",,,,"math.CO cs.DM","http://creativecommons.org/licenses/by/3.0/","  Let $G$ be a graph and $R\subseteq V(G)$. A proper edge-coloring of a graph
$G$ with colors $1,\ldots,t$ is called an $R$-sequential $t$-coloring if the
edges incident to each vertex $v\in R$ are colored by the colors
$1,\ldots,d_{G}(v)$, where $d_{G}(v)$ is the degree of the vertex $v$ in $G$.
In this note, we show that if $G$ is a graph with $\Delta(G)-\delta(G)\leq 1$
and $\chi^{\prime}(G)=\Delta(G)=r$ ($r\geq 3$), then $G$ has an $R$-sequential
$r$-coloring with $\vert R\vert \geq
\left\lceil\frac{(r-1)n_{r}+n}{r}\right\rceil$, where $n=\vert V(G)\vert$ and
$n_{r}=\vert\{v\in V(G):d_{G}(v)=r\}\vert$. As a corollary, we obtain the
following result: if $G$ is a graph with $\Delta(G)-\delta(G)\leq 1$ and
$\chi^{\prime}(G)=\Delta(G)=r$ ($r\geq 3$), then $\Sigma^{\prime}(G)\leq
\left\lfloor\frac {2n_{r}(2r-1)+n(r-1)(r^{2}+2r-2)}{4r}\right\rfloor$, where
$\Sigma^{\prime}(G)$ is the edge-chromatic sum of $G$.
","[{""version"":""v1"",""created"":""Sat, 4 Jan 2014 18:48:01 GMT""}]","2014-01-07"
"1401.0837","Michelle Cluver Dr","M.E. Cluver, T.H. Jarrett, A.M. Hopkins, S.P. Driver, J. Liske, M.L.P.
  Gunawardhana, E.N. Taylor, A.S.G. Robotham, M. Alpaslan, I. Baldry, M.J.I.
  Brown, J.A. Peacock, C.C. Popescu, R.J. Tuffs, A.E. Bauer, J. Bland-Hawthorn,
  M. Colless, B.W. Holwerda, M.A. Lara-Lopez, K. Leschinski, A.R.
  Lopez-Sanchez, P. Norberg, M. Owers, L. Wang, S.M. Wilkins","Galaxy And Mass Assembly (GAMA): Mid-Infrared Properties and Empirical
  Relations from $WISE$","20 pages. Accepted to ApJ",,"10.1088/0004-637X/782/2/90",,"astro-ph.GA astro-ph.CO","http://arxiv.org/licenses/nonexclusive-distrib/1.0/","  The Galaxy And Mass Assembly (GAMA) survey furnishes a deep redshift catalog
that, when combined with the Wide-field Infrared Explorer ($WISE$), allows us
to explore for the first time the mid-infrared properties of $> 110, 000$
galaxies over 120 deg$^2$ to $z\simeq 0.5$. In this paper we detail the
procedure for producing the matched GAMA-$WISE$ catalog for the G12 and G15
fields, in particular characterising and measuring resolved sources; the
complete catalogs for all three GAMA equatorial fields will be made available
through the GAMA public releases. The wealth of multiwavelength photometry and
optical spectroscopy allows us to explore empirical relations between optically
determined stellar mass (derived from synthetic stellar population models) and
3.4micron and 4.6micron WISE measurements. Similarly dust-corrected
Halpha-derived star formation rates can be compared to 12micron and 22micron
luminosities to quantify correlations that can be applied to large samples to
$z<0.5$. To illustrate the applications of these relations, we use the 12micron
star formation prescription to investigate the behavior of specific star
formation within the GAMA-WISE sample and underscore the ability of WISE to
detect star-forming systems at $z\sim0.5$. Within galaxy groups (determined by
a sophisticated friends-of-friends scheme), results suggest that galaxies with
a neighbor within 100$\,h^{-1} $kpc have, on average, lower specific star
formation rates than typical GAMA galaxies with the same stellar mass.
","[{""version"":""v1"",""created"":""Sat, 4 Jan 2014 19:00:17 GMT""}]","2015-06-18"
"1401.0838","Brendan Godfrey","Brendan B. Godfrey and Jean-Luc Vay","Suppressing the Numerical Cherenkov Instability in FDTD PIC Codes","13 pages, 5 figures","Journal of Compujtational Physics 261, 1-6 (2014)","10.1016/j.jcp.2014.02.022",,"physics.plasm-ph math.NA physics.acc-ph physics.comp-ph","http://creativecommons.org/licenses/by-nc-sa/3.0/","  A procedure for largely suppressing the numerical Cherenkov instability in
finite difference time-domain (FDTD) particle-in-cell (PIC) simulations of
cold, relativistic beams is derived, and residual growth rates computed and
compared with WARP code simulation results. Sample laser-plasma acceleration
simulation output is provided to further validate the new procedure.
","[{""version"":""v1"",""created"":""Sat, 4 Jan 2014 19:02:27 GMT""}]","2014-07-29"
"1401.0839","Marco Alberto Javarone","Marco Alberto Javarone","Social Influences in Opinion Dynamics: the Role of Conformity","22 pages, 12 figures, appears in Physica A: Statistical Mechanics and
  its Applications (volume 414) 2014",,"10.1016/j.physa.2014.07.018",,"physics.soc-ph cs.SI nlin.AO","http://arxiv.org/licenses/nonexclusive-distrib/1.0/","  We study the effects of social influences in opinion dynamics. In particular,
we define a simple model, based on the majority rule voting, in order to
consider the role of conformity. Conformity is a central issue in social
psychology as it represents one of people's behaviors that emerges as a result
of their interactions. The proposed model represents agents, arranged in a
network and provided with an individual behavior, that change opinion in
function of those of their neighbors. In particular, agents can behave as
conformists or as nonconformists. In the former case, agents change opinion in
accordance with the majority of their social circle (i.e., their neighbors); in
the latter case, they do the opposite, i.e., they take the minority opinion.
Moreover, we investigate the nonconformity both on a global and on a local
perspective, i.e., in relation to the whole population and to the social circle
of each nonconformist agent, respectively. We perform a computational study of
the proposed model, with the aim to observe if and how the conformity affects
the related outcomes. Moreover, we want to investigate whether it is possible
to achieve some kind of equilibrium, or of order, during the evolution of the
system. Results highlight that the amount of nonconformist agents in the
population plays a central role in these dynamics. In particular, conformist
agents play the role of stabilizers in fully-connected networks, whereas the
opposite happens in complex networks. Furthermore, by analyzing complex
topologies of the agent network, we found that in the presence of radical
nonconformist agents the topology of the system has a prominent role; otherwise
it does not matter since we observed that a conformist behavior is almost
always more convenient. Finally, we analyze the results of the model by
considering that agents can change also their behavior over time.
","[{""version"":""v1"",""created"":""Sat, 4 Jan 2014 19:13:11 GMT""},{""version"":""v2"",""created"":""Fri, 15 Aug 2014 07:29:50 GMT""}]","2014-08-18"
"1401.0840","Martin Kell","Martin Kell","q-heat flow and the gradient flow of the Renyi entropy in the
  p-Wasserstein space","26 pages",,,,"math.MG math.AP math.FA","http://arxiv.org/licenses/nonexclusive-distrib/1.0/","  Based on the idea of a recent paper by Ambrosio-Gigli-Savar\'e in Invent.
Math. (2013), we show that flow of the $q$-Cheeger energy, called $q$-heat
flow, solves the gradient flow problem of the Renyi entropy functional in the
$p$-Wasserstein. For that, a further study of the $q$-heat flow is presented
including a condition for its mass preservation. Under a convexity assumption
on the upper gradient, which holds for all $q\ge2$, one gets uniqueness of the
gradient flow and the two flows can be identified. Smooth solution of the
$q$-heat flow are solution the parabolic q-Laplace equation, i.e.
$\partial_{t}f_{t}=\Delta_{q}f_{t}.$
","[{""version"":""v1"",""created"":""Sat, 4 Jan 2014 19:38:20 GMT""}]","2014-01-07"
"1401.0841","Sandro Gallo","Sandro Gallo and Nancy L. Garcia and Valdivino Vargas Junior and Pablo
  M. Rodr\'iguez","Rumor processes on $\N$ and discrete renewal processes","10 pages",,"10.1007/s10955-014-0959-1",,"math.PR","http://arxiv.org/licenses/nonexclusive-distrib/1.0/","  We study two rumor processes on $\N$, the dynamics of which are related to an
SI epidemic model with long range transmission. Both models start with one
spreader at site $0$ and ignorants at all the other sites of $\N$, but differ
by the transmission mechanism. In one model, the spreaders transmit the
information within a random distance on their right, and in the other the
ignorants take the information from a spreader within a random distance on
their left.
  We obtain the probability of survival, information on the distribution of the
range of the rumor and limit theorems for the proportion of spreaders. The key
step of our proofs is to show that, in each model, the position of the
spreaders on $\N$ can be related to a suitably chosen discrete renewal process.
","[{""version"":""v1"",""created"":""Sat, 4 Jan 2014 19:49:48 GMT""}]","2015-06-18"
"1401.0842","Alexander Patkowski","Alexander E Patkowski","Remarks on a Bailey pair with one free parameter",,"Ukrainian Mathematical Journal (2017), Volume 69, Issue 2, pp
  312--317","10.1007/s11253-017-1363-1",,"math.NT","http://arxiv.org/licenses/nonexclusive-distrib/1.0/","  We offer a more general Bailey pair than one that was proved in two different
papers by two different methods [5, 12].
","[{""version"":""v1"",""created"":""Sat, 4 Jan 2014 19:56:40 GMT""}]","2017-09-05"
"1401.0843","Warren Powell","Warren R. Scott, Warren B. Powell, Somayeh Moazehi","Least Squares Policy Iteration with Instrumental Variables vs. Direct
  Policy Search: Comparison Against Optimal Benchmarks Using Energy Storage","37 pages, 9 figures",,,,"math.OC cs.LG","http://arxiv.org/licenses/nonexclusive-distrib/1.0/","  This paper studies approximate policy iteration (API) methods which use
least-squares Bellman error minimization for policy evaluation. We address
several of its enhancements, namely, Bellman error minimization using
instrumental variables, least-squares projected Bellman error minimization, and
projected Bellman error minimization using instrumental variables. We prove
that for a general discrete-time stochastic control problem, Bellman error
minimization using instrumental variables is equivalent to both variants of
projected Bellman error minimization. An alternative to these API methods is
direct policy search based on knowledge gradient. The practical performance of
these three approximate dynamic programming methods are then investigated in
the context of an application in energy storage, integrated with an
intermittent wind energy supply to fully serve a stochastic time-varying
electricity demand. We create a library of test problems using real-world data
and apply value iteration to find their optimal policies. These benchmarks are
then used to compare the developed policies. Our analysis indicates that API
with instrumental variables Bellman error minimization prominently outperforms
API with least-squares Bellman error minimization. However, these approaches
underperform our direct policy search implementation.
","[{""version"":""v1"",""created"":""Sat, 4 Jan 2014 19:57:26 GMT""}]","2014-01-07"
"1401.0844","Fabio Rapallo","Roberto Fontana, Fabio Rapallo and Maria Piera Rogantin","$D$-optimal saturated designs: a simulation study","8 pages. Preliminary version submitted to the 7th IWS Proceedings",,,,"stat.ME math.CO math.ST stat.TH","http://arxiv.org/licenses/nonexclusive-distrib/1.0/","  In this work we focus on saturated $D$-optimal designs. Using recent results,
we identify $D$-optimal designs with the solutions of an optimization problem
with linear constraints. We introduce new objective functions based on the
geometric structure of the design and we compare them with the classical
$D$-efficiency criterion. We perform a simulation study. In all the test cases
we observe that designs with high values of $D$-efficiency have also high
values of the new objective functions.
","[{""version"":""v1"",""created"":""Sat, 4 Jan 2014 21:19:02 GMT""}]","2014-01-07"
"1401.0845","Gabriel Feinberg","Gabriel Feinberg and Kyu-Hwan Lee","Fully commutative elements of type D and homogeneous representations of
  KLR-algebras","19 pages",,,,"math.RT math.CO","http://arxiv.org/licenses/nonexclusive-distrib/1.0/","  In this paper, we decompose the set of fully commutative elements into
natural subsets when the Coxeter group is of type $D_n$, and study the
combinatorics of these subsets, revealing hidden structures. (We do not
consider type $A_n$ first, since a similar decomposition for type $A_n$ is
trivial.) As an application, we classify and enumerate the homogeneous
representations of the Khovanov-Lauda-Rouquier algebras of type $D_n$.
","[{""version"":""v1"",""created"":""Sat, 4 Jan 2014 21:34:17 GMT""},{""version"":""v2"",""created"":""Wed, 29 Jul 2015 18:17:26 GMT""}]","2015-07-30"
