"1401.0866","Francisco Frutos-Alfaro Dr. rer. nat.","Francisco Frutos-Alfaro","Perturbation of the Kerr Metric",,,,,"gr-qc astro-ph.CO","http://arxiv.org/licenses/nonexclusive-distrib/1.0/","  A new Kerr-like metric with quadrupole moment is obtained by means of
perturbing the Kerr spacetime. By comparison with the exterior Hartle-Thorne
metric, it is showed that it could be matched to an interior solution. This
metric may represent the spacetime of an astrophysical object.
","[{""version"":""v1"",""created"":""Sun, 5 Jan 2014 04:11:24 GMT""}]","2014-01-09"
"1401.0867","Ruben Fossion","R. Fossion and G. Torres-Vargas","Normal mode analysis of disordered random-matrix ensembles","14 pages, 3 figures","Phys. A, Available online 15 October 2019, 123128","10.1016/j.physa.2019.123128",,"nlin.CD cond-mat.stat-mech","http://arxiv.org/licenses/nonexclusive-distrib/1.0/","  The statistics of random-matrix spectra can be very sensitive to the
unfolding procedure that separates global from local properties. In order to
avoid the introduction of possible artifacts, recently it has been applied to
ergodic ensembles of Random Matrix Theory (RMT) the singular value
decomposition (SVD) method, based on normal mode analysis, which characterizes
the long-range correlations of the spectral fluctuations in a direct way
without performing any unfolding. However, in the case of more general
ensembles, the ergodicity property is often broken leading to ambiguities
between spectrum-unfolded and ensemble-unfolded fluctuation statistics. Here,
we apply SVD to a disordered random-matrix ensemble with tunable nonergodicity,
as a mathematical framework to characterize the nonergodicity. We show that
ensemble-averaged and individual-spectrum averaged statistics are calculated
consistently using the same normal mode basis, and the nonergodicity is
explained as a breakdown of this common basis.
","[{""version"":""v1"",""created"":""Sun, 5 Jan 2014 05:42:41 GMT""},{""version"":""v2"",""created"":""Thu, 23 Jan 2014 02:16:52 GMT""},{""version"":""v3"",""created"":""Sun, 3 Nov 2019 22:48:33 GMT""}]","2019-11-05"
"1401.0868","Alexander I. Suciu","Stefan Papadima, Alexander I. Suciu","The Milnor fibration of a hyperplane arrangement: from modular resonance
  to algebraic monodromy","50 pages, 5 figures; v2: results strengthened, proofs simplified; v3:
  accepted for publication in the Proceedings of the London Mathematical
  Society","Proceedings of the London Mathematical Society 114 (2017), no. 6,
  961-1004","10.1112/plms.12027",,"math.AG math.AT math.CO","http://arxiv.org/licenses/nonexclusive-distrib/1.0/","  A central question in arrangement theory is to determine whether the
characteristic polynomial $\Delta_q$ of the algebraic monodromy acting on the
homology group $H_q(F(\mathcal{A}),\mathbb{C})$ of the Milnor fiber of a
complex hyperplane arrangement $\mathcal{A}$ is determined by the intersection
lattice $L(\mathcal{A})$. Under simple combinatorial conditions, we show that
the multiplicities of the factors of $\Delta_1$ corresponding to certain
eigenvalues of order a power of a prime $p$ are equal to the Aomoto--Betti
numbers $\beta_p(\mathcal{A})$, which in turn are extracted from
$L(\mathcal{A})$. When $\mathcal{A}$ defines an arrangement of projective lines
with only double and triple points, this leads to a combinatorial formula for
the algebraic monodromy. To obtain these results, we relate nets on the
underlying matroid of $\mathcal{A}$ to resonance varieties in positive
characteristic. Using modular invariants of nets, we find a new realizability
obstruction (over $\mathbb{C}$) for matroids, and we estimate the number of
essential components in the first complex resonance variety of $\mathcal{A}$.
Our approach also reveals a rather unexpected connection of modular resonance
with the geometry of ${\rm SL}_2(\mathbb{C})$-representation varieties, which
are governed by the Maurer--Cartan equation.
","[{""version"":""v1"",""created"":""Sun, 5 Jan 2014 06:12:19 GMT""},{""version"":""v2"",""created"":""Tue, 8 Apr 2014 15:30:53 GMT""},{""version"":""v3"",""created"":""Thu, 26 Jan 2017 05:05:29 GMT""}]","2017-06-13"
"1401.0869","Zhaosong Lu","Zhaosong Lu and Yong Zhang","Schatten-$p$ Quasi-Norm Regularized Matrix Optimization via Iterative
  Reweighted Singular Value Minimization","This paper has been withdrawn by the author due to major revision and
  corrections",,,,"math.OC cs.LG math.NA stat.CO stat.ML","http://arxiv.org/licenses/nonexclusive-distrib/1.0/","  In this paper we study general Schatten-$p$ quasi-norm (SPQN) regularized
matrix minimization problems. In particular, we first introduce a class of
first-order stationary points for them, and show that the first-order
stationary points introduced in [11] for an SPQN regularized $vector$
minimization problem are equivalent to those of an SPQN regularized $matrix$
minimization reformulation. We also show that any local minimizer of the SPQN
regularized matrix minimization problems must be a first-order stationary
point. Moreover, we derive lower bounds for nonzero singular values of the
first-order stationary points and hence also of the local minimizers of the
SPQN regularized matrix minimization problems. The iterative reweighted
singular value minimization (IRSVM) methods are then proposed to solve these
problems, whose subproblems are shown to have a closed-form solution. In
contrast to the analogous methods for the SPQN regularized $vector$
minimization problems, the convergence analysis of these methods is
significantly more challenging. We develop a novel approach to establishing the
convergence of these methods, which makes use of the expression of a specific
solution of their subproblems and avoids the intricate issue of finding the
explicit expression for the Clarke subdifferential of the objective of their
subproblems. In particular, we show that any accumulation point of the sequence
generated by the IRSVM methods is a first-order stationary point of the
problems. Our computational results demonstrate that the IRSVM methods
generally outperform some recently developed state-of-the-art methods in terms
of solution quality and/or speed.
","[{""version"":""v1"",""created"":""Sun, 5 Jan 2014 06:37:50 GMT""},{""version"":""v2"",""created"":""Tue, 24 Nov 2015 18:41:44 GMT""},{""version"":""v3"",""created"":""Mon, 31 Oct 2016 17:30:58 GMT""}]","2016-11-01"
"1401.0870","Laurence Aroquiaraj","I. Laurence Aroquiaraj and K. Thangavel","Pectoral Muscles Suppression in Digital Mammograms using Hybridization
  of Soft Computing Methods","8 pages, 6 figures",,,,"cs.CV cs.CE","http://arxiv.org/licenses/nonexclusive-distrib/1.0/","  Breast region segmentation is an essential prerequisite in computerized
analysis of mammograms. It aims at separating the breast tissue from the
background of the mammogram and it includes two independent segmentations. The
first segments the background region which usually contains annotations, labels
and frames from the whole breast region, while the second removes the pectoral
muscle portion (present in Medio Lateral Oblique (MLO) views) from the rest of
the breast tissue. In this paper we propose hybridization of Connected
Component Labeling (CCL), Fuzzy, and Straight line methods. Our proposed
methods worked good for separating pectoral region. After removal pectoral
muscle from the mammogram, further processing is confined to the breast region
alone. To demonstrate the validity of our segmentation algorithm, it is
extensively tested using over 322 mammographic images from the Mammographic
Image Analysis Society (MIAS) database. The segmentation results were evaluated
using a Mean Absolute Error (MAE), Hausdroff Distance (HD), Probabilistic Rand
Index (PRI), Local Consistency Error (LCE) and Tanimoto Coefficient (TC). The
hybridization of fuzzy with straight line method is given more than 96% of the
curve segmentations to be adequate or better. In addition a comparison with
similar approaches from the state of the art has been given, obtaining slightly
improved results. Experimental results demonstrate the effectiveness of the
proposed approach.
","[{""version"":""v1"",""created"":""Sun, 5 Jan 2014 08:14:43 GMT""}]","2014-01-07"
"1401.0871","Sakellarios Zairis","Amy Rebecca Gansell, Jan-Willem van de Meent, Sakellarios Zairis,
  Chris H. Wiggins","Stylistic Clusters and the Syrian/South Syrian Tradition of
  First-Millennium BCE Levantine Ivory Carving: A Machine Learning Approach","28 pages, 16 figures, accepted for publication in the Journal of
  Archaeological Science",,,,"stat.ML stat.AP","http://arxiv.org/licenses/nonexclusive-distrib/1.0/","  Thousands of first-millennium BCE ivory carvings have been excavated from
Neo-Assyrian sites in Mesopotamia (primarily Nimrud, Khorsabad, and Arslan
Tash) hundreds of miles from their Levantine production contexts. At present,
their specific manufacture dates and workshop localities are unknown. Relying
on subjective, visual methods, scholars have grappled with their classification
and regional attribution for over a century. This study combines visual
approaches with machine-learning techniques to offer data-driven perspectives
on the classification and attribution of this early Iron Age corpus. The study
sample consisted of 162 sculptures of female figures. We have developed an
algorithm that clusters the ivories based on a combination of descriptive and
anthropometric data. The resulting categories, which are based on purely
statistical criteria, show good agreement with conventional art historical
classifications, while revealing new perspectives, especially with regard to
the contested Syrian/South Syrian/Intermediate tradition. Specifically, we have
identified that objects of the Syrian/South Syrian/Intermediate tradition may
be more closely related to Phoenician objects than to North Syrian objects; we
offer a reconsideration of a subset of Phoenician objects, and we confirm
Syrian/South Syrian/Intermediate stylistic subgroups that might distinguish
networks of acquisition among the sites of Nimrud, Khorsabad, Arslan Tash and
the Levant. We have also identified which features are most significant in our
cluster assignments and might thereby be most diagnostic of regional carving
traditions. In short, our study both corroborates traditional visual
classification methods and demonstrates how machine-learning techniques may be
employed to reveal complementary information not accessible through the
exclusively visual analysis of an archaeological corpus.
","[{""version"":""v1"",""created"":""Sun, 5 Jan 2014 08:15:54 GMT""}]","2014-01-07"
"1401.0872","Philip Schniter","Justin Ziniel, Philip Schniter, and Per Sederberg","Binary Linear Classification and Feature Selection via Generalized
  Approximate Message Passing",,,"10.1109/TSP.2015.2407311",,"cs.IT math.IT stat.ML","http://arxiv.org/licenses/nonexclusive-distrib/1.0/","  For the problem of binary linear classification and feature selection, we
propose algorithmic approaches to classifier design based on the generalized
approximate message passing (GAMP) algorithm, recently proposed in the context
of compressive sensing. We are particularly motivated by problems where the
number of features greatly exceeds the number of training examples, but where
only a few features suffice for accurate classification. We show that
sum-product GAMP can be used to (approximately) minimize the classification
error rate and max-sum GAMP can be used to minimize a wide variety of
regularized loss functions. Furthermore, we describe an
expectation-maximization (EM)-based scheme to learn the associated model
parameters online, as an alternative to cross-validation, and we show that
GAMP's state-evolution framework can be used to accurately predict the
misclassification rate. Finally, we present a detailed numerical study to
confirm the accuracy, speed, and flexibility afforded by our GAMP-based
approaches to binary linear classification and feature selection.
","[{""version"":""v1"",""created"":""Sun, 5 Jan 2014 08:23:06 GMT""},{""version"":""v2"",""created"":""Tue, 26 Aug 2014 10:11:31 GMT""},{""version"":""v3"",""created"":""Tue, 16 Dec 2014 14:24:42 GMT""}]","2015-06-18"
"1401.0873","Brian  Sutcliffe","Brian T Sutcliffe and R Guy Woolley","Comment on `On the Quantum Theory of Molecules' [J. Chem.Phys. {\bf
  137}, 22A544 (2012)]","2 pages",,"10.1063/1.4861897",,"quant-ph","http://arxiv.org/licenses/nonexclusive-distrib/1.0/","  In our previous paper [J. Chem.Phys. {\bf 137}, 22A544 (2012)] we argued that
the Born-Oppenheimer approximation could not be based on an exact
transformation of the molecular Schr\""{o}dinger equation. In this Comment we
suggest that the fundamental reason for the approximate nature of the
Born-Oppenheimer model is the lack of a complete set of functions for the
electronic space, and the need to describe the continuous spectrum using
spectral projection.
","[{""version"":""v1"",""created"":""Sun, 5 Jan 2014 08:46:05 GMT""},{""version"":""v2"",""created"":""Thu, 9 Jan 2014 18:28:17 GMT""}]","2015-06-18"
"1401.0874","Julie Grollier","Nicolas Locatelli, Vincent Cros and Julie Grollier","Spin torque building blocks",,"Nature Materials 13, 11 (2014)","10.1038/NMAT3823",,"cond-mat.mtrl-sci cond-mat.mes-hall","http://arxiv.org/licenses/nonexclusive-distrib/1.0/","  The discovery of the spin torque effect has made magnetic nanodevices
realistic candidates for active elements of memory devices and applications.
Magnetoresistive effects allow the read-out of increasingly small magnetic
bits, and the spin torque provides an efficient tool to manipulate - precisely,
rapidly and at low energy cost - the magnetic state, which is in turn the
central information medium of spintronic devices. By keeping the same magnetic
stack, but by tuning a device's shape and bias conditions, the spin torque can
be engineered to build a variety of advanced magnetic nanodevices. Here we show
that by assembling these nanodevices as building blocks with different
functionalities, novel types of computing architectures can be envisisaged. We
focus in particular on recent concepts such as magnonics and spintronic neural
networks.
","[{""version"":""v1"",""created"":""Sun, 5 Jan 2014 08:59:19 GMT""}]","2014-01-07"
"1401.0875","Sonali Goyal","Anoop J. Sahoo, Md. Amir Khusru Akhtar","Determining the Possibilities and Certainties in Network Participation
  for MANETS","10 Pages. International Journal of Computer Engineering and
  Applications,2013",,,,"cs.NI","http://arxiv.org/licenses/nonexclusive-distrib/1.0/","  A mobile ad hoc network is a self organized cooperative network that works
without any permanent infrastructure. This infrastructure less design makes it
complex compared to other wireless networks. Lot of attacks and misbehavior
obstruct the growth and implementation. The majority of attacks and misbehavior
can be handled by existing protocols. But these protocols reduce the total
strength of nodes in a network because they isolate nodes from network
participation having lesser reputation value. To cope with this problem we have
presented the Possibility and Certainty model. This model uses reputation value
to determine the possibilities and certainties in network participation. The
proposed model classifies nodes into three classes such as certain or HIGH
grade possible or MED grade and not possible or LOW grade. Choosing HIGH grade
nodes in network activities improves the Packet Delivery Ratio which enhances
the throughput of the MANET. On the other hand when node strength is poor we
choose MED grade nodes for network activities. Thus the proposed model allows
communication in the worst scenario with the possibility of success. It
protects a network from misbehavior by isolating LOW grade nodes from routing
paths.
","[{""version"":""v1"",""created"":""Sun, 5 Jan 2014 09:00:40 GMT""}]","2014-01-07"
"1401.0876","Wolfgang Lueck","Holger Kammeyer and Wolfgang Lueck and Henrik Rueping","The Farrell-Jones conjecture for arbitrary lattices in virtually
  connected Lie groups","final version, to appear in G&T, 9 pages","Geom. Topol. 20 (2016) 1275-1287","10.2140/gt.2016.20.1275",,"math.KT","http://arxiv.org/licenses/nonexclusive-distrib/1.0/","  We prove the K- and the $L$-theoretic Farrell-Jones conjecture with
coefficients in additive categories and with finite wreath products for
arbitrary lattices in virtually connected Lie groups.
","[{""version"":""v1"",""created"":""Sun, 5 Jan 2014 09:13:11 GMT""},{""version"":""v2"",""created"":""Fri, 17 Jul 2015 12:39:21 GMT""}]","2016-07-20"
"1401.0877","Unnikrishnan K G","K.G. Unnikrishnan and B. Sundar Rajan","Space-Time Coded Spatial Modulated Physical Layer Network Coding for
  Two-Way Relaying","9 pages, 7 figures",,,,"cs.IT math.IT","http://arxiv.org/licenses/nonexclusive-distrib/1.0/","  Using the spatial modulation approach, where only one transmit antenna is
active at a time, we propose two transmission schemes for two-way relay channel
using physical layer network coding with space time coding using Coordinate
Interleaved Orthogonal Designs (CIOD's). It is shown that using two
uncorrelated transmit antennas at the nodes, but using only one RF transmit
chain and space-time coding across these antennas can give a better performance
without using any extra resources and without increasing the hardware
implementation cost and complexity. In the first transmission scheme, two
antennas are used only at the relay, Adaptive Network Coding (ANC) is employed
at the relay and the relay transmits a CIOD Space Time Block Code (STBC). This
gives a better performance compared to an existing ANC scheme for two-way relay
channel which uses one antenna each at all the three nodes. It is shown that
for this scheme at high SNR the average end-to-end symbol error probability
(SEP) is upper bounded by twice the SEP of a point-to-point fading channel. In
the second transmission scheme, two transmit antennas are used at all the three
nodes, CIOD STBC's are transmitted in multiple access and broadcast phases.
This scheme provides a diversity order of two for the average end-to-end SEP
with an increased decoding complexity of $\mathcal{O}(M^3)$ for an arbitrary
signal set and $\mathcal{O}(M^2\sqrt{M})$ for square QAM signal set.
","[{""version"":""v1"",""created"":""Sun, 5 Jan 2014 09:28:42 GMT""}]","2014-01-07"
"1401.0878","J\'er\^ome Tribollet","J\'er\^ome Tribollet","Hybrid paramagnetic-ferromagnetic quantum computer design based on
  electron spin arrays and a ferromagnetic nanostripe","15 pages, 5 figures",,"10.1140/epjb/e2014-50147-8",,"quant-ph cond-mat.mes-hall","http://arxiv.org/licenses/nonexclusive-distrib/1.0/","  General design for the practical implementation of hybrid
paramagnetic-ferromagnetic quantum computer.
","[{""version"":""v1"",""created"":""Sun, 5 Jan 2014 09:43:40 GMT""}]","2015-06-18"
"1401.0879","Nicolas Piro","Nicolas Piro, Thomas Pengo, Nicolas Olivier, Suliana Manley","Improved 3D Superresolution Localization Microscopy Using Adaptive
  Optics","9 pages, 3 figures",,,,"physics.optics physics.bio-ph","http://arxiv.org/licenses/nonexclusive-distrib/1.0/","  We demonstrate a new versatile method for 3D super-resolution microscopy by
using a deformable mirror to shape the point spread function of our microscope
in a continuous and controllable way. We apply this for 3D STORM imaging of
microtubules.
","[{""version"":""v1"",""created"":""Sun, 5 Jan 2014 09:45:19 GMT""}]","2014-01-07"
"1401.0880","Nick Gravin","Ning Chen and Nick Gravin and Pinyan Lu","Optimal Competitive Auctions",,,,,"cs.GT","http://arxiv.org/licenses/nonexclusive-distrib/1.0/","  We study the design of truthful auctions for selling identical items in
unlimited supply (e.g., digital goods) to n unit demand buyers. This classic
problem stands out from profit-maximizing auction design literature as it
requires no probabilistic assumptions on buyers' valuations and employs the
framework of competitive analysis. Our objective is to optimize the worst-case
performance of an auction, measured by the ratio between a given benchmark and
revenue generated by the auction.
  We establish a sufficient and necessary condition that characterizes
competitive ratios for all monotone benchmarks. The characterization identifies
the worst-case distribution of instances and reveals intrinsic relations
between competitive ratios and benchmarks in the competitive analysis. With the
characterization at hand, we show optimal competitive auctions for two natural
benchmarks.
  The most well-studied benchmark $\mathcal{F}^{(2)}(\cdot)$ measures the
envy-free optimal revenue where at least two buyers win. Goldberg et al. [13]
showed a sequence of lower bounds on the competitive ratio for each number of
buyers n. They conjectured that all these bounds are tight. We show that
optimal competitive auctions match these bounds. Thus, we confirm the
conjecture and settle a central open problem in the design of digital goods
auctions. As one more application we examine another economically meaningful
benchmark, which measures the optimal revenue across all limited-supply Vickrey
auctions. We identify the optimal competitive ratios to be
$(\frac{n}{n-1})^{n-1}-1$ for each number of buyers n, that is $e-1$ as $n$
approaches infinity.
","[{""version"":""v1"",""created"":""Sun, 5 Jan 2014 09:59:07 GMT""}]","2014-01-07"
"1401.0881","Floris Braakman","F.R. Braakman, J. Danon, L.R. Schreiber, W. Wegscheider and L.M.K.
  Vandersypen","Dynamics of spin-flip photon-assisted tunneling",,"Phys. Rev. B 89, 075417 (2014)","10.1103/PhysRevB.89.075417","NBI CMT QDEV 2014","cond-mat.mes-hall","http://arxiv.org/licenses/nonexclusive-distrib/1.0/","  We present time-resolved measurements of spin-flip photon-assisted tunneling
and spin-flip relaxation in a doubly occupied double quantum dot. The
photon-assisted excitation rate as a function of magnetic field indicates that
spin-orbit coupling is the dominant mechanism behind the spin-flip under the
present conditions. We are able to extract the resulting effective `spin-flip
tunneling' energy, which is found to be three orders of magnitude smaller than
the regular spin-conserving tunneling energy. We also measure the relaxation
and dephasing times of a qubit formed out of two two-electron states with
different spin and charge configurations.
","[{""version"":""v1"",""created"":""Sun, 5 Jan 2014 10:28:05 GMT""}]","2016-04-18"
"1401.0882","Jesse Alama","Jesse Alama","Exploring Steinitz-Rademacher polyhedra: A challenge for automated
  reasoning tools","5 pages. Presented at IWIL 2010 (International Workshop on the
  Implementation of Logics), Yogyakarta, Indonesia","Proceedings of the Eighth International Workshop on the
  Implementation of Logics, 2010, pp. 14-18",,,"math.LO cs.DM cs.LO","http://arxiv.org/licenses/nonexclusive-distrib/1.0/","  This note reports on some experiments, using a handful of standard automated
reasoning tools, for exploring Steinitz-Rademacher polyhedra, which are models
of a certain first-order theory of incidence structures. This theory and its
models, even simple ones, presents significant, geometrically fascinating
challenges for automated reasoning tools.
","[{""version"":""v1"",""created"":""Sun, 5 Jan 2014 10:29:49 GMT""},{""version"":""v2"",""created"":""Wed, 8 Jan 2014 14:48:36 GMT""}]","2014-01-09"
"1401.0883","Aurelien Manchon","Aurelien Manchon, P. Birame Ndiaye, Jung-Hwan Moon, Hyun-Woo Lee,
  Kyung-Jin Lee","Magnon-Mediated Dzyaloshinskii-Moriya Torque in Homogeneous Ferromagnets","5 pages, 3 figures","Phys. Rev. B 90, 224403 (2014)","10.1103/PhysRevB.90.224403",,"cond-mat.mes-hall cond-mat.mtrl-sci","http://arxiv.org/licenses/nonexclusive-distrib/1.0/","  In thin magnetic layers with structural inversion asymmetry and spin-orbit
coupling, a Dzyaloshinskii-Moriya interaction arises at the interface. When a
spin wave current ${\bf j}_m$ flows in a system with a homogeneous
magnetization {\bf m}, this interaction produces an effective field-like torque
on the form ${\bf T}_{\rm FL}\propto{\bf m}\times({\bf z}\times{\bf j}_m)$ as
well as a damping-like torque, ${\bf T}_{\rm DL}\propto{\bf m}\times[({\bf
z}\times{\bf j}_m)\times{\bf m}]$ in the presence of spin-wave relaxation
(${\bf z}$ is normal to the interface). These torques mediated by the magnon
flow can reorient the time-averaged magnetization direction and display a
number of similarities with the torques arising from the electron flow in a
magnetic two dimensional electron gas with Rashba spin-orbit coupling. This
magnon-mediated spin-orbit torque can be efficient in the case of magnons
driven by a thermal gradient.
","[{""version"":""v1"",""created"":""Sun, 5 Jan 2014 10:44:46 GMT""},{""version"":""v2"",""created"":""Wed, 21 May 2014 10:27:36 GMT""}]","2014-12-10"
"1401.0884","Dimitar  Nedanovski","Dimitar Nedanovski","Superconformal vertex algebras in four dimensions","19 pages","Mod. Phys. Lett. A, Vol. 30, No. 12 (2015) 1550064","10.1142/S0217732315500649",,"hep-th","http://arxiv.org/licenses/nonexclusive-distrib/1.0/","  A superfield formalism for quantum fields with N-extended superconformal
symmetry is developed using vertex algebra techniques in four dimensions.
","[{""version"":""v1"",""created"":""Sun, 5 Jan 2014 10:52:08 GMT""}]","2015-04-01"
