"1401.0885","Stefano Berardi","Stefano Berardi (University of Turin), Ugo de'Liguoro (University of
  Turin)","Knowledge Spaces and the Completeness of Learning Strategies",,"Logical Methods in Computer Science, Volume 10, Issue 1 (February
  12, 2014) lmcs:729","10.2168/LMCS-10(1:9)2014",,"cs.LO math.LO","http://arxiv.org/licenses/nonexclusive-distrib/1.0/","  We propose a theory of learning aimed to formalize some ideas underlying
Coquand's game semantics and Krivine's realizability of classical logic. We
introduce a notion of knowledge state together with a new topology, capturing
finite positive and negative information that guides a learning strategy. We
use a leading example to illustrate how non-constructive proofs lead to
continuous and effective learning strategies over knowledge spaces, and prove
that our learning semantics is sound and complete w.r.t. classical truth, as it
is the case for Coquand's and Krivine's approaches.
","[{""version"":""v1"",""created"":""Sun, 5 Jan 2014 11:04:02 GMT""},{""version"":""v2"",""created"":""Tue, 11 Feb 2014 16:10:01 GMT""}]","2015-07-01"
"1401.0886","Najashi Bara'u Gafai","Barau Gafai Najashi, Feng Wenjiang, Mohammed Dikko Almustapha","Spectrum Hole Prediction Based On Historical Data: A Neural Network
  Approach","8 pages,9 figures",,,,"cs.NE","http://arxiv.org/licenses/nonexclusive-distrib/1.0/","  The concept of cognitive radio pioneered by Mitola promises to change the
future of wireless communication especially in the area of spectrum management.
Currently, the command and control strategy employed in spectrum assignment is
too rigid and needs to be reviewed. Recent studies have shown that assigned
spectrum is underutilized spectrally and temporally. Cognitive radio provides a
viable solution whereby licensed users can share the spectrum with unlicensed
users opportunistically without causing interference. Unlicensed users must be
able to sense weather the channel is busy or idle, failure to do so will lead
to interference to the licensed user. In this paper, a neural network based
prediction model for predicting the channel status using historical data
obtained during a spectrum occupancy measurement is presented. Genetic
algorithm is combined with LM BP for increasing the probability of obtaining
the best weights thus optimizing the network. The results obtained indicate
high prediction accuracy over all bands considered
","[{""version"":""v1"",""created"":""Sun, 5 Jan 2014 11:41:43 GMT""}]","2014-01-07"
"1401.0887","Dorina Thanou","Dorina Thanou, David I Shuman, Pascal Frossard","Learning parametric dictionaries for graph signals",,,"10.1109/TSP.2014.2332441",,"cs.LG cs.SI stat.ML","http://arxiv.org/licenses/nonexclusive-distrib/1.0/","  In sparse signal representation, the choice of a dictionary often involves a
tradeoff between two desirable properties -- the ability to adapt to specific
signal data and a fast implementation of the dictionary. To sparsely represent
signals residing on weighted graphs, an additional design challenge is to
incorporate the intrinsic geometric structure of the irregular data domain into
the atoms of the dictionary. In this work, we propose a parametric dictionary
learning algorithm to design data-adapted, structured dictionaries that
sparsely represent graph signals. In particular, we model graph signals as
combinations of overlapping local patterns. We impose the constraint that each
dictionary is a concatenation of subdictionaries, with each subdictionary being
a polynomial of the graph Laplacian matrix, representing a single pattern
translated to different areas of the graph. The learning algorithm adapts the
patterns to a training set of graph signals. Experimental results on both
synthetic and real datasets demonstrate that the dictionaries learned by the
proposed algorithm are competitive with and often better than unstructured
dictionaries learned by state-of-the-art numerical learning algorithms in terms
of sparse approximation of graph signals. In contrast to the unstructured
dictionaries, however, the dictionaries learned by the proposed algorithm
feature localized atoms and can be implemented in a computationally efficient
manner in signal processing tasks such as compression, denoising, and
classification.
","[{""version"":""v1"",""created"":""Sun, 5 Jan 2014 12:17:51 GMT""}]","2015-06-18"
"1401.0888","Francesco Nitti","Elias Kiritsis, Wenliang Li and Francesco Nitti","Holographic RG flow and the Quantum Effective Action","85 pages, 6 figures. v2: three subsections and one appendix added
  with a more detailed discussion of local RG transformations, RG invariance of
  the renormalized action, trace identities and scheme dependence; discussion
  added about the distinction between RG-invariant and RG scale-dependent
  operators; details added in sections 6 and 7; typos corrected, references
  added","Fortschr. Phys. 62, No. 5-6, 389-454 (2014)","10.1002/prop.201400007",,"hep-th","http://arxiv.org/licenses/nonexclusive-distrib/1.0/","  The calculation of the full (renormalized) holographic action is undertaken
in general Einstein-scalar theories. The appropriate formalism is developed and
the renormalized effective action is calculated up to two derivatives in the
metric and scalar operators. The holographic RG equations involve Ricci flow
for the space-time metric as well as the standard $\beta$-function flow for
scalar operators. Several examples are analyzed and the effective action is
calculated. A set of conserved quantities of the holographic flow is found,
whose interpretation is not yet understood.
","[{""version"":""v1"",""created"":""Sun, 5 Jan 2014 12:37:32 GMT""},{""version"":""v2"",""created"":""Fri, 31 Jan 2014 16:01:53 GMT""}]","2014-06-26"
"1401.0889","Yue Guo","Yue Guo, Xuelian Shen, Zhanfeng Zhu","Research on the mobile robots intelligent path planning based on ant
  colony algorithm application in manufacturing logistics","17 pages,7 figures",,,,"cs.RO","http://arxiv.org/licenses/nonexclusive-distrib/1.0/","  With the development of robotics and artificial intelligence field
unceasingly thorough, path planning as an important field of robot calculation
has been widespread concern. This paper analyzes the current development of
robot and path planning algorithm and focuses on the advantages and
disadvantages of the traditional intelligent path planning as well as the path
planning. The problem of mobile robot path planning is studied by using ant
colony algorithm, and it also provides some solving methods.
","[{""version"":""v1"",""created"":""Sun, 5 Jan 2014 13:21:59 GMT""},{""version"":""v2"",""created"":""Tue, 7 Jan 2014 12:44:35 GMT""}]","2014-01-08"
"1401.0890","Ankan Das","Liton Majumdar, Ankan Das, Sandip K. Chakrabarti","Formation of different isotopomers of chloronium in the interstellar
  medium","14 pages, 7 figures, accepted for publication in ApJ",,"10.1088/0004-637X/782/2/73",,"astro-ph.SR astro-ph.GA","http://arxiv.org/licenses/nonexclusive-distrib/1.0/","  Main focus of this paper is to explore the possibility of findings two
deuterated isotopomers of H2Cl+ (Chloronium) in and around the Interstellar
Medium (ISM). Presence of Chloronium ion has recently been confirmed by
Herschel Space Observatory's Heterodyne Instrument for the Far-Infrared
(Neufeld et al., 2012). It observed para-chloronium towards six sources in the
Galaxy. Existence of its deuterated isotopomers (HDCl+ & D2Cl+) are till date
not discussed in the literature. We find that these deuterated gas phase ions
could be destroyed by various ion-molecular reactions, dissociative
recombination (DR) and by cosmic rays (CR). We compute all the Ion-molecular
(polar) reaction rates by using the parameterized trajectory theory and the
Ion-molecular (non-polar) reaction rates by using the Langevin theory. For DR
and CR induced reactions, we adopt two well behaved rate formulas. We also
include these rate coefficients into our large gas-grain chemical network to
study the chemical evolution of these species around the outer edge of the cold
dense cloud. In order to study spectral properties of chloronium ion and its
two deuterated isotopomers, we have carried out quantum chemical simulations.
We calculated ground state properties of these species by employing second
order Moller-Plesset perturbation theory (MP2) along with quadruple-zeta
correlation consistent (aug-cc-pVQZ) basis set. Infrared and electronic
absorption spectra of these species are calculated by using the same level of
theory. MP2/aug-cc-pVQZ level of theory is used to report the different
spectroscopic constants of these gas phase species. These spectroscopic
constants are essential to predict rotational transitions of these species. Our
predicted column densities of D2Cl^+, HDCl^+ along with the spectral
information may enable their future identification around outer edges of cold
dark clouds.
","[{""version"":""v1"",""created"":""Sun, 5 Jan 2014 13:22:28 GMT""},{""version"":""v2"",""created"":""Fri, 10 Jan 2014 10:49:57 GMT""}]","2015-06-18"
"1401.0891","Praveen Chaddah","S. B. Roy and P. Chaddah","Phase-coexistence and glass-like behavior in magnetic and dielectric
  solids with long range order","Accepted version, to appear in PSS(b) Special Issue 'Ferroic Glasses'",,"10.1002/pssb.201451004",,"cond-mat.mtrl-sci cond-mat.str-el","http://arxiv.org/licenses/nonexclusive-distrib/1.0/","  Phase-coexistence in the manganese-oxide compounds or manganites with
colossal magneto-resistance (CMR) has been generally considered to be an
inhomogeneous ground state. An alternative explanation of phase-coexistence as
the manifestation of a disorder-broadened first order magnetic phase transition
being interrupted by the glasslike arrest of kinetics is now gradually gaining
ground. This kinetic arrest of a first order phase transitions, between two
states with long-range magnetic order, has actually been observed in various
other classes of magnetic materials in addition to the CMR manganites. The
underlying common features of this kinetic arrest of a first order phase
transition are discussed in terms of the phenomenology of glasses. The possible
manifestations of such glass-like arrested states across disorder-influenced
first order phase transitions in dielectric solids and in multiferroic
materials, are also discussed.
","[{""version"":""v1"",""created"":""Sun, 5 Jan 2014 13:51:07 GMT""},{""version"":""v2"",""created"":""Tue, 11 Mar 2014 09:50:31 GMT""}]","2015-06-18"
"1401.0892","Nir Weinberger","Nir Weinberger and Neri Merhav","Optimum Trade-offs Between the Error Exponent and the Excess-Rate
  Exponent of Variable-Rate Slepian-Wolf Coding","Extended version of paper submitted to the IEEE Trans. on Information
  Theory. Presented in part in ISIT2014",,,,"cs.IT math.IT","http://arxiv.org/licenses/nonexclusive-distrib/1.0/","  We analyze the optimal trade-off between the error exponent and the
excess-rate exponent for variable-rate Slepian-Wolf codes. In particular, we
first derive upper (converse) bounds on the optimal error and excess-rate
exponents, and then lower (achievable) bounds, via a simple class of
variable-rate codes which assign the same rate to all source blocks of the same
type class. Then, using the exponent bounds, we derive bounds on the optimal
rate functions, namely, the minimal rate assigned to each type class, needed in
order to achieve a given target error exponent. The resulting excess-rate
exponent is then evaluated. Iterative algorithms are provided for the
computation of both bounds on the optimal rate functions and their excess-rate
exponents. The resulting Slepian-Wolf codes bridge between the two extremes of
fixed-rate coding, which has minimal error exponent and maximal excess-rate
exponent, and average-rate coding, which has maximal error exponent and minimal
excess-rate exponent.
","[{""version"":""v1"",""created"":""Sun, 5 Jan 2014 14:03:37 GMT""},{""version"":""v2"",""created"":""Wed, 5 Nov 2014 19:27:42 GMT""},{""version"":""v3"",""created"":""Thu, 6 Nov 2014 17:44:10 GMT""}]","2014-11-07"
"1401.0893","Suyoung Choi","Suyoung Choi, Mikiya Masuda, Satoshi Murai","Invariance of Pontrjagin classes for Bott manifolds",,"Algebr. Geom. Topol. 15 (2015) 965-986","10.2140/agt.2015.15.965",,"math.AT","http://arxiv.org/licenses/nonexclusive-distrib/1.0/","  A Bott manifold is the total space of some iterated $\mathbb C P^1$-bundle
over a point. We prove that any graded ring isomorphism between the cohomology
rings of two Bott manifolds preserves their Pontrjagin classes. Moreover, we
prove that such an isomorphism is induced from a diffeomorphism if the Bott
manifolds are $\mathbb Z/2$-trivial, where a Bott manifold is called $\mathbb
Z/2$-trivial if its cohomology ring with $\mathbb Z/2$-coefficient is
isomorphic to that of a product of $\mathbb C P^1$'s.
","[{""version"":""v1"",""created"":""Sun, 5 Jan 2014 14:08:05 GMT""}]","2015-05-27"
"1401.0894","Tao Zhou","Tao Zhou, Akil Narayan and Zhiqiang Xu","Multivariate discrete least-squares approximations with a new type of
  collocation grid",,,,,"math.NA","http://arxiv.org/licenses/nonexclusive-distrib/1.0/","  In this work, we discuss the problem of approximating a multivariate function
by discrete least squares projection onto a polynomial space using a specially
designed deterministic point set. The independent variables of the function are
assumed to be random variables, stemming from the motivating application of
Uncertainty Quantification (UQ).
  Our deterministic points are inspired by a theorem due to Andr\'e Weil. We
first work with the Chebyshev measure and consider the approximation in
Chebyshev polynomial spaces. We prove the stability and an optimal convergence
estimate, provided the number of points scales quadratically with the dimension
of the polynomial space. A possible application for quantifying
\textit{epistemic} uncertainties is then discussed. We show that the point set
asymptotically equidistributes to the product-Chebyshev measure, allowing us to
propose a weighted least squares framework, and extending our method to more
general polynomial approximations. Numerical examples are given to confirm the
theoretical results. It is shown that the performance of our deterministic
points is similar to that of randomly-generated points. However our
construction, being deterministic, does not suffer from probabilistic
qualifiers on convergence results. (E.g., convergence ""with high probability"".)
","[{""version"":""v1"",""created"":""Sun, 5 Jan 2014 14:13:12 GMT""}]","2014-01-07"
"1401.0895","Behrouz Mirza","Behrouz Mirza, Fatemeh Oboudiat, Somayeh Zare","Dimension of quantum channel of radiation in pure Lovelock black holes","6 pages","Gen Relativ Gravit (2014) 46:1652","10.1007/s10714-013-1652-4",,"gr-qc","http://arxiv.org/licenses/nonexclusive-distrib/1.0/","  It is known that the emission rate of entropy from a Schwarzschild black hole
is exactly the same as that of a one dimensional quantum channel \cite{Beken}.
We calculate the dimension of entropy emission from a $D$ dimensional pure
Lovelock black holes. Our results indicate that the dimension of transmission
for odd $D$ dimensional space-times is equal to $D$ and for even $D$
dimensional space-times, the dimension of quantum channel becomes $1+\epsilon
(\Lambda)$, where $ \Lambda $ is cosmological constant. It is interesting that
cosmological constant may put some constraint on dimension of quantum channel
in even dimensional space-times. The effect of Generalized Uncertainty
Principle (GUP) on the dimension of transmission of entropy for a Schwarzschild
black hole is also investigated.
","[{""version"":""v1"",""created"":""Sun, 5 Jan 2014 14:20:10 GMT""}]","2014-06-10"
"1401.0896","Stephen Adler","Stephen L. Adler","Where is quantum theory headed?","6 pages",,"10.1088/1742-6596/504/1/012002",,"quant-ph gr-qc hep-th math-ph math.MP","http://arxiv.org/licenses/nonexclusive-distrib/1.0/","  Public talk at the EmQM13 conference opening event on ""The Future of Quantum
Mechanics""
","[{""version"":""v1"",""created"":""Sun, 5 Jan 2014 14:30:09 GMT""}]","2015-06-18"
"1401.0897","Daniel Hexner","Daniel Hexner and Dov Levine","Self Organization and Self Avoiding Limit Cycles",,"EPL 109 30004 (2015)","10.1209/0295-5075/109/30004",,"cond-mat.stat-mech","http://arxiv.org/licenses/nonexclusive-distrib/1.0/","  A simple periodically driven system displaying rich behavior is introduced
and studied. The system self-organizes into a mosaic of static ordered regions
with three possible patterns, which are threaded by one-dimensional paths on
which a small number of mobile particles travel. These trajectories are
self-avoiding and non-intersecting, and their relationship to self-avoiding
random walks is explored. Near $\rho=0.5$ the distribution of path lengths
becomes power-law like up to some cutoff length, suggesting a possible critical
state.
","[{""version"":""v1"",""created"":""Sun, 5 Jan 2014 14:50:20 GMT""}]","2015-03-24"
"1401.0898","Vijendra Singh","Vijendra Singh and Shivani Pathak","Feature Selection Using Classifier in High Dimensional Data",,,,,"cs.CV cs.LG stat.ML","http://arxiv.org/licenses/nonexclusive-distrib/1.0/","  Feature selection is frequently used as a pre-processing step to machine
learning. It is a process of choosing a subset of original features so that the
feature space is optimally reduced according to a certain evaluation criterion.
The central objective of this paper is to reduce the dimension of the data by
finding a small set of important features which can give good classification
performance. We have applied filter and wrapper approach with different
classifiers QDA and LDA respectively. A widely-used filter method is used for
bioinformatics data i.e. a univariate criterion separately on each feature,
assuming that there is no interaction between features and then applied
Sequential Feature Selection method. Experimental results show that filter
approach gives better performance in respect of Misclassification Error Rate.
","[{""version"":""v1"",""created"":""Sun, 5 Jan 2014 14:52:27 GMT""}]","2014-01-07"
"1401.0899","Fulin Zhang","Li-Fang Xu and Fu-Lin Zhang and Mai-Lin Liang and Jing-Ling Chen","Assisted optimal state discrimination without entanglement","6 pages, 3 figures. Accepted by EPL. We extended the protocol for
  assisted optimal state discrimination to the case with positive real
  overlaps, and presented a proof for the absence of entanglement","EPL, 106 (2014) 50004","10.1209/0295-5075/106/50004",,"quant-ph","http://arxiv.org/licenses/nonexclusive-distrib/1.0/","  A fundamental problem in quantum information is to explore the roles of
different quantum correlations in a quantum information procedure. Recent work
[Phys. Rev. Lett., 107 (2011) 080401] shows that the protocol for assisted
optimal state discrimination (AOSD) may be implemented successfully without
entanglement, but with another correlation, quantum dissonance. However, both
the original work and the extension to discrimination of $d$ states [Phys. Rev.
A, 85 (2012) 022328] have only proved that entanglement can be absent in the
case with equal a \emph{priori} probabilities. By improving the protocol in
[Sci. Rep., 3 (2013) 2134], we investigate this topic in a simple case to
discriminate three nonorthogonal states of a qutrit, with positive real
overlaps. In our procedure, the entanglement between the qutrit and an
auxiliary qubit is found to be completely unnecessary. This result shows that
the quantum dissonance may play as a key role in optimal state discrimination
assisted by a qubit for more general cases.
","[{""version"":""v1"",""created"":""Sun, 5 Jan 2014 14:53:26 GMT""},{""version"":""v2"",""created"":""Sat, 17 May 2014 01:20:20 GMT""},{""version"":""v3"",""created"":""Sat, 28 Jun 2014 16:32:38 GMT""}]","2014-07-01"
"1401.0900","Dan Jonsson","Dan Jonsson","Interpretations and Representations of Classical Tensors","39 pages",,,,"math.HO","http://arxiv.org/licenses/nonexclusive-distrib/1.0/","  Classical tensors, the familiar mathematical objects denoted by symbols such
as $t_{i}$, $t^{ij}$ and $t_{k}^{ij}$, are usually interpreted either as
'coordinatizable objects' with coordinates changing in a specific way under a
change of coordinate system or as elements of tensor spaces of the form
$V^{\otimes n}\otimes\left(V^{*}\right)^{\otimes m}$. An alternative
interpretation of classical tensors as linear tensor maps of the form
$V^{\otimes m}\rightarrow V^{\otimes n}$ is presented here. In this
interpretation, tensor multiplication is seen as generalized function
composition. Representations of classical tensors by means of arrays are also
considered.
","[{""version"":""v1"",""created"":""Sun, 5 Jan 2014 15:03:46 GMT""}]","2014-01-07"
"1401.0901","Ihyeok Seo","Ihyeok Seo","From resolvent estimates to unique continuation for the Schr\""odinger
  equation","To appear in Trans. Amer. Math. Soc., 31 pages",,,,"math.AP math.SP","http://arxiv.org/licenses/nonexclusive-distrib/1.0/","  In this paper we develop an abstract method to handle the problem of unique
continuation for the Schr\""odinger equation $(i\partial_t+\Delta)u=V(x)u$. In
general the problem is to find a class of potentials $V$ which allows the
unique continuation. The key point of our work is to make a direct link between
the problem and the weighted $L^2$ resolvent estimates
$\|(-\Delta-z)^{-1}f\|_{L^2(|V|)}\leq C\|f\|_{L^2(|V|^{-1})}$. We carry out it
in an abstract way, and thereby we do not need to deal with each of the
potential classes. To do so, we will make use of limiting absorption principle
and Kato $H$-smoothing theorem in spectral theory, and employ some tools from
harmonic analysis. Once the resolvent estimate is set up for a potential class,
from our abstract theory the unique continuation would follow from the same
potential class. Also, it turns out that there can be no dented surface on the
boundary of the maximal open zero set of the solution $u$. In this regard,
another main issue for us is to know which class of potentials allows the
resolvent estimate. We establish such a new class which contains previously
known ones, and will also apply it to the problem of well-posedness for the
equation.
","[{""version"":""v1"",""created"":""Sun, 5 Jan 2014 15:03:56 GMT""},{""version"":""v2"",""created"":""Wed, 23 Apr 2014 05:49:14 GMT""},{""version"":""v3"",""created"":""Wed, 11 Jun 2014 12:47:50 GMT""},{""version"":""v4"",""created"":""Wed, 3 Sep 2014 09:42:16 GMT""},{""version"":""v5"",""created"":""Mon, 22 Dec 2014 05:59:12 GMT""},{""version"":""v6"",""created"":""Wed, 24 Dec 2014 04:50:12 GMT""}]","2014-12-25"
"1401.0902","Marco Polini","A. Gamucci, D. Spirito, M. Carrega, B. Karmakar, A. Lombardo, M.
  Bruna, A. C. Ferrari, L. N. Pfeiffer, K. W. West, Marco Polini, V. Pellegrini","Electron-hole pairing in graphene-GaAs heterostructures","9 pages, 9 figures, 72 references","Nature Commun. 5, 5824 (2014)","10.1038/ncomms6824",,"cond-mat.mes-hall","http://arxiv.org/licenses/nonexclusive-distrib/1.0/","  Vertical heterostructures combining different layered materials offer novel
opportunities for applications and fundamental studies of collective behavior
driven by inter-layer Coulomb coupling. Here we report heterostructures
comprising a single-layer (or bilayer) graphene carrying a fluid of massless
(massive) chiral carriers, and a quantum well created in GaAs 31.5 nm below the
surface, supporting a high-mobility two-dimensional electron gas. These are a
new class of double-layer devices composed of spatially-separated electron and
hole fluids. We find that the Coulomb drag resistivity significantly increases
for temperatures below 5-10 K, following a logarithmic law. This anomalous
behavior is a signature of the onset of strong inter-layer correlations,
compatible with the formation of a condensate of permanent excitons. The
ability to induce strongly-correlated electron-hole states paves the way for
the realization of coherent circuits with minimal dissipation and nanodevices
including analog-to-digital converters and topologically protected quantum
bits.
","[{""version"":""v1"",""created"":""Sun, 5 Jan 2014 15:19:05 GMT""}]","2015-01-09"
