"1401.0846","Mario Edmundo","Mario J. Edmundo, Luca Prelli","The six Grothendieck operations on o-minimal sheaves","arXiv admin note: text overlap with arXiv:1205.6124",,,,"math.AG","http://arxiv.org/licenses/nonexclusive-distrib/1.0/","  In this paper we develop the formalism of the Grothendieck six operations on
o-minimal sheaves. The Grothendieck formalism allows us to obtain o-minimal
versions of: (i) derived projection formula; (ii) universal coefficient
formula; (iii) derived base change formula; (iv) K\""unneth formula; (v) local
and global Verdier duality.
","[{""version"":""v1"",""created"":""Sat, 4 Jan 2014 21:53:54 GMT""},{""version"":""v2"",""created"":""Tue, 22 Jul 2014 14:26:39 GMT""},{""version"":""v3"",""created"":""Tue, 31 Jul 2018 15:50:34 GMT""}]","2018-08-01"
"1401.0847","Thomas Ayres","Thomas R. Ayres","The Ups and Downs of Alpha Centauri","30 pages, 6 figures, accepted by AJ",,"10.1088/0004-6256/147/3/59",,"astro-ph.SR","http://arxiv.org/licenses/nonexclusive-distrib/1.0/","  The following is a progress report on the long-term coronal activity of Alpha
Centauri A (HD128620: G2V) and B (HD128621: K1V). Since 2005, Chandra X-ray
Observatory has carried out semiannual pointings on AB, mainly with the High
Resolution Camera (HRC-I), but also on two occasions with the Low-Energy
Transmission Grating Spectrometer (LETGS), fully resolving the close pair in
all cases. During 2008-2013, Chandra captured the rise, peak, and initial
decline of B's coronal luminosity. Together with previous high states
documented by ROSAT and XMM-Newton, the long-term X-ray record suggests a
period of 8.2+/-0.2 yr, compared to 11 yr for the Sun; with a minimum-to-peak
contrast of 4.5, about half the typical solar cycle amplitude. Meanwhile, the A
component has been mired in a Maunder-Minimum-like low state since 2005,
initially recognized by XMM. But now, A finally appears to be climbing out of
the extended lull. If interpreted simply as an over-long cycle, the period
would be 19.1+/-0.7 yr, with a minimum-to-peak contrast of 3.4. The short X-ray
cycle of B, and possibly long cycle of A, are not unusual compared with the
diverse (albeit much lower amplitude) chromospheric variations recorded, for
example, by the HK Project. Further, the deep low state of A also is not
unusual, but instead is similar to the Sun during recent minima of the sunspot
cycle.
","[{""version"":""v1"",""created"":""Sat, 4 Jan 2014 22:20:08 GMT""}]","2015-06-18"
"1401.0848","M Zahid Hasan","M. Zahid Hasan, Su-Yang Xu, David Hsieh, L. Andrew Wray, and Yuqi Xia","Experimental Discovery of Topological Surface States - A New Type of 2D
  Electron Systems (Review Article)","18 Figures, 23 pages; Invited Review, Accepted for publication,
  Related papers at http://arxiv.org/abs/1105.0396 and
  http://scholar.google.com/citations?user=G1Qpy6MAAAAJ&hl=en",,,,"cond-mat.mes-hall cond-mat.str-el","http://arxiv.org/licenses/nonexclusive-distrib/1.0/","  Topological Surface States (TSS) represent new types of two dimensional
electron systems with novel and unprecedented properties distinct from any
quantum Hall-like or spin-Hall effects. Their Z$_2$ topological order can be
realized at room temperatures without magnetic fields and they can be turned
into magnets, exotic superconductors or Kondo insulators leading to worldwide
interest and activity in the topic. We review the basic concepts defining such
topological matter and the experimental discovery via the key experimental
probe that revealed the Z$_2$ topological order in the bulk of these spin-orbit
interaction dominated insulators for the first time. This review focuses on the
key results that demonstrated the fundamental Z$_2$ topological properties such
as spin-momentum locking, non-trivial Berry's phases, mirror Chern number,
absence of backscattering, bulk-boundary correspondence (topology), protection
by time-reversal and other discrete (mirror) symmetries and their remarkable
persistence up to the room temperature elaborating on results first briefly
discussed in an early review by M.Z. Hasan and C.L. Kane [Rev. of Mod. Phys.,
82, 3045 (2010)]. Additionally, key results on broken symmetry phases such as
quantum magnetism and superconductivity induced in topological materials are
briefly discussed. Topological insulators beyond the Z$_2$ classification such
as Topological Crystalline Insulators (TCI) are discussed based on their spin
properties (mirror Chern invariants). The experimental methodologies detailed
here have been used in most of the subsequent studies of Z$_2$ topological
physics in almost all bulk topological insulator materials to this date.
","[{""version"":""v1"",""created"":""Sat, 4 Jan 2014 22:25:37 GMT""}]","2014-01-07"
"1401.0849","Alexander Luzgarev","Alexander Luzgarev","Equations determining the orbit of the highest weight vector in the
  adjoint representation","13 pages",,,,"math.AG math.GR","http://arxiv.org/licenses/nonexclusive-distrib/1.0/","  We explicitly construct a set of quadratic equations defining the highest
weight vector orbit for adjoint representations of Chevalley groups of types
D_l, E_6, E_7, and E_8. The combinatorics of these equations is related to the
combinatorics of embeddings of the root system of type A_3. We believe that the
constructed equations provide a prominent framework for calculations with
exceptional groups in adjoint representations, which is particularly
interesting for groups of type E_8.
","[{""version"":""v1"",""created"":""Sat, 4 Jan 2014 22:59:00 GMT""}]","2014-01-07"
"1401.0850","Bart{\l}omiej Siudeja","R. S. Laugesen and B. A. Siudeja","Magnetic spectral bounds on starlike plane domains",,,,,"math-ph math.MP","http://arxiv.org/licenses/nonexclusive-distrib/1.0/","  We develop sharp upper bounds for energy levels of the magnetic Laplacian on
starlike plane domains, under either Dirichlet or Neumann boundary conditions
and assuming a constant magnetic field in the transverse direction. Our main
result says that $\sum_{j=1}^n \Phi \big( \lambda_j A/G \big)$ is maximal for a
disk whenever $\Phi$ is concave increasing, $n \geq 1$, the domain has area
$A$, and $\lambda_j$ is the $j$-th Dirichlet eigenvalue of the magnetic
Laplacian $\big( i\nabla+ \frac{\beta}{2A}(-x_2,x_1) \big)^2$. Here the flux
$\beta$ is constant, and the scale invariant factor $G$ penalizes deviations
from roundness, meaning $G \geq 1$ for all domains and $G=1$ for disks.
","[{""version"":""v1"",""created"":""Sat, 4 Jan 2014 23:14:07 GMT""}]","2014-01-07"
"1401.0851","Kathrin Smetana","Kathrin Smetana and Mario Ohlberger","Hierarchical model reduction of nonlinear partial differential equations
  based on the adaptive empirical projection method and reduced basis
  techniques",,"M2AN Math. Model. Numer. Anal., Volume 51, Number 2, page 641--677
  (2017)","10.1051/m2an/2016031",,"math.NA","http://arxiv.org/licenses/nonexclusive-distrib/1.0/","  In this paper we extend the hierarchical model reduction framework based on
reduced basis techniques for the application to nonlinear partial differential
equations. The major new ingredient to accomplish this goal is the introduction
of the adaptive empirical projection method, which is an adaptive integration
algorithm based on the (generalized) empirical interpolation method. Different
from other partitioning concepts for the empirical interpolation method we
perform an adaptive decomposition of the spatial domain. We project both the
variational formulation and the range of the nonlinear operator onto reduced
spaces. Those reduced spaces combine the full dimensional (finite element)
space in an identified dominant spatial direction and a reduction space or
collateral basis space spanned by modal orthonormal basis functions in the
transverse direction. Both the reduction and the collateral basis space are
constructed in a highly nonlinear fashion by introducing a parametrized problem
in the transverse direction and associated parametrized operator evaluations,
and by applying reduced basis methods to select the bases from the
corresponding snapshots. Rigorous a priori and a posteriori error estimators,
which do not require additional regularity of the nonlinear operator are proven
for the adaptive empirical projection method and then used to derive a rigorous
a posteriori error estimator for the resulting hierarchical model reduction
approach. Numerical experiments for an elliptic nonlinear diffusion equation
demonstrate a fast convergence of the proposed dimensionally reduced
approximation to the solution of the full-dimensional problem. Runtime
experiments verify a close to linear scaling of the reduction method in the
number of degrees of freedom used for the computations in the dominant
direction.
","[{""version"":""v1"",""created"":""Sat, 4 Jan 2014 23:17:31 GMT""},{""version"":""v2"",""created"":""Sat, 20 Dec 2014 00:36:39 GMT""},{""version"":""v3"",""created"":""Tue, 12 Jan 2016 18:59:46 GMT""}]","2017-02-27"
"1401.0852","Qing Zhou","Bryon Aragam and Qing Zhou","Concave Penalized Estimation of Sparse Gaussian Bayesian Networks","57 pages","Journal of Machine Learning Research 16(Nov):2273-2328, 2015",,,"stat.ME cs.LG stat.ML","http://arxiv.org/licenses/nonexclusive-distrib/1.0/","  We develop a penalized likelihood estimation framework to estimate the
structure of Gaussian Bayesian networks from observational data. In contrast to
recent methods which accelerate the learning problem by restricting the search
space, our main contribution is a fast algorithm for score-based structure
learning which does not restrict the search space in any way and works on
high-dimensional datasets with thousands of variables. Our use of concave
regularization, as opposed to the more popular $\ell_0$ (e.g. BIC) penalty, is
new. Moreover, we provide theoretical guarantees which generalize existing
asymptotic results when the underlying distribution is Gaussian. Most notably,
our framework does not require the existence of a so-called faithful DAG
representation, and as a result the theory must handle the inherent
nonidentifiability of the estimation problem in a novel way. Finally, as a
matter of independent interest, we provide a comprehensive comparison of our
approach to several standard structure learning methods using open-source
packages developed for the R language. Based on these experiments, we show that
our algorithm is significantly faster than other competing methods while
obtaining higher sensitivity with comparable false discovery rates for
high-dimensional data. In particular, the total runtime for our method to
generate a solution path of 20 estimates for DAGs with 8000 nodes is around one
hour.
","[{""version"":""v1"",""created"":""Sat, 4 Jan 2014 23:27:48 GMT""},{""version"":""v2"",""created"":""Sun, 4 Jan 2015 23:34:01 GMT""}]","2015-12-24"
"1401.0853","Nariyuki Minami","Nariyuki Minami","Definition and Self-Adjointness of the Stochastic Airy Operator","12 pages",,,,"math.PR","http://arxiv.org/licenses/nonexclusive-distrib/1.0/","  In this note, it is shown that the stochastic Airy operator, which is the
""Schr\""odinger operator"" on the half-line whose potential term consists of
Gaussian white noise plus a linear term tending to $+\infty$, can naturally be
defined as a generalized Sturm-Liouville operator and that it is self-adjoint
and has purely discrete spectrum with probability one. Thus ""stochastic Airy
spectrum"" of Ram\'irez, Rider and Vir\'ag is the spectrum of an operator in the
ordinary sense of the word.
","[{""version"":""v1"",""created"":""Sat, 4 Jan 2014 23:47:53 GMT""},{""version"":""v2"",""created"":""Thu, 13 Feb 2014 05:25:43 GMT""}]","2014-02-14"
"1401.0854","Armin Straub","Armin Straub","Multivariate Ap\'ery numbers and supercongruences of rational functions","19 pages","Algebra Number Theory 8 (2014) 1985-2008","10.2140/ant.2014.8.1985",,"math.NT math.CO","http://arxiv.org/licenses/nonexclusive-distrib/1.0/","  One of the many remarkable properties of the Ap\'ery numbers $A (n)$,
introduced in Ap\'ery's proof of the irrationality of $\zeta (3)$, is that they
satisfy the two-term supercongruences \begin{equation*}
  A (p^r m) \equiv A (p^{r - 1} m) \pmod{p^{3 r}} \end{equation*} for primes $p
\geq 5$. Similar congruences are conjectured to hold for all Ap\'ery-like
sequences. We provide a fresh perspective on the supercongruences satisfied by
the Ap\'ery numbers by showing that they extend to all Taylor coefficients $A
(n_1, n_2, n_3, n_4)$ of the rational function \begin{equation*}
  \frac{1}{(1 - x_1 - x_2) (1 - x_3 - x_4) - x_1 x_2 x_3 x_4} . \end{equation*}
The Ap\'ery numbers are the diagonal coefficients of this function, which is
simpler than previously known rational functions with this property.
  Our main result offers analogous results for an infinite family of sequences,
indexed by partitions $\lambda$, which also includes the Franel and
Yang--Zudilin numbers as well as the Ap\'ery numbers corresponding to $\zeta
(2)$. Using the example of the Almkvist--Zudilin numbers, we further indicate
evidence of multivariate supercongruences for other Ap\'ery-like sequences.
","[{""version"":""v1"",""created"":""Sun, 5 Jan 2014 00:21:36 GMT""},{""version"":""v2"",""created"":""Thu, 23 Oct 2014 14:56:13 GMT""}]","2016-01-20"
"1401.0855","Jie Xu","Jie Xu, Yiannis Andrepoulos, Yuanzhang Xiao, Mihaela van der Schaar","Non-stationary Resource Allocation Policies for Delay-constrained Video
  Streaming: Application to Video over Internet-of-Things-enabled Networks",,,,,"cs.NI cs.MM","http://arxiv.org/licenses/nonexclusive-distrib/1.0/","  Due to the high bandwidth requirements and stringent delay constraints of
multi-user wireless video transmission applications, ensuring that all video
senders have sufficient transmission opportunities to use before their delay
deadlines expire is a longstanding research problem. We propose a novel
solution that addresses this problem without assuming detailed packet-level
knowledge, which is unavailable at resource allocation time. Instead, we
translate the transmission delay deadlines of each sender's video packets into
a monotonically-decreasing weight distribution within the considered time
horizon. Higher weights are assigned to the slots that have higher probability
for deadline-abiding delivery. Given the sets of weights of the senders' video
streams, we propose the low-complexity Delay-Aware Resource Allocation (DARA)
approach to compute the optimal slot allocation policy that maximizes the
deadline-abiding delivery of all senders. A unique characteristic of the DARA
approach is that it yields a non-stationary slot allocation policy that depends
on the allocation of previous slots. We prove that the DARA approach is optimal
for weight distributions that are exponentially decreasing in time. We further
implement our framework for real-time video streaming in wireless personal area
networks that are gaining significant traction within the new
Internet-of-Things (IoT) paradigm. For multiple surveillance videos encoded
with H.264/AVC and streamed via the 6tisch framework that simulates the
IoT-oriented IEEE 802.15.4e TSCH medium access control, our solution is shown
to be the only one that ensures all video bitstreams are delivered with
acceptable quality in a deadline-abiding manner.
","[{""version"":""v1"",""created"":""Sun, 5 Jan 2014 00:49:22 GMT""}]","2014-01-07"
"1401.0856","Jiang Zhijin","Z. J. Jiang and H. L. Zhang","The pseudorapidity distributions of the produced charged particles in
  p-p collisions at center-of-mass energies from 23.6 to 900 GeV","9 pages, 1 figure",,"10.1142/S0217732314501302",,"nucl-th hep-ph","http://arxiv.org/licenses/nonexclusive-distrib/1.0/","  In p-p collisions, there are two leading particles. One is in projectile
fragmentation region. The other is in target fragmentation region. The
investigations of present paper show that, just like in nucleus-nucleus
collisions, the revised Landau hydrodynamic model alone is not enough to have a
good description to the measured pseudorapidity distributions of the produced
charged particles in p-p collisions. Only after the leading particles are taken
into account as well, can the experimental data be matched up properly. The
theoretical model works well in p-p collisions in the whole available energy
region from sqrt(s_NN) =23.6 to 900 GeV.
","[{""version"":""v1"",""created"":""Sun, 5 Jan 2014 00:50:03 GMT""}]","2015-06-18"
"1401.0857","Aleksander Ivanov","A.Ivanov","Metric ultraproducts of finite groups with respect to some length
  functions","16 pages",,,,"math.GR","http://arxiv.org/licenses/nonexclusive-distrib/1.0/","  We consider metric ultraproducts of finite groups with respect to some
classes of length functions. All sofic groups embed into these ultraproducts.
We study embeddings of normed groups. We also show that in some natural
situations such an ultraproduct is a simple group.
","[{""version"":""v1"",""created"":""Sun, 5 Jan 2014 01:27:27 GMT""}]","2014-01-07"
"1401.0858","Videh Seksaria","Videh Seksaria","Multimodal Optimization by Sparkling Squid Populations","19 pages, 4 figues",,,,"cs.NE","http://creativecommons.org/licenses/by-nc-sa/3.0/","  The swarm intelligence of animals is a natural paradigm to apply to
optimization problems. Ant colony, bee colony, firefly and bat algorithms are
amongst those that have been demonstrated to efficiently to optimize complex
constraints. This paper proposes the new Sparkling Squid Algorithm (SSA) for
multimodal optimization, inspired by the intelligent swarm behavior of its
namesake. After an introduction, formulation and discussion of its
implementation, it will be compared to other popular metaheuristics. Finally,
applications to well - known problems such as image registration and the
traveling salesperson problem will be discussed.
","[{""version"":""v1"",""created"":""Sun, 5 Jan 2014 01:37:45 GMT""}]","2014-01-07"
"1401.0859","Bogdan Wojtsekhowski","Bogdan Wojtsekhowski","Nucleon form factors program with SBS at JLAB","4 pages, 2 figures, prepared for the proceedings of PHIPSI13, table
  updated, references added, typo fixed",,"10.1142/S201019451460427X","JLAB-PHY-14-1, DOE/OR/23177-2924","nucl-ex","http://arxiv.org/licenses/nonexclusive-distrib/1.0/","  The physics of the nucleon form factors is a fundamental part of the
Jefferson Laboratory program. We review the achievements of the 6-GeV era and
the program with the 12- GeV beam with the SBS spectrometer in Hall A, with a
focus on the nucleon ground state properties.
","[{""version"":""v1"",""created"":""Sun, 5 Jan 2014 01:44:16 GMT""},{""version"":""v2"",""created"":""Mon, 27 Jan 2014 18:06:25 GMT""},{""version"":""v3"",""created"":""Mon, 17 Mar 2014 00:41:44 GMT""}]","2015-06-18"
"1401.0860","Xingxiao Li","Xingxiao Li","A new characterization of Calabi composition of hyperbolic affine
  hyperspheres","arXiv admin note: substantial text overlap with arXiv:1303.4278,
  arXiv:1310.5066",,,,"math.DG","http://arxiv.org/licenses/nonexclusive-distrib/1.0/","  In this paper, we mainly prove a theorem with a corollary establishing two
characterizations of the Calabi composition of hyperbolic hyperspheres, where
the second characterization (i.e., the corollary) has been given via a dual
correspondence theorem earlier but now we would like to use a very direct
method. Note that Z.J. Hu, H.Z. Li and L. Vrancken also gave a characterization
of the $2$-factor Calabi composition in a different manner.
","[{""version"":""v1"",""created"":""Sun, 5 Jan 2014 01:49:36 GMT""}]","2014-01-07"
"1401.0861","Jaret Heise","J. Heise","The Sanford Underground Research Facility at Homestake","14 pages, 10 figures, Proceedings of the VII International Conference
  on Interconnections between Particle Physics and Cosmology (PPC2013),
  Deadwood, SD, July 8-13, 2013","AIP Conf. Proc. 1604 331-344 (2014)","10.1063/1.4883449",,"physics.ins-det hep-ex","http://arxiv.org/licenses/nonexclusive-distrib/1.0/","  The former Homestake gold mine in Lead, South Dakota is being transformed
into a dedicated laboratory to pursue underground research in rare-process
physics, as well as offering research opportunities in other disciplines such
as biology, geology and engineering. A key component of the Sanford Underground
Research Facility (SURF) is the Davis Campus, which is in operation at the
4850-foot level (4300 m.w.e) and currently hosts three projects: the LUX dark
matter experiment, the MAJORANA DEMONSTRATOR neutrinoless double-beta decay
experiment and the CUBED low-background counter. Plans for possible future
experiments at SURF are well underway and include long baseline neutrino
oscillation experiments, future dark matter experiments as well as nuclear
astrophysics accelerators. Facility upgrades to accommodate some of these
future projects have already started. SURF is a dedicated facility with
significant expansion capability.
","[{""version"":""v1"",""created"":""Sun, 5 Jan 2014 02:20:11 GMT""}]","2015-06-18"
"1401.0862","Ole Christensen","Ole Christensen, Hong Oh Kim, Rae Young Kim","On extensions of wavelet systems to dual pairs of frames",,,,,"math.FA","http://arxiv.org/licenses/nonexclusive-distrib/1.0/","  It is an open problem whether any pair of Bessel sequences with wavelet
structure can be extended to a pair of dual frames by adding a pair of singly
generated wavelet systems. We consider the particular case where the given
wavelet systems are generated by the multiscale setup with trigonometric masks
and provide a positive answer under extra assumptions. We also identify a
number of conditions that are necessary for the extension to dual multiscale
wavelet frames with any number of generators, and show that they imply that an
extension with two pairs of wavelet systems is possible. Along the way we
provide examples showing that extensions to dual frame pairs are attractive
because they often allow better properties than the more popular extensions to
tight frames.
","[{""version"":""v1"",""created"":""Sun, 5 Jan 2014 03:23:25 GMT""}]","2014-01-07"
"1401.0863","Luis Granda","L. N. Granda","Power-law expansion and Higgs-type potential in a scalar-tensor model","16 pages, 1 figure; accepted in EPL",,"10.1209/0295-5075/105/19001",,"hep-th gr-qc","http://arxiv.org/licenses/nonexclusive-distrib/1.0/","  In the scalar-tensor model with Gauss-Bonnet and kinetic couplings, the
power-law dark energy solution may be described by Higgs-type potential. It was
found that in the solution describing early time epoch of matter dominance, the
potential presents symmetry breaking phase, and the power law solution leading
to accelerated expansion corresponds to Higgs-type potential in its symmetric
shape.
","[{""version"":""v1"",""created"":""Sun, 5 Jan 2014 03:25:55 GMT""}]","2015-06-18"
"1401.0864","Maryam Khademi","Mingming Fan, Maryam Khademi","Predicting a Business Star in Yelp from Its Reviews Text Alone","5 pages, 6 figures, 2 tables",,,,"cs.IR","http://arxiv.org/licenses/nonexclusive-distrib/1.0/","  Yelp online reviews are invaluable source of information for users to choose
where to visit or what to eat among numerous available options. But due to
overwhelming number of reviews, it is almost impossible for users to go through
all reviews and find the information they are looking for. To provide a
business overview, one solution is to give the business a 1-5 star(s). This
rating can be subjective and biased toward users personality. In this paper, we
predict a business rating based on user-generated reviews texts alone. This not
only provides an overview of plentiful long review texts but also cancels out
subjectivity. Selecting the restaurant category from Yelp Dataset Challenge, we
use a combination of three feature generation methods as well as four machine
learning models to find the best prediction result. Our approach is to create
bag of words from the top frequent words in all raw text reviews, or top
frequent words/adjectives from results of Part-of-Speech analysis. Our results
show Root Mean Square Error (RMSE) of 0.6 for the combination of Linear
Regression with either of the top frequent words from raw data or top frequent
adjectives after Part-of-Speech (POS).
","[{""version"":""v1"",""created"":""Sun, 5 Jan 2014 03:29:05 GMT""}]","2014-01-07"
"1401.0865","Xiaoping Zheng","Xiao-Ping Zheng, Xia Zhou, Shu-Hua Yang","Novel Non-equilibrium Phase Transition Caused by Non-linear
  Hadronic-quark Phase Structure","18pages,3figures;to be accepted for publication in Physics Letters B","Physics Letters B729,2014,79-84","10.1016/j.physletb.2014.01.004",,"hep-ph astro-ph.HE nucl-th","http://arxiv.org/licenses/nonexclusive-distrib/1.0/","  We consider how the occurrence of first-order phase transitions in
non-constant pressure differs from those at constant pressure. The former has
shown the non-linear phase structure of mixed matter, which implies a particle
number dependence of the binding energies of the two species. If the mixed
matter is mixed hadron-quark phase, nucleon outgoing from hadronic phase and
ingoing to quark phase probably reduces the system to a non-equilibrium state,
in other words, there exists the imbalance of the two phases when deconfinement
takes place. This novel non-equilibrium process is very analogous to the
nuclear reactions that nuclei emit neutrons and absorb them under appropriate
conditions. We present self-consistent thermodynamics in description for the
processes and identify the microphysics responsible for the processes. The
microphysics is an inevitable consequence of non-linear phase structure instead
of the effect of an additional dissipation force. When applying our findings to
the neutron star containing mixed hadron-quark matter, it is found that the
newly discovered energy release might strongly change the thermal evolution
behavior of the star.
","[{""version"":""v1"",""created"":""Sun, 5 Jan 2014 03:45:25 GMT""}]","2015-06-18"
