"1401.2306","Ilya Sinayskiy (Sinaysky)","I. Sinayskiy, N. Pumulo and F. Petruccione","Nonequilibrium thermal entanglement for simple qubit systems","Proceedings of Quantum optics V conference, Cozumel, Mexico (2010)","Revista Mexicana de Fisica S 57(3) 128-132 (2011)",,,"quant-ph","http://arxiv.org/licenses/nonexclusive-distrib/1.0/","  The dynamics of simple qubit systems in a chain configuration coupled at both
ends to separate bosonic baths at different temperatures is studied. An exact
analytical solution of the master equation in the Born-Markov approximation for
the reduced density matrix of the qubit system is constructed. The unique
non-equilibrium stationary state for the long time behavior of the reduced
density matrix in obtained. Dynamical and steady state properties of the
concurrence between the first and the last spin are studied.
","[{""version"":""v1"",""created"":""Fri, 10 Jan 2014 12:26:35 GMT""}]","2014-01-13"
"1401.2307","Joseph Novak","Sergei M. Kuzenko and Joseph Novak","Supergravity-matter actions in three dimensions and Chern-Simons terms","64 pages; V3: published version","JHEP 1405 (2014) 093","10.1007/JHEP05(2014)093",,"hep-th","http://arxiv.org/licenses/nonexclusive-distrib/1.0/","  We study off-shell N-extended Yang-Mills multiplets coupled to conformal
supergravity in three spacetime dimensions. Superform formulations are
presented for the non-Abelian Chern-Simons actions in the cases N=1, 2, 3, and
the corresponding component actions are explicitly worked out. Such a
Chern-Simons action does not exist for N=4. In the latter case, a superform
formulation is given for the BF term that describes the coupling of two Abelian
vector multiplets with self-dual and anti-self-dual superfield strengths
respectively. The superform results obtained are used to construct linear
multiplet action principles in the cases N=2, 3, 4. The N=3 and N=4 actions are
demonstrated to be universal in the sense that all known off-shell
supergravity-matter systems (with the exception of pure conformal supergravity)
may be described using such an action. Starting from the N=3 and N=4 Abelian
vector multiplets, we also construct composite O(2) multiplets which are
analogues of the four-dimensional construction of an N=2 reduced chiral scalar
engineered from the improved tensor multiplet. Using these composites, we
present the superfield equations of motion for N=3 and N=4 anti-de Sitter and
topologically massive supergravity theories. We also sketch the construction of
a large family of higher derivative couplings for N=3 and N=4 vector
multiplets.
","[{""version"":""v1"",""created"":""Fri, 10 Jan 2014 12:28:59 GMT""},{""version"":""v2"",""created"":""Tue, 11 Feb 2014 07:44:25 GMT""},{""version"":""v3"",""created"":""Tue, 27 May 2014 04:38:22 GMT""}]","2014-05-28"
"1401.2308","Jeff Gill","Jeff Gill","Discussion of ""Estimating the historical and future probabilities of
  large terrorist events"" by Aaron Clauset and Ryan Woodard","Published in at http://dx.doi.org/10.1214/13-AOAS614D the Annals of
  Applied Statistics (http://www.imstat.org/aoas/) by the Institute of
  Mathematical Statistics (http://www.imstat.org)","Annals of Applied Statistics 2013, Vol. 7, No. 4, 1881-1887","10.1214/13-AOAS614D","IMS-AOAS-AOAS614D","stat.AP","http://arxiv.org/licenses/nonexclusive-distrib/1.0/","  Discussion of ""Estimating the historical and future probabilities of large
terrorist events"" by Aaron Clauset and Ryan Woodard [arXiv:1209.0089].
","[{""version"":""v1"",""created"":""Fri, 10 Jan 2014 12:29:21 GMT""}]","2014-01-13"
"1401.2309","Frederic Paik Schoenberg","Frederic Paik Schoenberg","Discussion of ""Estimating the historical and future probabilities of
  large terrorist events"" by Aaron Clauset and Ryan Woodard","Published in at http://dx.doi.org/10.1214/13-AOAS614E the Annals of
  Applied Statistics (http://www.imstat.org/aoas/) by the Institute of
  Mathematical Statistics (http://www.imstat.org)","Annals of Applied Statistics 2013, Vol. 7, No. 4, 1888-1890","10.1214/13-AOAS614E","IMS-AOAS-AOAS614E","stat.AP","http://arxiv.org/licenses/nonexclusive-distrib/1.0/","  Discussion of ""Estimating the historical and future probabilities of large
terrorist events"" by Aaron Clauset and Ryan Woodard [arXiv:1209.0089].
","[{""version"":""v1"",""created"":""Fri, 10 Jan 2014 12:32:44 GMT""}]","2014-01-13"
"1401.2310","Lilu Zhao","Lilu Zhao","The sum of divisors of a quadratic form","Accepted by Acta Arithmetica",,,,"math.NT","http://arxiv.org/licenses/nonexclusive-distrib/1.0/","  We study the sum of divisors of the quadratic form $m_1^2+m_2^2+m_3^2$. Let
$$S_3(X)=\sum_{1\le m_1,m_2,m_3\le X}\tau(m_1^2+m_2^2+m_3^2).$$ We obtain the
asymptotic formula $$S_3(X)=C_1X^3\log X+ C_2X^3+O(X^2\log^7 X),$$ where
$C_1,C_2$ are two constants. This improves upon the error term
$O_\varepsilon(X^{8/3+\varepsilon})$ obtained by Guo and Zhai.
","[{""version"":""v1"",""created"":""Fri, 10 Jan 2014 12:35:40 GMT""}]","2014-01-13"
"1401.2311","J\'er\^ome  Poineau","J\'er\^ome Poineau","Sur les composantes connexes d'une famille d'espaces analytiques
  p-adiques","18 pages, in French",,,,"math.NT","http://arxiv.org/licenses/nonexclusive-distrib/1.0/","  Let $X=\mathcal{M}(A)$ be an affinoid space and let $f,g \in A$. We study the
sets of connected components of the spaces defined by an inequality of the form
$|f|\le r|g|$, with $r\ge 0$. We prove that there exists a finite partition of
$\mathbb{R}_+$ into intervals where those sets are canonically in bijection and
that the bounds of those intervals belong to $\sqrt{\rho(A)}$.
","[{""version"":""v1"",""created"":""Fri, 10 Jan 2014 12:36:06 GMT""}]","2014-01-13"
"1401.2312","Judit Murak\""ozy","J. Murak\""ozy, A. Ludm\'any","Temporal Variations of Coriolis-turns in the Photosphere","7 pages, 3 figures","Central European Astrophysical Bulletin, Vol. 32, p. 133-139, 2008",,,"astro-ph.SR","http://arxiv.org/licenses/nonexclusive-distrib/1.0/","  Correlations have been studied between longitudinal and latitudinal shifts of
sunspot groups in the period 1986-1998. This study is based on the Debrecen
Photoheliographic Data (DPD). The latitudinal distribution of the correlation
values exhibits the expected Coriolis-pattern on the entire period:
negative/positive correlations in the northern/southern hemispheres, gradually
disappearing toward the equator. The yearly distributions, however, show an
interesting cycle dependence: after the unambiguous Coriolis patterns during
the growing phase of the cycle the latitudinal dependence of the correlations
gets ambiguous at the activity maximum. This may be related to the Gnevyshev
gap, the depression of the cycle time-profile at the maximum.
","[{""version"":""v1"",""created"":""Fri, 10 Jan 2014 12:42:38 GMT""}]","2014-01-13"
"1401.2313","Jesse Ratzkin","Stefan Juhnke and Jesse Ratzkin","A numerical investigation of level sets of extremal Sobolev functions","15 pages, 9 figures, submitted","Involve 8 (2015) 787-799","10.2140/involve.2015.8.787",,"math.NA math.AP","http://arxiv.org/licenses/nonexclusive-distrib/1.0/","  In this paper we investigate the level sets of extremal Sobolev functions for
subcritical exponents p. We conjecture that as p increases the corresponding
extremal functions become more peaked, which we can measure by comparing their
distribution functions. Then we provide compelling numerical evidence for our
conjecture.
","[{""version"":""v1"",""created"":""Fri, 10 Jan 2014 12:47:24 GMT""}]","2016-01-20"
"1401.2314","Masaaki Fujii","Masaaki Fujii, Akihiko Takahashi","Optimal Hedging for Fund & Insurance Managers with Partially Observable
  Investment Flows","Revised version. Forthcoming in Quantitative Finance",,,,"q-fin.CP q-fin.PM q-fin.RM","http://arxiv.org/licenses/nonexclusive-distrib/1.0/","  All the financial practitioners are working in incomplete markets full of
unhedgeable risk-factors. Making the situation worse, they are only equipped
with the imperfect information on the relevant processes. In addition to the
market risk, fund and insurance managers have to be prepared for sudden and
possibly contagious changes in the investment flows from their clients so that
they can avoid the over- as well as under-hedging. In this work, the prices of
securities, the occurrences of insured events and (possibly a network of) the
investment flows are used to infer their drifts and intensities by a stochastic
filtering technique. We utilize the inferred information to provide the optimal
hedging strategy based on the mean-variance (or quadratic) risk criterion. A
BSDE approach allows a systematic derivation of the optimal strategy, which is
shown to be implementable by a set of simple ODEs and the standard Monte Carlo
simulation. The presented framework may also be useful for manufactures and
energy firms to install an efficient overlay of dynamic hedging by financial
derivatives to minimize the costs.
","[{""version"":""v1"",""created"":""Fri, 10 Jan 2014 12:47:30 GMT""},{""version"":""v2"",""created"":""Sat, 26 Jul 2014 05:38:22 GMT""}]","2014-07-29"
"1401.2315","Shahrooz Janbaz","Alireza Abdollahi and Shahrooz Janbaz","Connected graphs cospectral with a Friendship graph","3 pages, 2 figures",,,,"math.CO","http://arxiv.org/licenses/nonexclusive-distrib/1.0/","  Let $n$ be any positive integer, the friendship graph $F_n$ consist of $n$
edge-disjoint triangles that all of them meeting in one vertex. A graph $G$ is
called cospectral with a graph $H$ if their adjacency matrices have the same
eigenvalues. Recently in [http://arxiv.org/pdf/1310.6529v1.pdf] it is proved
that if $G$ is any graph cospectral with $F_n$ $(n\neq 16)$, then $G\cong F_n$.
In this note, we give a proof of special case of the latter: Any connected
graph cospectral with $F_n$ is isomorphic to $F_n$. Our proof is independent of
ones given in [http://arxiv.org/pdf/1310.6529v1.pdf] and the proofs are based
on our recent results given in [Trans. Com., 2 no. 4 (2013) 37-52.] Using an
upper bound for the largest eigenvalue of a connected graph given in [J.
Combinatorial Theory, Ser. B, 81 (2001) 177-183.].
","[{""version"":""v1"",""created"":""Fri, 10 Jan 2014 12:47:40 GMT""}]","2014-01-13"
"1401.2316","Qiurong Cui","Qiurong Cui, Karl Rohe, Zhengjun Zhang","Discussion of ""Estimating the historical and future probabilities of
  large terrorist events"" by Aaron Clauset and Ryan Woodard","Published in at http://dx.doi.org/10.1214/13-AOAS614F the Annals of
  Applied Statistics (http://www.imstat.org/aoas/) by the Institute of
  Mathematical Statistics (http://www.imstat.org)","Annals of Applied Statistics 2013, Vol. 7, No. 4, 1891-1894","10.1214/13-AOAS614F","IMS-AOAS-AOAS614F","stat.AP","http://arxiv.org/licenses/nonexclusive-distrib/1.0/","  Discussion of ""Estimating the historical and future probabilities of large
terrorist events"" by Aaron Clauset and Ryan Woodard [arXiv:1209.0089].
","[{""version"":""v1"",""created"":""Fri, 10 Jan 2014 12:49:31 GMT""}]","2014-01-13"
"1401.2317","Aaron Clauset","Aaron Clauset, Ryan Woodard","Rejoinder of ""Estimating the historical and future probabilities of
  large terrorist events"" by Aaron Clauset and Ryan Woodard","Published in at http://dx.doi.org/10.1214/13-AOAS614R the Annals of
  Applied Statistics (http://www.imstat.org/aoas/) by the Institute of
  Mathematical Statistics (http://www.imstat.org)","Annals of Applied Statistics 2013, Vol. 7, No. 4, 1895-1897","10.1214/13-AOAS614R","IMS-AOAS-AOAS614R","stat.AP","http://arxiv.org/licenses/nonexclusive-distrib/1.0/","  Rejoinder of ""Estimating the historical and future probabilities of large
terrorist events"" by Aaron Clauset and Ryan Woodard [arXiv:1209.0089].
","[{""version"":""v1"",""created"":""Fri, 10 Jan 2014 12:53:53 GMT""}]","2014-01-13"
"1401.2318","Achintya Singha","Dipanwita Majumdar, Abhisek Basu, Goutam Dev Mukherjee, Daniele
  Ercolani, Lucia Sorba, Achintya Singha","Raman scattering study of InAs nanowire under high pressure","20 pages, 6 figures, 1 table",,"10.1088/0957-4484/25/46/465704",,"cond-mat.mes-hall cond-mat.mtrl-sci","http://arxiv.org/licenses/nonexclusive-distrib/1.0/","  The pressure dependent phonon modes of predominant wurtzite InAs nanowires
has been investigated in a diamond anvil cell under hydrostatic pressure up to
58 GPa. The TO and LO at Gamma point and other optical phonon frequencies
increase linearly while the LO TO splitting decreases with pressure. The
recorded Raman modes have been used to determine the mode Gruneisen parameters
and also the value of Borns transverse effective charge. The calculated Borns
transverse effective charge exhibits a linear reduction with increasing
pressure implying an increase in covalency of nanowires under compression. The
intensity of the Raman modes shows a strong enhancement as the energy of E1
band gap approaches the excitation energy, which has been discussed in terms of
resonant Raman scattering. An indication of structural phase transformation has
been observed above pressure 10.87 GPa. We propose this transformation may be
from wurtzite to rock salt phase although further experimental and theoretical
confirmations are needed.
","[{""version"":""v1"",""created"":""Fri, 10 Jan 2014 12:57:38 GMT""}]","2015-06-18"
"1401.2319","Taras Banakh","Taras Banakh and Taras Radul","$F$-Dugundji spaces, $F$-Milutin spaces and absolute $F$-valued retracts","12 pages","Topology Appl. 179 (2015), 34-50","10.1016/j.topol.2014.08.015",,"math.GN","http://arxiv.org/licenses/nonexclusive-distrib/1.0/","  For every functional functor $F:Comp\to Comp$ in the category $Comp$ of
compact Hausdorff spaces we define the notions of $F$-Dugundji and $F$-Milutin
spaces, generalizing the classical notions of a Dugundji and Milutin spaces. We
prove that the class of $F$-Dugundji spaces coincides with the class of
absolute $F$-valued retracts. Next, we show that for a monomorphic continuous
functor $F:Comp\to Comp$ admitting tensor products each Dugundji compact is an
absolute $F$-valued retract if and only if the doubleton $\{0,1\}$ is an
absolute $F$-valued retract if and only if some points $a\in F(\{0\})\subset
F(\{0,1\})$ and $b\in F(\{1\})\subset F(\{0,1\})$ can be linked by a continuous
path in $F(\{0,1\})$. We prove that for the functor $Lip_k$ of $k$-Lipschitz
functionals with $k<2$, each absolute $Lip_k$-valued retract is openly
generated. On the other hand the one-point compactification of any uncountable
discrete space is not openly generated but is an absolute $Lip_3$-valued
retract. More generally, each hereditarily paracompact scattered compact space
$X$ of finite scattered height $n$ is an absolute $Lip_k$-valued retract for
$k=2^{n+2}-1$.
","[{""version"":""v1"",""created"":""Fri, 10 Jan 2014 13:03:27 GMT""}]","2016-02-19"
"1401.2320","Xinwu Cao","Xinwu Cao","The outflows accelerated by the magnetic fields and radiation force of
  accretion disks","8 pages, accepted by ApJ, references updated",,"10.1088/0004-637X/783/1/51",,"astro-ph.HE","http://arxiv.org/licenses/nonexclusive-distrib/1.0/","  The inner region of a luminous accretion disk is radiation pressure
dominated. We estimate the surface temperature of a radiation pressure
dominated accretion disk, \Theta=(c_s/r\Omega_K)^2<<(H/r)^2, which is
significantly lower than that of a gas pressure dominated disk, \Theta (H/r)^2.
This means that the outflow can be launched magnetically from the photosphere
of the radiation pressure dominate disk only if the effective potential barrier
along the magnetic field line is extremely shallow or no potential barrier is
present. For the latter case, the slow sonic point in the outflow may probably
be in the disk, which leads to a slow circular dense flow above the disk. This
implies that hot gas (probably in the corona) is necessary for launching a jet
from the radiation pressure dominated disk, which provides a natural
explanation on the observational evidence that the relativistic jets are
related to hot plasma in some X-ray binaries and active galactic nuclei. We
investigate the outflows accelerated from the hot corona above the disk by the
magnetic field and radiation force of the accretion disk. We find that, with
the help of the radiation force, the mass loss rate in the outflow is high,
which leads to a slow outflow. This may be the reason why the jets in
radio-loud narrow-line Seyfert galaxies are in general mild relativistic
compared with those in blazars.
","[{""version"":""v1"",""created"":""Fri, 10 Jan 2014 13:04:08 GMT""},{""version"":""v2"",""created"":""Sat, 18 Jan 2014 04:49:57 GMT""}]","2015-06-18"
"1401.2321","Marios Mattheakis M","F. Perakis, M. Mattheakis and G. P. Tsironis","Small-world networks of optical fiber lattices",,"J. Opt. 16 (2014) 102003","10.1088/2040-8978/16/10/102003",,"physics.optics cond-mat.dis-nn","http://arxiv.org/licenses/nonexclusive-distrib/1.0/","  We use a simple dynamical model and explore coherent dynamics of wavepackets
in complex networks of optical fibers. We start from a symmetric lattice and
through the application of a Monte-Carlo criterion we introduce structural
disorder and deform the lattice into a small-world network regime. We
investigate in the latter both structural (correlation length) as well as
dynamical (diffusion exponent) properties and find that both exhibit a rapid
crossover from the ordered to the fully random regime. For a critical value of
the structural disorder parameter $\rho \approx 0.25$ transport changes from
ballistic to sub-diffusive due to the creation strongly connected local
clusters and channels of preferential transport in the small world regime.
","[{""version"":""v1"",""created"":""Fri, 10 Jan 2014 13:21:05 GMT""},{""version"":""v2"",""created"":""Wed, 15 Jan 2014 09:56:57 GMT""},{""version"":""v3"",""created"":""Fri, 8 Aug 2014 07:35:11 GMT""}]","2014-09-30"
"1401.2322","Ga\""el Reecht","Ga\""el Reecht, Fabrice Scheurer, Virginie Speisser, Yannick J. Dappe,
  Fabrice Mathevet, Guillaume Schull","Electroluminescence from a polythiophene molecular wire suspended in a
  plasmonic scanning tunneling microscope junction","to be published in Physical Review Letters",,,,"cond-mat.mes-hall","http://arxiv.org/licenses/nonexclusive-distrib/1.0/","  The electroluminescence of a polythiophene wire suspended between two
metallic electrodes is probed using a scanning tunneling microscope. Under
positive sample voltage, the spectral and voltage dependencies of the emitted
light are consistent with the fluorescence of the wire junction mediated by
localized plasmons. This emission is strongly attenuated for the opposite
polarity. Both emission mechanism and polarity dependence are similar to what
occurs in organic light emitting diodes (OLED) but at the level of a single
molecular wire.
","[{""version"":""v1"",""created"":""Fri, 10 Jan 2014 13:23:14 GMT""}]","2014-01-13"
"1401.2323","Andreas Ketterer","A. Ketterer, A. Keller, T. Coudreau and P. Milman","Testing the Clauser-Horne-Shimony-Holt inequality using observables with
  arbitrary spectrum","10 pages, 4 figures, including a new Sec. 4","Phys. Rev. A 91, 012106 (2015)","10.1103/PhysRevA.91.012106",,"quant-ph","http://arxiv.org/licenses/nonexclusive-distrib/1.0/","  The Clauser-Horne-Shimony and Holt inequality applies when measurements with
binary outcomes are performed on physical systems under the assumption of local
realism. Testing such inequalities in the quantum realm usually involves either
measurements of two--valued quantum observables or pre-defining a context
dependent binning procedure. Here we establish the conditions to test the
Clauser-Horne-Shimony and Holt inequality using any quantum observable. Our
result applies to observables with an arbitrary spectrum and no prior knowledge
of their underlying Hilbert space's dimension is required. Finally, we
demonstrate the proposed general measurement strategy, that can be seen as
positive operator valued measurements performed on the system, using the
formalism of modular variables applied to the transverse degrees of freedom of
single photons.
","[{""version"":""v1"",""created"":""Fri, 10 Jan 2014 13:23:39 GMT""},{""version"":""v2"",""created"":""Mon, 27 Apr 2015 08:58:50 GMT""}]","2015-04-28"
"1401.2324","Philip S. Boonstra","Philip S. Boonstra, Bhramar Mukherjee, Jeremy M. G. Taylor","Bayesian shrinkage methods for partially observed data with many
  predictors","Published in at http://dx.doi.org/10.1214/13-AOAS668 the Annals of
  Applied Statistics (http://www.imstat.org/aoas/) by the Institute of
  Mathematical Statistics (http://www.imstat.org)","Annals of Applied Statistics 2013, Vol. 7, No. 4, 2272-2292","10.1214/13-AOAS668","IMS-AOAS-AOAS668","stat.AP","http://arxiv.org/licenses/nonexclusive-distrib/1.0/","  Motivated by the increasing use of and rapid changes in array technologies,
we consider the prediction problem of fitting a linear regression relating a
continuous outcome $Y$ to a large number of covariates $\mathbf {X}$, for
example, measurements from current, state-of-the-art technology. For most of
the samples, only the outcome $Y$ and surrogate covariates, $\mathbf {W}$, are
available. These surrogates may be data from prior studies using older
technologies. Owing to the dimension of the problem and the large fraction of
missing information, a critical issue is appropriate shrinkage of model
parameters for an optimal bias-variance trade-off. We discuss a variety of
fully Bayesian and Empirical Bayes algorithms which account for uncertainty in
the missing data and adaptively shrink parameter estimates for superior
prediction. These methods are evaluated via a comprehensive simulation study.
In addition, we apply our methods to a lung cancer data set, predicting
survival time ($Y$) using qRT-PCR ($\mathbf {X}$) and microarray ($\mathbf
{W}$) measurements.
","[{""version"":""v1"",""created"":""Fri, 10 Jan 2014 13:29:39 GMT""}]","2014-01-13"
"1401.2325","Markus Kantner","Markus Kantner, Serhiy Yanchuk and Eckehard Sch\""oll","Delay-induced patterns in a two-dimensional lattice of coupled
  oscillators",,"Sci. Rep. 5, 8522 (2015)","10.1038/srep08522",,"math.DS nlin.CD nlin.PS","http://creativecommons.org/licenses/by-nc-sa/3.0/","  We show how a variety of stable spatio-temporal periodic patterns can be
created in 2D-lattices of coupled oscillators with non-homogeneous coupling
delays. A ""hybrid dispersion relation"" is introduced, which allows studying the
stability of time-periodic patterns analytically in the limit of large delay.
The results are illustrated using the FitzHugh-Nagumo coupled neurons as well
as coupled limit cycle (Stuart-Landau) oscillators.
","[{""version"":""v1"",""created"":""Fri, 10 Jan 2014 13:30:16 GMT""}]","2017-10-31"
"1401.2326","Maik Gorgens","Maik G\""orgens","Inference in $\alpha$-Brownian bridge based on Karhunen-Lo\`eve
  expansions","21 pages, 1 figure",,,,"math.PR","http://arxiv.org/licenses/nonexclusive-distrib/1.0/","  We study a simple decision problem on the scaling parameter in the
$\alpha$-Brownian bridge $X^{(\alpha)}$ on the interval $[0,1]$: given two
values $\alpha_0, \alpha_1 \geq 0$ with $\alpha_0 + \alpha_1 \geq 1$ and some
time $0 \leq T \leq 1$ we want to test $H_0: \alpha = \alpha_0$ vs. $H_1:
\alpha = \alpha_1$ based on the observation of $X^{(\alpha)}$ until time $T$.
The likelihood ratio can be written as a functional of a quadratic form
$\psi(X^{(\alpha)})$ of $X^{(\alpha)}$. In order to calculate the distribution
of $\psi(X^{(\alpha)})$ under the null hypothesis, we generalize the
Karhunen-Lo\`eve Theorem to positive finite measures on $[0,1]$ and compute the
Karhunen-Lo\`eve expansion of $X^{(\alpha)}$ under such a measure. Based on
this expansion, the distribution of $\psi(X^{(\alpha)})$ follows by Smirnov's
formula.
","[{""version"":""v1"",""created"":""Fri, 10 Jan 2014 13:33:16 GMT""},{""version"":""v2"",""created"":""Mon, 13 Jan 2014 11:15:42 GMT""},{""version"":""v3"",""created"":""Tue, 5 Aug 2014 09:05:59 GMT""}]","2014-08-06"
"1401.2327","Waqas Nawaz","Kamran Najeebullah, Kifayat Ullah Khan, Waqas Nawaz, Young-Koo Lee","BPP: Large Graph Storage for Efficient Disk Based Processing","5 pages, Published in ICCA, 2013","Advanced Science and Technology Letters Vol.30 (ICCA 2013),
  pp.117-121","10.14257/astl.2013.30.25",,"cs.DS cs.DB","http://arxiv.org/licenses/nonexclusive-distrib/1.0/","  Processing very large graphs like social networks, biological and chemical
compounds is a challenging task. Distributed graph processing systems process
the billion-scale graphs efficiently but incur overheads of efficient
partitioning and distribution of the graph over a cluster of nodes. Distributed
processing also requires cluster management and fault tolerance. In order to
overcome these problems GraphChi was proposed recently. GraphChi significantly
outperformed all the representative distributed processing frameworks. Still,
we observe that GraphChi incurs some serious degradation in performance due to
1) high number of non-sequential I/Os for processing every chunk of graph; and
2) lack of true parallelism to process the graph. In this paper we propose a
simple yet powerful engine BiShard Parallel Processor (BPP) to efficiently
process billions-scale graphs on a single PC. We extend the storage structure
proposed by GraphChi and introduce a new processing model called BiShard
Parallel (BP). BP enables full CPU parallelism for processing the graph and
significantly reduces the number of non-sequential I/Os required to process
every chunk of the graph. Our experiments on real large graphs show that our
solution significantly outperforms GraphChi.
","[{""version"":""v1"",""created"":""Fri, 10 Jan 2014 13:36:21 GMT""}]","2014-01-13"
