"1401.2043","Edward Polehampton","Ivan Valtchanov, Rosalind Hopwood, Edward Polehampton, Dominique
  Benielli, Trevor Fulton, Peter Imhof, Tomasz Konopczynski, Tanya Lim, Nanyao
  Lu, Nicola Marchili, David Naylor and Bruce Swinyard","Relative pointing offset analysis of calibration targets with repeated
  observations with Herschel-SPIRE Fourier-Transform Spectrometer","17 pages, 19 figures, accepted for publication in Experimental
  Astronomy",,"10.1007/s10686-013-9356-z",,"astro-ph.IM","http://arxiv.org/licenses/nonexclusive-distrib/1.0/","  We present a method to derive the relative pointing offsets for SPIRE
Fourier-Transform Spectrometer (FTS) solar system object (SSO) calibration
targets, which were observed regularly throughout the Herschel mission. We
construct ratios of the spectra for all observations of a given source with
respect to a reference. The reference observation is selected iteratively to be
the one with the highest observed continuum. Assuming that any pointing offset
leads to an overall shift of the continuum level, then these ratios represent
the relative flux loss due to mispointing. The mispointing effects are more
pronounced for a smaller beam, so we consider only the FTS short wavelength
array (SSW, 958-1546 GHz) to derive a pointing correction. We obtain the
relative pointing offset by comparing the ratio to a grid of expected losses
for a model source at different distances from the centre of the beam, under
the assumption that the SSW FTS beam can be well approximated by a Gaussian. In
order to avoid dependency on the point source flux conversion, which uses a
particular observation of Uranus, we use extended source flux calibrated
spectra to construct the ratios for the SSOs. In order to account for continuum
variability, due to the changing distance from the Herschel telescope, the SSO
ratios are normalised by the expected model ratios for the corresponding
observing epoch. We confirm the accuracy of the derived pointing offset by
comparing the results with a number of control observations, where the actual
pointing of Herschel is known with good precision. Using the method we derived
pointing offsets for repeated observations of Uranus (including observations
centred on off-axis detectors), Neptune, Ceres and NGC7027. The results are
used to validate and improve the point-source flux calibration of the FTS.
","[{""version"":""v1"",""created"":""Thu, 9 Jan 2014 16:00:43 GMT""}]","2014-01-14"
"1401.2044","Riccardo Artoni","Riccardo Artoni and Andrea C. Santomaso and Massimiliano Go' and Paolo
  Canu","Scaling Laws for the Slip Velocity in Dense Granular Flows","5 pages, 4 figures","Phys. Rev. Lett. 108, 238002 (2012)","10.1103/PhysRevLett.108.238002",,"cond-mat.soft physics.flu-dyn","http://arxiv.org/licenses/nonexclusive-distrib/1.0/","  In this Letter, the 2-dimensional dense flow of polygonal particles on an
incline with a flat frictional inferior boundary is analyzed by means of
contact dynamics discrete element simulations, in order to develop boundary
conditions for continuum models of dense granular flows. We show the evidence
that the global slip phenomenon deviates significantly from simple sliding: a
finite slip velocity is generally found for shear forces lower than the sliding
threshold for particle-wall contacts. We determined simple scaling laws for the
dependence of the slip velocity on shear rate, normal and shear stresses, and
material parameters.The importance of a correct determination of the slip at
the base of the incline, which is crucial for the calculation of flow rates, is
discussed in relation to natural flows.
","[{""version"":""v1"",""created"":""Thu, 9 Jan 2014 16:02:08 GMT""}]","2014-01-10"
"1401.2045","Edward Polehampton","Nanyao Lu, Edward T. Polehampton, Bruce M. Swinyard, Dominique
  Benielli, Trevor Fulton, Rosalind Hopwood, Peter Imhof, Tanya Lim, Nicola
  Marchili, David A. Naylor, Bernhard Schulz, Sunil Sidher and Ivan Valtchanov","Herschel SPIRE Fourier Transform Spectrometer: Calibration of its
  Bright-source Mode","15 pages, 16 figures, accepted for publication in Experimental
  Astronomy",,"10.1007/s10686-013-9359-9",,"astro-ph.IM","http://arxiv.org/licenses/nonexclusive-distrib/1.0/","  The Fourier Transform Spectrometer (FTS) of the Spectral and Photometric
Imaging REceiver (SPIRE) on board the ESA Herschel Space Observatory has two
detector setting modes: (a) a nominal mode, which is optimized for observing
moderately bright to faint astronomical targets, and (b) a bright-source mode
recommended for sources significantly brighter than 500 Jy, within the SPIRE
FTS bandwidth of 446.7-1544 GHz (or 194-671 microns in wavelength), which
employs a reduced detector responsivity and out-of-phase analog signal
amplifier/demodulator. We address in detail the calibration issues unique to
the bright-source mode, describe the integration of the bright-mode data
processing into the existing pipeline for the nominal mode, and show that the
flux calibration accuracy of the bright-source mode is generally within 2% of
that of the nominal mode, and that the bright-source mode is 3 to 4 times less
sensitive than the nominal mode.
","[{""version"":""v1"",""created"":""Thu, 9 Jan 2014 16:03:05 GMT""}]","2014-01-14"
"1401.2046","Justin Evans","The IceCube-PINGU Collaboration","Letter of Intent: The Precision IceCube Next Generation Upgrade (PINGU)","This is a significant update to the original LoI, following three
  years of advanced studies. Through optimisation of the detector design and
  analysis techniques, similar physics capabilities are demonstrated for a
  26-string detector array, compared to the original 40-string design. The
  smaller array may be deployed in less time (two seasons compared to three)
  and at reduced estimated costs",,,,"physics.ins-det astro-ph.HE astro-ph.IM hep-ex","http://arxiv.org/licenses/nonexclusive-distrib/1.0/","  The Precision IceCube Next Generation Upgrade (PINGU) is a proposed
low-energy in-fill array of the IceCube Neutrino Observatory. Leveraging
technology proven with IceCube, PINGU will feature the world's largest
effective volume for neutrinos at an energy threshold of a few GeV, improving
the sensitivity to several aspects of neutrino oscillation physics at modest
cost. With its unprecedented statistical sample of low-energy atmospheric
neutrinos, PINGU will have highly competitive sensitivity to $\nu_{\mu}$
disappearance, the $\theta_{23}$ octant, and maximal mixing, will make the
world's best $\nu_{\tau}$ appearance measurement, allowing a unique probe of
the unitarity of the PMNS mixing matrix, and will be able to distinguish the
neutrino mass ordering at $3\sigma$ significance with less than 4 years of
data. PINGU can also extend the indirect search for solar WIMP dark matter
complimentary to the on-going and planned direct dark matter experiments. At
the lower end of the energy range, PINGU may use neutrino tomography to
directly probe the composition of the Earth's core. With its increased module
density, PINGU will improve IceCube's sensitivity to galactic supernova
neutrino bursts and enable it to extract the neutrino energy spectral shape.
","[{""version"":""v1"",""created"":""Thu, 9 Jan 2014 16:03:22 GMT""},{""version"":""v2"",""created"":""Tue, 5 Sep 2017 17:21:42 GMT""}]","2017-09-07"
"1401.2047","Edward Polehampton","Rosalind Hopwood, Trevor Fulton, Edward T. Polehampton, Ivan
  Valtchanov, Dominique Benielli, Peter Imhof, Tanya Lim, Nanyao Lu, Nicola
  Marchili, Chris P. Pearson and Bruce M. Swinyard","Herschel SPIRE FTS telescope model correction","12 pages, 14 figures, accepted for publication in Experimental
  Astronomy",,"10.1007/s10686-013-9355-0",,"astro-ph.IM","http://arxiv.org/licenses/nonexclusive-distrib/1.0/","  Emission from the Herschel telescope is the dominant source of radiation for
the majority of SPIRE Fourier transform spectrometer (FTS) observations,
despite the exceptionally low emissivity of the primary and secondary mirrors.
Accurate modelling and removal of the telescope contribution is, therefore, an
important and challenging aspect of FTS calibration and data reduction
pipeline. A dust-contaminated telescope model with time invariant mirror
emissivity was adopted before the Herschel launch. However, measured FTS
spectra show a clear evolution of the telescope contribution over the mission
and strong need for a correction to the standard telescope model in order to
reduce residual background (of up to 7 Jy) in the final data products.
Systematic changes in observations of dark sky, taken over the course of the
mission, provide a measure of the evolution between observed telescope emission
and the telescope model. These dark sky observations have been used to derive a
time dependent correction to the telescope emissivity that reduces the
systematic error in the continuum of the final FTS spectra to ~0.35 Jy.
","[{""version"":""v1"",""created"":""Thu, 9 Jan 2014 16:04:27 GMT""}]","2014-01-14"
"1401.2048","Thomas Buchheim","Thomas Buchheim, Thomas Hilger, Burkhard Kampfer","In-medium QCD sum rules for D mesons: A projection method for higher
  order contributions","5 pages","J. Phys.: Conf. Ser. 503 (2014) 012006","10.1088/1742-6596/503/1/012006",,"nucl-th hep-ph","http://arxiv.org/licenses/nonexclusive-distrib/1.0/","  D mesons serve as excellent probes of hot and/or dense strongly interacting
matter. They can provide insight into the restoration of chiral symmetry. The
chiral condensate as well as other chirally odd condensates, such as certain
four-quark condensates, are linked to order parameters of spontaneous chiral
symmetry breaking. Thus, the evaluation of these higher order condensate
contributions in the framework of QCD sum rules is of high interest. We present
a general method for projecting Lorentz indices of ground state expectation
values providing a crucial step towards a comprehensive calculation of higher
order corrections to the operator product expansion of hadrons, especially D
mesons, in a strongly interacting medium.
","[{""version"":""v1"",""created"":""Thu, 9 Jan 2014 16:05:10 GMT""}]","2014-04-17"
"1401.2049","Edward Polehampton","Trevor Fulton, Rosalind Hopwood, Jean-Paul Baluteau, Dominique
  Benielli, Peter Imhof, Tanya Lim, Nanyao Lu, Nicola Marchili, David Naylor,
  Edward Polehampton, Bruce Swinyard and Ivan Valtchanov","Herschel SPIRE FTS Relative Spectral Response Calibration","15 pages, 13 figures, accepted for publication in Experimental
  Astronomy",,"10.1007/s10686-013-9364-z",,"astro-ph.IM","http://arxiv.org/licenses/nonexclusive-distrib/1.0/","  Herschel/SPIRE Fourier transform spectrometer (FTS) observations contain
emission from both the Herschel Telescope and the SPIRE Instrument itself, both
of which are typically orders of magnitude greater than the emission from the
astronomical source, and must be removed in order to recover the source
spectrum. The effects of the Herschel Telescope and the SPIRE Instrument are
removed during data reduction using relative spectral response calibration
curves and emission models. We present the evolution of the methods used to
derive the relative spectral response calibration curves for the SPIRE FTS. The
relationship between the calibration curves and the ultimate sensitivity of
calibrated SPIRE FTS data is discussed and the results from the derivation
methods are compared. These comparisons show that the latest derivation methods
result in calibration curves that impart a factor of between 2 and 100 less
noise to the overall error budget, which results in calibrated spectra for
individual observations whose noise is reduced by a factor of 2-3, with a gain
in the overall spectral sensitivity of 23% and 21% for the two detector bands,
respectively.
","[{""version"":""v1"",""created"":""Thu, 9 Jan 2014 16:05:47 GMT""}]","2015-06-18"
"1401.2050","Mark Agranovsky","Mark Agranovsky","Parametric argument principle and its applications to CR functions and
  manifolds","Accepted in Advances in Mathematics. arXiv admin note: text overlap
  with arXiv:0704.2871","Advances in Mathematics, v.255 (2014), 38-85",,,"math.CV","http://arxiv.org/licenses/nonexclusive-distrib/1.0/","  A version of the argument principle is established for varieties of
holomorphic mappings from the unit disc to $\mathbb C^n,$ parametrized by
points of real manifolds. Applications to characterization of CR functions and
estimating CR dimensions of real submanifolds in $\mathbb C^n$ are given.
","[{""version"":""v1"",""created"":""Thu, 9 Jan 2014 16:06:00 GMT""}]","2015-04-07"
"1401.2051","Agunbiade Olusanya  yinka","Olusanya Y. Agunbiade, Tranos Zuva, Awosejo O. Johnson and Keneilwe
  Zuva","Enhancement performance of road recognition system of autonomous robots
  in shadow scenario","Signal & Image Processing : An International Journal (SIPIJ) Vol.4,
  No.6, December 2013",,,,"cs.RO cs.CV","http://creativecommons.org/licenses/by-nc-sa/3.0/","  Road region recognition is a main feature that is gaining increasing
attention from intellectuals because it helps autonomous vehicle to achieve a
successful navigation without accident. However, different techniques based on
camera sensor have been used by various researchers and outstanding results
have been achieved. Despite their success, environmental noise like shadow
leads to inaccurate recognition of road region which eventually leads to
accident for autonomous vehicle. In this research, we conducted an
investigation on shadow and its effects, optimized the road region recognition
system of autonomous vehicle by introducing an algorithm capable of detecting
and eliminating the effects of shadow. The experimental performance of our
system was tested and compared using the following schemes: Total Positive Rate
(TPR), False Negative Rate (FNR), Total Negative Rate (TNR), Error Rate (ERR)
and False Positive Rate (FPR). The performance result of the system improved on
road recognition in shadow scenario and this advancement has added tremendously
to successful navigation approaches for autonomous vehicle.
","[{""version"":""v1"",""created"":""Thu, 9 Jan 2014 16:09:57 GMT""}]","2014-01-10"
"1401.2052","Walter Burgess","Walter Burgess","On strongly clean matrices over commutative clean rings","10 pages",,,,"math.RA","http://arxiv.org/licenses/nonexclusive-distrib/1.0/","  The literature about strongly clean matrices over commutative rings is quite
extensive. The sharpest results are about matrices over commutative local
rings, for example those by Borooah, Diesl and Dorsey. The purpose of this note
is to show that, using Pierce sheaf techniques, many of the known results about
matrices over commutative local rings can be extended to those over commutative
clean rings in general.
","[{""version"":""v1"",""created"":""Thu, 9 Jan 2014 16:10:20 GMT""}]","2014-01-10"
"1401.2053","Achille A. Nucita","A.A. Nucita, S. Stefanelli, F. De Paolis, N. Masetti, G. Ingrosso, M.
  Del Santo, L. Manni","The puzzling symbiotic X-ray system 4U1700+24","In press on A&A",,"10.1051/0004-6361/201322680",,"astro-ph.HE","http://arxiv.org/licenses/nonexclusive-distrib/1.0/","  Symbiotic X-ray binaries form a subclass of low-mass X-ray binary systems
consisting of a neutron star accreting material from a red giant donor star via
stellar wind or Roche lobe overflow. Only a few confirmed members are currently
known; 4U 1700+24 is a good candidate as it is a relatively bright X-ray
object, possibly associated with the late-type star V934 Her. We analysed the
archive {\it XMM}-Newton and Swift/XRT observations of 4U 1700+24 in order to
have a uniform high-energy ($0.3-10$ keV) view of the source. We confirmed the
existence of a red-shifted O VIII Ly-$\alpha$ transition (already observed in
the 2002 {\it XMM}-Newton data) in the high-resolution spectra collected via
the RGS instruments. The red-shift of the line is found in all the analysed
observations and, on average, it was estimated to be $\simeq 0.009$. We also
observed a modulation of the centroid energy of the line on short time scales
(a few days) and discuss the observations in the framework of different
scenarios. If the modulation is due to the gravitational red-shift of the
neutron star, it might arise from a sudden re-organization of the emitting
$X$-ray matter on the scale of a few hundreds of km. Alternatively, we are
witnessing a uni-polar jet of matter (with typical velocity of $1000-4000$ km
s$^{-1}$) possibly emitted by the neutron star in an almost face-on system. The
second possibility seems to be required by the apparent lack of any modulation
in the observed $X$-ray light curve. We also note also that the low-resolution
spectra (both {\it XMM}-Newton and Swift/XRT in the $0.3-10$ keV band) show the
existence of a black body radiation emitted by a region (possibly associated
with the neutron star polar cap) with typical size from a few tens to hundreds
of meters. The size of this spot-like region reduces as the overall luminosity
of 4U 1700+24 decreases.
","[{""version"":""v1"",""created"":""Thu, 9 Jan 2014 16:12:43 GMT""}]","2015-06-18"
"1401.2054","Zhiyong Zhang","Zhiyong Zhang, Kaifeng Jiang, Haiyan Liu, In-Sue Oh","Bayesian meta-analysis of correlation coefficients through power prior",,,,,"stat.ME","http://creativecommons.org/licenses/by/3.0/","  To answer the call of introducing more Bayesian techniques to organizational
research (e.g., Kruschke, Aguinis, & Joo, 2012; Zyphur & Oswald, 2013), we
propose a Bayesian approach for meta-analysis with power prior in this article.
The primary purpose of this method is to allow meta-analytic researchers to
control the contribution of each individual study to an estimated overall
effect size though power prior. This is due to the consideration that not all
studies included in a meta-analysis should be viewed as equally reliable, and
that by assigning more weights to reliable studies with power prior,
researchers may obtain an overall effect size that reflects the population
effect size more accurately. We use the relationship between high-performance
work systems and financial performance as an example to illustrate how to apply
this method to organizational research. We also provide free online software
that can be used to conduct Bayesian meta-analysis proposed in this study.
Research implications and future directions are discussed.
","[{""version"":""v1"",""created"":""Thu, 9 Jan 2014 16:15:41 GMT""},{""version"":""v2"",""created"":""Tue, 29 Jul 2014 15:03:48 GMT""}]","2014-07-30"
"1401.2055","Nazim Mahmudov Idris","Nazim I. Mahmudov","Approximation by Genuine $q$-Bernstein-Durrmeyer Polynomials in Compact
  Disks in the case $q > 1$",,,,,"math.AP","http://creativecommons.org/licenses/by/3.0/","  This paper deals with approximating properties of the newly defined
$q$-generalization of the genuine Bernstein-Durrmeyer polynomials in the case
$q>1$, whcih are no longer positive linear operators on $C[0,1]$. Quantitative
estimates of the convergence, the Voronovskaja type theorem and saturation of
convergence for complex genuine $q$-Bernstein-Durrmeyer polynomials attached to
analytic functions in compact disks are given. In particular, it is proved that
for functions analytic in $\left\{ z\in\mathbb{C}:\left\vert z\right\vert
<R\right\} $, $R>q,$ the rate of approximation by the genuine
$q$-Bernstein-Durrmeyer polynomials ($q>1$) is of order $q^{-n}$ versus $1/n$
for the classical genuine Bernstein-Durrmeyer polynomials. We give explicit
formulas of Voronovskaja type for the genuine $q$-Bernstein-Durrmeyer for
$q>1$.
","[{""version"":""v1"",""created"":""Thu, 9 Jan 2014 16:19:35 GMT""}]","2014-01-10"
"1401.2056","Hamsalekha Venkatesh","Vanaja Ramaswamy, Abinaya Sivarasu, Bharghavi Sridharan and Hamsalekha
  Venkatesh","A Bi-Scheduler Algorithm for Frame Aggregation in IEEE 802.11n","9 pages,6 figures, International Journal of Wireless & Mobile
  Networks (IJWMN) Vol. 5, No. 6","International Journal of Wireless & Mobile Networks (IJWMN) Vol.
  5, No. 6, December 2013",,,"cs.NI","http://arxiv.org/licenses/nonexclusive-distrib/1.0/","  IEEE 802.11n mainly aims to provide high throughput, reliability and good
security over its other previous standards. The performance of 802.11n is very
effective on the saturated traffic through the use of frame aggregation. But
this frame aggregation will not effectively function in all scenarios. The main
objective of this paper is to improve the throughput of the wireless LAN
through effective frame aggregation using scheduler mechanism. The Bi-Scheduler
algorithm proposed in this article aims to segregate frames based on their
access categories. The outer scheduler separates delay sensitive applications
from the incoming burst of multi-part data and also decides whether to apply
Aggregated - MAC Service Data Unit (A-MSDU) aggregation technique or to send
the data without any aggregation. The inner scheduler schedules the remaining
(delay-insensitive, background and best-effort) packets using Aggregated-MAC
Protocol Data unit (A-MPDU) aggregation technique
","[{""version"":""v1"",""created"":""Thu, 9 Jan 2014 16:23:12 GMT""}]","2014-01-10"
"1401.2057","Giacomo Rosati","Francesco Cianfrani, Jerzy Kowalski-Glikman, Giacomo Rosati","Generally covariant formulation of Relative Locality in curved spacetime",,"Phys. Rev. D 89, 044039 (2014)","10.1103/PhysRevD.89.044039",,"gr-qc hep-th","http://arxiv.org/licenses/nonexclusive-distrib/1.0/","  We construct a theory of particles moving in curved both momentum space and
spacetime, being a generalization of Relative Locality. We find that in order
to construct such theory, with desired symmetries, including the general
coordinate invariance, we have to use non local position variables. It turns
out that free particles move on geodesics and momentum dependent translations
of Relative Locality are replaced with momentum dependent geodesic deviations.
","[{""version"":""v1"",""created"":""Thu, 9 Jan 2014 16:23:28 GMT""}]","2014-03-05"
"1401.2058","Rachit Puri","Rachit Puri","Gesture recognition based mouse events","9 pages, IJCSIT",,,,"cs.CV","http://creativecommons.org/licenses/by/3.0/","  This paper presents the maneuver of mouse pointer and performs various mouse
operations such as left click, right click, double click, drag etc using
gestures recognition technique. Recognizing gestures is a complex task which
involves many aspects such as motion modeling, motion analysis, pattern
recognition and machine learning. Keeping all the essential factors in mind a
system has been created which recognizes the movement of fingers and various
patterns formed by them. Color caps have been used for fingers to distinguish
it from the background color such as skin color. Thus recognizing the gestures
various mouse events have been performed. The application has been created on
MATLAB environment with operating system as windows 7.
","[{""version"":""v1"",""created"":""Thu, 9 Jan 2014 16:26:54 GMT""}]","2014-01-10"
"1401.2059","Alex Massarenti","Alex Massarenti","Generalized varieties of sums of powers","25 pages",,,,"math.AG","http://arxiv.org/licenses/nonexclusive-distrib/1.0/","  Let $X\subset\mathbb{P}^{N}$ be an irreducible, non-degenerate variety. The
generalized variety of sums of powers $VSP_H^X(h)$ of $X$ is the closure in the
Hilbert scheme $Hilb_{h}(X)$ of the locus parametrizing collections of points
$\{x_{1},...,x_{h}\}$ such that the $(h-1)$-plane $\left\langle
x_{1},...,x_{h}\right\rangle$ passes trough a fixed general point
$p\in\mathbb{P}^{N}$. When $X = V_{d}^{n}$ is a Veronese variety we recover the
classical variety of sums of powers $VSP(F,h)$ parametrizing additive
decompositions of a homogeneous polynomial as powers of linear forms. In this
paper we study the birational behavior of $VSP_H^X(h)$. In particular we will
show how some birational properties, such as rationality, unirationality and
rational connectedness, of $VSP_H^X(h)$ are inherited from the birational
geometry of variety $X$ itself.
","[{""version"":""v1"",""created"":""Thu, 9 Jan 2014 16:27:01 GMT""}]","2014-01-10"
"1401.2060","Kai Hoffmann","Kai Hoffmann, Susana Planelles, Enrique Gaztanaga, Alexander Knebe,
  Frazer R. Pearce, Hanni Lux, Julian Onions, Stuart I. Muldrew, Pascal Elahi,
  Peter Behroozi, Yago Ascasibar, Jiaxin Han, Michal Maciejewski, Manuel E.
  Merchan, Mark Neyrinck, Andr\'es N. Ruiz, Mario A. Sgro","Subhaloes gone Notts: Subhaloes as tracers of the dark matter halo shape","15 pages, 11 figures, 2 tables. 1 figure removed to reduce paper
  extension, shorter discussion, accepted for publication in MNRAS",,"10.1093/mnras/stu933",,"astro-ph.CO","http://arxiv.org/licenses/nonexclusive-distrib/1.0/","  We study the shapes of subhalo distributions from four dark-matter-only
simulations of Milky Way type haloes. Comparing the shapes derived from the
subhalo distributions at high resolution to those of the underlying dark matter
fields we find the former to be more triaxial if theanalysis is restricted to
massive subhaloes. For three of the four analysed haloes the increased
triaxiality of the distributions of massive subhaloes can be explained by a
systematic effect caused by the low number of objects. Subhaloes of the fourth
halo show indications for anisotropic accretion via their strong triaxial
distribution and orbit alignment with respect to the dark matter field. These
results are independent of the employed subhalo finder. Comparing the shape of
the observed Milky Way satellite distribution to those of high-resolution
subhalo samples from simulations, we find an agreement for samples of bright
satellites, but significant deviations if faint satellites are included in the
analysis. These deviations might result from observational incompleteness.
","[{""version"":""v1"",""created"":""Thu, 9 Jan 2014 16:33:13 GMT""},{""version"":""v2"",""created"":""Wed, 10 Sep 2014 20:46:36 GMT""}]","2015-06-18"
