"1401.2122","Artur Sergyeyev","A. Sergyeyev","New integrable (3+1)-dimensional systems and contact geometry","16 pages, LaTeX, no figures, revised and abridged, in this version
  (v5) the typos were fixed (including some that have unfortunately crept into
  the published version too), Letters in Mathematical Physics (2017)","Lett. Math. Phys. 108 (2018), no. 2, 359-376","10.1007/s11005-017-1013-4",,"math.AP hep-th math-ph math.DG math.MP nlin.SI","http://arxiv.org/licenses/nonexclusive-distrib/1.0/","  We introduce a novel systematic construction for integrable (3+1)-dimensional
dispersionless systems using nonisospectral Lax pairs that involve contact
vector fields.
  In particular, we present new large classes of (3+1)-dimensional integrable
dispersionless systems associated to the Lax pairs which are polynomial and
rational in the spectral parameter.
","[{""version"":""v1"",""created"":""Thu, 9 Jan 2014 19:14:18 GMT""},{""version"":""v2"",""created"":""Thu, 30 Jan 2014 20:51:34 GMT""},{""version"":""v3"",""created"":""Thu, 14 Jan 2016 20:06:31 GMT""},{""version"":""v4"",""created"":""Tue, 26 Sep 2017 16:57:31 GMT""},{""version"":""v5"",""created"":""Mon, 23 Oct 2017 17:51:33 GMT""}]","2018-01-25"
"1401.2123","Magnus Goffeng","Magnus Goffeng, Bram Mesland","Spectral triples and finite summability on Cuntz-Krieger algebras","67 pages, minor changes in Section 5.1 and 6.1","Documenta Math. 20 (2015), 89-170",,,"math.KT math.FA math.OA math.QA","http://arxiv.org/licenses/nonexclusive-distrib/1.0/","  We produce a variety of odd bounded Fredholm modules and odd spectral triples
on Cuntz-Krieger algebras by means of realizing these algebras as ""the algebra
of functions on a non-commutative space"" coming from a sub shift of finite
type. We show that any odd $K$-homology class can be represented by such an odd
bounded Fredholm module or odd spectral triple. The odd bounded Fredholm
modules that are constructed are finitely summable. The spectral triples are
$\theta$-summable although their bounded transform, when constructed using the
sign-function, will already on the level of analytic $K$-cycles be finitely
summable bounded Fredholm modules. Using the unbounded Kasparov product, we
exhibit a family of generalized spectral triples, possessing mildly unbounded
commutators, whilst still giving well defined $K$-homology classes.
","[{""version"":""v1"",""created"":""Thu, 9 Jan 2014 19:16:07 GMT""},{""version"":""v2"",""created"":""Tue, 29 Apr 2014 06:50:35 GMT""},{""version"":""v3"",""created"":""Fri, 27 Feb 2015 01:23:13 GMT""}]","2015-03-02"
"1401.2124","Ivan Limonchenko","Ivan Limonchenko","Stanley--Reisner rings of generalised truncation polytopes and their
  moment-angle manifolds","12 pages. arXiv admin note: text overlap with arXiv:1101.0066","Proceedings of the Steklov Institute of Mathematics, 286 (2014),
  188-197","10.1134/S0081543814060091",,"math.AT","http://arxiv.org/licenses/nonexclusive-distrib/1.0/","  We consider simple polytopes
$P=vc^{k}(\Delta^{n_{1}}\times\ldots\times\Delta^{n_{r}})$, for
$n_1\ge\ldots\ge n_r\ge 1,r\ge 1,k\ge 0$, that is, $k$-vertex cuts of a product
of simplices, and call them {\emph{generalized truncation polytopes}}. For
these polytopes we describe the cohomology ring of the corresponding
moment-angle manifold $\mathcal Z_P$ and explore some topological consequences
of this calculation. We also examine minimal non-Golodness for their
Stanley--Reisner rings and relate it to the property of $\mathcal Z_P$ being a
connected sum of sphere products.
","[{""version"":""v1"",""created"":""Thu, 9 Jan 2014 19:16:17 GMT""}]","2017-11-15"
"1401.2125","Paul Tranquilli","Paul Tranquilli and Adrian Sandu","Exponential-Krylov methods for ordinary differential equations",,"Journal of Computational Physics. Volume 278, Pages 31 -- 46, 2014","10.1016/j.jcp.2014.08.013","Computational Science Laboratory CSLTR-01/2014","cs.NA math.NA","http://arxiv.org/licenses/nonexclusive-distrib/1.0/","  This paper develops a new class of exponential-type integrators where all the
matrix exponentiations are performed in a single Krylov space of low dimension.
The new family, called Lightly Implicit Krylov-Exponential (LIKE), is well
suited for solving large scale systems of ODEs or semi-discrete PDEs. The time
discretization and the Krylov space approximation are treated as a single
computational process, and the Krylov space properties are an integral part of
the new LIKE order condition theory developed herein. Consequently, LIKE
methods require a small number of basis vectors determined solely by the
temporal order of accuracy. The subspace size is independent of the ODE under
consideration, and there is no need to monitor the errors in linear system
solutions at each stage. Numerical results illustrate the favorable properties
of new family of methods.
","[{""version"":""v1"",""created"":""Thu, 9 Jan 2014 19:17:40 GMT""},{""version"":""v2"",""created"":""Thu, 29 Jan 2015 20:26:34 GMT""}]","2015-01-30"
"1401.2127","Andr\'e van Renssen","Prosenjit Bose and Andr\'e van Renssen","Spanning Properties of Yao and $\Theta$-Graphs in the Presence of
  Constraints",,,,,"cs.CG","http://arxiv.org/licenses/nonexclusive-distrib/1.0/","  We present improved upper bounds on the spanning ratio of constrained
$\theta$-graphs with at least 6 cones and constrained Yao-graphs with 5 or at
least 7 cones. Given a set of points in the plane, a Yao-graph partitions the
plane around each vertex into $m$ disjoint cones, each having aperture $\theta
= 2 \pi/m$, and adds an edge to the closest vertex in each cone. Constrained
Yao-graphs have the additional property that no edge properly intersects any of
the given line segment constraints. Constrained $\theta$-graphs are similar to
constrained Yao-graphs, but use a different method to determine the closest
vertex.
  We present tight bounds on the spanning ratio of a large family of
constrained $\theta$-graphs. We show that constrained $\theta$-graphs with $4k
+ 2$ ($k \geq 1$ and integer) cones have a tight spanning ratio of $1 + 2
\sin(\theta/2)$, where $\theta$ is $2 \pi / (4k + 2)$. We also present improved
upper bounds on the spanning ratio of the other families of constrained
$\theta$-graphs. These bounds match the current upper bounds in the
unconstrained setting.
  We also show that constrained Yao-graphs with an even number of cones ($m
\geq 8$) have spanning ratio at most $1 / ( 1 - 2 \sin (\theta/2) )$ and
constrained Yao-graphs with an odd number of cones ($m \geq 5$) have spanning
ratio at most $1 / ( 1 - 2 \sin (3\theta/8) )$. As is the case with constrained
$\theta$-graphs, these bounds match the current upper bounds in the
unconstrained setting, which implies that like in the unconstrained setting
using more cones can make the spanning ratio worse.
","[{""version"":""v1"",""created"":""Thu, 9 Jan 2014 19:28:09 GMT""},{""version"":""v2"",""created"":""Thu, 4 Apr 2019 23:27:15 GMT""}]","2019-04-08"
"1401.2128","Cristian Quinzacara","Juan Crisostomo, Fernando Gomez, Patricio Salgado, Cristian
  Quinzacara, Mauricio Cataldo and Sergio del Campo","Accelerated FRW Solutions in Chern-Simons Gravity","58 pages, 24 figures","Eur. Phys. J. C (2014) 74:3087","10.1140/epjc/s10052-014-3087-9",,"gr-qc hep-th","http://arxiv.org/licenses/nonexclusive-distrib/1.0/","  We consider a five-dimensional Einstein-Chern-Simons action which is composed
of a gravitational sector and a sector of matter, where the gravitational
sector is given by a Chern-Simons gravity action instead of the
Einstein-Hilbert action and where the matter sector is given by the so called
perfect fluid. It is shown that (i) the Einstein-Chern-Simons (EChS) field
equations subject to suitable conditions can be written in a similar way to the
Einstein-Maxwell field equations; (ii) these equations have solutions that
describe accelerated expansion for the three possible cosmological models of
the universe, namely, spherical expansion, flat expansion and hyperbolic
expansion when $\alpha $, a parameter of theory, is greater than zero. This
result allow us to conjeture that this solutions are compatible with the era of
Dark Energy and that the energy-momentum tensor for the field $h^{a}$, a
bosonic gauge field from the Chern-Simons gravity action, corresponds to a form
of positive cosmological constant.
  It is also shown that the EChS field equations have solutions compatible with
the era of matter: (i) In the case of an open universe, the solutions
correspond to an accelerated expansion ($\alpha >0$) with a minimum scale
factor at initial time that, when the time goes to infinity, the scale factor
behaves as a hyperbolic sine function. (ii) In the case of a flat universe, the
solutions describing an accelerated expansion whose scale factor behaves as a
exponencial function when time grows. \item In the case of a closed universe it
is found only one solution for a universe in expansion, which behaves as a
hyperbolic cosine function when time grows.
","[{""version"":""v1"",""created"":""Thu, 9 Jan 2014 19:29:19 GMT""},{""version"":""v2"",""created"":""Sun, 4 May 2014 19:46:42 GMT""},{""version"":""v3"",""created"":""Tue, 19 Aug 2014 03:35:30 GMT""}]","2014-10-16"
"1401.2129","Zhiyuan Qi","Zhiyuan Qi (1), Zoom Hoang Nguyen (1), Cheol Soo Park (1), Matthew A.
  Glaser (1), Joseph E. Maclennan (1), Noel A. Clark (1), Tatiana Kuriabova (2
  and 3), Thomas R. Powers (2 and 3) ((1) Department of Physics and the Liquid
  Crystal Materials Research Center, University of Colorado, USA, (2) School of
  Engineering, Brown University, Rhode Island, USA, (3) Department of Physics,
  Brown University, Rhode Island, USA)","Mutual diffusion of inclusions in freely-suspended smectic liquid
  crystal films",,"Phys. Rev. Lett. 113, 128304 (2014)","10.1103/PhysRevLett.113.128304",,"cond-mat.soft","http://arxiv.org/licenses/nonexclusive-distrib/1.0/","  We study experimentally and theoretically the hydrodynamic interaction of
pairs of circular inclusions in two-dimensional, fluid smectic membranes
suspended in air. By analyzing their Brownian motion, we find that the radial
mutual mobilities of identical inclusions are independent of their size but
that the angular coupling becomes strongly size-dependent when their radius
exceeds a characteristic hydrodynamic length. The observed dependence of the
mutual mobilities on inclusion size is described well for arbitrary separations
by a model that generalizes the Levine/MacKintosh theory of point-force
response functions and uses a boundary-element approach to calculate the
mobility matrix.
","[{""version"":""v1"",""created"":""Thu, 9 Jan 2014 19:31:21 GMT""}]","2014-09-24"
"1401.2131","Maciej Zapior","Petr Heinzel, Maciej Zapi\'or, Ramon Oliver and Jose Luis Ballester","Synthetic hydrogen spectra of prominence oscillations","9 pages, 6 figures, 2 tables, accepted for publication in Astronomy
  and Astrophysics",,"10.1051/0004-6361/201322346",,"astro-ph.SR","http://arxiv.org/licenses/nonexclusive-distrib/1.0/","  Context. Prominence oscillations have been mostly detected using Doppler
velocity, although there are also claimed detections by means of periodic
variations in half-width or line intensity. However, scarce observational
evidence exists about simultaneous detection of oscillations in several
spectral indicators. Aims. Our main aim here is to explore the relationship
between spectral indicators, such as Doppler shift, line intensity, and line
half-width, and the linear perturbations excited in a simple prominence model.
Methods. Our equilibrium background model consists of a bounded, homogeneous
slab, which is permeated by a transverse magnetic field, having prominence-like
physical properties. Assuming linear perturbations, the dispersion relation for
fast and slow modes has been derived, as well as the perturbations for the
different physical quantities. These perturbations have been used as the input
variables in a one-dimensional radiative transfer code, which calculates the
full spectral profile of the hydrogen H-alpha and H-beta lines. Results. We
have found that different oscillatory modes produce spectral indicator
variations in different magnitudes. Detectable variations in the Doppler
velocity were found for the fundamental slow mode only. Substantial variations
in the H-beta line intensity were found for specific modes. Other modes lead to
lower and even undetectable parameter variations. Conclusions. To perform
prominence seismology, analysis of the H-alpha and H-beta spectral line
parameters could be a good tool to detect and identify oscillatory modes.
","[{""version"":""v1"",""created"":""Thu, 9 Jan 2014 19:34:36 GMT""}]","2015-06-18"
"1401.2132","Gabriel Conant","Gabriel Conant and Caroline Terry","Model theoretic properties of the Urysohn sphere","23 pages, some proofs shortened, appendix added","Ann. Pure Appl. Logic 167 (2016), no. 1, 49-72",,,"math.LO","http://arxiv.org/licenses/nonexclusive-distrib/1.0/","  We characterize model theoretic properties of the Urysohn sphere as a metric
structure in continuous logic. In particular, our first main result shows that
the theory of the Urysohn sphere is $\text{SOP}_n$ for all $n\geq 3$, but does
not have the fully finite strong order property. Our second main result is a
geometric characterization of dividing independence in the theory of the
Urysohn sphere. We further show that this characterization satisfies the
extension axiom, and so forking and dividing are the same for complete types.
Our results require continuous analogs of several tools and notions in
classification theory. While many of these results are undoubtedly known to
researchers in the field, they have not previously appeared in publication.
Therefore, we include a full exposition of these results for general continuous
theories.
","[{""version"":""v1"",""created"":""Thu, 9 Jan 2014 19:35:05 GMT""},{""version"":""v2"",""created"":""Mon, 21 Apr 2014 23:40:35 GMT""},{""version"":""v3"",""created"":""Wed, 8 Apr 2015 19:28:01 GMT""}]","2018-08-17"
"1401.2133","Deniz Olgu Devecioglu","Deniz Olgu Devecioglu","Lifshitz black holes in Einstein-Yang-Mills theory","23 pages, 8 figures; ver 2: added a new reference","Phys. Rev. D 89, 124020 (2014)","10.1103/PhysRevD.89.124020",,"gr-qc hep-th","http://arxiv.org/licenses/nonexclusive-distrib/1.0/","  We find that the four dimensional cosmological Einstein-Yang-Mills theory
with $SU(2)$ gauge group admits Lifshitz spacetime as a base solution for the
dynamical exponent $z>1$. Motivated by this, we next demonstrate numerically
that the field equations admit black hole solutions which behave regularly on
the horizon and at spatial infinity for different horizon topologies. The
solutions depend on one parameter, the strength of the gauge field at the
horizon, which is fine-tuned to capture the Lifshitz asymptotics at infinity.
We also discuss the behavior of solutions and the change in Hawking temperature
for black holes that are large or small with respect to the length scale $L$,
which is itself fixed by the value of the cosmological constant.
","[{""version"":""v1"",""created"":""Thu, 9 Jan 2014 19:36:50 GMT""},{""version"":""v2"",""created"":""Sun, 26 Jan 2014 20:50:36 GMT""}]","2014-06-25"
"1401.2134","Alberto Pepe","Alyssa Goodman, Alberto Pepe, Alexander W. Blocker, Christine L.
  Borgman, Kyle Cranmer, Merc\`e Crosas, Rosanne Di Stefano, Yolanda Gil, Paul
  Groth, Margaret Hedstrom, David W. Hogg, Vinay Kashyap, Ashish Mahabal, Aneta
  Siemiginowska, Aleksandra Slavkovic","10 Simple Rules for the Care and Feeding of Scientific Data","Accepted in PLOS Computational Biology. This paper was written
  collaboratively, on the web, in the open, using Authorea. The living version
  of this article, which includes sources and history, is available at
  http://www.authorea.com/3410/",,"10.1371/journal.pcbi.1003542",,"cs.DL astro-ph.IM cs.CY","http://arxiv.org/licenses/nonexclusive-distrib/1.0/","  This article offers a short guide to the steps scientists can take to ensure
that their data and associated analyses continue to be of value and to be
recognized. In just the past few years, hundreds of scholarly papers and
reports have been written on questions of data sharing, data provenance,
research reproducibility, licensing, attribution, privacy, and more, but our
goal here is not to review that literature. Instead, we present a short guide
intended for researchers who want to know why it is important to ""care for and
feed"" data, with some practical advice on how to do that.
","[{""version"":""v1"",""created"":""Thu, 9 Jan 2014 19:38:17 GMT""}]","2015-06-18"
"1401.2135","Tim Salimans","Tim Salimans","Implementing and Automating Fixed-Form Variational Posterior
  Approximation through Stochastic Linear Regression",,,,,"stat.CO","http://arxiv.org/licenses/nonexclusive-distrib/1.0/","  We recently proposed a general algorithm for approximating nonstandard
Bayesian posterior distributions by minimization of their Kullback-Leibler
divergence with respect to a more convenient approximating distribution. In
this note we offer details on how to efficiently implement this algorithm in
practice. We also suggest default choices for the form of the posterior
approximation, the number of iterations, the step size, and other user choices.
By using these defaults it becomes possible to construct good posterior
approximations for hierarchical models completely automatically.
","[{""version"":""v1"",""created"":""Thu, 9 Jan 2014 19:44:36 GMT""}]","2014-01-10"
"1401.2136","Elias C. Vagenas","Leonardo Balart, Elias C. Vagenas","Regular black hole metrics and the weak energy condition","v1: 11 pages, LaTeX, no figures; v2: typos corrected and one
  reference removed to match published version in Phys. Lett. B","Phys. Lett. B 730 (2014) 14","10.1016/j.physletb.2014.01.024",,"gr-qc","http://arxiv.org/licenses/nonexclusive-distrib/1.0/","  In this work we construct a family of spherically symmetric, static, charged
regular black hole metrics in the context of Einstein-nonlinear electrodynamics
theory. The construction of the charged regular black hole metrics is based on
three requirements: (a) the weak energy condition should be satisfied, (b) the
energy-momentum tensor should have the symmetry $T^{0}_{0}=T^{1}_{1}$, and (c)
these metrics have to asymptotically behave as the Reissner-Nordstr\""{o}m black
hole metric. In addition, these charged regular black hole metrics depend on
two parameters which for specific values yield regular black hole metrics that
already exist in the literature. Furthermore, by relaxing the third
requirement, we construct more general regular black hole metrics which do not
behave asymptotically as a Reissner-Nordstr\""{o}m black hole metric.
","[{""version"":""v1"",""created"":""Thu, 9 Jan 2014 19:54:38 GMT""},{""version"":""v2"",""created"":""Wed, 22 Jan 2014 19:14:07 GMT""}]","2014-01-23"
"1401.2137","Henri Thyrrestrup Dr","Henri Thyrrestrup, Emre Y\""uce, Georgios Ctistis, Julien Claudon,
  Willem L. Vos, Jean-Michel G\'erard","Differential ultrafast all-optical switching of the resonances of a
  micropillar cavity","4 pages, 3 figures","Appl. Phys. Lett. 105 , 111115 (2014)","10.1063/1.4896160",,"physics.optics","http://arxiv.org/licenses/nonexclusive-distrib/1.0/","  We perform frequency- and time-resolved all-optical switching of a GaAs-AlAs
micropillar cavity using an ultrafast pump-probe setup. The switching is
achieved by two-photon excitation of free carriers. We track the cavity
resonances in time with a high frequency resolution. The pillar modes exhibit
simultaneous frequency shifts, albeit with markedly different maximum switching
amplitudes and relaxation dynamics. These differences stem from the
non-uniformity of the free carrier density in the micropillar, and are well
understood by taking into account the spatial distribution of injected free
carriers, their spatial diffusion and surface recombination at micropillar
sidewalls.
","[{""version"":""v1"",""created"":""Thu, 9 Jan 2014 20:00:56 GMT""},{""version"":""v2"",""created"":""Fri, 10 Jan 2014 11:06:18 GMT""},{""version"":""v3"",""created"":""Fri, 4 Jul 2014 21:43:56 GMT""},{""version"":""v4"",""created"":""Wed, 24 Sep 2014 07:35:23 GMT""}]","2014-09-25"
"1401.2138","Xi Chen","Zhen-Su She, Xi Chen, Hong-Yue Zou, Yun Bao, Jun Chen, Fazle Hussain","Prediction of temperature distribution in turbulent Rayleigh-Benard
  convection","5 pages, 3 figures",,,,"physics.flu-dyn","http://arxiv.org/licenses/nonexclusive-distrib/1.0/","  A quantitative theory is developed for the vertical mean temperature profile
(MTP) in turbulent Rayleigh-Benard convection (RBC), which explains the recent
experimental and numerical observations of a logarithmic law by Ahlers et
al.(Phys. Rev. Lett., 2012). A multi-layer model is formulated and quantified,
whose predictions agree with DNS and experimental data for the Rayleigh-number
(Ra) over seven decades. In particular, a thermal buffer layer follows a 1/7
scaling like the previously postulated mixing zone (Procaccia et al, Phys. Rev.
A,1991), and yields a Ra-dependent log law constant. A new parameterization of
Nu(Ra) dependence is proposed, based on the present multi-layer quantification
of the bulk MTP.
","[{""version"":""v1"",""created"":""Thu, 9 Jan 2014 20:04:31 GMT""}]","2014-01-10"
"1401.2139","Alejandro Frery","Mart\'in G\'omez Ravetti and Laura C. Carpi and Bruna Amin
  Gon\c{c}alves and Alejandro C. Frery and Osvaldo A. Rosso","Distinguishing noise from chaos: objective versus subjective criteria
  using Horizontal Visibility Graph","Submitted to PLOS One",,"10.1371/journal.pone.0108004",,"stat.ML cs.IT math.IT nlin.CD","http://arxiv.org/licenses/nonexclusive-distrib/1.0/","  A recently proposed methodology called the Horizontal Visibility Graph (HVG)
[Luque {\it et al.}, Phys. Rev. E., 80, 046103 (2009)] that constitutes a
geometrical simplification of the well known Visibility Graph algorithm [Lacasa
{\it et al.\/}, Proc. Natl. Sci. U.S.A. 105, 4972 (2008)], has been used to
study the distinction between deterministic and stochastic components in time
series [L. Lacasa and R. Toral, Phys. Rev. E., 82, 036120 (2010)].
Specifically, the authors propose that the node degree distribution of these
processes follows an exponential functional of the form $P(\kappa)\sim
\exp(-\lambda~\kappa)$, in which $\kappa$ is the node degree and $\lambda$ is a
positive parameter able to distinguish between deterministic (chaotic) and
stochastic (uncorrelated and correlated) dynamics. In this work, we investigate
the characteristics of the node degree distributions constructed by using HVG,
for time series corresponding to $28$ chaotic maps and $3$ different stochastic
processes. We thoroughly study the methodology proposed by Lacasa and Toral
finding several cases for which their hypothesis is not valid. We propose a
methodology that uses the HVG together with Information Theory quantifiers. An
extensive and careful analysis of the node degree distributions obtained by
applying HVG allow us to conclude that the Fisher-Shannon information plane is
a remarkable tool able to graphically represent the different nature,
deterministic or stochastic, of the systems under study.
","[{""version"":""v1"",""created"":""Thu, 9 Jan 2014 20:08:02 GMT""}]","2019-04-09"
"1401.2140","Hamed Alsulami H","Adel Alahmedi, Hamed Alsulami, Surender Jain, and Efim I. Zelmanov","Structure of Leavitt path algebras of polynomial growth","3 pages","PROCEEDINGS OF THE NATIONAL ACADEMY OF SCIENCES OF THE UNITED
  STATES OF AMERICA Volume: 110 Issue: 38 Pages: 15222-15224 SEP 17 2013","10.1073/pnas.1311216110",,"math.RA","http://arxiv.org/licenses/nonexclusive-distrib/1.0/","  We determine the structure of Leavitt path algebras of polynomial growth and
discuss their automorphisms and involutions.
","[{""version"":""v1"",""created"":""Thu, 9 Jan 2014 20:08:18 GMT""}]","2014-01-10"
"1401.2142","Nathan Wiebe","Nathan Wiebe, Ashish Kapoor, Krysta Svore","Quantum Algorithms for Nearest-Neighbor Methods for Supervised and
  Unsupervised Learning","31 Pages, 15 figures. Comments are welcome!","Quantum Information & Computation 15(3 & 4): 0318-0358 (2015)",,,"quant-ph","http://arxiv.org/licenses/nonexclusive-distrib/1.0/","  We present several quantum algorithms for performing nearest-neighbor
learning. At the core of our algorithms are fast and coherent quantum methods
for computing distance metrics such as the inner product and Euclidean
distance. We prove upper bounds on the number of queries to the input data
required to compute these metrics. In the worst case, our quantum algorithms
lead to polynomial reductions in query complexity relative to the corresponding
classical algorithm. In certain cases, we show exponential or even
super-exponential reductions over the classical analog. We study the
performance of our quantum nearest-neighbor algorithms on several real-world
binary classification tasks and find that the classification accuracy is
competitive with classical methods.
","[{""version"":""v1"",""created"":""Thu, 9 Jan 2014 20:28:06 GMT""},{""version"":""v2"",""created"":""Fri, 18 Jul 2014 20:50:49 GMT""}]","2014-12-12"
