"1401.2206","Iek-Heng Chu","Iek-Heng Chu, Jonathan Trinastic, Lin-Wang Wang, and Hai-Ping Cheng","Using Light-Switching Molecules to Modulate Charge Mobility in a Quantum
  Dot Array","8 pages, 3 figures","Phys. Rev. B 89, 115415 (2014)","10.1103/PhysRevB.89.115415",,"cond-mat.mtrl-sci","http://arxiv.org/licenses/nonexclusive-distrib/1.0/","  We have studied the electron hopping in a two-CdSe quantum dot system linked
by an azobenzene-derived light-switching molecule. This system can be
considered as a prototype of a QD supercrystal. Following the computational
strategies given in our recent work [Chu et al. J. Phys. Chem. C 115, 21409
(2011)], we have investigated the effects of molecular attachment, molecular
isomer (trans and cis) and QD size on electron hopping rate using Marcus
theory. Our results indicate that molecular attachment has a large impact on
the system for both isomers. In the most energetically favorable attachment,
the cis isomer provides significantly greater coupling between the two QDs and
hence the electron hopping rate is greater compared to the trans isomer. As a
result, the carrier mobility of the QD array in the low carrier density, weak
external electric field regime is several orders of magnitude higher in the cis
compared to the trans configuration. This is the first demonstration of
mobility modulation using QDs and azobenzene that could lead to a new type of
switching device.
","[{""version"":""v1"",""created"":""Thu, 9 Jan 2014 23:35:48 GMT""}]","2014-03-17"
"1401.2207","Chan Y. Park","Chan Y. Park","2d SCFT from M-branes and its spectral network","10 pages, 26 figures, contribution to the Proceedings of String-Math
  2013; v2: minor changes, version to appear in the proceedings",,,,"hep-th","http://arxiv.org/licenses/nonexclusive-distrib/1.0/","  We consider the low-energy limit of the two-dimensional theory on multiple
M2-branes suspended between a flat M5-brane and a curved M5-brane. We argue
that it is described by an $\mathcal{N}=(2,2)$ supersymmetric Landau-Ginzburg
model with the superpotential determined by the shape of the curved M5-branes,
which flows in the low-energy limit to a Kazama-Suzuki coset model. We provide
evidence by studying ground states and BPS spectra of the systems.
","[{""version"":""v1"",""created"":""Thu, 9 Jan 2014 23:48:48 GMT""},{""version"":""v2"",""created"":""Mon, 5 May 2014 07:25:18 GMT""}]","2014-05-06"
"1401.2208","Clarissa Campanella","Clarissa Martina Campanella","Optical Biochemical Platforms for Nanoparticles Detection","PhD Thesis",,,,"physics.optics","http://arxiv.org/licenses/nonexclusive-distrib/1.0/","  In the biochemical sensing field, a fervent research activity related to the
development of real time, low cost, compact and high throughput devices for the
detection and characterization of natural or synthetic nanoparticles NPs
actually exists. In this research scenario, different platforms for biosensing
purposes have been developed according to the huge amount of physical effects
involved in the transduction of the biochemical-signal into a measurable output
signal. In the present work two different optical platforms for NP detection
have been investigated, one based on integrated optics and the other based on
microscopy. Both the approaches rely on the study of the interaction of an
electromagnetic wave with a small particle in the hypothesis of dealing with a
Rayleigh scatterer, i.e. a nanoparticle having a size really smaller than the
one of the wavelength of the incident light and scattering light elastically.
","[{""version"":""v1"",""created"":""Thu, 9 Jan 2014 23:59:02 GMT""}]","2014-01-13"
"1401.2209","Te-Yuan Huang","Te-Yuan Huang and Ramesh Johari and Nick McKeown and Matthew Trunnell
  and Mark Watson","Using the Buffer to Avoid Rebuffers: Evidence from a Large Video
  Streaming Service",,,,,"cs.NI","http://arxiv.org/licenses/nonexclusive-distrib/1.0/","  To provide a better streaming experience, video clients today select their
video rates by observing and estimating the available capacity. Recent work has
shown that capacity estimation is fraught with difficulties because of complex
interactions between the ABR control loop, HTTP server performance and TCP
congestion control. Estimation-based rate selection algorithms can lead to
unnecessary rebuffering events and suboptimal video quality. This paper argues
that we should do away with estimating network capacity, and instead directly
observe and control the playback buffer--which is the state variable we are
most interested in controlling. We present a class of ""buffer-based"" rate
selection algorithms that reduce the rebuffering rate while allowing us to
control the delivered video quality. We implemented our algorithms inside the
Netflix video client and ran a series of experiments spanning millions of
Netflix users around the world. Our results show that by doing away with
estimating network capacity and instead focusing on buffer occupancy, we can
reduce rebuffer rates by 20% while holding video rate constant.
","[{""version"":""v1"",""created"":""Fri, 10 Jan 2014 00:02:56 GMT""}]","2014-01-13"
"1401.2210","Giuseppe Zampieri","Luca Baracco, Stefano Pinton and Giuseppe Zampieri","Hypoellipticity of the $\bar\partial$-Neumann problem by means of
  subelliptic multipliers",,,,,"math.CV","http://arxiv.org/licenses/nonexclusive-distrib/1.0/","  We prove local hypoellipticity of the complex Laplacian $\Box$ and of the
Kohn Laplacian $\Box_b$ in a pseudoconvex boundary when, for a system of
cut-off $\eta$, the gradient $\partial_b\eta$ and the Levi form
$\partial_b\bar\partial_b\eta^2$ are subelliptic multipliers in the sense of
Kohn.
","[{""version"":""v1"",""created"":""Fri, 10 Jan 2014 00:10:39 GMT""}]","2014-01-13"
"1401.2211","Rolando Cardenas","Antolin Gonzalez, Rolando Cardenas and John Hearnshaw","Possibilities of life around Alpha Centauri B",,"Rev. Cub. Fis. 30, 81 (2013)",,,"astro-ph.EP q-bio.OT","http://arxiv.org/licenses/nonexclusive-distrib/1.0/","  We make a preliminary assessment on the habitability of potential rocky
exoplanets around Alpha Centauri B. We use several indexes: the Earth
Similarity Index, a mathematical model for photosynthesis, and a biological
productivity model. Considering the atmospheres of the exoplanets similar to
current Earth's atmosphere, we find consistent predictions of both the Earth
Similarity Index and the biological productivity model. The mathematical model
for photosynthesis clearly failed because does not consider the temperature
explicitly. For the case of Alpha Centauri B, several simulation runs give 11
planets in the habitable zone. Applying to them above mentioned indexes, we
select the five exoplanets more prone for photosynthetic life; showing that two
of them in principle have better conditions than Earth for this kind of life.
","[{""version"":""v1"",""created"":""Fri, 10 Jan 2014 00:29:54 GMT""}]","2014-01-13"
"1401.2212","Tomohiro Otsuka","Tatsuki Takakura, Akito Noiri, Toshiaki Obata, Tomohiro Otsuka, Jun
  Yoneda, Katsuharu Yoshida, and Seigo Tarucha","Single to quadruple quantum dots with tunable tunnel couplings","6 pages, 4 figures","Appl. Phys. Lett. 104, 113109 (2014)","10.1063/1.4869108",,"cond-mat.mes-hall","http://arxiv.org/licenses/nonexclusive-distrib/1.0/","  We prepare a gate-defined quadruple quantum dot to study the gate-tunability
of single to quadruple quantum dots with finite inter-dot tunnel couplings. The
measured charging energies of various double dots suggest that the dot size is
governed by gate geometry. For the triple and quadruple dots we study
gate-tunable inter-dot tunnel couplings. Particularly for the triple dot we
find that the effective tunnel coupling between side dots significantly depends
on the alignment of the center dot potential. These results imply that the
present quadruple dot device has gate performance relevant for implementing
spin-based four-qubit systems with controllable exchange couplings.
","[{""version"":""v1"",""created"":""Fri, 10 Jan 2014 00:40:02 GMT""}]","2014-03-21"
"1401.2213","Bojan Mohar","Ararat Harutyunyan and Bojan Mohar","Planar digraphs of digirth five are 2-colorable","25 pages",,,,"math.CO","http://arxiv.org/licenses/nonexclusive-distrib/1.0/","  Neumann-Lara (1985) and \v{S}krekovski conjectured that every planar digraph
with digirth at least three is 2-colorable. We prove a relaxed version of this
conjecture: every planar digraph of digirth at least five is 2-colorable. The
result also holds in the setting of list colorings.
","[{""version"":""v1"",""created"":""Fri, 10 Jan 2014 00:43:46 GMT""}]","2014-01-13"
"1401.2214","Zhao Wu","Z. Wu, Y. Chen, G. Li, L. L. Zhao, R. W. Ebert, M. I. Desai, G. M.
  Mason, B. Lavraud, L. Zhao, Y. C.-M. Liu, F. Guo, C. L. Tang, E. Landi, J.
  Sauvaud","Observation of Energetic particles between a pair of Corotating
  Interaction Regions",,,"10.1088/0004-637X/781/1/17",,"astro-ph.SR physics.space-ph","http://arxiv.org/licenses/nonexclusive-distrib/1.0/","  We report observations of the acceleration and trapping of energetic ions and
electrons between a pair of corotating interaction regions (CIRs). The event
occurred in Carrington Rotation 2060. Observed at spacecraft STEREO-B, the two
CIRs were separated by less than 5 days. In contrast to other CIR events, the
fluxes of energetic ions and electrons in this event reached their maxima
between the trailing-edge of the first CIR and the leading edge of the second
CIR. The radial magnetic field (Br) reversed its sense and the anisotropy of
the flux also changed from sunward to anti-sunward between the two CIRs.
Furthermore, there was an extended period of counter-streaming suprathermal
electrons between the two CIRs. Similar observations for this event were also
obtained for ACE and STEREO-A. We conjecture that these observations were due
to a ""U-shape"" large scale magnetic field topology connecting the reverse shock
of the first CIR and the forward shock of the second CIR. Such a disconnected
U-shaped magnetic field topology may have formed due to magnetic reconnection
in the upper corona.
","[{""version"":""v1"",""created"":""Fri, 10 Jan 2014 01:12:35 GMT""}]","2014-01-13"
"1401.2215","Qiang Zhang","Jianchun Wu and Qiang Zhang","The group fixed by a family of endomorphisms of a surface group","16 pages","Journal of Algebra, 417(2014), 412-432","10.1016/j.jalgebra.2014.07.003",,"math.GR math.GT","http://arxiv.org/licenses/nonexclusive-distrib/1.0/","  For a closed surface $S$ with $\chi(S)<0$, we show that the fixed subgroup of
a family $\mathcal B$ of endomorphisms of $\pi_1(S)$ has $\rk \fix\mathcal
B\leq \rk \pi_1(S)$. In particular, if $\mathcal B$ contains a non-epimorphic
endomorphism, then $\rk \fix\mathcal B\leq \frac{1}{2} \rk \pi_1(S)$. We also
show that geometric subgroups of $\pi_1(S)$ are inert, and hence the fixed
subgroup of a family of epimorphisms of $\pi_1(S)$ is also inert.
","[{""version"":""v1"",""created"":""Fri, 10 Jan 2014 01:47:39 GMT""},{""version"":""v2"",""created"":""Tue, 21 Jan 2014 01:58:28 GMT""}]","2019-06-24"
"1401.2216","Dafeng Zuo Dr.","Dafeng Zuo","Local matrix generalizations of $W$-algebras","We will rewrite this paper by considering general cases",,,,"math-ph math.MP","http://arxiv.org/licenses/nonexclusive-distrib/1.0/","  In this paper, we propose local matrix generalizations of the classical
$W$-algebras based on the second Hamiltonian structure of the
$\mathcal{Z}_m$-valued KP hierarchy, where $\mathcal{Z}_m$ is a maximal
commutative subalgebra of $gl(m,\mathbb{C})$.
","[{""version"":""v1"",""created"":""Fri, 10 Jan 2014 02:07:02 GMT""},{""version"":""v2"",""created"":""Fri, 13 Mar 2015 15:52:22 GMT""}]","2015-03-16"
"1401.2217","Dustin Ross","Dustin Ross and Zhengyu Zong","Cyclic Hodge Integrals and Loop Schur Functions","29 pages, 2 figures",,,,"math.AG math-ph math.CO math.MP","http://arxiv.org/licenses/nonexclusive-distrib/1.0/","  We conjecture an evaluation of three-partition cyclic Hodge integrals in
terms of loop Schur functions. Our formula implies the orbifold
Gromov-Witten/Donaldson-Thomas correspondence for toric Calabi-Yau threefolds
with transverse type A singularities. We prove the formula in the case where
one of the partitions is empty, and thus establish the orbifold Gromov-
Witten/Donaldson-Thomas correspondence for local toric surfaces with transverse
type A singularities.
","[{""version"":""v1"",""created"":""Fri, 10 Jan 2014 02:37:03 GMT""}]","2014-01-13"
"1401.2218","Jing Shi","Raymond Sachs, Zhisheng Lin, Patrick Odenthal, Roland Kawakami, and
  Jing Shi","Direct comparison of graphene devices before and after transfer to
  different substrates",,,"10.1063/1.4862063",,"cond-mat.mes-hall","http://arxiv.org/licenses/nonexclusive-distrib/1.0/","  The entire graphene field-effect-transistor (FET) devices first fabricated on
SiO2/Si are peeled from the surface and placed on a different wafer. Both
longitudinal and transverse resistivity measurements of the devices before and
after the transfer are measured to calculate the mobility for a direct
comparison. After transferred to different SiO2/Si wafers, the mobility
generally is comparable and the defect density does not show any significant
increase, which indicates the degradation due to the transfer process itself is
minimal. The same method can be applied to transfer graphene devices to any
arbitrary substrates (e.g. SrTiO3 or STO). The transfer method developed here
not only eliminates the need to locate single-layer graphene on non-SiO2/Si
substrates for patterning, but also provides a convenient way to study the
effects of various substrates on graphene electronic properties.
","[{""version"":""v1"",""created"":""Fri, 10 Jan 2014 02:44:17 GMT""}]","2015-06-18"
"1401.2219","Ruben Krasnopolsky","Zhi-Yun Li, Robi Banerjee, Ralph E. Pudritz, Jes K. J{\o}rgensen,
  Hsien Shang, Ruben Krasnopolsky, Ana\""elle Maury","The Earliest Stages of Star and Planet Formation: Core Collapse, and the
  Formation of Disks and Outflows","Accepted for publication as a chapter in Protostars and Planets VI,
  University of Arizona Press (2014), eds. H. Beuther, R. Klessen, C.
  Dullemond, Th. Henning",,"10.2458/azu_uapress_9780816531240-ch008",,"astro-ph.SR","http://arxiv.org/licenses/nonexclusive-distrib/1.0/","  (Abridged) In this review we focus on the observations and theory of the
formation of early disks and outflows, and their connections with the first
phases of planet formation. Large rotationally supported circumstellar disks,
although common around more evolved young stellar objects, are rarely detected
during the earliest, ""Class 0"" phase; however, a few excellent candidates have
been discovered recently around both low and high mass protostars. In this
early phase, prominent outflows are ubiquitously observed; they are expected to
be associated with at least small magnetized disks. Disk formation - once
thought to be a simple consequence of the conservation of angular momentum
during hydrodynamic core collapse - is far more subtle in magnetized gas. In
this case, the rotation can be strongly magnetically braked. Indeed, both
analytic arguments and numerical simulations have shown that disk formation is
suppressed in the strict ideal magnetohydrodynamic (MHD) limit for the observed
level of core magnetization. We review what is known about this ""magnetic
braking catastrophe"", possible ways to resolve it, and the current status of
early disk observations. Outflows are also intimately linked to disk formation;
they are a natural product of magnetic fields and rotation and are important
signposts of star formation. We review new developments on early outflow
generation since PPV. The properties of early disks and outflows are a key
component of planet formation in its early stages and we review these major
connections.
","[{""version"":""v1"",""created"":""Fri, 10 Jan 2014 02:51:17 GMT""}]","2015-06-18"
"1401.2220","Pascal Giard","Georges Kaddoum and Pascal Giard","Analog Network Coding for Multi-User Spread-Spectrum Communication
  Systems","6 pages, 2 figures, to appear at IEEE WCNC'14",,"10.1109/WCNC.2014.6952033",,"cs.IT math.IT","http://arxiv.org/licenses/nonexclusive-distrib/1.0/","  This work presents another look at an analog network coding scheme for
multi-user spread-spectrum communication systems. Our proposed system combines
coding and cooperation between a relay and users to boost the throughput and to
exploit interference. To this end, each pair of users, $\mathcal{A}$ and
$\mathcal{B}$, that communicate with each other via a relay $\mathcal{R}$
shares the same spreading code. The relay has two roles, it synchronizes
network transmissions and it broadcasts the combined signals received from
users. From user $\mathcal{B}$'s point of view, the signal is decoded, and
then, the data transmitted by user $\mathcal{A}$ is recovered by subtracting
user $\mathcal{B}$'s own data. We derive the analytical performance of this
system for an additive white Gaussian noise channel with the presence of
multi-user interference, and we confirm its accuracy by simulation.
","[{""version"":""v1"",""created"":""Fri, 10 Jan 2014 03:06:12 GMT""}]","2015-12-25"
"1401.2221","Bin Ren Mr.","Bin Ren, Taotao Fang, David A. Buote","X-Ray Absorption by the Warm-Hot Intergalactic Medium in the Hercules
  Supercluster","5 pages, 2 figures, 2 tables, Accepted for publication on ApJ Letters",,"10.1088/2041-8205/782/1/L6",,"astro-ph.CO astro-ph.HE","http://arxiv.org/licenses/nonexclusive-distrib/1.0/","  The ""missing baryons"", in the form of warm-hot intergalactic medium (WHIM),
are expected to reside in cosmic filamentary structures that can be traced by
signposts such as large-scale galaxy superstructures. The clear detection of an
X-ray absorption line in the Sculptor Wall demonstrated the success of using
galaxy superstructures as a signpost to search for the WHIM. Here we present an
XMM-Newton Reflection Grating Spectrometer (RGS) observation of the blazar Mkn
501, located in the Hercules Supercluster. We detected an O VII K$\alpha$
absorption line at the 98.7 % level ($2.5\sigma$) at the redshift of the
foreground Hercules Supercluster. The derived properties of the absorber are
consistent with theoretical expectations of the WHIM. We discuss the
implication of our detection for the search for the ""missing baryons"". While
this detection shows again that using signposts is a very effective strategy to
search for the WHIM, follow-up observations are crucial both to strengthen the
statistical significance of the detection and to rule out other
interpretations. A local, $z\sim0$ O VII K$\alpha$ absorption line was also
clearly detected at the $4\sigma$ level, and we discuss its implications for
our understanding of the hot gas content of our Galaxy.
","[{""version"":""v1"",""created"":""Fri, 10 Jan 2014 03:08:05 GMT""}]","2015-06-18"
"1401.2222","Jing Shi","Ray Sachs, Zhisheng Lin, and Jing Shi","Ferroelectric-like SrTiO3 surface dipoles probed by graphene",,"Scientific Reports 4, 3657 (2014)","10.1038/srep03657",,"cond-mat.mes-hall cond-mat.mtrl-sci","http://arxiv.org/licenses/nonexclusive-distrib/1.0/","  The electrical transport properties of graphene are greatly influenced by its
environment. Owing to its high dielectric constant, strontium titanate (STO) is
expected to suppress the long-range charged impurity scattering and
consequently to enhance the mobility. However, the absence of such enhancement
has caused some controversies regarding the scattering mechanism. In graphene
devices transferred from SiO2 to STO using a newly developed technique, we
observe a moderate mobility enhancement near the Dirac point, which is the
point of charge neutrality achieved by adjusting the Fermi level. While bulk
STO is not known as a ferroelectric material, its surface was previously
reported to exhibit an outward displacement of oxygen atoms and
ferroelectric-like dipole moment. When placed on STO, graphene shows strong and
asymmetric hysteresis in resistivity, which is consistent with the dipole
picture associated with the oxygen displacement. The hysteretic response of the
surface dipole moment diminishes the polarizability, therefore weakens the
ability of STO to screen the Coulomb potential of the impurities.
","[{""version"":""v1"",""created"":""Fri, 10 Jan 2014 03:27:13 GMT""}]","2014-12-04"
"1401.2223","Adam Schaefer","Adam Schaefer, Richard Hunstead, Helen Johnston","How accurate are SuperCOSMOS positions?","6 pages, 5 figures. Accepted for publication in PASA",,"10.1017/pasa.2014.4",,"astro-ph.IM","http://arxiv.org/licenses/nonexclusive-distrib/1.0/","  Optical positions from the SuperCOSMOS Sky Survey have been compared in
detail with accurate radio positions that define the second realisation of the
International Celestial Reference Frame (ICRF2). The comparison was limited to
the IIIaJ plates from the UK/AAO and Oschin (Palomar) Schmidt telescopes. A
total of 1373 ICRF2 sources was used, with the sample restricted to stellar
objects brighter than $B_J=20$ and Galactic latitudes $|b|>10^{\circ}$.
Position differences showed an rms scatter of $0.16''$ in right ascension and
declination. While overall systematic offsets were $<0.1''$ in each hemisphere,
both the systematics and scatter were greater in the north.
","[{""version"":""v1"",""created"":""Fri, 10 Jan 2014 03:35:21 GMT""}]","2015-06-18"
"1401.2224","Alireza Goudarzi","Alireza Goudarzi, Peter Banda, Matthew R. Lakin, Christof Teuscher,
  Darko Stefanovic","A Comparative Study of Reservoir Computing for Temporal Signal
  Processing",,,,,"cs.NE cs.LG","http://arxiv.org/licenses/nonexclusive-distrib/1.0/","  Reservoir computing (RC) is a novel approach to time series prediction using
recurrent neural networks. In RC, an input signal perturbs the intrinsic
dynamics of a medium called a reservoir. A readout layer is then trained to
reconstruct a target output from the reservoir's state. The multitude of RC
architectures and evaluation metrics poses a challenge to both practitioners
and theorists who study the task-solving performance and computational power of
RC. In addition, in contrast to traditional computation models, the reservoir
is a dynamical system in which computation and memory are inseparable, and
therefore hard to analyze. Here, we compare echo state networks (ESN), a
popular RC architecture, with tapped-delay lines (DL) and nonlinear
autoregressive exogenous (NARX) networks, which we use to model systems with
limited computation and limited memory respectively. We compare the performance
of the three systems while computing three common benchmark time series:
H{\'e}non Map, NARMA10, and NARMA20. We find that the role of the reservoir in
the reservoir computing paradigm goes beyond providing a memory of the past
inputs. The DL and the NARX network have higher memorization capability, but
fall short of the generalization power of the ESN.
","[{""version"":""v1"",""created"":""Fri, 10 Jan 2014 03:39:28 GMT""}]","2014-01-13"
"1401.2225","Joel Kamnitzer","Joel Kamnitzer","A combinatorial geometric Satake equivalence",,,,,"math.RT","http://arxiv.org/licenses/nonexclusive-distrib/1.0/","  The geometric Satake correspondence provides an equivalence of categories
between the Satake category of spherical perverse sheaves on the affine
Grassmannian and the category of representations of the dual group. In this
note, we define a combinatorial version of the Satake category using
irreducible components of fibres of the convolution morphism. We then prove an
equivalence of coboundary categories between this combinatorial Satake category
and the category of crystals of the dual group.
","[{""version"":""v1"",""created"":""Fri, 10 Jan 2014 03:51:43 GMT""}]","2014-01-13"
"1401.2226","Seokcheon Lee","Seokcheon Lee","Lagrangian perturbations theory : Third-order solution for general dark
  energy models","25 pages, 12 figures, To match the version accepted by Physical
  Review D","Phys. Rev. D 89, 084017 (2014)","10.1103/PhysRevD.89.084017","KIAS-P14002","astro-ph.CO gr-qc","http://arxiv.org/licenses/nonexclusive-distrib/1.0/","  We investigate the Lagrangian perturbation theory of a general dark energy
models with a constant equation of state, \omega, and derive the fitting form
of the fastest growing mode solutions up to the third order. These fitting
forms are less than few % errors compared to the numerical calculation. We also
correct the solutions of Einstein-de Sitter and the open universe with the
proper initial conditions and the correct consideration for the growing mode
solutions in order to compare with the general dark energy models. Even though
these fitting forms are limited to the constant equation of state models, one
can apply these to the time-varying \omega by interpolating between models with
the constant \omega. These fitting forms can be used for the correct prediction
for the two point correlation function and can give the proper predictions for
the different dark energy models.
","[{""version"":""v1"",""created"":""Fri, 10 Jan 2014 04:12:31 GMT""},{""version"":""v2"",""created"":""Mon, 10 Mar 2014 02:25:11 GMT""}]","2014-04-16"
"1401.2227","Yi-Zheng Fan","Jing Xu, Yi-Zheng Fan, Ying-Ying Tan","Lower bounds for algebraic connectivity of graphs in terms of matching
  number or edge covering number","arXiv admin note: substantial text overlap with arXiv:1310.8533","ARS COMBINATORIA, 2016, 125: 361-370",,,"math.CO","http://arxiv.org/licenses/nonexclusive-distrib/1.0/","  In this paper we characterize the unique graph whose algebraic connectivity
is minimum among all connected graphs with given order and fixed matching
number or edge covering number, and present two lower bounds for the algebraic
connectivity in terms of the matching number or edge covering number.
","[{""version"":""v1"",""created"":""Fri, 10 Jan 2014 04:13:58 GMT""}]","2017-09-07"
