"1401.7165","Surjya Ram","S. P. Ram, S. R. Mishra, S. K. Tiwari and H. S. Rawat","Temperature and phase-space density of cold atom cloud in a quadrupole
  magnetic trap","9 pages, 7 figures",,"10.3938/jkps.65.462",,"physics.atom-ph","http://arxiv.org/licenses/nonexclusive-distrib/1.0/","  We present studies on the modifications in temperature, number density and
phase-space density when a laser cooled atom cloud from the optical molasses is
trapped in a quadrupole magnetic trap. Theoretically it is shown that for a
given temperature and size of the cloud from the molasses, the phase-space
density in the magnetic trap first increases with magnetic field gradient and
then decreases with it, after attaining a maximum value at an optimum value of
magnetic field gradient. The experimentally measured variation in phase-space
density in the magnetic trap with the magnetic field gradient has shown the
similar trend. However, the experimentally measured values of number density
and phase-space density are much lower than their theoretically predicted
values. This is attributed to the higher experimentally observed temperature in
the magnetic trap than the theoretically predicted temperature. Nevertheless,
these studies can be useful to set a higher phase-space density in the trap by
setting the optimum value of field gradient of the quadrupole magnetic trap.
","[{""version"":""v1"",""created"":""Tue, 28 Jan 2014 13:08:06 GMT""},{""version"":""v2"",""created"":""Tue, 10 Jun 2014 04:57:25 GMT""}]","2015-06-18"
"1401.7166","Martin Lemoine","M. Lemoine (IAP), G. Pelletier (IPAG), L. Gremillet (CEA/DAM/DIF), I.
  Plotnikov (IPAG)","Current-driven filamentation upstream of magnetized relativistic
  collisionless shocks","14 pages, 8 figures; to appear in MNRAS",,"10.1093/mnras/stu213",,"astro-ph.HE astro-ph.CO physics.plasm-ph","http://arxiv.org/licenses/nonexclusive-distrib/1.0/","  The physics of instabilities in the precursor of relativistic collisionless
shocks is of broad importance in high energy astrophysics, because these
instabilities build up the shock, control the particle acceleration process and
generate the magnetic fields in which the accelerated particles radiate. Two
crucial parameters control the micro-physics of these shocks: the magnetization
of the ambient medium and the Lorentz factor of the shock front; as of today,
much of this parameter space remains to be explored. In the present paper, we
report on a new instability upstream of electron-positron relativistic shocks
and we argue that this instability shapes the micro-physics at moderate
magnetization levels and/or large Lorentz factors. This instability is seeded
by the electric current carried by the accelerated particles in the shock
precursor as they gyrate around the background magnetic field. The compensation
current induced in the background plasma leads to an unstable configuration,
with the appearance of charge neutral filaments carrying a current of the same
polarity, oriented along the perpendicular current. This ``current-driven
filamentation'' instability grows faster than any other instability studied so
far upstream of relativistic shocks, with a growth rate comparable to the
plasma frequency. Furthermore, the compensation of the current is associated
with a slow-down of the ambient plasma as it penetrates the shock precursor (as
viewed in the shock rest frame). This slow-down of the plasma implies that the
``current driven filamentation'' instability can grow for any value of the
shock Lorentz factor, provided the magnetization \sigma <~ 10^{-2}. We argue
that this instability explains the results of recent particle-in-cell
simulations in the mildly magnetized regime.
","[{""version"":""v1"",""created"":""Tue, 28 Jan 2014 13:11:18 GMT""}]","2015-06-18"
"1401.7167","Samyadeb Bhattacharya","Samyadeb Bhattacharya and Sisir Roy","Preservation of coherence for a Two-Level atom tunneling through a
  squeezed vacuum with finite bandwidth","5 pages, no figures, accepted for publication in Annals of Physics","Annals of Physics, volume 348, page 15 (2014)","10.1016/j.aop.2014.05.007",,"quant-ph","http://arxiv.org/licenses/nonexclusive-distrib/1.0/","  Tunneling of a two-state particle through a squeezed vacuum is considered. It
has been shown that repetitive measurement or interaction with the external
field can preserve the coherence. Moreover, the coherence time in terms of the
squeezing parameters has been calculated. A specific condition is derived,
under which the coherence is sustainable.
","[{""version"":""v1"",""created"":""Tue, 28 Jan 2014 13:14:48 GMT""},{""version"":""v2"",""created"":""Wed, 14 May 2014 06:57:36 GMT""}]","2015-06-18"
"1401.7168","Pascal Viot","Julien-Piera Vest, Gilles Tarjus and Pascal Viot","Dynamics of a monodisperse Lennard-Jones system on a sphere","10 oages, 5 figures",,"10.1080/00268976.2014.901568",,"cond-mat.stat-mech cond-mat.soft","http://arxiv.org/licenses/nonexclusive-distrib/1.0/","  We investigate by Molecular Dynamics simulation a system of $N$ particles
moving on the surface of a two-dimensional sphere and interacting by a
Lennard-Jones potential. We detail the way to account for the changes brought
by a nonzero curvature, both at a methodological and at a physical level. When
compared to a two-dimensional Lennard-Jones liquid on the Euclidean plane,
where a phase transition to an ordered hexagonal phase takes place, we find
that the presence of excess defects imposed by the topology of the sphere
frustrates the hexagonal order. We observe at high density a rapid increase of
the relaxation time when the temperature is decreased, whereas in the same
range of temperature the pair correlation function of the system evolves only
moderately.
","[{""version"":""v1"",""created"":""Tue, 28 Jan 2014 13:15:42 GMT""}]","2015-06-18"
"1401.7169","Tomaso Erseghe","Tomaso Erseghe","On the Evaluation of the Polyanskiy-Poor-Verdu Converse Bound for Finite
  Blocklength Coding in AWGN","13 pages, 10 figures. Matlab code available from
  http://dgt.dei.unipd.it section Download->Finite Blocklength Regime","IEEE Transactions on Information Theory, Vol. 61, No. 12, pp.
  6578-6590, December 2015","10.1109/TIT.2015.2494061",,"cs.IT math.IT","http://arxiv.org/licenses/nonexclusive-distrib/1.0/","  A tight converse bound to channel coding rate in the finite block-length
regime and under AWGN conditions was recently proposed by Polyanskiy, Poor, and
Verdu (PPV). The bound is a generalization of a number of other classical
results, and it was also claimed to be equivalent to Shannon's 1959 cone
packing bound. Unfortunately, its numerical evaluation is troublesome even for
not too large values of the block-length n. In this paper we tackle the
numerical evaluation by compactly expressing the PPV converse bound in terms of
non-central chi-squared distributions, and by evaluating those through a an
integral expression and a corresponding series expansion which exploit a method
proposed by Temme. As a result, a robust evaluation method and new insights on
the bound's asymptotics, as well as new approximate expressions, are given.
","[{""version"":""v1"",""created"":""Tue, 28 Jan 2014 13:19:53 GMT""},{""version"":""v2"",""created"":""Mon, 18 May 2015 12:16:37 GMT""},{""version"":""v3"",""created"":""Wed, 15 Jun 2016 13:21:20 GMT""}]","2016-06-16"
"1401.7170","Enrico Onali Dr","John Goddard, Enrico Onali","Self-affinity in financial asset returns",,"International Review of Financial Analysis 24, 2012, 1 11","10.1016/j.irfa.2012.06.004",,"q-fin.ST","http://arxiv.org/licenses/nonexclusive-distrib/1.0/","  We test for departures from normal and independent and identically
distributed (NIID) returns, when returns under the alternative hypothesis are
self-affine. Self-affine returns are either fractionally integrated and
long-range dependent, or drawn randomly from an L-stable distribution with
infinite higher-order moments. The finite sample performance of estimators of
the two forms of self-affinity is explored in a simulation study which
demonstrates that, unlike rescaled range analysis and other conventional
estimation methods, the variant of fluctuation analysis that considers finite
sample moments only is able to identify either form of self-affinity. However,
when returns are self-affine and long-range dependent under the alternative
hypothesis, rescaled range analysis has greater power than fluctuation
analysis. The finite-sample properties of the estimators when returns exhibit
either form of self-affinity can be exploited to determine the source of
self-affinity in empirical returns data. The techniques are illustrated by
means of an analysis of the fractal properties of the daily logarithmic returns
for the indices of 11 stock markets.
","[{""version"":""v1"",""created"":""Tue, 28 Jan 2014 13:20:21 GMT""}]","2014-01-29"
"1401.7171","Lei Song","Joost-Pieter Katoen and Lei Song and Lijun Zhang","Probably Safe or Live",,,,,"cs.LO","http://arxiv.org/licenses/nonexclusive-distrib/1.0/","  This paper presents a formal characterisation of safety and liveness
properties \`a la Alpern and Schneider for fully probabilistic systems. As for
the classical setting, it is established that any (probabilistic tree) property
is equivalent to a conjunction of a safety and liveness property. A simple
algorithm is provided to obtain such property decomposition for flat
probabilistic CTL (PCTL). A safe fragment of PCTL is identified that provides a
sound and complete characterisation of safety properties. For liveness
properties, we provide two PCTL fragments, a sound and a complete one. We show
that safety properties only have finite counterexamples, whereas liveness
properties have none. We compare our characterisation for qualitative
properties with the one for branching time properties by Manolios and Trefler,
and present sound and complete PCTL fragments for characterising the notions of
strong safety and absolute liveness coined by Sistla.
","[{""version"":""v1"",""created"":""Tue, 28 Jan 2014 13:22:25 GMT""},{""version"":""v2"",""created"":""Fri, 16 May 2014 10:34:19 GMT""}]","2014-05-19"
"1401.7172","Helmut Friedrich","Helmut Friedrich","On the AdS stability problem","12 pages",,"10.1088/0264-9381/31/10/105001",,"gr-qc","http://arxiv.org/licenses/nonexclusive-distrib/1.0/","  We discuss the notion of stability and the choice of boundary conditions for
AdS-type space-times and point out difficulties in the construction of Cauchy
data which arise if reflective boundary conditions are imposed.
","[{""version"":""v1"",""created"":""Tue, 28 Jan 2014 13:24:37 GMT""}]","2015-06-18"
"1401.7173","Felix Schindler","Mario Ohlberger and Felix Schindler","A-posteriori error estimates for the localized reduced basis multi-scale
  method",,"in Finite Volumes for Complex Applications VII-Methods and
  Theoretical Aspects, vol. 77 of Springer Proceedings in Mathematics &
  Statistics, 2014, pp. 421-429","10.1007/978-3-319-05684-5_41",,"math.NA","http://arxiv.org/licenses/nonexclusive-distrib/1.0/","  We present a localized a-posteriori error estimate for the localized reduced
basis multi-scale (LRBMS) method [Albrecht, Haasdonk, Kaulmann, Ohlberger
(2012): The localized reduced basis multiscale method]. The LRBMS is a
combination of numerical multi-scale methods and model reduction using reduced
basis methods to efficiently reduce the computational complexity of parametric
multi-scale problems with respect to the multi-scale parameter $\varepsilon$
and the online parameter $\mu$ simultaneously. We formulate the LRBMS based on
a generalization of the SWIPDG discretization presented in [Ern, Stephansen,
Vohralik (2010): Guaranteed and robust discontinuous Galerkin a posteriori
error estimates for convection-diffusion-reaction problems] on a coarse
partition of the domain that allows for any suitable discretization on the fine
triangulation inside each coarse grid element. The estimator is based on the
idea of a conforming reconstruction of the discrete diffusive flux, that can be
computed using local information only. It is offline/online decomposable and
can thus be efficiently used in the context of model reduction.
","[{""version"":""v1"",""created"":""Tue, 28 Jan 2014 13:27:06 GMT""},{""version"":""v2"",""created"":""Fri, 7 Feb 2014 15:07:11 GMT""},{""version"":""v3"",""created"":""Tue, 27 May 2014 14:57:45 GMT""}]","2019-10-30"
"1401.7174","Roy Shiloh","Roy Shiloh, Yossi Lereah, Yigal Lilach and Ady Arie","Sculpturing the Electron Wave Function","13 pages, 4 figures. Submitted to Nature",,"10.1016/j.ultramic.2014.04.007",,"physics.optics","http://arxiv.org/licenses/nonexclusive-distrib/1.0/","  Coherent electrons such as those in electron microscopes, exhibit wave
phenomena and may be described by the paraxial wave equation. In analogy to
light-waves, governed by the same equation, these electrons share many of the
fundamental traits and dynamics of photons. Today, spatial manipulation of
electron beams is achieved mainly using electrostatic and magnetic fields.
Other demonstrations include simple phase-plates and holographic masks based on
binary diffraction gratings. Altering the spatial profile of the beam may be
proven useful in many fields incorporating phase microscopy, electron
holography, and electron-matter interactions. These methods, however, are
fundamentally limited due to energy distribution to undesired diffraction
orders as well as by their binary construction. Here we present a new method in
electron-optics for arbitrarily shaping of electron beams, by precisely
controlling an engineered pattern of thicknesses on a thin-membrane, thereby
molding the spatial phase of the electron wavefront. Aided by the past decade's
monumental leap in nano-fabrication technology and armed with light-optic's
vast experience and knowledge, one may now spatially manipulate an electron
beam's phase in much the same way light waves are shaped simply by passing them
through glass elements such as refractive and diffractive lenses. We show
examples of binary and continuous phase-plates and demonstrate the ability to
generate arbitrary shapes of the electron wave function using a holographic
phase-mask. This opens exciting new possibilities for microscopic studies of
materials using shaped electron beams and enables electron beam lithography
without the need to move the electron beam or the sample, as well as high
resolution inspection of electronic chips by structured electron illumination.
","[{""version"":""v1"",""created"":""Tue, 28 Jan 2014 13:29:09 GMT""}]","2014-07-17"
"1401.7175","Tomasz Srokowski","Tomasz Srokowski","Asymmetric Levy flights in nonhomogeneous environments","13 pages, 6 figures","J. Stat. Mech. (2014) P05024","10.1088/1742-5468/2014/05/P05024",,"cond-mat.stat-mech","http://arxiv.org/licenses/nonexclusive-distrib/1.0/","  We consider stochastic systems involving general -- non-Gaussian and
asymmetric -- stable processes. The random quantities, either a stochastic
force or a waiting time in a random walk process, explicitly depend on the
position. A fractional diffusion equation corresponding to a master equation
for a jumping process with a variable jumping rate is solved in a diffusion
limit. It is demonstrated that for some model parameters the equation is
satisfied in that limit by the stable process with the same asymptotics as the
driving noise. The Langevin equation containing a multiplicative noise,
depending on the position as a power-law, is solved; the existing moments are
evaluated. The motion appears subdiffusive and the transport depends on the
asymmetry parameter: it is fastest for the symmetric case. A special case of
the one-sided distribution is discussed.
","[{""version"":""v1"",""created"":""Tue, 28 Jan 2014 13:29:38 GMT""},{""version"":""v2"",""created"":""Thu, 22 May 2014 11:10:43 GMT""}]","2015-06-18"
"1401.7176","Mikhail Ryzhkin","M. I. Ryzhkin","Do dipole correlations exist in two-dimensional spin ice?",,,,,"cond-mat.stat-mech cond-mat.str-el","http://arxiv.org/licenses/nonexclusive-distrib/1.0/","  Here we study the statistical properties of two-dimensional spin ice in its
ground state by the Monte Carlo simulation method. Using a new sampling
algorithm, we show that the short-range ice rule in two dimensions gives rise
to long-range but not dipole-like correlations, to non-Gaussian probability
density function for magnetization and to non-extensive conditional entropy
(entropy with given value of magnetization).
","[{""version"":""v1"",""created"":""Tue, 28 Jan 2014 13:36:40 GMT""}]","2014-01-29"
"1401.7177","Weronika Ewa Narloch","W. Narloch, J. Kaluzny, W. Krzeminski, W. Pych, M. Rozyczka, S.
  Shectman, I. B. Thompson, T. Tomov","New observations of the old magnetic nova GQ Muscae","9 pages, 5 figures, 1 table. Accepted for publication in Baltic
  Astronomy","Baltic Astronomy, 2014, vol.23, p. 1-7",,,"astro-ph.SR","http://arxiv.org/licenses/nonexclusive-distrib/1.0/","  We report photometric observations of GQ Mus performed between 1992 and 2011.
We find that the total amplitude of the orbital modulation of its brightness
decreased from ~0.9 mag in 1992 to ~0.2 mag in 2010, becoming comparable to the
amplitude of chaotic flickering on a time scale of several minutes. Optical
spectra obtained in 2001 and 2012 indicate continuing activity of GQ Mus. The
spectra show broad emission lines of HeII and HI typical for magnetic
cataclysmic variables. The nova was observed as an UV-bright object in 2001 and
2012. We also show that the orbital period of GQ Mus has been constant between
1989 and 2010-2011.
","[{""version"":""v1"",""created"":""Tue, 28 Jan 2014 13:38:08 GMT""}]","2014-05-26"
"1401.7178","Sergey Moiseev A","S. A. Moiseev, A. I. Sidorova, and B. S. Ham","Stationary and quasi-stationary light pulse in three-level cold atomic
  system","10 pages, 14 figures",,"10.1103/PhysRevA.89.043802",,"physics.optics physics.atom-ph quant-ph","http://arxiv.org/licenses/nonexclusive-distrib/1.0/","  We have studied stationary and quasi-stationary signal light pulses in cold
lambda-type atomic media driven by counterpropagating control laser fields at
the condition of electromagnetically induced transparency. By deriving a
dispersion relation we present spectral and temporal properties of the signal
light pulse and a significant influence of atomic decoherence on the coupled
stationary light pulses for spatial splitting. Finally we discuss
quasi-stationary light pulse evolution characterized by frozen spatial
spreading for a robust coherent control of slow light pulses.
","[{""version"":""v1"",""created"":""Tue, 28 Jan 2014 13:39:48 GMT""}]","2015-06-18"
"1401.7179","Christian Axler","Christian Axler","On generalized Ramanujan primes","The final publication is available at link.springer.com under
  http://link.springer.com/article/10.1007/s11139-015-9693-9","Ramanujan J. 39 (2016), no. 1, 1--30","10.1007/s11139-015-9693-9",,"math.NT","http://arxiv.org/licenses/nonexclusive-distrib/1.0/","  In this paper we establish several results concerning the generalized
Ramanujan primes. For $n\in\mathbb{N}$ and $k \in \mathbb{R}_{> 1}$ we give
estimates for the $n$th $k$-Ramanujan prime which lead both to generalizations
and to improvements of the results presently in the literature. Moreover, we
obtain results about the distribution of $k$-Ramanujan primes. In addition, we
find explicit formulae for certain $n$th $k$-Ramanujan primes. As an
application, we prove that a conjecture of Mitra, Paul and Sarkar concerning
the number of primes in certain intervals holds for every sufficiently large
positive integer.
","[{""version"":""v1"",""created"":""Tue, 28 Jan 2014 13:46:39 GMT""},{""version"":""v2"",""created"":""Tue, 12 Jan 2016 11:54:02 GMT""}]","2016-06-22"
"1401.7180","Agnieszka Kuc","Jianping Xiao, Agnieszka Kuc, Thomas Frauenheim, Thomas Heine","Stabilization Mechanism of ZnO nanoparticles by Fe doping","PRL accepted, 5 pages, 4 figures 1 table",,"10.1103/PhysRevLett.112.106102",,"cond-mat.mtrl-sci","http://arxiv.org/licenses/nonexclusive-distrib/1.0/","  Surprisingly low solubility and toxicity of Fe-doped ZnO nanoparticles is
elucidated on the basis of first-principles calculations. Various ZnO surfaces
that could be present in nanoparticles are subject to substitutional Fe doping.
We show that Fe stabilizes polar instable surfaces, while non-polar surfaces,
namely (1010) and (1120), remain intact. Polar surfaces can be stabilized
indirectly through Fe2+-Fe3+ pair assisted charge transfer, what reduces
surface polarity and therefore, the solubility in polar solvents.
","[{""version"":""v1"",""created"":""Tue, 28 Jan 2014 13:47:44 GMT""}]","2015-06-18"
"1401.7181","Lichao Zhao","L. Zhao, J. Jiang, and Y. Liu","Optimizing a spin-flip Zeeman slower",,,,,"cond-mat.quant-gas physics.atom-ph","http://arxiv.org/licenses/nonexclusive-distrib/1.0/","  We present a design of a spin-flip Zeeman slower controlled by a fast
feedback circuit for a sodium Bose-Einstein condensate apparatus. We also
demonstrate how the efficiency of the slower strongly depends on its intrinsic
parameters, and compare these observations with a few theoretical models. Our
findings lead to a simple three-step procedure of designing an optimal Zeeman
slower for neutral atoms, especially for those atomic species with high initial
velocities, such as sodium and lithium atoms.
","[{""version"":""v1"",""created"":""Tue, 28 Jan 2014 13:55:48 GMT""}]","2014-01-29"
"1401.7182","Enea Parini","Enea Parini, Tobias Weth","Existence, unique continuation and symmetry of least energy nodal
  solutions to sublinear Neumann problems",,,,,"math.AP","http://arxiv.org/licenses/nonexclusive-distrib/1.0/","  We consider the sublinear problem \begin {equation*} \left\{\begin{array}{r c
l c} -\Delta u & = &|u|^{q-2}u & \textrm{in }\Omega, \\ u_n & = & 0 &
\textrm{on }\partial\Omega,\end{array}\right. \end {equation*} where $\Omega
\subset \real^N$ is a bounded domain, and $1 \leq q < 2$. For $q=1$,
$|u|^{q-2}u$ will be identified with $\sgn(u)$. We establish a variational
principle for least energy nodal solutions, and we investigate their
qualitative properties. In particular, we show that they satisfy a unique
continuation property (their zero set is Lebesgue-negligible). Moreover, if
$\Omega$ is radial, then least energy nodal solutions are foliated Schwarz
symmetric, and they are nonradial in case $\Omega$ is a ball. The case $q=1$
requires special treatment since the formally associated energy functional is
not differentiable, and many arguments have to be adjusted.
","[{""version"":""v1"",""created"":""Tue, 28 Jan 2014 13:56:40 GMT""},{""version"":""v2"",""created"":""Tue, 3 Feb 2015 07:55:05 GMT""}]","2015-02-04"
"1401.7183","Derrick Stolee","James M. Carraher, David Galvin, Stephen G. Hartke, A. J. Radcliff,
  Derrick Stolee","On the independence ratio of distance graphs","39 pages, 12 figures, 6 tables",,,,"math.CO","http://arxiv.org/licenses/nonexclusive-distrib/1.0/","  A distance graph is an undirected graph on the integers where two integers
are adjacent if their difference is in a prescribed distance set. The
independence ratio of a distance graph $G$ is the maximum density of an
independent set in $G$. Lih, Liu, and Zhu [Star extremal circulant graphs, SIAM
J. Discrete Math. 12 (1999) 491--499] showed that the independence ratio is
equal to the inverse of the fractional chromatic number, thus relating the
concept to the well studied question of finding the chromatic number of
distance graphs.
  We prove that the independence ratio of a distance graph is achieved by a
periodic set, and we present a framework for discharging arguments to
demonstrate upper bounds on the independence ratio. With these tools, we
determine the exact independence ratio for several infinite families of
distance sets of size three, determine asymptotic values for others, and
present several conjectures.
","[{""version"":""v1"",""created"":""Tue, 28 Jan 2014 13:56:51 GMT""}]","2014-01-29"
"1401.7184","Florent Balacheff","Florent Balacheff (LPP)","Measurements of Riemannian two-disks and two-spheres",,"Pacific J. Math. 275 (2015) 167-181","10.2140/pjm.2015.275.167",,"math.DG","http://arxiv.org/licenses/nonexclusive-distrib/1.0/","  We prove that any Riemannian two-sphere with area at most 1 can be
continuously mapped onto a tree in a such a way that the topology of fibers is
controlled and their length is less than 7.6. This result improves previous
estimates and relies on a similar statement for Riemannian two-disks.
","[{""version"":""v1"",""created"":""Tue, 28 Jan 2014 13:57:27 GMT""}]","2016-01-20"
