"1401.6907","Gianluca Paolini","Gianluca Paolini","Independence Logic and Abstract Independence Relations",,,,,"math.LO","http://arxiv.org/licenses/nonexclusive-distrib/1.0/","  We continue the work on the relations between independence logic and the
model-theoretic analysis of independence, generalizing the results of [15] and
[16] to the framework of abstract independence relations for an arbitrary AEC.
We give a model-theoretic interpretation of the independence atom and
characterize under which conditions we can prove a completeness result with
respect to the deductive system that axiomatizes independence in team semantics
and statistics.
","[{""version"":""v1"",""created"":""Mon, 27 Jan 2014 16:07:18 GMT""},{""version"":""v2"",""created"":""Wed, 29 Jan 2014 09:44:48 GMT""},{""version"":""v3"",""created"":""Sat, 29 Mar 2014 18:23:06 GMT""},{""version"":""v4"",""created"":""Fri, 5 Sep 2014 15:24:14 GMT""},{""version"":""v5"",""created"":""Thu, 21 May 2015 15:21:00 GMT""},{""version"":""v6"",""created"":""Wed, 9 Mar 2016 09:05:45 GMT""},{""version"":""v7"",""created"":""Thu, 8 Sep 2016 09:49:28 GMT""}]","2016-09-09"
"1401.6908","Tereza Mendes","Tereza Mendes, Attilio Cucchieri","Systematic Effects at Criticality for the SU(2)-Landau-Gauge Gluon
  Propagator","7 pages, 4 figures, poster presented at Lattice 2013",,,,"hep-lat","http://arxiv.org/licenses/nonexclusive-distrib/1.0/","  We analyze data from finite-temperature simulations of the gluon propagator
in SU(2) Landau gauge on large lattices. We argue that the singular behavior of
this quantity around the deconfinement transition, seen in several previous
studies, is a lattice artifact.
","[{""version"":""v1"",""created"":""Mon, 27 Jan 2014 16:10:48 GMT""}]","2014-01-28"
"1401.6909","Shiqi Song","Shiqi Song","Dynamic construction of martingales of density functions",,,,,"math.PR","http://arxiv.org/licenses/nonexclusive-distrib/1.0/","  The density hypothesis on random times becomes now a standard in modeling of
risks. One of the basic reasons to introduce the density hypothesis is the
desire to have a computable credit risk model. However, recent work shows that
merely an existence of a density function for the conditional law of the random
times will not be enough for the purposes of some numerical implantation
problems. It becomes necessary to have models with martingales of density
functions evolving along with the development of the information flow, in
particular, to have Markovian martingales of density functions determined by a
stochastic differential equation. The quetion of constructing a martingale of
density functions by a stochastic differential equation has been answered in
one dimensional case. The aim of this note is to provide a solution in higher
dimensional cases.
","[{""version"":""v1"",""created"":""Mon, 27 Jan 2014 16:21:03 GMT""},{""version"":""v2"",""created"":""Sun, 2 Feb 2014 14:02:03 GMT""}]","2014-02-04"
"1401.6910","June-Seo Kim","June-Seo Kim, Sanghoon Jung, Myung-Hwa Jung, Chun-Yeol You, Henk J. M.
  Swagten, Bert Koopmans","Voltage controlled propagating spin waves on a perpendicularly
  magnetized nanowire",,,,,"cond-mat.mes-hall","http://arxiv.org/licenses/nonexclusive-distrib/1.0/","  We numerically and analytically investigate the voltage controlled spin wave
(SW) propagations in a nanowire with locally manipulated perpendicular magnetic
anisotropy (PMA) by applying an electric field. It is shown that the velocity
and wavelength of the propagating SWs are tailored by the modified PMA, which
can be locally controlled by the external electric field. First, we observe a
phase shift when the propagating SWs pass through the area of locally modified
PMA. By introducing phase control of the SWs, we finally propose a three
terminal SW device. Constructive/destructive interferences of two propagating
SWs are controlled at the detecting area by the voltage controlled phase shift.
","[{""version"":""v1"",""created"":""Mon, 27 Jan 2014 16:25:10 GMT""}]","2014-01-28"
"1401.6912","J. Navarro-Salas","Adrian del Rio and Jose Navarro-Salas","Spacetime correlators of perturbations in slow-roll de Sitter inflation","Clarifying comments and new references added. Misprints corrected","Phys. Rev. D89 (2014) 084037","10.1103/PhysRevD.89.084037",,"gr-qc astro-ph.CO hep-th","http://arxiv.org/licenses/nonexclusive-distrib/1.0/","  Two-point correlators and self-correlators of primordial perturbations in
quasi-de Sitter spacetime backgrounds are considered. For large separations
two-point correlators exhibit nearly scale invariance, while for short
distances self-correlators need standard renormalization. We study the
deformation of two-point correlators to smoothly match the self-correlators at
coincidence. The corresponding angular power spectrum is evaluated in the
Sachs-Wolfe regime of low multipoles. Scale invariance is maintained, but the
amplitude of $C_{\ell}$ could change in a non-trivial way.
","[{""version"":""v1"",""created"":""Mon, 27 Jan 2014 16:28:57 GMT""},{""version"":""v2"",""created"":""Thu, 10 Apr 2014 04:32:19 GMT""}]","2015-06-18"
"1401.6913","Jose F. Gomez","J. F. Gomez (1), L. Uscanga (2), O. Suarez (3), J. R. Rizzo (4), I. de
  Gregorio-Monsalvo (5) ((1) IAA-CSIC, Spain, (2) NOA, Greece, (3) OCA, France,
  (4) CAB, INTA-CSIC, Spain, (5) ESO, Chile)","A sensitive search for methanol line emission toward evolved stars","11 pages, no figure. Accepted by Revista Mexicana de Astronomia y
  Astrofisica. Errors corrected during proof revision",,,,"astro-ph.GA astro-ph.SR","http://arxiv.org/licenses/nonexclusive-distrib/1.0/","  We present a sensitive search for methanol line emission in evolved stars at
1 cm, aiming to detect, for the first time, methanol masers in this type of
objects. Our sample comprised post-AGB stars and young planetary nebulae (PNe),
whose mass-loss processes and circumstellar structures resemble those of young
stellar objects (YSOs), where methanol masers are detected. Class I masers were
searched for in 73 objects, whereas Class II ones were searched in 16. No
detection was obtained. The non-detection of Class I methanol masers indicated
that methanol production in dust grains and/or the enhancement of its gas-phase
abundance in the shocked regions of evolved objects are not as efficient as in
YSOs. We suggest that relatively more evolved PNe might have a better
probability of harboring Class II masers.
","[{""version"":""v1"",""created"":""Mon, 27 Jan 2014 16:31:49 GMT""},{""version"":""v2"",""created"":""Tue, 4 Mar 2014 12:13:14 GMT""}]","2014-03-05"
"1401.6914","Roberto Cominetti","Roberto Cominetti, Jos\'e R. Correa, Omar Larr\'e","Dynamic Equilibria in Fluid Queuing Networks",,,,,"math.OC","http://arxiv.org/licenses/nonexclusive-distrib/1.0/","  This paper continues the study of equilibria for flows over time in the fluid
queueing model recently considered by Koch and Skutella [10]. We provide a
constructive proof for the existence and uniqueness of equilibria in the case
of a single origin-destination with piecewise constant inflow rates, through a
detailed analysis of the static flows obtained as derivatives of a dynamic
equilibrium. We also give a nonconstructive existence proof of equilibria when
the inflow rates belong to $L^p$ including the extension to multiple
origin-destinations.
","[{""version"":""v1"",""created"":""Mon, 27 Jan 2014 16:34:01 GMT""}]","2014-01-28"
"1401.6915","Shou-Huang Dai","Shou-Huang Dai, Shogo Kuwakino, and Wen-Yu Wen","Spin chains and classical strings in rotating Rindler-AdS space","23pp, 8 figures","JHEP 1404 (2014) 018","10.1007/JHEP04(2014)018","CYCU-HEP-14-02","hep-th","http://arxiv.org/licenses/nonexclusive-distrib/1.0/","  In this paper, we study the spin chain and string excitation in the rotating
Rindler-$AdS_3$ proposed in [12]. We obtain a one-parameter deformed $SL(2)$
spin chain at the fast spin limit. Two-spin GKP-like solutions are studied at
short and long string limits. General ansatz for the giant magnons and the
spiky strings are analyzed in detail for various $\beta$. At last, we explore
its counterpart in analytic continuation and pp-wave limit.
","[{""version"":""v1"",""created"":""Mon, 27 Jan 2014 16:34:03 GMT""}]","2014-04-09"
"1401.6916","Pierre Ille","Abderrahim Boussa\""iri, Pierre Ille and Robert E. Woodrow","Primitive bound of a 2-structure","33 pages",,,,"math.CO","http://arxiv.org/licenses/nonexclusive-distrib/1.0/","  A 2-structure on a set $S$ is given by an equivalence relation on the set of
ordered pairs of distinct elements of $S$. A subset $C$ of $S$, any two
elements of which appear the same from the perspective of each element of the
complement of $C$, is called a clan. The number of elements that must be added
in order to obtain a 2-structure the only clans of which are trivial is called
the primitive bound of the 2-structure. The primitive bound is determined for
arbitrary 2-structures of any cardinality. This generalizes the classical
results of Erd\H{o}s et al. and Moon for tournaments, as well as the result of
Brignall et al. for finite graphs, and the precise results of Boussa\""{\i}ri
and Ille for finite graphs, providing new proofs which avoid extensive use of
induction in the finite case.
","[{""version"":""v1"",""created"":""Mon, 27 Jan 2014 16:37:36 GMT""}]","2014-01-28"
"1401.6917","Takashi Imai","A. W. Kinross, M. Fu, T. J. Munsie, H. A. Dabkowska, G. M. Luke, S.
  Sachdev, and T. Imai","Evolution of Quantum Fluctuations Near the Quantum Critical Point of the
  Transverse Field Ising Chain System CoNb$_2$O$_6$","Final version to appear in PRX","Phys. Rev. X4 (2014) 031008","10.1103/PhysRevX.4.031008",,"cond-mat.str-el cond-mat.stat-mech cond-mat.supr-con","http://arxiv.org/licenses/nonexclusive-distrib/1.0/","  The transverse field Ising chain (TFIC) model is ideally suited for testing
the fundamental ideas of quantum phase transitions, because its well-known
$T=0$ ground state can be extrapolated to finite temperatures. Nonetheless, the
lack of appropriate model materials hindered the past effort to test the
theoretical predictions. Here we map the evolution of quantum fluctuations in
the TFIC based on Nuclear Magnetic Resonance (NMR) measurements of
CoNb$_2$O$_6$, and demonstrate the finite temperature effects on quantum
criticality for the first time. From the temperature dependence of the
$^{93}$Nb longitudinal relaxation rate $1/T_1$, we identify the renormalized
classical, quantum critical, and quantum disordered scaling regimes in the
temperature ($T$) vs. transverse magnetic field ($h_{\perp}$) phase diagram.
Precisely at the critical field $h_{\perp}^{c}=5.25 \pm 0.15$ T, we observe a
power-law behavior, $1/T_{1} \sim T^{-3/4}$, as predicted by quantum critical
scaling. Our parameter-free comparison between the data and theory reveals that
quantum fluctuations persist up to as high as $T \sim 0.4 J$, where the
intra-chain exchange interaction $J$ is the only energy scale of the problem.
","[{""version"":""v1"",""created"":""Mon, 27 Jan 2014 16:40:15 GMT""},{""version"":""v2"",""created"":""Tue, 13 May 2014 19:49:16 GMT""}]","2014-07-17"
"1401.6918","Jian-Xiong Wang","Rong Li and Jian-Xiong Wang","Next-to-Leading-Order study on the associate production of
  $J/\psi+\gamma$ at the LHC","5 pages, 2 figures","Phys. Rev. D 89, 114018 (2014)","10.1103/PhysRevD.89.114018",,"hep-ph hep-ex","http://arxiv.org/licenses/nonexclusive-distrib/1.0/","  The associate $J/\psi+\gamma$ production at the LHC is studied completely at
next-to-leading-order (NLO) within the framework of nonrelativistic QCD. By
using three sets of color-octet long-distance matrix elements (LDMEs) obtained
in previous prompt $J/\psi$ studies, we find that only one of them can result
in a positive transverse momentum ($p_t$) distribution of $J/\psi$ production
rate at large $p_t$ region. Based on reasonable consideration to cut down
background, our estimation is measurable upto $p_t=50$GeV with present data
sample collected at $8$TeV LHC. All the color-octet LDMEs in $J/\psi$
production could be fixed sensitively by including this proposed measurement
and our calculation, and then confident conclusion on $J/\psi$ polarization
puzzle could be achieved.
","[{""version"":""v1"",""created"":""Mon, 27 Jan 2014 16:40:22 GMT""}]","2014-06-25"
"1401.6919","Bernard Derrida","Bernard Derrida and Martin Retaux","The depinning transition in presence of disorder: a toy model",,,"10.1007/s10955-014-1006-y",,"cond-mat.stat-mech","http://arxiv.org/licenses/nonexclusive-distrib/1.0/","  We introduce a toy model, which represents a simplified version of the
problem of the depinning transition in the limit of strong disorder. This toy
model can be formulated as a simple renormalization transformation for the
probability distribution of a single real variable. For this toy model, {the
critical line is known exactly in one particular case} and it can be calculated
perturbatively in the general case. One can also show that, at the transition,
there is no strong disorder fixed distribution accessible by renormalization.
Instead, both our numerical and analytic approaches indicate a transition of
infinite order (of the Berezinskii-Kosterlitz-Thouless type). We give numerical
evidence that this infinite order transition persists for the problem of the
depinning transition with disorder on the hierarchical lattice.
","[{""version"":""v1"",""created"":""Mon, 27 Jan 2014 16:41:19 GMT""}]","2015-06-18"
"1401.6920","Absos Ali Shaikh Absos","Ryszard Deszcz, Marian Hotlo\'s, Jan Je{\l}owicki, Haradhan Kundu and
  Absos Ali Shaikh","Curvature Properties of G\""{o}del metric","to be published in IJGMMP, 22 pages",,"10.1142/S021988781450025X",,"math.DG","http://creativecommons.org/licenses/by/3.0/","  The main aim of this article is to investigate the geometric structures
admitting by the G\""{o}del spacetime which produces a new class of
semi-Riemannian manifolds (see Theorem 4.1 and Theorem 4.5). We also consider
some extension of G\""{o}del metric (see Example 4.1).
","[{""version"":""v1"",""created"":""Mon, 27 Jan 2014 16:43:29 GMT""}]","2014-01-28"
"1401.6921","Hiroshi Okada","Seungwon Baek, Hiroshi Okada, Takashi Toma","Radiative Lepton Model and Dark Matter with Global $U(1)'$ Symmetry","15 pages, 2 figures, 2 tables; version accepted for publication in
  Physics Letters B",,"10.1016/j.physletb.2014.03.021","KIAS-P14003, IPPP/14/07, DCPT/14/14","hep-ph","http://arxiv.org/licenses/nonexclusive-distrib/1.0/","  We propose a radiative lepton model, in which the charged lepton masses are
generated at one-loop level, and the neutrino masses are induced at two-loop
level. On the other hand, tau mass is derived at tree level since it is too
heavy to generate radiatively. Then we discuss muon anomalous magnetic moment
together with the constraint of lepton flavor violation. A large muon magnetic
moment is derived due to the vector like charged fermions which are newly added
to the standard model. In addition, considering a scalar dark matter in our
model, a strong gamma-ray signal is produced by dark matter annihilation via
internal bremsstrahlung. We can also obtain the effective neutrino number by
the dark radiation of the Goldstone boson coming from the imposed global
$U(1)'$ symmetry.
","[{""version"":""v1"",""created"":""Mon, 27 Jan 2014 16:44:17 GMT""},{""version"":""v2"",""created"":""Mon, 3 Feb 2014 17:47:20 GMT""},{""version"":""v3"",""created"":""Wed, 12 Mar 2014 11:55:52 GMT""}]","2015-06-18"
"1401.6922","Ruixing Zhang","Rui-Xing Zhang, Chao-Xing Liu","Topological magnetic crystalline insulators and co-representation theory","14 pages, 7 figures","Phys. Rev. B 91, 115317 (2015)","10.1103/PhysRevB.91.115317",,"cond-mat.mes-hall","http://arxiv.org/licenses/nonexclusive-distrib/1.0/","  Gapless surface states of time reversal invariant topological insulators are
protected by the anti-unitary nature of the time reversal operation. Very
recently, this idea was generalized to magnetic structures, in which time
reversal symmetry is explicitly broken, but there is still an anti-unitary
symmetry operation combining time reversal symmetry and crystalline symmetry.
These topological phases in magnetic structures are dubbed ""topological
magnetic crystalline insulators"". In this work, we present a general theory of
topological magnetic crystalline insulators in different types of magnetic
crystals based on the co-representation theory of magnetic crystalline symmetry
groups. We construct two concrete tight-binding models of topological magnetic
crystalline insulators, the $\hat{C}_4\Theta$ model and the $\hat{\bf
\tau}\Theta$ model, in which topological surface states and topological
invariants are calculated explicitly. Moreover, we check different types of
anti-unitary operators in magnetic systems and find that the systems with
$\hat{C}_4\Theta$, $\hat{C}_6\Theta$ and $\hat{\bf \tau}\Theta$ symmetry are
able to protect gapless surface states. Our work will pave the way to search
for topological magnetic crystalline insulators in realistic magnetic
materials.
","[{""version"":""v1"",""created"":""Mon, 27 Jan 2014 16:44:54 GMT""}]","2015-04-01"
"1401.6923","Yusuke Isono","Yusuke Isono","Some prime factorization results for free quantum group factors","final version, to appear in J. Reine Angew. Math",,,,"math.OA","http://arxiv.org/licenses/nonexclusive-distrib/1.0/","  We prove some unique factorization results for tensor products of free
quantum group factors. They are type III analogues of factorization results for
direct products of bi-exact groups established by Ozawa and Popa. In the proof,
we first take continuous cores of the tensor products, which satisfy a
condition similar to condition (AO), and discuss some factorization properties
for the continuous cores. We then deduce factorization properties for the
original type III factors. We also prove some unique factorization results for
crossed product von Neumann algebras by direct products of bi-exact groups.
","[{""version"":""v1"",""created"":""Mon, 27 Jan 2014 16:45:59 GMT""},{""version"":""v2"",""created"":""Fri, 25 Apr 2014 15:06:35 GMT""}]","2014-04-28"
"1401.6924","Carl Hagen","G. S. Guralnik and C. R. Hagen","Where Have All the Goldstone Bosons Gone?","4 pages; typo corrected",,"10.1142/S0217732314500461",,"hep-th hep-ph","http://arxiv.org/licenses/nonexclusive-distrib/1.0/","  According to a commonly held view of spontaneously broken symmetry in gauge
theories, troublesome Nambu-Goldstone bosons are effectively eliminated by
turning into longitudinal modes of a massive vector meson. This note shows that
this is not in fact a consistent view of the role of Nambu-Goldstone bosons in
such theories. These particles necessarily appear as gauge excitations whenever
they are formulated in a manifestly covariant gauge. The radiation gauge
provides therefore the dual advantage of circumventing the Goldstone theorem
and making evident the disappearance of these particles from the physical
spectrum.
","[{""version"":""v1"",""created"":""Mon, 27 Jan 2014 16:49:34 GMT""},{""version"":""v2"",""created"":""Mon, 17 Feb 2014 17:19:55 GMT""}]","2015-06-18"
"1401.6925","Sean Sather-Wagstaff","Sean Sather-Wagstaff and Richard Wicklein","Support and adic finiteness for complexes","26 pages, v.2 is significantly reorganized; v.3 addresses referee's
  comments. To appear in Comm. Algebra",,,,"math.AC","http://arxiv.org/licenses/nonexclusive-distrib/1.0/","  Let $X$ be a chain complex over a commutative noetherian ring $R$, that is,
an object in the derived category $\mathcal{D}(R)$. We investigate the small
support and co-support of $X$, introduced by Foxby and Benson, Iyengar, and
Krause. We show that the derived functors $M \otimes_R^{\mathbf{L}} -$ and
$\mathbf{R}\operatorname{Hom}_R(M,-)$ can detect isomorphisms in
$\mathcal{D}(R)$ between complexes with restrictions on their supports or
co-supports. In particular, the derived local (co)homology functors
$\mathbf{R}\Gamma_{\mathfrak{a}}(-)$ and $\mathbf{L}\Lambda_{\mathfrak{a}}(-)$
with respect to an ideal $\mathfrak{a}\subsetneq R$ have the same ability.
Furthermore, we give reprove some results of Benson, Iyengar, and Krause in our
setting, with more direct proofs. Also, we include some computations of
co-supports, since this construction is still quite mysterious. Lastly, we
investigate ""$\mathfrak{a}$-adically finite"" $R$-complexes, that is, the
$X\in\mathcal{D}(R)$ that are $\mathfrak{a}$-cofinite \textit{\`a la}
Hartshorne. For instance, we characterize these complexes in terms of a
finiteness condition on $\mathbf{L}\Lambda_{\mathfrak{a}}(X)$.
","[{""version"":""v1"",""created"":""Mon, 27 Jan 2014 16:50:33 GMT""},{""version"":""v2"",""created"":""Wed, 23 Jul 2014 18:19:25 GMT""},{""version"":""v3"",""created"":""Fri, 5 Jun 2015 15:20:30 GMT""}]","2015-06-08"
"1401.6926","Ilya Soloveychik","Ilya Soloveychik and Ami Wiesel","Performance Analysis of Tyler's Covariance Estimator",,,"10.1109/TSP.2014.2376911",,"math.ST stat.TH","http://arxiv.org/licenses/nonexclusive-distrib/1.0/","  This paper analyzes the performance of Tyler's M-estimator of the scatter
matrix in elliptical populations. We focus on the non-asymptotic setting and
derive the estimation error bounds depending on the number of samples n and the
dimension p. We show that under quite mild conditions the squared Frobenius
norm of the error of the inverse estimator decays like p^2/n with high
probability.
","[{""version"":""v1"",""created"":""Mon, 27 Jan 2014 16:55:33 GMT""},{""version"":""v2"",""created"":""Wed, 26 Feb 2014 21:11:10 GMT""},{""version"":""v3"",""created"":""Mon, 3 Mar 2014 12:01:29 GMT""},{""version"":""v4"",""created"":""Thu, 11 Sep 2014 07:22:26 GMT""}]","2015-06-18"
"1401.6927","\'Agnes Vib\'ok","A. Perveaux, D. Lauvergnat, B. Lasorne, F. Gatti, M. A. Robb, G. J.
  Hal\'asz, and \'A. Vib\'ok","Attosecond electronic and nuclear quantum photodynamics of ozone:
  time-dependent Dyson orbitals and dipole",,,"10.1088/0953-4075/47/12/124010",,"physics.atm-clus physics.chem-ph","http://arxiv.org/licenses/nonexclusive-distrib/1.0/","  A nonadiabatic scheme for the description of the coupled electron and nuclear
motions in the ozone molecule was proposed recently. An initial coherent
nonstationary state was prepared as a superposition of the ground state and the
excited Hartley band. In this situation neither the electrons nor the nuclei
are in a stationary state. The multiconfiguration time dependent Hartree method
was used to solve the coupled nuclear quantum dynamics in the framework of the
adiabatic separation of the time-dependent Schr\""odinger equation. The
resulting wave packet shows an oscillation of the electron density between the
two chemical bonds. As a first step for probing the electronic motion we
computed the time-dependent molecular dipole and the Dyson orbitals. The latter
play an important role in the explanation of the photoelectron angular
distribution. Calculations of the Dyson orbitals are presented both for the
time-independent as well as the time-dependent situations. We limited our
description of the electronic motion to the Franck-Condon region only due to
the localization of the nuclear wave packets around this point during the first
5-6 fs.
","[{""version"":""v1"",""created"":""Mon, 27 Jan 2014 17:01:25 GMT""}]","2015-06-18"
"1401.6929","Wojciech Wislicki","W. Wi\'slicki, T. Bednarski, P. Bia{\l}as, E. Czerwi\'nski, {\L}.
  Kap{\l}on, A. Kochanowski, G. Korcyl, J. Kowal, P. Kowalski, T. Kozik, W.
  Krzemie\'n, M. Molenda, P. Moskal, S. Nied\'zwiecki, M. Pa{\l}ka, M. Pawlik,
  L. Raczy\'nski, Z. Rudy, P. Salabura, N.G. Sharma, M. Silarski, A.
  S{\l}omski, J. Smyrski, A. Strzelecki, A. Wieczorek, M. Zieli\'nski, N. Zo\'n","Computing support for advanced medical data analysis and imaging","9 p, 3 figs, based on talk given at Symposium on Positron Emission
  Tomography, Sept. 19-22, 2013, Jagiellonian University, Krak\'ow, Pl","Bio-Algorithms and Med-Systems 10(2014)52","10.1515/bams-2014-0001",,"physics.comp-ph cs.CV cs.DC physics.ins-det physics.med-ph","http://arxiv.org/licenses/nonexclusive-distrib/1.0/","  We discuss computing issues for data analysis and image reconstruction of
PET-TOF medical scanner or other medical scanning devices producing large
volumes of data. Service architecture based on the grid and cloud concepts for
distributed processing is proposed and critically discussed.
","[{""version"":""v1"",""created"":""Mon, 27 Jan 2014 17:02:37 GMT""}]","2014-05-27"
