"1401.7075","Masud Mansuripur","Masud Mansuripur","Radiation pressure and the linear momentum of light in dispersive
  dielectric media","6 pages, 2 figures, 15 equations, 8 references","Published in Optics Express, Vol. 13, No. 6, pp 2245-2250 (2005)","10.1364/OPEX.13.002245",,"physics.optics physics.class-ph","http://arxiv.org/licenses/nonexclusive-distrib/1.0/","  We derive an exact expression for the radiation pressure of a quasi-
monochromatic plane wave incident from the free space onto the flat surface of
a semi-infinite dielectric medium. In order to account for the total optical
momentum (incident plus reflected) that is transferred to the dielectric, the
mechanical momentum acquired by the medium must be added to the rate of flow of
the electromagnetic momentum (the so-called Abraham momentum) inside the
dielectric. We confirm that the electromagnetic momentum travels with the group
velocity of light inside the medium. The photon drag effect, in which the
photons captured in a semiconductor appear to have the Minkowski momentum, is
explained by analyzing a model system consisting of a thin absorptive layer
embedded in a transparent dielectric.
","[{""version"":""v1"",""created"":""Tue, 28 Jan 2014 03:37:27 GMT""}]","2014-01-29"
"1401.7076","Dmitry Berdinsky","Dmitry Berdinsky, Tae-wan Kim, Durkbin Cho, Cesare Bracco, Sutipong
  Kiatpanichgij","Bases of T-meshes and the refinement of hierarchical B-splines",,"Berdinsky D., Kim T., Cho D., Bracco C., Kiatpanichgij S., ""Bases
  of T-meshes and the refinement of hierarchical B-splines"", Computer Methods
  in Applied Mechanics and Engineering 2015, V. 283, pp. 841-855","10.1016/j.cma.2014.09.023",,"cs.CG math.NA","http://arxiv.org/licenses/nonexclusive-distrib/1.0/","  In this paper we consider spaces of bivariate splines of bi-degree (m, n)
with maximal order of smoothness over domains associated to a two-dimensional
grid. We define admissible classes of domains for which suitable combinatorial
technique allows us to obtain the dimension of such spline spaces and the
number of tensor-product B-splines acting effectively on these domains.
Following the strategy introduced recently by Giannelli and Juettler, these
results enable us to prove that under certain assumptions about the
configuration of a hierarchical T-mesh the hierarchical B-splines form a basis
of bivariate splines of bi-degree (m, n) with maximal order of smoothness over
this hierarchical T-mesh. In addition, we derive a sufficient condition about
the configuration of a hierarchical T-mesh that ensures a weighted partition of
unity property for hierarchical B-splines with only positive weights.
","[{""version"":""v1"",""created"":""Tue, 28 Jan 2014 03:38:01 GMT""}]","2021-08-18"
"1401.7077","Gerardo Febres","Gerardo Febres, Klaus Jaffe","Quantifying literature quality using complexity criteria","Submitted for publication. 29 pages. 8 figures, 4 tables, 4
  appendixes","Journal of Quantitative Linguistics, 2017, Vol 24, Iss 1","10.1080/09296174.2016.1169847",,"cs.CL","http://arxiv.org/licenses/nonexclusive-distrib/1.0/","  We measured entropy and symbolic diversity for English and Spanish texts
including literature Nobel laureates and other famous authors. Entropy, symbol
diversity and symbol frequency profiles were compared for these four groups. We
also built a scale sensitive to the quality of writing and evaluated its
relationship with the Flesch's readability index for English and the
Szigriszt's perspicuity index for Spanish. Results suggest a correlation
between entropy and word diversity with quality of writing. Text genre also
influences the resulting entropy and diversity of the text. Results suggest the
plausibility of automated quality assessment of texts.
","[{""version"":""v1"",""created"":""Tue, 28 Jan 2014 03:48:01 GMT""},{""version"":""v2"",""created"":""Mon, 10 Feb 2014 20:11:28 GMT""},{""version"":""v3"",""created"":""Sat, 24 Jan 2015 03:38:02 GMT""},{""version"":""v4"",""created"":""Sun, 15 Jan 2017 15:49:55 GMT""}]","2017-01-17"
"1401.7078","Roberto  Menezes","R. B. Menezes, J. E. Steiner, T. V. Ricci","A treatment procedure for Gemini North/NIFS data cubes: application to
  NGC 4151","26 pages, 24 figures, 1 table, published online in MNRAS",,"10.1093/mnras/stt2381",,"astro-ph.IM","http://arxiv.org/licenses/nonexclusive-distrib/1.0/","  We present a detailed procedure for treating data cubes obtained with the
Near-Infrared Integral Field Spectrograph (NIFS) of the Gemini North telescope.
This process includes the following steps: correction of the differential
atmospheric refraction, spatial re-sampling, Butterworth spatial filtering,
'instrumental fingerprint' removal and Richardson-Lucy deconvolution. The
clearer contours of the structures obtained with the spatial re-sampling, the
high spatial-frequency noise removed with the Butterworth spatial filtering,
the removed 'instrumental fingerprints' (which take the form of vertical
stripes along the images) and the improvement of the spatial resolution
obtained with the Richardson-Lucy deconvolution result in images with a
considerably higher quality. An image of the Br{\gamma} emission line from the
treated data cube of NGC 4151 allows the detection of individual ionized-gas
clouds (almost undetectable without the treatment procedure) of the narrow-line
region of this galaxy, which are also seen in an [O III] image obtained with
the Hubble Space Telescope. The radial velocities determined for each one of
these clouds seem to be compatible with models of biconical outflows proposed
by previous studies. Considering the observed improvements, we believe that the
procedure we describe in this work may result in more reliable analysis of data
obtained with this instrument.
","[{""version"":""v1"",""created"":""Tue, 28 Jan 2014 03:49:36 GMT""}]","2014-01-29"
"1401.7079","Mingyi Hong","Mingyi Hong, Tsung-Hui Chang, Xiangfeng Wang, Meisam Razaviyayn,
  Shiqian Ma, Zhi-Quan Luo","A Block Successive Upper Bound Minimization Method of Multipliers for
  Linearly Constrained Convex Optimization",,,,,"math.OC","http://arxiv.org/licenses/nonexclusive-distrib/1.0/","  Consider the problem of minimizing the sum of a smooth convex function and a
separable nonsmooth convex function subject to linear coupling constraints.
Problems of this form arise in many contemporary applications including signal
processing, wireless networking and smart grid provisioning. Motivated by the
huge size of these applications, we propose a new class of first order
primal-dual algorithms called the block successive upper-bound minimization
method of multipliers (BSUM-M) to solve this family of problems. The BSUM-M
updates the primal variable blocks successively by minimizing locally tight
upper-bounds of the augmented Lagrangian of the original problem, followed by a
gradient type update for the dual variable in closed form. We show that under
certain regularity conditions, and when the primal block variables are updated
in either a deterministic or a random fashion, the BSUM-M converges to the set
of optimal solutions. Moreover, in the absence of linear constraints, we show
that the BSUM-M, which reduces to the block successive upper-bound minimization
(BSUM) method, is capable of linear convergence without strong convexity.
","[{""version"":""v1"",""created"":""Tue, 28 Jan 2014 03:54:12 GMT""}]","2014-01-29"
"1401.7080","Yosuke Mizuno","Yosuke Mizuno, Martin Pohl, Jacek Niemiec, Bing Zhang, Ken-Ichi
  Nishikawa, Philip E. Hardee","Magnetic Field Amplification and Saturation in Turbulence Behind a
  Relativistic Shock","14 pages, 15 figures, accepted for publication in MNRAS",,"10.1093/mnras/stu196",,"astro-ph.HE gr-qc","http://arxiv.org/licenses/nonexclusive-distrib/1.0/","  We have investigated via two-dimensional relativistic MHD simulations the
long-term evolution of turbulence created by a relativistic shock propagating
through an inhomogeneous medium. In the postshock region, magnetic field is
strongly amplified by turbulent motions triggered by preshock density
inhomogeneities. Using a long-simulation box we have followed the
magnetic-field amplification until it is fully developed and saturated. The
turbulent velocity is sub-relativistic even for a strong shock. Magnetic-field
amplification is controled by the turbulent motion and saturation occurs when
the magnetic energy is comparable to the turbulent kinetic energy.
Magnetic-field amplification and saturation depend on the initial strength and
direction of the magnetic field in the preshock medium, and on the shock
strength. If the initial magnetic field is perpendicular to the shock normal,
the magnetic field is first compressed at the shock and then can be amplified
by turbulent motion in the postshock region. Saturation occurs when the
magnetic energy becomes comparable to the turbulent kinetic energy in the
postshock region. If the initial magnetic field in the preshock medium is
strong, the postshock region becomes turbulent but significant field
amplification does not occur. If the magnetic energy after shock compression is
larger than the turbulent kinetic energy in the postshock region, significant
field amplification does not occur. We discuss possible applications of our
results to gamma-ray bursts and active galactic nuclei.
","[{""version"":""v1"",""created"":""Tue, 28 Jan 2014 04:16:33 GMT""}]","2014-03-05"
"1401.7081","Adan Cabello","Adan Cabello, Simone Severini, Andreas Winter","Graph-Theoretic Approach to Quantum Correlations","REVTeX4, 6 pages, 1 figure. See also arXiv:1010.2163","Phys. Rev. Lett. 112 (2014) 040401","10.1103/PhysRevLett.112.040401",,"quant-ph","http://arxiv.org/licenses/nonexclusive-distrib/1.0/","  Correlations in Bell and noncontextuality inequalities can be expressed as a
positive linear combination of probabilities of events. Exclusive events can be
represented as adjacent vertices of a graph, so correlations can be associated
to a subgraph. We show that the maximum value of the correlations for
classical, quantum, and more general theories is the independence number, the
Lov\'asz number, and the fractional packing number of this subgraph,
respectively. We also show that, for any graph, there is always a correlation
experiment such that the set of quantum probabilities is exactly the
Gr\""otschel-Lov\'asz-Schrijver theta body. This identifies these combinatorial
notions as fundamental physical objects and provides a method for singling out
experiments with quantum correlations on demand.
","[{""version"":""v1"",""created"":""Tue, 28 Jan 2014 04:18:19 GMT""}]","2014-01-30"
"1401.7082","Masud Mansuripur","Masud Mansuripur","Angular momentum of circularly polarized light in dielectric media","10 pages, 3 figures, 16 equations, 14 references","Published in Optics Express, Vol. 13, No. 14, pp 5315-5324 (2005)","10.1364/OPEX.13.005315",,"physics.optics physics.class-ph","http://arxiv.org/licenses/nonexclusive-distrib/1.0/","  A circularly polarized plane-wave is known to have no angular momentum when
examined through Maxwell's equations. This, however, contradicts the
experimentally observed facts, where finite segments of plane waves are known
to be capable of imparting angular momentum to birefringent platelets. Using a
superposition of four plane-waves propagating at slightly different angles to a
common direction, we derive an expression for the angular momentum density of a
single plane-wave in the limit when the propagation directions of the four
beams come into alignment. We proceed to use this four-beam technique to
analyze the conservation of angular momentum when a plane-wave enters a
dielectric slab from the free space. The angular momentum of the beam is shown
to decrease upon entering the dielectric medium, by virtue of the fact that the
incident beam exerts a torque on the slab surface at the point of entry. When
the beam leaves the slab, it imparts an equal but opposite torque to the exit
facet, thus recovering its initial angular momentum upon re-emerging into the
free-space. Along the way, we derive an expression for the outward-directed
force of a normally incident, finite-diameter beam on a dielectric surface; the
possible relationship between this force and the experimentally observed
bulging of a liquid surface under intense illumination is explored.
","[{""version"":""v1"",""created"":""Tue, 28 Jan 2014 04:26:22 GMT""}]","2014-01-29"
"1401.7083","Aliakbar Alijani","Hossain Sahleh and Ali Akbar Alijani","Extensions of locally compact abelian, torsion-free groups by compact
  torsion abelian groups",,,,,"math.GR","http://arxiv.org/licenses/nonexclusive-distrib/1.0/","  Let $X$ be a compact torsion abelian group. In this paper, we show that an
extension of $F_{p}$ by $X$ splits where $F_{p}$ is the p-adic number group and
$p$ a prime number. Also, we show that an extension of a torsion-free,
non-divisible LCA group by $X$ is not split.
","[{""version"":""v1"",""created"":""Tue, 28 Jan 2014 04:29:18 GMT""},{""version"":""v2"",""created"":""Sun, 8 Mar 2015 03:31:56 GMT""}]","2015-03-10"
"1401.7084","Richard Brent","Richard P. Brent, Judy-anne H. Osborn and Warren D. Smith","Bounds on determinants of perturbed diagonal matrices","18 pages, 39 references. Added some references in v7","Linear Algebra and its Applications 466 (2015), 21-26","10.1016/j.laa.2014.09.041",,"math.NA math.CO","http://arxiv.org/licenses/nonexclusive-distrib/1.0/","  We give upper and lower bounds on the determinant of a perturbation of the
identity matrix or, more generally, a perturbation of a nonsingular diagonal
matrix. The matrices considered are, in general, diagonally dominant. The lower
bounds are best possible, and in several cases they are stronger than
well-known bounds due to Ostrowski and other authors. If $A = I-E$ is an $n
\times n$ matrix and the elements of $E$ are bounded in absolute value by
$\varepsilon \le 1/n$, then a lower bound of Ostrowski (1938) is $\det(A) \ge
1-n\varepsilon$. We show that if, in addition, the diagonal elements of $E$ are
zero, then a best-possible lower bound is \[\det(A) \ge
(1-(n-1)\varepsilon)\,(1+\varepsilon)^{n-1}.\] Corresponding upper bounds are
respectively \[\det(A) \le (1 + 2\varepsilon + n\varepsilon^2)^{n/2}\] and
\[\det(A) \le (1 + (n-1)\varepsilon^2)^{n/2}.\] The first upper bound is
stronger than Ostrowski's bound (for $\varepsilon < 1/n$) $\det(A) \le (1 -
n\varepsilon)^{-1}$. The second upper bound generalises Hadamard's inequality,
which is the case $\varepsilon = 1$.
  A necessary and sufficient condition for our upper bounds to be best possible
for matrices of order $n$ and all positive $\varepsilon$ is the existence of a
skew-Hadamard matrix of order $n$.
","[{""version"":""v1"",""created"":""Tue, 28 Jan 2014 04:45:21 GMT""},{""version"":""v2"",""created"":""Wed, 29 Jan 2014 11:00:48 GMT""},{""version"":""v3"",""created"":""Tue, 25 Feb 2014 12:33:26 GMT""},{""version"":""v4"",""created"":""Fri, 28 Feb 2014 03:24:41 GMT""},{""version"":""v5"",""created"":""Thu, 13 Mar 2014 14:01:28 GMT""},{""version"":""v6"",""created"":""Wed, 19 Mar 2014 09:10:24 GMT""},{""version"":""v7"",""created"":""Thu, 27 Mar 2014 10:55:06 GMT""}]","2021-07-05"
"1401.7085","Wentao Huang","Wentao Huang and Tracey Ho and Michael Langberg and Joerg Kliewer","Reverse Edge Cut-Set Bounds for Secure Network Coding",,,,,"cs.IT math.IT","http://arxiv.org/licenses/nonexclusive-distrib/1.0/","  We consider the problem of secure communication over a network in the
presence of wiretappers. We give a new cut-set bound on secrecy capacity which
takes into account the contribution of both forward and backward edges crossing
the cut, and the connectivity between their endpoints in the rest of the
network. We show the bound is tight on a class of networks, which demonstrates
that it is not possible to find a tighter bound by considering only cut set
edges and their connectivity.
","[{""version"":""v1"",""created"":""Tue, 28 Jan 2014 04:49:20 GMT""}]","2014-01-29"
"1401.7086","Jeffrey  Tsang","Jeffrey Tsang","N derivatives are necessary for order N+1 convergence in quadrature: a
  converse result","8 pages, 1 figure",,,,"math.NA","http://arxiv.org/licenses/nonexclusive-distrib/1.0/","  Results on the error bounds of quadrature methods are well known - most state
that if the method has degree N, and the integrand has N derivatives, then the
error is order N+1. We prove here a converse: that if the integrand fails to
have N derivatives, even only at a finite number of points, no method,
regardless of its degree, can guarantee convergence more than order N. Even if
the integrand fails to have N derivatives at just 3 (for even N, 2) points, no
method can produce order more than N+1 convergence. This is done by an
adversarial proof: we explicitly construct the functions that exhibit such
error; simple splines turn out to suffice.
","[{""version"":""v1"",""created"":""Tue, 28 Jan 2014 05:14:00 GMT""}]","2014-01-29"
"1401.7087","Seung Woo Shin","Seung Woo Shin, Graeme Smith, John A. Smolin, Umesh Vazirani","How ""Quantum"" is the D-Wave Machine?","16 pages, 9 figures. Uses figures from arXiv:1304.4595. Revised
  version. Enhanced presentation",,,,"quant-ph","http://arxiv.org/licenses/nonexclusive-distrib/1.0/","  Recently there has been intense interest in claims about the performance of
the D-Wave machine. In this paper, we outline a simple classical model, and
show that it achieves excellent correlation with published input-output
behavior of the D-Wave One machine on 108 qubits. While raising questions about
""how quantum"" the D-Wave machine is, the new model also provides additional
algorithmic insights into the nature of the native computational problem solved
by the D-Wave machine.
","[{""version"":""v1"",""created"":""Tue, 28 Jan 2014 05:35:16 GMT""},{""version"":""v2"",""created"":""Fri, 2 May 2014 19:37:19 GMT""}]","2014-05-05"
"1401.7088","Monowar Hasan","Hina Tabassum, Uzma Siddique, Ekram Hossain, and Md. Jahangir Hossain","Cellular Downlink Performance with Base Station Sleeping, User
  Association, and Scheduling","Submitted to IEEE Transactions on Wireless Communications",,"10.1109/TWC.2014.2336249",,"cs.NI cs.IT math.IT stat.AP","http://arxiv.org/licenses/nonexclusive-distrib/1.0/","  Base station (BS) sleeping has emerged as a viable solution to enhance the
overall network energy efficiency by inactivating the underutilized BSs.
However, it affects the performance of users in sleeping cells depending on
their BS association criteria, their channel conditions towards the active BSs,
and scheduling criteria and traffic loads at the active BSs. This paper
characterizes the performance of cellular systems with BS sleeping by
developing a systematic framework to derive the spectral efficiency and outage
probability of downlink transmission to the sleeping cell users taking into
account the aforementioned factors. In this context, we develop a user
association scheme in which a typical user in a sleeping cell selects a BS with
\textbf{M}aximum best-case \textbf{M}ean channel \textbf{A}ccess
\textbf{P}robability (MMAP) which is calculated by all active BSs based on
their existing traffic loads. We consider both greedy and round-robin schemes
at active BSs for scheduling users in a channel. Once the association is
performed, the exact access probability for a typical sleeping cell user and
the statistics of its received signal and interference powers are derived to
evaluate the spectral and energy efficiencies of transmission. For the sleeping
cell users, we also consider the conventional \textbf{M}aximum
\textbf{R}eceived \textbf{S}ignal \textbf{P}ower (MRSP)-based user association
scheme along with greedy and round-robin schemes at the BSs. The impact of
cell-zooming is incorporated in the derivations to analyze its feasibility in
reducing the coverage holes created by BS sleeping. Numerical results show the
trade-offs between spectral efficiency and energy efficiency in various network
scenarios. The accuracy of the analysis is verified through Monte-Carlo
simulations.
","[{""version"":""v1"",""created"":""Tue, 28 Jan 2014 05:39:31 GMT""}]","2016-11-17"
"1401.7089","Adrian Brown","Adrian J. Brown and Michael Storrie-Lombardi","MR PRISM - Spectral Analysis Tool for the CRISM","8 pages, 3 figures",,,,"astro-ph.IM astro-ph.EP","http://arxiv.org/licenses/nonexclusive-distrib/1.0/","  We describe a computer application designed to analyze hyperspectral data
collected by the Compact Infrared Spectrometer for Mars (CRISM). The
application links the spectral, imaging and mapping perspectives on the
eventual CRISM dataset by presenting the user with three different ways to
analyze the data.
  One of the goals when developing this instrument is to build in the latest
algorithms for detection of spectrally compelling targets on the surface of the
Red Planet, so they may be available to the Planetary Science community without
cost and with a minimal learning barrier to cross. This will allow the
Astrobiology community to look for targets of interest such as hydrothermal
minerals, sulfate minerals and hydrous minerals and be able to map the extent
of these minerals using the most up-to-date and effective algorithms.
  The application is programmed in Java and will be made available for Windows,
Mac and Linux platforms. Users will be able to embed Groovy scripts into the
program in order to extend its functionality. The first collection of CRISM
data will occur in September of 2006 and this data will be made publicly
available six months later via the Planetary Datasystem (PDS). Potential users
in the community should therefore look forward to a release date mid-2007.
  Although exploration of the CRISM data set is the motivating force for
developing these software tools, the ease of writing additional Groovy scripts
to access other data sets makes the tools useful for mineral exploration, crop
management, and characterization of extreme environments here on Earth or other
terrestrial planets. The system can be easily implemented for use by high
school, college, and graduate level students.
","[{""version"":""v1"",""created"":""Tue, 28 Jan 2014 05:47:28 GMT""}]","2014-01-29"
"1401.7090","Keang-Po Ho","Keang-Po Ho, Joseph M. Kahn and Jeffrey P. Wilde","Wavelength-Selective Switches for Mode-Division Multiplexing: Scaling
  and Performance Analysis","12 pages, 9 figures. appears in Journal of Lightwave Technology, 2014",,"10.1109/JLT.2014.2355812",,"physics.optics","http://arxiv.org/licenses/nonexclusive-distrib/1.0/","  Wavelength-selective switches for mode-division-multiplexing systems are
designed by scaling switches from single-mode systems. All modes at a given
wavelength are switched as a unit, which is necessary in systems with
substantial mode coupling, and minimizes the number of ports required to
accommodate a given traffic volume. When a pure mode is present at the input,
modal transmission and coupling coefficients are mode-dependent and may be
computed using a simple mode-clipping model. When multiple modes are present,
interference between modes alters the transmission and coupling coefficients,
shifting the passband center frequency and changing its bandwidth.
Mode-coupling matrices are used to compute mixed modes having the narrowest or
widest bandwidths, or having the largest center-frequency offsets. In a
specific design for graded-index fiber, five mode groups and 50-GHz channel
spacing, the one-sided bandwidth may change up to $\pm$3.6 GHz. In a system
with many cascaded switches and strong mode coupling, the end-to-end response
per switch may be characterized by a mode-averaged transmission coefficient.
","[{""version"":""v1"",""created"":""Tue, 28 Jan 2014 06:02:16 GMT""},{""version"":""v2"",""created"":""Thu, 4 Sep 2014 04:22:48 GMT""}]","2015-06-18"
"1401.7091","Lihua You","Wenxi Hong, Lihua You","Spectral radius and signless Laplacian spectral radius of strongly
  connected digraphs","20 pages, 6 figures",,,,"math.CO","http://creativecommons.org/licenses/by/3.0/","  Let D be a strongly connected digraph and A(D) be the adjacency matrix of D.
Let diag(D) be the diagonal matrix with outdegrees of the vertices of D and
Q(D) = diag(D) + A(D) be the signless Laplacian matrix of D. The spectral
radius of Q(D) is called the signless Laplacian spectral radius of D, denoted
by q(D). In this paper, we give sharp bound on q(D) with outdegree sequence and
compare the bound with some known bounds, establish some sharp upper or lower
bound on q(D) with some given parameter such as clique number, girth or vertex
connectivity, and characterize the corresponding extremal digraph or proposed
open problem. In addition, we also determine the unique digraph which achieves
the minimum (or maximum), the second minimum (or maximum), the third minimum,
the fourth minimum spectral radius and signless Laplacian spectral radius among
all strongly connected digraphs, and answer the open problem proposed by
Lin-Shu [H.Q. Lin, J.L. Shu, A note on the spectral characterization of
strongly connected bicyclic digraphs, Linear Algebra Appl. 436 (2012)
2524{2530].
","[{""version"":""v1"",""created"":""Tue, 28 Jan 2014 06:10:52 GMT""}]","2014-01-29"
