"1401.6982","Nicola Perra","Fabio Ciulla, Nicola Perra, Andrea Baronchelli, Alessandro Vespignani","Damage detection via shortest path network sampling",,,"10.1103/PhysRevE.89.052816",,"physics.soc-ph","http://arxiv.org/licenses/nonexclusive-distrib/1.0/","  Large networked systems are constantly exposed to local damages and failures
that can alter their functionality. The knowledge of the structure of these
systems is however often derived through sampling strategies whose
effectiveness at damage detection has not been thoroughly investigated so far.
Here we study the performance of shortest path sampling for damage detection in
large scale networks. We define appropriate metrics to characterize the
sampling process before and after the damage, providing statistical estimates
for the status of nodes (damaged, not-damaged). The proposed methodology is
flexible and allows tuning the trade-off between the accuracy of the damage
detection and the number of probes used to sample the network. We test and
measure the efficiency of our approach considering both synthetic and real
networks data. Remarkably, in all the systems studied the number of correctly
identified damaged nodes exceeds the number false positives allowing to uncover
precisely the damage.
","[{""version"":""v1"",""created"":""Mon, 27 Jan 2014 19:53:29 GMT""},{""version"":""v2"",""created"":""Wed, 29 Jan 2014 19:35:02 GMT""}]","2015-06-18"
"1401.6983","Giovanni Caviglia","Giovanni Caviglia","A Model Structure for Enriched Coloured Operads","44 pages, Preliminary version, comments are welcome",,,,"math.AT math.CT","http://arxiv.org/licenses/nonexclusive-distrib/1.0/","  We prove that, under certain conditions, the model structure on a monoidal
model category $\mathcal{V}$ can be transferred to a model structure on the
category of $\mathcal{V}$-enriched coloured (symmetric) operads. As a
particular case we recover the known model structure on simplicial operads.
","[{""version"":""v1"",""created"":""Mon, 27 Jan 2014 19:54:18 GMT""}]","2014-01-28"
"1401.6984","Yajie Miao","Yajie Miao","Kaldi+PDNN: Building DNN-based ASR Systems with Kaldi and PDNN","unpublished manuscript",,,,"cs.LG cs.CL","http://creativecommons.org/licenses/by-nc-sa/3.0/","  The Kaldi toolkit is becoming popular for constructing automated speech
recognition (ASR) systems. Meanwhile, in recent years, deep neural networks
(DNNs) have shown state-of-the-art performance on various ASR tasks. This
document describes our open-source recipes to implement fully-fledged DNN
acoustic modeling using Kaldi and PDNN. PDNN is a lightweight deep learning
toolkit developed under the Theano environment. Using these recipes, we can
build up multiple systems including DNN hybrid systems, convolutional neural
network (CNN) systems and bottleneck feature systems. These recipes are
directly based on the Kaldi Switchboard 110-hour setup. However, adapting them
to new datasets is easy to achieve.
","[{""version"":""v1"",""created"":""Mon, 27 Jan 2014 19:55:34 GMT""}]","2014-01-28"
"1401.6985","Roldao da Rocha","D. Bazeia, J. M. Hoff da Silva, Roldao da Rocha","Regular Bulk Solutions and Black Strings from Dynamical Braneworlds with
  Variable Tension","22 pages, 12 figures. Analysis of the regular bulk improved","Phys. Rev. D 90, 047902 (2014)","10.1103/PhysRevD.90.047902",,"hep-th gr-qc math-ph math.MP","http://arxiv.org/licenses/nonexclusive-distrib/1.0/","  Regular black strings solutions associated to a dynamical
Friedmann-Robertson-Walker braneworld are obtained as a particular case of a
regular bulk metric, in the context of a variable brane tension. By analyzing
the 5D Kretschmann invariants, we show that the variable brane tension is
capable to remove bulk singularities, along some eras of the evolution of the
Universe. In particular, the black string time-dependent profile in the bulk is
analyzed in the context of the McVittie metric on an E\""otv\""os fluid
braneworld, wherein the fluid dynamical brane tension depends on the brane
temperature. The whole bulk is shown to be regular for a Universe dominated by
non-relativistic matter or by relativistic matter/radiation, as the
cosmological time elapses. In a particular case the associated black strings
are shown to have finite extension along the extra dimension, what prominently
modify the higher-dimensional physical singularities. For a Universe dominated
by matter or radiation, we show that the brane singularities are removed along
the extra dimension, as an effect of the variable brane tension, corresponding
also to the vanishing of the black string horizon. In this case there is a
regular solution in the bulk. We show further that no additional physical
singularity is introduced in the bulk when the Universe is dominated by a
cosmological constant.
","[{""version"":""v1"",""created"":""Mon, 27 Jan 2014 19:56:02 GMT""},{""version"":""v2"",""created"":""Wed, 19 Mar 2014 22:49:14 GMT""}]","2014-09-05"
"1401.6986","Sebastien Maret S\'ebastien Maret","S. Maret, A. Belloche, A. J. Maury, F. Gueth, Ph. Andr\'e, S. Cabrit,
  C. Codella, and S. Bontemps","First results from the CALYPSO IRAM-PdBI survey. I. Kinematics of the
  inner envelope of NGC1333-IRAS2A","Accepted for publication in A&A letters",,"10.1051/0004-6361/201323028",,"astro-ph.GA","http://arxiv.org/licenses/nonexclusive-distrib/1.0/","  The structure and kinematics of Class 0 protostars on scales of a few hundred
AU is poorly known. Recent observations have revealed the presence of Keplerian
disks with a diameter of 150-180 AU in L1527-IRS and VLA1623A, but it is not
clear if such disks are common in Class 0 protostars. Here we present
high-angular-resolution observations of two methanol lines in NGC1333-IRAS2A.
We argue that these lines probe the inner envelope, and we use them to study
the kinematics of this region. Our observations suggest the presence of a
marginal velocity gradient normal to the direction of the outflow. However, the
position velocity diagrams along the gradient direction appear inconsistent
with a Keplerian disk. Instead, we suggest that the emission originates from
the infalling and perhaps slowly rotating envelope, around a central protostar
of 0.1-0.2 M$_\odot$. If a disk is present, it is smaller than the disk of
L1527-IRS, perhaps suggesting that NGC1333-IRAS2A is younger.
","[{""version"":""v1"",""created"":""Mon, 27 Jan 2014 19:56:20 GMT""},{""version"":""v2"",""created"":""Fri, 31 Jan 2014 15:04:48 GMT""}]","2014-03-05"
"1401.6987","Zhang Shoushan","B. Bartoli, P. Bernardini, X.J. Bi, I. Bolognino, P. Branchini, A.
  Budano, A.K. Calabrese Melcarne, P. Camarri, Z. Cao, R. Cardarelli, S.
  Catalanotti, S.Z. Chen, T.L. Chen, P. Creti, S.W. Cui, B.Z. Dai, A. D'Amone,
  Danzengluobu, I. De Mitri, B. D'Ettorre Piazzoli, T. Di Girolamo, G. Di
  Sciascio, C.F. Feng, Zhaoyang Feng, Zhenyong Feng, Q.B. Gou, Y.Q. Guo, H.H.
  He, Haibing Hu, Hongbo Hu, M. Iacovacci, R. Iuppa, H.Y. Jia, Labaciren, H.J.
  Li, G. Liguori, C. Liu, J. Liu, M.Y. Liu, H. Lu, L.L. Ma, X.H. Ma, G.
  Mancarella, S.M. Mari, G. Marsella, D. Martello, S. Mastroianni, P. Montini,
  C.C. Ning, M. Panareo, B. Panico, L. Perrone, P. Pistilli8, F. Ruggieri, P.
  Salvini, R. Santonico, S.N. Sbano, P.R. Shen, X.D. Sheng, F. Shi, A. Surdo,
  Y.H. Tan, P. Vallania, S. Vernetto, C. Vigorito, H. Wang, C.Y. Wu, H.R. Wu,
  L. Xue, Q.Y. Yang, X.C. Yang, Z.G. Yao, A.F. Yuan, M. Zha, H.M. Zhang, L.
  Zhang, X.Y. Zhang, Y. Zhang, J. Zhao, Zhaxiciren, Zhaxisangzhu, X.X. Zhou,
  F.R. Zhu, Q.Q. Zhu, G. Zizzi for ARGO-YBJ Collaboration, Y.X. Bai, M.J. Chen,
  Y. Chen, S.H. Feng, B. Gao, M.H. Gu, C. Hou, X.X. Li, J. Liu, J.L. Liu, X.
  Wang, G. Xiao, B.K. Zhang, S.S. Zhang, B. Zhou, X. Zuo for LHAASO
  Collaboration","Energy Spectrum of Cosmic Protons and Helium Nuclei by a Hybrid
  Measurement at 4300 m a.s.l","To be published on Chinese Physics C",,"10.1088/1674-1137/38/4/045001",,"astro-ph.HE hep-ex","http://arxiv.org/licenses/nonexclusive-distrib/1.0/","  The energy spectrum of cosmic Hydrogen and Helium nuclei has been measured,
below the so-called ""knee"", by using a hybrid experiment with a wide
field-of-view Cherenkov telescope and the Resistive Plate Chamber (RPC) array
of the ARGO-YBJ experiment at 4300 m above sea level. The Hydrogen and Helium
nuclei have been well separated from other cosmic ray components by using a
multi-parameter technique. A highly uniform energy resolution of about 25% is
achieved throughout the whole energy range (100 TeV - 700 TeV). The observed
energy spectrum is compatible with a single power law with index
gamma=-2.63+/-0.06.
","[{""version"":""v1"",""created"":""Mon, 27 Jan 2014 19:58:09 GMT""},{""version"":""v2"",""created"":""Fri, 7 Feb 2014 04:10:13 GMT""}]","2015-06-18"
"1401.6988","Marcos Portnoi","Marcos Portnoi","Criptografia com Curvas El\'ipticas","Portuguese, 14 pages",,,,"cs.CR","http://arxiv.org/licenses/nonexclusive-distrib/1.0/","  This paper presents an overview of the use of elliptic curves in
cryptography. The security of this cryptosystem is based on the discrete
logarithm problem, which appears to be much harder compared to the discrete
logarithm problem in other cryptosystems. An overview of common cryptosystems
is given, such as Diffie-Hellman and RSA, and an elliptic curve cryptography
scheme is discussed.
  --------
  Este trabalho apresenta o uso das curvas el\'ipticas em criptografia. Sua
seguran\c{c}a est\'a baseada no problema do logaritmo discreto. Este problema
aparentemente \'e significativamente mais dif\'icil de resolver, comparado com
o problema do logaritmo discreto usado por outros sistemas de criptografia. \'E
dada uma vis\~ao geral de sistemas de criptografia comuns, como Diffie-Hellman
e RSA, e discute-se um esquema de criptografia usando curvas el\'ipticas.
","[{""version"":""v1"",""created"":""Mon, 27 Jan 2014 20:15:17 GMT""}]","2014-01-28"
"1401.6989","Mehmet Haluk \c{S}eng\""un","Nicolas Bergeron, Mehmet Haluk Sengun, Akshay Venkatesh","Torsion homology growth and cycle complexity of arithmetic manifolds",,"Duke Math. J. 165, no. 9 (2016), 1629-1693","10.1215/00127094-3450429",,"math.NT math.GT","http://arxiv.org/licenses/nonexclusive-distrib/1.0/","  Let M be an arithmetic hyperbolic 3-manifold, such as a Bianchi manifold. We
conjecture that there is a basis for the second homology of M, where each basis
element is represented by a surface of `low' genus, and give evidence for this.
We explain the relationship between this conjecture and the study of torsion
homology growth.
","[{""version"":""v1"",""created"":""Mon, 27 Jan 2014 20:18:48 GMT""}]","2016-08-17"
"1401.6990","Riccardo Arpaia","Riccardo Arpaia, Marco Arzeo, Shahid Nawaz, Sophie Charpentier,
  Floriana Lombardi, and Thilo Bauch","Ultra low noise YBCO nanoSQUIDs implementing nanowires","11 pages, 4 figures, submitted to Appl. Phys. Lett. 25/01/2014","Appl. Phys. Lett. 104, 072603 (2014)","10.1063/1.4866277",,"cond-mat.supr-con","http://arxiv.org/licenses/nonexclusive-distrib/1.0/","  We present results on ultra low noise YBa$_2$Cu$_3$O$_{7-\delta}$ nano
Superconducting QUantum Interference Devices (nanoSQUIDs). To realize such
devices, we implemented high quality YBCO nanowires, working as weak links
between two electrodes. We observe critical current modulation as a function of
an externally applied magnetic field in the full temperature range below the
transition temperature $T_C$. The white flux noise below 1 $\mu
\Phi_0/\sqrt{\mathrm{Hz}}$ at T = 8 K makes our nanoSQUIDs very attractive for
the detection of small spin systems.
","[{""version"":""v1"",""created"":""Mon, 27 Jan 2014 20:23:40 GMT""}]","2014-03-07"
"1401.6991","Decio Levi","Decio Levi, Eugenio Ricca, Zora Thomova and Pavel Winternitz","Lie group analysis of a generalized Krichever-Novikov
  differential-difference equation",,,"10.1063/1.4896989",,"nlin.SI math-ph math.GR math.MP","http://arxiv.org/licenses/nonexclusive-distrib/1.0/","  The symmetry algebra of the differential--difference equation $$\dot u_n =
[P(u_n)u_{n+1}u_{n-1} + Q(u_n)(u_{n+1}+u_{n-1})+ R(u_n)]/(u_{n+1}-u_{n-1}),$$
where $P$, $Q$ and $R$ are arbitrary analytic functions is shown to have the
dimension $1 \le \mbox{dim}L \le 5$. When $P$, $Q$ and $R$ are specific second
order polynomials in $u_n$ (depending on 6 constants) this is the integrable
discretization of the Krichever--Novikov equation. We find 3 cases when the
arbitrary functions are not polynomials and the symmetry algebra satisfies
$\mbox{dim}L=2$. These cases are shown not to be integrable. The symmetry
algebras are used to reduce the equations to purely difference ones. The
symmetry group is also used to impose periodicity $u_{n+N}=u_n$ and thus to
reduce the differential--difference equation to a system of $N$ coupled
ordinary three points difference equations.
","[{""version"":""v1"",""created"":""Mon, 27 Jan 2014 20:26:57 GMT""}]","2015-06-18"
"1401.6992","Doowon Koh","Doowon Koh and Youngjin Pi","Size of dot product sets determined by pairs of subsets of vector spaces
  over finite fields","11 pages","JOURNAL OF THE CHUNGCHEONG MATHEMATICAL SOCIETY, Volume 26, No. 4,
  November 2013",,,"math.CO","http://arxiv.org/licenses/nonexclusive-distrib/1.0/","  In this paper we study the cardinality of the dot product set generated by
two subsets of vector spaces over finite fields. We notice that the results on
the dot product problems for one set can be simply extended to two sets. Let E
and F be subsets of the d-dimensional vector space F_q^d over a finite field
F_q with q elements. As a new result, we prove that if E and F are subsets of
the paraboloid and |E||F|\geq C q^d for some large C>1, then |\Pi(E,F)|\geq c q
for some 0<c<1. In particular, we find a connection between the size of the dot
product set and the number of lines through both the origin and a nonzero point
in the given set E. As an application of this observation, we obtain more
sharpened results on the generalized dot product set problems. The discrete
Fourier analysis and geometrical observation play a crucial role in proving our
results.
","[{""version"":""v1"",""created"":""Mon, 27 Jan 2014 20:29:00 GMT""}]","2014-01-28"
"1401.6993","Aron Walsh","Federico Brivio, Keith T. Butler, Aron Walsh, Mark van Schilfgaarde","Relativistic quasiparticle self-consistent electronic structure of
  hybrid halide perovskite photovoltaic absorbers",,"Physical Review B 89, 155204 (2014)","10.1103/PhysRevB.89.155204",,"cond-mat.mtrl-sci","http://arxiv.org/licenses/nonexclusive-distrib/1.0/","  Solar cells based on a light absorbing layer of the organometal halide
perovskite CH$_3$NH$_3$PbI$_3$ have recently reached 15% conversion efficiency,
though how these materials work remains largely unknown. We analyse the
electronic structure and optical properties within the quasiparticle
self-consistent GW approximation. While this compound bears some similarity to
conventional sp semiconductors, it also displays unique features. Quasiparticle
self-consistency is essential for an accurate description of the band
structure: bandgaps are much larger than what is predicted by the local density
approximation (LDA) or GW based on the LDA. Valence band dispersions are
modified in a very unusual manner. In addition, spin orbit coupling strongly
modifies the band structure and gives rise to unconventional dispersion
relations and a Dresselhaus splitting at the band edges. The average hole mass
is small, which accounts for the long diffusion lengths recently observed. The
surface ionisation potential (workfunction) is calculated to be 5.7 eV with
respect to the vacuum level, explaining efficient carrier transfer to TiO$_2$
and Au electrical contacts.
","[{""version"":""v1"",""created"":""Mon, 27 Jan 2014 20:29:07 GMT""},{""version"":""v2"",""created"":""Tue, 11 Feb 2014 15:32:22 GMT""},{""version"":""v3"",""created"":""Thu, 13 Mar 2014 08:27:54 GMT""},{""version"":""v4"",""created"":""Tue, 22 Apr 2014 23:13:55 GMT""}]","2014-04-24"
"1401.6994","Andre Massing","Mats G. Larson, Andre Massing","$L^2$-error estimates for finite element approximations of boundary
  fluxes","16 pages, 3 figures",,,,"math.NA","http://arxiv.org/licenses/nonexclusive-distrib/1.0/","  We prove quasi-optimal a priori error estimates for finite element
approximations of boundary normal fluxes in the $L^2$-norm. Our results are
valid for a variety of different schemes for weakly enforcing Dirichlet
boundary conditions including Nitsche's method, and Lagrange multiplier
methods. The proof is based on an error representation formula that is derived
by using a discrete dual problem with $L^2$-Dirichlet boundary data and
combines a weighted discrete stability estimate for the dual problem with
anisotropic interpolation estimates in the boundary zone.
","[{""version"":""v1"",""created"":""Mon, 27 Jan 2014 20:31:56 GMT""}]","2014-01-28"
"1401.6995","Jerry Vavra","J.Va'vra","What is needed to accept the new explanation of DAMA results",,,,,"astro-ph.IM physics.ins-det","http://arxiv.org/licenses/nonexclusive-distrib/1.0/","  The DAMA experiment clearly observes a small oscillatory signal. The observed
yearly modulation is in phase with the Earth's motion around the Sun. Recent
reference [Vavra, 2014] suggested that the DAMA experiment observes a WIMP of
much smaller mass than what Xenon 10, Xenon 100, LUX and CDMS experiments can
possibly reach. Scattering would occur on proton or oxygen target present in
the NaI(Tl) crystal as OH-contamination at a few ppm level. This paper
elaborates further on the idea that the OH-molecule could act as a very
sensitive detection mechanism for neutrons or WIMPs, and suggests a calibration
procedure to prove this idea. We also propose a new detector concept to detect
a low mass WIMP.
","[{""version"":""v1"",""created"":""Mon, 27 Jan 2014 20:32:37 GMT""}]","2014-01-28"
"1401.6996","Edward Witten","Edward Witten","Two Lectures On The Jones Polynomial And Khovanov Homology","26 pp",,,,"math.GT hep-th math.DG","http://arxiv.org/licenses/nonexclusive-distrib/1.0/","  In the first of these two lectures, I describe a gauge theory approach to
understanding quantum knot invariants as Laurent polynomials in a complex
variable q. The two main steps are to reinterpret three-dimensional
Chern-Simons gauge theory in four dimensional terms and then to apply
electric-magnetic duality. The variable q is associated to instanton number in
the dual description in four dimensions. In the second lecture, I describe how
Khovanov homology can emerge upon adding a fifth dimension. (Based on lectures
presented at the Clay Research Conference at Oxford University, and also at the
Galileo Galilei Institute in Florence, the University of Milan, Harvard
University, and the University of Pennsylvania.)
","[{""version"":""v1"",""created"":""Mon, 27 Jan 2014 20:35:57 GMT""}]","2014-01-28"
"1401.6997","Doowon Koh","Hunseok Kang and Doowon Koh","Weak version of restriction estimates for spheres and paraboloids in
  finite fields","12 pages",,,,"math.CA","http://arxiv.org/licenses/nonexclusive-distrib/1.0/","  We study L^p-L^r restriction estimates for algebraic varieties in
d-dimensional vector spaces over finite fields. Unlike the Euclidean case, if
the dimension $d$ is even, then it is conjectured that the L^{(2d+2)/(d+3)}-L^2
Stein-Tomas restriction result can be improved to the L^{(2d+4)/(d+4)}-L^2
estimate for both spheres and paraboloids in finite fields. In this paper we
show that the conjectured L^p-L^2 restriction estimate holds in the specific
case when test functions under consideration are restricted to d-coordinate
functions or homogeneous functions of degree zero. To deduce our result, we use
the connection between the restriction phenomena for our varieties in $d$
dimensions and those for homogeneous varieties in (d+1)dimensions.
","[{""version"":""v1"",""created"":""Mon, 27 Jan 2014 20:36:17 GMT""}]","2014-01-28"
"1401.6998","Anaelle Maury","A. J. Maury, A. Belloche, Ph. Andr\'e, S. Maret, F. Gueth, C. Codella,
  S. Cabrit, L. Testi, S. Bontemps","First results from the CALYPSO IRAM-PdBI survey. II. Resolving the hot
  corino in the Class 0 protostar NGC 1333-IRAS2A","Accepted for publication in A&A letters",,"10.1051/0004-6361/201323033",,"astro-ph.GA","http://arxiv.org/licenses/nonexclusive-distrib/1.0/","  We investigate the origin of complex organic molecules (COMs) in the gas
phase around the low-mass Class~0 protostar NGC1333-IRAS2A, to determine if the
COM emission lines trace an embedded disk, shocks from the protostellar jet, or
the warm inner parts of the protostellar envelope. In the framework of the
CALYPSO (Continuum And Lines in Young ProtoStellar Objects) IRAM Plateau de
Bure survey, we obtained large bandwidth spectra at sub-arcsecond resolution
towards NGC 1333-IRAS2A. We identify the emission lines towards the central
protostar and perform Gaussian fits to constrain the size of the emitting
region for each of these lines, tracing various physical conditions and scales.
The emission of numerous COMs such as methanol, ethylene glycol, and methyl
formate is spatially resolved by our observations. This allows us to measure,
for the first time, the size of the COM emission inside the protostellar
envelope, finding that it originates from a region of radius 40-100 AU,
centered on the NGC 1333-IRAS2A protostellar object. Our analysis shows no
preferential elongation of the COM emission along the jet axis, and therefore
does not support the hypothesis that COM emission arises from shocked envelope
material at the base of the jet. Down to similar sizes, the dust continuum
emission is well reproduced with a single envelope model, and therefore does
not favor the hypothesis that COM emission arises from the thermal sublimation
of grains embedded in a circumstellar disk. Finally, the typical scale $\sim$60
AU observed for COM emission is consistent with the size of the inner envelope
where $T_{\rm{dust}} > 100$ K is expected. Our data therefore strongly suggest
that the COM emission traces the hot corino in IRAS2A, i.e., the warm inner
envelope material where the icy mantles of dust grains evaporate because they
are passively heated by the central protostellar object.
","[{""version"":""v1"",""created"":""Mon, 27 Jan 2014 20:38:45 GMT""}]","2014-03-05"
"1401.6999","Yulia Emelianova","Yulia P. Emelianova, Valeriy V. Emelyanov, Nikita M. Ryskin","Synchronization of two coupled multimode oscillators with time-delayed
  feedback","19 pages, 10 figures",,"10.1016/j.cnsns.2014.03.031",,"nlin.CD physics.comp-ph","http://arxiv.org/licenses/nonexclusive-distrib/1.0/","  Effects of synchronization in a system of two coupled oscillators with
time-delayed feedback are investigated. Phase space of a system with time delay
is infinite-dimensional. Thus, the picture of synchronization in such systems
acquires many new features not inherent to finite-dimensional ones. A picture
of oscillation modes in cases of identical and non-identical coupled
oscillators is studied in detail. Periodical structure of amplitude death and
""broadband synchronization"" zones is investigated. Such a behavior occurs due
to the resonances between different modes of the infinite-dimensional system
with time delay.
","[{""version"":""v1"",""created"":""Mon, 27 Jan 2014 20:46:17 GMT""},{""version"":""v2"",""created"":""Wed, 29 Jan 2014 08:14:35 GMT""},{""version"":""v3"",""created"":""Sat, 3 May 2014 09:08:15 GMT""}]","2014-05-06"
"1401.7000","Roberto Peirone","Roberto Peirone","Uniqueness of Eigenforms on Fractals-II","20 pages",,,,"math.FA","http://arxiv.org/licenses/nonexclusive-distrib/1.0/","  I give an explicitly verifiable necessary and sufficient condition for the
uniqueness of the eigenform on finitely ramified fractals, once an eigenform is
known. This improves the results of my previous paper [14], where I gave some
necessary and some sufficient conditions, and with a relatively mild additional
requirement on the known eigenform. The result of this paper can be interpreted
as a uniqueness result for self-similar energies on the fractal.
","[{""version"":""v1"",""created"":""Mon, 27 Jan 2014 20:52:51 GMT""},{""version"":""v2"",""created"":""Mon, 31 Mar 2014 09:21:56 GMT""}]","2014-04-01"
"1401.7001","Rene Michel","Rene Michel, Igor Schnakenburg, Tobias von Martens","A modified $\chi^2$-test for uplift models with applications in
  marketing performance measurement","18 pages, 7 figures",,,,"math.ST stat.TH","http://arxiv.org/licenses/nonexclusive-distrib/1.0/","  Uplift, essentially being the difference between two probabilities, is a
central number in marketing performance measurement. A frequent question in
applications is whether the uplifts of two campaigns are significantly
different. In this article we present a new $\chi^2$-statistic which allows to
answer this question by performing a statistical test. We show that this
statistic is asymptotically $\chi^2$-distributed and demonstrate its
application in a real life example. By running simulations with this new and
alternative approaches, we find our suggested test to exhibit a better decisive
power.
","[{""version"":""v1"",""created"":""Mon, 27 Jan 2014 20:54:59 GMT""}]","2014-01-28"
