"1410.2075","Oliver Schaudt","Van Bang Le and Andrea Oversberg and Oliver Schaudt","Squares of $3$-sun-free split graphs",,,,,"cs.CC cs.DM","http://arxiv.org/licenses/nonexclusive-distrib/1.0/","  The square of a graph $G$, denoted by $G^2$, is obtained from $G$ by putting
an edge between two distinct vertices whenever their distance is two. Then $G$
is called a square root of $G^2$. Deciding whether a given graph has a square
root is known to be NP-complete, even if the root is required to be a split
graph, that is, a graph in which the vertex set can be partitioned into a
stable set and a clique.
  We give a wide range of polynomial time solvable cases for the problem of
recognizing if a given graph is the square of some special kind of split graph.
To the best of our knowledge, our result properly contains all previously known
such cases. Our polynomial time algorithms are build on a structural
investigation of graphs that admit a split square root that is 3-sun-free, and
may pave the way toward a dichotomy theorem for recognizing squares of
(3-sun-free) split graphs.
","[{""version"":""v1"",""created"":""Wed, 8 Oct 2014 12:05:59 GMT""}]","2014-10-13"
"1410.2076","Fr\'ed\'eric Pierret","Fr\'ed\'eric Pierret","Helmholtz theorem for Hamiltonian systems on time scales",,"International Journal of Difference Equations, 10(1), pp. 121-135,
  2015",,,"math.OC","http://arxiv.org/licenses/nonexclusive-distrib/1.0/","  We derive the Helmholtz theorem for Hamiltonian systems defined on time
scales in the context of nonshifted calculus of variations which encompass the
discrete and continuous case. Precisely, we give a theorem characterizing first
order equation on time scales, admitting a Hamiltonian formulation which is
defined with non-shifted calculus of variation. Moreover, in the affirmative
case, we give the associated Hamiltonian.
","[{""version"":""v1"",""created"":""Wed, 8 Oct 2014 12:13:53 GMT""}]","2015-07-23"
"1410.2077","Markus Klein","Markus Klein and Andreas Prohl","Optimal control for the thin-film equation: Convergence of a
  multi-parameter approach to track state constraints avoiding degeneracies",,,,,"math.OC math.AP","http://arxiv.org/licenses/nonexclusive-distrib/1.0/","  We consider an optimal control problem subject to the thin-film equation
which is deduced from the Navier--Stokes equation. The PDE constraint lacks
well-posedness for general right-hand sides due to possible degeneracies; state
constraints are used to circumvent this problematic issue and to ensure
well-posedness, and the rigorous derivation of necessary optimality conditions
for the optimal control problem is performed. A multi-parameter regularization
is considered which addresses both, the possibly degenerate term in the
equation and the state constraint, and convergence is shown for vanishing
regularization parameters by decoupling both effects. The fully regularized
optimal control problem allows for practical simulations which are provided,
including the control of a dewetting scenario, to evidence the need of the
state constraint, and to motivate proper scalings of involved regularization
and numerical parameters.
","[{""version"":""v1"",""created"":""Wed, 8 Oct 2014 12:17:16 GMT""},{""version"":""v2"",""created"":""Tue, 23 Dec 2014 11:07:39 GMT""},{""version"":""v3"",""created"":""Sat, 8 Aug 2015 06:15:55 GMT""}]","2015-08-11"
"1410.2078","Amit Das","Amit K. Das and Arup Banerjee","Calculation of ground state energy of harmonically confined two dipolar
  fermions",,,,,"physics.atm-clus cond-mat.quant-gas","http://arxiv.org/licenses/nonexclusive-distrib/1.0/","  We calculate the ground state energies of a system of two dipolar fermions
trapped in a harmonic oscillator potential. The dipoles are assumed to be
aligned parallel to each other. We perform the calculations of ground state
energy as a function of strength of interaction between two fermions by
employing variational method with Hylleraas-like explicitly correlated wave
function. Furthermore, we perform calculations of ground state energy within
Hartree-Fock approximation and the magnitude of correlation energy is estimated
by subtracting these results from the corresponding wave function based
results. We also carry out calculations of ground state energies within the
realm of density functional theory by using recently reported expressions for
exchange and correlation energies under local density approximation. By
comparing correlated wave function based results with those obtained using
density functional theory approach we examine the role of fermion-fermion
correlation and assess the accuracy of local density approximation based
expression for the correlation energy functional.
","[{""version"":""v1"",""created"":""Wed, 8 Oct 2014 12:17:16 GMT""}]","2014-10-09"
"1410.2079","Hasan Yilmaz","Hasan Yilmaz, Elbert G. van Putten, Jacopo Bertolotti, Ad Lagendijk,
  Willem L. Vos, and Allard P. Mosk","Exploiting speckle correlations to improve the resolution of wide-field
  fluorescence microscopy",,"Optica, Vol. 2, Issue 5, pp. 424-429 (2015)","10.1364/OPTICA.2.000424",,"physics.optics","http://arxiv.org/licenses/nonexclusive-distrib/1.0/","  Fluorescence microscopy is indispensable in nanoscience and biological
sciences. The versatility of labeling target structures with fluorescent dyes
permits to visualize structure and function at a subcellular resolution with a
wide field of view. Due to the diffraction limit, conventional optical
microscopes are limited to resolving structures larger than 200 nm. The
resolution can be enhanced by near-field and far-field super-resolution
microscopy methods. Near-field methods typically have a limited field of view
and far-field methods are limited by the involved conventional optics. Here, we
introduce a combined high-resolution and wide-field fluorescence microscopy
method that improves the resolution of a conventional optical microscope by
exploiting correlations in speckle illumination through a randomly scattering
high-index medium: Speckle correlation resolution enhancement (SCORE). As a
test, we collect two-dimensional fluorescence images of 100-nm diameter
dye-doped nanospheres. We demonstrate a deconvolved resolution of 130 nm with a
field of view of 10 x 10 $\text{\mu m}^2$.
","[{""version"":""v1"",""created"":""Wed, 8 Oct 2014 12:19:56 GMT""}]","2015-05-05"
"1410.2080","Florian Wendler","Florian Wendler and Ermin Malic","Population inversion in Landau-quantized graphene",,"Sci. Rep. 5, 12646 (2015)","10.1038/srep12646",,"cond-mat.mes-hall cond-mat.mtrl-sci physics.optics","http://arxiv.org/licenses/nonexclusive-distrib/1.0/","  Landau level lasers have the advantage of tunability of the laser frequency
by means of the external magnetic field. The crucial prerequisite of such a
laser is a population inversion between optically coupled Landau levels.
Efficient carrier-carrier and carrier-phonon scattering generally suppresses
this effect in conventional materials. Based on microscopic calculations, we
predict for the first time the occurrence of a long-lived population inversion
in Landau-quantized graphene and reveal the underlying many-particle
mechanisms. To guide the experimental demonstration, we present optimal
conditions for the observation of a maximal population inversion in terms of
experimentally accessible parameters, such as the strength of the magnetic
field, pump fluence, temperature, and doping. We reveal that in addition to the
tunability of the Landau-level laser frequency, also the polarization of the
emitted light can be tuned via gate voltage controlling the doping of the
sample.
","[{""version"":""v1"",""created"":""Wed, 8 Oct 2014 12:21:57 GMT""}]","2015-09-04"
"1410.2081","Melanie Koehler Dr","M. K\""ohler, E. Habart, H. Arab, J. Bernard-Salas, H. Ayasso, A.
  Abergel, A. Zavagno, E. Polehampton, M.H.D. van der Wiel, D.A. Naylor, G.
  Makiwa, K. Dassas, C. Joblin, P. Pilleri, O. Berne, A. Fuente, M. Gerin, J.
  R. Goicoechea, D. Teyssier","Physical structure of the photodissociation regions in NGC 7023.
  Observations of gas and dust emission with Herschel","Abstract shortened","A&A 569, 109, 2014","10.1051/0004-6361/201322711",,"astro-ph.GA","http://arxiv.org/licenses/nonexclusive-distrib/1.0/","  The determination of the physical conditions in molecular clouds is a key
step towards our understanding of their formation and evolution of associated
star formation. We investigate the density, temperature, and column density of
both dust and gas in the photodissociation regions (PDRs) located at the
interface between the atomic and cold molecular gas of the NGC 7023 reflection
nebula. We study how young stars affect the gas and dust in their environment.
Our approach combining both dust and gas delivers strong constraints on the
physical conditions of the PDRs. We find dense and warm molecular gas of high
column density in the PDRs.
","[{""version"":""v1"",""created"":""Wed, 8 Oct 2014 12:24:31 GMT""}]","2014-10-09"
"1410.2082","Yang Liu","Yang Liu, Maosong Sun","Contrastive Unsupervised Word Alignment with Non-Local Features","Added the missing Table 1; corrected a typo in Related Work",,,,"cs.CL","http://arxiv.org/licenses/nonexclusive-distrib/1.0/","  Word alignment is an important natural language processing task that
indicates the correspondence between natural languages. Recently, unsupervised
learning of log-linear models for word alignment has received considerable
attention as it combines the merits of generative and discriminative
approaches. However, a major challenge still remains: it is intractable to
calculate the expectations of non-local features that are critical for
capturing the divergence between natural languages. We propose a contrastive
approach that aims to differentiate observed training examples from noises. It
not only introduces prior knowledge to guide unsupervised learning but also
cancels out partition functions. Based on the observation that the probability
mass of log-linear models for word alignment is usually highly concentrated, we
propose to use top-n alignments to approximate the expectations with respect to
posterior distributions. This allows for efficient and accurate calculation of
expectations of non-local features. Experiments show that our approach achieves
significant improvements over state-of-the-art unsupervised word alignment
methods.
","[{""version"":""v1"",""created"":""Wed, 8 Oct 2014 12:24:38 GMT""},{""version"":""v2"",""created"":""Fri, 10 Oct 2014 00:25:46 GMT""}]","2014-10-13"
"1410.2083","Johann F\""orster","Johann F\""orster, Yulian V. Vanne, and Alejandro Saenz","Ionization behavior of molecular hydrogen in intense laser fields:
  Influence of molecular vibration and alignment","10 pages, 9 figures",,"10.1103/PhysRevA.90.053424",,"physics.atom-ph","http://arxiv.org/licenses/nonexclusive-distrib/1.0/","  The alignment- and internuclear-distance dependent ionization of H$_2$
exposed to intense, ultrashort laser fields is studied by solving the
time-dependent two-electron Schr\""odinger equation. In the regime of
perturbative few-photon ionization, a strong dependence of the ionization yield
on the internuclear distance is found. While this finding confirms a previously
reported breakdown of the fixed-nuclei approximation for parallel alignment, a
simpler explanation is provided and it is demonstrated that this breakdown is
not due to vibrational dynamics during the laser pulse. The persistence of this
effect even for randomly aligned molecules is demonstrated. Furthermore, the
transition from the multiphoton to the quasi-static (tunneling) regime is
investigated considering intense 800 nm laser pulses. While the obtained
ionization yields differ significantly from the prediction of
Ammosov-Delone-Krainov rates, we find a surprisingly good quantitative
agreement after introducing a simple frequency-dependent correction to the
standard tunneling formula.
","[{""version"":""v1"",""created"":""Wed, 8 Oct 2014 12:29:15 GMT""}]","2015-06-23"
"1410.2084","Daisuke Suyama","Takuro Abe, Daisuke Suyama, Shuhei Tsujie","The freeness of Ish arrangements","We added Section 3 (v2). We corrected the proof of Theorem 1.3 and
  several typos (v3)","Journal of Combinatorial Theory, Series A Volume 146, February
  2017, Pages 169-183","10.1016/j.jcta.2016.09.008",,"math.CO","http://arxiv.org/licenses/nonexclusive-distrib/1.0/","  The Ish arrangement was introduced by Armstrong to give a new interpretation
of the $q,t$-Catalan numbers of Garsia and Haiman. Armstrong and Rhoades showed
that there are some striking similarities between the Shi arrangement and the
Ish arrangement and posed some problems. One of them is whether the Ish
arrangement is a free arrangement or not. In this paper, we verify that the Ish
arrangement is supersolvable and hence free. Moreover, we give a necessary and
sufficient condition for the deleted Ish arrangement to be free.
","[{""version"":""v1"",""created"":""Wed, 8 Oct 2014 12:41:49 GMT""},{""version"":""v2"",""created"":""Mon, 22 Dec 2014 13:33:57 GMT""},{""version"":""v3"",""created"":""Thu, 3 Sep 2015 11:49:27 GMT""}]","2018-05-25"
"1410.2085","Ashish Chandra","Ashish Chandra, Mohammad Suaib, and Dr. Rizwan Beg","Low cost page quality factors to detect web spam",,"Informatics Engineering, an International Journal (IEIJ) ,Vol.2,
  No.3, September 2014",,,"cs.IR","http://arxiv.org/licenses/nonexclusive-distrib/1.0/","  Web spam is a big challenge for quality of search engine results. It is very
important for search engines to detect web spam accurately. In this paper we
present 32 low cost quality factors to classify spam and ham pages on real time
basis. These features can be divided in to three categories: (i) URL features,
(ii) Content features, and (iii) Link features. We developed a classifier using
Resilient Back-propagation learning algorithm of neural network and obtained
good accuracy. This classifier can be applied to search engine results on real
time because calculation of these features require very little CPU resources.
","[{""version"":""v1"",""created"":""Wed, 8 Oct 2014 12:46:34 GMT""}]","2014-10-09"
"1410.2086","Jianbo Wang","Jianbo Wang","The stable homotopy groups of $2$-stage Postnikov systems","This paper has been withdrawn by the author due to a error in the
  proof of Theorem 1.2",,,,"math.AT","http://arxiv.org/licenses/nonexclusive-distrib/1.0/","  The purpose of this note is to give a description of the stable homotopy
group of some $2$-stage Postnikov systems for a range of dimensions. The
considered $2$-stage Postnikov systems has the (weak) homotopy type of a
generalized Eilenberg-Mac lane space, then their stable homotopy groups can be
calculated by the stable homotopy groups of generalized Eilenberg-Mac lane
spaces.
","[{""version"":""v1"",""created"":""Wed, 8 Oct 2014 12:47:59 GMT""},{""version"":""v2"",""created"":""Thu, 9 Oct 2014 10:33:25 GMT""}]","2014-10-10"
"1410.2087","Saman Feghhi","Saman Feghhi, Douglas J. Leith","A Web Traffic Analysis Attack Using Only Timing Information",,,,,"cs.NI","http://arxiv.org/licenses/nonexclusive-distrib/1.0/","  We introduce an attack against encrypted web traffic that makes use only of
packet timing information on the uplink. This attack is therefore impervious to
existing packet padding defences. In addition, unlike existing approaches this
timing-only attack does not require knowledge of the start/end of web fetches
and so is effective against traffic streams. We demonstrate the effectiveness
of the attack against both wired and wireless traffic, achieving mean success
rates in excess of 90%. In addition to being of interest in its own right, this
timing-only attack serves to highlight deficiencies in existing defences and so
to areas where it would be beneficial for VPN designers to focus further
attention.
","[{""version"":""v1"",""created"":""Wed, 8 Oct 2014 12:51:36 GMT""},{""version"":""v2"",""created"":""Thu, 3 Sep 2015 12:28:54 GMT""},{""version"":""v3"",""created"":""Sat, 9 Jul 2016 07:12:24 GMT""}]","2016-07-12"
"1410.2088","Fuyong Wang","Fuyong Wang","Stable pulse generation in bias pumped gain-switched fiber laser",,"J. Opt. Soc. Am. B 35(2018) 231-236","10.1364/JOSAB.35.000231",,"physics.optics","http://arxiv.org/licenses/nonexclusive-distrib/1.0/","  We demonstrate gain-switched fiber laser with bias pumping plays an important
role in regulating chaotic relaxation spikes. Under certain conditions the
profile of output pulse from gain-switched fiber laser can keep the same shape
as that of pump pulse. Bias pumping technique may have significance in
increasing output stable pulse energy in gain-switched fiber laser.
Gain-switched fiber laser with bias pumping may be interesting for some
applications in micro-processing and thin film removal.
","[{""version"":""v1"",""created"":""Wed, 8 Oct 2014 13:01:03 GMT""},{""version"":""v2"",""created"":""Tue, 29 Aug 2017 02:02:40 GMT""}]","2018-05-08"
"1410.2089","Inkang Kim","Inkang Kim and Genkai Zhang","Toledo invariant of lattices in SU(2,1) via symmetric square","23 pages, Expanded and added some materials, corrected Lemma 3.2",,,,"math.GT math.DG math.RT","http://arxiv.org/licenses/nonexclusive-distrib/1.0/","  In this paper, we address the issue of quaternionic Toledo invariant to study
the character variety of two dimensional complex hyperbolic uniform lattices
into $SU(n,2)$. We construct four distinct representations to prove that the
character variety contains at least four distinct components. We also address
the existence of holomorphic horizontal lift to various period domains of
$SU(n,2)$.
","[{""version"":""v1"",""created"":""Wed, 8 Oct 2014 13:01:13 GMT""},{""version"":""v2"",""created"":""Fri, 17 Feb 2017 05:06:28 GMT""},{""version"":""v3"",""created"":""Sat, 29 Apr 2017 14:45:30 GMT""}]","2017-05-02"
"1410.2090","Amirpasha Shirazinia Dr.","Amirpasha Shirazinia, Subhrakanti Dey","Power-Constrained Sparse Gaussian Linear Dimensionality Reduction over
  Noisy Channels","Accepted for publication in IEEE Transactions on Signal Processing
  (16 pages)",,"10.1109/TSP.2015.2455521",,"cs.IT math.IT","http://arxiv.org/licenses/nonexclusive-distrib/1.0/","  In this paper, we investigate power-constrained sensing matrix design in a
sparse Gaussian linear dimensionality reduction framework. Our study is carried
out in a single--terminal setup as well as in a multi--terminal setup
consisting of orthogonal or coherent multiple access channels (MAC). We adopt
the mean square error (MSE) performance criterion for sparse source
reconstruction in a system where source-to-sensor channel(s) and
sensor-to-decoder communication channel(s) are noisy. Our proposed sensing
matrix design procedure relies upon minimizing a lower-bound on the MSE in
single-- and multiple--terminal setups. We propose a three-stage sensing matrix
optimization scheme that combines semi-definite relaxation (SDR) programming, a
low-rank approximation problem and power-rescaling. Under certain conditions,
we derive closed-form solutions to the proposed optimization procedure. Through
numerical experiments, by applying practical sparse reconstruction algorithms,
we show the superiority of the proposed scheme by comparing it with other
relevant methods. This performance improvement is achieved at the price of
higher computational complexity. Hence, in order to address the complexity
burden, we present an equivalent stochastic optimization method to the problem
of interest that can be solved approximately, while still providing a superior
performance over the popular methods.
","[{""version"":""v1"",""created"":""Wed, 8 Oct 2014 13:01:25 GMT""},{""version"":""v2"",""created"":""Thu, 9 Oct 2014 13:10:37 GMT""},{""version"":""v3"",""created"":""Mon, 27 Jul 2015 10:25:35 GMT""}]","2015-10-28"
"1410.2091","Adam K. Leibovich","Adam K Leibovich and Wai Kin Lai","Lambda_c^+/Lambda_c^- and Lambda_b^0/\bar{Lambda}_b^0 production
  asymmetry at the LHC from heavy quark recombination","9 pages, 6 figures","Phys. Rev. D 91, 054022 (2015)","10.1103/PhysRevD.91.054022",,"hep-ph hep-ex","http://arxiv.org/licenses/nonexclusive-distrib/1.0/","  The asymmetries in the forward region production cross section of
Lambda_c^+/Lambda_c^- and Lambda_b^0/\bar{Lambda}_b^0 are predicted using the
heavy quark recombination mechanism for pp collisions at 7 TeV and 14 TeV.
Using non-perturbative parameters determined from various previous experiments,
we find that A_p(Lambda_c^+/Lambda_c^-) ~ 1-2% and
A_p(Lambda_b^0/\bar{Lambda}_b^0) ~ 1-3% in the forward region covered by the
LHCb experiment.
","[{""version"":""v1"",""created"":""Wed, 8 Oct 2014 13:01:29 GMT""}]","2015-03-25"
"1410.2092","Stefan Boettcher","Lauren A. Ball, Alfred C. K. Farris, and Stefan Boettcher (Emory U)","Renormalization Group Solution of the Chutes&Ladder Model","7 pages, RevTex4.1; for related information, see
  http://www.physics.emory.edu/faculty/boettcher/","Physica A 421, 171-179 (2015)","10.1016/j.physa.2014.11.020",,"cond-mat.stat-mech physics.soc-ph","http://arxiv.org/licenses/nonexclusive-distrib/1.0/","  We analyze a semi-infinite one-dimensional random walk process with a biased
motion that is incremental in one direction and long-range in the other. On a
network with a fixed hierarchy of long-range jumps, we find with exact
renormalization group calculations that there is a dynamical transition between
a localized adsorption phase and an anomalous diffusion phase in which the
mean-square displacement exponent depends non-universally on the Bernoulli
coin. We relate these results to similar findings of unconventional phase
behavior in hierarchical networks.
","[{""version"":""v1"",""created"":""Wed, 8 Oct 2014 13:04:41 GMT""}]","2015-06-03"
"1410.2093","Anna Miotello","Anna Miotello, Simon Bruderer, Ewine F. van Dishoeck","Protoplanetary disk masses from CO isotopologues line emission","Accepted for publication in A&A, 16 pages, 10 figures, 4 tables","A&A 572, A96 (2014)","10.1051/0004-6361/201424712",,"astro-ph.SR","http://arxiv.org/licenses/nonexclusive-distrib/1.0/","  One of the methods for deriving disk masses relies on direct observations of
the gas, whose bulk mass is in the outer cold ($T\lesssim30$K) regions. This
zone can be well traced by rotational lines of less abundant CO isotopologues,
that probe the gas down to the midplane. The total CO gas mass is then obtained
with the isotopologue ratios taken to be constant at the elemental isotope
values found in the local ISM. This approach is however imprecise, because
isotope selective processes are ignored. The aim of this work is an
isotopologue selective treatment of CO isotopologues, in order to obtain a more
accurate determination of disk masses. The isotope-selective photodissociation,
the main process controlling the abundances of CO isotopologues in the
CO-emissive layer, is properly treated for the first time in a full disk model
(DALI, Bruderer et al. 2012; Bruderer 2013). The chemistry, thermal balance,
line and continuum radiative transfer are all considered together with a
chemical network that treats $^{13}$CO, C$^{18}$O, C$^{17}$O, isotopes of all
included atoms, and molecules, as independent species. Isotope selective
processes lead to regions in the disk where the isotopologues abundance ratios
are considerably different from the elemental ratio. The results of this work
show that considering CO isotopologue ratios as constants can lead to an
underestimate of disk masses by up to almost two orders of magnitude if grains
have grown to larger sizes. This may explain observed discrepancies in mass
determinations from different tracers. The dependence of the various
isotopologues emission on stellar and disk parameters is investigated.
Including CO isotope selective processes is crucial to determine the gas mass
of the disk accurately (through ALMA observations) and thus to provide the
amount of gas which may eventually form planets or change the dynamics of
forming planetary systems.
","[{""version"":""v1"",""created"":""Wed, 8 Oct 2014 13:07:50 GMT""}]","2014-12-03"
"1410.2094","Remi Louf","R\'emi Louf and Marc Barthelemy","A typology of street patterns","9 pages, 6 figures","Journal of the Royal Society Interface, 11:20140924 (2014)","10.1098/?rsif.2014.0924",,"physics.soc-ph cond-mat.dis-nn","http://arxiv.org/licenses/nonexclusive-distrib/1.0/","  We propose a quantitative method to classify cities according to their street
pattern. We use the conditional probability distribution of shape factor of
blocks with a given area, and define what could constitute the `fingerprint' of
a city. Using a simple hierarchical clustering method, these fingerprints can
then serve as a basis for a typology of cities. We apply this method to a set
of 131 cities in the world, and at an intermediate level of the dendrogram, we
observe 4 large families of cities characterized by different abundances of
blocks of a certain area and shape. At a lower level of the classification, we
find that most European cities and American cities in our sample fall in their
own sub-category, highlighting quantitatively the differences between the
typical layouts of cities in both regions. We also show with the example of New
York and its different Boroughs, that the fingerprint of a city can be seen as
the sum of the ones characterising the different neighbourhoods inside a city.
This method provides a quantitative comparison of urban street patterns, which
could be helpful for a better understanding of the causes and mechanisms behind
their distinct shapes.
","[{""version"":""v1"",""created"":""Wed, 8 Oct 2014 13:08:01 GMT""}]","2014-10-09"
