"1410.1981","Shravan Hanasoge","Shravan M Hanasoge","Full Waveform Inversion of Solar Interior Flows","21 pages, 6 figures; in press, ApJ",,"10.1088/0004-637X/797/1/23",,"astro-ph.SR astro-ph.EP","http://arxiv.org/licenses/nonexclusive-distrib/1.0/","  The inference of flows of material in the interior of the Sun is a subject of
major interest in helioseismology. Here we apply techniques of Full Waveform
Inversion (FWI) to synthetic data to test flow inversions. In this idealized
setup, we do not model seismic realization noise, training the focus entirely
on the problem of whether a chosen supergranulation flow model can be
seismically recovered. We define the misfit functional as a sum of L_2 norm
deviations in travel times between prediction and observation, as measured
using short-distance f and p_1 filtered and large-distance unfiltered $p$
modes. FWI allows for the introduction of measurements of choice and
iteratively improving the background model, while monitoring the evolution of
the misfit in all desired categories. Although the misfit is seen to uniformly
reduce in all categories, convergence to the true model is very slow, possibly
because it is trapped in a local minimum. The primary source of error is
inaccurate depth localization, which, owing to density stratification, leads to
wrong ratios of horizontal and vertical flow velocities (`cross talk'). In the
present formulation, the lack of sufficient temporal frequency and spatial
resolution makes it difficult to accurately localise flow profiles at depth. We
therefore suggest that the most efficient way to discover the global minimum is
to perform a probabilistic forward search, involving calculating the misfit
associated with a broad range of models (generated, for instance, by a
Monte-Carlo algorithm) and locating the deepest minimum. Such techniques
possess the added advantage of being able to quantify model uncertainty as well
as realization noise (data uncertainty).
","[{""version"":""v1"",""created"":""Wed, 8 Oct 2014 04:52:47 GMT""}]","2015-06-23"
"1410.1982","Shunsaku Kitagawa","Shunsaku Kitagawa, Hisashi Kotegawa, Hideki Tou, Ryota Yamauchi,
  Eiichi Matsuoka and Hitoshi Sugawara","Phase diagram of CeRuPO under pressure investigated by $^{31}$P-NMR -
  Comparison between CeRuPO under pressure and the Ce(Ru$_{1-x}$Fe$_{x}$)PO
  system -","7 pages, 6 figures, accepted for publication in Phys. Rev. B","Phys. Rev. B 90, 134406 (2014)","10.1103/PhysRevB.90.134406",,"cond-mat.str-el cond-mat.mtrl-sci","http://arxiv.org/licenses/nonexclusive-distrib/1.0/","  We have performed $^{31}$P-NMR measurements on single-crystalline CeRuPO
under pressure in order to understand the variation in magnetic character
against pressure. The NMR spectra for $H \perp c$ and $H \parallel c$ at
2.15GPa split below the ordered temperature, which is a microscopic evidence of
the change in the magnetic ground state from the ferromagnetic (FM) state at
ambient pressure to the antiferromagnetic (AFM) state under pressure. The
analysis of NMR spectra suggests that the magnetic structure in AFM state is
the stripe-type AFM state with the AFM moment $m_{\rm AFM} \perp c$-axis and
changes by magnetic field perpendicular to $c$-axis. In addition, the
dimensionality of magnetic correlations in the spin and the $k$ space is
estimated. We reveal that three-dimensional magnetic correlations in CeRuPO are
robust against pressure, which is quite different from the suppression of the
magnetic correlations along the $c$-axis by Fe substitution in
Ce(Ru$_{1-x}$Fe$_{x}$)PO.
","[{""version"":""v1"",""created"":""Wed, 8 Oct 2014 05:03:18 GMT""}]","2014-10-16"
"1410.1983","Reza Kamyar","Reza Kamyar and Matthew M. Peet","Optimal Thermostat Programming and Optimal Electricity Rates for
  Customers with Demand Charges","American Control Conference, 2015",,,,"math.OC","http://arxiv.org/licenses/nonexclusive-distrib/1.0/","  We consider the coupled problems of optimal thermostat programming and
optimal pricing of electricity. Our framework consists of a single user and a
single provider (a regulated utility). The provider sets prices for the user,
who pays for both total energy consumed (\$/kWh, including peak and off-peak
rates) and the peak rate of consumption in a month (a demand charge) (\$/kW).
The cost of electricity for the provider is based on a combination of capacity
costs (\$/kW) and fuel costs (\$/kWh). In the optimal thermostat programming
problem, the user minimizes the amount paid for electricity while staying
within a pre-defined temperature range. The user has access to energy storage
in the form of thermal capacitance of the interior structure of the building.
The provider sets prices designed to minimize the total cost of producing
electricity while meeting the needs of the user. To solve the user-problem, we
use a variant of dynamic programming. To solve the provider-problem, we use a
descent algorithm coupled with our dynamic programming code - yielding optimal
on-peak, off-peak and demand prices. We show that thermal storage and optimal
thermostat programming can reduce electricity bills using current utility
prices from utilities Arizona Public Service (APS) and Salt River Project
(SRP). Moreover, we obtain optimal utility prices which lead to significant
reductions in the cost of generating electricity and electricity bills.
","[{""version"":""v1"",""created"":""Wed, 8 Oct 2014 05:27:52 GMT""},{""version"":""v2"",""created"":""Thu, 15 Jan 2015 05:44:54 GMT""},{""version"":""v3"",""created"":""Fri, 6 Feb 2015 03:37:48 GMT""},{""version"":""v4"",""created"":""Tue, 24 Mar 2015 04:58:08 GMT""},{""version"":""v5"",""created"":""Wed, 15 Apr 2015 03:12:37 GMT""}]","2015-04-16"
"1410.1984","Xiaoli Yan","X.L. Yan, Z.K. Xue, J.H. Liu, D.F. Kong, C.L. Xu","Unwinding motion of a twisted active-region filament","26 pages,11 figures, accepted for publication in ApJ",,"10.1088/0004-637X/797/1/52",,"astro-ph.SR","http://arxiv.org/licenses/nonexclusive-distrib/1.0/","  To better understand the structures of active-region filaments and the
eruption process, we study an active-region filament eruption in active region
NOAA 11082 in detail on June 22, 2010. Before the filament eruption, the
opposite unidirectional material flows appeared in succession along the spine
of the filament. The rising of the filament triggered two B-class flares at the
upper part of the filament. As the bright material was injected into the
filament from the sites of the flares, the filament exhibited a rapid uplift
accompanying the counterclockwise rotation of the filament body. From the
expansion of the filament, we can see that the filament is consisted of twisted
magnetic field lines. The total twist of the filament is at least 5$\pi$
obtained by using time slice method. According to the morphology change during
the filament eruption, it is found that the active-region filament was a
twisted flux rope and its unwinding motion was like a solar tornado. We also
find that there was a continuous magnetic helicity injection before and during
the filament eruption. It is confirmed that magnetic helicity can be
transferred from the photosphere to the filament. Using the extrapolated
potential fields, the average decay index of the background magnetic fields
over the filament is 0.91. Consequently, these findings imply that the
mechanism of solar filament eruption could be due to the kink instability and
magnetic helicity accumulation.
","[{""version"":""v1"",""created"":""Wed, 8 Oct 2014 05:32:10 GMT""}]","2015-06-23"
"1410.1985","Nil Kamal Hazra","Asok K. Nanda, Nil Kamal Hazra, D.K. Al-Mutairi and M.E. Ghitany","On some generalized ageing orderings",,,,,"stat.AP","http://arxiv.org/licenses/nonexclusive-distrib/1.0/","  Some partial orderings which compare probability distributions with the expo-
nential distribution, are found to be very useful to understand the phenomenon
of ageing. Here, we introduce some new generalized partial orderings which de-
scribe the same kind of characterization of some generalized ageing classes. We
give some equivalent conditions for each of the orderings. Inter-relations
among the generalized orderings have also been discussed.
","[{""version"":""v1"",""created"":""Wed, 8 Oct 2014 05:33:20 GMT""}]","2014-10-09"
"1410.1986","Ellen Chih","Ellen Chih","Non-splittings of speedable sets",,,,,"math.LO","http://arxiv.org/licenses/nonexclusive-distrib/1.0/","  An r.e. set $A$ is speedable if for every recursive function, there exists a
program enumerating membership in $A$ faster, by the desired recursive factor,
on infinitely many integers. We construct a speedable set that cannot be split
into speedable sets. This solves a question of B\""{a}uerle and Remmel.
","[{""version"":""v1"",""created"":""Wed, 8 Oct 2014 05:39:02 GMT""}]","2014-10-09"
"1410.1987","Rasmus Bj{\o}rk","R. Bj{\o}rk, C. R. H. Bahl, A. Smith, D. V. Christensen and N. Pryds","An optimized magnet for magnetic refrigeration","6 pages, 6 figures","Journal of Magnetism and Magnetic Materials, Vol. 322 (21),
  3324-3328, 2010","10.1016/j.jmmm.2010.06.017",,"physics.ins-det","http://arxiv.org/licenses/nonexclusive-distrib/1.0/","  A magnet designed for use in a magnetic refrigeration device is presented.
The magnet is designed by applying two general schemes for improving a magnet
design to a concentric Halbach cylinder magnet design and dimensioning and
segmenting this design in an optimum way followed by the construction of the
actual magnet. The final design generates a peak value of 1.24 T, an average
flux density of 0.9 T in a volume of 2 L using only 7.3 L of magnet, and has an
average low flux density of 0.08 T also in a 2 L volume. The working point of
all the permanent magnet blocks in the design is very close to the maximum
energy density. The final design is characterized in terms of a performance
parameter, and it is shown that it is one of the best performing magnet designs
published for magnetic refrigeration.
","[{""version"":""v1"",""created"":""Wed, 8 Oct 2014 05:58:46 GMT""}]","2014-10-09"
"1410.1988","Rasmus Bj{\o}rk","R. Bj{\o}rk, C. R. H. Bahl and M. Katter","Magnetocaloric properties of LaFe$_{13-x-y}$Co$_x$Si$_y$ and commercial
  grade Gd","9 pages, 8 figures","Journal of Magnetism and Magnetic Materials, Vol. 322 (24),
  3882-3888, 2010","10.1016/j.jmmm.2010.08.013",,"cond-mat.mtrl-sci","http://arxiv.org/licenses/nonexclusive-distrib/1.0/","  The magnetocaloric properties of three samples of LaFe$_{13-x-y}$Co$_x$Si$_y$
have been measured and compared to measurements of commercial grade Gd. The
samples have (x=0.86, y=1.08), (x=0.94, y=1.01) and (x=0.97, y=1.07) yielding
Curie temperatures in the range 276-288 K. The magnetization, specific heat
capacity and adiabatic temperature change have been measured over a broad
temperature interval. Importantly, all measurements were corrected for
demagnetization, allowing the data to be directly compared. In an internal
field of 1 T the maximum specific entropy changes were 6.2, 5.1 and 5.0 J/kg K,
the specific heat capacities were 910, 840 and 835 J/kg K and the adiabatic
temperature changes were 2.3, 2.1 and 2.1 K for the three LaFeCoSi samples
respectively. For Gd in an internal field of 1 T the maximum specific entropy
change was 3.1 J/kg K, the specific heat capacity was 340 J/kg K and the
adiabatic temperature change was 3.3 K. The adiabatic temperature change was
also calculated from the measured values of the specific heat capacity and
specific magnetization and compared to the directly measured values. In general
an excellent agreement was seen.
","[{""version"":""v1"",""created"":""Wed, 8 Oct 2014 06:03:12 GMT""}]","2014-10-09"
"1410.1989","Liubin Pan","Liubin Pan and Paolo Padoan","Turbulence-Induced Relative Velocity of Dust particles IV: the Collision
  Kernel","20 pages, 9 figures, accepted to ApJ",,"10.1088/0004-637X/797/2/101",,"astro-ph.EP","http://arxiv.org/licenses/nonexclusive-distrib/1.0/","  Motivated by its importance for modeling dust particle growth in
protoplanetary disks, we study turbulence-induced collision statistics of
inertial particles as a function of the particle friction time, tau_p. We show
that turbulent clustering significantly enhances the collision rate for
particles of similar sizes with tau_p corresponding to the inertial range of
the flow. If the friction time, tau_p,h, of the larger particle is in the
inertial range, the collision kernel per unit cross section increases with
increasing friction time, tau_p,l, of the smaller particle, and reaches the
maximum at tau_p,l = tau_p,h, where the clustering effect peaks. This feature
is not captured by the commonly-used kernel formula, which neglects the effect
of clustering. We argue that turbulent clustering helps alleviate the bouncing
barrier problem for planetesimal formation. We also investigate the collision
velocity statistics using a collision-rate weighting factor to account for
higher collision frequency for particle pairs with larger relative velocity.
For tau_p,h in the inertial range, the rms relative velocity with
collision-rate weighting is found to be invariant with tau_p,l and scales with
tau_p,h roughly as ~ tau_p,h^(1/2). The weighting factor favors collisions with
larger relative velocity, and including it leads to more destructive and less
sticking collisions. We compare two collision kernel formulations based on
spherical and cylindrical geometries. The two formulations give consistent
results for the collision rate and the collision-rate weighted statistics,
except that the spherical formulation predicts more head-on collisions than the
cylindrical formulation.
","[{""version"":""v1"",""created"":""Wed, 8 Oct 2014 06:10:56 GMT""}]","2015-06-23"
"1410.1990","Jinyin Wan","Jinyin Wan, Yanling Meng, Ling Xiao, Peng Liu, Xiumei Wang, Yaning
  Wang, Huadong Cheng, and Liang Liu","Observation of magneto-optical rotation effects in cold $^{87}$Rb atoms
  in an integrating sphere","4 pages, 5 figures. arXiv admin note: text overlap with
  arXiv:physics/0203077 by other authors",,,,"physics.atom-ph","http://arxiv.org/licenses/nonexclusive-distrib/1.0/","  We present a modified scheme for detection of the magneto-optical rotation
(MOR) effect, where a linearly polarized laser field is interacting with cold
$^{87}$Rb atoms in an integrating sphere. The rotation angle of the probe
beam's polarization plane is detected in the experiment. The results indicate
that the biased magnetic field, the probe light intensity and detuning, and the
cold atoms' temperature are key parameters for the MOR effect. This scheme may
improve the contrast of the rotation signal and provide an useful approach for
high contrast cold atom clocks and magnetometers.
","[{""version"":""v1"",""created"":""Wed, 8 Oct 2014 06:14:40 GMT""},{""version"":""v2"",""created"":""Mon, 11 Jan 2016 10:17:28 GMT""}]","2016-01-12"
"1410.1991","Chunjing  Xie","Chao Chen, Lili Du, Chunjing Xie, Zhouping Xin","Two Dimensional Subsonic Euler Flow. Past a Wall or a Symmetric Body",,,,,"math.AP physics.flu-dyn","http://arxiv.org/licenses/nonexclusive-distrib/1.0/","  The existence and uniqueness of two dimensional steady compressible Euler
flows past a wall or a symmetric body are established. More precisely, given
positive convex horizontal veloicty in the upstream, there exists a critical
value $\rho_{cr}$ such that if the incoming density in the upstream is larger
than $\rho_{cr}$, then there exists a subsonic flow past a wall. Furthermore,
$\rho_{cr}$ is critical in the sense that there is no such subsonic flow if the
density of the incoming flow is less than $\rho_{cr}$. The subsonic flows
possess large vorticity and positive horizontal velocity above the wall except
at the corner points on the boundary. Moreover, the existence and uniqueness of
a two dimensional subsonic Euler flow past a symmetric body are also obtained
when the incoming velocity field is a general small perturbation of a constant
velocity field and the density of the incoming flow is larger than a critical
value. The asymptotic behavior of the flows is obtained with the aid of some
integral estimates for the velocity field and its far field states.
","[{""version"":""v1"",""created"":""Wed, 8 Oct 2014 06:26:23 GMT""}]","2014-10-09"
"1410.1992","Seungwon Baek","Seungwon Baek","3.5 keV X-ray Line Signal from Dark Matter Decay in Local $U(1)_{B-L}$
  Extension of Zee-Babu Model","matches published version","JHEP 08 (2015) 023","10.1007/JHEP08(2015)023","KIAS-O14003","hep-ph","http://arxiv.org/licenses/nonexclusive-distrib/1.0/","  We consider a local $U(1)_{B-L}$ extension of Zee-Babu model to explain the
recently observed 3.5 keV X-ray line signal. The model has three Standard model
(SM)-singlet Dirac fermions with different $U(1)_{B-L}$ charges. A complex
scalar field charged under $U(1)_{B-L}$ is introduced to break the $U(1)_{B-L}$
symmetry. After $U(1)_{B-L}$ symmetry breaking a remnant discrete symmetry
stabilizes the lightest state of the Dirac fermions, which can be a stable dark
matter (DM). The second lightest state, if mass splitting with the stable DM is
about 3.5 keV, decays dominantly to the stable DM and 3.5 keV photon through
two-loop diagrams, explaining the X-ray line signal. Two-loop suppression of
the decay amplitude makes its lifetime much longer than the age of the universe
and it can be a decaying DM candidate in large parameter region. We also
introduce a real scalar field which is singlet under both the SM and
$U(1)_{B-L}$ and can explain the current relic abundance of the Dirac fermionic
DMs. If the mixing with the SM Higgs boson is small, it does not contribute to
DM direct detection. The main contribution to the scattering of DM off atomic
nuclei comes from the exchange of $U(1)_{B-L}$ gauge boson, $Z'$, and is
suppressed below current experimental bound when $Z'$ mass is heavy ($\gtrsim
10$ TeV). If the singlet scalar mass is about 0.1-10 MeV, the DM
self-interaction can be large enough to solve small scale structure problems in
simulations with the cold DM, such as, the core-vs-cusp problem and
too-big-to-fail problem.
","[{""version"":""v1"",""created"":""Wed, 8 Oct 2014 06:35:02 GMT""},{""version"":""v2"",""created"":""Thu, 16 Oct 2014 06:20:19 GMT""},{""version"":""v3"",""created"":""Tue, 18 Aug 2015 02:09:19 GMT""}]","2015-09-02"
"1410.1993","Jianbin Liu","Jianbin Liu, Minglan Le, Bin Bai, Wentao Wang, Hui Chen, Yu Zhou,
  Fu-Li Li, and Zhuo Xu","The second-order interference of two independent single-mode He-Ne
  lasers","16 pages, 6 figures. Comments are welcome. Submitted for publication","Optics Communications, 350, 196 (2015)","10.1016/j.optcom.2015.04.018",,"physics.optics quant-ph","http://arxiv.org/licenses/nonexclusive-distrib/1.0/","  The second-order spatial and temporal interference patterns with two
independent single-mode He-Ne lasers are observed in a Hong-Ou-Mandel
interferometer. Two-photon interference in Feynman's path integral theory is
employed to interpret the experimental results. The conditions to observe the
second-order interference pattern with two independent single-mode continuous
wave lasers are discussed. It is concluded that two-photon interference exists
for not only identical photons, but also photons with different spectrums if
the detection system can not distinguish them in principle. The second-order
temporal beating with two independent lasers can be employed to measure the
coherence time and frequency of one laser if the properties of the other laser
were known.
","[{""version"":""v1"",""created"":""Wed, 8 Oct 2014 06:39:15 GMT""}]","2015-04-29"
"1410.1994","Sylwia Dudek Dr","Sylwia Dudek","Nontrival solution for nonlinear p(x)-Laplacian Dirichlet problem with
  the sign-changing weight","17 pages. arXiv admin note: substantial text overlap with
  arXiv:1212.4482, arXiv:1212.3688",,,,"math.AP","http://arxiv.org/licenses/nonexclusive-distrib/1.0/","  In this paper we study the nonlinear elliptic problem involving
p(x)-Laplacian with nonsmooth potential, where the weighted function may change
sign. By using critical point theory for locally Lipschitz functionals due to
Chang, we obtain conditions which ensure the existence of a solution for our
problem.
","[{""version"":""v1"",""created"":""Wed, 8 Oct 2014 06:42:34 GMT""},{""version"":""v2"",""created"":""Sat, 22 Nov 2014 18:32:47 GMT""},{""version"":""v3"",""created"":""Thu, 28 May 2015 05:50:44 GMT""}]","2015-05-29"
"1410.1995","Kiran Kumar v","V. Kiran Kumar (Dravidian University, Kuppam)","Semantic Web Approach towards Interoperability and Privacy issues in
  Social Networks","5 Pages",,"10.5121/ijwsc.2014.5302",,"cs.SE cs.SI","http://arxiv.org/licenses/nonexclusive-distrib/1.0/","  The Social Web is a set of social relations that link people through World
Wide Web. This Social Web encompasses how the websites and software are
designed and developed to support social relations. The new paradigms, tools
and web services introduced by Social Web are widely accepted by internet
users. The main drawbacks of these tools are it acts as independent data silos;
hence interoperability among applications is a complex issue. This paper
focuses on this issue and how best we can use semantic web technologies to
achieve interoperability among applications.
","[{""version"":""v1"",""created"":""Wed, 8 Oct 2014 06:43:01 GMT""}]","2014-10-09"
"1410.1996","Shinji Mukohyama","Shinji Mukohyama","A new quasidilaton theory of massive gravity",,,"10.1088/1475-7516/2014/12/011","YITP-14-77, IPMU14-0310","hep-th astro-ph.CO gr-qc","http://arxiv.org/licenses/nonexclusive-distrib/1.0/","  We present a new quasidilaton theory of Poincare invariant massive gravity,
based on the recently proposed framework of matter coupling that makes it
possible for the kinetic energy of the quasidilaton scalar to couple to both
physical and fiducial metrics simultaneously. We find a scaling-type exact
solution that expresses a self-accelerating de Sitter universe, and then
analyze linear perturbations around it. It is shown that in a range of
parameters all physical degrees of freedom have non-vanishing quadratic kinetic
terms and are stable in the subhorizon limit, while the effective Newton's
constant for the background is kept positive.
","[{""version"":""v1"",""created"":""Wed, 8 Oct 2014 06:47:56 GMT""}]","2015-06-23"
"1410.1997","Liudmila Ostroumova Prokhorenkova","Liudmila Ostroumova Prokhorenkova and Egor Samosvat","Global clustering coefficient in scale-free networks",,,,,"math.PR math.CO","http://arxiv.org/licenses/nonexclusive-distrib/1.0/","  In this paper, we analyze the behavior of the global clustering coefficient
in scale free graphs. We are especially interested in the case of degree
distribution with an infinite variance, since such degree distribution is
usually observed in real-world networks of diverse nature.
  There are two common definitions of the clustering coefficient of a graph:
global clustering and average local clustering. It is widely believed that in
real networks both clustering coefficients tend to some positive constant as
the networks grow. There are several models for which the average local
clustering coefficient tends to a positive constant. On the other hand, there
are no models of scale-free networks with an infinite variance of degree
distribution and with a constant global clustering.
  In this paper we prove that if the degree distribution obeys the power law
with an infinite variance, then the global clustering coefficient tends to zero
with high probability as the size of a graph grows.
","[{""version"":""v1"",""created"":""Wed, 8 Oct 2014 06:49:14 GMT""},{""version"":""v2"",""created"":""Mon, 8 Jun 2015 17:00:17 GMT""}]","2015-06-09"
"1410.1998","Ronny Bergmann","Ronny Bergmann and Andreas Weinmann","Inpainting of Cyclic Data using First and Second Order Differences","accepted Converence Paper at EMMCVPR'15",,"10.1007/978-3-319-14612-6_12",,"math.NA","http://arxiv.org/licenses/nonexclusive-distrib/1.0/","  Cyclic data arise in various image and signal processing applications such as
interferometric synthetic aperture radar, electroencephalogram data analysis,
and color image restoration in HSV or LCh spaces. In this paper we introduce a
variational inpainting model for cyclic data which utilizes our definition of
absolute cyclic second order differences. Based on analytical expressions for
the proximal mappings of these differences we propose a cyclic proximal point
algorithm (CPPA) for minimizing the corresponding functional. We choose
appropriate cycles to implement this algorithm in an efficient way. We further
introduce a simple strategy to initialize the unknown inpainting region.
Numerical results both for synthetic and real-world data demonstrate the
performance of our algorithm.
","[{""version"":""v1"",""created"":""Wed, 8 Oct 2014 07:04:16 GMT""}]","2018-12-10"
