"1410.1887","Sang-Hyun Chun","Sang-Hyun Chun, Minhee Kang, DooSeok Jung, Young-Jong Sohn","Tidal stripping stellar substructures around four metal-poor globular
  clusters in the Galactic bulge","46 pages, 11 figures. Accepted for publication in AJ",,"10.1088/0004-6256/149/1/29",,"astro-ph.GA","http://arxiv.org/licenses/nonexclusive-distrib/1.0/","  We investigate the spatial density configuration of stars around four
metal-poor globular clusters (NGC 6266, NGC 6626, NGC 6642 and NGC 6723) in the
Galactic bulge region using wide-field deep J, H, and K imaging data obtained
with the WFCAM near-infrared array on United Kingdom Infrared Telescope.
Statistical weighted filtering algorithm for the stars on the color-magnitude
diagram is applied in order to sort cluster member candidates from the field
star contamination. In two-dimensional isodensity contour maps of the clusters,
we find that all of the four globular clusters exhibit strong evidence of
tidally stripping stellar features beyond tidal radius, in the form of tidal
tail or small density lobes or chunk. The orientations of the extended stellar
substructures are likely to be associated with the effect of the dynamic
interaction with the Galaxy and the cluster space motion. The observed radial
density profiles of the four globular clusters also describe the extended
substructures; they depart from theoretical King and Wilson models and have an
overdensity feature with a break in a slope of profile at the outer region of
clusters. The observed results could imply that four globular clusters in the
Galactic bulge region have experienced strong environmental effect such as
tidal force or bulge or disk shock of the Galaxy in the dynamical evolution of
the globular clusters. These observational results provide us further
constraints to understand the evolution of clusters in the Galactic bulge
region as well as the formation of the Galaxy.
","[{""version"":""v1"",""created"":""Tue, 7 Oct 2014 20:06:46 GMT""}]","2015-06-23"
"1410.1888","Lodovico Coccato","Lodovico Coccato (1), Lorenzo Morelli (2, 3), Alessandro Pizzella (2,
  3), Enrico Maria Corsini (2, 3), Elena Dalla Bonta' (2, 3), Maximilian
  Fabricius (4, 5) ((1) European Southern Observatory, (2) Padova University,
  (3) INAF-Osservatorio Astronomico di Padova, (4) Max Planck Institute for
  Extraterrestrial Physics, (5) University Observatory Munich)","Counter-rotating disks in galaxies: dissecting kinematics and stellar
  populations with 3D spectroscopy","4 Pages, 3 figures. Coccato et al. 2014, in IAU Symp. 309, ""Galaxies
  in 3D across the Universe"", B. L. Ziegler, F. Combes, H. Dannerbauer, M.
  Verdugo, Eds. (Cambridge: Cambridge Univ. Press), in press",,"10.1017/S1743921314009466",,"astro-ph.GA","http://arxiv.org/licenses/nonexclusive-distrib/1.0/","  We present a spectral decomposition technique that separates the contribution
of different kinematic components in galaxies from the observed spectrum. This
allows to study the kinematics and properties of the stellar populations of the
individual components (e.g., bulge, disk, counter-rotating cores, orthogonal
structures). Here, we discuss the results of this technique for galaxies that
host counter-rotating stellar disks of comparable size. In all the studied
cases, the counter-rotating stellar disk is the less massive, the youngest and
has different chemical content (metallicity and alpha-elements abundance ratio)
than the main galaxy disk. Further applications of the spectral decomposition
technique are also discussed.
","[{""version"":""v1"",""created"":""Tue, 7 Oct 2014 20:06:46 GMT""}]","2015-06-23"
"1410.1889","Murad Alim","Murad Alim, Hossein Movasati, Emanuel Scheidegger, Shing-Tung Yau","Gauss-Manin connection in disguise: Calabi-Yau threefolds","25 pages",,,,"math.AG hep-th math.NT","http://arxiv.org/licenses/nonexclusive-distrib/1.0/","  We describe a Lie Algebra on the moduli space of Calabi-Yau threefolds
enhanced with differential forms and its relation to the
Bershadsky-Cecotti-Ooguri-Vafa holomorphic anomaly equation. In particular, we
describe algebraic topological string partition functions $F_g^{alg}, g\geq 1$,
which encode the polynomial structure of holomorphic and non-holomorphic
topological string partition functions. Our approach is based on Grothendieck's
algebraic de Rham cohomology and on the algebraic Gauss-Manin connection. In
this way, we recover a result of Yamaguchi-Yau and Alim-L\""ange in an algebraic
context. Our proofs use the fact that the special polynomial generators defined
using the special geometry of deformation spaces of Calabi-Yau threefolds
correspond to coordinates on such a moduli space. We discuss the mirror quintic
as an example.
","[{""version"":""v1"",""created"":""Tue, 7 Oct 2014 20:07:05 GMT""}]","2014-10-09"
"1410.1890","Yanlai Chen","Yanlai Chen, Sigal Gottlieb, Alfa Heryudono, Akil Narayan","A Reduced Radial Basis Function Method for Partial Differential
  Equations on irregular domains",,,,,"math.NA","http://arxiv.org/licenses/nonexclusive-distrib/1.0/","  We propose and test the first Reduced Radial Basis Function Method (R$^2$BFM)
for solving parametric partial differential equations on irregular domains. The
two major ingredients are a stable Radial Basis Function (RBF) solver that has
an optimized set of centers chosen through a reduced-basis-type greedy
algorithm, and a collocation-based model reduction approach that systematically
generates a reduced-order approximation whose dimension is orders of magnitude
smaller than the total number of RBF centers. The resulting algorithm is
efficient and accurate as demonstrated through two- and three-dimensional test
problems.
","[{""version"":""v1"",""created"":""Tue, 7 Oct 2014 20:07:36 GMT""}]","2014-10-09"
"1410.1891","Takuji Tsujimoto","Takuji Tsujimoto, Toshikazu Shigeyama","The origins of light and heavy r-process elements identified by chemical
  tagging of metal-poor stars","4 pages including 2 figures, accepted for publication in ApJ Letters",,"10.1088/2041-8205/795/1/L18",,"astro-ph.GA","http://arxiv.org/licenses/nonexclusive-distrib/1.0/","  Growing interests in neutron star (NS) mergers as the origin of r-process
elements have sprouted since the discovery of evidence for the ejection of
these elements from a short-duration gamma-ray burst. The hypothesis of a NS
merger origin is reinforced by a theoretical update of nucleosynthesis in NS
mergers successful in yielding r-process nuclides with A>130. On the other
hand, whether the origin of light r-process elements are associated with
nucleosynthesis in NS merger events remains unclear. We find a signature of
nucleosynthesis in NS mergers from peculiar chemical abundances of stars
belonging to the Galactic globular cluster M15. This finding combined with the
recent nucleosynthesis results implies a potential diversity of nucleosynthesis
in NS mergers. Based on these considerations, we are successful in the
interpretation of an observed correlation between [light r-process/Eu] and
[Eu/Fe] among Galactic halo stars and accordingly narrow down the role of
supernova nucleosynthesis in the r-process production site. We conclude that
the tight correlation by a large fraction of halo stars is attributable to the
fact that core-collapse supernovae produce light r-process elements while heavy
r-process elements such as Eu and Ba are produced by NS mergers. On the other
hand, stars in the outlier, composed of r-enhanced stars ([Eu/Fe]>+1) such as
CS22892-052, were exclusively enriched by matter ejected by a subclass of NS
mergers that is inclined to be massive and consist of both light and heavy
r-process nuclides.
","[{""version"":""v1"",""created"":""Tue, 7 Oct 2014 20:10:04 GMT""}]","2015-06-23"
"1410.1892","Andrea Ferroglia","Thomas Becher, Alessandro Broggio and Andrea Ferroglia","Introduction to Soft-Collinear Effective Theory","172 pages, 28 figures, 1 table. v3: corrected typos found by readers
  over the years",,"10.1007/978-3-319-14848-9","PSI-PR-14-12","hep-ph","http://arxiv.org/licenses/nonexclusive-distrib/1.0/","  These lectures provide an introduction to Soft-Collinear Effective Theory.
After discussing the expansion of Feynman diagrams around the high-energy
limit, the effective Lagrangian is constructed, first for a scalar theory, then
for QCD. The underlying concepts are illustrated with the Sudakov form factor,
i.e. the quark vector form factor at large momentum transfer. We then apply the
formalism in two examples: We perform soft gluon resummation as well as
transverse-momentum resummation for the Drell-Yan process using renormalization
group evolution in SCET, and we derive the infrared structure of n-point gauge
theory amplitudes by relating them to effective theory operators. We conclude
with an overview of the different applications of the effective theory.
","[{""version"":""v1"",""created"":""Tue, 7 Oct 2014 20:10:43 GMT""},{""version"":""v2"",""created"":""Mon, 27 Apr 2015 22:35:12 GMT""},{""version"":""v3"",""created"":""Thu, 20 Aug 2020 15:53:06 GMT""}]","2020-08-21"
"1410.1893","Jungyeon Cho","Jungyeon Cho","Origin of Magnetic Field in the Intracluster Medium: Primordial or
  Astrophysical?","11 pages, 10 figures, Accepted for publication in the ApJ",,"10.1088/0004-637X/797/2/133",,"astro-ph.CO astro-ph.HE","http://arxiv.org/licenses/nonexclusive-distrib/1.0/","  The origin of magnetic fields in clusters of galaxies is still an unsolved
problem, which is largely due to our poor understanding of initial seed
magnetic fields. If the seed magnetic fields have primordial origins, it is
likely that large-scale pervasive magnetic fields were present before the
formation of the large-scale structure. On the other hand, if they were ejected
from astrophysical bodies, they were highly localized in space at the time of
injection. In this paper, using turbulence dynamo models for high magnetic
Prandtl number fluids, we find constraints on the seed magnetic fields. The
hydrodynamic Reynolds number based on the Spitzer viscosity in the intracluster
medium (ICM) is believed to be less than $O(10^2)$, while the magnetic Reynolds
number can be much larger than that. In this case, if the seed magnetic fields
have primordial origins, they should be stronger than $O(10^{-11})$G, which is
very close to the upper limit of $O(10^{-9})$G set by the cosmic microwave
background (CMB) observations. On the other hand, if the seed magnetic fields
were ejected from astrophysical bodies, any seed magnetic fields stronger than
$O(10^{-9})$G can safely magnetize the intracluster medium. Therefore, it is
less likely that primordial magnetic fields are the direct origin of
present-day magnetic fields in the ICM.
","[{""version"":""v1"",""created"":""Tue, 7 Oct 2014 20:14:35 GMT""}]","2015-06-23"
"1410.1894","Carlos Molina Mendes","M. C. Baldiotti, Walace S. Elias, C. Molina, Thiago S. Pereira","Thermodynamics of quantum photon spheres","Published version","Phys. Rev. D 90, 104025 (2014)","10.1103/PhysRevD.90.104025",,"gr-qc astro-ph.HE hep-th quant-ph","http://arxiv.org/licenses/nonexclusive-distrib/1.0/","  Photon spheres, surfaces where massless particles are confined in closed
orbits, are expected to be common astrophysical structures surrounding
ultracompact objects. In this paper a semiclassical treatment of a photon
sphere is proposed. We consider the quantum Maxwell field and derive its energy
spectra. A thermodynamic approach for the quantum photon sphere is developed
and explored. Within this treatment, an expression for the spectral energy
density of the emitted radiation is presented. Our results suggest that photon
spheres, when thermalized with their environment, have nonusual thermodynamic
properties, which could lead to distinct observational signatures.
","[{""version"":""v1"",""created"":""Tue, 7 Oct 2014 20:15:50 GMT""},{""version"":""v2"",""created"":""Fri, 21 Nov 2014 17:51:48 GMT""}]","2014-11-24"
"1410.1896","Douglas Dommermuth Dr.","Laura K. Brandt and James W. Rottman and Kyle A. Brucker and Douglas
  G.Dommermuth","Numerical Simulation of Internal Tide Generation at a Continental Shelf
  Break","9 pages, 29th Symposium on Naval Hydrodynamics, Gothenburg, Sweden,
  26-31 August 2012. arXiv admin note: text overlap with arXiv:1410.1866",,,,"physics.flu-dyn","http://arxiv.org/licenses/nonexclusive-distrib/1.0/","  A fully nonlinear, three-dimensional numerical model is developed for the
simulation of tidal flow over arbitrary bottom topography in an ocean with
realistic stratification. The model is capable of simulating accurately the
generation of fine-scale internal wave tidal beams, their interaction with an
ocean thermocline and the subsequent generation of solitary internal waves that
propagate on this thermocline. Several preliminary simulation results are shown
for uniform and non-uniform flow over an idealized two-dimensional ridge, which
are compared with linear theory, and for flow over an idealized two-dimensional
continental shelf.
","[{""version"":""v1"",""created"":""Tue, 7 Oct 2014 20:24:59 GMT""}]","2014-10-09"
"1410.1897","Damien West","L. Seixas, D. West, A. Fazzio, and S.B. Zhang","Splitting of the topologically-protected Dirac cone without breaking
  time reversal symmetry",,,,,"cond-mat.mtrl-sci cond-mat.mes-hall","http://arxiv.org/licenses/nonexclusive-distrib/1.0/","  Topological insulators (TIs) are a new class of matter characterized by the
unique electronic properties of an insulating bulk and metallic boundaries
arising from non-trivial bulk band topology. While the surfaces of TIs have
been well studied, the interface between TIs and semiconductors may not only be
more technologically relevant but the interaction with non-topological states
may fundamentally alter the physics. Here, we present a general model to show
that such an interaction can lead to spin-momentum locked non-topological
states, the Dirac cone can split in two, and the particle-hole symmetry can be
fundamentally broken, along with their possible ramifications. Unlike magnetic
doping or alloying, these phenomena occur without topological transitions or
the breaking of time reversal symmetry. The model results are corroborated by
first-principles calculations of the technologically relevant Bi$_2$Se$_3$ film
van der Waals bound to a Se-treated GaAs substrate.
","[{""version"":""v1"",""created"":""Tue, 7 Oct 2014 20:25:05 GMT""}]","2014-10-09"
"1410.1898","Yao Tian","Yao Tian, Huiwen Ji, R. J. Cava L. D. Alegria, J. R. Petta and Kenneth
  S. Burch","Polarized Temperature Dependent Raman Study of Bi2Te3-Cr2Ge2Te6
  heterostructure and the Ferromagnetic Insulator Cr2Ge2Te6","4 pages, 5 figures",,,,"cond-mat.mtrl-sci","http://arxiv.org/licenses/nonexclusive-distrib/1.0/","  Cr2Ge2Te6 has been of interest for decades, as it is one of only a few
ferromagnetic insulators. Recently, this material has been revisited due to its
potential as a substrate for Bi2Te3, a topological insulator. This enables the
possibility of studying the anomalous quantum Hall effect in topological
insulators, and a route to novel spintronic devices. To probe the compatibility
of these two materials, we use polarized variable temperature Raman microscopy
to study Bi2Te3-Cr2Ge2Te6 heterostructure as well as the phonon dynamics of
Cr2Ge2Te6. We found the temperature dependence of the Cr2Ge2Te6 phonons results
primarily from anharmonicity, though a small magneto-elastic coupling is also
observed. Our results confirm the potential of Cr2Ge2Te6 as a substrate for
topological insulators.
","[{""version"":""v1"",""created"":""Tue, 7 Oct 2014 20:29:13 GMT""}]","2014-10-09"
"1410.1899","Fritz  Kretzschmar","Herbert Egger and Fritz Kretzschmar and Sascha M. Schnepp and Igor
  Tsukerman and Thomas Weiland","Transparent boundary conditions in a Discontinuous Galerkin Trefftz
  method","Revised Version",,,,"math.NA","http://arxiv.org/licenses/nonexclusive-distrib/1.0/","  The modeling and simulation of electromagnetic wave propagation is often
accompanied by a restriction to bounded domains which requires the introduction
of artificial boundaries. The corresponding boundary conditions should be
chosen in order to minimize parasitic reflections. In this paper, we
investigate a new type of transparent boundary condition for a discontinuous
Galerkin Trefftz finite element method. The choice of a particular basis
consisting of polynomial plane waves allows us to split the electromagnetic
field into components with a well specified direction of propagation. The
reflections at the artificial boundaries are then reduced by penalizing
components of the field incoming into the space-time domain of interest. We
formally introduce this concept, discuss its realization within the
discontinuous Galerkin framework, and demonstrate the performance of the
resulting approximations by numerical tests. A comparison with first order
absorbing boundary conditions, that are frequently used in practice, is made.
For a proper choice of basis functions, we observe spectral convergence in our
numerical test and an overall dissipative behavior for which we also give some
theoretical explanation.
","[{""version"":""v1"",""created"":""Tue, 7 Oct 2014 20:29:19 GMT""},{""version"":""v2"",""created"":""Mon, 18 May 2015 14:25:12 GMT""}]","2015-05-19"
"1410.1901","Lu Liu","Lu Liu, Xianghui Cao, Yu Cheng and Li Wang","On Optimizing Energy Efficiency in Multi-Radio Multi-Channel Wireless
  Networks","6 pages, 5 figures, Accepted to Globecom 2014",,,,"cs.NI","http://arxiv.org/licenses/nonexclusive-distrib/1.0/","  Multi-radio multi-channel (MR-MC) networks contribute significant enhancement
in the network throughput by exploiting multiple radio interfaces and
non-overlapping channels. While throughput optimization is one of the main
targets in allocating resource in MR-MC networks, recently, the network energy
efficiency is becoming a more and more important concern. Although turning on
more radios and exploiting more channels for communication is always beneficial
to network capacity, they may not be necessarily desirable from an energy
efficiency perspective. The relationship between these two often conflicting
objectives has not been well-studied in many existing works. In this paper, we
investigate the problem of optimizing energy efficiency under full capacity
operation in MR-MC networks and analyze the optimal choices of numbers of
radios and channels. We provide detailed problem formulation and solution
procedures. In particular, for homogeneous commodity networks, we derive a
theoretical upper bound of the optimal energy efficiency and analyze the
conditions under which such optimality can be achieved. Numerical results
demonstrate that the achieved optimal energy efficiency is close to the
theoretical upper bound.
","[{""version"":""v1"",""created"":""Tue, 7 Oct 2014 20:33:33 GMT""}]","2014-10-09"
"1410.1902","Yejin Huh","Yejin Huh and Philipp Strack","Stress tensor and current correlators of interacting conformal field
  theories in 2+1 dimensions: Fermionic Dirac matter coupled to U(1) gauge
  field","19 pages, 6 figures, 2 tables, 55 references. V3 corrects sign error,
  our evaluations of the C_T graphs now match http://arxiv.org/abs/1602.01076","JHEP 01 (2015) 147","10.1007/JHEP01(2015)147",,"cond-mat.str-el cond-mat.quant-gas hep-th","http://arxiv.org/licenses/nonexclusive-distrib/1.0/","  We compute the central charge $C_T$ and universal conductivity $C_J$ of $N_F$
fermions coupled to a $U(1)$ gauge field up to next-to-leading order in the
$1/N_F$ expansion. We discuss implications of these precision computations as a
diagnostic for response and entanglement properties of interacting conformal
field theories for strongly correlated condensed matter phases and conformal
quantum electrodynamics in $2+1$ dimensions.
","[{""version"":""v1"",""created"":""Tue, 7 Oct 2014 20:33:34 GMT""},{""version"":""v2"",""created"":""Mon, 12 Jan 2015 17:02:45 GMT""},{""version"":""v3"",""created"":""Thu, 18 Feb 2016 13:25:06 GMT""}]","2016-02-19"
"1410.1903","Luis Vaquero","Luis M. Vaquero, Felix Cuadrado, Matei Ripeanu","Systems for Near Real-Time Analysis of Large-Scale Dynamic Graphs",,,,,"cs.DC","http://creativecommons.org/licenses/by/3.0/","  Graphs are widespread data structures used to model a wide variety of
problems. The sheer amount of data to be processed has prompted the creation of
a myriad of systems that help us cope with massive scale graphs. The pressure
to deliver fast responses to queries on the graph is higher than ever before,
as it is demanded by many applications (e.g. online recommendations, auctions,
terrorism protection, etc.). In addition, graphs change continuously (so do the
real world entities that typically represent). Systems must be ready for both:
near real-time and dynamic massive graphs. We survey systems taking their
scalability, real-time potential and capability to support dynamic changes to
the graph as driving guidelines. The main techniques and limitations are
distilled and categorised. The algorithms run on top of graph systems are not
ready for prime time dynamism either. Therefore,a short overview on dynamic
graph algorithms has also been included.
","[{""version"":""v1"",""created"":""Tue, 7 Oct 2014 20:37:49 GMT""}]","2014-10-09"
"1410.1904","Igor Savukov Dr.","I. M. Savukov and D. V. Filin","CI-RMBPT calculations of photoionization cross sections from
  quasi-continuum oscillator strengths","4 pages, 4 figures",,,,"physics.atom-ph","http://arxiv.org/licenses/nonexclusive-distrib/1.0/","  Many applications are in need of accurate photoionization cross-sections,
especially in the case of complex atoms. Configuration-interaction relativistic
many-body perturbation theory (CI-RMBPT) that has been successful in predicting
atomic energies, matrix elements between discrete states, and other properties
is quite promising, but it has not been applied to photo-ionization problems
owing to extra complications arising from continuum states. In this paper a
method that will allow the conversion of discrete CI-(R)MPBT oscillator
strengths (OS) to photo-ionization cross sections with minimal modifications of
the codes is introduced and CI-RMBPT cross sections of Ne, Ar, Kr, Xe are
calculated. A consistent agreement with experiment is found. RMBPT corrections
are particularly significant for Ar, Kr, and Xe and improve agreement with
experiment compared to the particle-hole CI method. The demonstrated conversion
method can be applied to CI-RMBPT photo-ionization calculations for a large
number of multi-valence atoms and ions.
","[{""version"":""v1"",""created"":""Tue, 7 Oct 2014 20:44:24 GMT""}]","2014-10-09"
"1410.1905","Wentao Huang","Wentao Huang, Tracey Ho, Michael Langberg, Joerg Kliewer","Single-Source/Sink Network Error Correction Is as Hard as
  Multiple-Unicast",,,,,"cs.IT math.IT","http://arxiv.org/licenses/nonexclusive-distrib/1.0/","  We study the problem of communicating over a single-source single-terminal
network in the presence of an adversary that may jam a single link of the
network. If any one of the edges can be jammed, the capacity of such networks
is well understood and follows directly from the connection between the minimum
cut and maximum flow in single-source single- terminal networks. In this work
we consider networks in which some edges cannot be jammed, and show that
determining the network communication capacity is at least as hard as solving
the multiple-unicast network coding problem for the error-free case. The latter
problem is a long standing open problem.
","[{""version"":""v1"",""created"":""Tue, 7 Oct 2014 20:47:42 GMT""}]","2014-10-09"
"1410.1906","Patrick Lopatto","Patrick Lopatto, Richard Rochberg","Schatten-class Truncated Toeplitz Operators",,,,,"math.CV math.FA","http://arxiv.org/licenses/nonexclusive-distrib/1.0/","  We investigate truncated Toeplitz operators belonging to the Schatten ideals.
We completely characterize such operators when they have an analytic symbol or
belong to the ideal of Hilbert-Schmidt operators. We also study model spaces
generated by Blaschke products associated with thin sequences, model spaces
generated by certain types of singular inner functions, and operators
associated with a class of very smooth symbols.
","[{""version"":""v1"",""created"":""Tue, 7 Oct 2014 20:49:35 GMT""}]","2014-10-09"
"1410.1908","Katherine Christianson","Katherine Christianson, Justin Goluboff, Linus Hamann, and Srikar
  Varadaraj","Non-left-orderable surgeries on twisted torus knots","14 pages, 10 figures; added a reference and corrected a typo",,,,"math.GT math.GR","http://arxiv.org/licenses/nonexclusive-distrib/1.0/","  Boyer, Gordon, and Watson have conjectured that an irreducible rational
homology 3-sphere is an L-space if and only if its fundamental group is not
left-orderable. Since large classes of L-spaces can be produced from Dehn
surgery on knots in the 3-sphere, it is natural to ask what conditions on the
knot group are sufficient to imply that the quotient associated to Dehn surgery
is not left-orderable. Clay and Watson develop a criterion for determining the
left-orderability of this quotient group and use it to verify the conjecture
for surgeries on certain L-space twisted torus knots. We generalize a recent
theorem of Ichihara and Temma to provide another such criterion. We then use
this new criterion to generalize the results of Clay and Watson and to verify
the conjecture for a much broader class of L-space twisted torus knots.
","[{""version"":""v1"",""created"":""Tue, 7 Oct 2014 20:56:24 GMT""},{""version"":""v2"",""created"":""Sun, 19 Oct 2014 02:05:21 GMT""}]","2014-10-21"
